dialogue_id,speaker,turn,act_1,act_2,act_3
117_00063,SYSTEM,Have a great day!,GOODBYE,,
117_00064,USER,"Can you help me find a rental car for pickup in Portland, OR at evening 6?",INFORM,,INFORM_INTENT
117_00064,SYSTEM,"Sure, what is your pickup and drop off dates?",REQUEST,,
117_00064,USER,I'll pickup next Friday and drop off on the 9th.,INFORM,,
117_00064,SYSTEM,There's a standard Accord available at PDX International Airport on March 8th.,OFFER,,
117_00064,USER,What other standard cars are there?,INFORM,REQUEST_ALTS,
117_00064,SYSTEM,I found 5 you may like. There's a standard Camry available at Portland Bus Station on March 8th.,OFFER,,
117_00064,USER,That one works.,SELECT,,
117_00064,SYSTEM,Should I reserve it for you?,OFFER_INTENT,,
117_00064,USER,"No, I want to check on buses going there?",INFORM_INTENT,,
117_00064,SYSTEM,What date are you leaving?,REQUEST,,
117_00064,USER,I'm leaving Saturday this week and I'll need 1 flexible ticket.,INFORM,,
117_00064,SYSTEM,"Sure, where are you leaving from?",REQUEST,,
117_00064,USER,"From Vancouver, BC.",INFORM,,
117_00064,SYSTEM,I found 8 buses that fit that criteria. There's a flexible ticket for $63 on the 9:20 am bus.,OFFER,,
117_00064,USER,What else is there? Check on the 3rd.,INFORM,REQUEST_ALTS,
117_00064,SYSTEM,I found 7 buses that match that search. There's a flexible ticket for $62 on the bus leaving at 9:30 am.,OFFER,,
117_00064,USER,Let's check flights there. I want to leave March 1st and return March 13th.,SELECT,,
117_00064,SYSTEM,I found 1 flight that may work. It's a $238 United Airlines flight with an outbound departure time of 6:05 pm and a return departure time of 10:35 am.,OFFER,,
117_00064,USER,Sounds great to me.,SELECT,,
117_00064,SYSTEM,Should I get you tickets?,OFFER_INTENT,,
117_00064,USER,"No, not yet.",NEGATE_INTENT,,
117_00064,SYSTEM,Anything else you need at the moment?,REQ_MORE,,
117_00064,USER,"Nope, that should do it.",NEGATE,THANK_YOU,
117_00064,SYSTEM,Enjoy your day.,GOODBYE,,
117_00065,USER,Please find me a rental car.,INFORM_INTENT,,
117_00065,SYSTEM,When do you need it?,REQUEST,,
117_00065,USER,On March 11th.,INFORM,,
117_00065,SYSTEM,Until what date and what time you need it? Where do you want to pick it up?,REQUEST,,
117_00065,USER,Until the 13th at around 7:30 in the evening and I want to pick it up on Philadelphia.,INFORM,,
117_00065,SYSTEM,I got 4 cars and one is available at Intercity Terminal on March 11th. It is a Standard car and it's a Altima.,OFFER,,
117_00065,USER,That's great.,SELECT,,
117_00065,SYSTEM,Will I reserve you this car?,OFFER_INTENT,,
117_00065,USER,Not now.,NEGATE_INTENT,,
117_00065,SYSTEM,Anything else I can help you with?,REQ_MORE,,
117_00065,USER,Please help me find a bus going there on March 10th.,INFORM,INFORM_INTENT,
117_00065,SYSTEM,Where you coming from?,REQUEST,,
117_00065,USER,From Washington.,INFORM,,
117_00065,SYSTEM,I got 8 buses and the one will leave at 7:10 am for only $28 and it is a economy ticket.,OFFER,,
117_00065,USER,"Yes, I prefer economy but is there any other option? We are four people in the group.",INFORM,,REQUEST_ALTS
117_00065,SYSTEM,I got 7 buses and one is leaving at 7:50 am for only $26 and it's also an Economy ticket.,OFFER,,
117_00065,USER,Any other else?,REQUEST_ALTS,,
117_00065,SYSTEM,What about a bus leaving at 8:40 am for only $25. It's also an Economy ticket.,OFFER,,
117_00065,USER,That's perfect. Please help me find a round trip flight going there on 4th of this Month with American Airlines.,SELECT,,
117_00065,SYSTEM,Are you planning to come back on March 13th?,REQUEST,,
117_00065,USER,"No, on the 14th.",INFORM,,
117_00065,SYSTEM,I got 1 flight for you with American Airlines for only $151. Outbound flight leaves at 5:10 pm and returns at 9:45 am.,OFFER,,
117_00065,USER,That's good. Thanks,SELECT,GOODBYE,
117_00065,SYSTEM,you are welcome.,GOODBYE,,
117_00066,USER,"I would like to book a rental car, my car is in the shop.",INFORM_INTENT,,
117_00066,SYSTEM,I'm sorry to hear that. Let's get you setup with a rental. Do you know how long you will require the rental car?,REQUEST,,
117_00066,USER,I will need a rental until March 4th. I am going to need to pick up in San Francisco if possible.,INFORM,,
117_00066,SYSTEM,What day and time would you like to pick this rental up?,REQUEST,,
117_00066,USER,See if I can pick up half past 6 in the evening on the 2nd of this month.,INFORM,,
117_00066,SYSTEM,"Let me work my magic, one moment. There is a Standard car available for pickup on March 2nd. This Altima will be located at SFO International Airport.",OFFER,,
117_00066,USER,What would the cost be?,REQUEST,,
117_00066,SYSTEM,I show the cost will be $74 total.,INFORM,,
117_00066,USER,See if you can find a Full-size car please.,INFORM,REQUEST_ALTS,
117_00066,SYSTEM,"Sure, Pickup is also at SFO International Airport and available on March 2nd. This is an Escape, which is a Full-size car as you requested.",OFFER,,
117_00066,USER,That will work fine.,SELECT,,
117_00066,SYSTEM,"Great, shall we proceed and reserve this car?",OFFER_INTENT,,
117_00066,USER,No don't reserve it. I want to check on bus tickets also. Search for 3 Economy tickets leaving later today to the same location.,INFORM,,
117_00066,SYSTEM,Where should I search for departure from?,REQUEST,,
117_00066,USER,Vegas preferred.,INFORM,,
117_00066,SYSTEM,"Ok, there is 6 buses available. May I suggest the one departing at 10:50 am for $55. This is an Economy ticket.",OFFER,,
117_00066,USER,"Ok, I need you to search for a round trip ticket for a flight going there.",SELECT,,
117_00066,SYSTEM,"Will departure be March 1st, March 2nd or a different day?",REQUEST,,
117_00066,USER,Leave on later today please.,INFORM,,
117_00066,SYSTEM,Will your return still be March 4th?,REQUEST,,
117_00066,USER,"No, bring me back on the 9th of March.",INFORM,,
117_00066,SYSTEM,"Ok, there is 4 flights. Starting with American Airlines departing at 5:30 am and returning at 5:30 pm, this ticket will cost $101.",OFFER,,
117_00066,USER,That will be all. thanks,SELECT,GOODBYE,
117_00066,SYSTEM,your welcome. have a great day.,GOODBYE,,
117_00067,USER,I have to book a rental car until the 7th of March. I'd like to pick it up in Philadelphia at 1 in the afternoon.,INFORM,,
117_00067,SYSTEM,On what date?,REQUEST,,
117_00067,USER,On March 4th and I'd like an intermediate vehicle.,INFORM,,
117_00067,SYSTEM,I have 8 possible vehicles for you. There's a standard Civic which can be picked up from PHL International Airport on March 4th.,OFFER,,
117_00067,USER,What's the price?,REQUEST,,
117_00067,SYSTEM,That would come to $96 total.,INFORM,,
117_00067,USER,What else do you have?,REQUEST_ALTS,,
117_00067,SYSTEM,I have a standard Cruze on March 4th which is also available at PHL International Airport.,OFFER,,
117_00067,USER,Do you have anything compact available at half past 4 in the evening?,INFORM,,REQUEST_ALTS
117_00067,SYSTEM,"Yes, I have a compact Cooper which can be picked up March 4th from Intercity Terminal.",OFFER,,
117_00067,USER,I like that one.,SELECT,,
117_00067,SYSTEM,Would you like to reserve it?,OFFER_INTENT,,
117_00067,USER,I'm going to wait just a bit. Would you mind helping me with a bus?,INFORM_INTENT,,
117_00067,SYSTEM,Leaving from where?,REQUEST,,
117_00067,USER,New York City.,INFORM,,
117_00067,SYSTEM,What date were you looking at?,REQUEST,,
117_00067,USER,On this Sunday.,INFORM,,
117_00067,SYSTEM,I've found 7 buses. There's one with a 7:40 AM departure for $24 economy.,OFFER,,
117_00067,USER,What are the bus stations involved?,REQUEST,,
117_00067,SYSTEM,It travels from Port Authority Station to Intercity Terminal.,INFORM,,
117_00067,USER,What else is there?,REQUEST_ALTS,,
117_00067,SYSTEM,There's another bus that leaves at 8 AM for a $19 economy fare.,OFFER,,
117_00067,USER,"Okay, great. I'm also looking for a roundtrip flight.",SELECT,,
117_00067,SYSTEM,Are you planning on a March 7th return?,REQUEST,,
117_00067,USER,"No, March 13th, but I'm not sure about my plans so I need a refundable flight.",INFORM,,
117_00067,SYSTEM,Leaving March 4th?,REQUEST,,
117_00067,USER,Leaving this Sunday.,INFORM,,
117_00067,SYSTEM,I've found 2 possible flights for you. Delta Airlines has a 3:30 PM flight for $57 which returns at 7:25 PM.,OFFER,,
117_00067,USER,What's the arrival time of the onward flight?,REQUEST,,
117_00067,SYSTEM,It's 4:21 PM.,INFORM,,
117_00067,USER,That should do it.,SELECT,,
117_00067,SYSTEM,Do you care to make reservations?,OFFER_INTENT,,
117_00067,USER,Not right now.,NEGATE_INTENT,GOODBYE,
117_00067,SYSTEM,Thank you very much.,GOODBYE,,
117_00068,USER,Can you get me a good rental car?,INFORM_INTENT,,
117_00068,SYSTEM,"Sure, where will you pick it up? What time of day will you need it? Do you have a day in mind?",REQUEST,,
117_00068,USER,How about Next Wednesday at eleven in the morning? I need it at Portland.,INFORM,,
117_00068,SYSTEM,When will you return the car?,REQUEST,,
117_00068,USER,I can bring it back saturday this week.,INFORM,,
117_00068,SYSTEM,"There's a great accord, standard available on march 2nd from PDX International Airport.",OFFER,,
117_00068,USER,"Fine, get me a bus to get there. I need three seats, leaving from Vancouver on the 1st.",INFORM,,
117_00068,SYSTEM,"There are 8 to choose from. You can leave at 9:20 am, getting economy for $42.",OFFER,,
117_00068,USER,"What about economy extra tickets? Can you get another choice, maybe later?",INFORM,REQUEST_ALTS,
117_00068,SYSTEM,Sure there are 7 others. You can take Economy extra at 9:30 am for $46.,OFFER,,
117_00068,USER,What bus station will I depart?,REQUEST,,
117_00068,SYSTEM,Pacific Central Station.,INFORM,,
117_00068,USER,"That's a good one, I love that design there.",SELECT,,
117_00068,SYSTEM,How about I get you some tickets?,OFFER_INTENT,,
117_00068,USER,Not now. How about a round trip flight to get there? I want to return on the 14th of this month.,NEGATE_INTENT,,
117_00068,SYSTEM,Will you be leaving on March 1st? Did you have March 2nd or an even later date?,REQUEST,,
117_00068,USER,Leaving on the 1st.,INFORM,,
117_00068,SYSTEM,"There is 1 option. It's United Airlines, taking off at 6:05 pm. You'll board at 10:35 am to return. Your cost will be $245.",OFFER,,
117_00068,USER,If I have trouble can I get my money back?,REQUEST,,
117_00068,SYSTEM,"No, you may not.",INFORM,,
117_00068,USER,Where will I land on the flight? When will I get back?,REQUEST,,
117_00068,SYSTEM,You're going to PDX International Airport and you'll get there at 11:53 pm.,INFORM,,
117_00068,USER,Fine that's all the info I need.,SELECT,GOODBYE,
117_00068,SYSTEM,enjoy your trip.,GOODBYE,,
117_00069,USER,I want to find a rental car in SD on March 8th,INFORM,,INFORM_INTENT
117_00069,SYSTEM,How long do you need it?,REQUEST,,
117_00069,USER,I need it till March 13th,INFORM,,
117_00069,SYSTEM,What time do you need it?,REQUEST,,
117_00069,USER,I need it around 10:00 am and want it in Philadelphia,INFORM,,
117_00069,SYSTEM,"Cool, how about this nice standard Altima that's available on March 8th from 30th Street Station?",OFFER,,
117_00069,USER,How much will that cost me?,REQUEST,,
117_00069,SYSTEM,It'll be $130,INFORM,,
117_00069,USER,What about something more spacious?,INFORM,REQUEST_ALTS,
117_00069,SYSTEM,There's a full-size Equinox on March 8th also from 30th Street Station,OFFER,,
117_00069,USER,"What else can I pick up at 2 o""clock in the afternoon?",INFORM,REQUEST_ALTS,
117_00069,SYSTEM,There's a full-size cherokee available from PHL International Airport on March 8th,OFFER,,
117_00069,USER,That sounds great,SELECT,,
117_00069,SYSTEM,Do you want to book it?,OFFER_INTENT,,
117_00069,USER,No not yet,NEGATE_INTENT,,
117_00069,SYSTEM,Then what else can I do?,REQ_MORE,,
117_00069,USER,Find me a bus from Washington to there leaving on March 6th,INFORM,,INFORM_INTENT
117_00069,SYSTEM,I found 8 for you. How about a $23 economy ticket leaving at 7:10 am,OFFER,,
117_00069,USER,"That sounds great, can you find me a premium economy round trip ticket for one?",SELECT,,
117_00069,SYSTEM,When are you leaving and coming back? Is March 6th or March 8th good for departure? How about March 13th for your return?,REQUEST,,
117_00069,USER,I'll be back on March 14th and leaving on the 5th,INFORM,,
117_00069,SYSTEM,"Got it, so an American Airlines flight for $244 with a 5:10 pm departure and a 9:45 am return flight?",OFFER,,
117_00069,USER,Is it refundable? And where does it leave from?,REQUEST,,
117_00069,SYSTEM,"No it's not refundable, and it departs from Dulles international Airport",INFORM,,
117_00069,USER,"Got it, thanks",SELECT,,
117_00069,SYSTEM,Should I book you,OFFER_INTENT,,
117_00069,USER,"No not right now, that's it for now",NEGATE_INTENT,GOODBYE,
117_00069,SYSTEM,"Great, just let me know",GOODBYE,,
117_00070,USER,"Hello, could you search for a rental car in Vancouver for use from March 8th till 10th of this month?",INFORM,,
117_00070,SYSTEM,Do you have a preferred pick up time?,REQUEST,,
117_00070,USER,I guess sometime at five in the evening is fine for me.,INFORM,,
117_00070,SYSTEM,"Sure, there is a nice Standard Accord for pickup at YVR International Airport on March 8th.",OFFER,,
117_00070,USER,That sounds great with me!,SELECT,,
117_00070,SYSTEM,Would you like me to make a car reservation for you?,OFFER_INTENT,,
117_00070,USER,"No thanks, I was just checking.",NEGATE_INTENT,,
117_00070,SYSTEM,Do you require further assistance?,REQ_MORE,,
117_00070,USER,"Sure, could you help me find a bus departing on the 4th of this month please?",INFORM,INFORM_INTENT,
117_00070,SYSTEM,And where will you be departing from?,REQUEST,,
117_00070,USER,"I would likely depart from Portland, OR.",INFORM,,
117_00070,SYSTEM,"I see, would you like an Economy bus ride departing at 6:50 am which will cost you $45?",OFFER,,
117_00070,USER,"Sure, do you know which station am I departing from?",REQUEST,,
117_00070,SYSTEM,You will depart from the Portland Bus Station.,INFORM,,
117_00070,USER,And which station will I arrive at?,REQUEST,,
117_00070,SYSTEM,You will be arriving at Pacific Central Station.,INFORM,,
117_00070,USER,"I see, do you have any alternative buses?",REQUEST_ALTS,,
117_00070,SYSTEM,There is also an Economy bus ride departing at 8:10 am which will cost you $42.,OFFER,,
117_00070,USER,"No thanks, are there any alternative buses for 4 passengers?",INFORM,REQUEST_ALTS,
117_00070,SYSTEM,Would you like an Economy bus ride departing at 10:20 am and cost $43? This is one of the 6 buses which are available.,OFFER,,
117_00070,USER,That sounds great!,SELECT,,
117_00070,SYSTEM,"Sure, do you need me to make a reservation for you?",OFFER_INTENT,,
117_00070,USER,No thank you.,NEGATE_INTENT,,
117_00070,SYSTEM,Do you require further assistance?,REQ_MORE,,
117_00070,USER,Could you help me find a round trip flight there too?,INFORM_INTENT,,
117_00070,SYSTEM,"Sure, will you be departing from the March 8th?",REQUEST,,
117_00070,USER,For this I will depart on 4th of this month instead.,INFORM,,
117_00070,SYSTEM,And will you be returning on the March 10th?,REQUEST,,
117_00070,USER,Most probably on the 14th of March instead.,INFORM,,
117_00070,SYSTEM,Would you like a United Airlines flight departing at 10:35 am and returning on 6:05 pm which will cost you $265?,OFFER,,
117_00070,USER,"Sure, do you know which airport does the flight depart from and when does the departing flight arrive?",REQUEST,,
117_00070,SYSTEM,"You will be departing from PDX International Airport, in which the departing flight will arrive at 8:12 pm.",INFORM,,
117_00070,USER,"I see, this is perfect for me.",SELECT,,
117_00070,SYSTEM,Would you like me to reserve the plane tickets for you?,OFFER_INTENT,,
117_00070,USER,"No, that is not necessary.",NEGATE_INTENT,,
117_00070,SYSTEM,"Sure, do you need any other help?",REQ_MORE,,
117_00070,USER,"No, that is all I need. Thank you though.",NEGATE,THANK_YOU,
117_00070,SYSTEM,"No worries, have a great day ahead!",GOODBYE,,
117_00071,USER,"I need to find a rental car from Seattle, WA that I can get around the evening 4:30 pm",INFORM,,INFORM_INTENT
117_00071,SYSTEM,Till when do you need the car?,REQUEST,,
117_00071,USER,I just need it till the 11th of this month,INFORM,,
117_00071,SYSTEM,When do you want it from?,REQUEST,,
117_00071,USER,I need it from March 8th onwards,INFORM,,
117_00071,SYSTEM,I have 5 cars including a Standard Civic for pickup on March 8th at Seattle-Tacoma International Airport,OFFER,,
117_00071,USER,That sounds great.,SELECT,,
117_00071,SYSTEM,Do you want us to book it?,OFFER_INTENT,,
117_00071,USER,"No, not right now.",NEGATE_INTENT,,
117_00071,SYSTEM,Can I find you anything else?,REQ_MORE,,
117_00071,USER,How about a bus headed there on the 7th?,INFORM,INFORM_INTENT,
117_00071,SYSTEM,Where are you coming from,REQUEST,,
117_00071,USER,I'll be leaving from Vancouver,INFORM,,
117_00071,SYSTEM,There's an economy bus for $26 that leaves at 6:40 am,OFFER,,
117_00071,USER,What else is there?,REQUEST_ALTS,,
117_00071,SYSTEM,How about a $25 economy bus that leaves at 8:10 am,OFFER,,
117_00071,USER,Where does the bus reach?,REQUEST,,
117_00071,SYSTEM,It reaches King Street Station,INFORM,,
117_00071,USER,Are there any other buses left?,REQUEST_ALTS,,
117_00071,SYSTEM,I found an economy bus that leaves at 8:30 am for $29,OFFER,,
117_00071,USER,That sounds great,SELECT,,
117_00071,SYSTEM,Do you want tickets then?,OFFER_INTENT,,
117_00071,USER,No not right now,NEGATE_INTENT,,
117_00071,SYSTEM,"OK, Can I do something else?",REQ_MORE,,
117_00071,USER,Find me a round trip flight that gets back on the 12th of this month if I leave on the 2nd,INFORM,,INFORM_INTENT
117_00071,SYSTEM,There's a Delta Airlines flight that leaves at 2:50 am and a 7:40 am return flight for $316,OFFER,,
117_00071,USER,That's good for me,SELECT,,
117_00071,SYSTEM,Should I get the tickets?,OFFER_INTENT,,
117_00071,USER,No not right now,NEGATE_INTENT,,
117_00071,SYSTEM,Can I do something else?,REQ_MORE,,
117_00071,USER,"No, that's all thanks",NEGATE,THANK_YOU,
117_00071,SYSTEM,Have a fun trip!,GOODBYE,,
117_00072,USER,There is a trip for me to some place. Do you help me find a rental car?,INFORM_INTENT,,
117_00072,SYSTEM,"Sure, when do you want it?",REQUEST,,
117_00072,USER,"I want it on the 8th. Till March 9th it will be used and intend to pick up from Vancouver, BC.",INFORM,,
117_00072,SYSTEM,What is the time?,REQUEST,,
117_00072,USER,I need it around 6 in the evening.,INFORM,,
117_00072,SYSTEM,7 cars are ready. You can choose the Accord which is a Standard car available on March 8th at YVR International Airport.,OFFER,,
117_00072,USER,"Good, that sounds better.",SELECT,,
117_00072,SYSTEM,Shall I fix it for you?,OFFER_INTENT,,
117_00072,USER,"No, not now.",NEGATE_INTENT,,
117_00072,SYSTEM,Any other help?,REQ_MORE,,
117_00072,USER,"Are there buses to that place from Portland, OR?",INFORM,INFORM_INTENT,
117_00072,SYSTEM,When do you plan to go?,REQUEST,,
117_00072,USER,On 6th of this month.,INFORM,,
117_00072,SYSTEM,"The bus to that place leaves at 6:50 am. Its ticket charge is $46, an Economy ticket.",OFFER,,
117_00072,USER,From which bus station am I leaving?,REQUEST,,
117_00072,SYSTEM,It is from Portland Bus Station.,INFORM,,
117_00072,USER,What is the name of destination station?S,REQUEST,,
117_00072,SYSTEM,Its Pacific Central Station.,INFORM,,
117_00072,USER,Shall I get bus from Seattle having Economy extra tickets?,INFORM,,REQUEST_ALTS
117_00072,SYSTEM,"Yeah, 9 buses are there. One is leaving at 6:40 am with Economy extra tiket which costs $36.",OFFER,,
117_00072,USER,Fine. Please search whether round trip flight are going there?,SELECT,,
117_00072,SYSTEM,"What is your departing date, March 6th, March 8th or any other date?",REQUEST,,
117_00072,USER,It will be on 4th of this month.,INFORM,,
117_00072,SYSTEM,Are you returning on March 9th?,REQUEST,,
117_00072,USER,"No, I will be back on 12th of this month.",INFORM,,
117_00072,SYSTEM,You can catch Delta Airlines leaving at 8:45 am. It will take you back at 3:20 am. You have to pay $275.,OFFER,,
117_00072,USER,"Yes, that one will be apt.",SELECT,GOODBYE,
117_00072,SYSTEM,Have a great day.,GOODBYE,,
117_00073,USER,I wish to search a car for rent.,INFORM_INTENT,,
117_00073,SYSTEM,What is your pick up place and when do you need it?,REQUEST,,
117_00073,USER,I wish to get pick up from NY on the 5th.,INFORM,,
117_00073,SYSTEM,Up to which date and time do you need car?,REQUEST,,
117_00073,USER,I want it up to the 6th and it has to pick up me around 1:45 in the afternoon.,INFORM,,
117_00073,SYSTEM,There is a nice Standard Accord Car available at Grand Central Station and it will pick up you on March 5th.,OFFER,,
117_00073,USER,Any other option available? I need a small car up tp 7th of this month.,INFORM,,REQUEST_ALTS
117_00073,SYSTEM,There is a nice Compact Bolt Car available at Port Authority Station and it will pick up you on March 5th.,OFFER,,
117_00073,USER,What is the total price?,REQUEST,,
117_00073,SYSTEM,Your booking cost is $42.,INFORM,,
117_00073,USER,Any other option available? I wish to pick up me from Washington around 6 in the evening.,INFORM,,REQUEST_ALTS
117_00073,SYSTEM,There is a nice Compact Fit Car available at Dulles International Airport and it will pick up you on March 5th.,OFFER,,
117_00073,USER,It is good. What about the bus there?,INFORM_INTENT,,
117_00073,SYSTEM,From which place will you move and when will you leave?,REQUEST,,
117_00073,USER,"On this Sunday, I am moving from NY. It is for 4 persons.",INFORM,,
117_00073,SYSTEM,I searched and found that 8 buses for you. What about a bus with Economy ticket moving at 6 am and the cost of the ticket is $36.,OFFER,,
117_00073,USER,It is good. Could you please search a round trip flight to go there?,SELECT,,
117_00073,SYSTEM,Will you get back on March 7th?,REQUEST,,
117_00073,USER,I will be back on 14th of this month.,INFORM,,
117_00073,SYSTEM,Will you leave on March 5th?,REQUEST,,
117_00073,USER,I will leave on Saturday this week.,INFORM,,
117_00073,SYSTEM,I searched and found 2 flights. An American Airlines flight moves at 10:55 am. The return flight moves at 6:05 am. The cost of the ticket is $91.,OFFER,,
117_00073,USER,What about some other flights?,REQUEST_ALTS,,
117_00073,SYSTEM,Southwest Airlines flight moves at 5:15 pm. The return flight moves at 4:50 pm. The cost of the ticket is $96.,OFFER,,
117_00073,USER,It is good for me.,SELECT,,
117_00073,SYSTEM,Shall I book the tickets?,OFFER_INTENT,,
117_00073,USER,"No, I am okay.",NEGATE_INTENT,,
117_00073,SYSTEM,Do you need any other help?,REQ_MORE,,
117_00073,USER,Nope. Thank you so much for your help.,NEGATE,THANK_YOU,
117_00073,SYSTEM,Have a fantastic day.,GOODBYE,,
117_00074,USER,I need an intermediate rental car.,INFORM,INFORM_INTENT,
117_00074,SYSTEM,How long will you need it? When do you want it? What time do you want it?,REQUEST,,
117_00074,USER,I need it from the 8th to the 12th of March. I'll pick it up around 15:30.,INFORM,,
117_00074,SYSTEM,Where will you pick it up at?,REQUEST,,
117_00074,USER,"In Portland, OR.",INFORM,,
117_00074,SYSTEM,I found 8 cars. An Accord is available at PDX International Airport on March 8th. It's a standard car.,OFFER,,
117_00074,USER,That sounds fine.,SELECT,,
117_00074,SYSTEM,Would you like to reserve it?,OFFER_INTENT,,
117_00074,USER,Not right now. I wanna take a bus there.,INFORM_INTENT,,
117_00074,SYSTEM,Where are you coming from? When are you leaving?,REQUEST,,
117_00074,USER,"I'm going from Seattle, WA. I'm leaving on the 1st.",INFORM,,
117_00074,SYSTEM,I found 10 buses. A bus is leaving at 6:10 am and costs $30 per ticket. It's an economy ticket.,OFFER,,
117_00074,USER,What station does it arrive at? What station am I leaving from?,REQUEST,,
117_00074,SYSTEM,King Street Station is the origin. Portland Bus Station is the destination.,INFORM,,
117_00074,USER,What else is available? I need two tickets.,INFORM,REQUEST_ALTS,
117_00074,SYSTEM,A bus is leaving at 6:30 am and costs $29 per ticket. It's an economy ticket.,OFFER,,
117_00074,USER,That's a good one. I want a round trip flight there.,SELECT,,
117_00074,SYSTEM,Are you coming back March 12th? Are you leaving on March 8th?,REQUEST,,
117_00074,USER,I wanna come back on the 13th. I'll be going on the 1st.,INFORM,,
117_00074,SYSTEM,I found 2 flights. An American Airlines flight is leaving at 8:05 am and returns at 6 am. The ticket costs $80.,OFFER,,
117_00074,USER,When would my return flight be there? Can I refund the ticket?,REQUEST,,
117_00074,SYSTEM,The return flight will be there at 6:58 am. The ticket is not refundable.,INFORM,,
117_00074,USER,That sounds good.,SELECT,,
117_00074,SYSTEM,Would you like tickets?,OFFER_INTENT,,
117_00074,USER,No. That's all.,NEGATE_INTENT,GOODBYE,
117_00074,SYSTEM,Have a nice day.,GOODBYE,,
117_00075,USER,I need to search for a car,INFORM_INTENT,,
117_00075,SYSTEM,What time you need the car and where do you need to pick it from?,REQUEST,,
117_00075,USER,I have to pick it up around 13:30 from San Francisco,INFORM,,
117_00075,SYSTEM,When do you require it from?,REQUEST,,
117_00075,USER,I will require the car from the 2nd,INFORM,,
117_00075,SYSTEM,You will require the car tlll what date?,REQUEST,,
117_00075,USER,I will require till Sunday this week,INFORM,,
117_00075,SYSTEM,There is a nice Standard car Altima available at SFO International Airport for pick up on March 2nd,OFFER,,
117_00075,USER,Is there any other thing available?,REQUEST_ALTS,,
117_00075,SYSTEM,There is a nice Standard car Civic available at Salesforce Transit Center for pick up on March 2nd,OFFER,,
117_00075,USER,Can i know the total cost?,REQUEST,,
117_00075,SYSTEM,Your total booking cost is $26,INFORM,,
117_00075,USER,Is theer any other available thing as i want it till March 4th and i am good with any type,INFORM,,REQUEST_ALTS
117_00075,SYSTEM,There is a nice Compact car Bolt available at Salesforce Transit Center for pick up on March 2nd,OFFER,,
117_00075,USER,Can i know the total cost?,REQUEST,,
117_00075,SYSTEM,Your total booking cost is $52,INFORM,,
