dialogue_id,speaker,turn,act_1,act_2,act_3
55_00099,USER,"I've heard The Chats is good. I'd like to go on the 8th of March in Phoenix, AZ.",INFORM,,
55_00099,SYSTEM,How many tickets to do you want to purchase?,REQUEST,,
55_00099,USER,I need 4 tickets.,INFORM,,
55_00099,SYSTEM,"Okay, I have 4 tickets for The Chats on March 8th in Phoenix, correct?",CONFIRM,,
55_00099,USER,"Yes, that is correct.",AFFIRM,,
55_00099,SYSTEM,"I have successfully purchased the tickets, enjoy!",NOTIFY_SUCCESS,,
55_00099,USER,"Thanks, can you also help me with a rental car to travel there?",INFORM_INTENT,,
55_00099,SYSTEM,"Of course, would you like to pick it up on March 8th?",REQUEST,,
55_00099,USER,I need to pick it up on Wednesday next week.,INFORM,,
55_00099,SYSTEM,What time will you be picking it up?,REQUEST,,
55_00099,USER,I am picking it up at half past 4 in the evening.,INFORM,,
55_00099,SYSTEM,What date are you returning the car?,REQUEST,,
55_00099,USER,I need the car until the 11th of this month.,INFORM,,
55_00099,SYSTEM,There are 3 cars you might like. There is a nice standard car at Sky Harbor International Airport for pickup on March 6th. It is a Honda Accord.,OFFER,,
55_00099,USER,What other cars are available?,REQUEST_ALTS,,
55_00099,SYSTEM,There is a standard Toyota Camry available at Sky Harbor International Airport for pickup on March 6th.,OFFER,,
55_00099,USER,"What other cars are there, I'd like a large car.",INFORM,REQUEST_ALTS,
55_00099,SYSTEM,There is a full-size Hyundai Tucson available at Sky Harbor International Airport for pickup on March 6th.,OFFER,,
55_00099,USER,How much is the reservation?,REQUEST,,
55_00099,SYSTEM,The total cost is $210.,INFORM,,
55_00099,USER,"That sounds great, I'd like to reserve the car.",INFORM_INTENT,SELECT,
55_00099,SYSTEM,"Okay, I have a full-size rental car for pickup at Sky Harbor International Airport on March 6th at 4:30 pm and returning on March 11th, correct?",CONFIRM,,
55_00099,USER,"Yes, that is correct.",AFFIRM,,
55_00099,SYSTEM,I have successfully made the reservation.,NOTIFY_SUCCESS,,
55_00099,USER,Thank you for your help.,THANK_YOU,,
55_00099,SYSTEM,Is there anything else I can help with?,REQ_MORE,,
55_00099,USER,"No, thank you.",NEGATE,THANK_YOU,
55_00099,SYSTEM,Have a great day,GOODBYE,,
55_00100,USER,Can you search for event tickets for me?,INFORM_INTENT,,
55_00100,SYSTEM,Of course. What day?,REQUEST,,
55_00100,USER,I'll go on the 4th of this month,INFORM,,
55_00100,SYSTEM,Ok. What city are you interested in. Any preferences? How many tickets?,REQUEST,,
55_00100,USER,"I'll be in Vancouver, BC. There are 3 of us. I've heard good things about Styx",INFORM,,
55_00100,SYSTEM,Please confirm: 3 tickets for Styx on March 4th in Vancouver,CONFIRM,,
55_00100,USER,"Yes, book those please",AFFIRM,,
55_00100,SYSTEM,I've booked those tickets. Enjoy!,NOTIFY_SUCCESS,,
55_00100,USER,Thanks. I need a rental car too please,THANK_YOU,,
55_00100,SYSTEM,You'll pick that car up on March 4th? What time? When will you be returning it?,REQUEST,,
55_00100,USER,"Yes, find me a compact car. I can get it at 12:00 but I need to keep it until next Wednesday.",INFORM,,
55_00100,SYSTEM,"How about a compact car, a Chevrolet Bolt, from YVR International Airport on March 4th?",OFFER,,
55_00100,USER,What else do you have?,REQUEST_ALTS,,
55_00100,SYSTEM,"Would you like a compact car, a Honda Fit, pickup from YVR International Airport on March 4th?",OFFER,,
55_00100,USER,Yes that looks nice,SELECT,,
55_00100,SYSTEM,Great,REQ_MORE,,
55_00100,USER,Can you book that car for me?,INFORM_INTENT,,
55_00100,SYSTEM,"Please confirm: a compact car from YVR International Airport. Pickup on March 4th at 12 pm, returning on March 6th",CONFIRM,,
55_00100,USER,"Yes, book me that please",AFFIRM,,
55_00100,SYSTEM,I've reserved you that car,NOTIFY_SUCCESS,,
55_00100,USER,Thanks so much,THANK_YOU,,
55_00100,SYSTEM,Anything else you need,REQ_MORE,,
55_00100,USER,Nope. I appreciate it,NEGATE,THANK_YOU,
55_00100,SYSTEM,Take care.,GOODBYE,,
55_00101,USER,I want to get some tickets for an event in Philly.,INFORM,INFORM_INTENT,
55_00101,SYSTEM,Do you have a date in mind or a type of event?,REQUEST,,
55_00101,USER,"I'd like one for Monday next week, and I'm hearing good things about Northlane.",INFORM,,
55_00101,SYSTEM,How many tickets would you like?,REQUEST,,
55_00101,USER,4 tickets will do.,INFORM,,
55_00101,SYSTEM,So you want 4 tickets for Northlane on March 4th in Philadelphia.,CONFIRM,,
55_00101,USER,"Yep, sounds good. Where's the event at?",REQUEST,AFFIRM,
55_00101,SYSTEM,The tickets are booked. The event is at the Foundry.,INFORM,NOTIFY_SUCCESS,
55_00101,USER,Do you mind looking for a car for me to get there? Something spacious that I'll need until March 5th.,INFORM,,INFORM_INTENT
55_00101,SYSTEM,Do you want to pick it up on March 4th?,REQUEST,,
55_00101,USER,"No, I'm gonna need it on the 3rd of this month.",INFORM,,
55_00101,SYSTEM,What time are you going to need it?,REQUEST,,
55_00101,USER,I'll pick it up at twelve in the afternoon.,INFORM,,
55_00101,SYSTEM,I found 4 cars that match what you like. There's a full-size car over on 30th Street Station for pickup on March 3rd. It's a Chevrolet Equinox.,OFFER,,
55_00101,USER,What's the cost?,REQUEST,,
55_00101,SYSTEM,It'll be $76 total.,INFORM,,
55_00101,USER,Is there anything else available?,REQUEST_ALTS,,
55_00101,SYSTEM,There's also a full-size Jeep Cherokee over at Intercity Terminal available for pickup on March 3rd.,OFFER,,
55_00101,USER,Anything else?,REQUEST_ALTS,,
55_00101,SYSTEM,30th Street Station has a full-size Nissan Rogue available for pickup on March 3rd.,OFFER,,
55_00101,USER,That'll do.,SELECT,,
55_00101,SYSTEM,Do you want to book this one?,OFFER_INTENT,,
55_00101,USER,Yeah I do.,AFFIRM_INTENT,,
55_00101,SYSTEM,So you want to pick up the full-size car from 30th Street Station on March 3rd at 12 pm and drop it off on March 5th?,CONFIRM,,
55_00101,USER,"Yup, perfect.",AFFIRM,,
55_00101,SYSTEM,It's been booked.,NOTIFY_SUCCESS,,
55_00101,USER,What was the total cost?,REQUEST,,
55_00101,SYSTEM,It was $80 total.,INFORM,,
55_00101,USER,"Thanks so much, that's everything.",THANK_YOU,GOODBYE,
55_00101,SYSTEM,Have a great day.,GOODBYE,,
55_00102,USER,I want to buy tickets.,INFORM_INTENT,,
55_00102,SYSTEM,Which city?,REQUEST,,
55_00102,USER,Something in Chicago.,INFORM,,
55_00102,SYSTEM,How many tickets and what event do you want?,REQUEST,,
55_00102,USER,I want White Sox Vs Tigers for 4.,INFORM,,
55_00102,SYSTEM,What date?,REQUEST,,
55_00102,USER,Maybe 1st of this month.,INFORM,,
55_00102,SYSTEM,"Okay, you want 4 tickets for White Sox Vs Tigers on March 1st at Chicago. Please confirm.",CONFIRM,,
55_00102,USER,That's good!,AFFIRM,,
55_00102,SYSTEM,Reservation done. Enjoy!,NOTIFY_SUCCESS,,
55_00102,USER,Where is the event located?,REQUEST,,
55_00102,SYSTEM,At Guaranteed Rate Field.,INFORM,,
55_00102,USER,Thank you. Please help me find a Compact rental car to go there. I will pick it up at twelve pm on 1st of this month.,THANK_YOU,,
55_00102,SYSTEM,Until what date?,REQUEST,,
55_00102,USER,Until 3rd of March.,INFORM,,
55_00102,SYSTEM,I found 2 cars. It's available at O'Hare International Airport on March 1st. It is a Compact car. Do you want Kia Forte?,OFFER,,
55_00102,USER,Hpw much is the total cost?,REQUEST,,
55_00102,SYSTEM,$60 in total.,INFORM,,
55_00102,USER,That's great please reserve that for me.,INFORM_INTENT,SELECT,
55_00102,SYSTEM,"Okay, you want a Compact car on March 1st and you will pick it up at O'Hare International Airport at 12 pm until March 3rd.",CONFIRM,,
55_00102,USER,Yes that's great!,AFFIRM,,
55_00102,SYSTEM,Car reserved!,NOTIFY_SUCCESS,,
55_00102,USER,Thank you.,THANK_YOU,GOODBYE,
55_00102,SYSTEM,Enjoy your day!,GOODBYE,,
55_00103,USER,I need help buying tickets for this Outlaw Music Festival. I've been wanting to go there ever since I've heard that it is good. I would love to find it in NYC.,INFORM,,INFORM_INTENT
55_00103,SYSTEM,What date would you like to go to this event and how many tickets do you want?,REQUEST,,
55_00103,USER,8th of March would be perfect and I will want just 1 ticket.,INFORM,,
55_00103,SYSTEM,Make sure I got it all right. You want Outlaw Music Festival ticket to be booked. You want just 1 ticket for March 8th and the event is held in New York.,CONFIRM,,
55_00103,USER,That is correct.,AFFIRM,,
55_00103,SYSTEM,I have made your reservation. I hope you enjoy it!,NOTIFY_SUCCESS,,
55_00103,USER,"Thank you. I will be needing a car that I can rent to that place, preferably a Standard car.I need it on 5th of March till the 11th.",THANK_YOU,,
55_00103,SYSTEM,What time will you be wanting it?,REQUEST,,
55_00103,USER,I will use it at 12 pm and drop it off on 12th of this month.,INFORM,,
55_00103,SYSTEM,You will have a nice Standard car waiting at Port Authority Station on March 5th. Would you like a Hyundai Elantra?,OFFER,,
55_00103,USER,"Yes that would work. Book the car, please.",INFORM_INTENT,SELECT,
55_00103,SYSTEM,So you want to pick up a Standard car from Port Authority Station on March 5th at 12 pm. You will drop it off on March 12th.,CONFIRM,,
55_00103,USER,Yeah that is all right.,AFFIRM,,
55_00103,SYSTEM,I have reserved your car.,NOTIFY_SUCCESS,,
55_00103,USER,Thank you very much.,THANK_YOU,,
55_00103,SYSTEM,Do you want anything else?,REQ_MORE,,
55_00103,USER,Nope. That is all I need. Thank you.,NEGATE,THANK_YOU,
55_00103,SYSTEM,Have a wonderful day!,GOODBYE,,
55_00104,USER,I wangt to buy tickets for an event in SF?,INFORM,INFORM_INTENT,
55_00104,SYSTEM,What event?,REQUEST,,
55_00104,USER,3 tickets for Giants vs Nationals,INFORM,,
55_00104,SYSTEM,What date?,REQUEST,,
55_00104,USER,The 11th of March.,INFORM,,
55_00104,SYSTEM,"To confirm, you'd like 3 tickets for Giants vs Nationals on March 11th in San Francisco?",CONFIRM,,
55_00104,USER,Yes. What time is the event?,REQUEST,AFFIRM,
55_00104,SYSTEM,Your tickets are booked and the event starts at 7:30 pm.,INFORM,NOTIFY_SUCCESS,
55_00104,USER,Can you find me a rental car?,INFORM_INTENT,,
55_00104,SYSTEM,For March 11th? What time and for how long?,REQUEST,,
55_00104,USER,I'll need it around five in the evening from March 10th till March 12th.,INFORM,,
55_00104,SYSTEM,I have 6 available. How about a standard Chevrolet Cruze from SFO International Airport on March 10th?,OFFER,,
55_00104,USER,Yes please book that one.,INFORM_INTENT,SELECT,
55_00104,SYSTEM,"To confirm, you'd like a standard car to pick up at 5 pm from SFO International Airport on March 10th and will need it till March 12th?",CONFIRM,,
55_00104,USER,Sounds good. How much is it?,REQUEST,AFFIRM,
55_00104,SYSTEM,Your car is booked. It'll be $58.,INFORM,NOTIFY_SUCCESS,
55_00104,USER,Thank you.,THANK_YOU,,
55_00104,SYSTEM,Anything else I can help with?,REQ_MORE,,
55_00104,USER,Nope. Thanks again.,NEGATE,THANK_YOU,
55_00104,SYSTEM,Have a good day.,GOODBYE,,
55_00105,USER,I want tickets to an event.,INFORM_INTENT,,
55_00105,SYSTEM,How many tickets should I get? And for what city and type of event?,REQUEST,,
55_00105,USER,I want to see Blueface somewhere in Philly. I'd like 3 tickets.,INFORM,,
55_00105,SYSTEM,Do you have a date in mind?,REQUEST,,
55_00105,USER,The 6th of March works.,INFORM,,
55_00105,SYSTEM,You want 3 tickets to see Blueface on March 6th in Philadelphia?,CONFIRM,,
55_00105,USER,Yeah that works.,AFFIRM,,
55_00105,SYSTEM,"It's been booked, have fun!",NOTIFY_SUCCESS,,
55_00105,USER,When does it start?,REQUEST,,
55_00105,SYSTEM,At 5 pm.,INFORM,,
55_00105,USER,Thanks for that. Could you book a rental car for me too? I want to pick it up in the afternoon 3:30 and I need it by Monday next week.,THANK_YOU,,
55_00105,SYSTEM,What date do you need the car until?,REQUEST,,
55_00105,USER,I'll need it until the 8th.,INFORM,,
55_00105,SYSTEM,I found 8 cars that'll work. There's a standard chevrolet cruze at the phl international airport available for pickup on march 4th.,OFFER,,
55_00105,USER,What's that gonna cost?,REQUEST,,
55_00105,SYSTEM,It'll be $160 total.,INFORM,,
55_00105,USER,Is there anything else? I prefer a small car.,INFORM,REQUEST_ALTS,
55_00105,SYSTEM,There's 6 cars that might work for you. Intercity Terminal has a compact Honda Fit available for pickup on March 4th.,OFFER,,
55_00105,USER,That'll work.,SELECT,,
55_00105,SYSTEM,Do you want to reserve that one?,OFFER_INTENT,,
55_00105,USER,"Yeah, I want to book that one.",AFFIRM_INTENT,,
55_00105,SYSTEM,So you want to book the compact car from March 4th at 3:30 pm until March 8th at Intercity Terminal.,CONFIRM,,
55_00105,USER,Sounds perfect.,AFFIRM,,
55_00105,SYSTEM,It's been booked.,NOTIFY_SUCCESS,,
55_00105,USER,Thanks for all your help.,THANK_YOU,,
55_00105,SYSTEM,Is there anything else you need help with.,REQ_MORE,,
55_00105,USER,"No, that's everything.",NEGATE,THANK_YOU,
55_00105,SYSTEM,Have a nice day!,GOODBYE,,
55_00106,USER,I want event tickets.,INFORM_INTENT,,
55_00106,SYSTEM,Any preferred dates?,REQUEST,,
55_00106,USER,The 7th of this month.,INFORM,,
55_00106,SYSTEM,Any city preferences? Event preferences? How many tickets do you need?,REQUEST,,
55_00106,USER,"How about something in Toronto, Canada? I heard the Blue Jays Vs Indians is really good. I'm gonna need two tickets.",INFORM,,
55_00106,SYSTEM,"You want 2 tickets to the Blue Jays Vs Indians event that is taking place in Toronto on March 7th, correct?",CONFIRM,,
55_00106,USER,Yes. Where is the event being held? What time does it start?,REQUEST,,AFFIRM
55_00106,SYSTEM,The event is being held at the Rogers Centre and starts at 7 pm. You reservation has been made. Have fun!,INFORM,,NOTIFY_SUCCESS
55_00106,USER,Thanks! Could you also find me a rental car? I'd like a Compact car till the 9th.,THANK_YOU,,
55_00106,SYSTEM,What time will you need the rental?,REQUEST,,
55_00106,USER,I'd like an 11 am pick up.,INFORM,,
55_00106,SYSTEM,Is that for March 7th?,REQUEST,,
55_00106,USER,"No, it is for March 1st. I need it until Friday next week.",INFORM,,
55_00106,SYSTEM,I found 1 car. A Compact Honda Fit is available for pickup at the Toronto Pearson International Airport on March 1st.,OFFER,,
55_00106,USER,That sounds good.,SELECT,,
55_00106,SYSTEM,Would you like to reserve this car?,OFFER_INTENT,,
55_00106,USER,"Yes, please.",AFFIRM_INTENT,,
55_00106,SYSTEM,You will be picking up a Compact car on March 1st at 11 am at the Toronto Pearson International Airport. You will be dropping the car off on March 8th. Is this correct?,CONFIRM,,
55_00106,USER,"Yes, sounds good.",AFFIRM,,
55_00106,SYSTEM,Your car has been reserved.,NOTIFY_SUCCESS,,
55_00106,USER,Thanks for your help. That's all for now.,THANK_YOU,GOODBYE,
55_00106,SYSTEM,Have a great day!,GOODBYE,,
55_00107,USER,I'd like to buy some tickets for an event.,INFORM_INTENT,,
55_00107,SYSTEM,What city do you prefer i look in? How many tickets should i get?,REQUEST,,
55_00107,USER,Can you find me 2 tickets for something in SD.,INFORM,,
55_00107,SYSTEM,Do you have any specific events you're interested in?,REQUEST,,
55_00107,USER,I heard Aly And Aj is really good.,INFORM,,
55_00107,SYSTEM,What day are you thinking about attending?,REQUEST,,
55_00107,USER,I'd like to go to the one on the 4th.,INFORM,,
55_00107,SYSTEM,Please confirm the following: Booking 2 tickets for Aly And Aj on March 4th in San Diego.,CONFIRM,,
55_00107,USER,"Yes, that's right.",AFFIRM,,
55_00107,SYSTEM,Your reservation is confirmed. Have a great time!,NOTIFY_SUCCESS,,
55_00107,USER,Can you find me a rental car to get there? Something I can pick up around 12:30 pm?,INFORM,INFORM_INTENT,
55_00107,SYSTEM,What day do you want to get the car?,REQUEST,,
55_00107,USER,I need the car until the 7th of March.,INFORM,,
55_00107,SYSTEM,Do you want to pick it up on March 4th?,REQUEST,,
55_00107,USER,I really need the car by Saturday this week.,INFORM,,
55_00107,SYSTEM,I found a nice car available at SAN International Airport you can pick up on March 2nd. It's a Standard Ford Fusion.,OFFER,,
55_00107,USER,How much will it cost me?,REQUEST,,
55_00107,SYSTEM,The total for your reservation will be $165.,INFORM,,
55_00107,USER,"Sounds good, I'd like to reserve the car.",INFORM_INTENT,SELECT,
55_00107,SYSTEM,Please confirm the following details: You are picking up a Standard car from SAN International Airport on March 2nd at 12:30 pm. The drop-off date will be March 7th.,CONFIRM,,
55_00107,USER,"Cool, sounds good to me.",AFFIRM,,
55_00107,SYSTEM,Your car has been reserved.,NOTIFY_SUCCESS,,
55_00107,USER,Thanks a lot for the help.,THANK_YOU,,
55_00107,SYSTEM,Anything else i can help you with?,REQ_MORE,,
55_00107,USER,"No, that will be all. Thank you.",NEGATE,THANK_YOU,
55_00107,SYSTEM,Thank you. Have a great day!,GOODBYE,,
55_00108,USER,Can you buy me some event tickets?,INFORM_INTENT,,
55_00108,SYSTEM,"Sure, what date is it?",REQUEST,,
55_00108,USER,It's on March 9th.,INFORM,,
55_00108,SYSTEM,What city is it in? What event are you interested in? How many tickets do you need?,REQUEST,,
55_00108,USER,I'd like three tickets for Electric Feels in San Francisco.,INFORM,,
55_00108,SYSTEM,"Okay, please confirm that you'd like 3 tickets for Electric Feels in San Francisco on March 9th.",CONFIRM,,
55_00108,USER,"Yes, that's perfect. When does it start? Where is it?",REQUEST,,AFFIRM
55_00108,SYSTEM,Your booking is complete. It's at August Hall from 5 pm.,INFORM,,NOTIFY_SUCCESS
55_00108,USER,Can you get me a rental car too?,INFORM_INTENT,,
55_00108,SYSTEM,"Sure, for March 9th? What time will you need?",REQUEST,,
55_00108,USER,"No, I need it on Wednesday next week from 12:30.",INFORM,,
55_00108,SYSTEM,Until when will you need the car?,REQUEST,,
55_00108,USER,I need it until the 10th.,INFORM,,
55_00108,SYSTEM,"Okay, there's a standard Chevrolet Cruze at SFO International Airport available on March 6th.",OFFER,,
55_00108,USER,How much will it cost?,REQUEST,,
55_00108,SYSTEM,It'll cost $152 in total.,INFORM,,
55_00108,USER,Is there anything else? I can take a compact car until the 11th of this month.,INFORM,,REQUEST_ALTS
55_00108,SYSTEM,There are 4 available cars. How about a compact Kia Forte from SFO International Airport on March 6th?,OFFER,,
55_00108,USER,Is there anything else?,REQUEST_ALTS,,
55_00108,SYSTEM,"Sure, how about a compact Mini Cooper at SFO International Airport from March 6th?",OFFER,,
55_00108,USER,"That sounds good, please book it.",INFORM_INTENT,SELECT,
55_00108,SYSTEM,Please confirm that you'd like to book a compact car from SFO International Airport from 12:30 pm on March 6th until March 11th.,CONFIRM,,
55_00108,USER,"Yes, that's perfect.",AFFIRM,,
55_00108,SYSTEM,"Okay, it has been reserved.",NOTIFY_SUCCESS,,
55_00108,USER,"Thanks, that's all I need.",THANK_YOU,GOODBYE,
55_00108,SYSTEM,"Okay, see you.",GOODBYE,,
55_00109,USER,I want to get some tickets to an event.,INFORM_INTENT,,
55_00109,SYSTEM,What city are you wanting me to look in and for which day? Also how many tickets are you wanting to purchase?,REQUEST,,
55_00109,USER,I want to get 4 tickets for the 11th of this month in SD.,INFORM,,
55_00109,SYSTEM,What event are you trying to get tickets for?,REQUEST,,
55_00109,USER,"Actually you should look in NY for the Mets Vs Dodgers, I've heard good things about it.",INFORM,,
55_00109,SYSTEM,You want to get 4 tickets to the Mets Vs Dodgers game scheduled for March 11th in New York - is that what you want?,CONFIRM,,
55_00109,USER,You got it.,AFFIRM,,
55_00109,SYSTEM,"The ticket purchase was successful, have a good time.",NOTIFY_SUCCESS,,
55_00109,USER,I am going to be needing a rental car. I want it get it for March 8th until the 14th.,INFORM,,INFORM_INTENT
55_00109,SYSTEM,What time did you want to pick it up?,REQUEST,,
55_00109,USER,11 am would be the best time for me.,INFORM,,
55_00109,SYSTEM,I am showing 3 cars available to you one is a Standard Honda Accord you could pick it up on March 8th from Grand Central Station. Do you like that one?,OFFER,,
55_00109,USER,What would that set me back?,REQUEST,,
55_00109,SYSTEM,It would be $174 to make a reservation for that one.,INFORM,,
55_00109,USER,What else do you got?,REQUEST_ALTS,,
55_00109,SYSTEM,There is a Standard Nissan Altima available March 8th at the Port Authority Station. Would that work for you?,OFFER,,
55_00109,USER,What else is there?,REQUEST_ALTS,,
55_00109,SYSTEM,"Grand Central Station has a Standard Toyota Corolla available March 8th, would it do?",OFFER,,
55_00109,USER,That's the one for me.,SELECT,,
55_00109,SYSTEM,What else do you need me to do?,REQ_MORE,,
55_00109,USER,Get me that car of course.,INFORM_INTENT,,
55_00109,SYSTEM,You have decide on the Standard car and you will pick it up at Grand Central Station on March 8th at 11 am and return it March 14th it that correct?,CONFIRM,,
55_00109,USER,"It is, what will that cost me?",REQUEST,AFFIRM,
55_00109,SYSTEM,I paid $216 for you to reserve the vehicle.,INFORM,NOTIFY_SUCCESS,
55_00109,USER,Thanks you can go now.,THANK_YOU,GOODBYE,
55_00109,SYSTEM,Have a happy day.,GOODBYE,,
55_00110,USER,"I heard the Lights is really good, I'd like to purchase 4 tickets to the event.",INFORM,,INFORM_INTENT
55_00110,SYSTEM,What is your preferred city to search in?,REQUEST,,
55_00110,USER,I'm looking for something in LAX.,INFORM,,
55_00110,SYSTEM,What date would you like to go?,REQUEST,,
55_00110,USER,I want to go Saturday this week.,INFORM,,
55_00110,SYSTEM,Please confirm the following details: Book 4 tickets to Lights for March 2nd in Los Angeles.,CONFIRM,,
55_00110,USER,"Yes, that works for me.",AFFIRM,,
55_00110,SYSTEM,Your reservation has been made. Have a great time!,NOTIFY_SUCCESS,,
55_00110,USER,Thanks for the help. Can you find me a rental car to get there?,THANK_YOU,,
55_00110,SYSTEM,What time do you need it and how long will you be renting?,REQUEST,,
55_00110,USER,I need to be picked up at three pm. I'll be renting till the 5th.,INFORM,,
55_00110,SYSTEM,Would you like to pick it up on March 2nd?,REQUEST,,
55_00110,USER,"Yeah, sounds good to me.",AFFIRM,,
55_00110,SYSTEM,There is a nice car available at Union Station available for pickup on March 2nd. How about a Standard Chevrolet Cruze?,OFFER,,
55_00110,USER,Anything else available?,REQUEST_ALTS,,
55_00110,SYSTEM,There is a nice car available at LAX International Airport for pick up on March 2nd. How about a Standard Ford Fusion?,OFFER,,
55_00110,USER,"Ok, that sounds good.",SELECT,,
55_00110,SYSTEM,Would you like to reserve the car now?,OFFER_INTENT,,
55_00110,USER,"Yes, I'd like to book the rental.",AFFIRM_INTENT,,
55_00110,SYSTEM,Please confirm the following details: You are picking up a car from LAX International Airport on March 2nd at 3 pm. The return date is March 5th. This is a Standard car.,CONFIRM,,
55_00110,USER,"Yea, sounds good.",AFFIRM,,
55_00110,SYSTEM,Your car rental has been reserved.,NOTIFY_SUCCESS,,
55_00110,USER,Thanks a ton for the help. That's all for now.,THANK_YOU,GOODBYE,
55_00110,SYSTEM,Have a great day!,GOODBYE,,
55_00111,USER,I would like to buy tickets at an event.,INFORM_INTENT,,
55_00111,SYSTEM,Tell me the number of tickets you want and in witch city and what type of events?,REQUEST,,
55_00111,USER,Diamondbacks Vs Brewers I heard is really good.Fine me something is Phoenix.Four tickets will be ok.,INFORM,,
55_00111,SYSTEM,In what date do you prefer?,REQUEST,,
55_00111,USER,I would like to be on 2nd of this month.,INFORM,,
55_00111,SYSTEM,Book 4 tickets at Diamondbacks Vs Brewers on March 2nd in Phoenix.I'm right?,CONFIRM,,
55_00111,USER,Yes is good,AFFIRM,,
55_00111,SYSTEM,The reservation was made.Have fun!,NOTIFY_SUCCESS,,
55_00111,USER,The event where is taking place at at what hour will start?,REQUEST,,
55_00111,SYSTEM,Will start at 6:30 pm and is at Chase Field.,INFORM,,
55_00111,USER,Thanks.You can find me a rental car there?,THANK_YOU,,
55_00111,SYSTEM,You want to pick it up on March 2nd ?Tell me at what time will you need it and till what date?,REQUEST,,
55_00111,USER,The pick will be at half past 1 in the afternoon and I need it on the 1st till next Wednesday.,INFORM,,
55_00111,SYSTEM,I found 3 option.A nice Honda Accord Standard car at Sky Harbor International Airport available for pick up on March 1st.What is your opinion?,OFFER,,
55_00111,USER,Sounds very good.,SELECT,,
55_00111,SYSTEM,You want a reservation?,OFFER_INTENT,,
55_00111,USER,Ye I would like to book a car rental.,AFFIRM_INTENT,,
55_00111,SYSTEM,The pick up will be from Sky Harbor International Airport on March 1st at 1:30 pm and the drop-off will be on March 6th.Will be a Standard car.Is that okay for you?,CONFIRM,,
55_00111,USER,Ye sounds perfect.,AFFIRM,,
55_00111,SYSTEM,The car has been reserved for you.,NOTIFY_SUCCESS,,
55_00111,USER,Thank you very much.,THANK_YOU,,
55_00111,SYSTEM,Anything else I can do for you now?,REQ_MORE,,
55_00111,USER,No.Thank you!,NEGATE,THANK_YOU,
55_00111,SYSTEM,Have a nice day!,GOODBYE,,
55_00112,USER,I wish to book tickets for an event.,INFORM_INTENT,,
55_00112,SYSTEM,May I know which event do you want to see? How many tickets do you need?,REQUEST,,
55_00112,USER,I think Starset is very nice. I need 2 tickets.,INFORM,,
55_00112,SYSTEM,In which city and in what date do you want to see the event?,REQUEST,,
55_00112,USER,I am searching for something in LA on March 11th.,INFORM,,
55_00112,SYSTEM,"Kindly ensure that, on March 11th, 2 tickets have been booked ofr Starset at Los Angeles.",CONFIRM,,
55_00112,USER,Yes. it is good for me.,AFFIRM,,
55_00112,SYSTEM,Your booking has been done. Have a nice time there!,NOTIFY_SUCCESS,,
55_00112,USER,Which is the event location?,REQUEST,,
55_00112,SYSTEM,The location of the event is Regent Theater DTLA.,INFORM,,
55_00112,USER,What is the address?,REQUEST,,
55_00112,SYSTEM,The address is 448 South Main Street.,INFORM,,
55_00112,USER,Thank you so much for your help. I need a car for rental on 9th of March.,THANK_YOU,,
55_00112,SYSTEM,When will you need the car and up to which date you need the car?,REQUEST,,
55_00112,USER,"I will pick it up at 11 o""clock in the morning. I need it up to 14th of March.",INFORM,,
