dialogue_id,speaker,turn,act_1,act_2,act_3
11_00016,SYSTEM,Okay. I have found 10 events that you might like. One of it is Falcons Vs Buccaneers at Mercedes-Benz Stadium.,OFFER,,INFORM_COUNT
11_00016,USER,Pardon me but what is the category of this event and when will it start?,REQUEST,,
11_00016,SYSTEM,This is a Football match that starts at 6 pm.,INFORM,,
11_00016,USER,"Okay, that sounds good!",SELECT,,
11_00016,SYSTEM,Do you want me to buy tickets for you?,OFFER_INTENT,,
11_00016,USER,Let me think about that for a while.,NEGATE_INTENT,,
11_00016,SYSTEM,Do you need help with anything else?,REQ_MORE,,
11_00016,USER,I would also like to find dates for events.,INFORM_INTENT,,
11_00016,SYSTEM,The football match Falcons Vs Buccaneers at Mercedes-Benz Stadium os on next Wednesday.,OFFER,,
11_00016,USER,"Alright, please buy me four tickets.",INFORM,INFORM_INTENT,SELECT
11_00016,SYSTEM,Please do confirm the following details: the event is Falcons Vs Buccaneers in Atlanta that will happen next Wednesday. I will buy 4 tickets.,CONFIRM,,
11_00016,USER,"Ye, that's right!",AFFIRM,,
11_00016,SYSTEM,Booking has been made.,NOTIFY_SUCCESS,,
11_00016,USER,Thank you so much!,THANK_YOU,,
11_00016,SYSTEM,Do you need further assistance?,REQ_MORE,,
11_00016,USER,"No, thank you!",NEGATE,THANK_YOU,
11_00016,SYSTEM,Have a good day.,GOODBYE,,
11_00017,USER,Please look for events.,INFORM_INTENT,,
11_00017,SYSTEM,"What type of event would you like me to search for? I can search for Music or Sports, or many other types of events. What is the city where you would like me to search?",REQUEST,,
11_00017,USER,"I want to look for Sports events in Sacramento, CA. I would prefer a Soccer game.",INFORM,,
11_00017,SYSTEM,I found 1 soccer event. Republic Vs Toros is occuring at Papa Murphy's Park.,OFFER,,INFORM_COUNT
11_00017,USER,What time is the game?,REQUEST,,
11_00017,SYSTEM,The game begins at 5:30 pm.,INFORM,,
11_00017,USER,Where is the game?,REQUEST,,
11_00017,SYSTEM,"The event is scheduled at Papa Murphy's Park, located at 1600 Exposition Boulevard.",INFORM,,
11_00017,USER,Okay. What dates are available?,INFORM_INTENT,SELECT,
11_00017,SYSTEM,I found 5 of these events. There is a Republic Vs Toros event today at Papa Murphy's Park.,OFFER,,
11_00017,USER,Okay. How do I get tickets?,INFORM_INTENT,SELECT,
11_00017,SYSTEM,How many tickets do you want to purchase?,REQUEST,,
11_00017,USER,Purchase 4 please.,INFORM,,
11_00017,SYSTEM,"Okay. Just to confirm, you want 4 tickets to the Republic Vs Toros event today in Sacramento. Is that correct?",CONFIRM,,
11_00017,USER,That's correct.,AFFIRM,,
11_00017,SYSTEM,I have made a reservation for you.,NOTIFY_SUCCESS,,
11_00017,USER,Thanks. That's it for now.,THANK_YOU,GOODBYE,
11_00017,SYSTEM,Have a nice time!,GOODBYE,,
11_00018,USER,I have time off work soon and want to look for events to go to.,INFORM_INTENT,,
11_00018,SYSTEM,"Okay, let's try to narrow it down a bit. Can you tell me what city you would like the events to take place in and the type of event you would like to attend. You can say things like Music, Sports, or any other category of events.",REQUEST,,
11_00018,USER,I am looking for a Match to attend on the 13th of March in Stanford.,INFORM,,
11_00018,SYSTEM,"Great, I've found a match with Cardinal Vs Wildcats at Stanford Stadium.",OFFER,,
11_00018,USER,Can you find me a Football even on the 14th of this month?,INFORM,,REQUEST_ALTS
11_00018,SYSTEM,There is 1 game which sounds like what you're looking for between the Cardinal Vs Ducks and it is also held at Stanford Stadium.,OFFER,,INFORM_COUNT
11_00018,USER,That sounds great! What are the dates for that event?,INFORM_INTENT,SELECT,
11_00018,SYSTEM,The game with Cardinal Vs Ducks will be held on March 14th at Stanford Stadium.,OFFER,,
11_00018,USER,What time does the game start?,REQUEST,,
11_00018,SYSTEM,The game starts at 6:30 pm.,INFORM,,
11_00018,USER,That's exactly what I'm looking for. I would like tickets for that game.,INFORM_INTENT,SELECT,
11_00018,SYSTEM,How many tickets would you like me to order for you?,REQUEST,,
11_00018,USER,I will need a total of 3 tickets.,INFORM,,
11_00018,SYSTEM,So you need 3 tickets for the Cardinal Vs Ducks game on March 14th in Stanford. Does that sound right?,CONFIRM,,
11_00018,USER,"No, I'm sorry, I want 2 tickets.",INFORM,NEGATE,
11_00018,SYSTEM,"Okay, now I have 2 tickets for the game on March 14th.",CONFIRM,,
11_00018,USER,"Yes, that is correct.",AFFIRM,,
11_00018,SYSTEM,I have successfully reserved your tickets.,NOTIFY_SUCCESS,,
11_00018,USER,"Thank you for all of your help, that will be all.",THANK_YOU,GOODBYE,
11_00018,SYSTEM,Have a wonderful day.,GOODBYE,,
11_00019,USER,I want to search for events.,INFORM_INTENT,,
11_00019,SYSTEM,"Do you have a type of event or city you prefer? You can search for Music, Sports, or anything else.",REQUEST,,
11_00019,USER,I want music events in NY.,INFORM,,
11_00019,SYSTEM,I found 10 music events in NY. One event is in Warsaw and is called Amber Run Brooklyn.,OFFER,,INFORM_COUNT
11_00019,USER,That sounds good.,SELECT,,
11_00019,SYSTEM,Do you want to buy tickets for this event?,OFFER_INTENT,,
11_00019,USER,"Maybe later, I'm more interested in finding dates for events.",INFORM_INTENT,NEGATE_INTENT,
11_00019,SYSTEM,This event is tomorrow at Warsaw and is called Amber Run Brooklyn.,OFFER,,
11_00019,USER,"Sounds good, I want three tickets to the event.",INFORM,INFORM_INTENT,SELECT
11_00019,SYSTEM,Can you confirm the details? You want 3 tickets for tomorrow's show in New York that's called Amber Run Brooklyn.,CONFIRM,,
11_00019,USER,"Yeah, that's good. What's the address for the venue, and when does the event start?",REQUEST,,AFFIRM
11_00019,SYSTEM,"The event is at 261 Driggs Avenue, Brooklyn, and starts at 5 pm.",INFORM,,NOTIFY_SUCCESS
11_00019,USER,That's for your help. That's all I need.,THANK_YOU,GOODBYE,
11_00019,SYSTEM,Have a good day.,GOODBYE,,
11_00020,USER,I am new to this city. Where can I find a list of events?,INFORM_INTENT,,
11_00020,SYSTEM,"In which city should I look, and what types of activities should I look for?",REQUEST,,
11_00020,USER,I am looking for a concert list for the city of Berkeley.,INFORM,,
11_00020,SYSTEM,There are 7 musical events being held soon. The one you might like the most is the Berkeley World Music Festival at 2500 Durant Ave.,OFFER,,INFORM_COUNT
11_00020,USER,That sounds like what I'm looking for.,SELECT,,
11_00020,SYSTEM,Do you want to attend the concert? You will need to buy tickets.,OFFER_INTENT,,
11_00020,USER,Not now. I want to find the dates of other events.,INFORM_INTENT,NEGATE_INTENT,
11_00020,SYSTEM,It took me 4 days to find an event you would like. It takes place today and is the Berkeley World Music Festival at 2500 Durant Ave.,OFFER,,
11_00020,USER,I am interested in buying 2 tickets for the music festival.,INFORM,INFORM_INTENT,SELECT
11_00020,SYSTEM,Let me make sure--you want 2 tickets for the Berkeley World Music Festival today in Berkeley.,CONFIRM,,
11_00020,USER,"Yes, that's right. Where is the concert being held?",REQUEST,AFFIRM,
11_00020,SYSTEM,"The concert will be at 2500 Durant Avenue, and your reservation has been made.",INFORM,NOTIFY_SUCCESS,
11_00020,USER,At what time does the music festival begin?,REQUEST,,
11_00020,SYSTEM,The music festival starts at 7:30 pm.,INFORM,,
11_00020,USER,Thank you for your assistance.,THANK_YOU,,
11_00020,SYSTEM,My pleasure; is there anything else I can help you with?,REQ_MORE,,
11_00020,USER,"No, thank you. I appreciate your help.",NEGATE,THANK_YOU,
11_00020,SYSTEM,I'm happy to help; enjoy your day!,GOODBYE,,
11_00021,USER,I'm looking for events in New York City on March 11th.,INFORM,,INFORM_INTENT
11_00021,SYSTEM,What kind of events are you interested in?,REQUEST,,
11_00021,USER,"I'm looking for a Concert, and I also like International events.",INFORM,,
11_00021,SYSTEM,I was able to find 1 event that you may be interested in. There is a France Rocks Festival at the David Rubenstein Atrium at Lincoln Center.,OFFER,,INFORM_COUNT
11_00021,USER,That sounds great. I need to know the dates for the event.,INFORM_INTENT,SELECT,
11_00021,SYSTEM,The France Rocks Festival runs for 1 day at the David Rubenstein Atrium at Lincoln Center on March 11th.,OFFER,,
11_00021,USER,Excellent.,SELECT,,
11_00021,SYSTEM,Would you like to buy tickets for the event?,OFFER_INTENT,,
11_00021,USER,"Yes. I'd like to buy 1 ticket for the event, please.",AFFIRM_INTENT,INFORM,
11_00021,SYSTEM,To confirm: You'd like 1 ticket to the France Rocks Festival on March 11th in New York?,CONFIRM,,
11_00021,USER,"No. I'd like 4 tickets, please.",INFORM,NEGATE,
11_00021,SYSTEM,To confirm: You'd like 4 tickets for the France Rocks Festival?,CONFIRM,,
11_00021,USER,"Yes, that's perfect. When does the event start, and where's the venue located?",REQUEST,,AFFIRM
11_00021,SYSTEM,"Your tickets have been reserved. The event starts at 6:30 pm, and the venue is located at 61 West 62nd Street.",INFORM,,NOTIFY_SUCCESS
11_00021,USER,Thank you so much for all of your help.,THANK_YOU,GOODBYE,
11_00021,SYSTEM,Enjoy your day.,GOODBYE,,
11_00022,USER,"I am looking for events, especially Music events.",INFORM,INFORM_INTENT,
11_00022,SYSTEM,What time frame and what city or area would you like me to search in?,REQUEST,,
11_00022,USER,I want something in NYC on the 14th.,INFORM,,
11_00022,SYSTEM,There are 10 events in the category music on the 14th. The first one is Amber Run Brooklyn at Warsaw.,OFFER,,INFORM_COUNT
11_00022,USER,Warsaw? Where is that located?,REQUEST,,
11_00022,SYSTEM,"Warsaw is located at 261 Driggs Avenue, Brooklyn.",INFORM,,
11_00022,USER,What time does it start and could you give me some info on the event?,REQUEST,,
11_00022,SYSTEM,It begins at 7 pm. It is a pop event.,INFORM,,
11_00022,USER,I guess that sounds okay. Will it be on any other day?,INFORM_INTENT,SELECT,
11_00022,SYSTEM,The event Amber Run Brooklyn is listed for just 1 day. It is on March 14th at Warsaw.,OFFER,,
11_00022,USER,What time did you say the event starts? And what was that address again?,REQUEST,,
11_00022,SYSTEM,"Amber Run Brooklyn begins at 7 pm. The venue Warsaw is located at 261 Driggs Avenue, Brooklyn.",INFORM,,
11_00022,USER,"Yep, that sounds like a good deal. I want to buy tickets.",INFORM_INTENT,SELECT,
11_00022,SYSTEM,How many tickets would you like to purchase?,REQUEST,,
11_00022,USER,I will need two tickets.,INFORM,,
11_00022,SYSTEM,Please confirm the following: 2 tickets for Amber Run Brooklyn on March 14th in New York.,CONFIRM,,
11_00022,USER,"Yes, that's it. Thanks.",AFFIRM,,
11_00022,SYSTEM,Your tickets have been purchased.,NOTIFY_SUCCESS,,
11_00022,USER,Great. That's all I needed. Thanks for your help.,THANK_YOU,GOODBYE,
11_00022,SYSTEM,Enjoy the concert!,GOODBYE,,
11_00023,USER,I want to search for music events.,INFORM,INFORM_INTENT,
11_00023,SYSTEM,What city should I look in?,REQUEST,,
11_00023,USER,"Can you find me Pop events in Phoenix, AZ?",INFORM,,
11_00023,SYSTEM,I found Dodie at the Van Buren.,OFFER,,
11_00023,USER,Where is that located and when does it start?,REQUEST,,
11_00023,SYSTEM,The address is 401 West Van Buren Street and it starts at 5:30 PM.,INFORM,,
11_00023,USER,That sounds good.,SELECT,,
11_00023,SYSTEM,Do you want those tickets?,OFFER_INTENT,,
11_00023,USER,"I might, but I'm just looking at dates right now.",INFORM_INTENT,NEGATE_INTENT,
11_00023,SYSTEM,There is also an event for Dodie at the Van Buren next Monday.,OFFER,,
11_00023,USER,That one sounds good to me. I want to buy one ticket for it.,INFORM,INFORM_INTENT,SELECT
11_00023,SYSTEM,Can you confirm that you want 1 ticket for Dodie next Monday at the Phoenix.,CONFIRM,,
11_00023,USER,No I need two tickets.,INFORM,NEGATE,
11_00023,SYSTEM,Can you confirm you want 2 tickets for the event next Monday.,CONFIRM,,
11_00023,USER,Yes that's correct.,AFFIRM,,
11_00023,SYSTEM,I've made the reservation for you.,NOTIFY_SUCCESS,,
11_00023,USER,Thanks for the help. That's all I needed today.,THANK_YOU,GOODBYE,
11_00023,SYSTEM,Have a great day.,GOODBYE,,
11_00024,USER,I'd like to search for events.,INFORM_INTENT,,
11_00024,SYSTEM,What city should I search in?,REQUEST,,
11_00024,USER,"I'm looking for events in Phoenix, AZ.",INFORM,,
11_00024,SYSTEM,"What kind of events would you like to search for? For example, you can ask to search for Music or Sports.",REQUEST,,
11_00024,USER,I am looking for Sports events.,INFORM,,
11_00024,SYSTEM,There is an Arizona Vs La Dodgers game at Chase Field.,OFFER,,
11_00024,USER,When does it start?,REQUEST,,
11_00024,SYSTEM,It starts at 5:30 pm.,INFORM,,
11_00024,USER,That sounds good to me.,SELECT,,
11_00024,SYSTEM,Would you like to buy tickets?,OFFER_INTENT,,
11_00024,USER,"Maybe later, what day does the game happen?",INFORM_INTENT,NEGATE_INTENT,
11_00024,SYSTEM,The Arizona Vs La Dodgers game at Chase Field happens tomorrow.,OFFER,,
11_00024,USER,What is the address of the venue?,REQUEST,,
11_00024,SYSTEM,The venue is located at 401 East Jefferson Street.,INFORM,,
11_00024,USER,That sounds good - I'd like to buy 4 tickets.,INFORM,INFORM_INTENT,SELECT
11_00024,SYSTEM,To review: You'd like to purchase 4 tickets to tomorrow's Arizona Vs La Dodgers game in Phoenix.,CONFIRM,,
11_00024,USER,"Yes, what is the address of the venue again?",REQUEST,AFFIRM,
11_00024,SYSTEM,The venue is located at 401 East Jefferson Street. Your reservation has been made.,INFORM,NOTIFY_SUCCESS,
11_00024,USER,"That's all I need, thanks.",THANK_YOU,GOODBYE,
11_00024,SYSTEM,Have a great day.,GOODBYE,,
11_00025,USER,I want to take my girlfriend on a date to a concert. Do you have any suggestions?,INFORM,INFORM_INTENT,
11_00025,SYSTEM,Is there a specific city you want the concert to be located at?,REQUEST,,
11_00025,USER,"Yes, I prefer New York City.",INFORM,,
11_00025,SYSTEM,The first of 10 events I've found is Amber Run Brooklyn playing at Warsaw.,OFFER,,INFORM_COUNT
11_00025,USER,I'm looking more for something in the classical genre.,INFORM,REQUEST_ALTS,
11_00025,SYSTEM,Joe Hisaishi playing at Stern Auditorium / Perelman Stage is one of 3 that fall under that category.,OFFER,,INFORM_COUNT
11_00025,USER,That sounds perfect! What days are they playing?,INFORM_INTENT,SELECT,
11_00025,SYSTEM,Joe Hisaishi will be playing at Stern Auditorium / Perelman Stage on March 9th.,OFFER,,
11_00025,USER,"Great, that fits my schedule.",SELECT,,
11_00025,SYSTEM,Is there anything else I can find for you?,REQ_MORE,,
11_00025,USER,I will need a total of 4 tickets.,INFORM,INFORM_INTENT,
11_00025,SYSTEM,So I have 4 tickets to the Joe Hisaishi show in New York on March 9th.,CONFIRM,,
11_00025,USER,"Yes, that what I want!",AFFIRM,,
11_00025,SYSTEM,I have successfully confirmed those reservations for you.,NOTIFY_SUCCESS,,
11_00025,USER,What is the address of the venue they will be playing at?,REQUEST,,
11_00025,SYSTEM,The address is 881 7th Avenue.,INFORM,,
11_00025,USER,"Thank you for all of your help, I appreciate it.",THANK_YOU,,
11_00025,SYSTEM,"No problem, is there anything else I can find for you?",REQ_MORE,,
11_00025,USER,No that is all I needed help with.,NEGATE,THANK_YOU,
11_00025,SYSTEM,Have a wonderful day.,GOODBYE,,
11_00026,USER,I want to look for events in Phoenix.,INFORM,INFORM_INTENT,
11_00026,SYSTEM,What are you into?,REQUEST,,
11_00026,USER,I'm looking for something related to games.,INFORM,,
11_00026,SYSTEM,I found 10 events. There's Arizona vs LA Dodgers at Chase Field.,OFFER,,INFORM_COUNT
11_00026,USER,When does it start?,REQUEST,,
11_00026,SYSTEM,It starts at 5:30 pm.,INFORM,,
11_00026,USER,Sounds good.,SELECT,,
11_00026,SYSTEM,Do you want to buy tickets for the event?,OFFER_INTENT,,
11_00026,USER,"Maybe later, I'm interested in more dates for events.",INFORM_INTENT,NEGATE_INTENT,
11_00026,SYSTEM,There's an event tomorrow. It's Arizona vs la dodgers at chase field.,OFFER,,
11_00026,USER,When does it start?,REQUEST,,
11_00026,SYSTEM,At 5:30 pm.,INFORM,,
11_00026,USER,"Sounds good, i'll take three tickets.",INFORM,INFORM_INTENT,SELECT
11_00026,SYSTEM,"Just to confirm, you want 3 tickets for tomorrow for the Arizona vs la dodgers game in phoenix?",CONFIRM,,
11_00026,USER,Yes.,AFFIRM,,
11_00026,SYSTEM,It's been reserved,NOTIFY_SUCCESS,,
11_00026,USER,Where's it located?,REQUEST,,
11_00026,SYSTEM,It's on 401 East Jefferson Street.,INFORM,,
11_00026,USER,"Thanks, that's everything.",THANK_YOU,GOODBYE,
11_00026,SYSTEM,Have a good day.,GOODBYE,,
11_00027,USER,I'm looking for something to do.,INFORM_INTENT,,
11_00027,SYSTEM,"Is there any event you have in min, like Music or Sports? What city should I look in?",REQUEST,,
11_00027,USER,I'd like some Music in Philly next Monday.,INFORM,,
11_00027,SYSTEM,There are 5 events that will work. One is Blueface at The Fillmore Philadelphia.,OFFER,,INFORM_COUNT
11_00027,USER,That works.,SELECT,,
11_00027,SYSTEM,Do you want to buy the tickets?,OFFER_INTENT,,
11_00027,USER,Not right now.,NEGATE_INTENT,,
11_00027,SYSTEM,Is there anything else I can help with?,REQ_MORE,,
11_00027,USER,I want the dates for the events.,INFORM_INTENT,,
11_00027,SYSTEM,Blueface at The Fillmore Philadelphia is on next Monday.,OFFER,,
11_00027,USER,What's the address? When does it start?,REQUEST,,
11_00027,SYSTEM,It starts at 5:30 pm at 29 East Allen Street.,INFORM,,
11_00027,USER,"Ok, let's do that. Buy me 1 ticket.",INFORM,INFORM_INTENT,SELECT
11_00027,SYSTEM,You want 1 ticket for Blueface in Philadelphia next Monday?,CONFIRM,,
11_00027,USER,Yes please.,AFFIRM,,
11_00027,SYSTEM,I've made your reservation.,NOTIFY_SUCCESS,,
11_00027,USER,Thanks for the help. That's all for now.,THANK_YOU,GOODBYE,
11_00027,SYSTEM,Have a great day.,GOODBYE,,
11_00028,USER,I'm looking for events.,INFORM_INTENT,,
11_00028,SYSTEM,Is there a preferred day?,REQUEST,,
11_00028,USER,I know I want to look in New York.,INFORM,,
11_00028,SYSTEM,"Would you like a Music, Sports or other event type?",REQUEST,,
11_00028,USER,Music on the 2nd of March.,INFORM,,
11_00028,SYSTEM,I found Amber Run Brooklyn in Warsaw.,OFFER,,
11_00028,USER,"I am also looking for any type of event in Phoenix, AZ.",INFORM,,REQUEST_ALTS
11_00028,SYSTEM,Anberlin at The Van Buren is 1 of 4 events.,OFFER,,INFORM_COUNT
11_00028,USER,Anberlin is fine what are the dates.,INFORM_INTENT,SELECT,
11_00028,SYSTEM,"It is a 1 day event, tomorrow, at The Van Buren called the Anberlin.",OFFER,,
11_00028,USER,What time does it begin?,REQUEST,,
11_00028,SYSTEM,It starts at 7:30 pm.,INFORM,,
11_00028,USER,Great. I want to purchase 1 ticket.,INFORM,INFORM_INTENT,SELECT
11_00028,SYSTEM,So I am purchasing 1 ticket for Anberlin tomorrow in Phoenix.,CONFIRM,,
11_00028,USER,Exactly.,AFFIRM,,
11_00028,SYSTEM,You have a reservation.,NOTIFY_SUCCESS,,
11_00028,USER,You're the best. I don't need anything else right now.,THANK_YOU,GOODBYE,
11_00028,SYSTEM,Enjoy the day and the event.,GOODBYE,,
11_00029,USER,Let me search for things to do.,INFORM_INTENT,,
11_00029,SYSTEM,Which city interests you? What kind of event?,REQUEST,,
11_00029,USER,I'm into Music in the San Diego area.,INFORM,,
11_00029,SYSTEM,Here are 10 events you might like. One is Alejandro Sanz which takes place at Cal Coast Credit Union Amphitheater.,OFFER,,INFORM_COUNT
11_00029,USER,That sounds great. What dates is it on?,INFORM_INTENT,SELECT,
11_00029,SYSTEM,On 7 different days. One is next Monday. It's Alejandro Sanz at the Cal Coast Credit Union Amphitheater.,OFFER,,
11_00029,USER,And where is that venue?,REQUEST,,
11_00029,SYSTEM,It's at 5500 Campanile Drive.,INFORM,,
11_00029,USER,"Okay, that sounds great. I want to go ahead and buy 1 ticket.",INFORM,INFORM_INTENT,SELECT
11_00029,SYSTEM,Can you confirm: the event is Alejandro Sanz. You want 1 ticket. The event is happening next Monday in San Diego.,CONFIRM,,
11_00029,USER,Can I change that to four tickets?,INFORM,NEGATE,
11_00029,SYSTEM,Please confirm: 4 tickets at the event in San Diego.,CONFIRM,,
11_00029,USER,"Yes, that's right. What time does the event start, and where is it situated?",REQUEST,,AFFIRM
11_00029,SYSTEM,Your booking is complete. The music starts at 5:30 pm. And the venue is 5500 Campanile Drive.,INFORM,,NOTIFY_SUCCESS
11_00029,USER,Thank you so much for your help. That's all I wanted.,THANK_YOU,GOODBYE,
11_00029,SYSTEM,Have a splendid day.,GOODBYE,,
11_00030,USER,I would like to find some events.,INFORM_INTENT,,
11_00030,SYSTEM,Which city are you trying to find events in?,REQUEST,,
11_00030,USER,I'm looking for events in Chi-town.,INFORM,,
11_00030,SYSTEM,Do you prefer specific type of events like Music or Sports?,REQUEST,,
11_00030,USER,I am interested in Country Music events.,INFORM,,
11_00030,SYSTEM,There is a Billy Currington event at Gallagher Way.,OFFER,,
11_00030,USER,That sounds good to me.,SELECT,,
11_00030,SYSTEM,Is there anything else I can assist you with?,REQ_MORE,,
11_00030,USER,Can you help me with the dates for that event?,INFORM_INTENT,,
11_00030,SYSTEM,The Billy Currington event is scheduled for today at Gallagher Way.,OFFER,,
11_00030,USER,What is the address of the venue and when does the event start?,REQUEST,,
11_00030,SYSTEM,The venue is located at 3635 North Clark Street and the event starts at 6:30 pm.,INFORM,,
11_00030,USER,Thank you. I would like to buy tickets for the event.,INFORM_INTENT,SELECT,
11_00030,SYSTEM,How many tickets do you need?,REQUEST,,
11_00030,USER,I want just one ticket.,INFORM,,
11_00030,SYSTEM,"Please confirm that you want 1 ticket for the Billy Currington event to be held later today, at Chicago.",CONFIRM,,
11_00030,USER,"Yes, that's correct.",AFFIRM,,
11_00030,SYSTEM,Your ticket has been successfully booked.,NOTIFY_SUCCESS,,
11_00030,USER,Thank you for the help. That's all I need for now.,THANK_YOU,GOODBYE,
11_00030,SYSTEM,Have a great day!,GOODBYE,,
11_00031,USER,I wanna search for something to do.,INFORM_INTENT,,
11_00031,SYSTEM,"What are you looking for, exactly? Any preference on the city I should look in?",REQUEST,,
11_00031,USER,"I am looking for Music, in Napa. Some Blues could be nice.",INFORM,,
11_00031,SYSTEM,I found 2 events which might suit your taste. The event is called Jon B and it is at Blue Note Napa.,OFFER,,INFORM_COUNT
11_00031,USER,"Can you find me something else, please?",REQUEST_ALTS,,
11_00031,SYSTEM,"Another event's name is Water Seed, and it is at Blue Note Napa.",OFFER,,
11_00031,USER,When does it start? And where is it located?,REQUEST,,
11_00031,SYSTEM,"The event begins at 5:30 pm, and it's located at 1030 Main Street.",INFORM,,
11_00031,USER,That sounds good to me.,SELECT,,
11_00031,SYSTEM,Do you want me to buy tickets for this event?,OFFER_INTENT,,
11_00031,USER,Not right now. I'd like to know the dates for events.,INFORM_INTENT,NEGATE_INTENT,
11_00031,SYSTEM,"I found the event on 6 days. The event is on day after tomorrow, it's called Water Seed and it is at Blue Note Napa.",OFFER,,
11_00031,USER,Sounds good to me. I want to buy one ticket.,INFORM,INFORM_INTENT,SELECT
11_00031,SYSTEM,"Please confirm the details. The event is at Water Seed. The number of tickets is 1. The event takes place on day after tomorrow, and it is in Napa.",CONFIRM,,
11_00031,USER,"Yep, sounds good to me.",AFFIRM,,
11_00031,SYSTEM,Your reservation is confirmed.,NOTIFY_SUCCESS,,
11_00031,USER,Thanks a lot! That's everything for now.,THANK_YOU,GOODBYE,
11_00031,SYSTEM,Have a good one!,GOODBYE,,
11_00032,USER,What are the events for tomorrow?,INFORM,INFORM_INTENT,
11_00032,SYSTEM,What city are you looking for?,REQUEST,,
11_00032,USER,"I'd like events in Sacramento, CA?",INFORM,,
11_00032,SYSTEM,What do you like to do?,REQUEST,,
11_00032,USER,I'm looking for sporting match.,INFORM,,
11_00032,SYSTEM,They have a game between Republic vs Toros at Papa Murphy's Park.,OFFER,,
11_00032,USER,I'd like that. What days is that available?,INFORM_INTENT,SELECT,
11_00032,SYSTEM,I found an event on 1 day. They have a game between Republic vs Toros at Papa Murphy's Park tomorrow.,OFFER,,
11_00032,USER,Where is it located?,REQUEST,,
11_00032,SYSTEM,It's at 1600 Exposition Boulevard.,INFORM,,
11_00032,USER,That's good. I'd like to buy tickets to it.,INFORM_INTENT,SELECT,
11_00032,SYSTEM,How many tickets would you like?,REQUEST,,
11_00032,USER,I'd like 4 tickets.,INFORM,,
11_00032,SYSTEM,You'd like 4 tickets to the Republic vs Toros game tomorrow in Sacramento?,CONFIRM,,
11_00032,USER,Yes. That's great!,AFFIRM,,
11_00032,SYSTEM,"Okay, it's all set.",NOTIFY_SUCCESS,,
11_00032,USER,Thanks! That's all I'd like.,THANK_YOU,GOODBYE,
11_00032,SYSTEM,Have a nice day!,GOODBYE,,
11_00033,USER,I would like to find Music events.,INFORM,INFORM_INTENT,
11_00033,SYSTEM,What city would you like to search in?,REQUEST,,
11_00033,USER,I am looking for events in San Diego.,INFORM,,
11_00033,SYSTEM,Alejandro Sanz will be at Cal Coast Credit Union Amphitheater.,OFFER,,
11_00033,USER,"Can you find me some other events, please? I would like to look in SF for something on the 8th of March.",INFORM,,REQUEST_ALTS
11_00033,SYSTEM,I found 3 events for you. Carmina Burana will be performed at the San Francisco Symphony.,OFFER,,INFORM_COUNT
11_00033,USER,That sounds good. What are some of the dates for this event?,INFORM_INTENT,SELECT,
11_00033,SYSTEM,Carmina Burana will be at the San Francisco Symphony next Friday.,OFFER,,
11_00033,USER,That sounds good.,SELECT,,
11_00033,SYSTEM,Would you like to buy tickets?,OFFER_INTENT,,
11_00033,USER,"Yes, I want 4 tickets.",AFFIRM_INTENT,INFORM,
11_00033,SYSTEM,"You would like 4 tickets for Carmina Burana in San Francisco next Friday, is this correct.",CONFIRM,,
11_00033,USER,"No, I want three tickets.",INFORM,NEGATE,
11_00033,SYSTEM,"You would like 3 tickets for next Friday, is this correct?",CONFIRM,,
11_00033,USER,"Yes, that sounds great.",AFFIRM,,
11_00033,SYSTEM,Your reservation has been made.,NOTIFY_SUCCESS,,
11_00033,USER,When does the show start? What is the address of the venue?,REQUEST,,
11_00033,SYSTEM,The event starts at 7:30 pm. The venue is located at 201 Van Ness Avenue.,INFORM,,
11_00033,USER,Thanks for your help. That's all I need.,THANK_YOU,GOODBYE,
