dialogue_id,speaker,turn,act_1,act_2,act_3
32_00083,SYSTEM,"Please confirm these details: you want to transfer $1,580 from your checking account to Srinivas' checking account.",CONFIRM,,
32_00083,USER,Correct.,AFFIRM,,
32_00083,SYSTEM,The money has been successfully transferred.,NOTIFY_SUCCESS,,
32_00083,USER,Thank you. I'd like to check my balance again.,INFORM_INTENT,THANK_YOU,
32_00083,SYSTEM,"The balance for your checking account is $8,154.66.",OFFER,,
32_00083,USER,Sounds good.,SELECT,,
32_00083,SYSTEM,Can I help you with anything else?,REQ_MORE,,
32_00083,USER,"No, that will be all.",NEGATE,THANK_YOU,
32_00083,SYSTEM,Have a nice day.,GOODBYE,,
32_00084,USER,Can you check my bank balance?,INFORM_INTENT,,
32_00084,SYSTEM,"Sure, savings or checking?",REQUEST,,
32_00084,USER,I need to check my checking account,INFORM,,
32_00084,SYSTEM,"You have $22,116.23 in your checking account",OFFER,,
32_00084,USER,"Ok, what about my savings account?",INFORM,REQUEST_ALTS,
32_00084,SYSTEM,"You have $20,001.74 in your savings account",OFFER,,
32_00084,USER,"Great, thank you",SELECT,,
32_00084,SYSTEM,Did you want to make a transfer?,OFFER_INTENT,,
32_00084,USER,"Yes, can you transfer 1,090 bucks into their savings?",AFFIRM_INTENT,INFORM,
32_00084,SYSTEM,Where should I transfer the money too?,REQUEST,,
32_00084,USER,Can you send it to Raghav?,INFORM,,
32_00084,SYSTEM,"Just to confirm, you want to transfer $1,090 from your savings to Raghav?",CONFIRM,,
32_00084,USER,That is correct,AFFIRM,,
32_00084,SYSTEM,"Ok, that transfer was a success",NOTIFY_SUCCESS,,
32_00084,USER,"Thanks, what is my balance?",INFORM_INTENT,THANK_YOU,
32_00084,SYSTEM,"Your current balance in your savings account is $18,911.74",OFFER,,
32_00084,USER,"Great, thanks you for your help",SELECT,GOODBYE,
32_00084,SYSTEM,"Great, have a good day",GOODBYE,,
32_00085,USER,I want to check my balance,INFORM_INTENT,,
32_00085,SYSTEM,Do you want me to check your checking or savings?,REQUEST,,
32_00085,USER,My savings account please,INFORM,,
32_00085,SYSTEM,"Your savings account has a balance of $14,496.79",OFFER,,
32_00085,USER,Ok got it,SELECT,,
32_00085,SYSTEM,Is there anything else?,REQ_MORE,,
32_00085,USER,Can you trasfer 760 bucks for me,INFORM,INFORM_INTENT,
32_00085,SYSTEM,Where would you like it transferred to?,REQUEST,,
32_00085,USER,Send it to Sanuj's savings account,INFORM,,
32_00085,SYSTEM,Confiriming a $760 transfer from your savings account to Sanuj's savings account.,CONFIRM,,
32_00085,USER,Yes that's right,AFFIRM,,
32_00085,SYSTEM,Your transfer is done,NOTIFY_SUCCESS,,
32_00085,USER,Now check my balance,INFORM_INTENT,,
32_00085,SYSTEM,"Your savings now has a balance of $13,736.79",OFFER,,
32_00085,USER,Algiht that's good,SELECT,,
32_00085,SYSTEM,Anything else I can do?,REQ_MORE,,
32_00085,USER,"No that's all, thanks",NEGATE,THANK_YOU,
32_00085,SYSTEM,Have a great day,GOODBYE,,
32_00086,USER,I want to see my balance.,INFORM_INTENT,,
32_00086,SYSTEM,Should I use the checking or the savings account?,REQUEST,,
32_00086,USER,I would rather see my savings balance.,INFORM,,
32_00086,SYSTEM,"You have $20,262.81 in your savings account.",OFFER,,
32_00086,USER,Ok.,SELECT,,
32_00086,SYSTEM,Is there anything else,REQ_MORE,,
32_00086,USER,I want to transfer to Amir.,INFORM,INFORM_INTENT,
32_00086,SYSTEM,How much would you like to transfer?,REQUEST,,
32_00086,USER,I want to transfer $950 to their checking account.,INFORM,,
32_00086,SYSTEM,"Just to confirm, you want to send Amir $950 from your savings account, into their checking account?",CONFIRM,,
32_00086,USER,Yes.,AFFIRM,,
32_00086,SYSTEM,It was successful.,NOTIFY_SUCCESS,,
32_00086,USER,Thanks. Can I see my balance?,INFORM_INTENT,THANK_YOU,
32_00086,SYSTEM,"Your savings account has $19,312.81.",OFFER,,
32_00086,USER,Ok.,SELECT,,
32_00086,SYSTEM,Is there anything else you need help with?,REQ_MORE,,
32_00086,USER,"No, I'm okay thanks.",NEGATE,THANK_YOU,
32_00086,SYSTEM,Have a great day.,GOODBYE,,
32_00087,USER,Can you tell me how much money I have in my checking account?,INFORM,INFORM_INTENT,
32_00087,SYSTEM,"Your checking account balance is $20,179.68.",OFFER,,
32_00087,USER,Thank you. Can you tell me how much money I have in my savings account?,INFORM,REQUEST_ALTS,
32_00087,SYSTEM,"Your savings account balance is $18,787.86.",OFFER,,
32_00087,USER,"Thank you. I'd like to send transfer some money to my friend, Sanuj.",INFORM,INFORM_INTENT,SELECT
32_00087,SYSTEM,Okay. How much money would you like to transfer?,REQUEST,,
32_00087,USER,I'd like to transfer 450 bucks.,INFORM,,
32_00087,SYSTEM,Okay. Let's review your pending transfer: you'd like to transfer $450 from your savings account to Sanuj's checking account. Is that correct?,CONFIRM,,
32_00087,USER,"Yes, that's correct.",AFFIRM,,
32_00087,SYSTEM,Great. Your transfer is complete.,NOTIFY_SUCCESS,,
32_00087,USER,May I check my balance?,INFORM_INTENT,,
32_00087,SYSTEM,"Your savings account balance is $18,337.86.",OFFER,,
32_00087,USER,Thank you for your help.,SELECT,,
32_00087,SYSTEM,You're welcome. Would you like my help with anything else?,REQ_MORE,,
32_00087,USER,"No, that's all.",NEGATE,THANK_YOU,
32_00087,SYSTEM,Thank you for using our system. Have a wonderful day!,GOODBYE,,
32_00088,USER,I want to know my balance in the checking account.,INFORM,INFORM_INTENT,
32_00088,SYSTEM,"Your current balance is $4,503.52 in your checking account.",OFFER,,
32_00088,USER,Okay. What about my savings account?,INFORM,REQUEST_ALTS,
32_00088,SYSTEM,"Your current balance is $8,474.18 in your savings account.",OFFER,,
32_00088,USER,Alright.,SELECT,,
32_00088,SYSTEM,Would you like to make a transfer?,OFFER_INTENT,,
32_00088,USER,"Yes, I would like to make a transfer to Xiaoxue.",AFFIRM_INTENT,INFORM,
32_00088,SYSTEM,How much would you want to tranfer?,REQUEST,,
32_00088,USER,"860 bucks, please.",INFORM,,
32_00088,SYSTEM,Do you seriously want to transfer $860 from your savings account to Xiaoxue in their checking account?,CONFIRM,,
32_00088,USER,Yes. That's correct.,AFFIRM,,
32_00088,SYSTEM,Your transfer is now complete.,NOTIFY_SUCCESS,,
32_00088,USER,Thanks! What's the current balance now?,INFORM_INTENT,THANK_YOU,
32_00088,SYSTEM,"The balance is $7,614.18 in your savings account.",OFFER,,
32_00088,USER,Okay. Thank you for your help!,SELECT,GOODBYE,
32_00088,SYSTEM,Have a great day!,GOODBYE,,
32_00089,USER,I need to know about my savings account. Would you please check my current balance?,INFORM,INFORM_INTENT,
32_00089,SYSTEM,"Sure. The current balance in your savings account is $12,012.66.",OFFER,,
32_00089,USER,"Thank you. Now, please get me the balance in my checking account.",INFORM,REQUEST_ALTS,
32_00089,SYSTEM,"The balance in your checking account is $9,376.73.",OFFER,,
32_00089,USER,"Okay, Thanks.",SELECT,,
32_00089,SYSTEM,Would you like to make a transfer from one of your accounts at this time?,OFFER_INTENT,,
32_00089,USER,Yes. Please transfer 960 dollars to my checking account.,AFFIRM_INTENT,INFORM,
32_00089,SYSTEM,Who do you want to send money to?,REQUEST,,
32_00089,USER,Please withdraw a transfer of $640 and send it to Srinivas.,INFORM,,
32_00089,SYSTEM,All right. I'm transferring $640 from your checking account to Srinivas' checking account. Shall I confirm?,CONFIRM,,
32_00089,USER,"Yes, please confirm",AFFIRM,,
32_00089,SYSTEM,Your transfer has been completed.,NOTIFY_SUCCESS,,
32_00089,USER,"Great, now please give me my new balance.",INFORM_INTENT,,
32_00089,SYSTEM,"The current balance in your checking account is $8,736.73.",OFFER,,
32_00089,USER,"Okay, thank you.",SELECT,,
32_00089,SYSTEM,Is there any other assistance you need at this time?,REQ_MORE,,
32_00089,USER,"Nope, that's all I need for now. Thank you.",NEGATE,THANK_YOU,
32_00089,SYSTEM,My pleasure. Enjoy your day.,GOODBYE,,
32_00090,USER,I want to see my savings account balance.,INFORM,INFORM_INTENT,
32_00090,SYSTEM,"Your savings account balance is $21,254.82.",OFFER,,
32_00090,USER,Alright.,SELECT,,
32_00090,SYSTEM,Do you want to make a transfer?,OFFER_INTENT,,
32_00090,USER,"Yes, I would like transfer money into their checking account.",AFFIRM_INTENT,INFORM,
32_00090,SYSTEM,Who do want to send money to?,REQUEST,,
32_00090,USER,To Abhinav.,INFORM,,
32_00090,SYSTEM,How much would you like to transfer?,REQUEST,,
32_00090,USER,Transfer $520 to Xiaoxue.,INFORM,,
32_00090,SYSTEM,Please confirm the transfer details: a transfer of $520 from your savings account to Xiaoxue in their checking account.,CONFIRM,,
32_00090,USER,Yes please.,AFFIRM,,
32_00090,SYSTEM,Your transfer was successful.,NOTIFY_SUCCESS,,
32_00090,USER,Thank you. I want see my balance again.,INFORM_INTENT,THANK_YOU,
32_00090,SYSTEM,"Your savings account balance is $20,734.82.",OFFER,,
32_00090,USER,Alright.,SELECT,,
32_00090,SYSTEM,May I help you with something else?,REQ_MORE,,
32_00090,USER,No thanks.,NEGATE,THANK_YOU,
32_00090,SYSTEM,Have an excellent day.,GOODBYE,,
32_00091,USER,Can you check my balance for me?,INFORM_INTENT,,
32_00091,SYSTEM,Which account would you like to check the balance of?,REQUEST,,
32_00091,USER,My checking account.,INFORM,,
32_00091,SYSTEM,"The balance of your checking account is $5,459.64.",OFFER,,
32_00091,USER,How about my savings account?,INFORM,REQUEST_ALTS,
32_00091,SYSTEM,"The balance of your savings account is $19,746.79.",OFFER,,
32_00091,USER,"Hmm, alright. Let me make a transfer of 1,050 bucks.",INFORM,INFORM_INTENT,SELECT
32_00091,SYSTEM,Who would you like to send the money to?,REQUEST,,
32_00091,USER,Send it to my pal Raghav,INFORM,,
32_00091,SYSTEM,"Please confirm the following: Transfer $1,050 from my savings account to Raghav's checking account.",CONFIRM,,
32_00091,USER,Yes I confirm.,AFFIRM,,
32_00091,SYSTEM,Your transfer was successfully completed.,NOTIFY_SUCCESS,,
32_00091,USER,Thank you. Can you check the balance again for me now?,INFORM_INTENT,THANK_YOU,
32_00091,SYSTEM,"The balance of your savings account is $18,696.79.",OFFER,,
32_00091,USER,"Okay, nice.",SELECT,,
32_00091,SYSTEM,Would there be anything else that I could assist you with?,REQ_MORE,,
32_00091,USER,"No, that will be all. Thank you.",NEGATE,THANK_YOU,
32_00091,SYSTEM,No problem. Goodbye.,GOODBYE,,
32_00092,USER,I'd like to check my balance.,INFORM_INTENT,,
32_00092,SYSTEM,For which account?,REQUEST,,
32_00092,USER,"My savings account, please.",INFORM,,
32_00092,SYSTEM,"The balance in your savings account is $7,169.13.",OFFER,,
32_00092,USER,Can you also check the balance for my checking account?,INFORM,REQUEST_ALTS,
32_00092,SYSTEM,"The balance in your checking account is $24,521.74",OFFER,,
32_00092,USER,Sounds good.,SELECT,,
32_00092,SYSTEM,Did you want to make a transfer?,OFFER_INTENT,,
32_00092,USER,"Yes, please.",AFFIRM_INTENT,,
32_00092,SYSTEM,"How much would you like to transfer, and to who?",REQUEST,,
32_00092,USER,Please transfer 170 dollars to Abhinav.,INFORM,,
32_00092,SYSTEM,Please confirm the following: you'd like to transfer $170 from your checking account to Abhinav's checking account.,CONFIRM,,
32_00092,USER,Correct.,AFFIRM,,
32_00092,SYSTEM,The transfer was successful.,NOTIFY_SUCCESS,,
32_00092,USER,Please check my balance again.,INFORM_INTENT,,
32_00092,SYSTEM,"The balance of your checking account is $24,351.74.",OFFER,,
32_00092,USER,"Sounds good, thank you.",SELECT,GOODBYE,
32_00092,SYSTEM,Have a nice day.,GOODBYE,,
32_00093,USER,I nee to check my balance.,INFORM_INTENT,,
32_00093,SYSTEM,Would you like to see your checking or savings account balance?,REQUEST,,
32_00093,USER,my savings account.,INFORM,,
32_00093,SYSTEM,"$7,885.53 is available in your savings account.",OFFER,,
32_00093,USER,ok,SELECT,,
32_00093,SYSTEM,Would you like to transfer some funds?,OFFER_INTENT,,
32_00093,USER,Yes I would.,AFFIRM_INTENT,,
32_00093,SYSTEM,What amount would you like to send and who would you like to send them to?,REQUEST,,
32_00093,USER,Send $640 to Xiaoxue and deposit into their checking account.,INFORM,,
32_00093,SYSTEM,Sending $640 from savings to Xiaoxue and deposit into their checking account. Is that correct?,CONFIRM,,
32_00093,USER,Yes.,AFFIRM,,
32_00093,SYSTEM,Your transfer is successful.,NOTIFY_SUCCESS,,
32_00093,USER,Thanks. What is my new balance?,INFORM_INTENT,THANK_YOU,
32_00093,SYSTEM,"$7,245.53 is your new savings balance.",OFFER,,
32_00093,USER,Ok.,SELECT,,
32_00093,SYSTEM,Can I help you with something else?,REQ_MORE,,
32_00093,USER,"No, that will be all.",NEGATE,THANK_YOU,
32_00093,SYSTEM,Have an awesome day!,GOODBYE,,
32_00094,USER,Please tell me my checking account balance.,INFORM,INFORM_INTENT,
32_00094,SYSTEM,"The balance in your checking account is $16,173.38",OFFER,,
32_00094,USER,I need to make a transfer for 1770 dollars to Xiaoxue.,INFORM,,INFORM_INTENT
32_00094,SYSTEM,"You want me to transfer $1,770 to Xiaoxue checking account from your checking account.",CONFIRM,,
32_00094,USER,Yes I do.,AFFIRM,,
32_00094,SYSTEM,Done. The transfer was successful.,NOTIFY_SUCCESS,,
32_00094,USER,Thanks. What is my balance?,INFORM_INTENT,THANK_YOU,
32_00094,SYSTEM,"The balance in your checking account is $14,403.38",OFFER,,
32_00094,USER,Thanks.,SELECT,,
32_00094,SYSTEM,Anything Else?,REQ_MORE,,
32_00094,USER,No. I am all set.,NEGATE,THANK_YOU,
32_00094,SYSTEM,Have a nice day.,GOODBYE,,
32_00095,USER,I want to check my savings account balance.,INFORM,INFORM_INTENT,
32_00095,SYSTEM,"Your savings account balance is $20,237.61.",OFFER,,
32_00095,USER,Ok.,SELECT,,
32_00095,SYSTEM,Do you need to make a transfer?,OFFER_INTENT,,
32_00095,USER,"Yup, I would like to.",AFFIRM_INTENT,,
32_00095,SYSTEM,How much and where will we be sending the money to?,REQUEST,,
32_00095,USER,Send Amir 650 bucks.,INFORM,,
32_00095,SYSTEM,Can you confirm the details: Transfer $650 from your savings to Amir in their checking account.,CONFIRM,,
32_00095,USER,Correct!,AFFIRM,,
32_00095,SYSTEM,The transfer was successful.,NOTIFY_SUCCESS,,
32_00095,USER,What's my balance now?,INFORM_INTENT,,
32_00095,SYSTEM,"You savings balance is $19,587.61.",OFFER,,
32_00095,USER,"Okay, Thanks for the help!",SELECT,GOODBYE,
32_00095,SYSTEM,Have a good day!,GOODBYE,,
32_00096,USER,"I'd like to check my balance; specifically, about my savings account.",INFORM,INFORM_INTENT,
32_00096,SYSTEM,"Your savings account balance is $3,717.38.",OFFER,,
32_00096,USER,Alright; I'd like to transfer to their savings account.,INFORM,INFORM_INTENT,SELECT
32_00096,SYSTEM,"How much would you like to transfer, and to whom do you want to send the money to?",REQUEST,,
32_00096,USER,Transfer 480 bucks to Amir.,INFORM,,
32_00096,SYSTEM,Can you confirm that you want to transfer $480 from your savings account to Amir's savings account?,CONFIRM,,
32_00096,USER,Yeah.,AFFIRM,,
32_00096,SYSTEM,Your transfer was done.,NOTIFY_SUCCESS,,
32_00096,USER,Thanks for helping out. I'd like to check my balance.,INFORM_INTENT,THANK_YOU,
32_00096,SYSTEM,"Your balance in your savings account is $3,237.38",OFFER,,
32_00096,USER,Alright. Thanks for the help.,SELECT,GOODBYE,
32_00096,SYSTEM,Have a pleasant afternoon.,GOODBYE,,
32_00097,USER,I would like to check my balance,INFORM_INTENT,,
32_00097,SYSTEM,To which account should I search in?,REQUEST,,
32_00097,USER,I wanted to the balance in my checking account,INFORM,,
32_00097,SYSTEM,"The balance in your checking account is $21,181.35",OFFER,,
32_00097,USER,Tell me the balance of my savings account.,INFORM,REQUEST_ALTS,
32_00097,SYSTEM,"The balance in your savings account is $10,411.72",OFFER,,
32_00097,USER,I wanted to initiate a fund transfer of three hundred and ten bucks to their savings account,INFORM,,INFORM_INTENT
32_00097,SYSTEM,To whom would you like to send it to?,REQUEST,,
32_00097,USER,Please send it to Raghav,INFORM,,
32_00097,SYSTEM,Please confirm the details: Initiating a fund transfer to Raghav to their savings account for $310 from your saving account.,CONFIRM,,
32_00097,USER,yes exactly the same,AFFIRM,,
32_00097,SYSTEM,Your transaction is successful,NOTIFY_SUCCESS,,
32_00097,USER,Thanks a lot for the help. I wanted to know my balance,INFORM_INTENT,THANK_YOU,
32_00097,SYSTEM,"The balance in your savings account is $10,101.72",OFFER,,
32_00097,USER,Okay fine thats great,SELECT,,
32_00097,SYSTEM,Is there anything else I can assist you with?,REQ_MORE,,
32_00097,USER,No Thanks for the help thats all for now,NEGATE,THANK_YOU,
32_00097,SYSTEM,Have a wonderful day ahead,GOODBYE,,
32_00098,USER,Can you tell my savings account balance?,INFORM,INFORM_INTENT,
32_00098,SYSTEM,"You have a balance of $15,243.73 in your savings account.",OFFER,,
32_00098,USER,And how much do I have in checking?,INFORM,REQUEST_ALTS,
32_00098,SYSTEM,"Your checking account has a balance of $18,521.45",OFFER,,
32_00098,USER,"Ok, thank you.",SELECT,,
32_00098,SYSTEM,Would you like to make a transfer?,OFFER_INTENT,,
32_00098,USER,"Yes, please transfer 1320 dollars.",AFFIRM_INTENT,INFORM,
32_00098,SYSTEM,Who would you like to send it to?,REQUEST,,
32_00098,USER,Send it to Abhinav,INFORM,,
32_00098,SYSTEM,"Please confirm: You are sending $1,320 from your checking account to the checking account of Abhinav.",CONFIRM,,
32_00098,USER,"Yes, that is correct.",AFFIRM,,
32_00098,SYSTEM,"Transaction confirmed, your transfer is successful.",NOTIFY_SUCCESS,,
32_00098,USER,"Can you tell me my remaining balance, please?",INFORM_INTENT,,
32_00098,SYSTEM,"Your checking account has a balance of $17,201.45.",OFFER,,
32_00098,USER,"Ok, thank you very much.",SELECT,GOODBYE,
32_00098,SYSTEM,Have a great day.,GOODBYE,,
32_00099,USER,I would like to check my balance in my account,INFORM_INTENT,,
32_00099,SYSTEM,Which account should I check?,REQUEST,,
32_00099,USER,I would like to know the balance in my checking account.,INFORM,,
32_00099,SYSTEM,"The balance remaining in your checking account is $21,248.89.",OFFER,,
32_00099,USER,I understand.,SELECT,,
32_00099,SYSTEM,Would you like to make a transaction?,OFFER_INTENT,,
32_00099,USER,"Yes, I would like to transfer money to Maria.",AFFIRM_INTENT,INFORM,
32_00099,SYSTEM,What is the amount you would like to transfer?,REQUEST,,
32_00099,USER,Please transfer $600.,INFORM,,
32_00099,SYSTEM,Please confirm if the following details are correct: I would like to transfer $600 from my checking account to Maria checking account.,CONFIRM,,
32_00099,USER,That is correct.,AFFIRM,,
32_00099,SYSTEM,Your transfer was successful.,NOTIFY_SUCCESS,,
32_00099,USER,"Thanks for your assistance, now I would like to check my remaining balance if possible.",INFORM_INTENT,THANK_YOU,
32_00099,SYSTEM,"The balance in your checking account consists of $20,648.89",OFFER,,
32_00099,USER,"I see, thanks for your assistance.",SELECT,GOODBYE,
32_00099,SYSTEM,Have a great day.,GOODBYE,,
32_00100,USER,I want to check my savings account balance,INFORM,INFORM_INTENT,
32_00100,SYSTEM,"The balance of your savings account is $18,282.90",OFFER,,
32_00100,USER,Tell my the balance of my checking account,INFORM,REQUEST_ALTS,
32_00100,SYSTEM,"The balance of your checking account is $11,142.38",OFFER,,
32_00100,USER,ok,SELECT,,
32_00100,SYSTEM,Do you ant to make a transfer?,OFFER_INTENT,,
32_00100,USER,Please make transfer to checking account,AFFIRM_INTENT,INFORM,
32_00100,SYSTEM,how much would you like to transfer,REQUEST,,
32_00100,USER,i want to transfer $630,INFORM,,
32_00100,SYSTEM,Who are you sending the money to?,REQUEST,,
32_00100,USER,Please send it to Sanuj,INFORM,,
32_00100,SYSTEM,Please confirm the transfer of $630 to Sanuj from your checking account to his checking account,CONFIRM,,
32_00100,USER,Yes please,AFFIRM,,
32_00100,SYSTEM,done,NOTIFY_SUCCESS,,
32_00100,USER,Please check my balance again,INFORM_INTENT,,
32_00100,SYSTEM,"The balance of your checking account is $10,512.38",OFFER,,
32_00100,USER,Ok thanks,SELECT,GOODBYE,
32_00100,SYSTEM,Have a nice day,GOODBYE,,
32_00101,USER,I need to check my balance.,INFORM_INTENT,,
32_00101,SYSTEM,What account do you want?,REQUEST,,
32_00101,USER,I want to look at my checking account.,INFORM,,
32_00101,SYSTEM,"You have $21,630.40 in your checking account.",OFFER,,
32_00101,USER,I want to transfer some money.,INFORM_INTENT,SELECT,
32_00101,SYSTEM,To whom are you transferring money to?,REQUEST,,
32_00101,USER,I want to send money to Pranav.,INFORM,,
32_00101,SYSTEM,How much are you sending?,REQUEST,,
32_00101,USER,Send $430 to Srinivas.,INFORM,,
32_00101,SYSTEM,You want to send $430 to Srinivas from your checking account to their checking account. Is that right?,CONFIRM,,
32_00101,USER,That is correct.,AFFIRM,,
32_00101,SYSTEM,The transfer is complete.,NOTIFY_SUCCESS,,
32_00101,USER,Thanks a lot.,THANK_YOU,,
32_00101,SYSTEM,Do you need anything else?,REQ_MORE,,
32_00101,USER,Can you check my balance.,INFORM_INTENT,,
32_00101,SYSTEM,"Your new balance in your checking account is $21,200.40.",OFFER,,
32_00101,USER,Thanks a lot.,SELECT,GOODBYE,
32_00101,SYSTEM,Have a good day.,GOODBYE,,
32_00102,USER,I want to see my balance,INFORM_INTENT,,
32_00102,SYSTEM,On your checking or savings account?,REQUEST,,
32_00102,USER,My savings account,INFORM,,
32_00102,SYSTEM,"That account has $20,985.66 in savings",OFFER,,
32_00102,USER,Okay. I want to transfer it 2 xiaoxue and to their savings,INFORM,,INFORM_INTENT
32_00102,SYSTEM,How much did you want to transfer?,REQUEST,,
32_00102,USER,"$1,600 in all",INFORM,,
32_00102,SYSTEM,"Please confirm the following. Transfer $1,600 from your savings to the savings account of xiaoxue",CONFIRM,,
32_00102,USER,Yeah,AFFIRM,,
32_00102,SYSTEM,The transfer is complete,NOTIFY_SUCCESS,,
32_00102,USER,Okay thanks for all your help. Now let me check my balance again,INFORM_INTENT,THANK_YOU,
32_00102,SYSTEM,"Your balance is $19,385.66 in savings",OFFER,,
32_00102,USER,Okay thanks for the help,SELECT,GOODBYE,
32_00102,SYSTEM,Have a great day,GOODBYE,,
32_00103,USER,I want to check my savings account balance.,INFORM,INFORM_INTENT,
32_00103,SYSTEM,"Your savings account balance is $5,250.80.",OFFER,,
32_00103,USER,Ok. I want to make a transfer of 320 bucks. Send it to Sanuj.,INFORM,,INFORM_INTENT
32_00103,SYSTEM,Please confirm the following details: Transfer $320 from your savings account to Sanuj's checking account.,CONFIRM,,
32_00103,USER,Yes.,AFFIRM,,
32_00103,SYSTEM,Your transfer was successful.,NOTIFY_SUCCESS,,
32_00103,USER,Thank you. I'd like to check my new balance.,INFORM_INTENT,THANK_YOU,
32_00103,SYSTEM,"Your savings account balance is now $4,930.80.",OFFER,,
32_00103,USER,Ok. Thanks for your help.,SELECT,GOODBYE,
32_00103,SYSTEM,Have a great day.,GOODBYE,,
32_00104,USER,I want to check my balance in my checking account.,INFORM,INFORM_INTENT,
32_00104,SYSTEM,"You have a balance of $1,701.42 in your checking account.",OFFER,,
32_00104,USER,"Ok, can I make a transfer?",INFORM_INTENT,SELECT,
32_00104,SYSTEM,"Yes, what amount do you want to transfer?",REQUEST,,
32_00104,USER,Transfer 570 dollars please.,INFORM,,
32_00104,SYSTEM,To whom would you like to send the money?,REQUEST,,
32_00104,USER,"Send it to Srinivas, please.",INFORM,,
32_00104,SYSTEM,Please confirm you would like to do the following: Transfer $570 from my checking account to Srinivas into their checking account.,CONFIRM,,
32_00104,USER,"Yes, please.",AFFIRM,,
32_00104,SYSTEM,Your transfer is successful.,NOTIFY_SUCCESS,,
32_00104,USER,Can I check my new balance?,INFORM_INTENT,,
32_00104,SYSTEM,"The new balance is $1,131.42 in your checking account.",OFFER,,
32_00104,USER,"Ok, thank you.",SELECT,,
32_00104,SYSTEM,Is there anything else I can help you with?,REQ_MORE,,
32_00104,USER,"No, thank you for all your help.",NEGATE,THANK_YOU,
32_00104,SYSTEM,Have a nice day!,GOODBYE,,
32_00105,USER,Hello. I need to check my balance.,INFORM_INTENT,,
32_00105,SYSTEM,Of course! Which account should I use?,REQUEST,,
32_00105,USER,"My savings account, please.",INFORM,,
32_00105,SYSTEM,"No problem. Your savings account balance is $20,394.30.",OFFER,,
32_00105,USER,"Okay, great. I need to make a transfer.",INFORM_INTENT,SELECT,
32_00105,SYSTEM,No problem. Who would you like me to send money to?,REQUEST,,
32_00105,USER,It needs to be sent to Xiaoxue.,INFORM,,
32_00105,SYSTEM,Okay. What amount of money would you like to transfer?,REQUEST,,
32_00105,USER,"Transfer 310 bucks, please.",INFORM,,
32_00105,SYSTEM,"Got it. Can you confirm the following details, please? You are transferring $310 from your savings account to Xiaoxue to their checking account.",CONFIRM,,
32_00105,USER,Yes!,AFFIRM,,
32_00105,SYSTEM,Perfect! Your transfer is successful.,NOTIFY_SUCCESS,,
32_00105,USER,Thanks so much! I want to check my balance now.,INFORM_INTENT,THANK_YOU,
32_00105,SYSTEM,"No problem! Your savings account balance is now $20,084.30.",OFFER,,
32_00105,USER,Okay.,SELECT,,
32_00105,SYSTEM,Is there anything else I can help you with?,REQ_MORE,,
32_00105,USER,"No, that will be all.",NEGATE,THANK_YOU,
32_00105,SYSTEM,Okay. I hope you have a great day!,GOODBYE,,
32_00106,USER,I am trying to check my balance.,INFORM_INTENT,,
32_00106,SYSTEM,Which account would you like me to use?,REQUEST,,
32_00106,USER,Can you tell me about my checking account?,INFORM,,
32_00106,SYSTEM,"You have $13,680.23 in your checking account.",OFFER,,
32_00106,USER,I want to transfer funds.,INFORM_INTENT,SELECT,
32_00106,SYSTEM,How much would you like to transfer? Which account would you like to transfer it to?,REQUEST,,
32_00106,USER,I'd like to transfer 1620 dollars to Srinivas' savings account.,INFORM,,
32_00106,SYSTEM,"Please confirm: You'd like to transfer $1,620 from your checking account to Srinivas' savings account.",CONFIRM,,
32_00106,USER,"Yes, that's correct.",AFFIRM,,
32_00106,SYSTEM,Great. The transfer has been initiated.,NOTIFY_SUCCESS,,
32_00106,USER,What's the balance in my account?,INFORM_INTENT,,
32_00106,SYSTEM,"Your checking account balance is $12,060.23.",OFFER,,
32_00106,USER,"Alrighty, that's good.",SELECT,,
32_00106,SYSTEM,Can I provide assistance with anything else?,REQ_MORE,,
32_00106,USER,"Nope, that's it.",NEGATE,THANK_YOU,
32_00106,SYSTEM,Enjoy the rest of your day.,GOODBYE,,
