dialogue_id,speaker,turn,act_1,act_2,act_3
88_00090,SYSTEM,Please confirm this: Getting ticket for Dodgers Vs Rockies for 2 people on March 4th in Los Angeles,CONFIRM,,
88_00090,USER,Yes thats perfect for me,AFFIRM,,
88_00090,SYSTEM,Your reservation has made. Have a nice time there,NOTIFY_SUCCESS,,
88_00090,USER,Thanks and thats all I need now,THANK_YOU,GOODBYE,
88_00090,SYSTEM,Have a nice day,GOODBYE,,
88_00091,USER,Let's search events in San Francisco please.,INFORM,INFORM_INTENT,
88_00091,SYSTEM,"Ok, I would be happy to do that for you. What kind of events are you in the mood to search?",REQUEST,,
88_00091,USER,"I don't know, but let's start with Remo Drive, I hear it's really good.",INFORM,,
88_00091,SYSTEM,"Sure, I found Remo Drive at The Chapel playing on March 1st.",OFFER,,
88_00091,USER,"Ok, what time does this start?",REQUEST,,
88_00091,SYSTEM,Start time is 5 pm. Are you interested?,INFORM,,
88_00091,USER,"Maybe, give more choices include other dates, please.",REQUEST_ALTS,,
88_00091,SYSTEM,"ok, Remo Drive is at The Chapel on March 2nd.",OFFER,,
88_00091,USER,"Perfect, I would like to reserve a bus to attend this.",SELECT,,
88_00091,SYSTEM,"Sure thing, Please tell me what time would you be interested in leaving? How many tickets would you like? Where will you be departing from?",REQUEST,,
88_00091,USER,"I will require two tickets leaving at 7:15 in the evening, departing from Long Beach.",INFORM,,
88_00091,SYSTEM,Would you like to leave on March 2nd?,REQUEST,,
88_00091,USER,I would like to leave on the 1st of March.,INFORM,,
88_00091,SYSTEM,"Ok, please confirm 2 tickets leaving Long Beach headed to San Francisco. Leaving on March 1st at 7:15 pm, does this sound right?",CONFIRM,,
88_00091,USER,Yes this is correct. Go ahead and book.,AFFIRM,,
88_00091,SYSTEM,"I apologize, I was unable to complete this booking. The bus departs at 7:30 pm and will cost $49 if you are interested in leaving slightly later.",OFFER,,NOTIFY_FAILURE
88_00091,USER,"Ok, let's do that then.",AFFIRM,,
88_00091,SYSTEM,"Great, your booking is confirmed.",NOTIFY_SUCCESS,,
88_00091,USER,Thanks for your help. I would like to finish booking my tickets now please.,INFORM_INTENT,,
88_00091,SYSTEM,"Ok, please confirm 2 tickets on March 2nd in San Francisco to see Remo Drive. Is this correct?",CONFIRM,,
88_00091,USER,"Yes, please get the address for me.",REQUEST,AFFIRM,
88_00091,SYSTEM,"Ok, your reservation is confirmed and the address is 777 Valencia Street.",INFORM,NOTIFY_SUCCESS,
88_00091,USER,What time will the show start?,REQUEST,,
88_00091,SYSTEM,The show has a start time at 6:30 pm.,INFORM,,
88_00091,USER,"Ok, thanks for your help.",THANK_YOU,,
88_00091,SYSTEM,"your welcome, can I assist further?",REQ_MORE,,
88_00091,USER,"Nope, that was all.",NEGATE,THANK_YOU,
88_00091,SYSTEM,"Ok, Have a wonderful day.",GOODBYE,,
88_00092,USER,I want the event The Hives something in San Diego. Please find me some.,INFORM,,INFORM_INTENT
88_00092,SYSTEM,I found an event The Hives on March 4th at The Observatory North Park.,OFFER,,
88_00092,USER,Any other dates for the event?,REQUEST_ALTS,,
88_00092,SYSTEM,I found an event The Hives on March 5th at The Observatory North Park.,OFFER,,
88_00092,USER,What time it will start?,REQUEST,,
88_00092,SYSTEM,At 6 pm.,INFORM,,
88_00092,USER,Where is it located?,REQUEST,,
88_00092,SYSTEM,At 2891 University Avenue.,INFORM,,
88_00092,USER,"I want Usc Vs Oregon in LA, can you help me find other events?",INFORM,,REQUEST_ALTS
88_00092,SYSTEM,I found 4 events and one is Usc Vs Oregon on March 7th at LA Memorial Coliseum.,OFFER,,
88_00092,USER,Good. Please help me get a bus going there leaving at 4 pm.,SELECT,,
88_00092,SYSTEM,Where you coming from and how many tickets?,REQUEST,,
88_00092,USER,Just for four people and I am coming from Fresno.,INFORM,,
88_00092,SYSTEM,How about leaving at March 7th?,REQUEST,,
88_00092,USER,I want on the 3rd.,INFORM,,
88_00092,SYSTEM,"Okay, you want 4 tickets going to Los Angeles from Fresno on March 3rd and the bus leaves at 4 pm. Please confirm.",CONFIRM,,
88_00092,USER,That's fine.,AFFIRM,,
88_00092,SYSTEM,Ticket confirmed!,NOTIFY_SUCCESS,,
88_00092,USER,Which bus station I am coming from and reaching to?,REQUEST,,
88_00092,SYSTEM,Destination bus is Union Station and origin station is Fresno Station.,INFORM,,
88_00092,USER,Please help me book the ticket for the event.,INFORM_INTENT,,
88_00092,SYSTEM,"Okay, you want 4 tickets for Usc Vs Oregon on March 7th at Los Angeles. Please confirm.",CONFIRM,,
88_00092,USER,Yes. When the event start and where is it located?,REQUEST,,AFFIRM
88_00092,SYSTEM,The venue is located at 3911 Figueroa Street and it will start at 6 pm. Reservation confirmed!,INFORM,,NOTIFY_SUCCESS
88_00092,USER,Thanks for you help.,THANK_YOU,GOODBYE,
88_00092,SYSTEM,Have a good day.,GOODBYE,,
88_00093,USER,I want to know the dates of an event.,INFORM_INTENT,,
88_00093,SYSTEM,"Do you know the event you want to know the dates for? If so, where do you want to search?",REQUEST,,
88_00093,USER,Someone recommended me going to Diamondbacks Vs Mets in Phoenix.,INFORM,,
88_00093,SYSTEM,There are 3 dates that you might like. One date for Diamondbacks Vs Mets is on March 1st at the Chase Field.,OFFER,,
88_00093,USER,What is the address of the place? And at what time does it start?,REQUEST,,
88_00093,SYSTEM,The event starts at 6:30 pm and the address is 401 East Jefferson Street.,INFORM,,
88_00093,USER,When are the other dates? Is there anything for Sounders Vs Red bulls in Seattle?,INFORM,,REQUEST_ALTS
88_00093,SYSTEM,Sounders Vs Red Bulls is taking place on March 3rd at the CenturyLink Field,OFFER,,
88_00093,USER,"That sounds great, I'm going to need a bus to arrive.",SELECT,,
88_00093,SYSTEM,Where wil lyou leave from and how many tickets will you need? Do you plan to leave on March 3rd?,REQUEST,,
88_00093,USER,"No, I will leave one day before. I will be leaving on March 2nd from Portland, OR. I will be needing 3 tickets.",INFORM,,
88_00093,SYSTEM,At what time do you want to leave?,REQUEST,,
88_00093,USER,I want to leave at 6 in the evening.,INFORM,,
88_00093,SYSTEM,Please confirm: Booking 3 bus tickets from Portland to Seattle on March 2nd at 6 pm.,CONFIRM,,
88_00093,USER,I think I will be leaving on the 1st and at 10:15.,INFORM,,NEGATE
88_00093,SYSTEM,Please confirm: Booking 3 bus tickets from Portland to Seattle on March 1st at 10:15 am.,CONFIRM,,
88_00093,USER,That is correct.,AFFIRM,,
88_00093,SYSTEM,"Sorry, there was no match for the tickets. There is a bus that departs at 10:10 am with a price of $28.",OFFER,,NOTIFY_FAILURE
88_00093,USER,That sounds great.,AFFIRM,,
88_00093,SYSTEM,The tickets have been booked.,NOTIFY_SUCCESS,,
88_00093,USER,"Thanks a lot, I want to book the tickets for the event.",INFORM_INTENT,,
88_00093,SYSTEM,Please confirm: Booking 3 tickets for Sounders Vs Red bulls on March 3rd in Seattle.,CONFIRM,,
88_00093,USER,That is correct.,AFFIRM,,
88_00093,SYSTEM,The tickets have been booked.,NOTIFY_SUCCESS,,
88_00093,USER,"Thanks a lot, that would be all.",THANK_YOU,GOODBYE,
88_00093,SYSTEM,Have a great day.,GOODBYE,,
88_00094,USER,I need to find some dates for events.,INFORM_INTENT,,
88_00094,SYSTEM,"What kind of event are you looking for, and what city would you like to be in?",REQUEST,,
88_00094,USER,I'll be in New York - how about something Mets Vs Phillies? I heard there's a game on,INFORM,,
88_00094,SYSTEM,There's a Mets Vs Phillies event at Citi Field on March 4th.,OFFER,,
88_00094,USER,"Great - can you get me a bus there on March 1st, leaving from Philly?",SELECT,,
88_00094,SYSTEM,"Of course, how many tickets?",REQUEST,,
88_00094,USER,"I need 4 tickets, I'm leaving on the 2nd at half past 5 in the evening.",INFORM,,
88_00094,SYSTEM,"To review: You need 4 tickets for a bus leaving from Philadelphia, going to New York, on March 2nd at 5:30 pm?",CONFIRM,,
88_00094,USER,"Yeah, great.",AFFIRM,,
88_00094,SYSTEM,"Alright, those tickets have been reserved.",NOTIFY_SUCCESS,,
88_00094,USER,"Great, ok, so can we go back to the game?",INFORM_INTENT,,
88_00094,SYSTEM,You'd like 4 tickets to the Mets Vs Phillies game on March 4th in New York?,CONFIRM,,
88_00094,USER,"Yeah - what time does it start, and where's the venue?",REQUEST,,AFFIRM
88_00094,SYSTEM,"The venue is at 123-01 Roosevelt Avenue, starting at 5:30 pm - I've booked your tickets.",INFORM,,NOTIFY_SUCCESS
88_00094,USER,"Great, that's everything I need.",THANK_YOU,GOODBYE,
88_00094,SYSTEM,"Have a great time at the game, safe travels.",GOODBYE,,
88_00095,USER,Will you find me events in NYC?,INFORM,INFORM_INTENT,
88_00095,SYSTEM,You interested in anything?,REQUEST,,
88_00095,USER,Yankees Vs Indians.,INFORM,,
88_00095,SYSTEM,Yankees Vs Indians is on 4 days. There's one on March 2nd at Yankee Stadium.,OFFER,,
88_00095,USER,Where's the address? What's the start time?,REQUEST,,
88_00095,SYSTEM,1 East 161 Street at 5:30 pm.,INFORM,,
88_00095,USER,The other dates?,REQUEST_ALTS,,
88_00095,SYSTEM,Yankees Vs Indians on March 4th is at Yankee Stadium.,OFFER,,
88_00095,USER,Will you find Seattle Vs Minnesota in Seattle?,INFORM,,REQUEST_ALTS
88_00095,SYSTEM,I found 4 days. There's Seattle Vs Minnesota at Alaska Airlines Arena on March 3rd.,OFFER,,
88_00095,USER,Sounds good. Will you reserve a bus for three at 6:30 pm?,SELECT,,
88_00095,SYSTEM,Where from? You leaving on March 3rd?,REQUEST,,
88_00095,USER,"March 1st from Vancouver, BC.",INFORM,,
88_00095,SYSTEM,Please confirm 3 tickets on a bus from Vancouver to Seattle on March 1st that leaves at 6:30 pm.,CONFIRM,,
88_00095,USER,Great.,AFFIRM,,
88_00095,SYSTEM,Tickets are reserved.,NOTIFY_SUCCESS,,
88_00095,USER,Thanks. Will you book me tickets?,INFORM_INTENT,,
88_00095,SYSTEM,Please confirm 3 tickets for Seattle Vs Minnesota in Seattle on March 3rd.,CONFIRM,,
88_00095,USER,Sounds good. Address and start time?,REQUEST,,AFFIRM
88_00095,SYSTEM,3870 Montlake Boulevard Northeast at 6:30 pm. Reservation is confirmed.,INFORM,,NOTIFY_SUCCESS
88_00095,USER,Thanks.,THANK_YOU,,
88_00095,SYSTEM,Anything else?,REQ_MORE,,
88_00095,USER,"No, that's all.",NEGATE,THANK_YOU,
88_00095,SYSTEM,Enjoy your day.,GOODBYE,,
88_00096,USER,"Hi, could you help me search for some events please? Would prefer something in the San Diego area, and I heard that Sara Bareilles is a great eevent.",INFORM,,INFORM_INTENT
88_00096,SYSTEM,Would you prefer a Sara Bareilles event at Cal Coast Credit Union Amphitheater on March 5th?,OFFER,,
88_00096,USER,"Sure, may I know where and what time the event starts?",REQUEST,,
88_00096,SYSTEM,The event starts at 5:30 pm at the 5500 Campanile Drive.,INFORM,,
88_00096,USER,Sure that sounds fine with me.,SELECT,,
88_00096,SYSTEM,Would you like to purchase tickets for this event?,OFFER_INTENT,,
88_00096,USER,May another time. Could you reserve a bus there for three people later today?,NEGATE_INTENT,,
88_00096,SYSTEM,"Sure, when and where will you be departing from?",REQUEST,,
88_00096,USER,I will be departing at 2 pm from San Fran.,INFORM,,
88_00096,SYSTEM,"Sure, please confirm your bus ride for 3 people which departs from San Francisco to San Diego on March 1st at 2 pm.",CONFIRM,,
88_00096,USER,"Sure, that sounds fine with me.",AFFIRM,,
88_00096,SYSTEM,"Sorry I could not make that purchase, would you like a bus at 1:50 pm which costs $62 instead?",OFFER,,NOTIFY_FAILURE
88_00096,USER,"Sure, that is fine with me.",AFFIRM,,
88_00096,SYSTEM,Your reservation has been made.,NOTIFY_SUCCESS,,
88_00096,USER,May I know which station does the bus arrive at?,REQUEST,,
88_00096,SYSTEM,Your bus will arrive at Santa Fe Depot.,INFORM,,
88_00096,USER,How about the departure station? Does the journey have 0 transfers?,REQUEST,,
88_00096,SYSTEM,"Yes it does have 0 transfers, and will depart from Salesforce Transit Center.",INFORM,,
88_00096,USER,"Sure, thanks for your help. Could you also help me purchase tickets for the event too?",INFORM_INTENT,,
88_00096,SYSTEM,Please confirm your purchase of 3 tickets for the Sara Bareilles event in San Diego on March 5th.,CONFIRM,,
88_00096,USER,"Sure, that is fine with me.",AFFIRM,,
88_00096,SYSTEM,"Your reservation has been made, have fun!",NOTIFY_SUCCESS,,
88_00096,USER,Thanks so much for your kind assistance!,THANK_YOU,,
88_00096,SYSTEM,"Sure, could I further assist you?",REQ_MORE,,
88_00096,USER,"Nope, that is all the help I need. Thanks!",NEGATE,THANK_YOU,
88_00096,SYSTEM,"No worries, have a great day ahead!",GOODBYE,,
88_00097,USER,I'd like to find dates to see the Beach Boys.,INFORM,INFORM_INTENT,
88_00097,SYSTEM,Where should I look?,REQUEST,,
88_00097,USER,"I'd like to find something around Vancouver, BC.",INFORM,,
88_00097,SYSTEM,There is a Beach Boys event happening at the PNE Amphitheatre in 4 days on March 3rd.,OFFER,,
88_00097,USER,Can you help me find other events? I'd like to see The Drums in San Fran.,INFORM,,REQUEST_ALTS
88_00097,SYSTEM,The Drums are on at August Hall on March 2nd.,OFFER,,
88_00097,USER,Are there any other events on other dates?,REQUEST_ALTS,,
88_00097,SYSTEM,The Drums are on at August Hall on March 6th.,OFFER,,
88_00097,USER,Okay great.,SELECT,,
88_00097,SYSTEM,Would you like to purchase tickets?,OFFER_INTENT,,
88_00097,USER,Not right now.,NEGATE_INTENT,,
88_00097,SYSTEM,Do you need help with anything else?,REQ_MORE,,
88_00097,USER,"I'd like to reserve a bus to go to the event leaving at 2 o""clock in the afternoon.",INFORM,INFORM_INTENT,
88_00097,SYSTEM,Are you planning to leave on March 6th and how many people will be travelling?,REQUEST,,
88_00097,USER,I'd like to leave this Saturday and 2 people will be travelling.,INFORM,,
88_00097,SYSTEM,Where are you leaving from.,REQUEST,,
88_00097,USER,I'd like to leave from San Diego on the 1st.,INFORM,,
88_00097,SYSTEM,Okay so you would like 2 tickets for the bus to San Francisco leaving from San Diego on March 1st at 2 pm .,CONFIRM,,
88_00097,USER,That's great.,AFFIRM,,
88_00097,SYSTEM,Your booking has been made successfully.,NOTIFY_SUCCESS,,
88_00097,USER,Thanks for your help. Can I book tickets to the event now please.,INFORM_INTENT,,
88_00097,SYSTEM,Sure. You would like 2 tickets to the Drums on March 6th in San Francisco.,CONFIRM,,
88_00097,USER,That's correct. What is the address of the venue?,REQUEST,AFFIRM,
88_00097,SYSTEM,Your booking has been made successfully. The address is 420 Mason Street.,INFORM,NOTIFY_SUCCESS,
88_00097,USER,Thanks for your help.,THANK_YOU,,
88_00097,SYSTEM,Do you need help with anything else?,REQ_MORE,,
88_00097,USER,No thanks.,NEGATE,THANK_YOU,
88_00097,SYSTEM,Enjoy your day.,GOODBYE,,
88_00098,USER,What is there to do in Napa on a certain date?,INFORM,INFORM_INTENT,
88_00098,SYSTEM,What kind of event?,REQUEST,,
88_00098,USER,I like Jon B.,INFORM,,
88_00098,SYSTEM,Jon B is at Blue Note Napa on March 1st.,OFFER,,
88_00098,USER,Where is that?,REQUEST,,
88_00098,SYSTEM,1030 Main Street.,INFORM,,
88_00098,USER,Any other dates? I was thinking Nycfc vs Timbers in New York City.,INFORM,,REQUEST_ALTS
88_00098,SYSTEM,Nycfc vs Timbers will be at Yankee Stadium on March 3rd.,OFFER,,
88_00098,USER,Sounds good.,SELECT,,
88_00098,SYSTEM,Do you want tickets.,OFFER_INTENT,,
88_00098,USER,Not now.,NEGATE_INTENT,,
88_00098,SYSTEM,Anything else I can do?,REQ_MORE,,
88_00098,USER,Reserve a bus there for me.,INFORM_INTENT,,
88_00098,SYSTEM,Leaving March 3rd? For how many?,REQUEST,,
88_00098,USER,Four tickets for this Saturday.,INFORM,,
88_00098,SYSTEM,Time of departure and city?,REQUEST,,
88_00098,USER,Two people leaving from Washington at 1:30 pm.,INFORM,,
88_00098,SYSTEM,Please confirm: 2 tickets from Washington to New York on March 2nd at 1:30 pm.,CONFIRM,,
88_00098,USER,That works. How many transfers and what station do I leave from?,REQUEST,,AFFIRM
88_00098,SYSTEM,There are 0 transfers and it starts at Port Authority Station. I wasn't able to book tickets. The bus leaves at 1:40 pm and costs $32.,INFORM,,OFFER
88_00098,USER,"Ok, that's fine.",AFFIRM,,
88_00098,SYSTEM,Your ticket is booked.,NOTIFY_SUCCESS,,
88_00098,USER,I want to book more tickets.,INFORM_INTENT,,
88_00098,SYSTEM,Please confirm: 2 tickets to Nycfc vs Timbers March 3rd in New York.,CONFIRM,,
88_00098,USER,"Yes, right.",AFFIRM,,
88_00098,SYSTEM,"Your tickets are booked, have fun.",NOTIFY_SUCCESS,,
88_00098,USER,Thanks for the help.,THANK_YOU,,
88_00098,SYSTEM,Anything else?,REQ_MORE,,
88_00098,USER,"No, thanks.",NEGATE,THANK_YOU,
88_00098,SYSTEM,Have a nice day.,GOODBYE,,
88_00099,USER,I'd like to find dates for The Paper Kites in New York City,INFORM,,INFORM_INTENT
88_00099,SYSTEM,The Paper Kites are on at Murmrr on March 2nd.,OFFER,,
88_00099,USER,What time does the event begin?,REQUEST,,
88_00099,SYSTEM,It starts at 5:30 pm.,INFORM,,
88_00099,USER,Are there any events on other dates?,REQUEST_ALTS,,
88_00099,SYSTEM,The Paper Kites are on at Murmrr on March 4th.,OFFER,,
88_00099,USER,Sounds great.,SELECT,,
88_00099,SYSTEM,Would you like to buy tickets?,OFFER_INTENT,,
88_00099,USER,Not right now.,NEGATE_INTENT,,
88_00099,SYSTEM,Do you need help with anything else?,REQ_MORE,,
88_00099,USER,I'd like to reserve a bus to the event for four people leaving from Philly at quarter to 2 in the afternoon.,INFORM,,
88_00099,SYSTEM,Do you want to leave on March 4th?,REQUEST,,
88_00099,USER,"No, I'd like to go one the 2nd.",INFORM,,
88_00099,SYSTEM,Okay so you want to book 4 tickets for the bus leaving from Philadelphia to New York on March 2nd at 1:45 pm.,CONFIRM,,
88_00099,USER,Perfect.,AFFIRM,,
88_00099,SYSTEM,I have been unable to book your tickets. There is a bus leaving at 2 pm that costs $22.,OFFER,,NOTIFY_FAILURE
88_00099,USER,That would be fine.,AFFIRM,,
88_00099,SYSTEM,Your ticket has been purchased.,NOTIFY_SUCCESS,,
88_00099,USER,Thanks for your help. I'd like to book four tickets to the event now please.,INFORM,INFORM_INTENT,
88_00099,SYSTEM,"Sure, so to confirm: You would like 4 tickets to The Paper Kites on March 4th in New York.",CONFIRM,,
88_00099,USER,That's correct. Where is the venue and what time does the event start?,REQUEST,,AFFIRM
88_00099,SYSTEM,"Your booking has been confirmed. The address of the venue is 17 Eastern Parkway, Brooklyn and the event begins at 5:30 pm.",INFORM,,NOTIFY_SUCCESS
88_00099,USER,Thanks for your help.,THANK_YOU,,
88_00099,SYSTEM,Do you need anything else?,REQ_MORE,,
88_00099,USER,No thanks.,NEGATE,THANK_YOU,
88_00099,SYSTEM,Enjoy your day.,GOODBYE,,
88_00100,USER,"Hey, can you help me find the date of the Lyfe Jennings show?",INFORM,INFORM_INTENT,
88_00100,SYSTEM,"Sure, which city are you looking in?",REQUEST,,
88_00100,USER,"New York City, please.",INFORM,,
88_00100,SYSTEM,"Okay, Lyfe Jennings has shows on 6 days. There's one on March 1st at Sony Hall.",OFFER,,
88_00100,USER,Let's keep looking. What about dates for Young the Giant in Vegas?,INFORM,,REQUEST_ALTS
88_00100,SYSTEM,Young the Giant is playing March 3rd at Downtown Las Vegas Events Center - DLVEC.,OFFER,,
88_00100,USER,When does it start and what's the venue?,REQUEST,,
88_00100,SYSTEM,It starts at 6 pm at 200 South 3rd Street.,INFORM,,
88_00100,USER,Sounds good. Can you help me find a bus there?,SELECT,,
88_00100,SYSTEM,Of course. Are you leaving on March 3rd? What time?,REQUEST,,
88_00100,USER,I'm actually leaving on the 2nd around 10:30 am.,INFORM,,
88_00100,SYSTEM,"Okay, where are you leaving from?",REQUEST,,
88_00100,USER,"I'll be leaving from Sacramento, CA.",INFORM,,
88_00100,SYSTEM,"Okay, how many tickets should I reserve?",REQUEST,,
88_00100,USER,I'll need 3.,INFORM,,
88_00100,SYSTEM,"Okay, please confirm that you want 3 tickets for the bus going from Sacramento to Las Vegas on March 2nd at 10:30 am.",CONFIRM,,
88_00100,USER,"Yup, that's right.",AFFIRM,,
88_00100,SYSTEM,"Sorry, that ticket wasn't available. Can you do 10:40 am? It costs $73.",OFFER,,NOTIFY_FAILURE
88_00100,USER,"Yes, that's fine.",AFFIRM,,
88_00100,SYSTEM,Your tickets have been reserved.,NOTIFY_SUCCESS,,
88_00100,USER,"Okay, how many transfers will it have, and what bus station are we arriving in?",REQUEST,,
88_00100,SYSTEM,The trip has 1 transfer and arrives at Union Plaza.,INFORM,,
88_00100,USER,"Thanks, let's go back to booking tickets for the show.",INFORM_INTENT,,
88_00100,SYSTEM,"Okay, can you confirm you'd like 3 tickets for the Young the Giant show on March 3rd in Las Vegas?",CONFIRM,,
88_00100,USER,"Yup, that's right.",AFFIRM,,
88_00100,SYSTEM,Your reservation is confirmed. Have fun!,NOTIFY_SUCCESS,,
88_00100,USER,"Thanks, that's all for now.",THANK_YOU,GOODBYE,
88_00100,SYSTEM,Have a good day.,GOODBYE,,
88_00101,USER,I would like to find dates of events to attend.,INFORM_INTENT,,
88_00101,SYSTEM,What event are you interested in attending and in which city?,REQUEST,,
88_00101,USER,I would like to attend Electric Feels in SF.,INFORM,,
88_00101,SYSTEM,The Electric feels are playing on 5 dates at the August Hall. One date is March 4th.,OFFER,,
88_00101,USER,What is the location of this venue?,REQUEST,,
88_00101,SYSTEM,The address of this venue is 420 Mason Street.,INFORM,,
88_00101,USER,What time does the event start?,REQUEST,,
88_00101,SYSTEM,The event begins ar 5:30 pm.,INFORM,,
88_00101,USER,This sounds perfect! I would like to reserve a bus and would like to leave at half past 6 in the morning.,SELECT,,
88_00101,SYSTEM,Is your departure date MArch 4th and what location would you like to leave from on that day?,REQUEST,,
88_00101,USER,I would like to leave today from Long Beach.,INFORM,,
88_00101,SYSTEM,How many tickets should I reserve?,REQUEST,,
88_00101,USER,It is for two people.,INFORM,,
88_00101,SYSTEM,Please confirm 2 tickets on the bus departing from Long Beach at 6:30 am on March 1st and arriving in San Francisco.,CONFIRM,,
88_00101,USER,Perfect. Does that bus have 1 transfer and at what location does it arrive?,REQUEST,,AFFIRM
88_00101,SYSTEM,There are 0 transfers and it will arrive at the Salesforce Transit Center. Departure time is 6:50 am with a ticket cost of $47.,INFORM,,OFFER
88_00101,USER,"Yes, that works.",AFFIRM,,
88_00101,SYSTEM,Your ticket is confirmed.,NOTIFY_SUCCESS,,
88_00101,USER,"Now that the bus tickets are done, I would like to go back to the event tickets.",INFORM_INTENT,,
88_00101,SYSTEM,Please confirm 2 tickets to the Electric Feels on March 4th in San Francisco.,CONFIRM,,
88_00101,USER,"Yes, that is correct.",AFFIRM,,
88_00101,SYSTEM,Your reservation is confirmed!! Enjoy the event!,NOTIFY_SUCCESS,,
88_00101,USER,Tahnk you for your assitance. That is all I need today.,THANK_YOU,GOODBYE,
88_00101,SYSTEM,Have a great day!,GOODBYE,,
88_00102,USER,"I want to see Republic Vs Toros in Sacramento, CA.",INFORM,,INFORM_INTENT
88_00102,SYSTEM,I've got 5 possible matches. There's one on March 1st for Republic Vs Toros and it's at Papa Murphy's Park.,OFFER,,
88_00102,USER,What time does it start? What's the address?,REQUEST,,
88_00102,SYSTEM,It starts at 5:30 pm. The address is 1600 Exposition Boulevard.,INFORM,,
88_00102,USER,What are the other dates?,REQUEST_ALTS,,
88_00102,SYSTEM,There's one on March 2nd for Republic Vs Toros at Papa Murphy's Park.,OFFER,,
88_00102,USER,I need another date.,REQUEST_ALTS,,
88_00102,SYSTEM,Theres' one on March 7th for Republic Vs Toros at Papa Murphy's Park.,OFFER,,
88_00102,USER,"Sounds good. I need a bus to get there. I need one on the 4th of this month leaving at 11:45. I'm coming from Fresno, CA.",SELECT,,
88_00102,SYSTEM,How many tickets do you need.,REQUEST,,
88_00102,USER,I'm gonna need four.,INFORM,,
88_00102,SYSTEM,"Okay, please confirm: bus for 4 from Fresno to Sacramento on March 4th at 11:45 am.",CONFIRM,,
88_00102,USER,That is correct.,AFFIRM,,
88_00102,SYSTEM,I couldn't book that one but there's one at 11:20 am for $31.,OFFER,,NOTIFY_FAILURE
88_00102,USER,"Yes, do that one.",AFFIRM,,
88_00102,SYSTEM,Your tickets have been confirmed.,NOTIFY_SUCCESS,,
88_00102,USER,Thanks a lot.,THANK_YOU,,
88_00102,SYSTEM,Is there anything else?,REQ_MORE,,
88_00102,USER,I need to book those other tickets.,INFORM_INTENT,,
88_00102,SYSTEM,"No problem, please confirm: 4 tickets for Republic Vs Toros on MArch 7th in Sacramento.",CONFIRM,,
88_00102,USER,"Yes, that's right.",AFFIRM,,
88_00102,SYSTEM,Your reservation has been made. Have fun.,NOTIFY_SUCCESS,,
88_00102,USER,Thanks a lot.,THANK_YOU,,
88_00102,SYSTEM,Will that be all?,REQ_MORE,,
88_00102,USER,"Yeah, that's it.",NEGATE,THANK_YOU,
88_00102,SYSTEM,Have a great day.,GOODBYE,,
88_00103,USER,Could you help me find dates for events?,INFORM_INTENT,,
88_00103,SYSTEM,okay is there a preferred city I should look into?,REQUEST,,
88_00103,USER,"Yes, I'm looking for an event in Brisbane.",INFORM,,
88_00103,SYSTEM,Do you have a specific event you're interested in?,REQUEST,,
88_00103,USER,"I was told that Yankees Vs Blue Jays is good, I'm looking for something in NY.",INFORM,,
88_00103,SYSTEM,Okay there is an event for Yankees Vs Blue Jays at Yankee Stadium on March 3rd.,OFFER,,
88_00103,USER,When does it start and where is it located?,REQUEST,,
88_00103,SYSTEM,The event starts at 5:30 pm and is located at 1 East 161 Street.,INFORM,,
88_00103,USER,Are there any other events?,REQUEST_ALTS,,
88_00103,SYSTEM,"Yes, there's an event on March 5th for Yankees Vs Blue Jays at Yankee Stadium.",OFFER,,
88_00103,USER,Are there any events on other days?,REQUEST_ALTS,,
88_00103,SYSTEM,Okay there is an event for March 8th for Yankees Vs Blue Jays at Yankee Stadium.,OFFER,,
88_00103,USER,Great that sounds good to me. I'd like to reserve a bus to take me there.,SELECT,,
88_00103,SYSTEM,"Okay, do you plan to leave on March 8th?",REQUEST,,
88_00103,USER,I'm leaving on the 2nd of this month from Philadelphia.,INFORM,,
88_00103,SYSTEM,"Okay, what time do you plan to leave?",REQUEST,,
88_00103,USER,I'm planning on leaving in the afternoon 2.,INFORM,,
88_00103,SYSTEM,"Okay, how many tickets will you need?",REQUEST,,
88_00103,USER,I need one ticket.,INFORM,,
88_00103,SYSTEM,Okay confirm the following; You want a ticket for 1 person for a bus leaving from Philadelphia to New York. The bus will leave on March 2nd at 2 pm.,CONFIRM,,
