dialogue_id,speaker,turn,act_1,act_2,act_3
61_00096,USER,Can you help me find a dentist,INFORM_INTENT,,
61_00096,SYSTEM,What city are we looking in?,REQUEST,,
61_00096,USER,Let's look in Napa,INFORM,,
61_00096,SYSTEM,I found 3 dentists including Amine G Khoury in Napa,OFFER,,INFORM_COUNT
61_00096,USER,Where are they located,REQUEST,,
61_00096,SYSTEM,They're located at 3434 Villa Lane D-160,INFORM,,
61_00096,USER,"Yes, I'd like to go with this one",SELECT,,
61_00096,SYSTEM,Would you like to book an appointment too?,OFFER_INTENT,,
61_00096,USER,"Sure, please do",AFFIRM_INTENT,,
61_00096,SYSTEM,What time and date?,REQUEST,,
61_00096,USER,Let's do it at 5:15 in the evening on the 3rd of March,INFORM,,
61_00096,SYSTEM,"OK, so a meeting with Amine G Khoury at 5:15 pm on March 3rd",CONFIRM,,
61_00096,USER,"No, let's make it at 13:30 on the 2nd of March",INFORM,,NEGATE
61_00096,SYSTEM,"OK, so 1:30 pm on March 2nd?",CONFIRM,,
61_00096,USER,Yes please. Also do they do cosmetic services? And what's their contact?,REQUEST,,AFFIRM
61_00096,SYSTEM,It's booked! They don't offer cosmetic service unfortunately. Their number is 707-265-9440,INFORM,,NOTIFY_SUCCESS
61_00096,USER,I would like to add this to my calendar as dental appointment,INFORM,INFORM_INTENT,
61_00096,SYSTEM,What time is the event?,REQUEST,,
61_00096,USER,It's gonna be at 13:30,INFORM,,
61_00096,SYSTEM,I've listed an event on March 2nd on 1:30 pm called dental appointment at 3434 Villa Lane D-160,CONFIRM,,
61_00096,USER,"Yes, that sounds good",AFFIRM,,
61_00096,SYSTEM,It's added to your calendar,NOTIFY_SUCCESS,,
61_00096,USER,OK thanks for your help,THANK_YOU,,
61_00096,SYSTEM,Can I help with anything else?,REQ_MORE,,
61_00096,USER,"No, that's it for now",NEGATE,THANK_YOU,
61_00096,SYSTEM,Alright have a good one,GOODBYE,,
61_00097,USER,Could you find me a dentist in the Sunnyvale area?,INFORM,INFORM_INTENT,
61_00097,SYSTEM,I found Amazing Smile Dental in Sunnyvale.,OFFER,,
61_00097,USER,Do they provide cosmetic services? What's there phone number?,REQUEST,,
61_00097,SYSTEM,Its 408-739-6520. I'm sorry they do not offer cosmetic services.,INFORM,,
61_00097,USER,Is there other options?,REQUEST_ALTS,,
61_00097,SYSTEM,"There's Andrei Simel , Family & Cosmetic Dentisry also in Sunnyvale.",OFFER,,
61_00097,USER,That sounds good.,SELECT,,
61_00097,SYSTEM,Can I help with anything else?,REQ_MORE,,
61_00097,USER,"Yes, I'd like to make an appointment.",INFORM_INTENT,,
61_00097,SYSTEM,What date shall I make it for?,REQUEST,,
61_00097,USER,Make it for the 7th.,INFORM,,
61_00097,SYSTEM,What time would you prefer?,REQUEST,,
61_00097,USER,"At 1:45 in the afternoon, if that is available.",INFORM,,
61_00097,SYSTEM,"To confirm: You would like an appointment with Andrei Simel , Family & Cosmetic Dentisry on March 7th at 1:45 pm.",CONFIRM,,
61_00097,USER,That's right. Can you give me their address and phone number?,REQUEST,,AFFIRM
61_00097,SYSTEM,"990 West Fremont Avenue j. Their number is 408-992-0840. I was unable to get an appointment for the time you requested. Would you like an appointment with Andrei Simel , Family & Cosmetic Dentisry at 1:30 pm on March 7th?",INFORM,,OFFER
61_00097,USER,Sure. That's fine.,AFFIRM,,
61_00097,SYSTEM,Your appointment has been confirmed.,NOTIFY_SUCCESS,,
61_00097,USER,Thank you. Can you add this to my calendar?,INFORM_INTENT,,
61_00097,SYSTEM,What time shall shall I list it as?,REQUEST,,
61_00097,USER,Make it 1:30 pm.,INFORM,,
61_00097,SYSTEM,What name would you like me to use?,REQUEST,,
61_00097,USER,List it as dental.,INFORM,,
61_00097,SYSTEM,To verify: You would like me to add the dental appointment at 990 West Fremont Avenue j on your calendar for 1:30 pm on March 7th.,CONFIRM,,
61_00097,USER,You got it.,AFFIRM,,
61_00097,SYSTEM,It's been added to your calendar.,NOTIFY_SUCCESS,,
61_00097,USER,Thanks so much.,THANK_YOU,,
61_00097,SYSTEM,Is there anything else?,REQ_MORE,,
61_00097,USER,No thank you. I'm good for now.,NEGATE,THANK_YOU,
61_00097,SYSTEM,Have a great day.,GOODBYE,,
61_00098,USER,Can you find a dentist for me?,INFORM_INTENT,,
61_00098,SYSTEM,Which city should I search in?,REQUEST,,
61_00098,USER,I am looking for one that offers cosmetic services in San Ramon.,INFORM,,
61_00098,SYSTEM,I found 3. How about Perfect Smiles Family Dentistry located in San Ramon.,OFFER,,INFORM_COUNT
61_00098,USER,Yes that sounds good. Do they have anything available at half past 5 in the evening?,INFORM,INFORM_INTENT,SELECT
61_00098,SYSTEM,On what date?,REQUEST,,
61_00098,USER,Try for 10th of March.,INFORM,,
61_00098,SYSTEM,You wish to book an appointment with Perfect Smiles Family Dentistry on March 10th at 5:30 pm. Correct?,CONFIRM,,
61_00098,USER,Yes it is.,AFFIRM,,
61_00098,SYSTEM,Appointment is confirmed.,NOTIFY_SUCCESS,,
61_00098,USER,Can you get their address and telephone number please?,REQUEST,,
61_00098,SYSTEM,Perfect Smiles Family Dentistry is located at 9260 Alcosta Boulevard. Their phone number is 925-833-8702.,INFORM,,
61_00098,USER,Thank you. Can you add this appointment to my calendar at half past 5 in the evening?,INFORM,INFORM_INTENT,
61_00098,SYSTEM,What name should I use?,REQUEST,,
61_00098,USER,Please label it not at work.,INFORM,,
61_00098,SYSTEM,"To confirm: you wish to ad an event, called not at work ,to your calendar for March 10th. The time is 5:30 pm and address 9260 Alcosta Boulevard. Is this right?",CONFIRM,,
61_00098,USER,Yes thank you.,AFFIRM,,
61_00098,SYSTEM,Event has been added.,NOTIFY_SUCCESS,,
61_00098,USER,Thank you.,THANK_YOU,,
61_00098,SYSTEM,is there anything else I can do?,REQ_MORE,,
61_00098,USER,No that's all.,NEGATE,THANK_YOU,
61_00098,SYSTEM,Have a nice day.,GOODBYE,,
61_00099,USER,I wish to find a Dentist in Milpitas.,INFORM,INFORM_INTENT,
61_00099,SYSTEM,I searched and found 6 dentists. What do you think about Chen Jiangkai at Milpitas?,OFFER,,INFORM_COUNT
61_00099,USER,Yes. I wish to choose this one. I wish to see a dentist.,INFORM_INTENT,SELECT,
61_00099,SYSTEM,Which time do you need and in which date do you want to book it on?,REQUEST,,
61_00099,USER,Book it on March 8th. Is there any thing else available at morning 10:30?,INFORM,,
61_00099,SYSTEM,"Kindly ensure that, on March 8th, booking has been done with Chen Jiangkai at 10:30 am.",CONFIRM,,
61_00099,USER,Yes. It is good for me.,AFFIRM,,
61_00099,SYSTEM,"I am sorry that, I am unable to book the appointment. Do you need any other help?",NOTIFY_FAILURE,REQ_MORE,
61_00099,USER,please try again. Book it on 3rd of March. Is there any thing else available at morning 3:30 pm?,INFORM,,INFORM_INTENT
61_00099,SYSTEM,"Kindly ensure that, on March 3rd, booking has been done with Chen Jiangkai at 3:30 pm.",CONFIRM,,
61_00099,USER,Yes. it is good for me.,AFFIRM,,
61_00099,SYSTEM,"I am sorry that, I am unable to book the appointment. What do you think about Chen Jiangkai on March 3rd at 4 pm?",OFFER,,
61_00099,USER,Yes. It is good for me.,AFFIRM,,
61_00099,SYSTEM,Congrats. Your appointment is done.,NOTIFY_SUCCESS,,
61_00099,USER,Thank you so much for your help. I wish to like to include it to my calendar. The event time is 16:00.,INFORM,INFORM_INTENT,
61_00099,SYSTEM,Whether the event at 430 East Calaveras Boulevard. In which name shall I use for the event?,REQUEST,,
61_00099,USER,Yes. it is goo. Use dentist appointment as event title.,INFORM,AFFIRM,
61_00099,SYSTEM,"Kindly ensure that, on March 3rd, the event dentist appointment is at 430 East Calaveras Boulevard at 4 pm.",CONFIRM,,
61_00099,USER,Yes. it is good.,AFFIRM,,
61_00099,SYSTEM,Event has been successfully added to your calendar.,NOTIFY_SUCCESS,,
61_00099,USER,Thank you so much for your help.,THANK_YOU,,
61_00099,SYSTEM,Do you need any other help?,REQ_MORE,,
61_00099,USER,No. Thank you so much for your help.,NEGATE,THANK_YOU,
61_00099,SYSTEM,Have a fantastic day.,GOODBYE,,
61_00100,USER,I need to find a San Jose dentist please.,INFORM,INFORM_INTENT,
61_00100,SYSTEM,Would you like to go to A J Dental Lab in San Jose?,OFFER,,
61_00100,USER,What else is there?,REQUEST_ALTS,,
61_00100,SYSTEM,What about A-1 Dental Care in San Jose?,OFFER,,
61_00100,USER,Something else please?,REQUEST_ALTS,,
61_00100,SYSTEM,I also have Abad Dental Office in San Jose.,OFFER,,
61_00100,USER,What is the address and do they perform cosmetic services?,REQUEST,,
61_00100,SYSTEM,"No, they don't. The address is 2664 Berryessa Road # 212.",INFORM,,
61_00100,USER,"Okay, that should work.",SELECT,,
61_00100,SYSTEM,Shall I book an appointment for you?,OFFER_INTENT,,
61_00100,USER,"Yes, on the 13th of March please.",AFFIRM_INTENT,INFORM,
61_00100,SYSTEM,At what time?,REQUEST,,
61_00100,USER,How about 12 in the afternoon?,INFORM,,
61_00100,SYSTEM,Confirming an appointment with Abad Dental Office on March 13th at 12 pm.,CONFIRM,,
61_00100,USER,That's good. What's the phone number?,REQUEST,AFFIRM,
61_00100,SYSTEM,The appointment has been booked. The number there is 408-272-3809.,INFORM,NOTIFY_SUCCESS,
61_00100,USER,Can you put that on my calendar titled out of office for 12 in the afternoon?,INFORM,,INFORM_INTENT
61_00100,SYSTEM,Confirming a 12 pm appointment at 2664 Berryessa Road # 212 on March 13th titled out of office.,CONFIRM,,
61_00100,USER,"Sounds good, thank you.",AFFIRM,,
61_00100,SYSTEM,The event has been added.,NOTIFY_SUCCESS,,
61_00100,USER,"Thank you, I'm all set.`",THANK_YOU,GOODBYE,
61_00100,SYSTEM,You're very welcome.,GOODBYE,,
61_00101,USER,I need to find a dentist.,INFORM_INTENT,,
61_00101,SYSTEM,Which city would you like me to check?,REQUEST,,
61_00101,USER,In SF please.,INFORM,,
61_00101,SYSTEM,I found 4 in San Francisco. The first is Balboa Dental Care.,OFFER,,INFORM_COUNT
61_00101,USER,Please find another.,REQUEST_ALTS,,
61_00101,SYSTEM,Do you want Lee Myoung in San Francisco?,OFFER,,
61_00101,USER,No find another please.,REQUEST_ALTS,,
61_00101,SYSTEM,Another dentist in San Francisco is Lim Donald S.,OFFER,,
61_00101,USER,What is the contact number please?,REQUEST,,
61_00101,SYSTEM,The number is 415-387-0220.,INFORM,,
61_00101,USER,"Yes that will work, try to book an appointment tomorrow at 14:00.",INFORM,,INFORM_INTENT
61_00101,SYSTEM,"You want to book at appointment on March 2nd at 2 pm with Lim Donald S., correct?",CONFIRM,,
61_00101,USER,Yes that is correct. Do they offer cosmetic dentistry?,REQUEST,AFFIRM,
61_00101,SYSTEM,"I was unable to book an appointment at that time, can I help with anything else?",NOTIFY_FAILURE,REQ_MORE,
61_00101,USER,Try March 10th please.,INFORM,INFORM_INTENT,
61_00101,SYSTEM,"You want an appointment with Lim Donald S. at 2 pm on March 10th, correct?",CONFIRM,,
61_00101,USER,Yes that is correct. Do they offer cosmetic services?,REQUEST,AFFIRM,
61_00101,SYSTEM,Your appointment has been scheduled but they do not offer cosmetic services.,INFORM,NOTIFY_SUCCESS,
61_00101,USER,Please add the appointment to my calendar.,INFORM_INTENT,,
61_00101,SYSTEM,What would you like to name it?,REQUEST,,
61_00101,USER,Please call it dental appointment.,INFORM,,
61_00101,SYSTEM,Is the event at 4215 Geary Boulevard? What time is would you like it scheduled?,REQUEST,,
61_00101,USER,THe event time is 14:00 and yes that is the address.,INFORM,AFFIRM,
61_00101,SYSTEM,"You want to add your dental appointment on March 10th at 2 pm at 4215 Geary Boulevard to your calendar, correct?",CONFIRM,,
61_00101,USER,Yes that is correct.,AFFIRM,,
61_00101,SYSTEM,Your dental appointment has been added.,NOTIFY_SUCCESS,,
61_00101,USER,Thank you for your assistance.,THANK_YOU,,
61_00101,SYSTEM,Can I help with anything more?,REQ_MORE,,
61_00101,USER,No that is all thanks.,NEGATE,THANK_YOU,
61_00101,SYSTEM,Have a great day.,GOODBYE,,
61_00102,USER,Can you help me find a cosmetic dentist?,INFORM,INFORM_INTENT,
61_00102,SYSTEM,In what city?,REQUEST,,
61_00102,USER,Something in San Jose.,INFORM,,
61_00102,SYSTEM,How about Dr. Svetlana Naret in San Jose?,OFFER,,
61_00102,USER,What is their address and phone number?,REQUEST,,
61_00102,SYSTEM,5710 Cahalan Avenue # 8J and phone number is 408-225-7813.,INFORM,,
61_00102,USER,"Ok, can you book me an appt for 12 pm?",INFORM,INFORM_INTENT,SELECT
61_00102,SYSTEM,On what date?,REQUEST,,
61_00102,USER,"The 11th of March. Actually, is there anything at 10:30 in the morning?",INFORM,,
61_00102,SYSTEM,I have booking an appointment for Dr. Svetlana Naret at 10:30 am on March 11th. Is that correct?,CONFIRM,,
61_00102,USER,"No, actually, could you make it for the 10th of this month?",INFORM,NEGATE,
61_00102,SYSTEM,Appointment for 10:30 am on March 10th. Is that correct?,CONFIRM,,
61_00102,USER,"Yes, that is correct.",AFFIRM,,
61_00102,SYSTEM,You appointment was booked successfully.,NOTIFY_SUCCESS,,
61_00102,USER,Can you add this to my calendar?,INFORM_INTENT,,
61_00102,SYSTEM,What time should I add?,REQUEST,,
61_00102,USER,Quarter past 10 in the morning.,INFORM,,
61_00102,SYSTEM,What is the event name?,REQUEST,,
61_00102,USER,Dentist appointment at 10:30 in the morning.,INFORM,,
61_00102,SYSTEM,"I have, dentist appointment at 10:30 am on March 10th at 5710 Cahalan Avenue # 8J. Is that correct?",CONFIRM,,
61_00102,USER,"Yes, that is correct.",AFFIRM,,
61_00102,SYSTEM,It was added successfully.,NOTIFY_SUCCESS,,
61_00102,USER,Thank you so much.,THANK_YOU,,
61_00102,SYSTEM,Is there anything else I can help you with?,REQ_MORE,,
61_00102,USER,"No, that is all. Thank you.",NEGATE,THANK_YOU,
61_00102,SYSTEM,My pleasure. Have a great day.,GOODBYE,,
61_00103,USER,"I have a toothache, find a dentist please.",INFORM_INTENT,,
61_00103,SYSTEM,"Sure, Which city would you prefer a dentist in?",REQUEST,,
61_00103,USER,SFO please,INFORM,,
61_00103,SYSTEM,How about Balboa Dental Care located in San Francisco.,OFFER,,
61_00103,USER,"Maybe, what's the phone number?",REQUEST,,
61_00103,SYSTEM,The number is 415-387-8802,INFORM,,
61_00103,USER,More options please.,REQUEST_ALTS,,
61_00103,SYSTEM,"Sure, How about Lee Myoung located also in San Francisco?",OFFER,,
61_00103,USER,Find out if they can do cosmetic services and I will need their phone number as well.,REQUEST,,
61_00103,SYSTEM,"Unfortunately, they do not offer cosmetic services, I show a number for 415-239-4140.",INFORM,,
61_00103,USER,"Ok, I would like to book with this one.",SELECT,,
61_00103,SYSTEM,Would you like my help booking this appointment?,OFFER_INTENT,,
61_00103,USER,"Yes, please book for me.",AFFIRM_INTENT,,
61_00103,SYSTEM,What time is best for you?,REQUEST,,
61_00103,USER,Find out if I have anything available at 16:30?,INFORM,,
61_00103,SYSTEM,Which date would work best for your booking?,REQUEST,,
61_00103,USER,The 8th of this month would be the best day.,INFORM,,
61_00103,SYSTEM,please confirm a booking for Lee Myoung on March 8th at 4:30 pm. Is that right?,CONFIRM,,
61_00103,USER,"Yes, perfect.",AFFIRM,,
61_00103,SYSTEM,"Great news, I was able to confirm your booking.",NOTIFY_SUCCESS,,
61_00103,USER,"Great, let's go ahead and add this to my calendar please.",INFORM_INTENT,,
61_00103,SYSTEM,"Sure, I can do that for you. What would you like to call this event and at what time should I add this?",REQUEST,,
61_00103,USER,Let's label it not at work and put it at 4:15 in the evening please.,INFORM,,
61_00103,SYSTEM,"sure thing, will this event be happening at 90 Woodacre Drive # 108.",REQUEST,,
61_00103,USER,"Yeah, that is right.",AFFIRM,,
61_00103,SYSTEM,"Great, please confirm we are adding the event titled not at work for March 8th at 4:15 pm. The address is 90 Woodacre Drive # 108. Do I have this correct?",CONFIRM,,
61_00103,USER,"Yep, sounds right.",AFFIRM,,
61_00103,SYSTEM,"Great, I was able to update your calendar successfully.",NOTIFY_SUCCESS,,
61_00103,USER,Thank you for your help. Good bye.,THANK_YOU,GOODBYE,
61_00103,SYSTEM,"Your welcome, Good bye.",GOODBYE,,
61_00104,USER,Find a dentist.,INFORM_INTENT,,
61_00104,SYSTEM,In what city?,REQUEST,,
61_00104,USER,San Jose.,INFORM,,
61_00104,SYSTEM,A J Dental Lab does good work in San Jose.,OFFER,,
61_00104,USER,What's their address? Do they do cosmetics?,REQUEST,,
61_00104,SYSTEM,2664 Berryessa Road # 206. And they don't offer any cosmetic services?,INFORM,,
61_00104,USER,Is there anything else?,REQUEST_ALTS,,
61_00104,SYSTEM,A-1 Dental Care in San Jose.,OFFER,,
61_00104,USER,That would sounds better.,SELECT,,
61_00104,SYSTEM,Anything else I can help with?,REQ_MORE,,
61_00104,USER,I'd like to visit a dentist.,INFORM_INTENT,,
61_00104,SYSTEM,What time?,REQUEST,,
61_00104,USER,At 2 in the afternoon.,INFORM,,
61_00104,SYSTEM,For what date?,REQUEST,,
61_00104,USER,The 14th of March.,INFORM,,
61_00104,SYSTEM,So you want an appointment at 2 pm on March 14th at A-1 Dental Care?,CONFIRM,,
61_00104,USER,Sure. What's their number?,REQUEST,AFFIRM,
61_00104,SYSTEM,"The number for A-1 Dental Care is 408-258-6669. However, I was unable to book your appointment. Would you like the 2:30 pm appointment on March 14th?",INFORM,OFFER,
61_00104,USER,Yes that works.,AFFIRM,,
61_00104,SYSTEM,Your appointment is confirmed.,NOTIFY_SUCCESS,,
61_00104,USER,What's the address again?,REQUEST,,
61_00104,SYSTEM,2664 Berryessa Road # 205.,INFORM,,
61_00104,USER,Thanks. Please add it to my calendar?,INFORM_INTENT,,
61_00104,SYSTEM,What should I name it.,REQUEST,,
61_00104,USER,Put dentist appointment as the title at quarter past 2 in the afternoon.,INFORM,,
61_00104,SYSTEM,"To confirm, you would like the 2:15 dentist appointment at 2:15 pm on March 14th located at 2664 Berryessa Road # 205?",CONFIRM,,
61_00104,USER,Perfect,AFFIRM,,
61_00104,SYSTEM,I've added it to your calendar,NOTIFY_SUCCESS,,
61_00104,USER,Thanks so much,THANK_YOU,,
61_00104,SYSTEM,Anything else I can help with?,REQ_MORE,,
61_00104,USER,"Nope, thanks again.",NEGATE,THANK_YOU,
61_00104,SYSTEM,Have a great day.,GOODBYE,,
61_00105,USER,I'm looking for a dentist and I need help.,INFORM_INTENT,,
61_00105,SYSTEM,Where would you like to look for the dentist?,REQUEST,,
61_00105,USER,Please look in Santa Rosa.,INFORM,,
61_00105,SYSTEM,There's Access Dental - Santa Rosa in Santa Rosa.,OFFER,,
61_00105,USER,How about we look for something in San jose.,INFORM,REQUEST_ALTS,
61_00105,SYSTEM,There are 10 matches. There's A J Dental Lab in San Jose.,OFFER,,INFORM_COUNT
61_00105,USER,What's their address? And do they perform cosmetic services?,REQUEST,,
61_00105,SYSTEM,Their address is 2664 Berryessa Road # 206. I'm sorry but they don't perform cosmetic services.,INFORM,,
61_00105,USER,Please keep looking then.,REQUEST_ALTS,,
61_00105,SYSTEM,There's A-1 Dental Care in San Jose.,OFFER,,
61_00105,USER,"Okay, that seems good. I want to make an appointment for the 7th of this month.",INFORM,INFORM_INTENT,SELECT
61_00105,SYSTEM,What time would you like the appointment to be for?,REQUEST,,
61_00105,USER,"I want it at 2 o""clock in the afternoon.",INFORM,,
61_00105,SYSTEM,I'll make you an appointment at A-1 Dental Care for March 7th at 2 pm. Is that correct?,CONFIRM,,
61_00105,USER,"Yes, that's good.",AFFIRM,,
61_00105,SYSTEM,"Congrats, the appointment booking was a success.",NOTIFY_SUCCESS,,
61_00105,USER,"Thanks a lot. Now let's put this in my calendar. I want to name it dentist appointment. Put the location at 2664 Berryessa Road # 205. And put the time as 2 o""clock in the afternoon.",INFORM,,
61_00105,SYSTEM,"I'll add the following to your calendar, event named dentist appointment, date as March 7th, time as 2 pm, location at 2664 Berryessa Road # 205. Are all the details correct?",CONFIRM,,
61_00105,USER,"Yes, that's correct.",AFFIRM,,
61_00105,SYSTEM,I've added the event to the calendar.,NOTIFY_SUCCESS,,
61_00105,USER,Thanks for your help. That's everything I need.,THANK_YOU,GOODBYE,
61_00105,SYSTEM,Have a good day and take care.,GOODBYE,,
61_00106,USER,I need a dentist in Sunnyvale.,INFORM,INFORM_INTENT,
61_00106,SYSTEM,There is Amazing Smile Dental in Sunnyvale.,OFFER,,
61_00106,USER,Do they have cosmetic services and what is the location.,REQUEST,,
61_00106,SYSTEM,They do not offer cosmetic services. The address is 689 East Remington Drive Ste A.,INFORM,,
61_00106,USER,Please find another dentist.,REQUEST_ALTS,,
61_00106,SYSTEM,"Andrei Simel , Family & Cosmetic Dentisry in Sunnyvale.",OFFER,,
61_00106,USER,That sounds good.,SELECT,,
61_00106,SYSTEM,Would you like an appointment?,OFFER_INTENT,,
61_00106,USER,"Yes, on the 7th of this month any time after half past 3 in the afternoon.",AFFIRM_INTENT,INFORM,
61_00106,SYSTEM,"Please confirm the booking with Andrei Simel , Family & Cosmetic Dentisry at 3:30 pm on March 7th.",CONFIRM,,
61_00106,USER,"Yes, that's correct.",AFFIRM,,
61_00106,SYSTEM,The appointment has been made.,NOTIFY_SUCCESS,,
61_00106,USER,Do they offer cosmetic services and what is the phone number?,REQUEST,,
61_00106,SYSTEM,They do not offer cosmetic services. The number is 408-992-0840.,INFORM,,
61_00106,USER,"Thanks, please add the event time of 3:15 in the afternoon at 990 West Fremont Avenue j to my calendar.",INFORM,,INFORM_INTENT
61_00106,SYSTEM,What name would you like?,REQUEST,,
61_00106,USER,Dental is fine.,INFORM,,
61_00106,SYSTEM,Please confirm the event name of dental for March 7th at 3:15 pm with the location of 990 West Fremont Avenue j.,CONFIRM,,
61_00106,USER,That is correct.,AFFIRM,,
61_00106,SYSTEM,The event has been added.,NOTIFY_SUCCESS,,
61_00106,USER,"Thanks, I am all set.",THANK_YOU,GOODBYE,
61_00106,SYSTEM,have a nice day.,GOODBYE,,
61_00107,USER,I haven't gotten a haircut in a long time. Can you look up salons for me?,INFORM_INTENT,,
61_00107,SYSTEM,"Sure, in what city?",REQUEST,,
61_00107,USER,Anywhere in San Francisco would be great.,INFORM,,
61_00107,SYSTEM,"Ok, it looks like 1512 Barber Shop is a highly rated salon in San Francisco. How about that?",OFFER,,
61_00107,USER,What's their address?,REQUEST,,
61_00107,SYSTEM,It's at 1532 20th Street.,INFORM,,
61_00107,USER,"Ok, that sounds perfect.",SELECT,,
61_00107,SYSTEM,Do you want to make an appointment?,OFFER_INTENT,,
61_00107,USER,"Yes, can you make it for 11:45 in the morning next Thursday?",AFFIRM_INTENT,INFORM,
61_00107,SYSTEM,"Sure. To confirm, you want to make an appointment with 1512 Barber Shop at 11:45 am on March 7th. Is that right?",CONFIRM,,
61_00107,USER,"Yes, that's right. By the way, are they unisex and what's their phone number?",REQUEST,,AFFIRM
61_00107,SYSTEM,"They are a unisex salon, and you can reach them at 415-286-4371. Sorry, it looks like 1512 Barber Shop is already booked for that day and time and I couldn't book your appointment. Do you want to try 12 pm on March 7th?",INFORM,,OFFER
61_00107,USER,"Yes, that's fine.",AFFIRM,,
61_00107,SYSTEM,"Ok, your appointment has been booked!",NOTIFY_SUCCESS,,
61_00107,USER,"Great, thank you.",THANK_YOU,,
61_00107,SYSTEM,Anything else I can help with?,REQ_MORE,,
61_00107,USER,"Yeah, can you add this event to my calendar?",INFORM_INTENT,,
61_00107,SYSTEM,"Sure, what do you want to name it and for what time?",REQUEST,,
61_00107,USER,Put it for 11:30 am and just call it Stylist visit.,INFORM,,
61_00107,SYSTEM,"Ok. To confirm, you want to add the event Stylist visit at 1532 20th Street to your calendar for 11:30 am on March 7th. Is that right?",CONFIRM,,
61_00107,USER,"Yes, that's fine.",AFFIRM,,
61_00107,SYSTEM,"Ok, the event has been added.",NOTIFY_SUCCESS,,
61_00107,USER,"Great, thanks for your help.",THANK_YOU,,
61_00107,SYSTEM,"Sure, anything else I can do?",REQ_MORE,,
61_00107,USER,"No, that's all. Thanks.",NEGATE,THANK_YOU,
61_00107,SYSTEM,"No problem, have a good day.",GOODBYE,,
61_00108,USER,I need to find a salon.,INFORM_INTENT,,
61_00108,SYSTEM,Which city should I search in?,REQUEST,,
61_00108,USER,Please look in Santa Clara.,INFORM,,
61_00108,SYSTEM,I found 9 salons for you. The first is About Time Barber Shop in Santa Clara.,OFFER,,INFORM_COUNT
61_00108,USER,"Is it unisex, and what is the address?",REQUEST,,
61_00108,SYSTEM,It is unisex and the address is 2485 De LA Cruz Boulevard.,INFORM,,
61_00108,USER,"Yes, that sounds good. Can you please book an appointment at 3:30 pm on March 13th?",INFORM,,INFORM_INTENT
61_00108,SYSTEM,Please confirm the following: Making a reservation at About Time Barber Shop on March 13th at 3:30 pm.,CONFIRM,,
61_00108,USER,"No, I would like to appointment at 9:30 in the morning on the 10th of March.",INFORM,,NEGATE
61_00108,SYSTEM,Please confirm the following: Booking an appointment for March 10th at 9:30 am.,CONFIRM,,
61_00108,USER,"Yes, that is correct.",AFFIRM,,
61_00108,SYSTEM,"I'm sorry, I couldn't book the appointment. How about an appointment with About Time Barber Shop on March 10th at 10 am?",OFFER,,
61_00108,USER,"Yes, that sounds good.",AFFIRM,,
61_00108,SYSTEM,Your appointment is confirmed.,NOTIFY_SUCCESS,,
61_00108,USER,What is their average rating?,REQUEST,,
61_00108,SYSTEM,The average rating is 4.8.,INFORM,,
61_00108,USER,What is their contact number?,REQUEST,,
61_00108,SYSTEM,The phone number is 408-727-2200.,INFORM,,
61_00108,USER,"Thank you very much, I'd like to add this to my calendar.",INFORM_INTENT,,
61_00108,SYSTEM,What time is the event and what do you want to call it?,REQUEST,,
61_00108,USER,Please use errand for the title and the time is quarter to 10 in the morning.,INFORM,,
61_00108,SYSTEM,"Please confirm the following to add to your calendar: The event is called errand, located at 2485 De La Cruz Boulevard on March 10th at 9:45 am.",CONFIRM,,
61_00108,USER,That is correct.,AFFIRM,,
61_00108,SYSTEM,It has been added to your calendar.,NOTIFY_SUCCESS,,
61_00108,USER,"Thank you for your help, that is all I need.",THANK_YOU,GOODBYE,
61_00108,SYSTEM,"You're welcome, have a good day.",GOODBYE,,
61_00109,USER,I'd like to find a salon,INFORM_INTENT,,
61_00109,SYSTEM,"Sure, what city will you be searching in?",REQUEST,,
61_00109,USER,San Francisco,INFORM,,
61_00109,SYSTEM,How about 1512 barber shop in san francisco?,OFFER,,
61_00109,USER,"Sure, I want a half past 10 in the morning appointment next friday",INFORM,,INFORM_INTENT
61_00109,SYSTEM,Please confirm: a 10:30 am appointment for 1512 barber shop is scheduled on march 8th,CONFIRM,,
