dialogue_id,speaker,turn,act_1,act_2,act_3
11_00091,SYSTEM,The venue address is 89 South Street.,INFORM,,
11_00091,USER,Sounds good!,SELECT,,
11_00091,SYSTEM,Would you like to buy any tickets?,OFFER_INTENT,,
11_00091,USER,"No, not now.",NEGATE_INTENT,,
11_00091,SYSTEM,Can I do anything else for you?,REQ_MORE,,
11_00091,USER,"Nope, that's all.",NEGATE,THANK_YOU,
11_00091,SYSTEM,"Thank you, have a good day.",GOODBYE,,
11_00092,USER,What events are happening this weekend?,INFORM_INTENT,,
11_00092,SYSTEM,What type of event and what city would you like me to search?,REQUEST,,
11_00092,USER,Please search Games in Philly.,INFORM,,
11_00092,SYSTEM,The Eagles Vs Cowboys game will be taking place at Lincoln Financial Field March 14th at 8 pm.,OFFER,,
11_00092,USER,Are there any more events?,REQUEST_ALTS,,
11_00092,SYSTEM,The Owls Vs Bison game will be at the Lincoln Financial Field. It starts at 7:30 pm the day after tomorrow.,OFFER,,
11_00092,USER,Do you have more information on this event?,REQUEST,,
11_00092,SYSTEM,It is part of the American Football league.,INFORM,,
11_00092,USER,What is the address of this event?,REQUEST,,
11_00092,SYSTEM,It is located at 1 Lincoln Financial Field Way.,INFORM,,
11_00092,USER,Are there any more games coming up?,REQUEST_ALTS,,
11_00092,SYSTEM,The Owls Vs Huskies game is at 6:30 pm on March 13th at Lincoln Financial Field.,OFFER,,
11_00092,USER,Thank you.,SELECT,,
11_00092,SYSTEM,Would you like me to book tickets for this event?,OFFER_INTENT,,
11_00092,USER,No thank you.,NEGATE_INTENT,,
11_00092,SYSTEM,Do you need anything else today?,REQ_MORE,,
11_00092,USER,No thank you.,NEGATE,THANK_YOU,
11_00092,SYSTEM,Enjoy your day.,GOODBYE,,
11_00093,USER,i am looking for events around stanford.,INFORM,INFORM_INTENT,
11_00093,SYSTEM,you can say music or sports or anything else.,REQUEST,,
11_00093,USER,i like sports events.,INFORM,,
11_00093,SYSTEM,"the event cardinal vs ducks, taking place at stanford stadium .the event is happening on day after tomorrow starting at 6:30 pm",OFFER,,
11_00093,USER,yes,REQUEST_ALTS,,
11_00093,SYSTEM,"the event is cardinal vs fighting irish, taking place at stanford stadium. the event is happening on next friday . staring at 6 pm.",OFFER,,
11_00093,USER,yes,SELECT,GOODBYE,
11_00093,SYSTEM,thank you,GOODBYE,,
11_00094,USER,Help me to find some interesting events?,INFORM_INTENT,,
11_00094,SYSTEM,in any events i want to participate.,REQUEST,,
11_00094,USER,"at phoenix, az i want to see the concert",INFORM,,
11_00094,SYSTEM,In place the van buren on march 10th there are 8 events are present they started at 7:30 pm the name was anberlin,OFFER,,
11_00094,USER,i want more evnets like blues on friday next week,INFORM,,REQUEST_ALTS
11_00094,SYSTEM,on next friday at 7:30 pm there was 1 event like greensky bluegrass at the place of the van buren,OFFER,,
11_00094,USER,yes the sounds are good,SELECT,GOODBYE,
11_00094,SYSTEM,"thank you for your help,have a good day",GOODBYE,,
11_00095,USER,Hello! I'm looking to do something exciting and new. Can you help me find some interesting events around SD?,INFORM,INFORM_INTENT,
11_00095,SYSTEM,"Sure, no problem. Did you have any preference on what type of event?",REQUEST,,
11_00095,USER,I'm currently interested in Sports events. Are there any on Saturday this week?,INFORM,,
11_00095,SYSTEM,"From my findings, there are 3 events that would peak your interest. There's one event at Padres Vs Brewers at Petco Park that is happening tomorrow at 8:30 pm.",OFFER,,
11_00095,USER,Great! Can I please have the address of the venue?,REQUEST,,
11_00095,SYSTEM,"The venue is at 100 Park Boulevard,",INFORM,,
11_00095,USER,"That's good. Can I also look at some other events? I'm interested in Baseball, hopefully around NYC?",INFORM,,REQUEST_ALTS
11_00095,SYSTEM,No worries. There's an event called Mets Vs Cubs that is taking place at Citi Field tomorrow at 7:30 pm.,OFFER,,
11_00095,USER,Great! Were they any other events happening?,REQUEST_ALTS,,
11_00095,SYSTEM,There's another events called Mets Vs Dodgers also taking place at Citi Field. The event is tomorrow at 7 pm.,OFFER,,
11_00095,USER,Can I get the address of the venue?,REQUEST,,
11_00095,SYSTEM,The venue is at 123-01 Roosevelt Avenue.,INFORM,,
11_00095,USER,That sounds great. That's all I need. Thank you so much.,SELECT,GOODBYE,
11_00095,SYSTEM,No problem. Have a great day.,GOODBYE,,
11_00096,USER,"Would you help me find cool events in Portland, OR?",INFORM,INFORM_INTENT,
11_00096,SYSTEM,Is there any type of event that you prefer?,REQUEST,,
11_00096,USER,I like Sports events around Philadelphia.,INFORM,,
11_00096,SYSTEM,I found 10 events that you will like. How about Eagles Vs Cowboys that will be at the Lincoln Financial Field? The event is on March 14th at 8 pm.,OFFER,,
11_00096,USER,That sounds good. How about other events though? I want something on Saturday this week. I like Baseball a lot.,INFORM,,REQUEST_ALTS
11_00096,SYSTEM,"I have 2 events that you'd like. How about Phillies Vs Padres at Citizens Bank Park? It will be tomorrow at 8 pm,",OFFER,,
11_00096,USER,That sounds perfect.,SELECT,,
11_00096,SYSTEM,Would you like tickets to this event?,OFFER_INTENT,,
11_00096,USER,Not at the moment. I don't need anything else.,NEGATE_INTENT,GOODBYE,
11_00096,SYSTEM,Have a good day.,GOODBYE,,
11_00097,USER,I would like to go to an interesting event on the 11th of this month.,INFORM,INFORM_INTENT,
11_00097,SYSTEM,Do you have some specific genre for the event? Do you also know the city where it should take place?,REQUEST,,
11_00097,USER,I would like to attend a Music event in NYC.,INFORM,,
11_00097,SYSTEM,"There's an event happening in Warsaw on March 11th starting at 6:30 pm, it's called Amber Run Brooklyn.",OFFER,,
11_00097,USER,Tell me the details of the event. Do you know the address?,REQUEST,,
11_00097,SYSTEM,"It's a Pop event taking place in 261 Driggs Avenue, Brooklyn.",INFORM,,
11_00097,USER,It sounds awesome!,SELECT,,
11_00097,SYSTEM,May I buy the tickets for you?,OFFER_INTENT,,
11_00097,USER,"No, thank you.",NEGATE_INTENT,,
11_00097,SYSTEM,May I assist you furthermore?,REQ_MORE,,
11_00097,USER,No but thank for what you've done to me.,NEGATE,THANK_YOU,
11_00097,SYSTEM,Have a wonderful day.,GOODBYE,,
11_00098,USER,Can you help me find interesting events?,INFORM_INTENT,,
11_00098,SYSTEM,Do you have a preference on the category of events? Any particular city I should search in?,REQUEST,,
11_00098,USER,I'm looking for a sports event around LAX on the 9th of March.,INFORM,,
11_00098,SYSTEM,At 7:30 pm on March 9th a Dodgers Vs Giants game is taking place at Dodger Stadium.,OFFER,,
11_00098,USER,Tell me more about the event.,REQUEST,,
11_00098,SYSTEM,The event involves Baseball.,INFORM,,
11_00098,USER,"This is great, and although I like baseballs I really like basketball.",INFORM,REQUEST_ALTS,
11_00098,SYSTEM,At 6 Pm on March 9th there's a Sparks Vs Mystics playing a the STAPLES Center.,OFFER,,
11_00098,USER,That sounds great.,SELECT,,
11_00098,SYSTEM,Do you want to buy tickets for this event?,OFFER_INTENT,,
11_00098,USER,"No, not right now. That's all I need.",NEGATE_INTENT,GOODBYE,
11_00098,SYSTEM,Have a great days.,GOODBYE,,
11_00099,USER,I'm looking for any Games coming up in the District of Columbia. Would you assist me in finding one please?,INFORM,,INFORM_INTENT
11_00099,SYSTEM,Sure. I found a game tomorrow at the Audi Field at 8:30 pm. It's the Dc United vs Revolution. That's just one of 10 that may interest you.,OFFER,,
11_00099,USER,That sounds fun but I'd like to check out my other options. Are there any Baseball games happening next Monday?,INFORM,,REQUEST_ALTS
11_00099,SYSTEM,"Yes, I found a game next Monday at 7:30 pm. It's going to be the Nationals Vs Braves at the Nationals Park.",OFFER,,
11_00099,USER,"Okay, perfect. That should do for now, thanks.",SELECT,GOODBYE,
11_00099,SYSTEM,"Alright, take care.",GOODBYE,,
11_00100,USER,I want to see a good concert.,INFORM,INFORM_INTENT,
11_00100,SYSTEM,Do you know what city you would like to go to?,REQUEST,,
11_00100,USER,Preferably in New York City.,INFORM,,
11_00100,SYSTEM,There are 10 concerts in New York City. One is Amber Run Brooklyn at Warsaw on March 14th at 6 pm.,OFFER,,
11_00100,USER,Sounds good.,SELECT,,
11_00100,SYSTEM,Would you like to purchase the tickets now?,OFFER_INTENT,,
11_00100,USER,"Not now, thanks.",NEGATE_INTENT,GOODBYE,
11_00100,SYSTEM,Have a nice day.,GOODBYE,,
11_00101,USER,Can you find some interesting Music events?,INFORM,INFORM_INTENT,
11_00101,SYSTEM,Is there a certain city you're looking for?,REQUEST,,
11_00101,USER,I want events around NYC on the 14th.,INFORM,,
11_00101,SYSTEM,There are 10 events that you'll like. The event is Amber Run Brooklyn in Warsaw. It's happening on March 14th at 6 pm.,OFFER,,
11_00101,USER,Perfect.,SELECT,,
11_00101,SYSTEM,Do you wish to order tickets?,OFFER_INTENT,,
11_00101,USER,"No, not at the moment. Thanks.",NEGATE_INTENT,GOODBYE,
11_00101,SYSTEM,Have a good one!,GOODBYE,,
11_00102,USER,I am looking for some interesting events to attend.,INFORM_INTENT,,
11_00102,SYSTEM,Is there a sort of event that particularly interests you?,REQUEST,,
11_00102,USER,I love to watch Match events.,INFORM,,
11_00102,SYSTEM,What city will you be in?,REQUEST,,
11_00102,USER,"I'll be in Anaheim, CA and I'm available on any day.",INFORM,,
11_00102,SYSTEM,I found 7 events including a ball game--the Angels Vs Astros next Wednesday at 7:30 PM at Angel Stadium of Anaheim.,OFFER,,
11_00102,USER,Thank you; what other events are available?,REQUEST_ALTS,,
11_00102,SYSTEM,"There's another ball game, the Angels Vs Mariners, at Angel Stadium of Anaheim next Wednesday at 8 pm.",OFFER,,
11_00102,USER,Where is this event located?,REQUEST,,
11_00102,SYSTEM,"It's a baseball game, and the stadium is located at 2000 East Gene Autry Way.",INFORM,,
11_00102,USER,I am interested in doing something this Saturday.,INFORM,REQUEST_ALTS,
11_00102,SYSTEM,The Angels Vs Orioles is at the Angel Stadium of Anaheim tomorrow at 7:30 pm.,OFFER,,
11_00102,USER,Thank you for your help; you've given me everything I need.,SELECT,GOODBYE,
11_00102,SYSTEM,You have a great day as well.,GOODBYE,,
11_00103,USER,I am meeting with a friend later to hang out. Can you find some cool places to nearby?,INFORM_INTENT,,
11_00103,SYSTEM,Would you like to participate in a music event or a sports event? Which city should I search?,REQUEST,,
11_00103,USER,Sports events will be fine. Football in particular.I will be in Portland on the 12th of this month.,INFORM,,
11_00103,SYSTEM,There are 2 events on March 12th at 8:30 pm. It is the Portland Thorns Vs Houston game at Providence Park.,OFFER,,
11_00103,USER,Those sound find. But can you find me others?,REQUEST_ALTS,,
11_00103,SYSTEM,There is another event at Providence Park on March 12th at 7 pm. It is the Timbers Vs Dc United.,OFFER,,
11_00103,USER,Can you provide me with the address?,REQUEST,,
11_00103,SYSTEM,Yes. The address is 1844 Southwest Morrison Street.,INFORM,,
11_00103,USER,That sounds great! Thank you!,SELECT,GOODBYE,
11_00103,SYSTEM,You're welcome. Have a good day.,GOODBYE,,
11_00104,USER,Are there any interesting events happening out there?,INFORM_INTENT,,
11_00104,SYSTEM,What type of event?,REQUEST,,
11_00104,USER,How about Games.,INFORM,,
11_00104,SYSTEM,Where should I look?,REQUEST,,
11_00104,USER,Check around SFO.,INFORM,,
11_00104,SYSTEM,There's Giants Vs Brewers at Oracle Park next Tuesday at 7 pm.,OFFER,,
11_00104,USER,How about a Concert on Wednesday next week.,INFORM,,REQUEST_ALTS
11_00104,SYSTEM,I see 3 for next Wednesday. Carmina Burana at San Francisco Symphony starts at 8:30 pm.,OFFER,,
11_00104,USER,"I'm intrigued. Tell me more. Where is it, exactly?",REQUEST,,
11_00104,SYSTEM,It's at 201 Van Ness Avenue. It is Classical music.,INFORM,,
11_00104,USER,Nice. What else you got?,REQUEST_ALTS,,
11_00104,SYSTEM,"I got Celine Dion at Chase Center Experience, next Wednesday at 7 pm.",OFFER,,
11_00104,USER,That sounds awesome too. I'm good for now.,SELECT,GOODBYE,
11_00104,SYSTEM,OK. See you soon.,GOODBYE,,
11_00105,USER,Can you assist me in finding some interesting events around New York?,INFORM,INFORM_INTENT,
11_00105,SYSTEM,Any preferences in terms of category of events?,REQUEST,,
11_00105,USER,"Yes, I like events that have to do with Music",INFORM,,
11_00105,SYSTEM,There's one slated for March 14th. It's the Amber Run Brooklyn happening at Warsaw by 6 pm.,OFFER,,
11_00105,USER,"Okay nice, but can you help me check out other events?",REQUEST_ALTS,,
11_00105,SYSTEM,Okay there's the Americo happening at La Boom next Wednesday by 6:30 pm.,OFFER,,
11_00105,USER,"Not bad, but can you find me other events slated for March 11th?",INFORM,REQUEST_ALTS,
11_00105,SYSTEM,"Okay, I have 9 events that I think you might like. There's Ben Harper, and it will be taking place at Pier 17 by March 11th at 8:30 pm.",OFFER,,
11_00105,USER,Can you give me more information about this event? Is there an address for the venue of the event?,REQUEST,,
11_00105,SYSTEM,Yes it's a Blues event and the address is 89 South Street.,INFORM,,
11_00105,USER,That's great,SELECT,,
11_00105,SYSTEM,Would you love to purchase ticket for this event?,OFFER_INTENT,,
11_00105,USER,"Not at the moment. Thanks, that would be all.",NEGATE_INTENT,GOODBYE,
11_00105,SYSTEM,"Alright, enjoy the rest of your day.",GOODBYE,,
11_00106,USER,Can you help me find interesting events around Phoenix?,INFORM,INFORM_INTENT,
11_00106,SYSTEM,Do you have an event category preference?,REQUEST,,
11_00106,USER,I like concert events and I can go any day.,INFORM,,
11_00106,SYSTEM,I found 8 events you might be interested in. An event called Anberlin on March 10th at 7:30 pm and takes place at The Van Buren.,OFFER,,
11_00106,USER,What is the venue address?,REQUEST,,
11_00106,SYSTEM,The venue is located at 401 West Van Buren Street.,INFORM,,
11_00106,USER,That sounds great.,SELECT,,
11_00106,SYSTEM,Do you want to buy tickets for this event?,OFFER_INTENT,,
11_00106,USER,"No, not right now. That's all I need.",NEGATE_INTENT,GOODBYE,
11_00106,SYSTEM,Have a great day.,GOODBYE,,
11_00107,USER,Can you check to see if any occurrences of interest are nearby?,INFORM_INTENT,,
11_00107,SYSTEM,Give me a city to check.,REQUEST,,
11_00107,USER,I want to see what's happening around Los Angeles.,INFORM,,
11_00107,SYSTEM,Is there any specific type event you want to search for?,REQUEST,,
11_00107,USER,"As a big fan of American Football, I'd love it if you could show me any nearby Sports events.",INFORM,,
11_00107,SYSTEM,"I have found 5 events relevant to your interests. One such event is the Rams VS Cardinals match. It takes place at the LA Memorial Coliseum, and the time is 6 pm on March 12th.",OFFER,,
11_00107,USER,"That sounds fine, but I'd like to hear about other events.",REQUEST_ALTS,,
11_00107,SYSTEM,"Another match that might appeal to you is the Trojans Vs Bulldogs one. It also takes place at the LA Memorial Coliseum, but instead happens on the day after tomorrow at 8:30 pm.",OFFER,,
11_00107,USER,Sounds good to me.,SELECT,,
11_00107,SYSTEM,Do you want to purchase tickets for this game?,OFFER_INTENT,,
11_00107,USER,Not at the moment.,NEGATE_INTENT,,
11_00107,SYSTEM,Is there any other way I can assist you today?,REQ_MORE,,
11_00107,USER,Not right now. I appreciate your help.,NEGATE,THANK_YOU,
11_00107,SYSTEM,Enjoy the rest of your day!,GOODBYE,,
11_00108,USER,Can you help me find interesting events such as American Football or other Match events?,INFORM,,INFORM_INTENT
11_00108,SYSTEM,Which city would you like me to search in?,REQUEST,,
11_00108,USER,Around Berkeley please.,INFORM,,
11_00108,SYSTEM,The Golden Bears Vs Cougars at California Memorial Stadium will take place on March 9th at 6 pm.,OFFER,,
11_00108,USER,"Perfect, thank you.",SELECT,GOODBYE,
11_00108,SYSTEM,"Glad to help, have a great day.",GOODBYE,,
11_00109,USER,Can you please help me find events like games?,INFORM,INFORM_INTENT,
11_00109,SYSTEM,Do you have any city preference?,REQUEST,,
11_00109,USER,"Yes, It can be baseball around Chicago on any day.",INFORM,,
11_00109,SYSTEM,There is an event of Cubs Vs Brewers at Wrigley Field starting at 6:30 pm next wednesday.,OFFER,,
11_00109,USER,Is there anything in Los Angeles on 8th of March?,INFORM,,REQUEST_ALTS
11_00109,SYSTEM,Next Friday there is one event of Dodgers Vs Cubs at Dodger Stadium starting at 7:30 pm.,OFFER,,
11_00109,USER,Thats all I need. Thanks.,SELECT,GOODBYE,
11_00109,SYSTEM,Have a good day.,GOODBYE,,
11_00110,USER,Can you help me find some interesting events?,INFORM_INTENT,,
11_00110,SYSTEM,Do you like any particular category? Music? Sports? Something else?,REQUEST,,
11_00110,USER,I want concert events. Something on the 13th of this month,INFORM,,
11_00110,SYSTEM,Any particular city?,REQUEST,,
11_00110,USER,Maybe in New York City. I love hip hop,INFORM,,
11_00110,SYSTEM,I found 2 events. One is the Blowout Music Festival at Knockdown Center. The event is happening on March 13th at 6:30 pm,OFFER,,
11_00110,USER,What's the address?,REQUEST,,
11_00110,SYSTEM,"The venue is at 52-19 Flushing Avenue, Maspeth",INFORM,,
11_00110,USER,That sounds good,SELECT,,
11_00110,SYSTEM,Do you want me to buy tickets?,OFFER_INTENT,,
11_00110,USER,"No not right now, that's all I need",NEGATE_INTENT,GOODBYE,
11_00110,SYSTEM,Have a great day,GOODBYE,,
11_00111,USER,"I really like Baseball, please find me some interesting events.",INFORM,INFORM_INTENT,
11_00111,SYSTEM,What city in particular should I search in?,REQUEST,,
11_00111,USER,"I like sports events, I am looking for events in Seattle, something going on next Thursday.",INFORM,,
11_00111,SYSTEM,There are 2 events which you will like. The event is Mariners Vs Tigers. taking place at 8:30 pm next Thursday at the T-Mobile Park.,OFFER,,
11_00111,USER,What is the venue address?,REQUEST,,
11_00111,SYSTEM,The venue is located at 1250 1st Avenue South.,INFORM,,
11_00111,USER,"That is all I need, that sounds great.",SELECT,GOODBYE,
11_00111,SYSTEM,Have a good day.,GOODBYE,,
11_00112,USER,"I have vacation days coming up, and I am looking for interesting events to attend. Could you please find me something on the 7th?",INFORM,INFORM_INTENT,
11_00112,SYSTEM,Is there a particular category you'd prefer? Which city should I search in?,REQUEST,,
11_00112,USER,I'd like Match events around DC.,INFORM,,
11_00112,SYSTEM,"There's a Mystics Vs Sun game at the Entertainment & Sports Arena next Thursday, starting at 7 pm.",OFFER,,
11_00112,USER,Sounds perfect!,SELECT,,
11_00112,SYSTEM,Would you like tickets for this event?,OFFER_INTENT,,
11_00112,USER,"No, not at the moment.",NEGATE_INTENT,,
11_00112,SYSTEM,Will there be anything else?,REQ_MORE,,
11_00112,USER,"No, thanks. You've been very helpful.",NEGATE,THANK_YOU,
11_00112,SYSTEM,Have a wonderful day.,GOODBYE,,
11_00113,USER,Help me find Music events around New York.,INFORM,,INFORM_INTENT
11_00113,SYSTEM,I found 10. One event is the Amber Run Brooklyn in Warsaw on March 14th at 6 pm.,OFFER,,
11_00113,USER,Anything related?? How about something involving hip hop on the 8th of this month?,INFORM,,REQUEST_ALTS
11_00113,SYSTEM,Here's 1. The Blowout Music Festival at Knockdown Center. It's next Friday at 6 pm.,OFFER,,
11_00113,USER,What's the address?,REQUEST,,
11_00113,SYSTEM,"52-19 Flushing Avenue, Maspeth",INFORM,,
11_00113,USER,Great,SELECT,,
11_00113,SYSTEM,Anything else I can help you with?,REQ_MORE,,
11_00113,USER,Nope. Thanks.,NEGATE,THANK_YOU,
11_00113,SYSTEM,Have a great day.,GOODBYE,,
11_00114,USER,Hello. Can you help me find some interesting events to do today?,INFORM,INFORM_INTENT,
11_00114,SYSTEM,Any particular city or area I should search?,REQUEST,,
11_00114,USER,"I am looking for events around Vancouver, BC.",INFORM,,
11_00114,SYSTEM,Do you like any particular category? You can say Music or Sports or anything else.,REQUEST,,
11_00114,USER,I really like Blues. How about Music events.,INFORM,,
11_00114,SYSTEM,Zz Top is playing at the PNE Amphitheatre today starting at 6 pm.,OFFER,,
11_00114,USER,"Thank you, but can you please find me some other events? I would like to see what is happening on the 10th of this month, specifically in and around Brisbane.",INFORM,,REQUEST_ALTS
11_00114,SYSTEM,The Star City Music Festival is taking place at Brisbane Community Park. This is occurring on March 10th starting at 8:30 pm.,OFFER,,
11_00114,USER,"That sounds great, thanks.",SELECT,,
11_00114,SYSTEM,Would you like to purchase tickets for this event?,OFFER_INTENT,,
11_00114,USER,No thank you.,NEGATE_INTENT,,
11_00114,SYSTEM,Can I help you with anything else today?,REQ_MORE,,
11_00114,USER,No thanks. I appreciate your help.,NEGATE,THANK_YOU,
11_00114,SYSTEM,Have a great day.,GOODBYE,,
11_00115,USER,"I am looking for some interesting events, can you help me?",INFORM_INTENT,,
11_00115,SYSTEM,What is your preference on the category of events?,REQUEST,,
11_00115,USER,Games are my favorite events.,INFORM,,
11_00115,SYSTEM,What city should I search in?,REQUEST,,
11_00115,USER,What are some interesting events around NYC?,INFORM,,
11_00115,SYSTEM,"There are 10 events that you'll like, one being the Mets Vs Braves at Citi Field which is taking place on March 13th beginning at 6 pm.",OFFER,,
11_00115,USER,That works for me.,SELECT,,
11_00115,SYSTEM,Do you need tickets for the event?,OFFER_INTENT,,
11_00115,USER,"No, that's all I need for now.",NEGATE_INTENT,GOODBYE,
11_00115,SYSTEM,Good day.,GOODBYE,,
11_00116,USER,"Hi I have a friend visiting and I'm looking for some interesting events around NYC, can you help me?",INFORM,INFORM_INTENT,
11_00116,SYSTEM,What specific category of events are you looking for?,REQUEST,,
11_00116,USER,I'm looking for Games events.,INFORM,,
11_00116,SYSTEM,I managed to find 10 events that I think you'll like. There is a game for the Mets Vs Braves at Citi Field on March 13th at 6 pm.,OFFER,,
11_00116,USER,That's perfect.,SELECT,,
11_00116,SYSTEM,Would you like to purchase tickets?,OFFER_INTENT,,
11_00116,USER,"No, not at this time.",NEGATE_INTENT,,
11_00116,SYSTEM,Is there anything else I can help you with.,REQ_MORE,,
11_00116,USER,"That will be all, thank you.",NEGATE,THANK_YOU,
11_00116,SYSTEM,Have a pleasant day.,GOODBYE,,
11_00117,USER,I want to find Music events.,INFORM,INFORM_INTENT,
11_00117,SYSTEM,In which city?,REQUEST,,
11_00117,USER,Phoenix please.,INFORM,,
11_00117,SYSTEM,"I found 8 events, the first is Anberlin at the Van Buren.",OFFER,,INFORM_COUNT
11_00117,USER,When does it start? Where is it?,REQUEST,,
11_00117,SYSTEM,At 5:30 pm at 401 West Van Buren Street.,INFORM,,
11_00117,USER,That's perfect.,SELECT,,
11_00117,SYSTEM,Do you want tickets?,OFFER_INTENT,,
11_00117,USER,No that is all.,NEGATE_INTENT,GOODBYE,
11_00117,SYSTEM,Have a good day.,GOODBYE,,
11_00118,USER,I'm looking for an event.,INFORM_INTENT,,
11_00118,SYSTEM,Is there a particular city that you're interested in?,REQUEST,,
11_00118,USER,"Yes, in DC.",INFORM,,
11_00118,SYSTEM,"Is there an event in particular that you would like, such as music or sports?",REQUEST,,
11_00118,USER,I would like something in the games category.,INFORM,,
11_00118,SYSTEM,I have 10 possibilities for you. One of them is DC United Vs Revolution at Audi Field.,OFFER,,INFORM_COUNT
11_00118,USER,I like that one.,SELECT,,
11_00118,SYSTEM,Shall I make reservations for you?,OFFER_INTENT,,
11_00118,USER,"Not yet, I don't think.",NEGATE_INTENT,,
11_00118,SYSTEM,What else may I do for you?,REQ_MORE,,
11_00118,USER,Nothing right now.,NEGATE,THANK_YOU,
11_00118,SYSTEM,Thanks for calling us.,GOODBYE,,
11_00119,USER,I wish to find for events.,INFORM_INTENT,,
11_00119,SYSTEM,In which city do you prefer?,REQUEST,,
11_00119,USER,I wish to see the events in Brisbane.,INFORM,,
11_00119,SYSTEM,What do you want to see?,REQUEST,,
11_00119,USER,I am searching for Concert.,INFORM,,
11_00119,SYSTEM,The event Star City Music Festival is at Brisbane Community Park.,OFFER,,
11_00119,USER,It is looking nice for me.,SELECT,,
11_00119,SYSTEM,Are you wish to book tickets for that event?,OFFER_INTENT,,
11_00119,USER,Nope. This time I don't want to get tickets. This is what I need.,NEGATE_INTENT,GOODBYE,
11_00119,SYSTEM,Have a fantastic day.,GOODBYE,,
11_00120,USER,"I'd like to search for an event, any date will do.",INFORM,INFORM_INTENT,
11_00120,SYSTEM,"Do you have a preferred type of event such as music or sports, and what city would you like me to search in?",REQUEST,,
11_00120,USER,"Uh I'd like to go to a concert, somewhere in san diego.",INFORM,,
11_00120,SYSTEM,There is an event for Alejandro Sanz at the Cal Coast Credit Union Amphitheater.,OFFER,,
11_00120,USER,What kind of event is that and when will it be?,REQUEST,,
11_00120,SYSTEM,It is an international event and starts at 7:30 pm,INFORM,,
11_00120,USER,That sounds like a great event to me.,SELECT,,
11_00120,SYSTEM,Would you like to purchase tickets for the event?,OFFER_INTENT,,
11_00120,USER,"No I don't want to buy tickets right now, I just needed some info thanks!",NEGATE_INTENT,GOODBYE,
11_00120,SYSTEM,"You're welcome, have a great day!",GOODBYE,,
11_00121,USER,I want to go to an event,INFORM_INTENT,,
11_00121,SYSTEM,Sure. What city? Any type of event?,REQUEST,,
11_00121,USER,I'm looking for music events in Philly,INFORM,,
11_00121,SYSTEM,Ok. I found 10 events for you. How about Blueface at The Fillmore Philadelphia,OFFER,,INFORM_COUNT
11_00121,USER,Great,SELECT,,
11_00121,SYSTEM,Would you like to book tickets,OFFER_INTENT,,
11_00121,USER,"Eh, not right now. Thanks",NEGATE_INTENT,GOODBYE,
11_00121,SYSTEM,Always here to help,GOODBYE,,
11_00122,USER,"I'm looking for some Music events in Philly, do you know of anything?",INFORM,,INFORM_INTENT
11_00122,SYSTEM,There's an event called Blueface at The Fillmore Philadelphia.,OFFER,,
11_00122,USER,Are there any other events out there?,REQUEST_ALTS,,
11_00122,SYSTEM,There's an event called Conan Gray at The Fillmore Philadelphia.,OFFER,,
11_00122,USER,How about anything else?,REQUEST_ALTS,,
