dialogue_id,speaker,turn,act_1,act_2,act_3
55_00029,USER,"I'll be taking a trip soon. Assistant, find me tickets for one-way flights.",INFORM_INTENT,,
55_00029,SYSTEM,Please indicate your departure city.,REQUEST,,
55_00029,USER,I'll be leaving Philadelphia for this trip.,INFORM,,
55_00029,SYSTEM,Where will you be traveling to?,REQUEST,,
55_00029,USER,There are 2 people in my group that will be traveling with me to New York.,INFORM,,
55_00029,SYSTEM,"Thank you. Next, please tell me the date on which you wish to leave.",REQUEST,,
55_00029,USER,I'll begin my travels on the 3rd of this month.,INFORM,,
55_00029,SYSTEM,"At 4:45 pm, an American Airlines flight will be departing. There are 0 stops along the way and the ticket will have a cost of $55.",OFFER,,
55_00029,USER,That sounds like a great option.,SELECT,,
55_00029,SYSTEM,I can buy these tickets for you now. Do you want me to make that purchase?,OFFER_INTENT,,
55_00029,USER,I think so. Please purchase Economy class tickets for me. I prefer traveling in that class.,AFFIRM_INTENT,INFORM,
55_00029,SYSTEM,Confirm the following details about your flight: You will depart from Philadelphia on American Airlines on March 3rd to head to New York. You want to purchase 2 Economy class tickets for this flight.,CONFIRM,,
55_00029,USER,That's everything I can think of. Please go ahead and confirm this purchase.,AFFIRM,,
55_00029,SYSTEM,Your one way flight ticket has been purchased and confirmed.,NOTIFY_SUCCESS,,
55_00029,USER,Thank you! Tell me what airport the flight departs from please.,REQUEST,,
55_00029,SYSTEM,The flight will be leaving on March 3rd from the PHL International Airport.,INFORM,,
55_00029,USER,"Thank you assistant! Before I let you go, can you tell me about Economy Bus Tickets as well?",INFORM,INFORM_INTENT,
55_00029,SYSTEM,Would the departure date be March 3rd as well?,REQUEST,,
55_00029,USER,I'm planning to leave next Monday actually.,INFORM,,
55_00029,SYSTEM,There are 8 buses that fit your description. There is a bus leaving at 8:30 am. This Economy class ticket will cost you $25.,OFFER,,
55_00029,USER,That sounds like a winner to me.,SELECT,,
55_00029,SYSTEM,Do you require any other assistance?,REQ_MORE,,
55_00029,USER,That's all the help that I need. I appreciate your help.,NEGATE,THANK_YOU,
55_00029,SYSTEM,Please enjoy the rest of your day.,GOODBYE,,
55_00030,USER,Can you find me a one way flight on economy with united airlines,INFORM,,INFORM_INTENT
55_00030,SYSTEM,where are you traveling to and when are you leaving,REQUEST,,
55_00030,USER,i am traveling to lax on wednesday next week,INFORM,,
55_00030,SYSTEM,where are you traveling from,REQUEST,,
55_00030,USER,i am traveling from san fran,INFORM,,
55_00030,SYSTEM,I found 1 flights for you with united airlines with 0 stop for $95 leave on 10:05 pm,OFFER,,
55_00030,USER,what airport does it depart from,REQUEST,,
55_00030,SYSTEM,this is depart from sfo international airport,INFORM,,
55_00030,USER,when does it arrive? is it refundable?,REQUEST,,
55_00030,SYSTEM,this is a refundable ticket arrive at 11:30 pm,INFORM,,
55_00030,USER,"ok perfect, can you purchase the ticket for me",INFORM_INTENT,SELECT,
55_00030,SYSTEM,please confirm your purchase for 1 economy ticket with united airlines from san francisco to los angeles on march 6th,CONFIRM,,
55_00030,USER,yes please. what airport does it arrive,REQUEST,AFFIRM,
55_00030,SYSTEM,you will arrive at lax international airport,INFORM,NOTIFY_SUCCESS,
55_00030,USER,what about the bus? can you find me a flexible bus ticket to get there on march 1st,INFORM,,INFORM_INTENT
55_00030,SYSTEM,i found you 10 bus tickets. i recommend you flexible ticket for $70 leaving at 7 am,OFFER,,
55_00030,USER,What else do you have? i prefer economy ticket leaving on 3rd of march,INFORM,,REQUEST_ALTS
55_00030,SYSTEM,i found you 9 buses. This is a economy ticekt for $51 depart at 7:40 am,OFFER,,
55_00030,USER,ok perfect,SELECT,GOODBYE,
55_00030,SYSTEM,have a nice day,GOODBYE,,
55_00031,USER,Can you find me any one-way flights? I will leave on 1st of March from SF.,INFORM,,INFORM_INTENT
55_00031,SYSTEM,Where are you planning to go?,REQUEST,,
55_00031,USER,I am going to Los Angeles and would prefer to have Southwest Airlines.,INFORM,,
55_00031,SYSTEM,I have found 1 Southwest Airlines flight that looks good for you. This flight has 0 stops and leaves at 12:50 pm. The ticket costs $108.,OFFER,,
55_00031,USER,What airport does this flight leave from? Is the ticket a refundable one?,REQUEST,,
55_00031,SYSTEM,"This flight departs from SFO International Airport, but it is not refundable.",INFORM,,
55_00031,USER,That flight sounds fine. Will you help me in buying a ticket on a one-way flight? I have 3 people in my group.,INFORM,INFORM_INTENT,SELECT
55_00031,SYSTEM,Confirm the following details if you would: the flight leaves from San Francisco and goes to Los Angeles on Southwest Airlines on March 1st. You will have 3 passengers in the economy seating class.,CONFIRM,,
55_00031,USER,Yes that sounds fine.,AFFIRM,,
55_00031,SYSTEM,Your oneway ticket has been successfully reserved.,NOTIFY_SUCCESS,,
55_00031,USER,What airport is the flight going to?,REQUEST,,
55_00031,SYSTEM,It will fly to LAX International Airport.,INFORM,,
55_00031,USER,What time does the onward flight get there?,REQUEST,,
55_00031,SYSTEM,The flight will arrive at 2:15 pm.,INFORM,,
55_00031,USER,Thank you for helping me. What about the bus going there? I want to leave on the 12th and prefer economy tickets for 3 people.,INFORM,,
55_00031,SYSTEM,What about a bus departing at 7 am at a cost of $51 for an economy ticket?,OFFER,,
55_00031,USER,"That sounds fine, that was all I needed.",SELECT,GOODBYE,
55_00031,SYSTEM,Have a fine day.,GOODBYE,,
55_00032,USER,I need a one-way flight please.,INFORM_INTENT,,
55_00032,SYSTEM,When would you like to begin your travels? From where would you like to depart from?,REQUEST,,
55_00032,USER,I want to travel on the 8th of March to San Diego and from San Francisco.,INFORM,,
55_00032,SYSTEM,There is an Alaska Airlines flight which matches your selection. It will depart at 6:10 AM and has 0 stops. The ticket price is $99.,OFFER,,
55_00032,USER,Which airport will the flight arrive at?,REQUEST,,
55_00032,SYSTEM,The destination airport is SAN International Airport.,INFORM,,
55_00032,USER,That flight sounds good.,SELECT,,
55_00032,SYSTEM,Would you like to purchase these tickets now?,OFFER_INTENT,,
55_00032,USER,"Yes, I want those tickets.",AFFIRM_INTENT,,
55_00032,SYSTEM,Please confirm the following information: The flight will depart from San Francisco and arrive at San Diego on March 8th. The airlines is Alaska Airlines and the number of people in your party is 1. The seating class is Economy.,CONFIRM,,
55_00032,USER,"Yes, that sounds great. And which airport will this flight depart from? Is this ticket refundable?",REQUEST,,AFFIRM
55_00032,SYSTEM,Your oneway ticket is now confirmed. The flight will depart from SFO International Airport. The ticket is not refundable.,INFORM,,NOTIFY_SUCCESS
55_00032,USER,Thank you for that. How about the bus to there? I wanna leave on the 7th of this month. I prefer Economy tickets.,INFORM,,INFORM_INTENT
55_00032,SYSTEM,There is a bus set to depart at 11 AM and the ticket price is $59. It is an Economy ticket.,OFFER,,
55_00032,USER,What is the name of the bus station that I leave from?,REQUEST,,
55_00032,SYSTEM,The origin station is designated as Salesforce Transit Center.,INFORM,,
55_00032,USER,"OK, that's perfect. Thank you.",SELECT,GOODBYE,
55_00032,SYSTEM,Of course. Have a wonderful day.,GOODBYE,,
55_00033,USER,I need to find a one way flight.,INFORM_INTENT,,
55_00033,SYSTEM,What airport will you be flying out of? Where would you like to go?,REQUEST,,
55_00033,USER,I need to leave SD going to Los Angeles.,INFORM,,
55_00033,SYSTEM,What date would you like to leave on?,REQUEST,,
55_00033,USER,I need to leave on the 4th.,INFORM,,
55_00033,SYSTEM,What do you think about an Alaska Airlines flight that leaves at 3:20 pm and has 0 layovers for $62. I also have 3 other options if you dont like that one.,OFFER,,
55_00033,USER,"I need it for two people. I don""t like Alaskan.",INFORM,REQUEST_ALTS,
55_00033,SYSTEM,how about an American Airlines flight that leaves at 9:50 am and has 0 layovers for $63.,OFFER,,
55_00033,USER,What time does it arrive and where?,REQUEST,,
55_00033,SYSTEM,It arrives at 10:44 am at LAX International Airport.,INFORM,,
55_00033,USER,That sounds great. I need to buy 2 refundable tickets for that flight.,INFORM,INFORM_INTENT,SELECT
55_00033,SYSTEM,Just to confirm you would to to purchase 2 economy tickets on the American Airlines flight departing on March 4th from San Diego going to Los Angeles.,CONFIRM,,
55_00033,USER,Yes that is great. Where does that depart from?,REQUEST,AFFIRM,
55_00033,SYSTEM,Your tickets are booked and it departs from SAN International Airport.,INFORM,NOTIFY_SUCCESS,
55_00033,USER,IS there any buses going there on the 5th of March. Look for Economy tickets please.,INFORM,,INFORM_INTENT
55_00033,SYSTEM,How about the bus departing at 6:10 am and its only $32 for an Economy Ticket. I also have 10 other buses if you prefer a different one.,OFFER,,
55_00033,USER,Showing another one.,REQUEST_ALTS,,
55_00033,SYSTEM,How about the bus departing at 6:50 am and its only $27 for an Economy Ticket,OFFER,,
55_00033,USER,I want to change and leave on the 4th with an Economy extra ticket.,INFORM,,REQUEST_ALTS
55_00033,SYSTEM,what about the bus departing at 8:30 am and its only $37 for an Economy extra Ticket. I also have 8 other buses if you prefer a different one.,OFFER,,
55_00033,USER,What station does it arrive into.,REQUEST,,
55_00033,SYSTEM,It arrives at Union Station.,INFORM,,
55_00033,USER,That's great. Thanks for you help. That will be all for now.,SELECT,GOODBYE,
55_00033,SYSTEM,Enjoy the rest of your evening.,GOODBYE,,
55_00034,USER,I ma leaving 10th of march to san fran and leaving fro las vegas,INFORM,,
55_00034,SYSTEM,4 flights for you american airlines. leaves at 10:55 am and has 0 stops and is $99,OFFER,,
55_00034,USER,I will go to economy for 1 person,INFORM,,
55_00034,SYSTEM,confirm las vegas san francisco american airlines leaving march 10th for 1 person in economy,CONFIRM,,
55_00034,USER,yes when does the onward flight get here?,REQUEST,AFFIRM,
55_00034,SYSTEM,"yes, the onward flight leaves at 12:30 pm",INFORM,NOTIFY_SUCCESS,
55_00034,USER,"thanks, how about the bus?",INFORM_INTENT,,
55_00034,SYSTEM,will you depart march 10th?,REQUEST,,
55_00034,USER,I will leave next tuesday,INFORM,,
55_00034,SYSTEM,bus laves at 10:50 am and the price is $42 and is an economy ticket,OFFER,,
55_00034,USER,that is good,SELECT,,
55_00034,SYSTEM,wanna get tickets on the bus?,OFFER_INTENT,,
55_00034,USER,thanks that is all,NEGATE_INTENT,GOODBYE,
55_00034,SYSTEM,Have a good one,GOODBYE,,
55_00035,USER,Would you look for one way flights?,INFORM_INTENT,,
55_00035,SYSTEM,Where are you leaving from and where are you going? When do you want to leave?,REQUEST,,
55_00035,USER,I will leave on the 6th from SFO to San Diego.,INFORM,,
55_00035,SYSTEM,I have 5 flights that should work. There is an Alaska Airlines outbound flight that leaves at 11:10 am and has 0 stops. The ticket costs $100.,OFFER,,
55_00035,USER,That flight sounds great. Could you help me to buy a one way flight ticket?,INFORM_INTENT,SELECT,
55_00035,SYSTEM,"Could you confirm that you are leaving from San Diego to San Francisco on Alaska Airlines on March 6th, and that you need 1 economy ticket?",CONFIRM,,
55_00035,USER,Sounds good to me. Is the ticket refundable?,REQUEST,AFFIRM,
55_00035,SYSTEM,"Your one way ticket has been confired. No, the ticket cannot be refunded.",INFORM,NOTIFY_SUCCESS,
55_00035,USER,Thank you for helping. What about the bus going there? It's for four people on economy.,INFORM,,INFORM_INTENT
55_00035,SYSTEM,When will you depart? What about March 6th?,REQUEST,,
55_00035,USER,I would like to leave on March 13th.,INFORM,,
55_00035,SYSTEM,I have 6 buses that should work. What about a bus leaving at 7:40 am that costs $50? It is an economy ticket.,OFFER,,
55_00035,USER,Sounds good to me.,SELECT,,
55_00035,SYSTEM,Shall I buy tickets on this bus?,OFFER_INTENT,,
55_00035,USER,"No, not right now.",NEGATE_INTENT,,
55_00035,SYSTEM,Could I assist with anything else?,REQ_MORE,,
55_00035,USER,"No, but thank you for helping.",NEGATE,THANK_YOU,
55_00035,SYSTEM,Have a good one.,GOODBYE,,
55_00036,USER,"Hi, are there any one-way flights I can travel on?",INFORM_INTENT,,
55_00036,SYSTEM,When do you plan to travel?,REQUEST,,
55_00036,USER,I will be leaving next Wednesday for my holiday.,INFORM,,
55_00036,SYSTEM,And where are you planning to visit?,REQUEST,,
55_00036,USER,I will be travelling to NYC.,INFORM,,
55_00036,SYSTEM,Where will you be departing from?,REQUEST,,
55_00036,USER,I will likely depart from Washington.,INFORM,,
55_00036,SYSTEM,"There are 2 available flights, one of which is an American Airlines flight with 0 layovers which departs at 6:05 am and costs $78.",OFFER,,
55_00036,USER,Are there any alternative flights I can take?,REQUEST_ALTS,,
55_00036,SYSTEM,"Yes there is, would you like the Southwest Airlines flight with 0 layovers which will depart at 9:15 am and cost you $75?",OFFER,,
55_00036,USER,Sure this is great! Could you purchase the tickets for me please?,INFORM_INTENT,SELECT,
55_00036,SYSTEM,Please confirm your purchase of 1 Economy class tickets for the Southwest Airlines flight from Washington to New York on March 6th.,CONFIRM,,
55_00036,USER,That sounds great!,AFFIRM,,
55_00036,SYSTEM,Your flight ticket has been purchased!,NOTIFY_SUCCESS,,
55_00036,USER,Thank you! May I know if this ticket is refundable?,REQUEST,,
55_00036,SYSTEM,"Unfortunately, this is a non-refundable ticket.",INFORM,,
55_00036,USER,"What a pity, thanks for your help though. Could you help me search for buses travelling there too?",INFORM_INTENT,,
55_00036,SYSTEM,Will you be departing on March 6th?,REQUEST,,
55_00036,USER,"No, I will be departing on March 8th instead.",INFORM,,
55_00036,SYSTEM,"Sure, would you like an Economy bus ride which departs at 8:10 am and costs $35.",OFFER,,
55_00036,USER,"Sure, which bus station will I be departing from?",REQUEST,,
55_00036,SYSTEM,You will be departing from Union Station.,INFORM,,
55_00036,USER,"Sure, and which station does the bus arrive at?",REQUEST,,
55_00036,SYSTEM,You will arrive at Port Authority Station.,INFORM,,
55_00036,USER,"Sure, that sounds great! That is all I need, thank you!",SELECT,GOODBYE,
55_00036,SYSTEM,"No worries, have a safe trip!",GOODBYE,,
55_00037,USER,Can you find a one-way flight to NYC from Philly for three people?,INFORM,,
55_00037,SYSTEM,When are you leaving?,REQUEST,,
55_00037,USER,I would leave on Friday next week.,INFORM,,
55_00037,SYSTEM,There are 4 flights. There is American Airlines that leaves at 4:45 pm and has 0 stops for $57.,OFFER,,
55_00037,USER,I would like to buy a ticket.,INFORM_INTENT,SELECT,
55_00037,SYSTEM,"Booking 3 tickets for Philadelphia to New York with American Airlines on March 8th, economy seats.",CONFIRM,,
55_00037,USER,"Yes, that is correct. Which Airport does the flight depart from?",REQUEST,AFFIRM,
55_00037,SYSTEM,The flight leaves from PHL International Airport.,INFORM,NOTIFY_SUCCESS,
55_00037,USER,Is there a bus going there?,INFORM_INTENT,,
55_00037,SYSTEM,When would you like to depart on March 8th?,REQUEST,,
55_00037,USER,"Yes, March 8th works for me.",AFFIRM,,
55_00037,SYSTEM,"There are 8 buses. There is one leaving at 8:30 am for the price of $23, economy ticket.",OFFER,,
55_00037,USER,That is all I needed.,SELECT,GOODBYE,
55_00037,SYSTEM,Have a good day.,GOODBYE,,
55_00038,USER,Hello! I have a very short trip. Please can you find me to book a one-way flight?,INFORM_INTENT,,
55_00038,SYSTEM,Sure! I can do that for you. From where are you flying and which is your destination point?,REQUEST,,
55_00038,USER,I'll be travelling to NY from Philadelphia.,INFORM,,
55_00038,SYSTEM,When are you planning to leave?,REQUEST,,
55_00038,USER,I'll be leaving on 13th of this month.,INFORM,,
55_00038,SYSTEM,There are 4 suitable flights for you. The American Airlines outbound flight will be leaving at 4:45 pm and it has 0 stops. The price for your travel will be $64.,OFFER,,
55_00038,USER,Sounds good to me.,SELECT,,
55_00038,SYSTEM,Do you want me to book tickets for you in this flight?,OFFER_INTENT,,
55_00038,USER,"Yup, I wish to book 3 tickets in this flight.",AFFIRM_INTENT,INFORM,
55_00038,SYSTEM,"Please can you confirm me that you wish to book 3 Economy tickets in American Airlines that is departing from Philadelphia to New York on March 13th, right?",CONFIRM,,
55_00038,USER,"Yup, sounds good to me.",AFFIRM,,
55_00038,SYSTEM,Okay! your one way ticket confirmation is successful.,NOTIFY_SUCCESS,,
55_00038,USER,Is it a refundable or a non-refundable ticket? Which is the departure airport?,REQUEST,,
55_00038,SYSTEM,Sorry that the ticket is non-refundable. The flight will depart from PHL International Airport.,INFORM,,
55_00038,USER,Thanks for the information. Do you have any bus transportation to that place for I wish to have some Economy extra tickets and I will be travelling on 9th of this month.,INFORM,,INFORM_INTENT
55_00038,SYSTEM,"Yup, a bus leaving at 8:30 am has Economy extra ticket and the ticket price is only $33.",OFFER,,
55_00038,USER,Do you have any other buses available on the same day? I would prefer Economy tickets rather than extra ticket.,INFORM,REQUEST_ALTS,
55_00038,SYSTEM,"Yup, there are 7 buses are leaving on the same day and only one bus is leaving at 9:50 am and it has Economy ticket and the ticket fare is just $23.",OFFER,,
55_00038,USER,Do you have any other buses available?,REQUEST_ALTS,,
55_00038,SYSTEM,"Yup, there is a bus leaving at 10:10 am which has Economy ticket and the ticket price will be only $24.",OFFER,,
55_00038,USER,Sounds good to me.,SELECT,,
55_00038,SYSTEM,"So, do you wish to get tickets on this bus?",OFFER_INTENT,,
55_00038,USER,"Nope, not right now, but might be later on.",NEGATE_INTENT,,
55_00038,SYSTEM,Do you want me to help on anything else?,REQ_MORE,,
55_00038,USER,"Nope, thanks much for your help.",NEGATE,THANK_YOU,
55_00038,SYSTEM,Have a wonderful day.,GOODBYE,,
55_00039,USER,I need to find a one way flight please.,INFORM_INTENT,,
55_00039,SYSTEM,Departing from where?,REQUEST,,
55_00039,USER,I'll be going from Philadelphia.,INFORM,,
55_00039,SYSTEM,When would you like to leave?,REQUEST,,
55_00039,USER,The 8th of March please.,INFORM,,
55_00039,SYSTEM,What is your destination?,REQUEST,,
55_00039,USER,Going to Washington.,INFORM,,
55_00039,SYSTEM,American Airlines has a flight at 9:45 AM with 1 stop and that is a $146 ticket.,OFFER,,
55_00039,USER,That should work.,SELECT,,
55_00039,SYSTEM,Would you like to make reservations?,OFFER_INTENT,,
55_00039,USER,Yes I would.,AFFIRM_INTENT,,
55_00039,SYSTEM,Confirming a flight on American Airlines on March 8th from Philadelphia to Washington for 1 economy ticket.,CONFIRM,,
55_00039,USER,That sounds perfect.,AFFIRM,,
55_00039,SYSTEM,The reservation is complete.,NOTIFY_SUCCESS,,
55_00039,USER,Thank you. I also need to find a bus please.,INFORM_INTENT,,
55_00039,SYSTEM,Is that for a March 8th departure?,REQUEST,,
55_00039,USER,"That's correct, thank you.",AFFIRM,,
55_00039,SYSTEM,I have one leaving at 7:30 AM which is a $30 economy ticket.,OFFER,,
55_00039,USER,That would work.,SELECT,,
55_00039,SYSTEM,Do you want to purchase tickets?,OFFER_INTENT,,
55_00039,USER,Not this time.,NEGATE_INTENT,,
55_00039,SYSTEM,Is there anything else today?,REQ_MORE,,
55_00039,USER,I don't think so.,NEGATE,THANK_YOU,
55_00039,SYSTEM,Thank you very much.,GOODBYE,,
55_00040,USER,"I am planning to travel to Atlanta, GA for which I need your help to find some one-way flights. Can you search for the one for me?",INFORM,INFORM_INTENT,
55_00040,SYSTEM,"Yes, let me know your planned date and place that you want to leave from.",REQUEST,,
55_00040,USER,I have planned my travel from San Francisco on the 9th.,INFORM,,
55_00040,SYSTEM,What about an outbound flight with Alaska Airlines which leaves at 3:55 pm with 0 stops for which the ticket cost is $196? Hope you will choose this one I think.,OFFER,,
55_00040,USER,"Let me decide, before that I want to know about the date and place of arrival of that onward flight.",REQUEST,,
55_00040,SYSTEM,The onward flight will reach the destination Airport Hartsfield-Jackson International Airport at 0:21 am. Hope this information useful for your selection.,INFORM,,
55_00040,USER,"Yes, that was useful. But I prefer to go with something else to LAX under Economy class. Can you search for the available flights based on this?",INFORM,,REQUEST_ALTS
55_00040,SYSTEM,"Yes, found 3 results that suit to you. What about an outbound flight with American Airlines which leaves at 4:25 pm with 0 stops for which the ticket cost is $88? Hope you will like this one I think",OFFER,,
55_00040,USER,Any other available flights in your search list?,REQUEST_ALTS,,
55_00040,SYSTEM,What about a flight with Southwest Airlines which leaves at 12:50 pm with 0 stops for which the ticket cost is $93? Hope you will choose this one I think,OFFER,,
55_00040,USER,"Yes, I like this flight and want to proceed further.",SELECT,,
55_00040,SYSTEM,How can I help? Shall I purchase tickets to this flight?,OFFER_INTENT,,
55_00040,USER,"Yes, do it for me.",AFFIRM_INTENT,,
55_00040,SYSTEM,Please confirm to book 1 Economy class ticket in a flight with Southwest Airlines from San Francisco on March 9th to Los Angeles.,CONFIRM,,
55_00040,USER,"Yes, that is confirmed to proceed.",AFFIRM,,
55_00040,SYSTEM,I have booked the tickets successfully.,NOTIFY_SUCCESS,,
55_00040,USER,Thanks and let me know the time and place of arrival of this onward flight.,REQUEST,,
55_00040,SYSTEM,This flight will arrive to the destination LAX International Airport at 2:15 pm.,INFORM,,
55_00040,USER,That's great and thanks. Can you search for a bus to go there?,INFORM_INTENT,,
55_00040,SYSTEM,"Yes, Shall I proceed with the departure date of March 9th?",REQUEST,,
55_00040,USER,"Yes, check for that date and I want to book flexible tickets.",INFORM,AFFIRM,
55_00040,SYSTEM,What about your opinion on a bus leaves at 7 am under ticket cost $64 which is flexible one.,OFFER,,
55_00040,USER,That is okay for me and thanks. That's all for now.,SELECT,GOODBYE,
55_00040,SYSTEM,Have a good day.,GOODBYE,,
55_00041,USER,I need a one-way flight.,INFORM_INTENT,,
55_00041,SYSTEM,Where are you going? When are you leaving? Where are you leaving from?,REQUEST,,
55_00041,USER,I want Alaska Airlines. I'm going to LA with two people on March 9th. I'm going from San Francisco.,INFORM,,
55_00041,SYSTEM,I found 1 Alaska Airlines flight that leaves at 7:10 pm and costs $98 with 0 stops.,OFFER,,
55_00041,USER,That's a good one.,SELECT,,
55_00041,SYSTEM,Would you like tickets?,OFFER_INTENT,,
55_00041,USER,Yes I would.,AFFIRM_INTENT,,
55_00041,SYSTEM,2 economy class Alaska Airlines tickets from San Francisco to Los Angeles on March 9th. Is this what you want?,CONFIRM,,
55_00041,USER,Yes it is. When will the onward flight be there? What airport does it go from?,REQUEST,,AFFIRM
55_00041,SYSTEM,Your ticket has been booked. It leaves at SFO International Airport and arrives at 8:35 pm.,INFORM,,NOTIFY_SUCCESS
55_00041,USER,I want a bus to go there. I'm leaving today.,INFORM,INFORM_INTENT,
55_00041,SYSTEM,I found 10 buses. A bus is leaving at 7 am and costs $50. It's an economy ticket.,OFFER,,
55_00041,USER,What station does it go to? What station would I leave from?,REQUEST,,
55_00041,SYSTEM,Salesforce Transit Center is the origin station. Union Station is the destination.,INFORM,,
55_00041,USER,That's fine. That's all I wanted.,SELECT,GOODBYE,
55_00041,SYSTEM,Have a nice day.,GOODBYE,,
55_00042,USER,Find for me please some one-way flights.,INFORM_INTENT,,
55_00042,SYSTEM,Tell me where are you planning to visit and from where will you be leaving .You plan to leave when?,REQUEST,,
55_00042,USER,I will leave from LAX to SD on March 10th.,INFORM,,
55_00042,SYSTEM,I have 3 flights for you.With Alaska Airlines the outbound flight will go at 7:30 am and have 0 stops.Cost wil be $60.,OFFER,,
55_00042,USER,Tell me which is the airport from where I will depart.,REQUEST,,
55_00042,SYSTEM,From LAX International Airport,INFORM,,
55_00042,USER,That's the one I like it.,SELECT,,
55_00042,SYSTEM,You want to buy tickets for it?,OFFER_INTENT,,
55_00042,USER,Yes will be perfect.,AFFIRM_INTENT,,
55_00042,SYSTEM,You want 1 Economy ticket for flight with Alaska Airlines that goes from Los Angeles to San Diego on March 10th.I'm right?,CONFIRM,,
55_00042,USER,Yes perfect.Tell me if the ticket is refundable and at which airport the flight will arrive.,REQUEST,,AFFIRM
55_00042,SYSTEM,Ticket was confirmed.Your ticket is refundable and your destination is SAN International Airport.,INFORM,,NOTIFY_SUCCESS
55_00042,USER,Thanks.Find me a bus that goes there.I want some Flexible tickets.,INFORM,INFORM_INTENT,
55_00042,SYSTEM,Tell me when you want to depart.Would you like to be in March 10th?,REQUEST,,
55_00042,USER,Yes that s good for me.,AFFIRM,,
55_00042,SYSTEM,I have 10 results for you.A bus that leave at 7:40 am and a Flexible ticket cost is $49.,OFFER,,
55_00042,USER,Sounds very good.That's all.,SELECT,GOODBYE,
55_00042,SYSTEM,Have a good day!,GOODBYE,,
55_00043,USER,I am going to washington,INFORM,,INFORM_INTENT
55_00043,SYSTEM,where are you going from?,REQUEST,,
55_00043,USER,I will go the 6th and leave NYC,INFORM,,
55_00043,SYSTEM,southwest airlines is 1 flight and it leaves 2:35 pm with 0 stops and price is $88,OFFER,,
55_00043,USER,I love the travelling economy and three people are in the group,INFORM,,INFORM_INTENT
55_00043,SYSTEM,flight from new york to washington on southwest airlines and leaves march 6th with 3 people economy class,CONFIRM,,
55_00043,USER,yes that is good,AFFIRM,,
