dialogue_id,speaker,turn,act_1,act_2,act_3
73_00026,SYSTEM,Is there anything else I can help you with?,REQ_MORE,,
73_00026,USER,No. That will be all. Thank you!,NEGATE,THANK_YOU,
73_00026,SYSTEM,I am glad I could help. Have a nice day!,GOODBYE,,
73_00027,USER,I'm leaving NY soon/ Can you find a round trip for three people?,INFORM,,INFORM_INTENT
73_00027,SYSTEM,You're leaving New York when? Where will you be going?,REQUEST,,
73_00027,USER,I leave later today to visit ATL.,INFORM,,
73_00027,SYSTEM,When will you be back?,REQUEST,,
73_00027,USER,On the 11th of this month.,INFORM,,
73_00027,SYSTEM,Okay. There's a $130 American Airlines flight that leaves at 11:45 am and returns at 3:25 pm. How's that sound?,OFFER,,
73_00027,USER,Sounds great to me!,SELECT,,
73_00027,SYSTEM,Want to buy tickets for it?,OFFER_INTENT,,
73_00027,USER,"Yes. Economy tickets, please.",AFFIRM_INTENT,INFORM,
73_00027,SYSTEM,Okay. I will purchase 3 economy tickets for your group to go on an American Airlines flight from New York to Atlanta. It will depart at 11:45 am on March 1st and return at 3:25 pm on March 11th.,CONFIRM,,
73_00027,USER,"Sounds good. If my plans change, can I get a refund?",REQUEST,AFFIRM,
73_00027,SYSTEM,"I got the tickets. Unfortunately, a refund will not be possible.",INFORM,NOTIFY_SUCCESS,
73_00027,USER,"At what airport does the flight go to, and at what time will the return flight appear?",REQUEST,,
73_00027,SYSTEM,"The flight travels to Hartsfield-Jackson International Airport, and the return flight arrives at 5:47 pm.",INFORM,,
73_00027,USER,Thanks. Can you find a hotel there for me?,INFORM_INTENT,,
73_00027,SYSTEM,How about AC Hotel by Marriott Atlanta Buckhead at Phipps Plaza? It has a 4.5 rating.,OFFER,,
73_00027,USER,Sounds fantastic to me.,SELECT,,
73_00027,SYSTEM,Want to reserve that hotel?,OFFER_INTENT,,
73_00027,USER,"Yes, I do.",AFFIRM_INTENT,,
73_00027,SYSTEM,Want to leave March 11th?,REQUEST,,
73_00027,USER,No. I want to book three rooms until the 9th of this month.,INFORM,,
73_00027,SYSTEM,Want to check in on March 1st?,REQUEST,,
73_00027,USER,I'd rather check into 1 room next Friday.,INFORM,,
73_00027,SYSTEM,You'll book 1 room at AC Hotel by Marriott Atlanta Buckhead at Phipps Plaza in Atlanta from March 8th until March 9th?,CONFIRM,,
73_00027,USER,Yes. What's the street address and phone number?,REQUEST,,AFFIRM
73_00027,SYSTEM,"I booked the hotel. You can reach them at 3600 Wieuca Road Northeast, and the phone number is +1 470-231-3030.",INFORM,,NOTIFY_SUCCESS
73_00027,USER,Great. What are some child-friendly attractions in the area?,INFORM,INFORM_INTENT,
73_00027,SYSTEM,There's a lovely park called Atlanta Botanical Garden.,OFFER,,
73_00027,USER,Nice. What else?,REQUEST_ALTS,,
73_00027,SYSTEM,There's also the Atlanta History Center museum.,OFFER,,
73_00027,USER,Great to know.,SELECT,,
73_00027,SYSTEM,Can I help out with anything else?,REQ_MORE,,
73_00027,USER,No. That was a great help. Thanks!,NEGATE,THANK_YOU,
73_00027,SYSTEM,Enjoy your time there!,GOODBYE,,
73_00028,USER,I would lke to find a round trip flight.,INFORM_INTENT,,
73_00028,SYSTEM,What are your travel plans as far as when you are leaving and where are starting and ending your travels?,REQUEST,,
73_00028,USER,"I would like to travel from Seattle, WA on the 4th and return on the 7th.",INFORM,,
73_00028,SYSTEM,Where will you be visiting?,REQUEST,,
73_00028,USER,I am visiting Los Angeles.,INFORM,,
73_00028,SYSTEM,I found 5 flights that meet your citeria. Alaska Airlines has a flight departing at 3:45 pm and returning at 7:10 pm for a ticket price of $152.,OFFER,,
73_00028,USER,That flight is perfect.,SELECT,,
73_00028,SYSTEM,Would you like to purchase tickets?,OFFER_INTENT,,
73_00028,USER,"Yes, please purchase two economy tickets.",AFFIRM_INTENT,INFORM,
73_00028,SYSTEM,"Please confirm 2 economy tickets on Alaska Airlines flight leaving Seattle on March 4th at 3:45 pm, and returning from Los Angeles March 7th at 7:10 pm.",CONFIRM,,
73_00028,USER,"Yes, that is right. Which airport do I fly out from?",REQUEST,AFFIRM,
73_00028,SYSTEM,Your ticket is confirmed. You will be departing from Seattle-Tacoma International Airport.,INFORM,NOTIFY_SUCCESS,
73_00028,USER,Is this a refundable ticket?,REQUEST,,
73_00028,SYSTEM,"Yes, this ticket is refundable.",INFORM,,
73_00028,USER,"Thanks! Now, I would l ike to find a hotel nearby.",INFORM_INTENT,,
73_00028,SYSTEM,The AC Hotel by Marriott Beverly Hills has a 4.4 rating.,OFFER,,
73_00028,USER,What else is listed?,REQUEST_ALTS,,
73_00028,SYSTEM,The Airtel Plaza Hotel has a 3.9 rating.,OFFER,,
73_00028,USER,What else is listed. I will need two rooms.,INFORM,REQUEST_ALTS,
73_00028,SYSTEM,I have 8 hotels that you may like. The Banana Bungalow - Hollywood Hostel has a 4.1 rating.,OFFER,,INFORM_COUNT
73_00028,USER,What is their phone number and address?,REQUEST,,
73_00028,SYSTEM,"You may reach them at +1 323-469-2500 and they are located at 5920 Hollywood Boulevard, Hollywood CA 90028, USA.",INFORM,,
73_00028,USER,That one works for me.,SELECT,,
73_00028,SYSTEM,Would you like to make reservations?,OFFER_INTENT,,
73_00028,USER,"Yes, please reserve a room checking in on the 4th and leaving on the March 5th.",AFFIRM_INTENT,INFORM,
73_00028,SYSTEM,Please confirm 2 rooms at the the Banana Bungalow - Hollywood Hostel in Los Angeles arriving on March 4th and leaving on March 5th.,CONFIRM,,
73_00028,USER,Correct. Is this a pet friendly hotel? What is the price?,REQUEST,,AFFIRM
73_00028,SYSTEM,Your reservations have been confirmed and the cost will be $300. They sadly do not allow pets.,INFORM,,NOTIFY_SUCCESS
73_00028,USER,Thank you. Please tell if there is a kid-firendly tourist attraction close by.,THANK_YOU,,
73_00028,SYSTEM,I found 7 attractions you may like. One tourist attraction is the Hollywood Walk of Fame.,OFFER,,INFORM_COUNT
73_00028,USER,"Okay, thank you.",SELECT,,
73_00028,SYSTEM,Is there anything else I can assist you with right now?,REQ_MORE,,
73_00028,USER,"No, that is it right now. Thanks!",NEGATE,THANK_YOU,
73_00028,SYSTEM,Enjoy the day!,GOODBYE,,
73_00029,USER,Could you help me look for a round trip flight for my sake?,INFORM_INTENT,,
73_00029,SYSTEM,What place will you depart from?,REQUEST,,
73_00029,USER,I am departing from Paris.,INFORM,,
73_00029,SYSTEM,"What place do you intend to go to, and what time do you intend to depart?",REQUEST,,
73_00029,USER,"I am going to LAX, and will depart on this Sunday.",INFORM,,
73_00029,SYSTEM,What time will you return?,REQUEST,,
73_00029,USER,Ii'd like to return on the 10th.,INFORM,,
73_00029,SYSTEM,There is a ticket costing $388 for an outbound American Airlines flight that departs at 4:05 am. The feturn flight departs at 9:40 am.,OFFER,,
73_00029,USER,That flight is perfect for me.,SELECT,,
73_00029,SYSTEM,Do you want me to purchase tickets for it?,OFFER_INTENT,,
73_00029,USER,"Yeah, I'd like toe reserve the ticket.",AFFIRM_INTENT,,
73_00029,SYSTEM,"Please verify the following information: an economy seat for 1 for an outbound American Airlines flight that departs from Paris to Los Angeles. The flight departs on March 3rd at 4:05 am, and has a return flight leaving at 9:40 am on MArch 10th.",CONFIRM,,
73_00029,USER,"Yeah, that's perfect.",AFFIRM,,
73_00029,SYSTEM,Your ticket is verified.,NOTIFY_SUCCESS,,
73_00029,USER,Thank you for your assistance. I'd like to look a hotel there.,INFORM_INTENT,,
73_00029,SYSTEM,"I discovered 10 hotels. What do you think about Ac Hotel by Marriott Beverly Hills, which has a 4.4 rating?",OFFER,,INFORM_COUNT
73_00029,USER,"What is its location, and does it offer pets?",REQUEST,,
73_00029,SYSTEM,"It doesn't permit pets, and the location is 6399 Wilshire Boulevard.",INFORM,,
73_00029,USER,"That's wonderful. I'd like to book 1 room at the hotel, and I'd like to check out on March 9th.",INFORM,,INFORM_INTENT
73_00029,SYSTEM,Would you like to check in on March 3rd?,REQUEST,,
73_00029,USER,"I'd like to reserve two rooms, and check in on next Friday.",INFORM,,
73_00029,SYSTEM,"Please verify the following information: a booking for 2 rooms at Ac Hotel By Marriott Beverly Hills in Los Angeles. The check-in date is MArch 8th, and the check-out date is March 9th.",CONFIRM,,
73_00029,USER,"I'd like to check out on next Friday, and want to check in on March 4th.",INFORM,,NEGATE
73_00029,SYSTEM,"Please verify the following information: the check-in date is March 4th, and the check-out day is March 8th.",CONFIRM,,
73_00029,USER,"Yeah, that's fine by me.",AFFIRM,,
73_00029,SYSTEM,Your booking is successful.,NOTIFY_SUCCESS,,
73_00029,USER,"Thank you for your help. Can you tell me about several attractions there? I'd like something that is friendly for children, and I'm searching for stadium.",THANK_YOU,,
73_00029,SYSTEM,"I recommend you go to the Dodger Stadium, which is a sports venue.",OFFER,,
73_00029,USER,"Alright, wonderful. That's all; see ya.",SELECT,GOODBYE,
73_00029,SYSTEM,Have fun at the event!,GOODBYE,,
73_00030,USER,I need a round trip flight.,INFORM_INTENT,,
73_00030,SYSTEM,When would you like to leave?,REQUEST,,
73_00030,USER,I want to leave this saturday.,INFORM,,
73_00030,SYSTEM,Where would you like to go and when would you like to return? Where are you leaving from?,REQUEST,,
73_00030,USER,I will be leaving from Philadelphia to los angeles and I want to return on the 6th of march.,INFORM,,
73_00030,SYSTEM,There are 2 suitable flights. There is an outbound flight on delta airlines that leaves at 2:20 pm. The flight returns at 1:40 pm and it costs $311,OFFER,,
73_00030,USER,That would be fine. I want tickets for 2.,INFORM,INFORM_INTENT,SELECT
73_00030,SYSTEM,You would like economy tickets for 2 on a delta airlines flight from Philadelphia to Los Angeles that leaves on March 2nd at 2:20 pm and returns on March 6th at 1:40 pm?,CONFIRM,,
73_00030,USER,That would be fine.,AFFIRM,,
73_00030,SYSTEM,I have reserved your tickets.,NOTIFY_SUCCESS,,
73_00030,USER,I would need 2 rooms at a hotel when I get there.,INFORM,INFORM_INTENT,
73_00030,SYSTEM,There is ac hotel by marriott beverly hills that has a rating of 4.4.,OFFER,,
73_00030,USER,That would be ideal.,SELECT,,
73_00030,SYSTEM,Would you like me to make the reservation?,OFFER_INTENT,,
73_00030,USER,"Yes, go head.",AFFIRM_INTENT,,
73_00030,SYSTEM,You would like to check in on March 2nd and check out on March 6th?,REQUEST,,
73_00030,USER,"Yes, that could work.",AFFIRM,,
73_00030,SYSTEM,You would like to book 2 rooms at ac hotel by marriott beverly hills in los angeles from march 2nd to March 6th?,CONFIRM,,
73_00030,USER,That would be ok. Are pets allowed and what is their phone number?,REQUEST,,AFFIRM
73_00030,SYSTEM,I have made the reservation. The number is +1 323-852-7000 and pets are not allowed.,INFORM,,NOTIFY_SUCCESS
73_00030,USER,What fun place is there to visit there?,INFORM_INTENT,,
73_00030,SYSTEM,There are 10 suitable attractions. There is a historical landmark called angels flight railway.,OFFER,,INFORM_COUNT
73_00030,USER,Great. I will check it out.,SELECT,,
73_00030,SYSTEM,Is there anything else you would need?,REQ_MORE,,
73_00030,USER,No. You have been helpful. Thanks.,NEGATE,THANK_YOU,
73_00030,SYSTEM,Enjoy your day.,GOODBYE,,
73_00031,USER,"Hello, I'm looking for a round trip flights. Please can you find me one?",INFORM_INTENT,,
73_00031,SYSTEM,"Sure, when is your return date?",REQUEST,,
73_00031,USER,I'll be returning most probably on 13th of March.,INFORM,,
73_00031,SYSTEM,Okay! When is your start date of journey? From where are you flying and where are you heading to?,REQUEST,,
73_00031,USER,"I'll be travelling from Chicago to LA on 7th of this month. Only 1, that's me will be travelling and I would prefer an Economy ticket.",INFORM,,
73_00031,SYSTEM,Okay! I can find 3 flights suitable for your trip. The American Airlines outbound flight will leave at 4:30 am and the return flight will start at 8:30 am. The cost for the journey will be $195.,OFFER,,
73_00031,USER,Looks to be a good deal. Is it a refundable ticket? Which is the departure airport?,REQUEST,,
73_00031,SYSTEM,"Sorry, the ticket is non-refundable and from O'Hare International Airport, the flight will depart.",INFORM,,
73_00031,USER,"Do you have any other flights available with round-trip? If Southwest Airlines is available, that would be great.",INFORM,REQUEST_ALTS,
73_00031,SYSTEM,"Okay, lemme check... Here you go! there is 1 Southwest airlines flight available and the outbound flight starts at 9:10 am and it will return by starting at 6:45 pm. The journey cost will be $233.",OFFER,,
73_00031,USER,Sounds good to me.,SELECT,,
73_00031,SYSTEM,Can I reserve for you in this flight?,OFFER_INTENT,,
73_00031,USER,"Yup, Please book a refundable ticket, for my plans might change later on.",AFFIRM_INTENT,INFORM,
73_00031,SYSTEM,"Sure. Please confirm me that you wish to book 1 refundable ticket to fly from Chicago to Los Angeles in Southwest Airlines on March 7th at 9:10 am in Economy class and the return flight will leave on March 13th at 6:45 pm, right?",CONFIRM,,
73_00031,USER,"Yup, perfect. thanks.",AFFIRM,,
73_00031,SYSTEM,Okay! your ticket confirmation is successful.,NOTIFY_SUCCESS,,
73_00031,USER,Please can you find some good hotels there and book two rooms?,INFORM,INFORM_INTENT,
73_00031,SYSTEM,sure. Do you wish to stay at Ac Hotel By Marriott Beverly Hills for its rating is nearly 4.4?,OFFER,,
73_00031,USER,sounds perfect to me.,SELECT,,
73_00031,SYSTEM,Do you want me to book the room at this hotel?,OFFER_INTENT,,
73_00031,USER,"Yup, please make the reservation?",AFFIRM_INTENT,,
73_00031,SYSTEM,So do you wish to check in on March 7th and check out on March 13th?,REQUEST,,
73_00031,USER,"Yup, you're right. A slight change. I'll be checking out on the 12th.",INFORM,AFFIRM,
73_00031,SYSTEM,"Okay! Please can you confirm me that you wish to book 2 rooms at Ac Hotel By Marriott Beverly Hills in Los Angeles on March 7th till March 12th, right?",CONFIRM,,
73_00031,USER,"Yup, you're correct.",AFFIRM,,
73_00031,SYSTEM,Okay! I've successfully booked the room to you.,NOTIFY_SUCCESS,,
73_00031,USER,Thanks. Where is the hotel exactly located?,REQUEST,,
73_00031,SYSTEM,It's located at 6399 Wilshire Boulevard.,INFORM,,
73_00031,USER,Is it pet-friendly? What's the cost of stay per night?,REQUEST,,
73_00031,SYSTEM,"It would cost $1,860 in total including tax and sorry that they do not allow pets.",INFORM,,
73_00031,USER,Thanks much for the information.,THANK_YOU,,
73_00031,SYSTEM,Do you need any other help?,REQ_MORE,,
73_00031,USER,Please can you suggest some attractions there which is child-friendly. It would be good if you can suggest in the place of interest I have.,INFORM,,INFORM_INTENT
73_00031,SYSTEM,"Sure! What about the Tourist Attraction, Hollywood Walk of Fame?",OFFER,,
73_00031,USER,Sounds good to me. That's all I need.,SELECT,GOODBYE,
73_00031,SYSTEM,Have a nice time and a nice day.,GOODBYE,,
73_00032,USER,"I am looking for an economy round trip flight from Atlanta, GA to San Fran.",INFORM,,
73_00032,SYSTEM,When do you want to leave and return?,REQUEST,,
73_00032,USER,I am leaving on the 6th of this month and returning on the 12th of March.,INFORM,,
73_00032,SYSTEM,There are 4 flights including an American Airlines flight that costs $260. The outbound flight is at 11:40 am and the return flight leaves at 2:15 pm.,OFFER,,
73_00032,USER,What times do the two flights arrive?,REQUEST,,
73_00032,SYSTEM,The outbound flight arrives at 2:06 pm and the return flight arrives at 1:27 am.,INFORM,,
73_00032,USER,That flight is perfect.,SELECT,,
73_00032,SYSTEM,Do you want to purchase the tickets?,OFFER_INTENT,,
73_00032,USER,Please buy the ticket.,AFFIRM_INTENT,,
73_00032,SYSTEM,Please confirm you want 1 economy ticket on the round trip American Airlines flight from Atlanta to San Francisco. The outbound flight is on March 6th at 11:40 am and the return flight is on March 12th at 2:15 pm.,CONFIRM,,
73_00032,USER,That is perfect.,AFFIRM,,
73_00032,SYSTEM,The ticket has been purchased.,NOTIFY_SUCCESS,,
73_00032,USER,Which airport does it fly out of?,REQUEST,,
73_00032,SYSTEM,The flight leaves Hartsfield-Jackson International Airport.,INFORM,,
73_00032,USER,Are there any stops? Which airport does the flight arrive at?,REQUEST,,
73_00032,SYSTEM,There is 1 stop and the arrival is at SFO International Airport.,INFORM,,
73_00032,USER,Thank you. I also need a hotel to stay at.,INFORM_INTENT,,
73_00032,SYSTEM,There is a 3.5 rated hotel called Amsterdam Hostel San Francisco.,OFFER,,
73_00032,USER,That is good.,SELECT,,
73_00032,SYSTEM,Do you want to make the reservation?,OFFER_INTENT,,
73_00032,USER,I want one room from the 10th of March to March 11th.,AFFIRM_INTENT,INFORM,
73_00032,SYSTEM,Please confirm you want to book 1 room at Amsterdam Hostel San Francisco in San Francisco from March 10th to March 11th.,CONFIRM,,
73_00032,USER,That sounds good.,AFFIRM,,
73_00032,SYSTEM,The reservation is successful.,NOTIFY_SUCCESS,,
73_00032,USER,Is there a child-friendly park there?,THANK_YOU,,
73_00032,SYSTEM,There are 5 attractions including a park called Fort Funston.,OFFER,,INFORM_COUNT
73_00032,USER,That will be all for now.,SELECT,GOODBYE,
73_00032,SYSTEM,See you soon!,GOODBYE,,
73_00033,USER,I need a roundtrip flight please.,INFORM_INTENT,,
73_00033,SYSTEM,When are you leaving?,REQUEST,,
73_00033,USER,The 12th of this month.,INFORM,,
73_00033,SYSTEM,Where are you leaving from and what is your destination? Also when will you be returning?,REQUEST,,
73_00033,USER,"I'm going to San Fran from Atlanta, GA and want to return on the 14th of this month.",INFORM,,
73_00033,SYSTEM,I have a 2:30 PM American Airlines flight which comes back at 3:50 PM for $263.,OFFER,,
73_00033,USER,What is the arrival time of the onward flight and is it a 1 stop flight?,REQUEST,,
73_00033,SYSTEM,"Yes, it is 1 stop and arrives at 6:15 PM.",INFORM,,
73_00033,USER,Sounds good. I'd like an economy ticket.,INFORM,INFORM_INTENT,SELECT
73_00033,SYSTEM,Confirming an American Airlines flight from Atlanta to San Francisco on March 12th at 2:30 PM and returning March 14th at 3:50 PM for 1 economy ticket.,CONFIRM,,
73_00033,USER,"Sounds perfect, thanks.",AFFIRM,,
73_00033,SYSTEM,The reservation is complete.,NOTIFY_SUCCESS,,
73_00033,USER,I appreciate it.,THANK_YOU,,
73_00033,SYSTEM,How else may I help you?,REQ_MORE,,
73_00033,USER,I also need two books two hotel rooms.,INFORM,INFORM_INTENT,
73_00033,SYSTEM,"I have 10 possible hotels for you. Are you interested in Amsterdam Hostel San Francisco, which is rated 3.5?",OFFER,,INFORM_COUNT
73_00033,USER,"Sure, let's make a reservation.",INFORM_INTENT,SELECT,
73_00033,SYSTEM,Checking out March 14th?,REQUEST,,
73_00033,USER,Yes that's right.,AFFIRM,,
73_00033,SYSTEM,Checking in March 12th?,REQUEST,,
73_00033,USER,"Now, checking in on the 13th.",INFORM,,
73_00033,SYSTEM,Confirming 2 rooms at Amsterdam Hostel San Francisco in San Francisco on March 13th for a March 14th check out.,CONFIRM,,
73_00033,USER,"Correct, thank you.",AFFIRM,,
73_00033,SYSTEM,The reservation is complete.,NOTIFY_SUCCESS,,
73_00033,USER,Could you look for some child friendly attractions for me as well? A museum maybe?,INFORM,,INFORM_INTENT
73_00033,SYSTEM,The Cable Car Museum is a good museum.,OFFER,,
73_00033,USER,Is it free admission?,REQUEST,,
73_00033,SYSTEM,No it's not.,INFORM,,
73_00033,USER,"Thank you, I'm all set for now.",SELECT,GOODBYE,
73_00033,SYSTEM,You're very welcome.,GOODBYE,,
73_00034,USER,Would you search round trip flights for me?,INFORM_INTENT,,
73_00034,SYSTEM,When are you leaving?,REQUEST,,
73_00034,USER,I am leaving to LA on MArch 10th.,INFORM,,
73_00034,SYSTEM,Where are you departing from?,REQUEST,,
73_00034,USER,"I am departing Portland, OR.",INFORM,,
73_00034,SYSTEM,When are you arriving back?,REQUEST,,
73_00034,USER,I'm getting back the 13th of this month.,INFORM,,
73_00034,SYSTEM,An American Airlines flight leaves 6 am and returns 5:20 am for $206.,OFFER,,
73_00034,USER,Would there be any other flights?,REQUEST_ALTS,,
73_00034,SYSTEM,Delta Airlines has an outbound flight leaving 9:35 am and returning 6:50 am for $195.,OFFER,,
73_00034,USER,Will it be refundable?,REQUEST,,
73_00034,SYSTEM,"No, it's not refundable.",INFORM,,
73_00034,USER,The flight sounds good. I'd like Economy.,INFORM,INFORM_INTENT,SELECT
73_00034,SYSTEM,Please confirm a flight from Portland to Los Angeles from Delta Airlines departing March 10th and returning March 13th leaving 9:35 am and returning 6:50 am for 1 passenger Economy.,CONFIRM,,
73_00034,USER,"Yes, that is great. When does the flight arrive and which airport does it leave from?",REQUEST,,AFFIRM
73_00034,SYSTEM,The ticket is confirmed arriving 12:08 pm and departing from PDX international Airport.,INFORM,,NOTIFY_SUCCESS
73_00034,USER,I would like to search a hotel there.,INFORM_INTENT,,
73_00034,SYSTEM,What about the AC hotel by Marriott Beverly Hills rated 4.4?,OFFER,,
73_00034,USER,That is great.,SELECT,,
73_00034,SYSTEM,Would you like to continue to reserve the hotel?,OFFER_INTENT,,
73_00034,USER,"Yes, I'd like to reserve the hotel.",AFFIRM_INTENT,,
73_00034,SYSTEM,Would you like check out on March 13th and check in March 10th?,REQUEST,,
73_00034,USER,"Yes, I'd like to check out March 12th.",INFORM,AFFIRM,
73_00034,SYSTEM,Please confirm a Reservation for the Ac Hotel By Marriott Beverly Hills Los Angeles with a check-in date March 10th and March 12th booking 1 rooms.,CONFIRM,,
73_00034,USER,"Yes, that will work for me.",AFFIRM,,
73_00034,SYSTEM,You have successfully made a reservation.,NOTIFY_SUCCESS,,
73_00034,USER,Thanks a lot. Show me some attractions there and a museum.,THANK_YOU,,
73_00034,SYSTEM,Check out the Autry Museum of the American west a museum.,OFFER,,
73_00034,USER,Okay that is good.,SELECT,,
73_00034,SYSTEM,Is there anything else I can help with?,REQ_MORE,,
73_00034,USER,No that will be all.,NEGATE,THANK_YOU,
73_00034,SYSTEM,Enjoy that so much.,GOODBYE,,
73_00035,USER,I need to search for a round trip flight,INFORM_INTENT,,
73_00035,SYSTEM,Where are you traveling from?,REQUEST,,
73_00035,USER,I leave from ATL,INFORM,,
73_00035,SYSTEM,And what is the destination and travel date?,REQUEST,,
73_00035,USER,I am visiting New York City on 8th of this month,INFORM,,
73_00035,SYSTEM,When would you be coming back?,REQUEST,,
73_00035,USER,I get back on the 12th,INFORM,,
73_00035,SYSTEM,There is a American Airlines flight that leaves at 3:25 pm and costs $158. The return flight leaves at 11:45 am,OFFER,,
73_00035,USER,Is it refundable? which is the destination airport?,REQUEST,,
73_00035,SYSTEM,The flight is non refundable and arrives at JFK international airport.,INFORM,,
73_00035,USER,Sounds good to me.,SELECT,,
73_00035,SYSTEM,Should I book your ticket?,OFFER_INTENT,,
73_00035,USER,"yes, do that.",AFFIRM_INTENT,,
73_00035,SYSTEM,Booking 1 economy ticket on the american airlines flight from Atlanta to New York on March 8th 3:25 pm with return flight on March 12th at 11:45 am,CONFIRM,,
73_00035,USER,Sounds perfect to me.,AFFIRM,,
73_00035,SYSTEM,Your ticket is booked successfully,NOTIFY_SUCCESS,,
73_00035,USER,Thanks a lot. I also need to search for a hotel there.,INFORM_INTENT,,
73_00035,SYSTEM,How about the 4.5 star rated 1 hotel brooklyn bridge?,OFFER,,
73_00035,USER,Sounds good. book one room from the 11th to the 12th.,INFORM,,
73_00035,SYSTEM,Booking 1 room at 1 hotel brooklyn bridge in New York from March 11th to March 12th.,CONFIRM,,
73_00035,USER,sounds perfect to me.,AFFIRM,,
73_00035,SYSTEM,Your booking is confirmed.,NOTIFY_SUCCESS,,
73_00035,USER,"Thanks, can you also help me find some attractions there?",INFORM_INTENT,,
73_00035,SYSTEM,"Sure, there is a performing arts venue at 92nd Street Y",OFFER,,
73_00035,USER,"Okay, anything else you can recommend?",REQUEST_ALTS,,
73_00035,SYSTEM,"If you like museum, there is American folk art museum there.",OFFER,,
73_00035,USER,can you suggest some other performance venue?,INFORM,REQUEST_ALTS,
73_00035,SYSTEM,I found 5 performing arts venue. How about apollo theater?,OFFER,,INFORM_COUNT
73_00035,USER,What's their number? Is it child friendly?,REQUEST,,
73_00035,SYSTEM,Yes it is. The number is 212-531-5300,INFORM,,
73_00035,USER,"Okay, thanks a lot.",SELECT,,
73_00035,SYSTEM,Is there anything else I can do for you?,REQ_MORE,,
73_00035,USER,"No, that would be all. Thanks again.",NEGATE,THANK_YOU,
73_00035,SYSTEM,Have a great trip!,GOODBYE,,
73_00036,USER,I want to find round trip flights.,INFORM_INTENT,,
73_00036,SYSTEM,Where are you leaving from?,REQUEST,,
73_00036,USER,I'm leaving from San Diego going to Delhi.,INFORM,,
73_00036,SYSTEM,When are you coming back and when are you leaving?,REQUEST,,
73_00036,USER,I'm leaving on the 10th of this month and returning on March 13th.,INFORM,,
73_00036,SYSTEM,I found 2 flights. There is an American Airlines flight that leaves at 9:50 am. The return flight departs at 3 pm. The ticket is $373.,OFFER,,
73_00036,USER,Yes sounds good.,SELECT,,
73_00036,SYSTEM,Should I buy tickets?,OFFER_INTENT,,
73_00036,USER,Yes I want to buy tickets.,AFFIRM_INTENT,,
73_00036,SYSTEM,Please confirm: an American Airlines flight for 1 person in economy seating. The flight leaves from San Diego to Delhi on March 10th at 9:50 am. The return flight is March 13th at 3 pm.,CONFIRM,,
73_00036,USER,"Yes, sounds good. How many stops? Is it refundable?",REQUEST,,AFFIRM
73_00036,SYSTEM,Your ticket has been confirmed. There is 1 stop. The ticket is refundable.,INFORM,,NOTIFY_SUCCESS
73_00036,USER,Thank you. I want to find a hotel where pets are allowed.,INFORM,INFORM_INTENT,
73_00036,SYSTEM,I found 5 hotels. Andaz Delhi - A Concept By Hyatt is rated 4.6.,OFFER,,INFORM_COUNT
73_00036,USER,What's the address?,REQUEST,,
73_00036,SYSTEM,"The address is Asset, Street Number 1, New Delhi.",INFORM,,
73_00036,USER,Is there anything else? I want to book 1 room.,INFORM,REQUEST_ALTS,
73_00036,SYSTEM,Ibis New Delhi Aerocity has a rating of 4.1.,OFFER,,
73_00036,USER,That sounds perfect.,SELECT,,
