dialogue_id,speaker,turn,act_1,act_2,act_3
88_00026,USER,Thanks for your help.,THANK_YOU,GOODBYE,
88_00026,SYSTEM,Enjoy your day.,GOODBYE,,
88_00027,USER,"I need a place to stay, so I need to find an apartment.",INFORM_INTENT,,
88_00027,SYSTEM,Which is the number of bedrooms that you would like for the apartment to have?,REQUEST,,
88_00027,USER,I want the apartment to have three bedrooms.,INFORM,,
88_00027,SYSTEM,Is there a specific area where you would like for the apartment to be?,REQUEST,,
88_00027,USER,I want for the apartment to be located in Santa Clara.,INFORM,,
88_00027,SYSTEM,"I see that 1000 Kiely might be a good property for you, and it is located at 1000 Kiely Boulevard. This apartment has 3 bedrooms and 3 baths. If you will rent this apartment it will cost you $4,300 per month.",OFFER,,
88_00027,USER,"Can you check if the pets are allowed at this apartment? Can you give me the number, which I can use to call them?",REQUEST,,
88_00027,SYSTEM,"If you want to call the property, you can through 669-206-0300. I can confirm that the pets are allowed in the apartment.",INFORM,,
88_00027,USER,Are there other apartments available to me?,REQUEST_ALTS,,
88_00027,SYSTEM,"Another apartment which you might like is Alderwood Apartments, which is located at 900 Pepper Tree Lane. This apartment is composed from 3 bedrooms and 2 bathrooms. The renting of this apartment will cost you $3,650 per month.",OFFER,,
88_00027,USER,"This apartment seems nice. I would like to visit this apartment, so I want to schedule a visit on 11th of this month.",INFORM,INFORM_INTENT,SELECT
88_00027,SYSTEM,Can you please confirm that you want to schedule a visit on March 11th at the Alderwood Apartments?,CONFIRM,,
88_00027,USER,That seems right.,AFFIRM,,
88_00027,SYSTEM,Your request for visit at the apartment has been booked.,NOTIFY_SUCCESS,,
88_00027,USER,"Can you give me the phone number, which I can use to call the apartment? Also can you check if the apartment is furnished?",REQUEST,,
88_00027,SYSTEM,If you want to call the apartment you can through 866-472-2645. Unfortunately the apartment is not furnished.,INFORM,,
88_00027,USER,I appreciate it. I will need a cab to go there.,INFORM_INTENT,,
88_00027,SYSTEM,Would you like your cab to be a shared ride? For how many people do you need the car?,REQUEST,,
88_00027,USER,It is okay if the cab is a shared ride. I am in need for it for 1 person.,INFORM,,
88_00027,SYSTEM,"Can you please confirm that you want a shared cab ride for 1 person, and that you want to go to 900 Pepper Tree Lane?",CONFIRM,,
88_00027,USER,That's right. Can you tell me how much it will cost me?,REQUEST,AFFIRM,
88_00027,SYSTEM,"Your request for the cab has been done, and the cab is on the way. The cab will cost you $11.86.",INFORM,NOTIFY_SUCCESS,
88_00027,USER,How long will the trip with the cab last?,REQUEST,,
88_00027,SYSTEM,Your ride with the cab is expected to last 27 minutes.,INFORM,,
88_00027,USER,I appreciate your help very much.,THANK_YOU,,
88_00027,SYSTEM,Is there anything else you need from me?,REQ_MORE,,
88_00027,USER,Nothing. I am thankful for your help.,NEGATE,THANK_YOU,
88_00027,SYSTEM,Have a good time!,GOODBYE,,
88_00028,USER,Can you find me an apartment with 2 baths?,INFORM,INFORM_INTENT,
88_00028,SYSTEM,Which area would you like me to search in?,REQUEST,,
88_00028,USER,Search for the apartment in San Jose.,INFORM,,
88_00028,SYSTEM,Can you please confirm the number of bedrooms in the apartment?,REQUEST,,
88_00028,USER,The apartment must have 2 bedrooms.,INFORM,,
88_00028,SYSTEM,"There are 10 apartments suitable to you. One is called Alameda Gardens Apartments with 2 bedroom and 2 baths located at 73 North Keeble Avenue and the rent is $3,150 per month.",OFFER,,
88_00028,USER,Can you check if the apartment is furnished?,REQUEST,,
88_00028,SYSTEM,Yes. It is a furnished apartment.,INFORM,,
88_00028,USER,Can you check if pets are allowed and the contact number?,REQUEST,,
88_00028,SYSTEM,"Sorry, Pets are not allowed and the contact number is 408-998-7266.",INFORM,,
88_00028,USER,Okay. That sounds good to me.,SELECT,,
88_00028,SYSTEM,Would you like me to schedule a visit to the apartment?,OFFER_INTENT,,
88_00028,USER,Yes. Please schedule a visit to the apartment on 8th of this month.,AFFIRM_INTENT,INFORM,
88_00028,SYSTEM,Please confirm: You want me to schedule a visit to Alameda Gardens apartments on March 8th.,CONFIRM,,
88_00028,USER,No. Change the day to 3rd of March.,INFORM,NEGATE,
88_00028,SYSTEM,Please confirm: You want me to schedule a visit to Alameda Gardens apartments on March 3rd.,CONFIRM,,
88_00028,USER,"Yes, That is correct.",AFFIRM,,
88_00028,SYSTEM,Your scheduling is done successfully.,NOTIFY_SUCCESS,,
88_00028,USER,Thank you for the help. Can you help me in booking the cab there?,INFORM_INTENT,,
88_00028,SYSTEM,What type of ride like shared or luxury do you prefer?,REQUEST,,
88_00028,USER,I prefer shared ride.,INFORM,,
88_00028,SYSTEM,For how many people should I book the cab?,REQUEST,,
88_00028,USER,Book the cab for one people.,INFORM,,
88_00028,SYSTEM,Please confirm: You want me to book a shared ride for 1 people in a cab to 73 North Keeble Avenue.,CONFIRM,,
88_00028,USER,"Yes, That is correct. What is the duration of the ride?",REQUEST,AFFIRM,
88_00028,SYSTEM,I have successfully booked the ride and the cab is on the way here and it will reach here in 31 minutes.,INFORM,NOTIFY_SUCCESS,
88_00028,USER,Okay.Thank you for the help.,THANK_YOU,,
88_00028,SYSTEM,Is there anything else I can help you with?,REQ_MORE,,
88_00028,USER,No. That will be all. Thank you!,NEGATE,THANK_YOU,
88_00028,SYSTEM,I am glad I could help. Have a nice day!,GOODBYE,,
88_00029,USER,I'd like to find a 4 bedroom apartment with three bathrooms.,INFORM,,INFORM_INTENT
88_00029,SYSTEM,Which are would you like the apartment in?,REQUEST,,
88_00029,USER,"I was hoping to find an apartment in Concord, please.",INFORM,,
88_00029,SYSTEM,"I was able to locate 10 apartments for you. There is a 4 bedroom, 3 bathroom apartment for $4,800 a month at Casa Pino Condos, located at 1580 Clayton Road # 1.",OFFER,,
88_00029,USER,What's their phone number?,REQUEST,,
88_00029,SYSTEM,The phone number for Casa Pino Condos is 925-827-3700.,INFORM,,
88_00029,USER,Does the listing state if the apartment is furnished or not?,REQUEST,,
88_00029,SYSTEM,"Yes, the apartment is furnished.",INFORM,,
88_00029,USER,Great. I'd like to schedule a visit of the property for March 13th.,INFORM,INFORM_INTENT,SELECT
88_00029,SYSTEM,"To confirm: You'd like to schedule a visit to Casa Pino Condos for March 13th, correct?",CONFIRM,,
88_00029,USER,"Yes, that is correct.",AFFIRM,,
88_00029,SYSTEM,The visit has been scheduled.,NOTIFY_SUCCESS,,
88_00029,USER,Thank you so much.,THANK_YOU,,
88_00029,SYSTEM,Is there anything else that I can help you with?,REQ_MORE,,
88_00029,USER,I'd like a cab for two people to the property. Ride-share is okay if that's all that's available.,INFORM,,INFORM_INTENT
88_00029,SYSTEM,"To confirm: You'd like a cab for 2 people to 1580 Clayton Road # 1, correct?",CONFIRM,,
88_00029,USER,"Yes. How long is the ride, and how much will the trip cost?",REQUEST,,AFFIRM
88_00029,SYSTEM,Your cab has been confirmed and is on its way. The ride cost $20.76 and we be about 19 minutes long.,INFORM,,NOTIFY_SUCCESS
88_00029,USER,Thank you so much for all of your help. That'll be all.,THANK_YOU,GOODBYE,
88_00029,SYSTEM,Enjoy your day.,GOODBYE,,
88_00030,USER,I need to book a apartment for which I need your help.,INFORM_INTENT,,
88_00030,SYSTEM,Let me know your interested area to search for the apartment. How many bed rooms you need to have in that apartment?,REQUEST,,
88_00030,USER,Please search an apartment with 4 bed rooms in Corte Madera.,INFORM,,
88_00030,SYSTEM,"What about 1 apartment named Parc Marin Apartments located at 1441 Casa Buena Drive which has 4 bed rooms with 3 baths for which the rent will be $5,000 per month?.",OFFER,,
88_00030,USER,"Yes, I need this type of apartment only. thank you. Please make as schedule of visit to that place.",INFORM_INTENT,SELECT,
88_00030,SYSTEM,When do you want to make a schedule?,REQUEST,,
88_00030,USER,Please make it on 4th of March.,INFORM,,
88_00030,SYSTEM,Please confirm to proceed the following: Schedule of visit to Parc Marin Apartments on March 4th.,CONFIRM,,
88_00030,USER,confirmed to proceed further.,AFFIRM,,
88_00030,SYSTEM,Your schedule is confirmed as per your wish.,NOTIFY_SUCCESS,,
88_00030,USER,get me a Cab for one person and I can adjust with shared ride.,INFORM,,INFORM_INTENT
88_00030,SYSTEM,Please confirm to book a cab with shared ride for 1 person to 1441 Casa Buena Drive.,CONFIRM,,
88_00030,USER,"That is fine, go ahead.",AFFIRM,,
88_00030,SYSTEM,Your cab was booked and it will reach you at any time.,NOTIFY_SUCCESS,,
88_00030,USER,Thank you.,THANK_YOU,,
88_00030,SYSTEM,Any more help you need?,REQ_MORE,,
88_00030,USER,"No, that's all for now.",NEGATE,THANK_YOU,
88_00030,SYSTEM,Have a good day.,GOODBYE,,
88_00031,USER,I need to find an apartment.,INFORM_INTENT,,
88_00031,SYSTEM,In which area?,REQUEST,,
88_00031,USER,Something in Fremont.,INFORM,,
88_00031,SYSTEM,How many bedrooms?,REQUEST,,
88_00031,USER,I want two bedrooms.,INFORM,,
88_00031,SYSTEM,"There are 10 options. There is the Americana Apartments on 4445 stevenson boulevard. There are 2 bedrooms and 2 baths and it costs $2,800 a month.",OFFER,,
88_00031,USER,Are animals allowed? Is it furnished?,REQUEST,,
88_00031,SYSTEM,"Yes, animals are allowed. The apartment is not furnished.",INFORM,,
88_00031,USER,Is there anything else?,REQUEST_ALTS,,
88_00031,SYSTEM,"There is the Boulevard is located at the 40001 fremont boulevard and it costs $2,750. It has 2 bedrooms and 2 baths.",OFFER,,
88_00031,USER,That sounds good.,SELECT,,
88_00031,SYSTEM,Would you like to visit the apartment?,OFFER_INTENT,,
88_00031,USER,"Yes, that would be cool.",AFFIRM_INTENT,,
88_00031,SYSTEM,When would you like to visit?,REQUEST,,
88_00031,USER,On the 9th.,INFORM,,
88_00031,SYSTEM,You want to visit the Boulevard on March 9th?,CONFIRM,,
88_00031,USER,Yes. Can I bring a pet? May I have a contact number?,REQUEST,,AFFIRM
88_00031,SYSTEM,I have scheduled the visit. Pets are allowed. The number is 510-455-8815.,INFORM,,NOTIFY_SUCCESS
88_00031,USER,I would need a cab.,INFORM_INTENT,,
88_00031,SYSTEM,Would you mind a shared ride? How many people would be traveling?,REQUEST,,
88_00031,USER,I am good for a shared ride for two.,INFORM,,
88_00031,SYSTEM,You want a shared ride for 2 to 40001 fremont boulevard.,CONFIRM,,
88_00031,USER,That would be fine.,AFFIRM,,
88_00031,SYSTEM,The cab is on its way.,NOTIFY_SUCCESS,,
88_00031,USER,Thanks for the help. That would be all.,THANK_YOU,GOODBYE,
88_00031,SYSTEM,Enjoy your day.,GOODBYE,,
88_00032,USER,Can you help me to find a four bed room apartment in Hayward?,INFORM,,INFORM_INTENT
88_00032,SYSTEM,"Sure. I found the Alpine Vista Apartments located at 1282 Mattox Road. They have a 4 bed room 3 bath available for $5,150 per month.",OFFER,,
88_00032,USER,That sounds nice. Can you schedule a visit for the 14th of March?,INFORM,INFORM_INTENT,SELECT
88_00032,SYSTEM,Confirming that you want to schedule a visit to the Alpine Vista Apartments for March 14th?,CONFIRM,,
88_00032,USER,Yes. Do they accept pets?,REQUEST,AFFIRM,
88_00032,SYSTEM,"Yes, they allow pets in the apartment. I have scheduled your apartment visit.",INFORM,NOTIFY_SUCCESS,
88_00032,USER,Thanks! Can you help me find a cab for 1 to visit the apartment? I'm ok with a shared ride.,INFORM,,INFORM_INTENT
88_00032,SYSTEM,Confirming that you need a shared ride cab for 1 to 1282 Mattox Road?,CONFIRM,,
88_00032,USER,"No, make that for 3 people.",INFORM,NEGATE,
88_00032,SYSTEM,Confirming that you need a shared ride cab for 3 to 1282 Mattox Road?,CONFIRM,,
88_00032,USER,"Yes, that is right. Can you give me the cost?",REQUEST,AFFIRM,
88_00032,SYSTEM,Your cab is booked and will cost $21.17.,INFORM,NOTIFY_SUCCESS,
88_00032,USER,That's all I need. Thanks so much for your help.,THANK_YOU,GOODBYE,
88_00032,SYSTEM,You're welcome. Have a great day!,GOODBYE,,
88_00033,USER,I'd like an apartment with two baths.,INFORM,INFORM_INTENT,
88_00033,SYSTEM,In what area? How many bedrooms?,REQUEST,,
88_00033,USER,Three bedrooms in Concord.,INFORM,,
88_00033,SYSTEM,"How about City Walk Apartment Homes at 1688 Clayton Road. There's a 3 bedroom, 2 bathroom apartment for $3,550.",OFFER,,
88_00033,USER,That sounds nice.,SELECT,,
88_00033,SYSTEM,Would you like to schedule a visit?,OFFER_INTENT,,
88_00033,USER,Yes please.,AFFIRM_INTENT,,
88_00033,SYSTEM,For when?,REQUEST,,
88_00033,USER,I could do the 6th of this month.,INFORM,,
88_00033,SYSTEM,"To confirm, you want to visit City Walk Apartment Homes on March 6th?",CONFIRM,,
88_00033,USER,"Actually, can I do the 14th of March?",INFORM,NEGATE,
88_00033,SYSTEM,Sure. March 14th at City Walk Apartment Homes?,CONFIRM,,
88_00033,USER,Sure. What's their number?,REQUEST,AFFIRM,
88_00033,SYSTEM,You have an appointment. Their number is 925-671-3845.,INFORM,NOTIFY_SUCCESS,
88_00033,USER,I'd like to go by cab.,INFORM_INTENT,,
88_00033,SYSTEM,For how many people?,REQUEST,,
88_00033,USER,For two please. I'm good with a shared ride.,INFORM,,
88_00033,SYSTEM,So you would like a cab for 2 people to 1688 Clayton Road?,CONFIRM,,
88_00033,USER,Sure thing.,AFFIRM,,
88_00033,SYSTEM,Your cab is on the way.,NOTIFY_SUCCESS,,
88_00033,USER,How long is the ride?,REQUEST,,
88_00033,SYSTEM,It'll last about 11 minutes,INFORM,,
88_00033,USER,How much is it?,REQUEST,,
88_00033,SYSTEM,It'll be $22.40.,INFORM,,
88_00033,USER,Thanks. That'll be all for now.,THANK_YOU,GOODBYE,
88_00033,SYSTEM,Have a good day.,GOODBYE,,
88_00034,USER,I am looking for an apartment.,INFORM_INTENT,,
88_00034,SYSTEM,How many bedrooms do you want? Do you have a preferred area?,REQUEST,,
88_00034,USER,I need a 3 bedroom apartment. I'd like one in Rohnert Park.,INFORM,,
88_00034,SYSTEM,"How about Americana Apartment Homes? They are located at 4757 Snyder Lane. They have a 3 bedroom / 3 bath apartment available for $4,350 per month.",OFFER,,
88_00034,USER,"Yes, that's good. Please schedule a visit to that property.",INFORM_INTENT,SELECT,
88_00034,SYSTEM,When do you want to visit?,REQUEST,,
88_00034,USER,I'm available on March 13th.,INFORM,,
88_00034,SYSTEM,Please confirm: you are scheduling a visit to Americana Apartment Homes on March 13th.,CONFIRM,,
88_00034,USER,"Yes, that's good.",AFFIRM,,
88_00034,SYSTEM,Your apartment visit is scheduled.,NOTIFY_SUCCESS,,
88_00034,USER,Thanks. Can you get me a cab to get there?,INFORM_INTENT,,
88_00034,SYSTEM,How many people will be riding? Do you want a shared ride?,REQUEST,,
88_00034,USER,This is for 2 people. A shared ride is fine.,INFORM,,
88_00034,SYSTEM,Please confirm: You need a cab for 2 people to 4757 Snyder Lane. You prefer a shared ride.,CONFIRM,,
88_00034,USER,"Yes, that's good.",AFFIRM,,
88_00034,SYSTEM,Your ride is booked and on its way.,NOTIFY_SUCCESS,,
88_00034,USER,Thanks a lot!,THANK_YOU,,
88_00034,SYSTEM,Do you need anything else today?,REQ_MORE,,
88_00034,USER,"No, that's all. Thanks.",NEGATE,THANK_YOU,
88_00034,SYSTEM,Have a great day.,GOODBYE,,
88_00035,USER,Can you locate a one bedroom apartment now?,INFORM,INFORM_INTENT,
88_00035,SYSTEM,Where do you want the property to be?,REQUEST,,
88_00035,USER,I need one bath in richmond please.,INFORM,,
88_00035,SYSTEM,"I have 6 choices today. What about 1 bed, 1 bath in Crescent Park in Richmond. It's at 5000 Hartnett Avenue. Rent is a monthly $1,950.",OFFER,,
88_00035,USER,What about another option?,REQUEST_ALTS,,
88_00035,SYSTEM,"What about Liberty Village Apartments, 1 Bed, 1 Bath at 298 West Chanslor Avenue? It's $2050 monthly.",OFFER,,
88_00035,USER,Give me their number. Is it furnished?,REQUEST,,
88_00035,SYSTEM,It isn't furnished but their number is 510-232-8908.,INFORM,,
88_00035,USER,What else ya got?,REQUEST_ALTS,,
88_00035,SYSTEM,"You might like living at Monterey Pines. It's at 680 South 37th Street. The 1 bed, 1 bath there rent for $1,850.",OFFER,,
88_00035,USER,"Fine, let's try that.",SELECT,,
88_00035,SYSTEM,Would you like to go and visit there?,OFFER_INTENT,,
88_00035,USER,"Sure, please next Thursday.",AFFIRM_INTENT,INFORM,
88_00035,SYSTEM,To be clear: You will visit Monterey Pines on March 7th.,CONFIRM,,
88_00035,USER,"That's perfect, thanks.",AFFIRM,,
88_00035,SYSTEM,"You are scheduled, right?",NOTIFY_SUCCESS,,
88_00035,USER,"For my records, give me their number.",REQUEST,,
88_00035,SYSTEM,The number there is 510-215-1926.,INFORM,,
88_00035,USER,"Great, get me a cab for the trip there.",INFORM_INTENT,,
88_00035,SYSTEM,How many need to ride? Are you interested in sharing?,REQUEST,,
88_00035,USER,"Just one, and sharing is fine.",INFORM,,
88_00035,SYSTEM,"To be clear, you need a ride for 1 going to 680 South 37th Street.",CONFIRM,,
88_00035,USER,I confirm that baby.,REQUEST,,AFFIRM
88_00035,SYSTEM,Your ride is on the way. You will have to pay $7.28 and the ride lasts 28 minutes.,INFORM,,NOTIFY_SUCCESS
88_00035,USER,"Fine, I can live with that.",THANK_YOU,,
88_00035,SYSTEM,Will you require anything else?,REQ_MORE,,
88_00035,USER,Nope not today.,NEGATE,THANK_YOU,
88_00035,SYSTEM,Happy apartment hunting.,GOODBYE,,
88_00036,USER,I need an Apartment.,INFORM_INTENT,,
88_00036,SYSTEM,How many beds would you like and where would you like it located?,REQUEST,,
88_00036,USER,I need a two bedroom in Mountain view.,INFORM,,
88_00036,SYSTEM,How about Americana located at 707 Continental Circle it is a 2 bed and 2 bath apartment for $2700 a month.,OFFER,,
88_00036,USER,Does it allow pets and is it furnished.,REQUEST,,
88_00036,SYSTEM,It is not furnished and does not allow pets.,INFORM,,
88_00036,USER,That sounds great I wan to visit it on Thursday next week.,INFORM,INFORM_INTENT,SELECT
88_00036,SYSTEM,You would like to visit Americana on march 7th. IS that correct.,CONFIRM,,
88_00036,USER,Yes. Whats the contact number for the apartment?,REQUEST,AFFIRM,
88_00036,SYSTEM,Your appointment is confirmed. The number is 833-278-0054.,INFORM,NOTIFY_SUCCESS,
88_00036,USER,I need a cab to get there.,INFORM_INTENT,,
88_00036,SYSTEM,How many people and would you like to share the cab?,REQUEST,,
88_00036,USER,A shared ride is good for one person.,INFORM,,
88_00036,SYSTEM,You would like a shared cab for 1 person to 707 Continental Circle. Is that correct?,CONFIRM,,
88_00036,USER,No I need it for four people.,INFORM,NEGATE,
88_00036,SYSTEM,You would like a shared cab for 4 people to 707 Continental Circle. Is that correct.,CONFIRM,,
88_00036,USER,Yep that is fine.,AFFIRM,,
88_00036,SYSTEM,Your cab is on the way.,NOTIFY_SUCCESS,,
88_00036,USER,How much is the fare and how long is the ride time?,REQUEST,,
88_00036,SYSTEM,It is $14.82 and will last about 14 minutes.,INFORM,,
88_00036,USER,Thanks for your help.,THANK_YOU,,
88_00036,SYSTEM,Is there anything else I can do.,REQ_MORE,,
88_00036,USER,No that will be all.,NEGATE,THANK_YOU,
88_00036,SYSTEM,Have an awesome!,GOODBYE,,
88_00037,USER,I'm looking for an apartment. And I want it to allow pets.,INFORM,INFORM_INTENT,
88_00037,SYSTEM,What's your preference for number of bed rooms?,REQUEST,,
88_00037,USER,I want 2 bed rooms. And it should be in San Leandro.,INFORM,,
88_00037,SYSTEM,"There are 6 apartment that match. There's a very good place at Alderwood Apartments on 1435 163rd Avenue #23. It has 2 bed rooms, 2 baths, and its rent is $2,950 a month.",OFFER,,
88_00037,USER,Can you keep looking? I'd like it to be furnished.,INFORM,REQUEST_ALTS,
88_00037,SYSTEM,"There are 2 apartments that match. There's a very good place at Marina Plaza Apartments on 2777 Marina Boulevard. It has 2 bed rooms, 1 bath, and its rent is $2,550 a month.",OFFER,,
88_00037,USER,What else is there?,REQUEST_ALTS,,
88_00037,SYSTEM,"There's a very good place at Parkside Commons Apartments on 900 143rd Avenue. It has 2 bed rooms, 2 baths, and rent is $2,700 a month.",OFFER,,
88_00037,USER,Can you give me their phone number?,REQUEST,,
88_00037,SYSTEM,You can call them at 510-898-6076.,INFORM,,
88_00037,USER,"Okay, that place sounds like something I'd like. Can you schedule a visit to it?",INFORM_INTENT,SELECT,
88_00037,SYSTEM,When will you be visiting?,REQUEST,,
88_00037,USER,I'll go on the 9th of March.,INFORM,,
88_00037,SYSTEM,"Okay, you'll visit Parkside Commons Apartments on March 9th, is that correct?",CONFIRM,,
88_00037,USER,"Yeah, that's correct.",AFFIRM,,
88_00037,SYSTEM,I've scheduled your visit to the apartment.,NOTIFY_SUCCESS,,
88_00037,USER,"I'll also need a cab to bring me there, shared ride is fine for me.",INFORM,INFORM_INTENT,
88_00037,SYSTEM,What's the number of people that will be travelling?,REQUEST,,
88_00037,USER,There will be 4 people.,INFORM,,
88_00037,SYSTEM,"I'll get you a shared ride to 900 143rd Avenue for 4 people, is that correct?",CONFIRM,,
88_00037,USER,"Yeah, that's right. What's the ride duration?",REQUEST,AFFIRM,
88_00037,SYSTEM,The trip will take 29 minutes. I booked the cab and it's on its way now.,INFORM,NOTIFY_SUCCESS,
88_00037,USER,Thanks a lot for helping me. That's everything I need.,THANK_YOU,GOODBYE,
88_00037,SYSTEM,Have a wonderful day.,GOODBYE,,
88_00038,USER,I want to search for an apartment in San Jose and I need your help to find the best one.,INFORM,INFORM_INTENT,
88_00038,SYSTEM,"Yes, I can help you for which I need the information on your required number of bed rooms in that apartment.",REQUEST,,
88_00038,USER,I need it with two bed rooms.,INFORM,,
88_00038,SYSTEM,"Apartment name Aegena located at 1290 San Tomas Aquino Road which I think is the best one to you and it has 2 bed rooms and 1 bath for which the rent per month will be $2,650.",OFFER,,
88_00038,USER,"Let me check it, before that please check whether they will allow pets with me.",REQUEST,,
88_00038,SYSTEM,"Yes, they happily allow pets there and hope you may like it.",INFORM,,
88_00038,USER,Is that fully furnished or not? Please also let me know their contact number for my reference.,REQUEST,,
88_00038,SYSTEM,"No, it is not furnished and the contact number is 408-984-8888. Shall I proceed with this apartment further?",INFORM,,
88_00038,USER,"No, search for something else.",REQUEST_ALTS,,
88_00038,SYSTEM,"What about Alameda Gardens Apartments at 73 North Keeble Avenue with 2 bed rooms and 2 baths for which the rent will be $3,150 per month?",OFFER,,
88_00038,USER,This is the one I want and I would like to make an appointment to visit there. Please do it for me.,INFORM_INTENT,SELECT,
88_00038,SYSTEM,"Yes, for which date?",REQUEST,,
88_00038,USER,make it for March 9th.,INFORM,,
88_00038,SYSTEM,Please confirm to book an appointment to visit Alameda Gardens Apartments on March 9th.,CONFIRM,,
88_00038,USER,"No, change it to day after tomorrow.",INFORM,NEGATE,
88_00038,SYSTEM,Please confirm to book an appointment to visit Alameda Gardens Apartments on March 3rd.,CONFIRM,,
88_00038,USER,"Yes, that is confirmed to proceed. I need their contact number.",REQUEST,AFFIRM,
88_00038,SYSTEM,Please note their contact number is 408-998-7266 and your appointment was confirmed.,INFORM,NOTIFY_SUCCESS,
88_00038,USER,I need a Cab for one person to go there.,INFORM,INFORM_INTENT,
88_00038,SYSTEM,Shall I book it with Shared ride?,REQUEST,,
88_00038,USER,"Yes, I can adjust.",INFORM,,
88_00038,SYSTEM,Please confirm to book a Cab with shared ride to 73 North Keeble Avenue for 1 person.,CONFIRM,,
88_00038,USER,Make it for two persons.,INFORM,NEGATE,
88_00038,SYSTEM,"OKay, please confirm to book a Cab for 2 to 73 North Keeble Avenue.",CONFIRM,,
88_00038,USER,"Yes, that is confirmed. How much time will taken to reach there?",REQUEST,AFFIRM,
88_00038,SYSTEM,I have booked the cab and it will reach you soon and the same will take you to there within 31 minutes.,INFORM,NOTIFY_SUCCESS,
88_00038,USER,Thank you for your all help.,THANK_YOU,GOODBYE,
88_00038,SYSTEM,Have a good day.,GOODBYE,,
88_00039,USER,I need to move somewhere closer to my new job. Can you help me find an apartment?,INFORM_INTENT,,
88_00039,SYSTEM,"Sure, in what area?",REQUEST,,
88_00039,USER,Something in Fremont would be great.,INFORM,,
88_00039,SYSTEM,How many bedrooms do you need?,REQUEST,,
88_00039,USER,It needs to have three bedrooms.,INFORM,,
88_00039,SYSTEM,"I found 10 options you might like. How about Alborada Apartments at 1001 Beethoven Common? They have a 3 bedroom 2 bathroom unit for $3,900 per month.",OFFER,,
88_00039,USER,That sounds pretty good.,SELECT,,
88_00039,SYSTEM,Do you want to schedule a visit?,OFFER_INTENT,,
88_00039,USER,"Yeah, can you make an appointment for the 5th of March?",AFFIRM_INTENT,INFORM,
88_00039,SYSTEM,"Ok. To confirm, you want to book a visit to Alborada Apartments on March 5th. Is that right?",CONFIRM,,
88_00039,USER,"Yes, that's right. By the way, do they allow pets?",REQUEST,AFFIRM,
88_00039,SYSTEM,"I've scheduled the visit, and yes, they are pet-friendly.",INFORM,NOTIFY_SUCCESS,
88_00039,USER,Great. Is it furnished? And what's their phone number?,REQUEST,,
88_00039,SYSTEM,"It's not furnished, unfortunately. You can reach them at 510-797-1800.",INFORM,,
88_00039,USER,"Ok, that's fine. Can you book a cab for me to go there also?",INFORM_INTENT,,
88_00039,SYSTEM,Sure. How many people and do you want a shared ride?,REQUEST,,
88_00039,USER,"Just 1 person, and shared is fine.",INFORM,,
88_00039,SYSTEM,"Ok. Just to confirm, you want 1 seat in a shared cab to go to 1001 Beethoven Common. Is that right?",CONFIRM,,
88_00039,USER,"No, actually, I think I'll ask my friend to go with me. Can you book two seats?",INFORM,NEGATE,
88_00039,SYSTEM,"Sure. To confirm, you want to book a cab for 2 people on a shared ride. Is that right?",CONFIRM,,
88_00039,USER,Yes that's fine. What's the travel time and how much is it?,REQUEST,,AFFIRM
88_00039,SYSTEM,The ride will cost $21.88 and will take 30 minutes to get there. It's on its way now.,INFORM,,NOTIFY_SUCCESS
88_00039,USER,"Great, thanks for your help.",THANK_YOU,,
