dialogue_id,speaker,turn,act_1,act_2,act_3
60_00052,USER,"Yes, that would be fine. I need a small car.",INFORM,AFFIRM,
60_00052,SYSTEM,For what time? You would like it from March 3rd to March 7th.,REQUEST,,
60_00052,USER,I would need it Monday next week at half past 1 in the afternoon till the 5th of this month.,INFORM,,
60_00052,SYSTEM,You would like to pick up a compact car at LAX international airport on March 4th at 1:30 pm till March 5th?,CONFIRM,,
60_00052,USER,"Yes, that is exactly what I want.",AFFIRM,,
60_00052,SYSTEM,I have reserved the car.,NOTIFY_SUCCESS,,
60_00052,USER,Thank you very much.,THANK_YOU,,
60_00052,SYSTEM,Is there anything else?,REQ_MORE,,
60_00052,USER,No. I appreciate your assistance.,NEGATE,THANK_YOU,
60_00052,SYSTEM,Enjoy your day.,GOODBYE,,
60_00053,USER,Please help me find a round trip flight.,INFORM_INTENT,,
60_00053,SYSTEM,Where are you coming from?,REQUEST,,
60_00053,USER,From Seattle.,INFORM,,
60_00053,SYSTEM,When do you plan to leave and when do you plan to come back?,REQUEST,,
60_00053,USER,I want to leave on 9th of March until 12th of March.,INFORM,,
60_00053,SYSTEM,Where do you want to go?,REQUEST,,
60_00053,USER,To New York.,INFORM,,
60_00053,SYSTEM,How about American Airlines for only $306 with an outbound flight leaves at 4 pm and return flights leaves at 3:40 pm.,OFFER,,
60_00053,USER,That's good.,SELECT,,
60_00053,SYSTEM,Will I buy you tickets now?,OFFER_INTENT,,
60_00053,USER,"Yes, I prefer Traveling in Economy for 1 people only.",AFFIRM_INTENT,INFORM,
60_00053,SYSTEM,"Okay, you want 1 Economy seat at American Airlines going to New York form Seattle on March 9th until March 12th. Onward flight leaves at 4 pm and return flight leaves at 3:40 pm. Please confirm.",CONFIRM,,
60_00053,USER,Yes.,AFFIRM,,
60_00053,SYSTEM,Ticket reserved!,NOTIFY_SUCCESS,,
60_00053,USER,Please help me reserve a rental car going there.,INFORM_INTENT,,
60_00053,SYSTEM,DO you plan to drop off on March 12th?,REQUEST,,
60_00053,USER,I need it until March 11th.,INFORM,,
60_00053,SYSTEM,Do you plan to pick it up at JFK International Airport? What type of car do you want?,REQUEST,,
60_00053,USER,I want a standard car and yes I want to pick it up there.,INFORM,AFFIRM,
60_00053,SYSTEM,How about picking it up on March 9th and what time you need it?,REQUEST,,
60_00053,USER,I need it on the 10th at 2 in the afternoon.,INFORM,,
60_00053,SYSTEM,"Okay, you want standard car and you will pick it up from JFK International Airport on March 10th until March 11th at 2 pm. Please confirm.",CONFIRM,,
60_00053,USER,Good. What's the name of the car?,REQUEST,AFFIRM,
60_00053,SYSTEM,It's Toyota Corolla and your car has been reserved!,INFORM,NOTIFY_SUCCESS,
60_00053,USER,Thank you.,THANK_YOU,,
60_00053,SYSTEM,Anything else I can help you with?,REQ_MORE,,
60_00053,USER,"No, thanks.",NEGATE,THANK_YOU,
60_00053,SYSTEM,You are welcome.,GOODBYE,,
60_00054,USER,I'm looking for round trip flights.,INFORM_INTENT,,
60_00054,SYSTEM,Where will you be going and when will you be returning?,REQUEST,,
60_00054,USER,I'm going to Philly. I want to come back on the 8th of March.,INFORM,,
60_00054,SYSTEM,Where will you be traveling from? And when will you be leaving?,REQUEST,,
60_00054,USER,"I want to leave tomorrow from Paris, France.",INFORM,,
60_00054,SYSTEM,There's 1 flight that could work. It's American Airlines. The outbound flight is at 4:05 am. The return flight is at 4:45 pm. The ticket costs $293.,OFFER,,
60_00054,USER,What's the departure airport?,REQUEST,,
60_00054,SYSTEM,The departure airport is Charles de Gaulle International Airport.,INFORM,,
60_00054,USER,"Okay, that's what I want. Can you get me a ticket?",INFORM_INTENT,SELECT,
60_00054,SYSTEM,I'll get you 1 Economy ticket on American Airlines Paris to Philadelphia round trip. The outbound flight is March 2nd at 4:05 am. The return flight is March 8th at 4:45 pm. Is everything correct?,CONFIRM,,
60_00054,USER,"Yes, everything is right.",AFFIRM,,
60_00054,SYSTEM,I purchased the ticket.,NOTIFY_SUCCESS,,
60_00054,USER,I also need a rental car there.,INFORM_INTENT,,
60_00054,SYSTEM,Would you like to pick it up at PHL International Airport.,REQUEST,,
60_00054,USER,"Yes, I would.",AFFIRM,,
60_00054,SYSTEM,Will pick up be March 2nd and return March 8th?,REQUEST,,
60_00054,USER,"No, I'm going to pick it up on March 3rd and return it on the 5th of this month.",INFORM,,
60_00054,SYSTEM,Is there a type of car you want?,REQUEST,,
60_00054,USER,I'd like a Standard car.,INFORM,,
60_00054,SYSTEM,And what time do you want to pick it up?,REQUEST,,
60_00054,USER,I want to get it at 5:45 in the evening.,INFORM,,
60_00054,SYSTEM,You want a Standard car from PHL International Airport with a pick up on March 3rd at 5:45 pm and a return on March 5th. Shall I proceed with the rental?,CONFIRM,,
60_00054,USER,"Yes, please do. How much is the total? And what kind of car is it?",REQUEST,,AFFIRM
60_00054,SYSTEM,I've booked the rental. It was $68 in altogether. And the car is a Chevrolet Cruze.,INFORM,,NOTIFY_SUCCESS
60_00054,USER,"Okay, that's all I need. Thank you.",THANK_YOU,GOODBYE,
60_00054,SYSTEM,Have a terrific day!,GOODBYE,,
60_00055,USER,Can you help me book a round trip flight for 2?,INFORM,INFORM_INTENT,
60_00055,SYSTEM,"Sure, when are you leaving and returning and where are you going?",REQUEST,,
60_00055,USER,I'm going to LA on the day after tomorrow and returning on the 9th.,INFORM,,
60_00055,SYSTEM,Where are you departing from?,REQUEST,,
60_00055,USER,I'm leaving from Atlanta.,INFORM,,
60_00055,SYSTEM,I found an American Airlines flight for $193 per ticket. It leaves Atlanta at 2:30 pm and leaves LA at 5:25 pm.,OFFER,,
60_00055,USER,"Great, can you help me get a couple of economy tickets for that flight?",INFORM,INFORM_INTENT,SELECT
60_00055,SYSTEM,"Sure, just to confirm, you need 2 economy tickets for the American Airlines flight from Atlanta to Los Angeles on March 3rd at 2:30 pm with a return flight on March 9th at 5:25 pm.",CONFIRM,,
60_00055,USER,"Great, what time will I get back home?",REQUEST,AFFIRM,
60_00055,SYSTEM,I've reserved your ticket. You'll arrive back at 1:24 am.,INFORM,NOTIFY_SUCCESS,
60_00055,USER,"Great, I'll also need a rental car until the 8th of March.",INFORM,INFORM_INTENT,
60_00055,SYSTEM,Are you picking up on March 3rd at LAX International Airport? Do you know what kind of car you want?,REQUEST,,
60_00055,USER,Actually I'll need it on the 4th and I want a small one.,INFORM,,AFFIRM
60_00055,SYSTEM,What time do you want it?,REQUEST,,
60_00055,USER,In the evening 5:15.,INFORM,,
60_00055,SYSTEM,"Okay, please confirm that you'd like to pickup a compact car from LAX International Airport on March 4th at 5:15 pm and drop it off on March 8th.",CONFIRM,,
60_00055,USER,"Yes, what kind of car is it?",REQUEST,AFFIRM,
60_00055,SYSTEM,I've confirmed your reservation and it will be a Chevrolet Bolt.,INFORM,NOTIFY_SUCCESS,
60_00055,USER,"Awesome, thanks a lot.",THANK_YOU,,
60_00055,SYSTEM,Anything else I can do for you?,REQ_MORE,,
60_00055,USER,"Not right now, thank you.",NEGATE,THANK_YOU,
60_00055,SYSTEM,Have a good day!,GOODBYE,,
60_00056,USER,Could you find round trip flights for me? There are four in my group. I do not care about the airline.,INFORM,,INFORM_INTENT
60_00056,SYSTEM,When will you leave and return? Where are you leaving from?,REQUEST,,
60_00056,USER,I want to leave on the 2nd of this month and return on 6th of March. I will leave from Atlanta.,INFORM,,
60_00056,SYSTEM,Where will you visit?,REQUEST,,
60_00056,USER,I want to go to NYC.,INFORM,,
60_00056,SYSTEM,There is an American Airlines flight that leaves at 6:25 am. The return leaves at 11:20 am. This tikcet costs $130.,OFFER,,
60_00056,USER,That flight sounds good. Would you buy me economy tickets?,INFORM,INFORM_INTENT,SELECT
60_00056,SYSTEM,Please confirm that you want to leave from Atlanta and go to New York on American Airlines. You will leave on March 2nd at 6:25 am and return on March 6th at 11:20 am. This is an economy flight for 4 people.,CONFIRM,,
60_00056,USER,Sounds good to me. Could I get a refund on the ticket i I needed one? Which airport does the flight arrive at?,REQUEST,,AFFIRM
60_00056,SYSTEM,The ticket has been confirmed and is refundable. You will arrive at JFK International Airport.,INFORM,,NOTIFY_SUCCESS
60_00056,USER,Thank you for helping. I would like to reseve a rental car there.,INFORM_INTENT,,
60_00056,SYSTEM,Would you like to pick it up on March 2nd and drop it off on March 6th? What time do you need to pick it up?,REQUEST,,
60_00056,USER,I would like to pick it up at half past 3 in the afternoon on March 3rd. I will drop it off on the 5th.,INFORM,,
60_00056,SYSTEM,"Would you full-size, standard or something else?",REQUEST,,
60_00056,USER,I would like a small car.,INFORM,,
60_00056,SYSTEM,"Could you confirm that you want to pick up the compact car from JFK International Airport on March 3rd at 3:30 pm, and that you will drop it off on March 5th?",CONFIRM,,
60_00056,USER,"No, I would like an intermediate car.",INFORM,NEGATE,
60_00056,SYSTEM,Could you confirm that you want the standard car dropped off on March 5th?,CONFIRM,,
60_00056,USER,Sounds good to me.,AFFIRM,,
60_00056,SYSTEM,The car was reserved.,NOTIFY_SUCCESS,,
60_00056,USER,Thank you for helping. That is all I needed.,THANK_YOU,GOODBYE,
60_00056,SYSTEM,Have a good one.,GOODBYE,,
60_00057,USER,Could you look for round trip flights for me? I would like to leave next Friday. I need to return on 14th of this month.,INFORM,,INFORM_INTENT
60_00057,SYSTEM,Where do you want to leave from?,REQUEST,,
60_00057,USER,There are four people in my group and I will leave from San Diego.,INFORM,,
60_00057,SYSTEM,Where do you want to visit?,REQUEST,,
60_00057,USER,I want to go to Seattle.,INFORM,,
60_00057,SYSTEM,There is an American Airlines flight leaving at 4:10 am and returning at 8:15 am. This ticket costs $215.,OFFER,,
60_00057,USER,That flight sounds great. Would you help me find flights?,INFORM_INTENT,SELECT,
60_00057,SYSTEM,Could you confirm that you want to leave from San Diego and go to Seattle? This flight is American Airlines. It leaves on March 8th and returns on March 14th. The onward flight leaves at 4:10 am while the return flight leaves at 8:15 am. You need 4 economy tickets. Is this right?,CONFIRM,,
60_00057,USER,Sounds great.,AFFIRM,,
60_00057,SYSTEM,Your ticket has been confirmed.,NOTIFY_SUCCESS,,
60_00057,USER,I would like a rental car there for March 9th.,INFORM,INFORM_INTENT,
60_00057,SYSTEM,What sort of car do you want to prefer?,REQUEST,,
60_00057,USER,I would like a medium-sized car.,INFORM,,
60_00057,SYSTEM,Would you drop it off on March 14th? Would you like to pick it up at Seattle-Tacoma International Airport and return it?,REQUEST,,
60_00057,USER,That sounds good. I will pick it up at afternoon 3:30 and need the car until the 11th.,INFORM,,AFFIRM
60_00057,SYSTEM,Could you confirm that you want the Standard car for Seattle-Tacoma International Airport on March 9th at 3:30 pm? You can drop it off March 11th.,CONFIRM,,
60_00057,USER,Sounds great. How much is the total cost?,REQUEST,AFFIRM,
60_00057,SYSTEM,The car has been reserved and costs $72 in total.,INFORM,NOTIFY_SUCCESS,
60_00057,USER,Thank you for helping. That is all I wanted.,THANK_YOU,GOODBYE,
60_00057,SYSTEM,Have a good day.,GOODBYE,,
60_00058,USER,"On this Sunday, could you find a round trip flight for me?",INFORM,INFORM_INTENT,
60_00058,SYSTEM,From which place you are moving from? What do you want to visit?,REQUEST,,
60_00058,USER,"I am moving from London, UK to ATL.",INFORM,,
60_00058,SYSTEM,When will you return back?,REQUEST,,
60_00058,USER,I will be back on March 11th.,INFORM,,
60_00058,SYSTEM,A flight from American Airlines which leaves at 8:35 pm and the return flight will leave at 3:30 pm. The cost of the ticket is $371.,OFFER,,
60_00058,USER,Whether any other flights available? I like United Airlines.,INFORM,REQUEST_ALTS,
60_00058,SYSTEM,I searched and found 1 flight for you. It is a United Airlines flight which moves at 0:25 am and the return flight will leave at 6:15 am. The cost of the ticket is $343.,OFFER,,
60_00058,USER,Is is refundable?,REQUEST,,
60_00058,SYSTEM,Sorry. The ticket is not refundable.,INFORM,,
60_00058,USER,It is good for me.,SELECT,,
60_00058,SYSTEM,Shall I book the ticket?,OFFER_INTENT,,
60_00058,USER,Yes. Book the ticket.,AFFIRM_INTENT,,
60_00058,SYSTEM,"Kindly ensure that, on March 3rd, a United Airlines Economy class flight from London to Atlanta is moving at 0:25 am. The return date is March 11th and the flight leaves at 6:15 am. The ticket has been reserved for 1 person.",CONFIRM,,
60_00058,USER,Yes. It is good. What is the arriving time of the flight?,REQUEST,AFFIRM,
60_00058,SYSTEM,Your ticket is booked. The return flight reaches at 0:49 am.,INFORM,NOTIFY_SUCCESS,
60_00058,USER,I wish to book a rental car there. I need a Compact car from the 4th to March 9th.,INFORM,,
60_00058,SYSTEM,Are you want to pick it up at Hartsfield-Jackson International Airport. When will you need it?,REQUEST,,
60_00058,USER,It is good. I will pick it up at 16:15,INFORM,AFFIRM,
60_00058,SYSTEM,"Kindly ensure that, on March 4th, a Compact car from Hartsfield-Jackson International Airport will pick up you at 4:15 pm and on March 9th, it will drop you.",CONFIRM,,
60_00058,USER,"Nope. On 5th of this month, I wish to pick it up at Charles de Gaulle Airport.",INFORM,,NEGATE
60_00058,SYSTEM,"Kindly ensure that, on March 5th you will be picked up from Charles de Gaulle International Airport.",CONFIRM,,
60_00058,USER,It is good.,AFFIRM,,
60_00058,SYSTEM,Your car is booked.,NOTIFY_SUCCESS,,
60_00058,USER,Thank you so much for your help.,THANK_YOU,,
60_00058,SYSTEM,Do you need any other thing?,REQ_MORE,,
60_00058,USER,No. Thank you so much for your help.,NEGATE,THANK_YOU,
60_00058,SYSTEM,Have a fantastic day.,GOODBYE,,
60_00059,USER,"I want to find tickets for a round trip flight, and I want to leave today.",INFORM,INFORM_INTENT,
60_00059,SYSTEM,"Can you tell me from where you will leave, and where you want to arrive? Can you also tell me when you plan to return?",REQUEST,,
60_00059,USER,"I will be flying from Portland, and I want to arrive in SFO. I want to return from my flight on Friday next week.",INFORM,,
60_00059,SYSTEM,"There are 5 flights which match what you want. One of the flights is Alaska Airlines which departs at 7:55 am, and when it returns it flies at 12:20 pm. The ticket of this flight costs $133.",OFFER,,
60_00059,USER,"Can you check if there are other flights available? I need the tickets for 3 people, and I want to fly with Southwest Airlines.",INFORM,,REQUEST_ALTS
60_00059,SYSTEM,"There is 1 flight which matches what you requested. The flight is with Southwest Airlines and it departs at 3:15 pm, and when it returns it flies at 11:30 pm. The ticket for this flight will cost you $117.",OFFER,,
60_00059,USER,This flight seems as what I want.,SELECT,,
60_00059,SYSTEM,Do you want to book tickets for this flight?,OFFER_INTENT,,
60_00059,USER,I want to buy Economy tickets for this flight.,AFFIRM_INTENT,INFORM,
60_00059,SYSTEM,"Can you please confirm that you want to buy Economy class tickets for 3 people for the flight with Southwest Airlines which departs from Portland on March 1st at 3:15 pm to arrive in San Francisco, and it returns on March 8th at 11:30 pm?",CONFIRM,,
60_00059,USER,That suits me well.,AFFIRM,,
60_00059,SYSTEM,Your requested ticket has been booked.,NOTIFY_SUCCESS,,
60_00059,USER,I appreciate your help. I also need to make a booking for a rental car there. I will pick the rental car at night 8.,INFORM,INFORM_INTENT,
60_00059,SYSTEM,"Will you be going at SFO International Airport? Will you be picking the car up on March 1st, and will need the car till March 8th?",REQUEST,,
60_00059,USER,"Alright, that seems nice. I want to have the car on March 6th, and I will be needing to rent the car till 7th of this month.",INFORM,,AFFIRM
60_00059,SYSTEM,"Would you like to have a car which is Compact. Full-size, or something else?",REQUEST,,
60_00059,USER,I would prefer to have a medium-sized car.,INFORM,,
60_00059,SYSTEM,"Can you please confirm that you want to rent a Standard car which you will pick up from SFO International Airport on March 6th at 8 pm, and you will need the car till March 7th.",CONFIRM,,
60_00059,USER,"Alright, that's what I want. Can you tell me how much it will cost me?",REQUEST,AFFIRM,
60_00059,SYSTEM,Your requested rental car has been booked. The renting of this car costs $29.,INFORM,NOTIFY_SUCCESS,
60_00059,USER,I appreciate your help very much. That would be all.,THANK_YOU,GOODBYE,
60_00059,SYSTEM,Have a good time!,GOODBYE,,
60_00060,USER,Search round trip flights to London.,INFORM,INFORM_INTENT,
60_00060,SYSTEM,From where?,REQUEST,,
60_00060,USER,LA,INFORM,,
60_00060,SYSTEM,When do you plan to leave and return?,REQUEST,,
60_00060,USER,From March 1st till the 6th.,INFORM,,
60_00060,SYSTEM,I found an American Airlines flight leaving at 9:05 am with your return flight leaving at 3:05 pm. The total is $362.,OFFER,,
60_00060,USER,Sounds great.,SELECT,,
60_00060,SYSTEM,Would you like to purchase these tickets?,OFFER_INTENT,,
60_00060,USER,Yes please. Three tickets in economy class.,AFFIRM_INTENT,INFORM,
60_00060,SYSTEM,"To confirm, you would like 3 economy seats from Los Angeles to London on American Airlines from March 1st till March 6th with departure flight leaving at 9:05 am and returning flight leaving at 3:05 pm?",CONFIRM,,
60_00060,USER,Yes sounds good,AFFIRM,,
60_00060,SYSTEM,Ticket is confirmed,NOTIFY_SUCCESS,,
60_00060,USER,What time will I return and will there be one or more stops?,REQUEST,,
60_00060,SYSTEM,There is only 1 stop and it will arrive at 8:54 pm.,INFORM,,
60_00060,USER,Can you find me a rental car?,INFORM_INTENT,,
60_00060,SYSTEM,Sure. Would you also like it for March 1st?,REQUEST,,
60_00060,USER,I need it on Sunday this week.,INFORM,,
60_00060,SYSTEM,For what time? Is Heathrow International Airport okay for pickup?,REQUEST,,
60_00060,USER,I'll need it till the 5th of this month and would like to pick it up around 9:45 in the morning.,INFORM,,AFFIRM
60_00060,SYSTEM,Would you like a standard or full-size vehicle?,REQUEST,,
60_00060,USER,Compact,INFORM,,
60_00060,SYSTEM,So you would like a compact car from Heathrow International Airport from March 3rd till March 5th and you would like to pick it up at 9:45 am?,CONFIRM,,
60_00060,USER,Sounds great. What kind of car? How much will it be?,REQUEST,,AFFIRM
60_00060,SYSTEM,I have reserved a Kia Forte for $58.,INFORM,,NOTIFY_SUCCESS
60_00060,USER,Thanks. That will be all.,THANK_YOU,GOODBYE,
60_00060,SYSTEM,Have a good day.,GOODBYE,,
60_00061,USER,Can you help me find round trip flights? I'd like to return on March 13th and I have no preference for the airline.,INFORM,,INFORM_INTENT
60_00061,SYSTEM,Where are you leaving from and where did you plan on going?,REQUEST,,
60_00061,USER,I'm leaving from Paris and going to Chicago.,INFORM,,
60_00061,SYSTEM,When did you plan on leaving?,REQUEST,,
60_00061,USER,I will leave on the 2nd of this month.,INFORM,,
60_00061,SYSTEM,I found 1 flight for you. It is a Delta Airlines flight with the outbound flight leaving at 11:20 pm and the return flight leaving at 6:40 pm for $270.,OFFER,,
60_00061,USER,What is the destination airport?,REQUEST,,
60_00061,SYSTEM,The flight will arrive at O'Hare International Airport.,INFORM,,
60_00061,USER,How many stops will the flight have and where is the origin airport?,REQUEST,,
60_00061,SYSTEM,The flight has 0 stops and the origin airport is Charles de Gaulle International Airport.,INFORM,,
60_00061,USER,That flight will work for me.,SELECT,,
60_00061,SYSTEM,Did you want to buy tickets for it?,OFFER_INTENT,,
60_00061,USER,"Yes, I would like to buy the ticket. I have three people in my group and I would like to travel in Economy.",AFFIRM_INTENT,INFORM,
60_00061,SYSTEM,Please confirm you're booking a Delta Airlines flight for 3 passengers from Paris to Chicago departing on March 2nd at 11:20 pm and returning on March 13th at 6:40 pm in Economy class.,CONFIRM,,
60_00061,USER,"Yes, that is correct. When will the return flight arrive?",REQUEST,AFFIRM,
60_00061,SYSTEM,Your reservation has been made. The return flight will arrive at 11:36 am.,INFORM,NOTIFY_SUCCESS,
60_00061,USER,When will the onward flight arrive and is the ticket refundable?,REQUEST,,
60_00061,SYSTEM,The onward flight will arrive at 2:16 am but unfortunately the ticket is non-refundable.,INFORM,,
60_00061,USER,Thank you. I'd also like to book a rental car there. I'd like a large car.,INFORM,INFORM_INTENT,
60_00061,SYSTEM,Would you like to pick it up on March 2nd?,REQUEST,,
60_00061,USER,I will be needing the car on the 6th.,INFORM,,
60_00061,SYSTEM,What time will you need the car and will you drop it off on March 13th?,REQUEST,,
60_00061,USER,I will need the car until March 11th and I'll be picking it up at six in the evening.,INFORM,,
60_00061,SYSTEM,Please confirm you're picking up the Full-size car from O'Hare International Airport on March 6th at 6 pm and dropping it off on March 11th.,CONFIRM,,
60_00061,USER,"Yes, that is correct. What will the total cost be?",REQUEST,AFFIRM,
60_00061,SYSTEM,Your car has been booked. The total cost of the reservation will be $235.,INFORM,NOTIFY_SUCCESS,
60_00061,USER,"Thank you, that's all I need.",THANK_YOU,GOODBYE,
60_00061,SYSTEM,Have a wonderful day!,GOODBYE,,
60_00062,USER,Could you look up a flight for me for 4 people?,INFORM,INFORM_INTENT,
60_00062,SYSTEM,Sure! Where are you wanting to visit?,REQUEST,,
60_00062,USER,I'd like to go to NYC.,INFORM,,
60_00062,SYSTEM,When would you return?,REQUEST,,
60_00062,USER,"Well, there's 3 people in my group and I want to get back on the 12th. We'd leave from Chicago.",INFORM,,
60_00062,SYSTEM,When do you plan to leave?,REQUEST,,
60_00062,USER,I'd like to leave later today if possible.,INFORM,,
60_00062,SYSTEM,There's an American Airlines flight that leaves at 12:30 pm and returns at 5:25 am. Each ticket costs $131.,OFFER,,
60_00062,USER,Does it have zero stops? Could I get a refund if I need?,REQUEST,,
60_00062,SYSTEM,"Unfortunately, there is no refund available. There are 0 stops.",INFORM,,
60_00062,USER,Any other flights?,REQUEST_ALTS,,
60_00062,SYSTEM,There's a Delta airlines flight that leaves at 9:15 am and returns at 6 am for $137 each ticket.,OFFER,,
60_00062,USER,"Okay, that sounds good. Can you reserve these tickets?",INFORM_INTENT,SELECT,
60_00062,SYSTEM,Okay. Please confirm the following: You'll be leaving from Chicago going to New York with Delta Airlines on March 1st at 9:15 am. You will return March 12th leaving at 6 am. These are for 3 tickets with Economy seating. Is this correct?,CONFIRM,,
60_00062,USER,"Yes, that's good. When will the flight arrive when I return? Will it have one stop?",REQUEST,,AFFIRM
60_00062,SYSTEM,There will be 0 stops and it arrives at 7:19 am.,INFORM,,NOTIFY_SUCCESS
60_00062,USER,"I'd like to reserve a rental car, too.",INFORM_INTENT,,
60_00062,SYSTEM,Do you want a compact or full-size vehicle? Or something else?,REQUEST,,
60_00062,USER,I'd like a Standard.,INFORM,,
60_00062,SYSTEM,What time will you need it? Would you want to drop it off March 12th?,REQUEST,,
60_00062,USER,I'd like to get it at 15:30 and would want it until the 10th of March.,INFORM,,
60_00062,SYSTEM,Are you going to pick it up at JFK International Airport?,REQUEST,,
60_00062,USER,"Yup, sounds good.",AFFIRM,,
60_00062,SYSTEM,DO you want to pick it up March 1st?,REQUEST,,
60_00062,USER,I'd like it March 7th.,INFORM,,
60_00062,SYSTEM,"Okay, please confirm: you'll pick up a Standard car from JFK International Airport on March 7th around 3:30 pm. You will drop it off on March 10th.",CONFIRM,,
60_00062,USER,"Yes, that's good. How much will it be?",REQUEST,AFFIRM,
60_00062,SYSTEM,The total cost for your car will be $87. Your car has also been reserved.,INFORM,NOTIFY_SUCCESS,
60_00062,USER,"Awesome, thanks so much. That's everything.",THANK_YOU,GOODBYE,
60_00062,SYSTEM,"You're welcome, have a good day.",GOODBYE,,
60_00063,USER,I need to look for a round trip flight. 4 people will be traveling.,INFORM,INFORM_INTENT,
60_00063,SYSTEM,Where will you be traveling from and to? And when will you be returning?,REQUEST,,
60_00063,USER,I'll be traveling from Philadelphia to Chicago. And I want to return on March 10th.,INFORM,,
60_00063,SYSTEM,And when will you be leaving?,REQUEST,,
60_00063,USER,I want to leave on Tuesday next week.,INFORM,,
60_00063,SYSTEM,There's a Delta Airlines flight with an outbound departure at 12:20 pm and return flight that leaves at 9:40 pm. It's $138.,OFFER,,
60_00063,USER,"That'll work, please get me tickets.",INFORM_INTENT,SELECT,
60_00063,SYSTEM,I'll get you 4 Economy ticket for Philadelphia to Chicago on Delta Airlines. The outbound flight is March 5th at 12:20 pm. The return flight is March 10th at 9:40 pm. Is everything correct?,CONFIRM,,
60_00063,USER,"Yeah, that's correct. Can I refund the ticket? Also what's the arrival airport?",REQUEST,,AFFIRM
60_00063,SYSTEM,"I've booked the tickets, however, they are not refundable. The arrival airport is O'Hare International Airport.",INFORM,,NOTIFY_SUCCESS
60_00063,USER,I also want to rent a car when I'm there.,INFORM_INTENT,,
60_00063,SYSTEM,Do you want the car from March 5th to March 10th?,REQUEST,,
60_00063,USER,"No, I'm going to need it from the 7th of this month until the 9th.",INFORM,,
60_00063,SYSTEM,What kind of car do you want?,REQUEST,,
60_00063,USER,I'd prefer a Compact car.,INFORM,,
60_00063,SYSTEM,What time would you like to pick it up?,REQUEST,,
60_00063,USER,I can go and get it at 17:30. I'm going to need it until next Friday actually.,INFORM,,
60_00063,SYSTEM,I'll reserve you a Compact car for pick up at O'Hare International Airport on March 7th at 5:30 pm with a return on March 8th. Is that correct?,CONFIRM,,
60_00063,USER,"No, I actually want to pick it up at 3:30 in the afternoon.",INFORM,NEGATE,
