dialogue_id,speaker,turn,act_1,act_2,act_3
38_00034,USER,That is the flight I want.,SELECT,,
38_00034,SYSTEM,Are you ready to purchase tickets right now?,OFFER_INTENT,,
38_00034,USER,"Not right now, I have a trip I previously planned approaching. Would you please find 1 one way seat for me?",INFORM,INFORM_INTENT,NEGATE_INTENT
38_00034,SYSTEM,"Delta Airlines offers 1 doable flight for $290, there is 1 stop and the return flight takes off at 6 am.",OFFER,,
38_00034,USER,Where does the flight originate and will the ticket be refundable?,REQUEST,,
38_00034,SYSTEM,The ticket is nonrefundable and the flight would depart from YVR International Airport.,INFORM,,
38_00034,USER,"That one meets the requirements, I'll take it.",SELECT,,
38_00034,SYSTEM,Can be of further assistance?,REQ_MORE,,
38_00034,USER,I'm good thank you goodby.,NEGATE,THANK_YOU,
38_00034,SYSTEM,Have a good day.,GOODBYE,,
38_00035,USER,Can you look up a flight for me,INFORM_INTENT,,
38_00035,SYSTEM,When are you leaving and coming back? Where do you want to go?,REQUEST,,
38_00035,USER,I want to go to Mexico City on the 8th and coming back on the 10th.,INFORM,,
38_00035,SYSTEM,Where are you traveling from?,REQUEST,,
38_00035,USER,I will be traveling from New York City,INFORM,,
38_00035,SYSTEM,I have 2 flights for you with Delta Airlines leaves at 8:45 pm and return at 3 pm for $174,OFFER,,
38_00035,USER,What airport will this flight arrive to?,REQUEST,,
38_00035,SYSTEM,You will arrive at Benito Juarez International Airport,INFORM,,
38_00035,USER,Ok sounds good,SELECT,,
38_00035,SYSTEM,Do you want me to book the flights?,OFFER_INTENT,,
38_00035,USER,No. Can you find me oneway tickets for 2 people in my group?,INFORM,INFORM_INTENT,NEGATE_INTENT
38_00035,SYSTEM,There is a 0 stop Delta Airlines flight leaves at 8:45 pm for $166,OFFER,,
38_00035,USER,What airport will this be and at what time?,REQUEST,,
38_00035,SYSTEM,This will be in Benito juarez International Airport at 11:16 pm,INFORM,,
38_00035,USER,ok sounds good,SELECT,,
38_00035,SYSTEM,Anything else i can help you with?,REQ_MORE,,
38_00035,USER,No,NEGATE,THANK_YOU,
38_00035,SYSTEM,Have a nice day,GOODBYE,,
38_00036,USER,Can you search for flights for me,INFORM_INTENT,,
38_00036,SYSTEM,Where are you planning to go? When do you plan to leave and when are you planning on coming back?,REQUEST,,
38_00036,USER,I plan to leave on March 4th from San Diego to Seattle. I want to return on the 11th of March,INFORM,,
38_00036,SYSTEM,There's an American Airlines flight that leaves at 12:05 pm and returns at 8:15 am that costs $223,OFFER,,
38_00036,USER,That flight sounds good,SELECT,,
38_00036,SYSTEM,Shall I book the tickets?,OFFER_INTENT,,
38_00036,USER,No it's ok. Can you find me one way flights for another upcoming trip. I need four tickets for economy,INFORM,,INFORM_INTENT
38_00036,SYSTEM,I found 1 flight via American Airlines that has 1 stop. it leaves at 12:05 pm and is $237,OFFER,,
38_00036,USER,That flight is good,SELECT,,
38_00036,SYSTEM,Shall I help with anything else?,REQ_MORE,,
38_00036,USER,No that's it,NEGATE,THANK_YOU,
38_00036,SYSTEM,Have a wonderful day,GOODBYE,,
38_00037,USER,Can you find economy flights via United Airlines?,INFORM,,INFORM_INTENT
38_00037,SYSTEM,"Where do you want to leave from, when do you want to leave, and when are you coming back?",REQUEST,,
38_00037,USER,I want to depart from CDMX. I'm leaving on the 3rd of this month and returning on the 12th of March.,INFORM,,
38_00037,SYSTEM,Where do you want to go?,REQUEST,,
38_00037,USER,"I want to go to Phoenix, AZ.",INFORM,,
38_00037,SYSTEM,"There is 1 flight that matches your trip. The flight is through United Airlines, it leaves at 8:45 pm and the return flight leaves at 11:05 am. The ticket costs $263.",OFFER,,
38_00037,USER,"Yes, that sounds great.",SELECT,,
38_00037,SYSTEM,Would you like to purchase the ticket?,OFFER_INTENT,,
38_00037,USER,"No, thank you.",NEGATE_INTENT,,
38_00037,SYSTEM,Anything else I can help you with?,REQ_MORE,,
38_00037,USER,I would like to find oneway flights for three people.,INFORM,INFORM_INTENT,
38_00037,SYSTEM,"There is 1 flight that matches your trip. It is through United Airlines, it leaves at 8:45 pm and costs $215.",OFFER,,
38_00037,USER,When does the onward flight get here?,REQUEST,,
38_00037,SYSTEM,The onward flight gets in at 1:18 am.,INFORM,,
38_00037,USER,That sounds great.,SELECT,,
38_00037,SYSTEM,Anything else I can help you with?,REQ_MORE,,
38_00037,USER,"No, thank you.",NEGATE,THANK_YOU,
38_00037,SYSTEM,Have a great day.,GOODBYE,,
38_00038,USER,I need a flight out of Chicago. Business or economy both work for me.,INFORM,,INFORM_INTENT
38_00038,SYSTEM,Where are you going and when are you coming back?,REQUEST,,
38_00038,USER,I am going to SF and coming back on the 14th of March.,INFORM,,
38_00038,SYSTEM,What day are you leaving?,REQUEST,,
38_00038,USER,I need 2 tickets and am leaving on the 8th.,INFORM,,
38_00038,SYSTEM,An American Airlines flight departs at 7:05 am and the return flight departs at 3:20 pm. It costs $182.,OFFER,,
38_00038,USER,Can you find something else?,REQUEST_ALTS,,
38_00038,SYSTEM,I found a Delta Airlines flight that leaves at 10:40 am and the return flight departs at 10:05 pm. It costs $192.,OFFER,,
38_00038,USER,That works for me.,SELECT,,
38_00038,SYSTEM,Do you want to buy tickets now?,OFFER_INTENT,,
38_00038,USER,"No, not right now. Can you find oneway flights for an upcoming trip?",INFORM_INTENT,NEGATE_INTENT,
38_00038,SYSTEM,"Search revealed 1 flight. It is a Delta Airlines flight that has 0 stops, departs at 10:40 am and costs $181.",OFFER,,
38_00038,USER,What airport does it fly into?,REQUEST,,
38_00038,SYSTEM,It flies into SFO International Airport.,INFORM,,
38_00038,USER,That works for me.,SELECT,,
38_00038,SYSTEM,Do you need anything else?,REQ_MORE,,
38_00038,USER,"No, that is all. Thanks.",NEGATE,THANK_YOU,
38_00038,SYSTEM,Have a good day.,GOODBYE,,
38_00039,USER,Will you please assist me in booking a flight?,INFORM_INTENT,,
38_00039,SYSTEM,What are your expected departure and arrival destinations?,REQUEST,,
38_00039,USER,"I'll be leaving from SFO and arriving in Seattle, WA. I need to return on the 14th.",INFORM,,
38_00039,SYSTEM,When would you like to leave?,REQUEST,,
38_00039,USER,I'll be leaving on Friday next week.,INFORM,,
38_00039,SYSTEM,I've found an Alaska Airlines flight with a ticket price of $138. The outbound flight will depart at 2:55 pm and the return flight departs at 12 pm.,OFFER,,
38_00039,USER,That sounds like a great option.,SELECT,,
38_00039,SYSTEM,Would you like me to purchase this ticket?,OFFER_INTENT,,
38_00039,USER,"No, thank you. Will you please find me a one way flight for an up coming trip?",INFORM_INTENT,NEGATE_INTENT,
38_00039,SYSTEM,I've found 1 flight with Alaska Airlines for $126 per ticket. The flight will depart at 2:55 pm and has 0 stops.,OFFER,,
38_00039,USER,When will the onward flight arrive?,REQUEST,,
38_00039,SYSTEM,The expected time of arrival is 5:06 pm.,INFORM,,
38_00039,USER,What is the airport this flight departs from?,REQUEST,,
38_00039,SYSTEM,This flight will leave from SFO International Airport.,INFORM,,
38_00039,USER,That will work for me.,SELECT,,
38_00039,SYSTEM,Can I be of further assistance to you?,REQ_MORE,,
38_00039,USER,"No, but thank you.",NEGATE,THANK_YOU,
38_00039,SYSTEM,Enjoy your day.,GOODBYE,,
38_00040,USER,Can you find me a flight?,INFORM_INTENT,,
38_00040,SYSTEM,When do you want to leave?,REQUEST,,
38_00040,USER,On Sunday this week.,INFORM,,
38_00040,SYSTEM,"Where will you leave from and where do you want to visit? Also, when are you coming back.",REQUEST,,
38_00040,USER,I prefer American Airlines. I just want 1 ticket. I am leaving from ATL and traveling to Chi-town. I want to return on the 6th of this month.,INFORM,,
38_00040,SYSTEM,I found 1 American Airlines flight. It departs at 9:15 pm and the return flight leaves at 8:50 pm. This flight costs $187.,OFFER,,
38_00040,USER,When does the return flight arrive?,REQUEST,,
38_00040,SYSTEM,1:41 am.,INFORM,,
38_00040,USER,Sounds great.,SELECT,,
38_00040,SYSTEM,Should I purchase a ticket?,OFFER_INTENT,,
38_00040,USER,"No, I am fine.",NEGATE_INTENT,,
38_00040,SYSTEM,May I help with something else.,REQ_MORE,,
38_00040,USER,Yes please. Can you search oneway flights.,INFORM_INTENT,,
38_00040,SYSTEM,I found 1 American Airlines flight. This flight leaves at 9:15 pm and has 0 stops. A ticket costs $133.,OFFER,,
38_00040,USER,Sounds great.,SELECT,,
38_00040,SYSTEM,May I help you with something else?,REQ_MORE,,
38_00040,USER,No thanks.,NEGATE,THANK_YOU,
38_00040,SYSTEM,Have a great day.,GOODBYE,,
38_00041,USER,Can you find a flight for me. I want Southwest Airlines and I want to return on the 14th of this month.,INFORM,,INFORM_INTENT
38_00041,SYSTEM,Where are you departing from? When do you want to leave? Where are you planning on visiting?,REQUEST,,
38_00041,USER,I'm leaving on the 12th. There's two people in my group and we're going to SFO from LAX.,INFORM,,
38_00041,SYSTEM,I found 1 flight for you that fits your trip. It's a Southwest Airlines flight that leaves at 10:20 PM and returns at 12:50 pm. The price of the ticket is $98.,OFFER,,
38_00041,USER,When does the onward flight arrive?,REQUEST,,
38_00041,SYSTEM,The onward flight comes back at 11:45 pm.,INFORM,,
38_00041,USER,"Which airport does it leave from, and our my tickets refundable?",REQUEST,,
38_00041,SYSTEM,"The flight leaves from LAX International Airport. The tickets aren't refundable, sorry.",INFORM,,
38_00041,USER,Sounds good to me.,SELECT,,
38_00041,SYSTEM,Should I buy them?,OFFER_INTENT,,
38_00041,USER,"No, it's okay. I have a trip coming up, can you find me a oneway flight?",INFORM_INTENT,NEGATE_INTENT,
38_00041,SYSTEM,There's a Southwest Airlines flight. It leaves at 10:20 pm and has 0 stops. The ticket is $77.,OFFER,,
38_00041,USER,"What airport does it leave from, and is it refundable?",REQUEST,,
38_00041,SYSTEM,It leaves from LAX International Airport. It's not refundable.,INFORM,,
38_00041,USER,Sounds good to me.,SELECT,,
38_00041,SYSTEM,Do you need help with anything else?,REQ_MORE,,
38_00041,USER,"No, it's okay.",NEGATE,THANK_YOU,
38_00041,SYSTEM,Have a good day.,GOODBYE,,
38_00042,USER,I need a to find a flight back on Sunday this week.,INFORM,INFORM_INTENT,
38_00042,SYSTEM,Where would you like to go? What dates would you like to travel on?,REQUEST,,
38_00042,USER,I need to go to Philly on March 1st for two people. I like Delta Airlines.,INFORM,,
38_00042,SYSTEM,What city would you like to leave from?,REQUEST,,
38_00042,USER,Paris.,INFORM,,
38_00042,SYSTEM,I have 1 flight it is Delta Airlines departing 5:35 pm. The return flight departs at 12:20 pm. The price for the ticket is $378.,OFFER,,
38_00042,USER,Does it have more than one stop?,REQUEST,,
38_00042,SYSTEM,It has 1 stop.,INFORM,,
38_00042,USER,That sounds good.,SELECT,,
38_00042,SYSTEM,Would you like to purchase the tickets?,OFFER_INTENT,,
38_00042,USER,No can you find me a one way ticket?,INFORM_INTENT,NEGATE_INTENT,
38_00042,SYSTEM,I have 1 flight on Delta Airlines departing at 5:35 pm and has 1 stop for $369.,OFFER,,
38_00042,USER,Which airport does it depart form?,REQUEST,,
38_00042,SYSTEM,Charles de Gaulle International Airport.,INFORM,,
38_00042,USER,That sounds good.,SELECT,,
38_00042,SYSTEM,Is there anything else I can help you with?,REQ_MORE,,
38_00042,USER,"Not, that will be all.",NEGATE,THANK_YOU,
38_00042,SYSTEM,Have a great day!,GOODBYE,,
38_00043,USER,Will you help me find some flights?,INFORM_INTENT,,
38_00043,SYSTEM,When and where are you traveling?,REQUEST,,
38_00043,USER,I am traveling from San Francisco to Chicago day after tomorrow.,INFORM,,
38_00043,SYSTEM,When are you returning?,REQUEST,,
38_00043,USER,March 8th on Economy.,INFORM,,
38_00043,SYSTEM,I found American Airlines for $178 that leaves at 3:20 pm and return flight leaves at 7:05 am.,OFFER,,
38_00043,USER,Are there any flights on United Airlines for tomorrow?,INFORM,,REQUEST_ALTS
38_00043,SYSTEM,I found 1 flight on United Airlines for $193 with an outbound flight that leaves at 10:10 pm and return flight that leaves at 6:25 pm.,OFFER,,
38_00043,USER,Which airport does it depart from?,REQUEST,,
38_00043,SYSTEM,SFO International Airport.,INFORM,,
38_00043,USER,Sounds good.,SELECT,,
38_00043,SYSTEM,Do you want to buy tickets?,OFFER_INTENT,,
38_00043,USER,No. Will you find me oneway flights?,INFORM_INTENT,NEGATE_INTENT,
38_00043,SYSTEM,I found 1 flight on United Airlines for $176. It leaves at 10:10 pm with 0 stops.,OFFER,,
38_00043,USER,Sounds good.,SELECT,,
38_00043,SYSTEM,Anything else?,REQ_MORE,,
38_00043,USER,"No, thanks.",NEGATE,THANK_YOU,
38_00043,SYSTEM,Have a nice day.,GOODBYE,,
38_00044,USER,I need a flight that leaves on the 5th of March. Either business or economy is fine.,INFORM,,INFORM_INTENT
38_00044,SYSTEM,"Sure, where are you leaving from, where are you going and when do you want to return?",REQUEST,,
38_00044,USER,It's three of us in the group. We're travelling to Delhi from LA and we want to get back on the 10th of this month.,INFORM,,
38_00044,SYSTEM,I found 1 convenient flight for your trip. It's an American Airlines flight that leaves at 6:30 am and the return flight leaves at 7 pm. It will cost $331.,OFFER,,
38_00044,USER,What airport will my flight depart from and when does my return flight arrive?,REQUEST,,
38_00044,SYSTEM,The return flight will arrive at 8:04 pm and the flight departs from LAX International Airport,INFORM,,
38_00044,USER,Sounds good.,SELECT,,
38_00044,SYSTEM,Should I purchase the tickets?,OFFER_INTENT,,
38_00044,USER,"No, thank you, I have a trip coming up. Can you find me oneway flights?",INFORM_INTENT,NEGATE_INTENT,
38_00044,SYSTEM,I've found 1 that's suitable for you. It's also American Airlines. The outbound flight leaves at 6:30 am and has 1 stop. The ticket will be $346.,OFFER,,
38_00044,USER,Which airport will the flight arrive in and when does the onward flight arrive?,REQUEST,,
38_00044,SYSTEM,The onward flight will arrive at 4:07 pm at Indira Gandhi International airport.,INFORM,,
38_00044,USER,Sounds good to me.,SELECT,,
38_00044,SYSTEM,May I assist you with anything else?,REQ_MORE,,
38_00044,USER,"No, thanks for your help.",NEGATE,THANK_YOU,
38_00044,SYSTEM,Have a great day!,GOODBYE,,
38_00045,USER,Please help me find flights that will leave tomorrow.,INFORM,INFORM_INTENT,
38_00045,SYSTEM,Where will you be leaving from and where do you plan to go?,REQUEST,,
38_00045,USER,I will bee visiting Vegas. I am leaving from SF and I prefer Economy seating.,INFORM,,
38_00045,SYSTEM,When do you plan to go back?,REQUEST,,
38_00045,USER,I do planned to be back 9th of this month. There are 2 people in my group and we prefer flights from American Airlines.,INFORM,,
38_00045,SYSTEM,"I have found 1 flight that is best for you from American Airlines, it departs at 5:30 pm and returns at 5:30 am. It costs $113.",OFFER,,
38_00045,USER,When will it arrive?,REQUEST,,
38_00045,SYSTEM,Your return flight will arrive at 7:05 am.,INFORM,,
38_00045,USER,"Okay, that sounds good.",SELECT,,
38_00045,SYSTEM,Should I book the ticket for you?,OFFER_INTENT,,
38_00045,USER,"No, that's alright.",NEGATE_INTENT,,
38_00045,SYSTEM,Do you need help with anything else?,REQ_MORE,,
38_00045,USER,Can you help me book one way flight? I plan to go on a trip.,INFORM_INTENT,,
38_00045,SYSTEM,I found a flight from American Airlines that departs at 5:30 pm with 0 stops. It costs $104.,OFFER,,
38_00045,USER,That sounds good.,SELECT,,
38_00045,SYSTEM,Do you need further assistance?,REQ_MORE,,
38_00045,USER,"No, thank you!",NEGATE,THANK_YOU,
38_00045,SYSTEM,Have a good day!,GOODBYE,,
38_00046,USER,Please could you search flights preferably with Alaska Airlines?,INFORM,INFORM_INTENT,
38_00046,SYSTEM,"For sure, which is the departure city?",REQUEST,,
38_00046,USER,I am travelling from San Diego.,INFORM,,
38_00046,SYSTEM,Which is the returning date?,REQUEST,,
38_00046,USER,I will flight back on the 12th.,INFORM,,
38_00046,SYSTEM,When are you going to travel?,REQUEST,,
38_00046,USER,I want to travel on 1st of March to SF.,INFORM,,
38_00046,SYSTEM,There is flight with Alaska Airlines. Departure time is 11:10 am and returning flight departures at 6:10 am. The price is $114.,OFFER,,
38_00046,USER,This is nice for me.,SELECT,,
38_00046,SYSTEM,Do you want that I buy tickets?,OFFER_INTENT,,
38_00046,USER,No that is OK. Could you find me one way flights on business or economy?,INFORM,INFORM_INTENT,NEGATE_INTENT
38_00046,SYSTEM,There is 1 suitable flight with Alaska Airlines leaving at 11:10 am with 0 stops. The price is $107.,OFFER,,
38_00046,USER,That is really nice for me.,SELECT,,
38_00046,SYSTEM,Do you want anything else?,REQ_MORE,,
38_00046,USER,No that is fine.,NEGATE,THANK_YOU,
38_00046,SYSTEM,Have a great day.,GOODBYE,,
38_00047,USER,"I'm looking for a family fun getaway. Would you help me search flight options for our trip, please?",INFORM_INTENT,,
38_00047,SYSTEM,"Sure, I'll be happy to assist you. Tell me where you want to go for your trip and when you would like to return.",REQUEST,,
38_00047,USER,"I want to search flights to Atlanta, GA. I want the return date to be the 14th of March.",INFORM,,
38_00047,SYSTEM,"All right. From what city do you want your departure? And, when do you want your flight to leave?",REQUEST,,
38_00047,USER,"Let's make the departure for Tuesday next week, flying out of Seattle, WA.",INFORM,,
38_00047,SYSTEM,"Got it. There is an American Airlines outbound flight, leaving at 9:45 pm, with a return flight at 11:40 am. The ticket costs $241.",OFFER,,
38_00047,USER,"Do you show any other available flights, please?",REQUEST_ALTS,,
38_00047,SYSTEM,"There is a Delta Airlines outbound flight, leaving at 12:15 pm, with a return flight at 4:20 pm. The cost of that ticket is $191.",OFFER,,
38_00047,USER,Great. Is the cost of the ticket refundable?,REQUEST,,
38_00047,SYSTEM,"No, that ticket is not refundable",INFORM,,
38_00047,USER,"Okay, that flight will work.",SELECT,,
38_00047,SYSTEM,Shall I buy the tickets for you now?,OFFER_INTENT,,
38_00047,USER,"No, thanks, not now but can you search for one-way flights next? I have a trip coming up that I need to make a reservation for.",INFORM_INTENT,NEGATE_INTENT,
38_00047,SYSTEM,"I show a Delta Airlines outbound flight, leaving at 12:15 pm, with 0 stops. The price of that ticket is $168.",OFFER,,
38_00047,USER,Cool. I'll take that flight.,SELECT,,
38_00047,SYSTEM,Is there any other assistance you need at this time?,REQ_MORE,,
38_00047,USER,"Nope, really appreciate your help.",NEGATE,THANK_YOU,
38_00047,SYSTEM,Enjoy your day.,GOODBYE,,
38_00048,USER,Will you help me find a flight on March 4th?,INFORM,INFORM_INTENT,
38_00048,SYSTEM,Where are you visiting? When are you leaving and coming back?,REQUEST,,
38_00048,USER,I want to leave on 7th of this month from Phoenix to San Francisco. I plan to return on March 12th. I prefer United Airlines.,INFORM,,
38_00048,SYSTEM,I found 1 flight on United Airlines for $132. It leaves at 11:50 pm and returns at 2:15 pm.,OFFER,,
38_00048,USER,Which airport is the departing flight?,REQUEST,,
38_00048,SYSTEM,Sky Harbor International Airport.,INFORM,,
38_00048,USER,Sounds great.,SELECT,,
38_00048,SYSTEM,Do you want to buy tickets?,OFFER_INTENT,,
38_00048,USER,"No, thanks.",NEGATE_INTENT,,
38_00048,SYSTEM,Is there anything else I can help you with?,REQ_MORE,,
38_00048,USER,I am planning on a trip. Will you find me oneway flights?,INFORM_INTENT,,
38_00048,SYSTEM,I found 1 flight on United Airlines for $114 that leaves at 11:50 pm with 0 stops.,OFFER,,
38_00048,USER,Sounds good.,SELECT,,
38_00048,SYSTEM,Anything else?,REQ_MORE,,
38_00048,USER,"No, that's all for now. Thanks.",NEGATE,THANK_YOU,
38_00048,SYSTEM,Have a great day.,GOODBYE,,
38_00049,USER,Will you help find some flights?,INFORM_INTENT,,
38_00049,SYSTEM,When are you leaving and returning?,REQUEST,,
38_00049,USER,I am to leave on the 6th and return on March 13th.,INFORM,,
38_00049,SYSTEM,Where are you leaving from?,REQUEST,,
38_00049,USER,I am leaving from Washington on 10th of this month.,INFORM,,
38_00049,SYSTEM,Where do you plan to visit?,REQUEST,,
38_00049,USER,"Paris, France.",INFORM,,
38_00049,SYSTEM,I found 2 flights on American Airlines. The outbound flight leaves at 6:05 am and return flight leaves at 4:05 am. The price of the ticket is $289.,OFFER,,
38_00049,USER,Sounds great.,SELECT,,
38_00049,SYSTEM,Do you want to buy the tickets?,OFFER_INTENT,,
38_00049,USER,No. Can you find me oneway flights?,INFORM_INTENT,NEGATE_INTENT,
38_00049,SYSTEM,I found 1 flight on American Airlines for $292. The outbound flight departs at 6:05 am with 1 stop.,OFFER,,
38_00049,USER,What's the arrival time of the onward flight? Is the ticket refundable?,REQUEST,,
38_00049,SYSTEM,"It arrives at 10:22 pm. No, the ticket is not refundable.",INFORM,,
38_00049,USER,Sounds good.,SELECT,,
38_00049,SYSTEM,Anything else?,REQ_MORE,,
38_00049,USER,"No, that's all for now. Thanks.",NEGATE,THANK_YOU,
38_00049,SYSTEM,Have a great day.,GOODBYE,,
38_00050,USER,"I'm traveling to Portland, OR. Can you check flights for me?",INFORM,INFORM_INTENT,
38_00050,SYSTEM,What day do you plan on leaving and returning? Where would you like to leave from?,REQUEST,,
38_00050,USER,Next Wednesday from Ciudad de Mexico returning on the 11th of this month.,INFORM,,
38_00050,SYSTEM,I found 3 flights. There is an American Airlines flight leaving at 2:35 am and the return flight leaves at 7:20 am. The ticket is $269.,OFFER,,
38_00050,USER,Does it have zero stops?,REQUEST,,
38_00050,SYSTEM,There is only 1 stop.,INFORM,,
38_00050,USER,That sounds good.,SELECT,,
38_00050,SYSTEM,Would you like me to buy the tickets?,OFFER_INTENT,,
38_00050,USER,No. I have an upcoming trip. Can you find a oneway flight for me and one more person in my group?,INFORM,INFORM_INTENT,NEGATE_INTENT
38_00050,SYSTEM,I found an American Airlines flight leaving at 2:35 am with 1 stop. The cost is $275 per ticket.,OFFER,,
38_00050,USER,What airport and what is the arrival time?,REQUEST,,
38_00050,SYSTEM,The flight leaves from Benito Juarez International Airport and arrives at 7:45 am.,INFORM,,
38_00050,USER,Sounds good to me.,SELECT,,
38_00050,SYSTEM,Is there anything else.,REQ_MORE,,
38_00050,USER,"No, thank you.",NEGATE,THANK_YOU,
38_00050,SYSTEM,Have a great day!,GOODBYE,,
38_00051,USER,Can you list flights for me?,INFORM_INTENT,,
38_00051,SYSTEM,When is departure and arrival and what locations?,REQUEST,,
38_00051,USER,Departure on the 7th to SFO and return back on the 10th of March.,INFORM,,
38_00051,SYSTEM,What is the departure city.,REQUEST,,
38_00051,USER,The departure city is Vegas.,INFORM,,
38_00051,SYSTEM,An American Airlines departure at 5:30 am is $108 and returns at 5:30 pm.,OFFER,,
38_00051,USER,Are they any stops.,REQUEST,,
38_00051,SYSTEM,There are 0 stops.,INFORM,,
38_00051,USER,This flight meets my needs.,SELECT,,
38_00051,SYSTEM,Would you like tickets reserved?,OFFER_INTENT,,
38_00051,USER,"No, I have a trip coming up and need a oneway flight.",INFORM_INTENT,NEGATE_INTENT,
38_00051,SYSTEM,There is 1 flight on American Airlines that departs at 5:30 am and has 0 stops with a ticket price of $104.,OFFER,,
38_00051,USER,When does the departure flight arrive?,REQUEST,,
38_00051,SYSTEM,It arrives at 7:05 am.,INFORM,,
38_00051,USER,"I like this flight, please reserve.",SELECT,,
38_00051,SYSTEM,"Done, is there anything else you need?",REQ_MORE,,
38_00051,USER,No thank you that is all.,NEGATE,THANK_YOU,
38_00051,SYSTEM,Thank you and have a great day.,GOODBYE,,
38_00052,USER,Can you find me a flight which leaves on the 5th?,INFORM,INFORM_INTENT,
38_00052,SYSTEM,"Sure. Where are you going to, where are you departing from, and when do you want to get back?",REQUEST,,
38_00052,USER,I am going from ATL to Las Vegas and want to be back on the 14th of March.,INFORM,,
38_00052,SYSTEM,"There is a Southwest Airlines ticket for $252. It departs at 2:35 pm, and the flight bringing you back is at 12:05 pm.",OFFER,,
38_00052,USER,Sounds great.,SELECT,,
38_00052,SYSTEM,Do you want me to purchase the tickets?,OFFER_INTENT,,
38_00052,USER,Not right now. I'm going on a trip with two others. Can you find me a one-way flight for three people?,INFORM,INFORM_INTENT,NEGATE_INTENT
38_00052,SYSTEM,There is 1 such flight. It is through Southwest Airlines and costs $242 per ticket. It departs at 2:35 pm and has 1 stop.,OFFER,,
38_00052,USER,Sounds great.,SELECT,,
38_00052,SYSTEM,Do you want anything else?,REQ_MORE,,
38_00052,USER,Nothing else. Thanks.,NEGATE,THANK_YOU,
38_00052,SYSTEM,Have a nice day.,GOODBYE,,
38_00053,USER,"I would like to search flights, please.",INFORM_INTENT,,
38_00053,SYSTEM,Where will you be leaving from?,REQUEST,,
38_00053,USER,I am leaving from NY. I prefer to fly Delta Airlines.,INFORM,,
38_00053,SYSTEM,"When do you plan to depart and come back, and where would you like to fly to?",REQUEST,,
38_00053,USER,"I am traveling to LAX. I am leaving on the 1st, returning on March 14th, and I would prefer to travel in Economy.",INFORM,,
38_00053,SYSTEM,"Delta Airlines has an outbound flight at 7:30 am with a return light at 10:55 pm, and the ticket price is $196.",OFFER,,
38_00053,USER,Is the ticket refundable? Which airport does the flight depart from?,REQUEST,,
38_00053,SYSTEM,Unfortunately the ticket is not refundable. The flight departs from JFK International Airport.,INFORM,,
38_00053,USER,That flight sounds good.,SELECT,,
38_00053,SYSTEM,Would you like to buy tickets?,OFFER_INTENT,,
38_00053,USER,"No, that's okay. I have another trip coming up. Can I search for one way flights for a group of 2 people?",INFORM,INFORM_INTENT,NEGATE_INTENT
38_00053,SYSTEM,I found 1 flight. Delta Airlines has an outbound flight at 7:30 am with 0 stops for $168.,OFFER,,
38_00053,USER,Is the ticket refundable? Which airport does the flight depart from?,REQUEST,,
38_00053,SYSTEM,Unfortunately the ticket is not refundable. The flight departs from JFK International Airport.,INFORM,,
