dialogue_id,speaker,turn,act_1,act_2,act_3
29_00075,USER,"Yes, that would be great! I want to go on the 11th of this month around 4:30 in the evening. I have a date that night that I really want to look good for!",AFFIRM_INTENT,INFORM,
29_00075,SYSTEM,"Ok, so you'd like to make the appointment at Great Clips at 4:30 pm on March 11th?",CONFIRM,,
29_00075,USER,"Oh my gosh, no, I have that mixed up. I need to go on March 12th. I am so sorry. Actually can you make it at half past 5 in the evening.",INFORM,,NEGATE
29_00075,SYSTEM,"Sure, so I will make the appointment at 5:30 pm on March 12th?",CONFIRM,,
29_00075,USER,"Yes, that will work. What is its average rating. And I don't think I got the address yet.",REQUEST,,AFFIRM
29_00075,SYSTEM,Alright I have confirmed your appointment. The average rating is high. It's 3.9. The address is 979 Broadway Ave Ste 108.,INFORM,,NOTIFY_SUCCESS
29_00075,USER,Thanks so much! I know I have been a bit of a pain!,THANK_YOU,,
29_00075,SYSTEM,No problem. Do you need anything else today?,REQ_MORE,,
29_00075,USER,"No, that will be all. Thanks again!",NEGATE,THANK_YOU,
29_00075,SYSTEM,Enjoy the rest of your day.,GOODBYE,,
29_00076,USER,I would like to find a salon in Mountain View.,INFORM,INFORM_INTENT,
29_00076,SYSTEM,I have 9 salons you may like.Bollywood Beauty Salon is one nice salon in Mountain View.,OFFER,,INFORM_COUNT
29_00076,USER,Can you find a different one?,REQUEST_ALTS,,
29_00076,SYSTEM,Christine'S Salon i another nice one in Mountain View.,OFFER,,
29_00076,USER,Can you find me a unisex salon?,INFORM,REQUEST_ALTS,
29_00076,SYSTEM,I found 5 you may like. Cubby Cuts for Kids is a nice one in Mountain View.,OFFER,,INFORM_COUNT
29_00076,USER,Can i get its contacts please?,REQUEST,,
29_00076,SYSTEM,650-964-5437 is the phone number.,INFORM,,
29_00076,USER,What about its address?,REQUEST,,
29_00076,SYSTEM,1734 El Camino Real.,INFORM,,
29_00076,USER,That sounds good. I want an appointment at 11:30 in the morning.,INFORM,INFORM_INTENT,SELECT
29_00076,SYSTEM,What is the date you want?,REQUEST,,
29_00076,USER,I want to visit on 11th of this month.,INFORM,,
29_00076,SYSTEM,"Confirm the following details please: Cubby Cuts for Kids is the name of the Salon, and the appointment at 11:30 am on March 11th.",CONFIRM,,
29_00076,USER,That sounds good.,AFFIRM,,
29_00076,SYSTEM,Appointment confirmed.,NOTIFY_SUCCESS,,
29_00076,USER,Thanks alot for your help.,THANK_YOU,,
29_00076,SYSTEM,How else can i be of help?,REQ_MORE,,
29_00076,USER,Nothing more. That's it. Thanks.,NEGATE,THANK_YOU,
29_00076,SYSTEM,Have a fabulous day!,GOODBYE,,
29_00077,USER,I would like to find a unisex salon in Fairfield.,INFORM,,INFORM_INTENT
29_00077,SYSTEM,There is a nice salon in Fairfield called C'S Barber Shop.,OFFER,,
29_00077,USER,Can you give me their phone number?,REQUEST,,
29_00077,SYSTEM,You can reach them at 707-673-7601.,INFORM,,
29_00077,USER,That's great. I'd like to make an appointment there.,INFORM_INTENT,SELECT,
29_00077,SYSTEM,When would you like your appointment to be?,REQUEST,,
29_00077,USER,I would like it tomorrow morning 11:45.,INFORM,,
29_00077,SYSTEM,Are these details correct? An appointment tomorrow at 11:45 am at C'S Barber Shop.,CONFIRM,,
29_00077,USER,They are not. I'd like to make an appointment on the 14th of March at 1:30 in the afternoon.,INFORM,,NEGATE
29_00077,SYSTEM,Is this correct? The appointment you want is on March 14th at 1:30 pm.,CONFIRM,,
29_00077,USER,That is correct. What is salon's rating?,REQUEST,AFFIRM,
29_00077,SYSTEM,I have confirmation of your appointment. The salon is rated at a 4.9 on average.,INFORM,NOTIFY_SUCCESS,
29_00077,USER,Thank you for your assistance.,THANK_YOU,,
29_00077,SYSTEM,Is there anything else you need?,REQ_MORE,,
29_00077,USER,No thanks.,NEGATE,THANK_YOU,
29_00077,SYSTEM,Please have a great day.,GOODBYE,,
29_00078,USER,I would like help finding a salon.,INFORM_INTENT,,
29_00078,SYSTEM,In what area are you looking for a salon?,REQUEST,,
29_00078,USER,I would like a salon in San Fran.,INFORM,,
29_00078,SYSTEM,I would 10 salons in San Francisco. 1512 Barber Shop is one you might like.,OFFER,,INFORM_COUNT
29_00078,USER,What is its average user rating? What is their contact number?,REQUEST,,
29_00078,SYSTEM,Their average rating is 4.8 The salon can be reached at 415-286-4371.,INFORM,,
29_00078,USER,OK. I would like to book an appointment there.,INFORM_INTENT,SELECT,
29_00078,SYSTEM,At what time?,REQUEST,,
29_00078,USER,I would like an appointment at afternoon 3.,INFORM,,
29_00078,SYSTEM,On which date?,REQUEST,,
29_00078,USER,The 7th of this month.,INFORM,,
29_00078,SYSTEM,To confirm the details: Your appoints is at 3 pm next Thursday at the 1512 Barber Shop.,CONFIRM,,
29_00078,USER,Correct. What is the address?,REQUEST,AFFIRM,
29_00078,SYSTEM,The appointment is confirmed and they are located at 1532 20th Street.,INFORM,NOTIFY_SUCCESS,
29_00078,USER,Thank you for the assistance.,THANK_YOU,GOODBYE,
29_00078,SYSTEM,Have a good day!,GOODBYE,,
29_00079,USER,Please find me a unisex hair salon in SFO,INFORM,,INFORM_INTENT
29_00079,SYSTEM,There are 10 salons I think you'd like. 1512 Barber Shop in San Francisco seems like a good one,OFFER,,INFORM_COUNT
29_00079,USER,What's their phone number?,REQUEST,,
29_00079,SYSTEM,Their number is 415-286-4371,INFORM,,
29_00079,USER,What sort of ratings has it gotten? What's the average?,REQUEST,,
29_00079,SYSTEM,The ratings give it a 4.8,INFORM,,
29_00079,USER,Is there a different salon I'd like?,REQUEST_ALTS,,
29_00079,SYSTEM,There's 20Th Salon and Barber in San Francisco,OFFER,,
29_00079,USER,Anything else around?,REQUEST_ALTS,,
29_00079,SYSTEM,How about A Businessman'S Haircut in San Francisco?,OFFER,,
29_00079,USER,I like that one,SELECT,,
29_00079,SYSTEM,Would you like me to make an appointment for you?,OFFER_INTENT,,
29_00079,USER,Yes please,AFFIRM_INTENT,,
29_00079,SYSTEM,When would you like to get your hair done?,REQUEST,,
29_00079,USER,6 in the evening on March 3rd suits,INFORM,,
29_00079,SYSTEM,"You're going to a Businessman'S Haircut at 6 pm the day after tomorrow, right?",CONFIRM,,
29_00079,USER,"No, I want to go on the 6th",INFORM,NEGATE,
29_00079,SYSTEM,"Ahh, A Businessman'S Haircut next Wednesday?",CONFIRM,,
29_00079,USER,That's perfect. What's their number and their rating?,REQUEST,,AFFIRM
29_00079,SYSTEM,"I wasn't able to make the appointment, can I do anything else for you?",NOTIFY_FAILURE,REQ_MORE,
29_00079,USER,Please book a hair appointment for me at three in the afternoon,INFORM,INFORM_INTENT,
29_00079,SYSTEM,"You want your hair done at a Businessman'S Haircut next Wednesday at 3 pm, right?",CONFIRM,,
29_00079,USER,Yes please,AFFIRM,,
29_00079,SYSTEM,I've booked you in for then,NOTIFY_SUCCESS,,
29_00079,USER,Thanks,THANK_YOU,,
29_00079,SYSTEM,Do you need anything else?,REQ_MORE,,
29_00079,USER,No thanks,NEGATE,THANK_YOU,
29_00079,SYSTEM,Have a great day,GOODBYE,,
29_00080,USER,I'm searching for a salon.,INFORM_INTENT,,
29_00080,SYSTEM,What city shall I search in?,REQUEST,,
29_00080,USER,Please look in Santa Clara.,INFORM,,
29_00080,SYSTEM,Sure. There's a salon named About Time Barber Shop in Santa Clara that's really nice.,OFFER,,
29_00080,USER,"No, I need you to keep looking.",REQUEST_ALTS,,
29_00080,SYSTEM,"No problem. Ok, how about Hunny Hair & Nail Spa in Santa Clara?",OFFER,,
29_00080,USER,"No, I'm not liking either choice, what else is there? Also, I need to find a unisex salon.",INFORM,REQUEST_ALTS,
29_00080,SYSTEM,"I've got it, how about Jimmy Hair Team, it's a gorgeous salon in Santa Clara.",OFFER,,
29_00080,USER,Can you list their rating?,REQUEST,,
29_00080,SYSTEM,"Yes, it's rated 4.2.",INFORM,,
29_00080,USER,I'll go with them. Please book the appointment.,INFORM_INTENT,SELECT,
29_00080,SYSTEM,"Sure thing, what date did you want to book this on ?",REQUEST,,
29_00080,USER,"Book my appointment for the 4th of this month at 1 o""clock in the afternoon.",INFORM,,
29_00080,SYSTEM,Great. Please confirm the booking details: Your appointment at Jimmy Hair Team is scheduled for 1 pm next Monday.,CONFIRM,,
29_00080,USER,"Thanks, can you tell me their address and number?",REQUEST,,AFFIRM
29_00080,SYSTEM,"Of course, their address is 2803 El Camino Real and their number is 408-663-0137.",INFORM,,NOTIFY_SUCCESS
29_00080,USER,"You've been very helpful, thanks.",THANK_YOU,,
29_00080,SYSTEM,Is there anything else I can assist you with?,REQ_MORE,,
29_00080,USER,"Nope, I'd all set. Thank you.",NEGATE,THANK_YOU,
29_00080,SYSTEM,Have a wonderful day.,GOODBYE,,
29_00081,USER,I am looking for a salon.,INFORM_INTENT,,
29_00081,SYSTEM,In what city are you wanting me to find a salon?,REQUEST,,
29_00081,USER,I would like a to find a salon in San Francisco.,INFORM,,
29_00081,SYSTEM,I found 10 salons the first is a nice salon in San Francisco at 1512 Barber Shop,OFFER,,INFORM_COUNT
29_00081,USER,can I hear about the others you found.,REQUEST_ALTS,,
29_00081,SYSTEM,OK I found one in San Francisco at 20Th Salon And Barber,OFFER,,
29_00081,USER,Cam I please get the address and contact number.,REQUEST,,
29_00081,SYSTEM,of course it is at 2737 20th Street and the phone number is 415-824-1335.,INFORM,,
29_00081,USER,Ok that one sounds great I would like to book an appointment for that salon.,INFORM_INTENT,SELECT,
29_00081,SYSTEM,Ok what date do you want for your appointment.,REQUEST,,
29_00081,USER,I would like it for the 5th of March at 12:00.,INFORM,,
29_00081,SYSTEM,OK your appointment is at 20th salon and barber next Tuesday at 12 pm is that ok do you want me to go head an book it?,CONFIRM,,
29_00081,USER,yes that is great what is the average rating and is it unisex?,REQUEST,,AFFIRM
29_00081,SYSTEM,The appointment has been confirmed the average rating is 4.5 and is a unisex salon.,INFORM,,NOTIFY_SUCCESS
29_00081,USER,thank you,THANK_YOU,,
29_00081,SYSTEM,can I do anything else for you.,REQ_MORE,,
29_00081,USER,that is it thank you,NEGATE,THANK_YOU,
29_00081,SYSTEM,have a great day,GOODBYE,,
29_00082,USER,I want to find a salon that is nearby.,INFORM_INTENT,,
29_00082,SYSTEM,Which city should i search in?,REQUEST,,
29_00082,USER,Search for salons in Pleasant Hill.,INFORM,,
29_00082,SYSTEM,I found 4 salons nearby. One you may like is Cool Tops in Pleasant Hill,OFFER,,INFORM_COUNT
29_00082,USER,What is the address and average rating?,REQUEST,,
29_00082,SYSTEM,"2255 Contra Costa Boulevard, average rating is 4.1",INFORM,,
29_00082,USER,"Perfect,I would like to book an appointment.",INFORM_INTENT,SELECT,
29_00082,SYSTEM,What time should I make the appointment for?,REQUEST,,
29_00082,USER,"Please make the appointment on the 13th of this month at 4 o""clock in the evening.",INFORM,,
29_00082,SYSTEM,Please confirm the following details: salon choice is Cool Tops. Appointment date is 4 pm on March 13th,CONFIRM,,
29_00082,USER,No. Change the date to March 1st.,INFORM,NEGATE,
29_00082,SYSTEM,please confirm the following details: the appointment is at 4 pm today.,CONFIRM,,
29_00082,USER,yes that sounds good. What is the contact number? Is it unisex?,REQUEST,,AFFIRM
29_00082,SYSTEM,"The appointment is confirmed. The phone number is 925-798-5214, it is a unisex salon.",INFORM,,NOTIFY_SUCCESS
29_00082,USER,"Thank you very much, that is all.",THANK_YOU,GOODBYE,
29_00082,SYSTEM,Have a pleasant day!,GOODBYE,,
29_00083,USER,I want to find a hair salon?,INFORM_INTENT,,
29_00083,SYSTEM,What city should I search in?,REQUEST,,
29_00083,USER,Search in San Francisco.,INFORM,,
29_00083,SYSTEM,You might try 1512 Barber Shop. It is in San Francisco.,OFFER,,
29_00083,USER,Can you find me a salon in Pleasanton?,INFORM,REQUEST_ALTS,
29_00083,SYSTEM,There are 9 salons in Pleasanton. I recommend Cosmo'S Barber Shop.,OFFER,,INFORM_COUNT
29_00083,USER,Great! Please book an appointment at 16:30.,INFORM,INFORM_INTENT,SELECT
29_00083,SYSTEM,What date should the appointment be?,REQUEST,,
29_00083,USER,Make the appointment for March 9th.,INFORM,,
29_00083,SYSTEM,Is this correct? You would like an appointment at Cosmo'S Barber Shop on March 9th at 4:30 pm.,CONFIRM,,
29_00083,USER,"No, the appointment should be at evening 5.",INFORM,NEGATE,
29_00083,SYSTEM,Is this correct? You would like an appointment at Cosmo's Barber Shop at 5 pm.,CONFIRM,,
29_00083,USER,"No, I want the appointment on the 14th of March",INFORM,NEGATE,
29_00083,SYSTEM,Is this correct? You would like an appointment at Cosmo's Barber Shop on March 14th.,CONFIRM,,
29_00083,USER,"Yes, that's correct.",AFFIRM,,
29_00083,SYSTEM,I scheduled your appointment.,NOTIFY_SUCCESS,,
29_00083,USER,What is the address?,REQUEST,,
29_00083,SYSTEM,The address is 4275 First Street.,INFORM,,
29_00083,USER,Thank you!,THANK_YOU,,
29_00083,SYSTEM,Do you need anything else?,REQ_MORE,,
29_00083,USER,"No, thank you.",NEGATE,THANK_YOU,
29_00083,SYSTEM,Have a good day.,GOODBYE,,
29_00084,USER,"HI, I am looking for a salon in San Jose.",INFORM,INFORM_INTENT,
29_00084,SYSTEM,We have a nice salon in San Jose called Atelier Salon Willow Glen. Does that interest you?,OFFER,,
29_00084,USER,"I would also like to find another salon, this one would need to be a unisex salon in San Francisco.",INFORM,,REQUEST_ALTS
29_00084,SYSTEM,I have found 10 salons that might interest you. 1512 Barber Shop in San Francisco is a nice salon.,OFFER,,INFORM_COUNT
29_00084,USER,May I have the address?,REQUEST,,
29_00084,SYSTEM,The address for 1512 Barber Shop is 1532 20th Street.,INFORM,,
29_00084,USER,What is its average review rating? Do you have a contact number?,REQUEST,,
29_00084,SYSTEM,"Its average rating is listed as 4.8, and we do have a contact number, which is 415-286-4371.",INFORM,,
29_00084,USER,"Ok, I will go with that one.",SELECT,,
29_00084,SYSTEM,May I book an appointment for you there?,OFFER_INTENT,,
29_00084,USER,"Yes, please, I would like an appointment. Is there one available on the 7th at 3:15 in the afternoon or so?",AFFIRM_INTENT,INFORM,
29_00084,SYSTEM,"All right, here are the detail, to confirm: Your appointment at 1512 Barber Shop is at 3:15 PM next Thursday.",CONFIRM,,
29_00084,USER,"Thank you, that sounds good.",AFFIRM,,
29_00084,SYSTEM,Your appointment has been confirmed. Is there anything else?,NOTIFY_SUCCESS,,
29_00084,USER,"Thank you for your help, that is all.",THANK_YOU,GOODBYE,
29_00084,SYSTEM,"You're welcome, have a nice day.",GOODBYE,,
29_00085,USER,"Hello, I am looking for a salon.",INFORM_INTENT,,
29_00085,SYSTEM,Okay great and what city are you looking in?,REQUEST,,
29_00085,USER,I would like to find a salon in Livermore.,INFORM,,
29_00085,SYSTEM,Okay the first one I see listed in Livermore is a nice salon called Fusion 3 Salon Livermore.,OFFER,,
29_00085,USER,Would you happen to know their average rating?,REQUEST,,
29_00085,SYSTEM,Sure! It has a rating of 4.8.,INFORM,,
29_00085,USER,Are there any other options for salons?,REQUEST_ALTS,,
29_00085,SYSTEM,There is also a nice salon in Livermore called Great Clips.,OFFER,,
29_00085,USER,How about any other salons?,REQUEST_ALTS,,
29_00085,SYSTEM,The third one I see available in Livermore is a salon called Livermore Barber Shop Third Street Og.,OFFER,,
29_00085,USER,Do you have a contact number for it?,REQUEST,,
29_00085,SYSTEM,"Yes, their number is 925-292-5328.",INFORM,,
29_00085,USER,Okay that works.,SELECT,,
29_00085,SYSTEM,Would you like me to book an appointment?,OFFER_INTENT,,
29_00085,USER,"Yes I want visit the salon on the 7th of March for 11 o""clock in the morning.",AFFIRM_INTENT,INFORM,
29_00085,SYSTEM,Okay great. You have an appointment scheduled next Thursday at 11 am at the Livermore Barber Shop Third Street Og.,CONFIRM,,
29_00085,USER,"Actually, can we make the appointment for the 1st of March at evening 6:30?",INFORM,,NEGATE
29_00085,SYSTEM,Sure! I have rescheduled your appointment for today at 6:30 pm.,CONFIRM,,
29_00085,USER,Great that sounds good.,AFFIRM,,
29_00085,SYSTEM,Your appointment has been confirmed,NOTIFY_SUCCESS,,
29_00085,USER,Thank you.,THANK_YOU,GOODBYE,
29_00085,SYSTEM,Have a pleasant day.,GOODBYE,,
29_00086,USER,I would like to find a unisex salon.,INFORM,INFORM_INTENT,
29_00086,SYSTEM,Which city would you like to find one in?,REQUEST,,
29_00086,USER,How about San Jose?,INFORM,,
29_00086,SYSTEM,Atelier Salon Willow Glen is a nice salon in San Jose.,OFFER,,
29_00086,USER,"Actually, can you find me a salon in Santa Rosa?",INFORM,REQUEST_ALTS,
29_00086,SYSTEM,Elle Lui Hair Salon is a nice salon in Santa Rosa.,OFFER,,
29_00086,USER,Can you find me a different salon?,REQUEST_ALTS,,
29_00086,SYSTEM,How about Exclusive Spa in Santa Rosa?,OFFER,,
29_00086,USER,What is its average rating?,REQUEST,,
29_00086,SYSTEM,Its average rating is 4.8.,INFORM,,
29_00086,USER,What's its address?,REQUEST,,
29_00086,SYSTEM,Its address is 314 Mendocino Avenue.,INFORM,,
29_00086,USER,That sounds good.,SELECT,,
29_00086,SYSTEM,Shall I book an appointment there?,OFFER_INTENT,,
29_00086,USER,"Yes, please.",AFFIRM_INTENT,,
29_00086,SYSTEM,What date and time would you like your appointment on?,REQUEST,,
29_00086,USER,I would like to visit the salon on Saturday this week. Please make the appointment at 13:30.,INFORM,,
29_00086,SYSTEM,"Please confirm the appointment at Exclusive Spa, at 1:30 pm, tomorrow.",CONFIRM,,
29_00086,USER,"No, I want the visit to be on the 9th of this month, at afternoon 1.",INFORM,,NEGATE
29_00086,SYSTEM,Please confirm the appointment at 1 pm on March 9th.,CONFIRM,,
29_00086,USER,Yes that sounds good. What's the contact number?,REQUEST,AFFIRM,
29_00086,SYSTEM,Your appointment is confirmed. The spa's phone number is 707-528-8266.,INFORM,NOTIFY_SUCCESS,
29_00086,USER,"Thanks, that's all I need.",THANK_YOU,GOODBYE,
29_00086,SYSTEM,Have a pleasant day.,GOODBYE,,
29_00087,USER,I'm looking for a salon.,INFORM_INTENT,,
29_00087,SYSTEM,What city do you prefer?,REQUEST,,
29_00087,USER,I would like it to be in El Cerrito.,INFORM,,
29_00087,SYSTEM,I found 1. Chop Salon & Spa is located in El Cerrito.,OFFER,,INFORM_COUNT
29_00087,USER,That would be great.,SELECT,,
29_00087,SYSTEM,Are you ready to book an appointment?,OFFER_INTENT,,
29_00087,USER,"Yes, please.",AFFIRM_INTENT,,
29_00087,SYSTEM,On which date would you like your appointment?,REQUEST,,
29_00087,USER,"On March 5th, please.",INFORM,,
29_00087,SYSTEM,And at what time?,REQUEST,,
29_00087,USER,I'd like to go around quarter past 10 in the morning.,INFORM,,
29_00087,SYSTEM,I think I've got it. Will you confirm? A 10:15 am appointment with Chop Salon & Spa next Tuesday.,CONFIRM,,
29_00087,USER,That's perfect. What's their number?,REQUEST,AFFIRM,
29_00087,SYSTEM,Your appointment is confirmed. Their number is 510-649-7843.,INFORM,NOTIFY_SUCCESS,
29_00087,USER,Thank you! That'll be all.,THANK_YOU,GOODBYE,
29_00087,SYSTEM,My pleasure. Have a good day!,GOODBYE,,
29_00088,USER,I am looking for a salon in SF.,INFORM,INFORM_INTENT,
29_00088,SYSTEM,"Okay, I found 10 salons. There is a nice salon in San Francisco called 1512 Barber Shop.",OFFER,,INFORM_COUNT
29_00088,USER,Is there anywhere else? I am looking for a unisex salon in Campbell.,INFORM,,REQUEST_ALTS
29_00088,SYSTEM,I found 5 salons. There is a nice salon in Campbell called Bella Capelli Salon.,OFFER,,INFORM_COUNT
29_00088,USER,What is the address and contact number?,REQUEST,,
29_00088,SYSTEM,The address is 2160 South Bascom Avenue. You can reach them by phone at 408-371-2051.,INFORM,,
29_00088,USER,"Okay, that sounds good.",SELECT,,
29_00088,SYSTEM,Would you like me to book an appointment for you?,OFFER_INTENT,,
29_00088,USER,"Yes, please. I would like to go on March 11th.",AFFIRM_INTENT,INFORM,
29_00088,SYSTEM,"Okay, what time would you like?",REQUEST,,
29_00088,USER,"I would like my appointment to be on March 9th at 12:15 pm, please.",INFORM,,
29_00088,SYSTEM,"Okay, just to be sure, you want an appointment at Bella Capelli Salon on March 9th at 12:15 pm?",CONFIRM,,
29_00088,USER,"Yes, that's right.",AFFIRM,,
29_00088,SYSTEM,"Okay, your appointment has been booked.",NOTIFY_SUCCESS,,
29_00088,USER,What's the rating of the salon?,REQUEST,,
29_00088,SYSTEM,The salon has been rated 4.7.,INFORM,,
29_00088,USER,Thank you! I'm all set.,THANK_YOU,GOODBYE,
29_00088,SYSTEM,"Okay, have a nice day.",GOODBYE,,
29_00089,USER,I want to find a salon.,INFORM_INTENT,,
29_00089,SYSTEM,What city should I look in?,REQUEST,,
29_00089,USER,Find a salon in San Jose.,INFORM,,
29_00089,SYSTEM,I found the Atelier Salon Willow Glen in San Jose.,OFFER,,
29_00089,USER,What is the address and average rating?,REQUEST,,
29_00089,SYSTEM,It's located at 1047 Lincoln Highway suite 101 and has an average rating of 4.3.,INFORM,,
29_00089,USER,Can you find me a different unisex salon?,INFORM,REQUEST_ALTS,
29_00089,SYSTEM,I found another salon in San Jose called Barba & Co. San Jose.,OFFER,,
29_00089,USER,That sounds good. I want to book an appointment there.,INFORM_INTENT,SELECT,
29_00089,SYSTEM,What date would you like the appointment?,REQUEST,,
29_00089,USER,I want the appointment at half past 3 in the afternoon on the 11th.,INFORM,,
29_00089,SYSTEM,So confirm an appointment on March 11th at 3:30 pm for a hair stylist at Barba & Co. San Jose.,CONFIRM,,
29_00089,USER,Yes that sounds good. What's the address and contact number?,REQUEST,,AFFIRM
29_00089,SYSTEM,"Great, I've confirmed your appointment. The address is 1775 Park Avenue and the phone number is 669-258-9601.",INFORM,,NOTIFY_SUCCESS
29_00089,USER,Thanks very much.,THANK_YOU,,
29_00089,SYSTEM,Anything else I can help with?,REQ_MORE,,
29_00089,USER,"No, thanks very much.",NEGATE,THANK_YOU,
29_00089,SYSTEM,Have a pleasant day!,GOODBYE,,
29_00090,USER,I am looking to get a haircut at a beauty salon.,INFORM_INTENT,,
29_00090,SYSTEM,Do you know which city I could find a salon?,REQUEST,,
29_00090,USER,I am looking for a salon in Sonoma.,INFORM,,
29_00090,SYSTEM,I found 3 salons in Sonoma. C C Beauty Salon is one you may enjoy.,OFFER,,INFORM_COUNT
29_00090,USER,What kind of reviews does the salon have? Does the salon cater to men and women?,REQUEST,,
29_00090,SYSTEM,The salon has been given an average rating of 4.4 and only caters to women.,INFORM,,
29_00090,USER,Great! I would like to schedule an appointment at C C Beauty Salon.,INFORM_INTENT,SELECT,
29_00090,SYSTEM,What day and time would you like to schedule your appointment?,REQUEST,,
29_00090,USER,I would like to schedule my appointment on March 9th at 16:30.,INFORM,,
29_00090,SYSTEM,Please confirm your appointment time at C C Beauty Salon. Your appointment will be 4:30 pm on March 9th.,CONFIRM,,
29_00090,USER,Yes. What is the address?,REQUEST,AFFIRM,
29_00090,SYSTEM,Your appointment has been confirmed. The address for C C Beauty Salon is 18615 California 12.,INFORM,NOTIFY_SUCCESS,
29_00090,USER,What is the phone number for C C Beauty Salon?,REQUEST,,
29_00090,SYSTEM,The number for C C Beauty Salon is 707-935-8329.,INFORM,,
29_00090,USER,Thank you so much.,THANK_YOU,,
29_00090,SYSTEM,Is there anything else I could help you with?,REQ_MORE,,
29_00090,USER,No thank you.,NEGATE,THANK_YOU,
29_00090,SYSTEM,Have a great day.,GOODBYE,,
29_00091,USER,I would like to find a salon.,INFORM_INTENT,,
29_00091,SYSTEM,Which city are you looking in?,REQUEST,,
29_00091,USER,I'd like to find one in SF.,INFORM,,
29_00091,SYSTEM,"In San Francisco, I found 1512 Barber Shop.",OFFER,,
29_00091,USER,"Actually, can you look in San Jose? I need a unisex salon.",INFORM,,REQUEST_ALTS
29_00091,SYSTEM,There are 10 salons that you might like. Atelier Salon Willow Glen is a nice place in San Jose.,OFFER,,INFORM_COUNT
29_00091,USER,What's the address and contact number for that one?,REQUEST,,
29_00091,SYSTEM,The address is 1047 Lincoln Highway suite 101. The phone number is 408-293-3494.,INFORM,,
29_00091,USER,Sounds great. Can you book me an appointment on March 10th?,INFORM,INFORM_INTENT,SELECT
29_00091,SYSTEM,At what time do you want an appointment?,REQUEST,,
29_00091,USER,I'd actually like to go on the 1st. The appointment should be at evening 4:30.,INFORM,,
29_00091,SYSTEM,Please confirm: An appointment at 4:30 pm today at Atelier Salon Willow Glen hair stylist.,CONFIRM,,
29_00091,USER,"No, I'd like the appointment at afternoon 1.",INFORM,NEGATE,
29_00091,SYSTEM,Pleas confirm: An appointment at 1 pm at Atelier Salon Willow Glen.,CONFIRM,,
29_00091,USER,That sounds great. What's their average rating.,REQUEST,AFFIRM,
29_00091,SYSTEM,I've confirmed your appointment. The average rating of the salon is 4.3.,INFORM,NOTIFY_SUCCESS,
29_00091,USER,Thank you so much!,THANK_YOU,,
29_00091,SYSTEM,Do you need help with anything else?,REQ_MORE,,
29_00091,USER,"No, thank you!",NEGATE,THANK_YOU,
29_00091,SYSTEM,Have a good day.,GOODBYE,,
29_00092,USER,I want to go take a hair cut. Can you help me find a salon?,INFORM_INTENT,,
29_00092,SYSTEM,I can help you. In which city the salon should be?,REQUEST,,
29_00092,USER,The place should be in San Jose.,INFORM,,
29_00092,SYSTEM,"In San Jose, a great salon is the Atelier Salon Willow Glen.",OFFER,,
29_00092,USER,This one is perfect!,SELECT,,
29_00092,SYSTEM,Is there anything else I can do for you?,REQ_MORE,,
29_00092,USER,I would like to book an appointment at this salon.,INFORM_INTENT,,
29_00092,SYSTEM,What date and hour would you like your appointment to be set?,REQUEST,,
29_00092,USER,I would like the appointment to be set on the 10th at two in the afternoon.,INFORM,,
29_00092,SYSTEM,Could you confirm some detelais for me? Your appointment will be on March 10th at 2 pm with Atelier Salon Willow Glen.,CONFIRM,,
29_00092,USER,No. I would like the appoint to be moved to 4:30 in the evening.,INFORM,NEGATE,
29_00092,SYSTEM,Could you confirm some detelais for me? Your appointment will be on March 10th at 4:30 pm with Atelier Salon Willow Glen.,CONFIRM,,
29_00092,USER,No. I would like the appoint to be moved to 1st of March.,INFORM,NEGATE,
29_00092,SYSTEM,Could you confirm some detelais for me? Your appointment will be today at 4:30 pm.,CONFIRM,,
