dialogue_id,speaker,turn,act_1,act_2,act_3
88_00053,USER,I would need 4 tickets.,INFORM,,
88_00053,SYSTEM,Where are you leaving from?,REQUEST,,
88_00053,USER,I'm leaving from Washington.,INFORM,,
88_00053,SYSTEM,There is a bus leaving from Washington going to New York on March 1st at 12:30 pm for 4 people.,CONFIRM,,
88_00053,USER,"Yes, that works for us.",AFFIRM,,
88_00053,SYSTEM,Your tickets have been purchased.,NOTIFY_SUCCESS,,
88_00053,USER,How many transfers does this bus have?,REQUEST,,
88_00053,SYSTEM,There is 0 transfer.,INFORM,,
88_00053,USER,How much does it cost and where is the bus station?,REQUEST,,
88_00053,SYSTEM,The cost is $38 and the bus station is Union Station.,INFORM,,
88_00053,USER,Thank you I would like to book 4 tickets for the event.,INFORM,INFORM_INTENT,
88_00053,SYSTEM,4 tickets for Outlaw Music Festival on March 3rd in New York.,CONFIRM,,
88_00053,USER,"Yes, that is correct can I have the address?",REQUEST,AFFIRM,
88_00053,SYSTEM,"The tickets are purchased. The location is 1 Tennis Place, Forest Hills.",INFORM,NOTIFY_SUCCESS,
88_00053,USER,Thank you for your time.,THANK_YOU,,
88_00053,SYSTEM,Can I help with anything else?,REQ_MORE,,
88_00053,USER,"No, that is all I needed.",NEGATE,THANK_YOU,
88_00053,SYSTEM,Have a good day.,GOODBYE,,
88_00054,USER,I am having trouble finding dates for a few events. Can you help me?,INFORM_INTENT,,
88_00054,SYSTEM,Which event shall I search for?,REQUEST,,
88_00054,USER,The Blue Jays Vs Yankees. It was recommended to me.,INFORM,,
88_00054,SYSTEM,What city shall I search first?,REQUEST,,
88_00054,USER,"Lets go with Toronto, Canada.",INFORM,,
88_00054,SYSTEM,The Blue Jays Vs Yankees is at Rogers Centre on March 2nd.,OFFER,,
88_00054,USER,Can you check other dates for The Drums please? Please look in San Fran area.,INFORM,,REQUEST_ALTS
88_00054,SYSTEM,The Drums will be in San Fran on March 6th at August Hall.,OFFER,,
88_00054,USER,Do you have that address?,REQUEST,,
88_00054,SYSTEM,August Hall is located at 420 Mason Street.,INFORM,,
88_00054,USER,I'd like to reserve a bus ticket for The Drums event.,SELECT,,
88_00054,SYSTEM,You will be leaving March 6th I assume. From which city?,REQUEST,,
88_00054,USER,No I want to leave the 1st of March from Vegas.,INFORM,,
88_00054,SYSTEM,How many tickets shall i reserve?,REQUEST,,
88_00054,USER,I only need 1 ticket.,INFORM,,
88_00054,SYSTEM,What time of day do you prefer to leave?,REQUEST,,
88_00054,USER,I'd prefer to leave in the morning 11:15.,INFORM,,
88_00054,SYSTEM,To confirm: You wish to reserve 1 bus ticket that leaves Las Vegas March 1st at 11:15 am for San Francisco. is this accurate?,CONFIRM,,
88_00054,USER,Yes sounds perfect.,AFFIRM,,
88_00054,SYSTEM,I'm sorry but no seats are available on that bus. There is an available seat on a 10:50 am bus for $55.,OFFER,,NOTIFY_FAILURE
88_00054,USER,"Ok, lets go with that one.",AFFIRM,,
88_00054,SYSTEM,Your ticket has been reserved.,NOTIFY_SUCCESS,,
88_00054,USER,Ok. Now I would like to book event tickets please.,INFORM_INTENT,,
88_00054,SYSTEM,To confirm: You wish to book 1 ticket for The Drums on March 6th in San Francisco. Is this correct?,CONFIRM,,
88_00054,USER,Yes you have it right. What is the starting time of the event?,REQUEST,AFFIRM,
88_00054,SYSTEM,Reservation is confirmed. The event begins at 6:30 pm.,INFORM,NOTIFY_SUCCESS,
88_00054,USER,Thank you that will be all.,THANK_YOU,GOODBYE,
88_00054,SYSTEM,Have fun at the event.,GOODBYE,,
88_00055,USER,I'm interested in finding events.,INFORM_INTENT,,
88_00055,SYSTEM,Is there a specific event you're interested in attending?,REQUEST,,
88_00055,USER,"I've heard that the Psychedelic Furs put on a great show. Can you find events in SD, please?",INFORM,,
88_00055,SYSTEM,There is a Psychedelic Furs concert on March 3rd at The Observatory North Park.,OFFER,,
88_00055,USER,Great. Can I'd like to reserve one bus ticket to the show and depart by 12:15 on March 2nd.,SELECT,,
88_00055,SYSTEM,Where are you departing from?,REQUEST,,
88_00055,USER,"I'll be traveling from Long Beach, CA.",INFORM,,
88_00055,SYSTEM,"To confirm: You'd like 1 bus ticket from Long Beach to San Diego for March 2nd at 12:15 pm, correct?",CONFIRM,,
88_00055,USER,"No, no. I'm actually departing from Fresno, CA.",INFORM,NEGATE,
88_00055,SYSTEM,"To confirm: You'd like a bus ticket from Fresno to San Diego, correct?",CONFIRM,,
88_00055,USER,"Yes, that's perfect.",AFFIRM,,
88_00055,SYSTEM,"Sorry, I was unable your ticket. There is another bus that departs at 12 pm, and tickets are $48.",OFFER,,NOTIFY_FAILURE
88_00055,USER,That's fine.,AFFIRM,,
88_00055,SYSTEM,Your ticket has been reserved.,NOTIFY_SUCCESS,,
88_00055,USER,Which bus station am I leaving from and are there any transfers?,REQUEST,,
88_00055,SYSTEM,You will be departing from Fresno Station and your trip has 0 transfers.,INFORM,,
88_00055,USER,Thank you so much. Let's go back to booking tickets for the show.,INFORM_INTENT,,
88_00055,SYSTEM,"To confirm: You'd like 1 ticket to see the Psychedelic Furs on March 3rd in San Diego, correct?",CONFIRM,,
88_00055,USER,"Yes, that is correct.",AFFIRM,,
88_00055,SYSTEM,Your ticket has been reserved. Enjoy the show.,NOTIFY_SUCCESS,,
88_00055,USER,That you so much for all of your help.,THANK_YOU,GOODBYE,
88_00055,SYSTEM,Enjoy your day.,GOODBYE,,
88_00056,USER,I'm supposed to plan an outing with some friends. Can you look up some events for me?,INFORM_INTENT,,
88_00056,SYSTEM,"Sure, what kind of event are you interested in?",REQUEST,,
88_00056,USER,I've been hearing good things about Blackbear.,INFORM,,
88_00056,SYSTEM,What city are you looking in?,REQUEST,,
88_00056,USER,We want to go to NYC.,INFORM,,
88_00056,SYSTEM,"Ok, I found Blackbear at Pier 17 on March 3rd. It's happening on 4 different days.",OFFER,,
88_00056,USER,That sounds fine.,SELECT,,
88_00056,SYSTEM,Do you want to buy tickets?,OFFER_INTENT,,
88_00056,USER,"No, not yet.",NEGATE_INTENT,,
88_00056,SYSTEM,Anything else I can do?,REQ_MORE,,
88_00056,USER,I want to book bus tickets to get there.,INFORM_INTENT,,
88_00056,SYSTEM,No problem. Would you be leaving on March 3rd?,REQUEST,,
88_00056,USER,"No, March 1st.",INFORM,,
88_00056,SYSTEM,Ok. How many tickets do you need?,REQUEST,,
88_00056,USER,Just for one person from Washington.,INFORM,,
88_00056,SYSTEM,"Ok, and what time do you want to leave?",REQUEST,,
88_00056,USER,Ideally around 12:30 in the afternoon on March 2nd.,INFORM,,
88_00056,SYSTEM,"Sure. Before I book it, please confirm you want 1 bus ticket from Washington to New York on March 2nd at 12:30 pm. Is that right?",CONFIRM,,
88_00056,USER,"Yes, that's right.",AFFIRM,,
88_00056,SYSTEM,"Ok, I've booked your ticket.",NOTIFY_SUCCESS,,
88_00056,USER,"Great, thanks. Can you book three tickets for that event for me now?",INFORM,INFORM_INTENT,
88_00056,SYSTEM,Sure. Can you just confirm that you want 3 tickets for Blackbear in New York on March 3rd?,CONFIRM,,
88_00056,USER,"Yep, that's right. Where's the venue?",REQUEST,AFFIRM,
88_00056,SYSTEM,I've booked your tickets. The venue is at 89 South Street. Have a good time!,INFORM,NOTIFY_SUCCESS,
88_00056,USER,"Great, thanks. When does it start?",REQUEST,,
88_00056,SYSTEM,It starts at 7 pm.,INFORM,,
88_00056,USER,"Cool, thanks for your help! That's all.",THANK_YOU,GOODBYE,
88_00056,SYSTEM,"Ok, have a good day.",GOODBYE,,
88_00057,USER,I've heard many good things about Cher. Can you see if any of her shows are playing in San Fran?,INFORM,,INFORM_INTENT
88_00057,SYSTEM,I found 5 Cher shows in the area. How about one on March 1st at Chase Center Experience?,OFFER,,
88_00057,USER,Can you give me another date?,REQUEST_ALTS,,
88_00057,SYSTEM,Sure. Cher will be playing at Chase Center Experience once more on March 6th.,OFFER,,
88_00057,USER,What's the time and address of the show?,REQUEST,,
88_00057,SYSTEM,You need to be at 500 Terry A Francois Boulevard Suite 73 by 7 pm.,INFORM,,
88_00057,USER,Good to know. I'd like to reserve a bus to go there.,SELECT,,
88_00057,SYSTEM,"Give me a time and number of tickets. Will the date be the same as the concert, on March 6th, or will it be earlier?",REQUEST,,
88_00057,USER,"The time will be at quarter to 7 in the morning, and I need only one ticket. I'll be leaving earlier, on the 5th.",INFORM,,
88_00057,SYSTEM,Where will you be leaving?,REQUEST,,
88_00057,USER,"To get there, I will leave Long Beach, CA.",INFORM,,
88_00057,SYSTEM,"I see. So, I should get you 1 ticket for a bus that goes from Long Beach to San Francisco at 6:45 am on March 5th?",CONFIRM,,
88_00057,USER,"Actually, I need more time to prepare. Find something that leaves this Sunday at 18:45.",INFORM,,NEGATE
88_00057,SYSTEM,"Okay, so you want a bus that leaves on March 3rd at 6:45 pm?",CONFIRM,,
88_00057,USER,"Also, I want it to depart from LA.",INFORM,NEGATE,
88_00057,SYSTEM,"Okay, so I should get you a ticket that heads out from Los Angeles starting on March 3rd?",CONFIRM,,
88_00057,USER,"Yes, that's good. Can I have the name of the bus station I'll be leaving?",REQUEST,AFFIRM,
88_00057,SYSTEM,You'll be leaving Union Station. I'm so sorry! I couldn't get the ticket for you. Is it fine if you instead get a $49 ticket for a bus that departs at 7 pm?,INFORM,OFFER,
88_00057,USER,"Yes, that works.",AFFIRM,,
88_00057,SYSTEM,I have successfully reserved your ticket.,NOTIFY_SUCCESS,,
88_00057,USER,"What's the number of transfers? One, zero? What's the destination bus station?",REQUEST,,
88_00057,SYSTEM,It has 0 transfers and will arrive at Salesforce Transit Center.,INFORM,,
88_00057,USER,Thanks for helping me out. I want to resume booking the Cher tickets.,INFORM_INTENT,,
88_00057,SYSTEM,"Okay, so I should book 1 ticket for the Cher ticket on March 6th in San Francisco?",CONFIRM,,
88_00057,USER,"Yes, that sounds good.",AFFIRM,,
88_00057,SYSTEM,I have reserved your ticket. Enjoy the show!,NOTIFY_SUCCESS,,
88_00057,USER,Thanks a lot! I don't need anything else right now.,THANK_YOU,GOODBYE,
88_00057,SYSTEM,Have yourself a wonderful day.,GOODBYE,,
88_00058,USER,My friends and I would like to attend an event. Any date you can suggest?,INFORM_INTENT,,
88_00058,SYSTEM,Any particular city I should search in? What kind of events interest you?,REQUEST,,
88_00058,USER,"Please find something in Portland, OR., because my friends really love Bryan Adams.",INFORM,,
88_00058,SYSTEM,"Your search yielded 5 days of the event. How about March 4th, when Bryan Adams will be performing at Theater of the Clouds?",OFFER,,
88_00058,USER,That sounds perfect. Please book 4 tickets for the bus leaving for Portland later today.,SELECT,,
88_00058,SYSTEM,"Please tell me when you'd like to leave, and your origin city.",REQUEST,,
88_00058,USER,I'd like to leave from Seattle at half past 8 in the morning.,INFORM,,
88_00058,SYSTEM,"Okay, I'm almost done. Let me see if I got everything correctly: You'd like 4 tickets on the 8:30 am, March 1st bus, leaving Seattle for Portland.",CONFIRM,,
88_00058,USER,"No, sorry, one of us won't be available at 8:30 am. Please change the departure time to 7:30 in the evening.",INFORM,NEGATE,
88_00058,SYSTEM,"Sure, no problem. Please confirm that the destination is still Portland and the bus will depart at 7:30 pm.",CONFIRM,,
88_00058,USER,That is correct. Please let me know the departure station.,REQUEST,AFFIRM,
88_00058,SYSTEM,I have successfully made your reservation. The departure station is King Street Station.,INFORM,NOTIFY_SUCCESS,
88_00058,USER,"Okay, thanks. Please go back to booking the event tickets.",INFORM_INTENT,,
88_00058,SYSTEM,Sure. Please confirm that you'd like to book 4 ticket for the March 4th Bryan Adams concert in Portland.,CONFIRM,,
88_00058,USER,That is correct. May I know when the event starts?,REQUEST,AFFIRM,
88_00058,SYSTEM,I have successfully made your reservation. Enjoy the show! The event will start at 7 pm.,INFORM,NOTIFY_SUCCESS,
88_00058,USER,Please let me know the event venue.,REQUEST,,
88_00058,SYSTEM,The event will be at 1016-1098 North Center Court Street.,INFORM,,
88_00058,USER,Thank you very much. You've been very helpful.,THANK_YOU,,
88_00058,SYSTEM,Would you like my help with anything else?,REQ_MORE,,
88_00058,USER,"No, thank you very much. You've been very helpful.",NEGATE,THANK_YOU,
88_00058,SYSTEM,"Thank you, and have a wonderful day!",GOODBYE,,
88_00059,USER,I want to go to a Whitecaps Vs Earthquakes game.,INFORM,INFORM_INTENT,
88_00059,SYSTEM,Which city should I search in?,REQUEST,,
88_00059,USER,I would like a game in Vancouver.,INFORM,,
88_00059,SYSTEM,There is a Whitecaps Vs Earthquakes game at BC Place on March 2nd.,OFFER,,
88_00059,USER,That sounds good.,SELECT,,
88_00059,SYSTEM,Would you like to purchase tickets?,OFFER_INTENT,,
88_00059,USER,"Not right now, thanks.",NEGATE_INTENT,,
88_00059,SYSTEM,Is there anything else I can help you with?,REQ_MORE,,
88_00059,USER,I would like to find a bus for 3 people leaving on the 1st.,INFORM,,INFORM_INTENT
88_00059,SYSTEM,What time would you like to leave?,REQUEST,,
88_00059,USER,I want to leave at 8:15 in the morning.,INFORM,,
88_00059,SYSTEM,Where are you travelling from?,REQUEST,,
88_00059,USER,I am leaving from Seattle.,INFORM,,
88_00059,SYSTEM,"Okay, you would like 3 tickets for the bus traveling from Seattle to Vancouver on March 1st at 8:15 am, correct?",CONFIRM,,
88_00059,USER,"Yes, that's correct. Which station am I leaving from and what is the total cost?",REQUEST,,AFFIRM
88_00059,SYSTEM,This bus leaves from King Street Station at 8:40 am and costs $28.,INFORM,OFFER,
88_00059,USER,That works perfectly.,AFFIRM,,
88_00059,SYSTEM,Your tickets have been booked.,NOTIFY_SUCCESS,,
88_00059,USER,Can I return to booking the game tickets?,INFORM_INTENT,,
88_00059,SYSTEM,"Sure, you would like 3 tickets for the Whitecaps Vs Earthquakes game on March 2nd in Vancouver, correct?",CONFIRM,,
88_00059,USER,"Yes, that works.",AFFIRM,,
88_00059,SYSTEM,Your tickets have been reserved. Enjoy the game!,NOTIFY_SUCCESS,,
88_00059,USER,Thank you! That's all I need.,THANK_YOU,GOODBYE,
88_00059,SYSTEM,Have a great day!,GOODBYE,,
88_00060,USER,I would like to find an event.,INFORM_INTENT,,
88_00060,SYSTEM,What kind of event and in which city?,REQUEST,,
88_00060,USER,I heard about Vertical Horizon in NY.,INFORM,,
88_00060,SYSTEM,"There is 4 days. There is the event on March 4th, Vertical Horizon at Sony Hall.",OFFER,,
88_00060,USER,Where is the venue located and when does the event start?,REQUEST,,
88_00060,SYSTEM,The venue is at 235 West 46th Street and starts at 6:30 pm.,INFORM,,
88_00060,USER,That sounds good. I would like to reserve a bus to go there.,SELECT,,
88_00060,SYSTEM,Do you want a bus on March 4th?,REQUEST,,
88_00060,USER,"No, on the 3rd around 08:00.",INFORM,,
88_00060,SYSTEM,How many tickets do you need?,REQUEST,,
88_00060,USER,I would need two tickets.,INFORM,,
88_00060,SYSTEM,Where are you departing from?,REQUEST,,
88_00060,USER,I'm leaving today from Washington.,INFORM,,
88_00060,SYSTEM,Do you want 2 tickets leaving from Washington to New York on March 1st at 8 am?,CONFIRM,,
88_00060,USER,"Yes, that is perfect. Which bus station am I leaving from and reaching?",REQUEST,,AFFIRM
88_00060,SYSTEM,You are leaving at Port Authority Station and going to Union Station at 8:10 am for $37.,INFORM,,OFFER
88_00060,USER,"Yes, that is good for me.",AFFIRM,,
88_00060,SYSTEM,Your tickets have been purchased.,NOTIFY_SUCCESS,,
88_00060,USER,I want to book two tickets for the event.,INFORM,INFORM_INTENT,
88_00060,SYSTEM,2 tickets for Vertical Horizon on March 4th in New York.,CONFIRM,,
88_00060,USER,"Yes, that is perfect.",AFFIRM,,
88_00060,SYSTEM,Your tickets have been purchased.,NOTIFY_SUCCESS,,
88_00060,USER,Thank you for your time.,THANK_YOU,,
88_00060,SYSTEM,Can I help with anything else?,REQ_MORE,,
88_00060,USER,"No, that is all.",NEGATE,THANK_YOU,
88_00060,SYSTEM,Have a good day.,GOODBYE,,
88_00061,USER,Can you help me find some dates for events in Philadelphia?,INFORM,INFORM_INTENT,
88_00061,SYSTEM,What event would you prefer?,REQUEST,,
88_00061,USER,Owls Vs Terrapins I heard it's really good.,INFORM,,
88_00061,SYSTEM,I have found for you the event on 3 days.Owls Vs Terrapins will be at Lincoln Financial Field on March 6th.,OFFER,,
88_00061,USER,It sounds really good.,SELECT,,
88_00061,SYSTEM,Can I help with something else ?,REQ_MORE,,
88_00061,USER,Yes make me a bus reservation.I want to leave on March 2nd at 14:30 from Washington.,INFORM,,
88_00061,SYSTEM,How many tickets are needed?,REQUEST,,
88_00061,USER,I want to buy for 3 people.,INFORM,,
88_00061,SYSTEM,3 tickets for the bus that leave from Washington to Philadelphia on March 2nd at 2:30 pm.I'm right?,CONFIRM,,
88_00061,USER,"Yes is perfect, but tell me what's the bus station from where I am leaving from and how many transfer does it have.",REQUEST,,AFFIRM
88_00061,SYSTEM,Number of transfers is 0.Union Station is the origin station.I'm sorry but buying that tickets could not be done.The cost is $31 and departs at 2:10 pm.,INFORM,,OFFER
88_00061,USER,It's okay for me.,AFFIRM,,
88_00061,SYSTEM,Tickets are confirmed.,NOTIFY_SUCCESS,,
88_00061,USER,Thank you.Let's get back to the tickets.,INFORM_INTENT,,
88_00061,SYSTEM,Book 3 tickets at Owls Vs Terrapins on March 6th in Philadelphia is that correct?,CONFIRM,,
88_00061,USER,Yes is perfect.,AFFIRM,,
88_00061,SYSTEM,The booking was successful.Have fun!,NOTIFY_SUCCESS,,
88_00061,USER,Tell me when the event will start.,REQUEST,,
88_00061,SYSTEM,At 6:30 pm.,INFORM,,
88_00061,USER,Thank you.That's what I needed now.,THANK_YOU,GOODBYE,
88_00061,SYSTEM,Have a nice day!,GOODBYE,,
88_00062,USER,I want to search dates for events.,INFORM_INTENT,,
88_00062,SYSTEM,In which city do you want to search?,REQUEST,,
88_00062,USER,I am searching something in Seattle.,INFORM,,
88_00062,SYSTEM,Which event who are interested in?,REQUEST,,
88_00062,USER,I know that Sounders Vs Timbers is fantastic.,INFORM,,
88_00062,SYSTEM,"On March 1st, Sounders Vs Timbers event at CenturyLink Field",OFFER,,
88_00062,USER,What is the starting time of the event and where it is located?,REQUEST,,
88_00062,SYSTEM,It is at 800 Occidental Avenue South and event will start at 6:30 pm.,INFORM,,
88_00062,USER,Is there any other events on that date?,REQUEST_ALTS,,
88_00062,SYSTEM,"On March 2nd, Sounders Vs Timbers event at CenturyLink Field",OFFER,,
88_00062,USER,It is good for me.,SELECT,,
88_00062,SYSTEM,Shall I book the tickets for that event?,OFFER_INTENT,,
88_00062,USER,It can be done later. I wish to book a bus to go to that event.,NEGATE_INTENT,,
88_00062,SYSTEM,When will you leave? How many tickets shall I book?,REQUEST,,
88_00062,USER,I will leave at 6 in the evening and I need it 2 persons.,INFORM,,
88_00062,SYSTEM,From which place will you leave? Are you plan to leave at March 2nd?,REQUEST,,
88_00062,USER,"I will leave on March 1st from Portland, OR",INFORM,,
88_00062,SYSTEM,"Kindly ensure that, on March 1st, bus ticket has been booked for 2 persons from Portland to Seattle. It will leave at 6 pm",CONFIRM,,
88_00062,USER,It is good for me. What is the total cost? What is the name of the destination station?,REQUEST,,AFFIRM
88_00062,SYSTEM,The reaching station is King Street Station. I am very sorry that I am unable to book tickets. The bus will start at 5:50 pm. It costs $34.,INFORM,OFFER,
88_00062,USER,It is good for me.,AFFIRM,,
88_00062,SYSTEM,Your ticket is booked.,NOTIFY_SUCCESS,,
88_00062,USER,Please get back for booking tickets.,INFORM_INTENT,,
88_00062,SYSTEM,"Kindly ensure that, on March 2nd, bus ticket has been booked for 2 persons for the event Sounders Vs Timbers at Seattle.",CONFIRM,,
88_00062,USER,Yes. it is good for me.,AFFIRM,,
88_00062,SYSTEM,Your booking is done. Have a great time there!,NOTIFY_SUCCESS,,
88_00062,USER,Thank you so much for your help.,THANK_YOU,,
88_00062,SYSTEM,Do you need any other help?,REQ_MORE,,
88_00062,USER,Nope. Thank you so much for your help.,NEGATE,THANK_YOU,
88_00062,SYSTEM,Have a fantastic day.,GOODBYE,,
88_00063,USER,I would like to find fun events.,INFORM_INTENT,,
88_00063,SYSTEM,What is the city and type?,REQUEST,,
88_00063,USER,Something in Napa and Roy Ayers would be good.,INFORM,,
88_00063,SYSTEM,"On March 1st, Roy Ayers is at Blue Note Napa.",OFFER,,
88_00063,USER,How about others? In LA do you have Usc Vs Ucla?,INFORM,,REQUEST_ALTS
88_00063,SYSTEM,"I have 3. On March 4th, Usc Vs Ucla is at LA Memorial Coliseum.",OFFER,,
88_00063,USER,Do you have another date?,REQUEST_ALTS,,
88_00063,SYSTEM,"On March 6th, Usc Vs Ucla is at LA Memorial Coliseum.",OFFER,,
88_00063,USER,I like that one.,SELECT,,
88_00063,SYSTEM,Is there anything else I can do?,REQ_MORE,,
88_00063,USER,I would like to get tickets for departure at quarter past 5 in the evening.,INFORM,INFORM_INTENT,
88_00063,SYSTEM,How many tickets you want?,REQUEST,,
88_00063,USER,I want three tickets.,INFORM,,
88_00063,SYSTEM,Where do you want to depart on March 6th?,REQUEST,,
88_00063,USER,Tuesday next week I want to leave Anaheim.,INFORM,,
88_00063,SYSTEM,Confirm on March 5th departure at 5:15 pm from Anaheim for 3 tickets to Los Angeles.,CONFIRM,,
88_00063,USER,Yes I confirm all.,AFFIRM,,
88_00063,SYSTEM,I cannot book that time but I have 5:20 pm for $12.,OFFER,,NOTIFY_FAILURE
88_00063,USER,Yes I accept that.,AFFIRM,,
88_00063,SYSTEM,Your tickets are confirmed.,NOTIFY_SUCCESS,,
88_00063,USER,What is departure and arrival stations?,REQUEST,,
88_00063,SYSTEM,The departure is Anaheim Intermodal Center and arrival is Union Station.,INFORM,,
88_00063,USER,Lets book the tickets now.,INFORM_INTENT,,
88_00063,SYSTEM,Confirm Confirm on March 6th Usc Vs Ucla for 3 in Los Angeles.,CONFIRM,,
88_00063,USER,"Good, what is the address?",REQUEST,AFFIRM,
88_00063,SYSTEM,You are confirmed and address is 3911 Figueroa Street.,INFORM,NOTIFY_SUCCESS,
88_00063,USER,Thank you for the help.,THANK_YOU,,
88_00063,SYSTEM,Is there anything else?,REQ_MORE,,
88_00063,USER,That is all I need.,NEGATE,THANK_YOU,
88_00063,SYSTEM,Thanks and enjoy your event.,GOODBYE,,
88_00064,USER,I'd like to find some dates to attend an event. Can you help me?,INFORM_INTENT,,
88_00064,SYSTEM,I'd be happy to help. Where are you attending the event?,REQUEST,,
88_00064,USER,"I'd like to find something in Seattle, WA.",INFORM,,
88_00064,SYSTEM,Are you interested in a particular event?,REQUEST,,
88_00064,USER,"Yes, I would like to see Sounders Vs Revolution.",INFORM,,
88_00064,SYSTEM,There are 2 options available. The first is Sounders Vs Revolution at CenturyLink Field on March 4th.,OFFER,,
88_00064,USER,What is the other option?,REQUEST_ALTS,,
88_00064,SYSTEM,The Sounders Vs Revolution will also be playing at CenturyLink Field on March 8th.,OFFER,,
88_00064,USER,Can you tell me when the game is scheduled to start?,REQUEST,,
88_00064,SYSTEM,"Yes, it will begin at 6:30 pm.",INFORM,,
88_00064,USER,That will work for me. I'd like to get a bus ticket for 8:30 am.,SELECT,,
88_00064,SYSTEM,When will you be departing and how many are in your party?,REQUEST,,
88_00064,USER,There are four of us and we will be departing from Vancouver.,INFORM,,
88_00064,SYSTEM,Are you planning to leave on March 8th?,REQUEST,,
88_00064,USER,"No, we will be leaving on the 1st.",INFORM,,
88_00064,SYSTEM,You'd like to purchase 4 tickets from Vancouver to Seattle on March 1st at 8:30 am. Is this correct?,CONFIRM,,
88_00064,USER,"Yes, that's correct. Can you tell me which station we will be arriving at if the trip has 1 transfer?",REQUEST,,AFFIRM
88_00064,SYSTEM,The bus has 0 transfers and will be arriving at King Street Station. Your tickets have been purchased and you will receive an email confirmation shortly.,INFORM,,NOTIFY_SUCCESS
88_00064,USER,"Okay, I'd like to purchase the tickets to the game now please.",INFORM_INTENT,,
88_00064,SYSTEM,You would like to purchase 4 tickets to see the Sounders vs Revolution on March 8th in Seattle. Is this correct?,CONFIRM,,
88_00064,USER,"Yes, that's right. Can you tell me what the address of the venue is?",REQUEST,AFFIRM,
88_00064,SYSTEM,"Yes, it is located at 800 Occidental Avenue South. The ticket purchase has been confirmed.",INFORM,NOTIFY_SUCCESS,
88_00064,USER,Thank you for your help.,THANK_YOU,,
88_00064,SYSTEM,Is there anything else I can do for you?,REQ_MORE,,
88_00064,USER,"No, that will be all. Thank you again.",NEGATE,THANK_YOU,
88_00064,SYSTEM,You're welcome. Have a wonderful trip.,GOODBYE,,
88_00065,USER,I need ti find some dates for events.,INFORM_INTENT,,
88_00065,SYSTEM,What kinda of event would you like to see?,REQUEST,,
88_00065,USER,I want to see the Rob Thomas concert.,INFORM,,
88_00065,SYSTEM,What city would you like to look in?,REQUEST,,
88_00065,USER,I want to see him in Portland.,INFORM,,
88_00065,SYSTEM,I have 4 dates. How about Rob Thomas in concert at the Theater Of The Clouds on March 3rd,OFFER,,
88_00065,USER,What is the address?,REQUEST,,
88_00065,SYSTEM,It located at 1016-1098 North Center Court Street.,INFORM,,
88_00065,USER,That sounds great.,SELECT,,
88_00065,SYSTEM,Would you like to purchase tickets?,OFFER_INTENT,,
88_00065,USER,Not right now.,NEGATE_INTENT,,
88_00065,SYSTEM,IS there anything else I can help with.,REQ_MORE,,
88_00065,USER,I need a bus to get there.,INFORM_INTENT,,
88_00065,SYSTEM,Would you like to leave on March 3rd? Where will you be parting from? Do you have a preferred time you would like to leave?,REQUEST,,
88_00065,USER,I need 3 tickts for the 1st of this month from Vancouver if at all possible around nine am.,INFORM,,
88_00065,SYSTEM,Just to confirm: You would like 3 bus tickets leaving on March 1st from Vancouver and going to Portland at 9 am.,CONFIRM,,
88_00065,USER,That's perfect. Is there more than 1 transfer?,REQUEST,AFFIRM,
88_00065,SYSTEM,It has 0 transfers. So I wasn't able to find 3 tickets at that time. Will 9:20 am work for you the price per ticket is $42.,INFORM,OFFER,
88_00065,USER,Yes that is fine.,AFFIRM,,
88_00065,SYSTEM,Your tickets are booked.,NOTIFY_SUCCESS,,
88_00065,USER,Thanks for your help.,THANK_YOU,,
88_00065,SYSTEM,Is there anything else I can do for you?,REQ_MORE,,
