dialogue_id,speaker,turn,act_1,act_2,act_3
121_00093,USER,Is there a contact number for them?,REQUEST,,
121_00093,SYSTEM,It is +1 559-268-1000,INFORM,,
121_00093,USER,Can I bring a pet? What is the address?,REQUEST,,
121_00093,SYSTEM,Pets are not allowed. It is located on 2233 ventura street.,INFORM,,
121_00093,USER,Is there anything else?,REQUEST_ALTS,,
121_00093,SYSTEM,There is la quinta inn by wyndham fresno yosemite and it has a rating of 3.7.,OFFER,,
121_00093,USER,That would be ideal. That is all for now.,SELECT,GOODBYE,
121_00093,SYSTEM,Enjoy your day.,GOODBYE,,
121_00094,USER,Can you please find a rental car for me?,INFORM_INTENT,,
121_00094,SYSTEM,"Sure, but first tell me your desired pick up location and the date until you need the car.",REQUEST,,
121_00094,USER,"I need the car in Anaheim, CA and I want it until the 9th of March.",INFORM,,
121_00094,SYSTEM,From when do you want it?,REQUEST,,
121_00094,USER,Please find me an intermediate car from the 7th of this month.,INFORM,,
121_00094,SYSTEM,At what time do you want to pick up the car?,REQUEST,,
121_00094,USER,"12 in the afternoon, please.",INFORM,,
121_00094,SYSTEM,There are 6 cars meeting your criteria. I'd recommend a nice standard class Chevrolet Cruze available for pick up at John Wayne Airport on March 7th.,OFFER,,
121_00094,USER,Anything else available?,REQUEST_ALTS,,
121_00094,SYSTEM,There also a nice standard class Ford Fusion available for pick up at John Wayne Airport on March 7th.,OFFER,,
121_00094,USER,Anything else available?,REQUEST_ALTS,,
121_00094,SYSTEM,There also a nice standard class Honda Accord available for pick up at John Wayne Airport on March 7th.,OFFER,,
121_00094,USER,Sounds perfect to me.,SELECT,,
121_00094,SYSTEM,Do you want me to place a reservation for you?,OFFER_INTENT,,
121_00094,USER,"Yes, please do.",AFFIRM_INTENT,,
121_00094,SYSTEM,"Can you please confirm that you want me to reserve a Standard car for you to be picked up from John Wayne Airport on March 7th at 12 pm, due for drop off on March 9th?",CONFIRM,,
121_00094,USER,"Yes, that's correct.",AFFIRM,,
121_00094,SYSTEM,I've successfully placed your reservation.,NOTIFY_SUCCESS,,
121_00094,USER,Can you also help me find a hotel there?,INFORM_INTENT,,
121_00094,SYSTEM,"Sure, how about Anaheim Desert Inn And Suites rated at 4.1.",OFFER,,
121_00094,USER,Sounds absolutely perfect.,SELECT,,
121_00094,SYSTEM,Do you want me to book a room there for you?,OFFER_INTENT,,
121_00094,USER,"No, not at the moment.",NEGATE_INTENT,,
121_00094,SYSTEM,Is there anything else I could do for you?,REQ_MORE,,
121_00094,USER,"No, thanks a lot.",NEGATE,THANK_YOU,
121_00094,SYSTEM,Have a nice day!,GOODBYE,,
121_00095,USER,I need a rental car please.,INFORM_INTENT,,
121_00095,SYSTEM,"No problem, Where would you prefer to pick up the car? Also, how long will you be needing the car.",REQUEST,,
121_00095,USER,"I can pick up in Anaheim, CA, I will also need the car until the 13th of this month.",INFORM,,
121_00095,SYSTEM,What time will you need to pick up?,REQUEST,,
121_00095,USER,Let's do next Wednesday at three pm.,INFORM,,
121_00095,SYSTEM,What date do you want it from?,REQUEST,,
121_00095,USER,Saturday this week please.,INFORM,,
121_00095,SYSTEM,"There is a Chevrolet Cruze, which is a Standard, available at John Wayne Airport on March 2nd.",OFFER,,
121_00095,USER,"Ok, let's go ahead and book it.",INFORM_INTENT,SELECT,
121_00095,SYSTEM,"Alright, just to confirm, Pick up a standard car at John Wayne Airport. Pick up on March 2nd at 3 pm and drop back off on March 6th. Is this correct?",CONFIRM,,
121_00095,USER,"Yes, that's right. I will also need the total rental cost please.",REQUEST,AFFIRM,
121_00095,SYSTEM,"Good news, I was able to reserve your car! Total reservation price is $124.",INFORM,NOTIFY_SUCCESS,
121_00095,USER,"Ok, I will also need to book 3 hotel rooms there as well.",THANK_YOU,,
121_00095,SYSTEM,"Ok, I show 10 hotels available. May I recommend Anaheim Desert Inn And Suites, I show a rating of 4.1",OFFER,,INFORM_COUNT
121_00095,USER,Thanks for the information. That will be all.,SELECT,GOODBYE,
121_00095,SYSTEM,"Ok, Have a great day.",GOODBYE,,
121_00096,USER,I need to rent a car please and I'd like a large automobile.,INFORM,INFORM_INTENT,
121_00096,SYSTEM,From when until when?,REQUEST,,
121_00096,USER,Starting Tuesday next week until Wednesday next week.,INFORM,,
121_00096,SYSTEM,What would you like the pickup location to be?,REQUEST,,
121_00096,USER,In Phoenix please.,INFORM,,
121_00096,SYSTEM,At what time?,REQUEST,,
121_00096,USER,At night 8.,INFORM,,
121_00096,SYSTEM,I have 3 possible vehicles for you. How about a full-size Hyundai Tucson? That's available March 5th and can be picked up from Sky Harbor International Airport.,OFFER,,
121_00096,USER,For how much?,REQUEST,,
121_00096,SYSTEM,It's a $42 total.,INFORM,,
121_00096,USER,I like that.,SELECT,,
121_00096,SYSTEM,Is there anything else you need?,REQ_MORE,,
121_00096,USER,I'd like to make a reservation for the car.,INFORM_INTENT,,
121_00096,SYSTEM,Certainly. Confirming a full-size rental for pickup on March 5th from Sky Harbor International Airport at 8 PM and returning on March 6th.,CONFIRM,,
121_00096,USER,"That will work, thank you.",AFFIRM,,
121_00096,SYSTEM,The vehicle has been reserved.,NOTIFY_SUCCESS,,
121_00096,USER,I would also like to find a hotel please.,INFORM_INTENT,,
121_00096,SYSTEM,Would you be interested in the Aloft Phoenix-Airport? It has a 4.2 rating.,OFFER,,
121_00096,USER,"Great choice, thank you.",SELECT,,
121_00096,SYSTEM,Would you like to reserve a room?,OFFER_INTENT,,
121_00096,USER,Not at the moment.,NEGATE_INTENT,,
121_00096,SYSTEM,Anything else today?,REQ_MORE,,
121_00096,USER,"No, I'm good.",NEGATE,THANK_YOU,
121_00096,SYSTEM,Thank you very much.,GOODBYE,,
121_00097,USER,Can you find me a rental car?,INFORM_INTENT,,
121_00097,SYSTEM,Sure. Picking it up where and when? When will you want to return it?,REQUEST,,
121_00097,USER,I'll pick up the car in Sacramento at eleven am and need to keep it until the 6th,INFORM,,
121_00097,SYSTEM,"Ok, and what day do you want to pick it up?",REQUEST,,
121_00097,USER,I'll get it Tuesday next week,INFORM,,
121_00097,SYSTEM,"I found 2 cars for you: There's a standard car, a Toyota Camry, available from Sacramento Valley Station on March 5th",OFFER,,
121_00097,USER,How much will that cost?,REQUEST,,
121_00097,SYSTEM,The rental will be $29,INFORM,,
121_00097,USER,Anything else? Make it a small car from Paris France instead,INFORM,,REQUEST_ALTS
121_00097,SYSTEM,"There's a compact car, a Chevrolet Bolt, available at Charles de Gaulle International Airport on March 5th",OFFER,,
121_00097,USER,"Ok, book that one please:",INFORM_INTENT,SELECT,
121_00097,SYSTEM,Please confirm: reserving a compact car from Charles de Gaulle International Airport on March 5th at 11 am. You'll return it on March 6th.,CONFIRM,,
121_00097,USER,Yes I like that. How much is that?,REQUEST,AFFIRM,
121_00097,SYSTEM,I've reserved your car. The rental will cost $29,INFORM,NOTIFY_SUCCESS,
121_00097,USER,And can you find me a hotel there?,INFORM_INTENT,,
121_00097,SYSTEM,"Ac Hotel By Marriott Paris Porte Maillot looks nice, with a 4.3 rating",OFFER,,
121_00097,USER,Sure that looks good,SELECT,,
121_00097,SYSTEM,Would you like to book a room,OFFER_INTENT,,
121_00097,USER,Not right now. Thanks,NEGATE_INTENT,GOODBYE,
121_00097,SYSTEM,Take care?,GOODBYE,,
121_00098,USER,"I'm going on a road trip, so I want to find a rental car.",INFORM_INTENT,,
121_00098,SYSTEM,On what dates will you want it?,REQUEST,,
121_00098,USER,From Thursday next week until the 9th.,INFORM,,
121_00098,SYSTEM,What time of day will you collect it?,REQUEST,,
121_00098,USER,I'll get it at 7:30 in the evening.,INFORM,,
121_00098,SYSTEM,Where will you pick it up?,REQUEST,,
121_00098,USER,"I made a mistake, I'll return the car on the 8th of this month. I'll pick it up in Philly.",INFORM,,
121_00098,SYSTEM,"I've found 4 cars you may like. You could get a Standard model Hyundai Elantra, available to be collected on March 7th from Intercity Terminal.",OFFER,,
121_00098,USER,What's the price?,REQUEST,,
121_00098,SYSTEM,The price is $35 in total.,INFORM,,
121_00098,USER,What else is there to choose?,REQUEST_ALTS,,
121_00098,SYSTEM,"An alternative Standard model car would be a Nissan Altima, also available at Intercity Terminal on March 7th.",OFFER,,
121_00098,USER,And the price of that one is?,REQUEST,,
121_00098,SYSTEM,It'll cost $29.,INFORM,,
121_00098,USER,"I prefer that one, please go ahead and reserve it.",INFORM_INTENT,SELECT,
121_00098,SYSTEM,"So to recap, I'll book a Standard car for you to pick up at Intercity Terminal at 7:30 pm on March 7th, and you'll return it on March 8th. Correct?",CONFIRM,,
121_00098,USER,"Yes, go ahead.",AFFIRM,,
121_00098,SYSTEM,The car has been reserved.,NOTIFY_SUCCESS,,
121_00098,USER,"Thanks, now I need to find a hotel to stay in while I'm there.",THANK_YOU,,
121_00098,SYSTEM,Aka University City is a 4.6 rated hotel.,OFFER,,
121_00098,USER,What else is available?,REQUEST_ALTS,,
121_00098,SYSTEM,Aloft Philadelphia Airport is a 4.0 rated hotel.,OFFER,,
121_00098,USER,Are pets allowed? What's the phone number?,REQUEST,,
121_00098,SYSTEM,Pets are welcome. The phone number is +1 267-298-1700.,INFORM,,
121_00098,USER,"Keep searching, please.",REQUEST_ALTS,,
121_00098,SYSTEM,"How about Aloft Philadelphia Downtown, a 4.4 rated hotel.",OFFER,,
121_00098,USER,"Okay, that's sound about right. I'll leave it at that for now, thanks.",SELECT,GOODBYE,
121_00098,SYSTEM,Have a good day!,GOODBYE,,
121_00099,USER,I need a car for rent.,INFORM_INTENT,,
121_00099,SYSTEM,Where will you pick it up and when will you be needing it?,REQUEST,,
121_00099,USER,"I want a car on March 5th in Anaheim, CA.",INFORM,,
121_00099,SYSTEM,What date will you want the car until?,REQUEST,,
121_00099,USER,I will use the car till 8th of this month.,INFORM,,
121_00099,SYSTEM,What is the time of your pick up?,REQUEST,,
121_00099,USER,I will have it at 10 in the morning.,INFORM,,
121_00099,SYSTEM,I have a nice Standard Hyundai Elantra which will be waiting for pick up at Anaheim Intermodal Center on March 5th.,OFFER,,
121_00099,USER,How much is the cost overall?,REQUEST,,
121_00099,SYSTEM,It will be $93 for the reservation.,INFORM,,
121_00099,USER,Ok fine. Book me this car.,INFORM_INTENT,SELECT,
121_00099,SYSTEM,So you would like a Standard car on March 5th at 10 am in Anaheim Intermodal Center. You will be dropping it off on March 8th. Is that right?,CONFIRM,,
121_00099,USER,Yeah that is very well.,AFFIRM,,
121_00099,SYSTEM,I have booked your car.,NOTIFY_SUCCESS,,
121_00099,USER,Thank you very much. I want a hotel room to stay. Just 1 room is fine for booking.,THANK_YOU,,
121_00099,SYSTEM,Shall I go with Anaheim Desert Inn and Suites with a rating of 4.1?,OFFER,,
121_00099,USER,What is the location of this place?,REQUEST,,
121_00099,SYSTEM,The location will be 1600 South Harbor Boulevard.,INFORM,,
121_00099,USER,Works very well with me.,SELECT,,
121_00099,SYSTEM,Shall I reserve this hotel for you?,OFFER_INTENT,,
121_00099,USER,Not really. I don't want to book it now.,NEGATE_INTENT,,
121_00099,SYSTEM,Can I do anything else for you?,REQ_MORE,,
121_00099,USER,Nope. That will do. Thanks!,NEGATE,THANK_YOU,
121_00099,SYSTEM,I wish you a wonderful day!,GOODBYE,,
121_00100,USER,Will you find a rental car with pick up at nine in the morning?,INFORM,INFORM_INTENT,
121_00100,SYSTEM,When?,REQUEST,,
121_00100,USER,the 11th.,INFORM,,
121_00100,SYSTEM,'Til when?,REQUEST,,
121_00100,USER,'Til March 14th.,INFORM,,
121_00100,SYSTEM,Pick up where?,REQUEST,,
121_00100,USER,"London, UK.",INFORM,,
121_00100,SYSTEM,"I found a Standard car, Chevrolet Cruze, at Heathrow International Airport with pick up on March 11th.",OFFER,,
121_00100,USER,Great.,SELECT,,
121_00100,SYSTEM,Reserve it?,OFFER_INTENT,,
121_00100,USER,Yes.,AFFIRM_INTENT,,
121_00100,SYSTEM,Please confirm a Standard car at Heathrow International Airport with pick up date of March 11th at 9 am and drop-off on March 14th.,CONFIRM,,
121_00100,USER,That's fine. Total cost?,REQUEST,AFFIRM,
121_00100,SYSTEM,$105. Your reservation is complete.,INFORM,NOTIFY_SUCCESS,
121_00100,USER,Thanks.,THANK_YOU,,
121_00100,SYSTEM,Anything else?,REQ_MORE,,
121_00100,USER,Will you find a hotel there?,INFORM_INTENT,,
121_00100,SYSTEM,I found 10. 45 Park Lane is a 4.7 star hotel.,OFFER,,INFORM_COUNT
121_00100,USER,Anything with 2 rooms?,INFORM,REQUEST_ALTS,
121_00100,SYSTEM,Abc Hyde Park Hotel is a 3.2 star hotel.,OFFER,,
121_00100,USER,Anything else?,REQUEST_ALTS,,
121_00100,SYSTEM,Abercorn House is a 3.5 star hotel.,OFFER,,
121_00100,USER,Address? Pet-friendly?,REQUEST,,
121_00100,SYSTEM,28-30 Bute Gardens. No pets allowed.,INFORM,,
121_00100,USER,Great. That's all.,SELECT,GOODBYE,
121_00100,SYSTEM,Have a nice day.,GOODBYE,,
121_00101,USER,Can you help me find a rental car?,INFORM_INTENT,,
121_00101,SYSTEM,When do you need it from?,REQUEST,,
121_00101,USER,I want the car from wednesday next week from 5:15 in the evening,INFORM,,
121_00101,SYSTEM,What is the preferred pickup location and duration?,REQUEST,,
121_00101,USER,I want a car in LA till 11th of this month,INFORM,,
121_00101,SYSTEM,I have found 5 cars that match your requirements. How about a standard ford fusion available at LAX international airport on march 6th?,OFFER,,
121_00101,USER,A full-size car would be better. I can pick it up from half past 3 in the afternoon as well.,INFORM,,REQUEST_ALTS
121_00101,SYSTEM,There is a chevrolet equinox available in full-size from LAX international airport on march 6th.,OFFER,,
121_00101,USER,What would it cost?,REQUEST,,
121_00101,SYSTEM,The total cost would be $235,INFORM,,
121_00101,USER,That works for me,SELECT,,
121_00101,SYSTEM,Should I book the car?,OFFER_INTENT,,
121_00101,USER,"Yes, proceed with the booking",AFFIRM_INTENT,,
121_00101,SYSTEM,Booking a full-size car from LAX international airport from 3:30 pm on march 6th till march 11th,CONFIRM,,
121_00101,USER,Sounds perfect to me,AFFIRM,,
121_00101,SYSTEM,Booking is successful,NOTIFY_SUCCESS,,
121_00101,USER,I also want to search for a hotel there,INFORM_INTENT,,
121_00101,SYSTEM,I found 10 hotels for you. How about ac hotel by marriott beverly hills with a 4.4 rating?,OFFER,,INFORM_COUNT
121_00101,USER,Is it per friendly? What is the address?,REQUEST,,
121_00101,SYSTEM,It isn't pet friendly. The address is 6399 wilshire boulevard,INFORM,,
121_00101,USER,That would do.,SELECT,,
121_00101,SYSTEM,Should I make the booking?,OFFER_INTENT,,
121_00101,USER,"No, I would do that later.",NEGATE_INTENT,,
121_00101,SYSTEM,Is there anything else I can help with?,REQ_MORE,,
121_00101,USER,"No, that would be all.",NEGATE,THANK_YOU,
121_00101,SYSTEM,Have a nice trip!,GOODBYE,,
121_00102,USER,"Hi, could you help me search for a rental car please?",INFORM_INTENT,,
121_00102,SYSTEM,What is your preferred time and location of pick up?,REQUEST,,
121_00102,USER,I will be needing the car at Chi-town from two in the afternoon.,INFORM,,
121_00102,SYSTEM,When do you need the car till?,REQUEST,,
121_00102,USER,I will be using the car till 13th of March!,INFORM,,
121_00102,SYSTEM,How about when will you need the car from?,REQUEST,,
121_00102,USER,I will be using the car from the 9th.,INFORM,,
121_00102,SYSTEM,"Sure, there are 5 cars which might suit your preference, one of which is a Standard Ford Fusion available for pick up at Chicago Union Station on March 9th.",OFFER,,
121_00102,USER,That sounds great! Could you proceed to help me make a reservation?,INFORM_INTENT,SELECT,
121_00102,SYSTEM,"Sure, please confirm your reservation for 1 standard car for pickup at Chicago Union Station from March 9th at 2 pm to March 13th.",CONFIRM,,
121_00102,USER,That sounds great!,AFFIRM,,
121_00102,SYSTEM,Your reservation has been made.,NOTIFY_SUCCESS,,
121_00102,USER,"Sure, could you also help me search for a hotel there?",THANK_YOU,,
121_00102,SYSTEM,"There are 10 hotels in that area, one of which is Ac Hotel By Marriott Chicago Downtown with a 4.3 rating.",OFFER,,INFORM_COUNT
121_00102,USER,May I have their street address and contact number please?,REQUEST,,
121_00102,SYSTEM,You can call them at +1 312-981-6600 and visit them at 630 North Rush Street.,INFORM,,
121_00102,USER,"Sure, that is all the help I need.",SELECT,GOODBYE,
121_00102,SYSTEM,Have a safe trip!,GOODBYE,,
121_00103,USER,I will be needing a rental car on Friday next week at 18:00 and will need it until the 13th of March.,INFORM,,
121_00103,SYSTEM,Where would you like to pick up the car?,REQUEST,,
121_00103,USER,I would like to pick up a intermediate car in NY.,INFORM,,
121_00103,SYSTEM,There is a Standard Honda Accord that is available to pick up on March 8th at Grand Central Station.,OFFER,,
121_00103,USER,Can you tell me how much it would be?,REQUEST,,
121_00103,SYSTEM,"Yes, the total would be $180",INFORM,,
121_00103,USER,Can you check and see if there is a car available in Sacramento at 12:30 pm?,INFORM,,REQUEST_ALTS
121_00103,SYSTEM,"Yes, I have 2 cars, one of which is a Standard Toyota Corolla available for pick up on March 8th at Sacramento Valley Station.",OFFER,,
121_00103,USER,Can you tell me the total cost on that one?,REQUEST,,
121_00103,SYSTEM,"Yes, the total would be $135.",INFORM,,
121_00103,USER,"Ok, I would like to reserve that one please.",INFORM_INTENT,SELECT,
121_00103,SYSTEM,Please confirm you are picking up a Standard car at Sacramento Valley Station on March 8th at 12:30 pm and dropping off on March 13th.,CONFIRM,,
121_00103,USER,"Yes, that sounds perfect!",AFFIRM,,
121_00103,SYSTEM,I have reserved your car,NOTIFY_SUCCESS,,
121_00103,USER,Please search for hotels there also.,INFORM_INTENT,,
121_00103,SYSTEM,There are 10 hotels. There is one with a 4.3 rating called Best Western Plus Sutter House.,OFFER,,INFORM_COUNT
121_00103,USER,Can you give me the phone number please?,REQUEST,,
121_00103,SYSTEM,"Yes, the phone number is +1 916-441-1314.",INFORM,,
121_00103,USER,Is there anything else by chance?,REQUEST_ALTS,,
121_00103,SYSTEM,There is the Courtyard By Marriott Sacramento Midtown with a rating of 4.1.,OFFER,,
121_00103,USER,Can you give me the phone number and let me know if they allow pets?,REQUEST,,
121_00103,SYSTEM,The phone number is +1 916-455-6800. Unfortunately they do not allow pets.,INFORM,,
121_00103,USER,That one will be perfect.,SELECT,,
121_00103,SYSTEM,Would you like to reserve the hotel now?,OFFER_INTENT,,
121_00103,USER,"No thank you, that will be all I need for now.",NEGATE_INTENT,GOODBYE,
121_00103,SYSTEM,Have a great day then!,GOODBYE,,
121_00104,USER,I need to rent a car please.,INFORM_INTENT,,
121_00104,SYSTEM,When you need a car and for how long?,REQUEST,,
121_00104,USER,I'm going to need it until March 5th and I'd like to pick it up at 1:30 PM.,INFORM,,
121_00104,SYSTEM,Beginning when please?,REQUEST,,
121_00104,USER,I'll need it starting on the 2nd.,INFORM,,
121_00104,SYSTEM,What would you like the pickup location to be?,REQUEST,,
121_00104,USER,"Anaheim, CA please.",INFORM,,
121_00104,SYSTEM,I have 6 options for you. There is a standard Chevrolet Cruze available at John Wayne Airport for a March 2nd pick up.,OFFER,,
121_00104,USER,What else is available?,REQUEST_ALTS,,
121_00104,SYSTEM,I also have a standard Ford Fusion at John Wayne Airport on March 2nd.,OFFER,,
121_00104,USER,What will that cost?,REQUEST,,
121_00104,SYSTEM,The total will be $111.,INFORM,,
121_00104,USER,What else do you have? I don't care what type but I need it on the 1st of this month .,INFORM,,REQUEST_ALTS
121_00104,SYSTEM,There is a compact Chevrolet Bolt available on March 1st at John Wayne Airport.,OFFER,,
121_00104,USER,How much does that one run?,REQUEST,,
121_00104,SYSTEM,The total for that would be $100.,INFORM,,
121_00104,USER,I like that one.,SELECT,,
121_00104,SYSTEM,Shall I reserve that for you?,OFFER_INTENT,,
121_00104,USER,"Yes, please do.",AFFIRM_INTENT,,
121_00104,SYSTEM,Confirming a compact car pick up from John Wayne Airport on March 1st at 1:30 PM and returning March 5th.,CONFIRM,,
121_00104,USER,That all sounds correct.,AFFIRM,,
121_00104,SYSTEM,The reservation was successful.,NOTIFY_SUCCESS,,
121_00104,USER,"Great, thank you. I also need to find a hotel please.",THANK_YOU,,
121_00104,SYSTEM,"Certainly. How about Anaheim Desert Inn And Suites, which is rated 4.1?",OFFER,,
121_00104,USER,I love it.,SELECT,,
121_00104,SYSTEM,Shall I make a reservation for you?,OFFER_INTENT,,
121_00104,USER,"Not right now, thank you.",NEGATE_INTENT,,
121_00104,SYSTEM,May I help you with anything else?,REQ_MORE,,
121_00104,USER,"No, I'm all set.",NEGATE,THANK_YOU,
121_00104,SYSTEM,Thank you very much.,GOODBYE,,
121_00105,USER,I am looking for a rental car till the 10th.,INFORM,INFORM_INTENT,
121_00105,SYSTEM,What time do you need it and on what date? Where will you pick it up from?,REQUEST,,
121_00105,USER,"I need the car on 7th of March at six in the evening. I will pick it up from London, England.",INFORM,,
121_00105,SYSTEM,There is a nice Standard Chevrolet Cruze available for you to pick up on March 7th. This car would be picked up at Heathrow International Airport. How does this sound?,OFFER,,
121_00105,USER,What is the cost in total?,REQUEST,,
121_00105,SYSTEM,It is $90 in total.,INFORM,,
121_00105,USER,That sounds great.,SELECT,,
121_00105,SYSTEM,Would you like to make your reservation?,OFFER_INTENT,,
121_00105,USER,"Yes, please book the car rental.",AFFIRM_INTENT,,
121_00105,SYSTEM,"Okay, please confirm that you will pick up the Standard car from Heathrow International Airport on March 7th at 6 pm. The car will be dropped off at March 10th.",CONFIRM,,
121_00105,USER,That sounds wonderful.,AFFIRM,,
121_00105,SYSTEM,The car was reserved.,NOTIFY_SUCCESS,,
121_00105,USER,I would like to find a hotel there.,INFORM_INTENT,,
121_00105,SYSTEM,I have 10 hotels. What about 45 Park Lane? The rating is 4.7.,OFFER,,INFORM_COUNT
121_00105,USER,That sounds good.,SELECT,,
121_00105,SYSTEM,Would you like to continue with this reservation?,OFFER_INTENT,,
121_00105,USER,"No, not now. That is all I need.",NEGATE_INTENT,GOODBYE,
121_00105,SYSTEM,Have a good one.,GOODBYE,,
121_00106,USER,I need a rental car.,INFORM_INTENT,,
121_00106,SYSTEM,When would you like the rental car from and at what time do you need it?,REQUEST,,
121_00106,USER,I need the car on March 11th and will pick it up at 4:30 in the evening.,INFORM,,
121_00106,SYSTEM,Where will you pick it up from?,REQUEST,,
121_00106,USER,I want to pick it up in San Diego.,INFORM,,
121_00106,SYSTEM,Until what date do you want the car?,REQUEST,,
121_00106,USER,I need the car till the 14th. Any kind of car is fine.,INFORM,,
121_00106,SYSTEM,There is a good compact car available at Santa Fe Depot to be picked up on March 11th. What about a Chevrolet Bolt?,OFFER,,
121_00106,USER,That sounds nice. I would like to book the car.,INFORM_INTENT,SELECT,
121_00106,SYSTEM,"Okay, so you want to book the car and pick it up from Santa Fe Depot on March 11th at 4:30 pm. You will drop it off on March 14th. It's a compact car, right?",CONFIRM,,
121_00106,USER,"Yes, perfect. How much will it cost?",REQUEST,AFFIRM,
121_00106,SYSTEM,Your car was reserved. It will cost $63 in total.,INFORM,NOTIFY_SUCCESS,
121_00106,USER,Find a hotel for me there.,INFORM_INTENT,,
121_00106,SYSTEM,How about Bahia Resort HOtel? It is rated 4.3.,OFFER,,
121_00106,USER,That sounds good.,SELECT,,
121_00106,SYSTEM,Would you like to continue to hotel reservation?,OFFER_INTENT,,
121_00106,USER,"No, I don't and that is all I need.",NEGATE_INTENT,GOODBYE,
121_00106,SYSTEM,Have a good one.,GOODBYE,,
121_00107,USER,I need a car to rent,INFORM_INTENT,,
121_00107,SYSTEM,In which city?,REQUEST,,
121_00107,USER,"I need in Toronto, Canada",INFORM,,
121_00107,SYSTEM,Until what day do you need it?,REQUEST,,
121_00107,USER,Till 5th of March,INFORM,,
121_00107,SYSTEM,Which day do you want to pic it up? At what time?,REQUEST,,
121_00107,USER,On this Sunday at evening 4:30. I'd like a Standard car.,INFORM,,
121_00107,SYSTEM,"There's a Standard car, a Chevrolet Cruze, at Toronto Pearson International Airport on March 3rd",OFFER,,
121_00107,USER,How much does it cost?,REQUEST,,
121_00107,SYSTEM,It costs $68 in total,INFORM,,
121_00107,USER,Are there any other models available?,REQUEST_ALTS,,
121_00107,SYSTEM,"There's a Standard car, a Toyota Camry, at Toronto Pearson International Airport on March 3rd",OFFER,,
121_00107,USER,"Yes, I like it! I want this car.",INFORM_INTENT,SELECT,
121_00107,SYSTEM,a Standard car from Toronto Pearson International Airport on March 3rd at 4:30 pm till March 5th. Is it correct?,CONFIRM,,
121_00107,USER,"Yes, It's correct!",AFFIRM,,
121_00107,SYSTEM,Your car is booked!,NOTIFY_SUCCESS,,
121_00107,USER,How much does it cost?,REQUEST,,
121_00107,SYSTEM,It costs $62 in total,INFORM,,
121_00107,USER,Thanks. I need a hotel there,THANK_YOU,,
121_00107,SYSTEM,There's Best Western Plus Toronto North York Hotel & Suites with rating 3.9,OFFER,,
121_00107,USER,Are there other hotels in the area?,REQUEST_ALTS,,
121_00107,SYSTEM,I found Best Western Premier Toronto Airport Carlingview Hotel with rating 4.0,OFFER,,
121_00107,USER,Ok! It's fine for me! Thanks!,SELECT,GOODBYE,
121_00107,SYSTEM,Have a nice day!,GOODBYE,,
121_00108,USER,Can you find a rental car in ATL on 5th of March?,INFORM,,INFORM_INTENT
121_00108,SYSTEM,What is the date you want the car on?,REQUEST,,
121_00108,USER,I will pick up the car on March 1st.,INFORM,,
121_00108,SYSTEM,What is the time you want the car on?,REQUEST,,
121_00108,USER,I want the car at 4:30 pm.,INFORM,,
121_00108,SYSTEM,There are 4 cars that might interest you. There is standard Chevrolet Cruze car for pick up at Hartsfield-Jackson International Airport on March 1st.,OFFER,,
121_00108,USER,Okay. That sounds good to me. Please reserve the car for me.,INFORM_INTENT,SELECT,
