dialogue_id,speaker,turn,act_1,act_2,act_3
117_00026,SYSTEM,"I found 9. In Napa, I have Allegria.",OFFER,,INFORM_COUNT
117_00026,USER,Is there anything else?,REQUEST_ALTS,,
117_00026,SYSTEM,"In Napa, I have Bistro Don Giovanni.",OFFER,,
117_00026,USER,What is price range and do they have liquor?,REQUEST,,
117_00026,SYSTEM,They are expensive and do not have liquor.,INFORM,,
117_00026,USER,"I accept, make it for 13:30.",INFORM,INFORM_INTENT,SELECT
117_00026,SYSTEM,Confirm March 1st for 3 at 1:30 pm in Napa for Bistro Don Giovanni.,CONFIRM,,
117_00026,USER,Yes I accept all.,AFFIRM,,
117_00026,SYSTEM,Reservation unavailable at that time.,NOTIFY_FAILURE,REQ_MORE,
117_00026,USER,How about making for 11:30?,INFORM,INFORM_INTENT,
117_00026,SYSTEM,Confirm March 1st for 3 at 11:30 am in Napa for Bistro Don Giovanni.,CONFIRM,,
117_00026,USER,I accept that time.,AFFIRM,,
117_00026,SYSTEM,You are confirmed now.,NOTIFY_SUCCESS,,
117_00026,USER,Thanks for the help.,THANK_YOU,,
117_00026,SYSTEM,Is there anything else?,REQ_MORE,,
117_00026,USER,That is all today.,NEGATE,THANK_YOU,
117_00026,SYSTEM,Have a great time.,GOODBYE,,
117_00027,USER,I'm looking for an event to go to.,INFORM_INTENT,,
117_00027,SYSTEM,What city do you want to go to? When do you want to go and how many tickets would you like?,REQUEST,,
117_00027,USER,"Something in SF on the 4th, just one ticket.",INFORM,,
117_00027,SYSTEM,What kinds of events are you looking for?,REQUEST,,
117_00027,USER,I heard the Giants vs Nationals are playing on March 3rd. I'd like to go to that one.,INFORM,,
117_00027,SYSTEM,To verify: You want 1 ticket to the Giants vs Nationals game on March 3rd in San Francisco.,CONFIRM,,
117_00027,USER,That's right. Where is the game going to be and what time does it start?,REQUEST,,AFFIRM
117_00027,SYSTEM,It starts at 6 pm at Oracle Park. Your ticket is confirmed.,INFORM,,NOTIFY_SUCCESS
117_00027,USER,I'd also like to find a restaurant there.,INFORM_INTENT,,
117_00027,SYSTEM,Is there a particular type of food you're looking for?,REQUEST,,
117_00027,USER,I'd love to find some Izakaya food.,INFORM,,
117_00027,SYSTEM,I found 10 possibilities. 2g Japanese Brasserie in San Francisco looks good.,OFFER,,INFORM_COUNT
117_00027,USER,What is another choice?,REQUEST_ALTS,,
117_00027,SYSTEM,"Ace Wasabi Rock-n-Roll Sushi looks good, also in San Francisco.",OFFER,,
117_00027,USER,That sounds good. Please make a reservation for quarter past 1 in the afternoon.,INFORM,INFORM_INTENT,SELECT
117_00027,SYSTEM,To confirm: you would like a reservation for 1 at Ace Wasabi Rock-n-Roll Sushi in San Francisco at 1:15 pm on March 3rd.,CONFIRM,,
117_00027,USER,Yes. What is there phone number?,REQUEST,AFFIRM,
117_00027,SYSTEM,There number is 415-567-4903. Your reservation has been made.,INFORM,NOTIFY_SUCCESS,
117_00027,USER,Perfect. Thank you.,THANK_YOU,,
117_00027,SYSTEM,Is there anything else I can help you with?,REQ_MORE,,
117_00027,USER,"No, that will do it. Thanks.",NEGATE,THANK_YOU,
117_00027,SYSTEM,Have a great day.,GOODBYE,,
117_00028,USER,I want to buy two tickets for an upcoming event.,INFORM,INFORM_INTENT,
117_00028,SYSTEM,What event do you want to see? Which city is it in and what day are you thinking of?,REQUEST,,
117_00028,USER,I am looking for a game in SFO. I want to watch the Giants vs Brewers next Friday.,INFORM,,
117_00028,SYSTEM,"Please confirm the following: 2 tickets for the Giants vs Brewers, March 8th in San Francisco.",CONFIRM,,
117_00028,USER,"No, I want to see the game on March 9th. And make it 1 ticket.",INFORM,,NEGATE
117_00028,SYSTEM,Please confirm the following details: 1 ticket for the game on March 9th.,CONFIRM,,
117_00028,USER,I have changed my mind. How about something in Napa. Roy Ayers is good from what I've heard.,INFORM,,NEGATE
117_00028,SYSTEM,Please confirm the booking details: A ticket for Roy Ayers in Napa.,CONFIRM,,
117_00028,USER,"Yes, that's great! Where is the venue and when does it start?",REQUEST,,AFFIRM
117_00028,SYSTEM,Your reservation has been made. It starts at 5 pm and is located 1030 Main Street.,INFORM,,NOTIFY_SUCCESS
117_00028,USER,I also want to eat at a restaurant.,INFORM_INTENT,,
117_00028,SYSTEM,"What kind of food do you like? You can say Mexican, Italian, or anything you want.",REQUEST,,
117_00028,USER,Pizza and Pasta is what I like.,INFORM,,
117_00028,SYSTEM,Allegria is a good restaurant in Napa.,OFFER,,
117_00028,USER,What is the number and do they have live music?,REQUEST,,
117_00028,SYSTEM,The number is 707-254-8006 and there is no live music.,INFORM,,
117_00028,USER,"Okay, that works.",SELECT,,
117_00028,SYSTEM,Would you like to make a reservation?,OFFER_INTENT,,
117_00028,USER,Yes I do.,AFFIRM_INTENT,,
117_00028,SYSTEM,For what time?,REQUEST,,
117_00028,USER,I want for the afternoon 12:45.,INFORM,,
117_00028,SYSTEM,"Please confirm the booking details: Booking a table for 1 at Allegria in Napa, at 12:45 pm on March 9th.",CONFIRM,,
117_00028,USER,"Yes, that's perfect.",AFFIRM,,
117_00028,SYSTEM,"Sorry the reservation did not go through. Should I try a reservation for 1 at Allegria, March 9th at 1 pm.",OFFER,,
117_00028,USER,No thanks.,NEGATE,,
117_00028,SYSTEM,Can I assist you further?,REQ_MORE,,
117_00028,USER,"No, I'm good.",NEGATE,THANK_YOU,
117_00028,SYSTEM,Have a wonderful day!,GOODBYE,,
117_00029,USER,Will you buy tickets to an event?,INFORM_INTENT,,
117_00029,SYSTEM,Which event and city?,REQUEST,,
117_00029,USER,Two tickets for Giants Vs Cardinals in SF.,INFORM,,
117_00029,SYSTEM,Which date?,REQUEST,,
117_00029,USER,the 11th.,INFORM,,
117_00029,SYSTEM,Please confirm 2 tickets for Giants Vs Cardinals in San Francisco on March 11th.,CONFIRM,,
117_00029,USER,That's fine.,AFFIRM,,
117_00029,SYSTEM,I've completed your reservation. Enjoy!,NOTIFY_SUCCESS,,
117_00029,USER,Where is it? What's the start time?,REQUEST,,
117_00029,SYSTEM,Oracle Park at 7:30 pm.,INFORM,,
117_00029,USER,Thanks. Will you find a restaurant there?,THANK_YOU,,
117_00029,SYSTEM,"What kind of food? American, Italian or something else?",REQUEST,,
117_00029,USER,Not very costly Fish.,INFORM,,
117_00029,SYSTEM,Alamo Square Seafood Grill in San Francisco.,OFFER,,
117_00029,USER,That's great.,SELECT,,
117_00029,SYSTEM,You want to reserve a table?,OFFER_INTENT,,
117_00029,USER,"Yes, afternoon 12:30.",AFFIRM_INTENT,INFORM,
117_00029,SYSTEM,Please confirm table for 2 at Alamo Square Seafood Grill in San Francisco at 12:30 pm on March 11th.,CONFIRM,,
117_00029,USER,Great.,AFFIRM,,
117_00029,SYSTEM,I've completed your reservation.,NOTIFY_SUCCESS,,
117_00029,USER,What's their number?,REQUEST,,
117_00029,SYSTEM,415-440-2828.,INFORM,,
117_00029,USER,Thanks. That's all.,THANK_YOU,GOODBYE,
117_00029,SYSTEM,Have a wonderful day.,GOODBYE,,
117_00030,USER,I would like four tickets to an event. I heard that Raiders vs Titans is good.,INFORM,,INFORM_INTENT
117_00030,SYSTEM,Is there a date preference?,REQUEST,,
117_00030,USER,I would prefer the 4th of this month.,INFORM,,
117_00030,SYSTEM,Which city please.,REQUEST,,
117_00030,USER,I would like it in Oakland.,INFORM,,
117_00030,SYSTEM,"OK, confirming 4 tickets on March 4th for Raiders vs Titans in Oakland.",CONFIRM,,
117_00030,USER,Great. Where is it located?,REQUEST,AFFIRM,
117_00030,SYSTEM,The reservation is completed. The address is 7000 Coliseum Way.,INFORM,NOTIFY_SUCCESS,
117_00030,USER,Where is it and when does it start?,REQUEST,,
117_00030,SYSTEM,The event is at Oakland-Alameda County Coliseum at 5:30 pm.,INFORM,,
117_00030,USER,Great. I need a restaurant too. I like Pho.,THANK_YOU,,
117_00030,SYSTEM,I found 5 places located in Oakland. One nice one is Binh Minh Quan.,OFFER,,INFORM_COUNT
117_00030,USER,Do they have live music and what is the phone number?,REQUEST,,
117_00030,SYSTEM,They do not offer live music. The number is 510-893-8136.,INFORM,,
117_00030,USER,That is great.,SELECT,,
117_00030,SYSTEM,Would you like a reservation?,OFFER_INTENT,,
117_00030,USER,"Yes, please for half past 1 in the afternoon.",AFFIRM_INTENT,INFORM,
117_00030,SYSTEM,"OK, confirming a table at Binh Minh Quan in Oakland for 4 people at 1:30 pm on March 4th.",CONFIRM,,
117_00030,USER,Great. Do they serve liquor and what is the address?,REQUEST,,AFFIRM
117_00030,SYSTEM,The reservation have been completed. They do not serve alcohol. The address is 338 12th Street.,INFORM,,NOTIFY_SUCCESS
117_00030,USER,Thanks a lot.,THANK_YOU,,
117_00030,SYSTEM,Can I assist you with anything else?,REQ_MORE,,
117_00030,USER,"No, all is good.",NEGATE,THANK_YOU,
117_00030,SYSTEM,Have a nice day.,GOODBYE,,
117_00031,USER,I am hoping to get 3 tickets for an activity in SF.,INFORM,,INFORM_INTENT
117_00031,SYSTEM,Which date would you like me to check?,REQUEST,,
117_00031,USER,Preferably on the 10th of this month.,INFORM,,
117_00031,SYSTEM,What type of event do you like?,REQUEST,,
117_00031,USER,I was told the Giants Vs Nationals is pretty good to watch.,INFORM,,
117_00031,SYSTEM,To confirm then you want 3 tickets for Giants Vs Nationals on March 10th in San Francisco.,CONFIRM,,
117_00031,USER,That sounds perfect.,AFFIRM,,
117_00031,SYSTEM,"That is your booking complete, I hope you have a great time.",NOTIFY_SUCCESS,,
117_00031,USER,Thanks for that. Could you help me find an intermediate priced restaurant there too?,THANK_YOU,,
117_00031,SYSTEM,What type of food do you fancy?,REQUEST,,
117_00031,USER,I love Latin American food.,INFORM,,
117_00031,SYSTEM,"There are 6 restaurants you may like, one is Barvale located in San Francisco.",OFFER,,INFORM_COUNT
117_00031,USER,Sounds good. Can you reserve a table for me at half past 11 in the morning.,INFORM,INFORM_INTENT,SELECT
117_00031,SYSTEM,To confirm then you want a table for 3 people at Barvale restaurant in San Francisco on March 10th at 11:30 am.,CONFIRM,,
117_00031,USER,That is it indeed.,AFFIRM,,
117_00031,SYSTEM,You booking is complete.,NOTIFY_SUCCESS,,
117_00031,USER,Do they serve alcohol?,REQUEST,,
117_00031,SYSTEM,Yes they do serve alcohol.,INFORM,,
117_00031,USER,Thanks so much.,THANK_YOU,,
117_00031,SYSTEM,Do you need help with anything else today?,REQ_MORE,,
117_00031,USER,No thank you.,NEGATE,THANK_YOU,
117_00031,SYSTEM,Have a good one.,GOODBYE,,
117_00032,USER,Hi! Can you help me find event tickets?,INFORM_INTENT,,
117_00032,SYSTEM,I'd be happy to help. When will you be attending the event?,REQUEST,,
117_00032,USER,I'm looking for something on the 8th.,INFORM,,
117_00032,SYSTEM,Let's get some details to help narrow our search. Where are you looking to attend the event. How many are in your party? Do you have anything particular in mind?,REQUEST,,
117_00032,USER,I'm interested in purchasing 2 tickets to see the Giants Vs Diamondbacks in SF.,INFORM,,
117_00032,SYSTEM,You'd like 2 tickets for the Giants Vs Diamondbacks on March 8th in San Francisco. Is that correct?,CONFIRM,,
117_00032,USER,"Yes, that's correct. Can you tell me where the game is being held?",REQUEST,AFFIRM,
117_00032,SYSTEM,"Yes, it is at Oracle Park. Your ticket purchase has been confirmed.",INFORM,NOTIFY_SUCCESS,
117_00032,USER,Can you tell me the address of the venue and the starting time of the game?,REQUEST,,
117_00032,SYSTEM,The venue's address is 24 Willie Mays Plaza and the game begins at 7 pm.,INFORM,,
117_00032,USER,Great. Can you help me find a restaurant that serves typical California fare?,THANK_YOU,,
117_00032,SYSTEM,Certainly. I'd like to suggest Al's Place in San Francisco.,OFFER,,
117_00032,USER,Is there live music at the restaurant? What's the phone number?,REQUEST,,
117_00032,SYSTEM,"Unfortunately, they do not offer live music. The phone number is 415-416-6136.",INFORM,,
117_00032,USER,That's okay. I'd like to continue with a reservation.,INFORM_INTENT,SELECT,
117_00032,SYSTEM,What time would work best for you?,REQUEST,,
117_00032,USER,"I'd like to try to make it at 1:45 in the afternoon, please.",INFORM,,
117_00032,SYSTEM,You'd like a table for 2 at Al's Place in San Francisco at 1:45 pm on March 8th. Is that correct?,CONFIRM,,
117_00032,USER,"Yes, that is correct. Can you tell if the restaurant is pricey?",REQUEST,AFFIRM,
117_00032,SYSTEM,It is considered a moderate range restaurant. Your reservation has been confirmed.,INFORM,NOTIFY_SUCCESS,
117_00032,USER,Great. That will be everything. Thank you.,THANK_YOU,GOODBYE,
117_00032,SYSTEM,You're welcome. Have a wonderful night.,GOODBYE,,
117_00033,USER,I want to find events happening in Santa Rosa next Friday. I also want to buy 3 tickets.,INFORM,,
117_00033,SYSTEM,What type of events are you interested in?,REQUEST,,
117_00033,USER,How about the Huichica Music Festival? I heard that it's really good.,INFORM,,
117_00033,SYSTEM,I am booking 3 tickets to the Huichica Music Festival. The event is on March 8th in Santa Rosa. Is this correct?,CONFIRM,,
117_00033,USER,"Yes, that works.",AFFIRM,,
117_00033,SYSTEM,I have made your reservation. Have fun!,NOTIFY_SUCCESS,,
117_00033,USER,I also need a restaurant.,INFORM_INTENT,,
117_00033,SYSTEM,"What cuisine should I search? How about American, Italian or something else?",REQUEST,,
117_00033,USER,Cantonese food would be perfect.,INFORM,,
117_00033,SYSTEM,I found 3 restaurants. How about Gary Chu's in Santa Rosa?,OFFER,,INFORM_COUNT
117_00033,USER,Anything else?,REQUEST_ALTS,,
117_00033,SYSTEM,I also found Kirin located in Santa Rosa.,OFFER,,
117_00033,USER,I'm looking for a low priced restaurant. Can you suggest something else?,INFORM,REQUEST_ALTS,
117_00033,SYSTEM,I found 1 restaurant. The Mei-don Chinese Cuisine is located in Santa Rosa.,OFFER,,INFORM_COUNT
117_00033,USER,Do they serve alcohol? What is their phone number?,REQUEST,,
117_00033,SYSTEM,"No, they don't serve alcohol. Their phone number is 707-521-9239.",INFORM,,
117_00033,USER,"Yes, that will be fine.",SELECT,,
117_00033,SYSTEM,Do you want to make a reservation?,OFFER_INTENT,,
117_00033,USER,Yes. I need a table for one and make it in the morning 11:30.,AFFIRM_INTENT,INFORM,
117_00033,SYSTEM,Please confirm that you want a table for 1 at the Mei-don Chinese Cuisine restaurant in Santa Rosa . For March 8th at 11:30 am.,CONFIRM,,
117_00033,USER,"No, change that to eleven am.",INFORM,NEGATE,
117_00033,SYSTEM,You want to change your reservation in Santa Rosa to 11 am?,CONFIRM,,
117_00033,USER,Yes. Can I have the address?,REQUEST,AFFIRM,
117_00033,SYSTEM,The address is 6576 Oakmont Drive. Your reservation is successful.,INFORM,NOTIFY_SUCCESS,
117_00033,USER,Thank you very much.,THANK_YOU,,
117_00033,SYSTEM,Is there anything else?,REQ_MORE,,
117_00033,USER,No. Thanks!,NEGATE,THANK_YOU,
117_00033,SYSTEM,You're welcome. Have a nice day.,GOODBYE,,
117_00034,USER,I would like to purchase tickets for an event.,INFORM_INTENT,,
117_00034,SYSTEM,How many tickets would you like and what event are you interested in?,REQUEST,,
117_00034,USER,I would like four tickets for the Electric Feels in San Fran on the 14th.,INFORM,,
117_00034,SYSTEM,4 tickets for Electric Feels on March 14th at San Francisco.,CONFIRM,,
117_00034,USER,"Yes, that works for me.",AFFIRM,,
117_00034,SYSTEM,Your tickets have been purchased.,NOTIFY_SUCCESS,,
117_00034,USER,Thank you. Can you find me a restaurant?,THANK_YOU,,
117_00034,SYSTEM,"What kind of food would you like, Chinese, Italian or something else?",REQUEST,,
117_00034,USER,Some Cambodian food would be good.,INFORM,,
117_00034,SYSTEM,There is 10 restaurants. There is Baan Thai House & Wine Bar located in San Francisco.,OFFER,,INFORM_COUNT
117_00034,USER,What is their phone number is the price fancy?,REQUEST,,
117_00034,SYSTEM,The price is moderate and their phone number is 415-379-4505.,INFORM,,
117_00034,USER,Could you suggest another restaurant?,REQUEST_ALTS,,
117_00034,SYSTEM,There is Basil located in San Francisco.,OFFER,,
117_00034,USER,I would like to make a reservation for 11:30 am.,INFORM,INFORM_INTENT,SELECT
117_00034,SYSTEM,Booking a table at Basil for 4 people at 11:30 am on March 14th in San Francisco.,CONFIRM,,
117_00034,USER,"Yes, that is perfect.",AFFIRM,,
117_00034,SYSTEM,Your reservation was made.,NOTIFY_SUCCESS,,
117_00034,USER,Thank you that is all I needed.,THANK_YOU,GOODBYE,
117_00034,SYSTEM,Have a good day.,GOODBYE,,
117_00035,USER,There's an event I'd like to get 3 tickets for. It's for Tuesday next week. I've heard good things about the Golden Bears Vs Trojans.,INFORM,,
117_00035,SYSTEM,What city is this event taking place in?,REQUEST,,
117_00035,USER,Search for things in San Francisco. I'm interested in Matt Corby.,INFORM,,
117_00035,SYSTEM,"Just to make sure, you want 3 tickets for Matt Corby in San Francisco on March 5th?",CONFIRM,,
117_00035,USER,"Yeah, that's what I want.",AFFIRM,,
117_00035,SYSTEM,"I've booked the tickets, enjoy your time there?",NOTIFY_SUCCESS,,
117_00035,USER,Than you very much. I'd also like to look for restaurants there.,THANK_YOU,,
117_00035,SYSTEM,Is there any cuisine you'd prefer?,REQUEST,,
117_00035,USER,I really like Asian Fusion.,INFORM,,
117_00035,SYSTEM,8 Immortals Restaurant in San Francisco might be to your liking.,OFFER,,
117_00035,USER,What other restaurants do you suggest? I'd like a restaurant that is afforadable.,INFORM,REQUEST_ALTS,
117_00035,SYSTEM,Bai Thong Thai in San Francisco might fit your preference.,OFFER,,
117_00035,USER,What's their phone number?,REQUEST,,
117_00035,SYSTEM,You can call them at 415-863-9335.,INFORM,,
117_00035,USER,"Is there live music there, also what's the address?",REQUEST,,
117_00035,SYSTEM,There's no live music. They're located at 298 Gough Street.,INFORM,,
117_00035,USER,"Okay, that'll work.",SELECT,,
117_00035,SYSTEM,Do you want me to book you a table?,OFFER_INTENT,,
117_00035,USER,"Yes please, get met a table.",AFFIRM_INTENT,,
117_00035,SYSTEM,What time would you like me to book you the table for?,REQUEST,,
117_00035,USER,I want it for the afternoon 12:45.,INFORM,,
117_00035,SYSTEM,"I'll book you a table for 3 at Bai Thong Thai in San Francisco on March 5th at 12:45 pm, is that correct?",CONFIRM,,
117_00035,USER,"Yes, that's correct.",AFFIRM,,
117_00035,SYSTEM,"I'm sorry, but that time is unavailable. Do you want a table for 3 at Bai Thong Thai on March 5th at 12:30 pm?",OFFER,,
117_00035,USER,"Yeah, that's good too.",AFFIRM,,
117_00035,SYSTEM,I've booked you the table.,NOTIFY_SUCCESS,,
117_00035,USER,Thanks a lot. That's all the help I need.,THANK_YOU,GOODBYE,
117_00035,SYSTEM,Have a good rest of your day.,GOODBYE,,
117_00036,USER,I'm looking for an event in Oakland,INFORM,INFORM_INTENT,
117_00036,SYSTEM,What event are you interested in? How many tickets would you like?,REQUEST,,
117_00036,USER,3 tickets for Raiders Vs Bengals on March 1st,INFORM,,
117_00036,SYSTEM,3 tickets for Raiders Vs Bengals in Oakland on March 1st: do you confirm?,CONFIRM,,
117_00036,USER,"No, I prefer Raiders Vs Lions on 6th of March",INFORM,,NEGATE
117_00036,SYSTEM,Raiders Vs Lions on March 6th: do you confirm?,CONFIRM,,
117_00036,USER,"Yes, I confirm. What time is the event?",REQUEST,AFFIRM,
117_00036,SYSTEM,It starts at 7:30 pm. Your ticket has been booked! Have a good time there!,INFORM,NOTIFY_SUCCESS,
117_00036,USER,I also need to book a restaurant there. I like Burrito.,THANK_YOU,,
117_00036,SYSTEM,There are 8 restaurants. In Oakland there's Agave Uptown,OFFER,,INFORM_COUNT
117_00036,USER,"Ok, please reserve a table there",INFORM_INTENT,SELECT,
117_00036,SYSTEM,What time do you want to book?,REQUEST,,
117_00036,USER,I want to book at 1:15 pm,INFORM,,
117_00036,SYSTEM,"A reservation for 3 people at Agave Uptown in Oakland, on March 6th at 1:15 pm. Is it correct?",CONFIRM,,
117_00036,USER,"Yes, it is. Are liquors served in the restaurant?",REQUEST,AFFIRM,
117_00036,SYSTEM,"No, they don't serve alcohol. The table was booked",INFORM,NOTIFY_SUCCESS,
117_00036,USER,"Thank you for helping, It's all",THANK_YOU,GOODBYE,
117_00036,SYSTEM,Have a nice day,GOODBYE,,
117_00037,USER,Can you find me tickets to some interesting event in San Francisco? Some of my friends says Giants Vs Marlins is really good.,INFORM,,INFORM_INTENT
117_00037,SYSTEM,Which date do you want e to search for?,REQUEST,,
117_00037,USER,Please search for 14th of this month.,INFORM,,
117_00037,SYSTEM,Can you confirm the number of tickets you want?,REQUEST,,
117_00037,USER,Please make it four tickets.,INFORM,,
117_00037,SYSTEM,Please confirm: You want me to book 4 tickets for the event Giants Vs Marlins taking place in San Francisco on March 14th.,CONFIRM,,
117_00037,USER,"Yes, That is correct.",AFFIRM,,
117_00037,SYSTEM,Your tickets are booked and confirmed successfully. Have a nice time!,NOTIFY_SUCCESS,,
117_00037,USER,Thank you! Can you find me a good restaurant there?,THANK_YOU,,
117_00037,SYSTEM,"What kind of food like American, Italian or anything else are you looking for?",REQUEST,,
117_00037,USER,I am looking for a restaurant which serves Turkish kind of food.,INFORM,,
117_00037,SYSTEM,There are 5 nice restaurants. One is called A La Turca located at San Francisco.,OFFER,,INFORM_COUNT
117_00037,USER,"Yes, that sounds good to me.Can you make a reservation at the restaurant for 12:15.",INFORM,INFORM_INTENT,SELECT
117_00037,SYSTEM,Please confirm: you want me to make a reservation for 4 people at A La Turca located in San Francisco for March 14th at 12:15 pm.,CONFIRM,,
117_00037,USER,"Yes, That is correct.",AFFIRM,,
117_00037,SYSTEM,Unfortunately Your reservation could not be made. Do you want me to try to reserve table for 4 people at A La Turca on March 14th at 12 pm?,OFFER,,
117_00037,USER,"Yes, That sounds good to me.",AFFIRM,,
117_00037,SYSTEM,Your reservation is made successfully.,NOTIFY_SUCCESS,,
117_00037,USER,That will be all. Thank you!,THANK_YOU,GOODBYE,
117_00037,SYSTEM,I am glad I could help. Have a nice day!,GOODBYE,,
117_00038,USER,I would like event tickets please.,INFORM_INTENT,,
117_00038,SYSTEM,"What would you like to see, for how many people and what date?",REQUEST,,
117_00038,USER,"I'd like something next Monday for three, like Raiders vs Titans.",INFORM,,
117_00038,SYSTEM,What city please?,REQUEST,,
117_00038,USER,In the city of Oakland.,INFORM,,
117_00038,SYSTEM,Confirming tickets for 3 on March 4th in Oakland for Raiders vs Titans.,CONFIRM,,
117_00038,USER,That sounds good. What time does it start?,REQUEST,AFFIRM,
117_00038,SYSTEM,It begins at 5:30 pm and your reservation is complete.,INFORM,NOTIFY_SUCCESS,
117_00038,USER,"Thank you. I'd like a restaurant, too, something affordable in the Asian Fusion category.",THANK_YOU,,
117_00038,SYSTEM,How about Battambang Restaurant in Oakland?,OFFER,,
117_00038,USER,That's great. Please book that for afternoon 1:30.,INFORM,INFORM_INTENT,SELECT
117_00038,SYSTEM,Confirming a reservation for 3 people on March 4th at 1:30 PM in Oakland at Battambang Restaurant.,CONFIRM,,
117_00038,USER,That sounds good.,AFFIRM,,
117_00038,SYSTEM,The reservation is complete.,NOTIFY_SUCCESS,,
117_00038,USER,"Thank you, I'm all set.",THANK_YOU,GOODBYE,
117_00038,SYSTEM,You're very welcome.,GOODBYE,,
117_00039,USER,I am looking for a ticket to an event,INFORM_INTENT,,
117_00039,SYSTEM,when would you like to go,REQUEST,,
117_00039,USER,I need 2 tickets on the 14th for raiders vs lions,INFORM,,
117_00039,SYSTEM,any city you are preference to look in,REQUEST,,
117_00039,USER,i am looking into oakland,INFORM,,
117_00039,SYSTEM,Please confirm your booking for 2 tickets for raiders vs lions in oakland on march 14th,CONFIRM,,
117_00039,USER,yes thats correct. Where is it located,REQUEST,,AFFIRM
117_00039,SYSTEM,It will take place in oakland-alameda county coliseum with address 7000 coliseum way,INFORM,,NOTIFY_SUCCESS
117_00039,USER,"thanks for the help, i also need a restaurant recommendation",THANK_YOU,,
117_00039,SYSTEM,What kind of food do you want? Indian or mexican?,REQUEST,,
117_00039,USER,I want some tacos,INFORM,,
117_00039,SYSTEM,I found 8 restaurants. Agave uptown in oakland is nice,OFFER,,INFORM_COUNT
117_00039,USER,any other suggestion?,REQUEST_ALTS,,
117_00039,SYSTEM,what about bar cesar in oakland?,OFFER,,
117_00039,USER,anything else?,REQUEST_ALTS,,
117_00039,SYSTEM,what about calavera in oakland,OFFER,,
117_00039,USER,yes that works,SELECT,,
117_00039,SYSTEM,would you like me to reserve a table?,OFFER_INTENT,,
117_00039,USER,"yes, make it 12:30",AFFIRM_INTENT,INFORM,
117_00039,SYSTEM,please confirm your booking for 2 people at calavera in oakland on march 14th at 12:30 pm,CONFIRM,,
117_00039,USER,yes that works,AFFIRM,,
117_00039,SYSTEM,your reservation is completed,NOTIFY_SUCCESS,,
117_00039,USER,thanks,THANK_YOU,GOODBYE,
117_00039,SYSTEM,have a nice day,GOODBYE,,
117_00040,USER,I want tickets to an event in Oakland. I heard about Raiders Vs Chiefs.,INFORM,,INFORM_INTENT
117_00040,SYSTEM,Are you looking at a specific date?,REQUEST,,
117_00040,USER,I want it on the 11th.,INFORM,,
117_00040,SYSTEM,How many tickets would you want?,REQUEST,,
117_00040,USER,Four.,INFORM,,
117_00040,SYSTEM,You want 4 tickets to see Raiders Vs Chiefs in Oakland on March 11th. Is this right?,CONFIRM,,
117_00040,USER,"Yes, that's it. Where is the event?",REQUEST,AFFIRM,
117_00040,SYSTEM,Your tickets have been booked. The event is at Oakland-Alameda County Coliseum.,INFORM,NOTIFY_SUCCESS,
117_00040,USER,What time is the event?,REQUEST,,
117_00040,SYSTEM,It starts at 6:30 pm.,INFORM,,
117_00040,USER,Thanks for your help.,THANK_YOU,,
117_00040,SYSTEM,Do you need help with anything else?,REQ_MORE,,
117_00040,USER,I'd also like a restaurant. The price range should be economical.,INFORM,INFORM_INTENT,
117_00040,SYSTEM,What type of food do you like?,REQUEST,,
117_00040,USER,Anything non meat.,INFORM,,
117_00040,SYSTEM,Cafe Romanat is in Oakland.,OFFER,,
117_00040,USER,What's their number?,REQUEST,,
117_00040,SYSTEM,Their contact number is 510-444-1800.,INFORM,,
117_00040,USER,Do you have anymore restaurants?,REQUEST_ALTS,,
117_00040,SYSTEM,Encuentro is in Oakland.,OFFER,,
117_00040,USER,What's their phone number?,REQUEST,,
117_00040,SYSTEM,Their contact number is 510-832-9463.,INFORM,,
117_00040,USER,Thank you for that.,SELECT,,
