dialogue_id,speaker,turn,act_1,act_2,act_3
73_00055,USER,Get me the address of this hotel and also check for the availability of wifi there.,REQUEST,,
73_00055,SYSTEM,This hotel has wifi and their address is 2423 1st Avenue.,INFORM,,
73_00055,USER,That is nice and thanks.,SELECT,,
73_00055,SYSTEM,Shall I book the rooms now.,OFFER_INTENT,,
73_00055,USER,"No, not now. But I need to book the tickets to the event which I selected before.",INFORM_INTENT,,
73_00055,SYSTEM,Let me know the number of tickets that you want to book.,REQUEST,,
73_00055,USER,Make it for two.,INFORM,,
73_00055,SYSTEM,Please confirm to book 2 tickets on March 4th to the event Mariners Vs Tigers in Seattle.,CONFIRM,,
73_00055,USER,Make it for 4 tickets.,INFORM,NEGATE,
73_00055,SYSTEM,Please confirm to book 4 tickets to the event on March 4th.,CONFIRM,,
73_00055,USER,That is confirmed. Proceed.,AFFIRM,,
73_00055,SYSTEM,I have reserved the tickets successfully.,NOTIFY_SUCCESS,,
73_00055,USER,That's all I want and thanks.,THANK_YOU,GOODBYE,
73_00055,SYSTEM,Have a good day.,GOODBYE,,
73_00056,USER,I want to find the dates for some nice events. Can you find me the one?,INFORM_INTENT,,
73_00056,SYSTEM,"Yes, what about your desired City to search for the events? Any Idea?",REQUEST,,
73_00056,USER,I want to search it in SFO.,INFORM,,
73_00056,SYSTEM,Do you have any favorite category of event to search for?,REQUEST,,
73_00056,USER,"Yes, I like Giants Vs Dodgers which I think is the interesting one.",INFORM,,
73_00056,SYSTEM,Got 5 dates for that event. How about the event Giants Vs Dodgers On March 4th at Oracle Park?,OFFER,,
73_00056,USER,What is the starting time and venue of this event?,REQUEST,,
73_00056,SYSTEM,This event will start at 5:30 pm at 24 Willie Mays Plaza. Is that convenient to you or do you want to search for some other dates?.,INFORM,,
73_00056,USER,That is perfect to me. I want to search for a bus to go there and I need to book Economy tickets for the date March 4th. Help me to do this.,SELECT,,
73_00056,SYSTEM,From which place you want to book the bus?,REQUEST,,
73_00056,USER,I want to book it from San Diego.,INFORM,,
73_00056,SYSTEM,Found a bus which is leaving at 7:40 am for which the price of the economy class ticket is $61. How about this?,OFFER,,
73_00056,USER,Search for something else and I need to book 4 tickets.,INFORM,REQUEST_ALTS,
73_00056,SYSTEM,How about an another bus leave at 10 am and the price for which is $43 for Economy class ticket. Is that convenient to you?,OFFER,,
73_00056,USER,Let me confirm. Before that In need to know some details about that bus. What is the origin station's name?,REQUEST,,
73_00056,SYSTEM,It is Santa Fe Depot.,INFORM,,
73_00056,USER,What about the destination?,REQUEST,,
73_00056,SYSTEM,This bus will finally reach the station name Salesforce Transit Center.,INFORM,,
73_00056,USER,I think this is not suitable to me. Search for something else and I want to book flexible tickets.,INFORM,REQUEST_ALTS,
73_00056,SYSTEM,"Okay, what about a bus at 11:40 am with flexible ticket cost $74.",OFFER,,
73_00056,USER,That is nice to proceed.,SELECT,,
73_00056,SYSTEM,Shall I book the tickets now?,OFFER_INTENT,,
73_00056,USER,"No, not now. May be later. Now I want to book rooms in a Hotel with wifi and it should have 2 stars rating.",NEGATE_INTENT,,
73_00056,SYSTEM,What about Argonaut Hotel which is a 2 star hotel as you need?,OFFER,,
73_00056,USER,I want to know the contact number of this hotel and also let me know the cost per night.,REQUEST,,
73_00056,SYSTEM,The cost for reservation will be $264 and please note their phone number is +1 415-563-0800. What about this hotel?,INFORM,,
73_00056,USER,This is also not the one I search for. Find me some other hotels.,REQUEST_ALTS,,
73_00056,SYSTEM,Found a hotel which is Beck's Motor Lodge with 2 stars. How about this?,OFFER,,
73_00056,USER,That is perfect.,SELECT,,
73_00056,SYSTEM,Shall I book the rooms in this hotel now?,OFFER_INTENT,,
73_00056,USER,"No, not now. Thanks.",NEGATE_INTENT,,
73_00056,SYSTEM,How can I help you further?,REQ_MORE,,
73_00056,USER,I want to proceed with the tickets booking for the event that you have selected for me.,INFORM_INTENT,,
73_00056,SYSTEM,Let me know the number of tickets that you want to book for this event.,REQUEST,,
73_00056,USER,I need 2.,INFORM,,
73_00056,SYSTEM,Please confirm to book 2 tickets for the event Giants Vs Dodgers on March 4th in San Francisco.,CONFIRM,,
73_00056,USER,That is confirmed to proceed.,AFFIRM,,
73_00056,SYSTEM,I have booked the tickets successfully.,NOTIFY_SUCCESS,,
73_00056,USER,Thanks for your help. That's all I want.,THANK_YOU,GOODBYE,
73_00056,SYSTEM,Have a good day.,GOODBYE,,
73_00057,USER,I would like to find an event.,INFORM_INTENT,,
73_00057,SYSTEM,What is the name of the event?,REQUEST,,
73_00057,USER,The event is Seattle Vs La Angels.,INFORM,,
73_00057,SYSTEM,In which city would you like the search?,REQUEST,,
73_00057,USER,"I'm looking for an event in Seattle, WA.",INFORM,,
73_00057,SYSTEM,"There are 6 days. On March 2nd, Seattle Vs La Angels is at T-Mobile Park.",OFFER,,
73_00057,USER,I would like to find a bus to get there.,SELECT,,
73_00057,SYSTEM,Would you like to depart on March 2nd? Where are you leaving from?,REQUEST,,
73_00057,USER,"Yes, and I'm leaving from Portland, OR.",INFORM,AFFIRM,
73_00057,SYSTEM,There are 8 buses. There is one leaving at 8:40 am and it's $32 for an economy ticket.,OFFER,,
73_00057,USER,"It's from 4 people leaving from Vancouver, bc.",INFORM,,REQUEST_ALTS
73_00057,SYSTEM,there is a bus leaving at 6:40 am and the price is $28 for an economy ticket.,OFFER,,
73_00057,USER,That sounds good to me.,SELECT,,
73_00057,SYSTEM,Can I help with something else?,REQ_MORE,,
73_00057,USER,I would like to find 1 hotel room.,INFORM,,INFORM_INTENT
73_00057,SYSTEM,Ace Hotel Seattle is a 2 star hotel.,OFFER,,
73_00057,USER,That is good. Can I book a ticket for the event?,INFORM_INTENT,,
73_00057,SYSTEM,How many tickets would you like?,REQUEST,,
73_00057,USER,I would like 4 tickets.,INFORM,,
73_00057,SYSTEM,Booking 4 tickets for Seattle Vs La Angels on March 2nd in Seattle.,CONFIRM,,
73_00057,USER,"Yes, that is perfect. Where is the venue located?",REQUEST,AFFIRM,
73_00057,SYSTEM,Your reservation was made. The address is 1250 1st Avenue South.,INFORM,NOTIFY_SUCCESS,
73_00057,USER,When does the event start?,REQUEST,,
73_00057,SYSTEM,The event will start at 7 pm.,INFORM,,
73_00057,USER,Thank you that is all I needed.,THANK_YOU,GOODBYE,
73_00057,SYSTEM,Have a good day.,GOODBYE,,
73_00058,USER,Hello! I'm looking for some good events that happening in and around Berkeley. Do you have any idea of the event Chris Webby for I heard its a good one.,INFORM,,INFORM_INTENT
73_00058,SYSTEM,"Yup, the event Chris Webby is going to take place on March 4th and will continue for 6 days and is going to held at Cornerstone Craft Beer & Live Music.",OFFER,,
73_00058,USER,What is the address of the event location?,REQUEST,,
73_00058,SYSTEM,The address is 2367 Shattuck Avenue.,INFORM,,
73_00058,USER,When is the event will start?,REQUEST,,
73_00058,SYSTEM,The event will start at 7:30 pm.,INFORM,,
73_00058,USER,"Do you have any other events on any other dates? I think the event Angels Vs Orioles is a good one. Please can you find something in and around Anaheim, CA.",INFORM,,REQUEST_ALTS
73_00058,SYSTEM,"Sure, there is an event Angels Vs Orioles happening at Angel Stadium of Anaheim on March 9th and it will continue for 3 days.",OFFER,,
73_00058,USER,Do you have any idea about the events on other dates?,REQUEST_ALTS,,
73_00058,SYSTEM,"Yup, there is an event Angels Vs Orioles at Angel Stadium of Anaheim taking place on March 11th.",OFFER,,
73_00058,USER,Sounds good to me.,SELECT,,
73_00058,SYSTEM,Do you wish to get tickets for this event?,OFFER_INTENT,,
73_00058,USER,"Not right now, but might be later on.",NEGATE_INTENT,,
73_00058,SYSTEM,Do you want me to help you on anything else?,REQ_MORE,,
73_00058,USER,Yup. Do you have any buses with Flexible tickets going over there?,INFORM,INFORM_INTENT,
73_00058,SYSTEM,Yup! Do you have any plan to travel on March 11th. From where are you planning to start?,REQUEST,,
73_00058,USER,I'll be leaving on March 8th from LAX.,INFORM,,
73_00058,SYSTEM,Looks good. There is a bus departing at 7 am that has a Flexible ticket and the ticket price is $33. Do you wish to book tickets in this bus?,OFFER,,
73_00058,USER,Sounds good. Please can you help me to find a hotel room there?,SELECT,,
73_00058,SYSTEM,"Sure. there are 10 hotels that will suit your requirement. There is a 2 star hotel, Anaheim Desert Inn And Suites which is a nice one.",OFFER,,INFORM_COUNT
73_00058,USER,Do you have their phone number?,REQUEST,,
73_00058,SYSTEM,"Yup, you can reach them at +1 714-772-5050.",INFORM,,
73_00058,USER,Sounds great to me.,SELECT,,
73_00058,SYSTEM,"So, do you want to book a room at this hotel?",OFFER_INTENT,,
73_00058,USER,"Nope, not right now.",NEGATE_INTENT,,
73_00058,SYSTEM,Please may I know if you need any other help?,REQ_MORE,,
73_00058,USER,Please can you get back and book the tickets for the event.,INFORM_INTENT,,
73_00058,SYSTEM,"Sure, how many tickets you wish to get.",REQUEST,,
73_00058,USER,Please can you get four tickets.,INFORM,,
73_00058,SYSTEM,"Please can you confirm that you wish to book 4 tickets for the event Angels Vs Orioles that is going to take place on March 11th in Anaheim, right?",CONFIRM,,
73_00058,USER,"Yup, you're correct. please can I have the address of the venue?",REQUEST,AFFIRM,
73_00058,SYSTEM,"Sure, the venue is at 2000 East Gene Autry Way. Your booking is successful. Have a nice time there.",INFORM,NOTIFY_SUCCESS,
73_00058,USER,Thanks much for your help. I'm done with.,THANK_YOU,GOODBYE,
73_00058,SYSTEM,Have a fantastic day.,GOODBYE,,
73_00059,USER,I want to find some events to attend in New York City please.,INFORM,INFORM_INTENT,
73_00059,SYSTEM,What event do you want to see?,REQUEST,,
73_00059,USER,How about Yankees Vs Rays?,INFORM,,
73_00059,SYSTEM,"I have 4 possibilities for you. On March 4th, Yankees Vs Rays is at Yankee Stadium.",OFFER,,
73_00059,USER,What time and where is it?,REQUEST,,
73_00059,SYSTEM,That's at 6 pm at 1 East 161 Street.,INFORM,,
73_00059,USER,How about some other dates?,REQUEST_ALTS,,
73_00059,SYSTEM,I also have Yankees Vs Rays on March 7th at Yankee Stadium.,OFFER,,
73_00059,USER,That's good. I also need a bus please.,SELECT,,
73_00059,SYSTEM,Is that for a March 7th departure?,REQUEST,,
73_00059,USER,Next Tuesday please.,INFORM,,
73_00059,SYSTEM,Leaving from where?,REQUEST,,
73_00059,USER,From Washington please.,INFORM,,
73_00059,SYSTEM,I have a $36 economy bus leaving at 8:10 am.,OFFER,,
73_00059,USER,Anything else available?,REQUEST_ALTS,,
73_00059,SYSTEM,There's a $39 economy bus leaving at 8:20 am.,OFFER,,
73_00059,USER,"Okay, good. I need a hotel, too. I's like 1 room at a two star hotel with wifi.",SELECT,,
73_00059,SYSTEM,There are 10 hotels which might work. 1 Hotel Brooklyn Bridge has 2 stars.,OFFER,,INFORM_COUNT
73_00059,USER,For how much?,REQUEST,,
73_00059,SYSTEM,That is $240.,INFORM,,
73_00059,USER,Could you give me the address and phone number?,REQUEST,,
73_00059,SYSTEM,"The telephone number is +1 833-625-6111 at 60 Furman Street, Brooklyn.",INFORM,,
73_00059,USER,What else is there? I'd like a 1 star place and I need three rooms.,INFORM,,REQUEST_ALTS
73_00059,SYSTEM,1 Hotel Central Park has 1 star.,OFFER,,
73_00059,USER,"Okay, thank you. I'd like to buy those event tickets please.",INFORM_INTENT,,
73_00059,SYSTEM,How many please?,REQUEST,,
73_00059,USER,I'd like 1.,INFORM,,
73_00059,SYSTEM,Confirming 1 Yankees Vs Rays tickets on March 7th in New York.,CONFIRM,,
73_00059,USER,"Sounds good, thanks.",AFFIRM,,
73_00059,SYSTEM,The reservation has been booked.,NOTIFY_SUCCESS,,
73_00059,USER,Thank you for your help.,THANK_YOU,GOODBYE,
73_00059,SYSTEM,It's my pleasure.,GOODBYE,,
73_00060,USER,I want to search for dates of some nice events which should be an enjoyable one. Can you find the best one for me?,INFORM_INTENT,,
73_00060,SYSTEM,What is your favorite category of event that you want me to search and in which City you like to search for that event?,REQUEST,,
73_00060,USER,I think the event Giants Vs Rockies is the good one and I need to search it in San Francisco.,INFORM,,
73_00060,SYSTEM,What about the date March 1st on which the event Giants Vs Rockies will take place at Oracle Park?. Is that convenient to you?,OFFER,,
73_00060,USER,check about other dates for this event.,REQUEST_ALTS,,
73_00060,SYSTEM,This event Giants Vs Rockies will also be held at Oracle Park on March 3rd. How about this date?,OFFER,,
73_00060,USER,That is the convenient one. Thanks.,SELECT,,
73_00060,SYSTEM,Shall I book the tickets to this event now?,OFFER_INTENT,,
73_00060,USER,"No, will think about it later. Now, I want to book two Flexible tickets to a bus to go there. I want your help in this regard.",NEGATE_INTENT,,
73_00060,SYSTEM,What about your departure date? shall I go with March 3rd or something else? And also let me know your current location to search the bus.,REQUEST,,
73_00060,USER,Departure date is confirmed as March 3rd and I want to book it from Sacramento.,INFORM,AFFIRM,
73_00060,SYSTEM,Got 10 bus details that match your requirements and what about the one leaves at 7:40 am for flexible ticket price $41?,OFFER,,
73_00060,USER,Let me know about the final destination of this bus.,REQUEST,,
73_00060,SYSTEM,I will reach finally to Salesforce Transit Center.,INFORM,,
73_00060,USER,Search for something else as I need the one which is exactly meet my requirements.,REQUEST_ALTS,,
73_00060,SYSTEM,How about another one bus which leaves at 8:30 am for the flexible ticket cost $41?,OFFER,,
73_00060,USER,From which station this bus will leave?,REQUEST,,
73_00060,SYSTEM,It will leave from Sacramento Valley Station and hope this will meet your requirements.,INFORM,,
73_00060,USER,"Sorry to say, this is also not suitable one. Can you search for some other buses which will leave by tomorrow?",INFORM,REQUEST_ALTS,
73_00060,SYSTEM,"Yes, what about the one under price of flexible ticket is $44 which will leave at 10:20 am?",OFFER,,
73_00060,USER,This the perfect one.,SELECT,,
73_00060,SYSTEM,Shall I book the tickets now?,OFFER_INTENT,,
73_00060,USER,"No, will be later. Thanks.",NEGATE_INTENT,,
73_00060,SYSTEM,How can I help you further?,REQ_MORE,,
73_00060,USER,Search for me some nice hotels with Wi-fi connection. I need to boo two rooms there.,INFORM,,INFORM_INTENT
73_00060,SYSTEM,Got 10 results and what about the one which is in the name of Amsterdam Hostel San Francisco with 1 star?,OFFER,,INFORM_COUNT
73_00060,USER,"Get me their contact number, so that I can use for my future reference.",REQUEST,,
73_00060,SYSTEM,Their phone number is +1 415-673-3277 by which you can contact them at any time.,INFORM,,
73_00060,USER,Also I want to know the address of that hotel.,REQUEST,,
73_00060,SYSTEM,This hotel is located at 749 Taylor Street.,INFORM,,
73_00060,USER,"Thanks for the details. I need to search for some 3 star hotels, can you search for the one?",INFORM,REQUEST_ALTS,
73_00060,SYSTEM,"Yes, what about a best hotel named Argonaut Hotel? which is a 3 star hotel and is the best one among the 10 results I got.",OFFER,,INFORM_COUNT
73_00060,USER,"Sorry, that is also not suitable to me. Can you search for something else?",REQUEST_ALTS,,
73_00060,SYSTEM,"Yes, What about Bei Hotel San Francisco which is a 3 Star Hotel and it is a homely one.",OFFER,,
73_00060,USER,"Yes, that is the one I want.",SELECT,,
73_00060,SYSTEM,Shall I book the rooms there.,OFFER_INTENT,,
73_00060,USER,"No, not now. At present I want to book the tickets for the event that I have chose before and I need 3 tickets.",INFORM,INFORM_INTENT,
73_00060,SYSTEM,Please confirm to book 3 tickets to the event Giants Vs Rockies in San Francisco on March 3rd.,CONFIRM,,
73_00060,USER,Make it for 4 tickets.,INFORM,NEGATE,
73_00060,SYSTEM,Please confirm to book 4 tickets to the event in San Francisco.,CONFIRM,,
73_00060,USER,"Yes, confirmed to proceed.",AFFIRM,,
73_00060,SYSTEM,Your tickets are booked successfully to that event.,NOTIFY_SUCCESS,,
73_00060,USER,What is the starting time and venue of this event?,REQUEST,,
73_00060,SYSTEM,It will start at 5 pm at 24 Willie Mays Plaza.,INFORM,,
73_00060,USER,That is great and that's all for now.,THANK_YOU,GOODBYE,
73_00060,SYSTEM,Have a good day.,GOODBYE,,
73_00061,USER,I'm intrigued about looking for dates for activities.,INFORM_INTENT,,
73_00061,SYSTEM,Do you know the activities you are intrigued in?,REQUEST,,
73_00061,USER,I got word that Greensky Bluegrass is wonderful.,INFORM,,
73_00061,SYSTEM,Is there a metropolis you prefer me to search in?,REQUEST,,
73_00061,USER,I am searching for one in Seattle.,INFORM,,
73_00061,SYSTEM,There is an activity called Greensky Bluegrass at Flamingo Lot on March 1st.,OFFER,,
73_00061,USER,"Where is the event's location, and what time does it begin?",REQUEST,,
73_00061,SYSTEM,the event is at 5500 Phinney Avenue North and begins at 5:30 pm.,INFORM,,
73_00061,USER,Can you tell me about activities on other days? I got word that Huskies vs Utes is excellent.,INFORM,REQUEST_ALTS,
73_00061,SYSTEM,I discovered the activity on 2 days. There is an activity on March 8th known as the Huskies vs Utes at Husky Stadium.,OFFER,,
73_00061,USER,That is perfect for me.,SELECT,,
73_00061,SYSTEM,Do you wish to purchase tickets for the activity?,OFFER_INTENT,,
73_00061,USER,Perhaps later. What about the bus traveling there?,NEGATE_INTENT,,
73_00061,SYSTEM,"Where will you depart from, and what time do you wish to leave from? What about March 8th?",REQUEST,,
73_00061,USER,"I am departing from Portland, OR, and I intend to do so on March 6th.",INFORM,,
73_00061,SYSTEM,I discovered 8 buses for you. What do you think about an economy ticket costing $26 for a bus departing at 8:40 am?,OFFER,,
73_00061,USER,Is there any alternative bus available for 3 people?,INFORM,REQUEST_ALTS,
73_00061,SYSTEM,What do you think about an economy ticket costing $32 for a bus departing at 9:30 am?,OFFER,,
73_00061,USER,That sounds perfect. I'd like to look for a hotel room there.,SELECT,,
73_00061,SYSTEM,I discovered 10 hotels suitable for your requirements. There is a lovely 2 star hotel called Ace Hotel Seattle.,OFFER,,INFORM_COUNT
73_00061,USER,That's perfect. I'd like to focus on reserving tickets for the activity; I'd like one ticket.,INFORM,INFORM_INTENT,
73_00061,SYSTEM,Please verify the following information: 1 ticket reserved for the Huskies vs Utes activity taking place in Seattle on March 8th.,CONFIRM,,
73_00061,USER,"Yeah, that's perfect for me. Where is the activity's location?",REQUEST,AFFIRM,
73_00061,SYSTEM,your booking is successful. Enjoy the event! It's located at 3800 Montlake Boulevard Northeast.,INFORM,NOTIFY_SUCCESS,
73_00061,USER,Thank you for your assistance.,THANK_YOU,,
73_00061,SYSTEM,Could I assist you with something else?,REQ_MORE,,
73_00061,USER,"No, thank you for your assistance.",NEGATE,THANK_YOU,
73_00061,SYSTEM,Have a pleasant afternoon.,GOODBYE,,
73_00062,USER,"Hi, I need something fun to do. My friend said that the Mets Vs Yankees are good. Can you find me something in New York City?",INFORM,,INFORM_INTENT
73_00062,SYSTEM,"Sure, I managed to find the event on 2 different days. There is a game on March 3rd for the Mets Vs Yankees in Citi Field.",OFFER,,
73_00062,USER,When does it start and where is the venue?,REQUEST,,
73_00062,SYSTEM,The game will start at 6 pm and it is located at 123-01 Roosevelt Avenue.,INFORM,,
73_00062,USER,What about another date? I was told that the Yankees Vs Diamondbacks is supposed to be good.,INFORM,REQUEST_ALTS,
73_00062,SYSTEM,I managed to find the game on 4 days. There is a game on March 2nd for the Yankees Vs Diamondbacks at Yankee Stadium.,OFFER,,
73_00062,USER,Is there any other dates?,REQUEST_ALTS,,
73_00062,SYSTEM,There's a game on March 5th for the Yankees Vs Diamondbacks at Yankee Stadium.,OFFER,,
73_00062,USER,That is perfect.,SELECT,,
73_00062,SYSTEM,Would you like to buy tickets for the game?,OFFER_INTENT,,
73_00062,USER,Maybe another time.,NEGATE_INTENT,,
73_00062,SYSTEM,Is there anything else I can help you with?,REQ_MORE,,
73_00062,USER,Can you find me a bus that goes there?,INFORM_INTENT,,
73_00062,SYSTEM,When would you like to leave? Does March 5th sound good? And where will you be departing from?,REQUEST,,
73_00062,USER,"Yes, that's great. I'd like to leave from Washington.",INFORM,AFFIRM,
73_00062,SYSTEM,I managed to find 8 buses. There's a bus leaving at 8:10 am and the price is $36. It is Economy.,OFFER,,
73_00062,USER,"Great, what station does the bus go to?",REQUEST,,
73_00062,SYSTEM,The name of the destination station is Port Authority Station.,INFORM,,
73_00062,USER,What is the bus station called that I am departing from?,REQUEST,,
73_00062,SYSTEM,The name of the origin station is Union Station.,INFORM,,
73_00062,USER,That's perfect.,SELECT,,
73_00062,SYSTEM,Would you like to buy bus tickets?,OFFER_INTENT,,
73_00062,USER,"No, not at this time.",NEGATE_INTENT,,
73_00062,SYSTEM,Is there anything else I can help you with?,REQ_MORE,,
73_00062,USER,I'd like to find a hotel room there.,INFORM_INTENT,,
73_00062,SYSTEM,"I found 10 hotels I think you might like. One is called 1 Hotel Brooklyn Bridge. It is a 4 star hotel, so it's pretty nice.",OFFER,,INFORM_COUNT
73_00062,USER,Is there anything else? I'd like a three star hotel. I'm looking for 2 hotel rooms.,INFORM,,REQUEST_ALTS
73_00062,SYSTEM,I found 9 hotels that you might like. One is called 1 Hotel Central Park. It is a 3 star hotel.,OFFER,,INFORM_COUNT
73_00062,USER,That sounds great.,SELECT,,
73_00062,SYSTEM,Is there anything else I can help you with?,REQ_MORE,,
73_00062,USER,I'd like to book tickets for the event I talked about earlier.,INFORM_INTENT,,
73_00062,SYSTEM,How many tickets do you wish to get?,REQUEST,,
73_00062,USER,I just want one ticket.,INFORM,,
73_00062,SYSTEM,So you'd like 1 ticket for Yankees Vs Diamondbacks for March 5th in New York. Is this correct?,CONFIRM,,
73_00062,USER,"Yes, that's perfect.",AFFIRM,,
73_00062,SYSTEM,The tickets have been booked. Have fun!,NOTIFY_SUCCESS,,
73_00062,USER,When does the game start? And where is the venue?,REQUEST,,
73_00062,SYSTEM,The game will start at 5 pm and it is located at 1 East 161 Street.,INFORM,,
73_00062,USER,Thanks for everything.,THANK_YOU,,
73_00062,SYSTEM,Is there anything else I can help you with?,REQ_MORE,,
73_00062,USER,"No that's all, I appreciate your help.",NEGATE,THANK_YOU,
73_00062,SYSTEM,Have a wonderful day!,GOODBYE,,
73_00063,USER,"I would like to find something to do in LAX, I've heard that Toe is good..",INFORM,,INFORM_INTENT
73_00063,SYSTEM,The event is on for 4 days. On March 3rd there is Toe at Masonic Lodge at Hollywood Forever.,OFFER,,
73_00063,USER,When does the event start and where is it located?,REQUEST,,
73_00063,SYSTEM,The venue is at 5970 Santa Monica Boulevard at 5:30 pm.,INFORM,,
73_00063,USER,That event sounds good.,SELECT,,
73_00063,SYSTEM,Would you like a ticket for this event?,OFFER_INTENT,,
73_00063,USER,Maybe later. Is there a bus going there?,NEGATE_INTENT,,
73_00063,SYSTEM,When would you like to leave on March 3rd? Where are you leaving from?,REQUEST,,
73_00063,USER,"Yes, and I'm leaving from Long Beach, CA.",INFORM,AFFIRM,
73_00063,SYSTEM,I found 10 buses there is one leaving 6:40 am and the economy ticket is $14.,OFFER,,
73_00063,USER,What is the name of the station it's leaving and which station does it reach?,REQUEST,,
73_00063,SYSTEM,The origin station is Downtown Station and the destination is Union Station.,INFORM,,
73_00063,USER,That sounds good. I would like to find an hotel room.,SELECT,,
73_00063,SYSTEM,There is AC Hotel By Marriott Beverly Hills that is a 2 star hotel.,OFFER,,
73_00063,USER,What is the cost per night?,REQUEST,,
73_00063,SYSTEM,The rooms are $156 per night.,INFORM,,
73_00063,USER,What is their address and phone number?,REQUEST,,
73_00063,SYSTEM,Their address 6399 Wilshire Boulevard and their phone number is +1 323-852-7000.,INFORM,,
73_00063,USER,Yes that sounds good.,SELECT,,
73_00063,SYSTEM,Would you like to book a room?,OFFER_INTENT,,
73_00063,USER,"No, but I would like to have 3 tickets to the event.",INFORM,INFORM_INTENT,
73_00063,SYSTEM,Booking 3 tickets for Toe on March 3rd in Los Angeles.,CONFIRM,,
73_00063,USER,"Yes, that is perfect for me.",AFFIRM,,
73_00063,SYSTEM,Your reservation was made.,NOTIFY_SUCCESS,,
73_00063,USER,Thank you for helping.,THANK_YOU,GOODBYE,
73_00063,SYSTEM,Have a good day.,GOODBYE,,
73_00064,USER,Hey can you help me find some dates to some events?,INFORM_INTENT,,
73_00064,SYSTEM,What kind of event do you like? In which city would you like that to be?,REQUEST,,
73_00064,USER,I want to watch the Phillies Vs Diamondbacks in Philly please.,INFORM,,
73_00064,SYSTEM,I found it on 5 days. Phillies Vs Diamondbacks at Citizens Bank Park will occur on March 1st.,OFFER,,
73_00064,USER,When does the event start? Where is their venue?,REQUEST,,
73_00064,SYSTEM,Starts at 5:30 pm. Their venue is at 1 Citizens Bank Way.,INFORM,,
73_00064,USER,Is it available on another day?,REQUEST_ALTS,,
73_00064,SYSTEM,On March 4th too. Phillies vs Diamondbacks on Citizens Bank Park.,OFFER,,
73_00064,USER,Any other date?,REQUEST_ALTS,,
73_00064,SYSTEM,On March 6th too. Phillies vs Diamondbacks at Citizens Bank Park.,OFFER,,
73_00064,USER,Sounds really good.,SELECT,,
73_00064,SYSTEM,Should I buy the tickets?,OFFER_INTENT,,
73_00064,USER,Not now. Help me find two Economy tickets on a bus going there leaving on the 5th of this month.,NEGATE_INTENT,,
73_00064,SYSTEM,Where are you leaving from?,REQUEST,,
73_00064,USER,Leaving from Washington.,INFORM,,
73_00064,SYSTEM,I found 8 buses. There's one that leaves at 7:10 am with a $29 Economy ticket.,OFFER,,
73_00064,USER,Sounds good. Get me 3 rooms in a hotel there with WiFi and a two star rating.,SELECT,,
