dialogue_id,speaker,turn,act_1,act_2,act_3
121_00062,USER,Are pets allowed?,REQUEST,,
121_00062,SYSTEM,No pets are allowed.,INFORM,,
121_00062,USER,"Perfect, that is all I need.",SELECT,GOODBYE,
121_00062,SYSTEM,Have a great day.,GOODBYE,,
121_00063,USER,Can you help me find a rental car?,INFORM_INTENT,,
121_00063,SYSTEM,Of course. Where will you be picking it up and at what time? How long will you be keeping it?,REQUEST,,
121_00063,USER,I'll need to pick it up in NYC at 15:30 and I'll be keeping it until the 6th.,INFORM,,
121_00063,SYSTEM,What day will you be picking it up?,REQUEST,,
121_00063,USER,I'll need it on Saturday this week.,INFORM,,
121_00063,SYSTEM,I have found a Standard car available on March 2nd. It is an Accord and it is available for pick up at Grand Central Station.,OFFER,,
121_00063,USER,How much would it be?,REQUEST,,
121_00063,SYSTEM,The total cost would be $108.,INFORM,,
121_00063,USER,Perfect. Can you reserve it for me?,INFORM_INTENT,SELECT,
121_00063,SYSTEM,You'd like to pick up a Standard car on March 2nd at 3:30 pm from Grand Central Station. You will be returning the car on March 6th. Is this correct?,CONFIRM,,
121_00063,USER,"Yes, that's correct.",AFFIRM,,
121_00063,SYSTEM,Your reservation has been confirmed.,NOTIFY_SUCCESS,,
121_00063,USER,Can you find me a hotel nearby?,INFORM_INTENT,,
121_00063,SYSTEM,I recommend 1 Hotel Brooklyn Bridge. It is a beautiful property with a 4.5 average rating.,OFFER,,
121_00063,USER,Is there anything else available? I only need one room.,INFORM,REQUEST_ALTS,
121_00063,SYSTEM,1 Hotel Central Park also has a 4.5 rating.,OFFER,,
121_00063,USER,Can you tell me where it is located and what the contact number is?,REQUEST,,
121_00063,SYSTEM,The street address is 1414 6th Avenue and their phone number is +1 212-703-2001.,INFORM,,
121_00063,USER,That works for me.,SELECT,,
121_00063,SYSTEM,Would you like to make a reservation?,OFFER_INTENT,,
121_00063,USER,Not at this time. Thank you.,NEGATE_INTENT,GOODBYE,
121_00063,SYSTEM,You're welcome. Have a great day!,GOODBYE,,
121_00064,USER,I need help booking a car for rent on March 2nd and I will pick it up in NY.,INFORM,,INFORM_INTENT
121_00064,SYSTEM,What time will you pick it up and when is your drop off date for the car?,REQUEST,,
121_00064,USER,I will take the car at 9:30 in the morning and I want it until 4th of this month.,INFORM,,
121_00064,SYSTEM,How about a standard Altima available at Port Authority Station for pick up on March 2nd?,OFFER,,
121_00064,USER,How much is it costing?,REQUEST,,
121_00064,SYSTEM,It will be $54 for reservation cost.,INFORM,,
121_00064,USER,Find me something else. I like a compact car for pick up in Philly.,INFORM,,REQUEST_ALTS
121_00064,SYSTEM,"Out of 5 cars, do you like a compact cooper in Intercity Terminal available for pick up on March 2nd. It is a nice car.",OFFER,,
121_00064,USER,Suggest something else.,REQUEST_ALTS,,
121_00064,SYSTEM,"Would you like Fit, a compact car which you can pick up at Intercity Terminal on March 2nd?",OFFER,,
121_00064,USER,That is perfect.,SELECT,,
121_00064,SYSTEM,Shall I reserve the car?,OFFER_INTENT,,
121_00064,USER,Sure. Book the car for rent.,AFFIRM_INTENT,,
121_00064,SYSTEM,Ok so you want a compact car from March 2nd to March 4th. You will pick it up at Intercity Terminal ar 9:30 am?,CONFIRM,,
121_00064,USER,"That is correct, now tell me the cost?",REQUEST,AFFIRM,
121_00064,SYSTEM,I have booked your car and it is $46 in all.,INFORM,NOTIFY_SUCCESS,
121_00064,USER,Thank you. Book me a hotel room to stay. I need only one room.,THANK_YOU,,
121_00064,SYSTEM,Would you mind Aka University city with a rating of 4.6?,OFFER,,
121_00064,USER,I would like it.,SELECT,,
121_00064,SYSTEM,Shall I reserve the hotel?,OFFER_INTENT,,
121_00064,USER,Not right now. We will reserve it later.,NEGATE_INTENT,,
121_00064,SYSTEM,Is there anything else you need?,REQ_MORE,,
121_00064,USER,Nope. Thanks. That is all.,NEGATE,THANK_YOU,
121_00064,SYSTEM,Have a nice day!,GOODBYE,,
121_00065,USER,Can you get me a rental car?,INFORM_INTENT,,
121_00065,SYSTEM,Sure. When do you need it and when would you like to return it?,REQUEST,,
121_00065,USER,"I need it later today, around half past 10 in the morning, and I'll keep it until March 4th",INFORM,,
121_00065,SYSTEM,And where would you like to get the car?,REQUEST,,
121_00065,USER,I'll pick it up in Las Vegas,INFORM,,
121_00065,SYSTEM,"There's a standard car, a Civic, available from McCarran International Airport on March 1st",OFFER,,
121_00065,USER,How much will that cost,REQUEST,,
121_00065,SYSTEM,That's a $90 rental,INFORM,,
121_00065,USER,Ok please book that,INFORM_INTENT,SELECT,
121_00065,SYSTEM,"Please confirm: booking a standard car from McCarran International Airport for pickup on March 1st at 10:30 am, returning on March 4th",CONFIRM,,
121_00065,USER,Yes that's right,AFFIRM,,
121_00065,SYSTEM,I've reserved your car. Enjoy,NOTIFY_SUCCESS,,
121_00065,USER,Thanks so much. Can I get a hotel there too?,THANK_YOU,,
121_00065,SYSTEM,"I found 6 hotels for you. Best Western Plus Las Vegas West looks good, with a 4.3 rating",OFFER,,INFORM_COUNT
121_00065,USER,Yes I like that,SELECT,,
121_00065,SYSTEM,Would you like to book a reservation,OFFER_INTENT,,
121_00065,USER,Not right now. I'm good for now.,NEGATE_INTENT,GOODBYE,
121_00065,SYSTEM,Take care.,GOODBYE,,
121_00066,USER,My car just got towed and I need a car for rent.,INFORM_INTENT,,
121_00066,SYSTEM,What date will you be needing it from?,REQUEST,,
121_00066,USER,I want the car Tuesday next week.,INFORM,,
121_00066,SYSTEM,What date will you drop the car off? What is your pick up location and what time will you take it?,REQUEST,,
121_00066,USER,I will pick up the car in Fresno at half past 4 in the evening. I will drive it until 8th of this month.,INFORM,,
121_00066,SYSTEM,You can choose from 6 options. How about a Standard Accord at Fresno Station available to be picked up on March 5th?,OFFER,,
121_00066,USER,Can you find something else?,REQUEST_ALTS,,
121_00066,SYSTEM,You can pick up a Standard Altima at Fresno Yosemite International Airport on March 5th.,OFFER,,
121_00066,USER,Keep looking for something else.,REQUEST_ALTS,,
121_00066,SYSTEM,Would you like a Standard Camry at Fresno Yosemite International Airport which you can pick up on March 5th?,OFFER,,
121_00066,USER,This one will be perfect.,SELECT,,
121_00066,SYSTEM,Shall I book the car?,OFFER_INTENT,,
121_00066,USER,Sure. I will take the vehicle on rent.,AFFIRM_INTENT,,
121_00066,SYSTEM,"So, you want the Standard Car on March 5th at Fresno Yosemite International Airport where you will be picking it up at 4:30 pm. Your drop-off day is the March 8th.",CONFIRM,,
121_00066,USER,Indeed. Tell me how much it costs.,REQUEST,AFFIRM,
121_00066,SYSTEM,I booked the car. It should cost you $93 in all.,INFORM,NOTIFY_SUCCESS,
121_00066,USER,I have my dogs with me. So need a hotel where pets are allowed. Book me one room in that area.,INFORM,,INFORM_INTENT
121_00066,SYSTEM,Can I suggest you La Quinta Inn By Wyndham Fresno Yosemite rated at 3.7?,OFFER,,
121_00066,USER,That will be excellent.,SELECT,,
121_00066,SYSTEM,Shall I go ahead with the hotel reservation?,OFFER_INTENT,,
121_00066,USER,Nope. Hold off the reservation for now.,NEGATE_INTENT,,
121_00066,SYSTEM,Is there anything else you like me do?,REQ_MORE,,
121_00066,USER,Not really. But thanks.,NEGATE,THANK_YOU,
121_00066,SYSTEM,I wish you a great day!,GOODBYE,,
121_00067,USER,I am searching for a small rental car. I'll need the car from next Friday until March 9th.,INFORM,,
121_00067,SYSTEM,Where will you pick it up and what time do you need it?,REQUEST,,
121_00067,USER,I will pick it up around 15:30 in Portland.,INFORM,,
121_00067,SYSTEM,I have 5 suitable cars. There is a nice compact Bolt at Union Station. You can pick it up on March 8th.,OFFER,,
121_00067,USER,How much will it cost in total?,REQUEST,,
121_00067,SYSTEM,It will be $28 in total.,INFORM,,
121_00067,USER,"Do you have anything else? Make the pick up in Paris, France.",INFORM,REQUEST_ALTS,
121_00067,SYSTEM,I have a nice compact Cooper available at Charles de Gaulle International Airport that you can pick up on March 8th.,OFFER,,
121_00067,USER,Sounds nice.,SELECT,,
121_00067,SYSTEM,Would you like to reserve it?,OFFER_INTENT,,
121_00067,USER,"Yeah, reserve it for me.",AFFIRM_INTENT,,
121_00067,SYSTEM,Would you confirm these details? You want to pick up the compact car from Charles de Gaulle International Airport on March 8th at 3:30 pm and drop it off on March 9th?,CONFIRM,,
121_00067,USER,Sounds good to me.,AFFIRM,,
121_00067,SYSTEM,Your car was reserved.,NOTIFY_SUCCESS,,
121_00067,USER,I would like to look for one room at a hotel.,INFORM,INFORM_INTENT,
121_00067,SYSTEM,There are 10 hotels. How about Ac Hotel By Marriott Paris Porte Maillot? It has a 4.3 rating.,OFFER,,INFORM_COUNT
121_00067,USER,What is the address and phone number?,REQUEST,,
121_00067,SYSTEM,"The address is 6 Rue Gustave CHarpentier, 75017 and the phone number is +33 1 84 82 49 09.",INFORM,,
121_00067,USER,Sounds perfect.,SELECT,,
121_00067,SYSTEM,Shall I continue with the booking?,OFFER_INTENT,,
121_00067,USER,Not right now.,NEGATE_INTENT,,
121_00067,SYSTEM,Could I assist with something else?,REQ_MORE,,
121_00067,USER,"No, thanks.",NEGATE,THANK_YOU,
121_00067,SYSTEM,Have a good one!,GOODBYE,,
121_00068,USER,I want a car rental.,INFORM_INTENT,,
121_00068,SYSTEM,How long do you want the car for and where do you want to pick it up?,REQUEST,,
121_00068,USER,From LAX and I want it until next Tuesday.,INFORM,,
121_00068,SYSTEM,What time do you want to pick it up?,REQUEST,,
121_00068,USER,Around 12:30 works.,INFORM,,
121_00068,SYSTEM,What day do you want to pick it up?,REQUEST,,
121_00068,USER,I want it today.,INFORM,,
121_00068,SYSTEM,"I have 6 cars for you. One car, a standard one, is a Civic. It's available for pickup at Union Station on March 1st.",OFFER,,
121_00068,USER,What's the total cost for the rental?,REQUEST,,
121_00068,SYSTEM,It is $120.,INFORM,,
121_00068,USER,Sounds great. Reserve it please.,INFORM_INTENT,SELECT,
121_00068,SYSTEM,Please confirm the following reservation details: You are picking up a standard car from Union Station at 12:30 pm. The pickup date is March 1st and you will drop the car off on March 5th.,CONFIRM,,
121_00068,USER,"Yes, that's perfect.",AFFIRM,,
121_00068,SYSTEM,Your car was successfully reserved.,NOTIFY_SUCCESS,,
121_00068,USER,I want to search a hotel please.,INFORM_INTENT,,
121_00068,SYSTEM,Ac Hotel By Marriott Beverly Hills has a rating of 4.4.,OFFER,,
121_00068,USER,What else is there?,REQUEST_ALTS,,
121_00068,SYSTEM,Airtel Plaza Hotel has a 3.9 rating.,OFFER,,
121_00068,USER,Anything else? I want just 1 room.,INFORM,REQUEST_ALTS,
121_00068,SYSTEM,How about Banana Bungalow - Hollywood Hostel. Its rating is 4.1.,OFFER,,
121_00068,USER,"That good. Okay, I'm not booking a hotel right now. That's all I want for today.",SELECT,GOODBYE,
121_00068,SYSTEM,Have a great day.,GOODBYE,,
121_00069,USER,I would like to find a rental car.,INFORM_INTENT,,
121_00069,SYSTEM,Where would you like to pick the car up from and until what date did you want it?,REQUEST,,
121_00069,USER,"I'd like to pick it up from Vancouver, BC and will need it until the 5th of this month.",INFORM,,
121_00069,SYSTEM,When did you need the car?,REQUEST,,
121_00069,USER,I'd like to pick it up around 10:15 am.,INFORM,,
121_00069,SYSTEM,From what day did you want the car?,REQUEST,,
121_00069,USER,I will need the car starting 1st of this month.,INFORM,,
121_00069,SYSTEM,I found 4 cars for you. One nice car is a Standard Accord available for pick up from YVR International Airport on March 1st.,OFFER,,
121_00069,USER,Did you find anything else? I'd like to pick the car up around half past 6 in the evening and any type works for me.,INFORM,,REQUEST_ALTS
121_00069,SYSTEM,There is also a nice Standard Altima car available at YVR International Airport for pickup on March 1st.,OFFER,,
121_00069,USER,Were there any other cars available?,REQUEST_ALTS,,
121_00069,SYSTEM,There is also a Compact Bolt car available at YVR International Airport for pickup on March 1st.,OFFER,,
121_00069,USER,What will the total cost be?,REQUEST,,
121_00069,SYSTEM,The total for the reservation will be $116.,INFORM,,
121_00069,USER,Sounds about right.,SELECT,,
121_00069,SYSTEM,Did you wish to book this car?,OFFER_INTENT,,
121_00069,USER,"Yes, I'd like to rent a vehicle.",AFFIRM_INTENT,,
121_00069,SYSTEM,Please confirm you're picking up a Compact car from YVR International Airport on March 1st at 6:30 pm and dropping it off on March 5th.,CONFIRM,,
121_00069,USER,"Yes, that is correct.",AFFIRM,,
121_00069,SYSTEM,Your reservation has been confirmed.,NOTIFY_SUCCESS,,
121_00069,USER,I'd also like to find a hotel there.,INFORM_INTENT,,
121_00069,SYSTEM,I found 10 hotels for you. One hotel is Atrium Inn Vancouver with a rating of 3.7.,OFFER,,INFORM_COUNT
121_00069,USER,That sounds perfect.,SELECT,,
121_00069,SYSTEM,Did you want to continue booking the hotel?,OFFER_INTENT,,
121_00069,USER,"No, I did not want to book now. That will be all I need.",NEGATE_INTENT,GOODBYE,
121_00069,SYSTEM,Have a nice day.,GOODBYE,,
121_00070,USER,I need a rental car for two pm on March 4th.,INFORM,,INFORM_INTENT
121_00070,SYSTEM,To be picked up from where?,REQUEST,,
121_00070,USER,"From Vancouver, BC.",INFORM,,
121_00070,SYSTEM,For what date?,REQUEST,,
121_00070,USER,From the 3rd of March.,INFORM,,
121_00070,SYSTEM,There are 7 options. There is a standard Accord available at YVR International Airport on March 3rd.,OFFER,,
121_00070,USER,Great. Please book.,INFORM_INTENT,SELECT,
121_00070,SYSTEM,Please confirm you want me to book a standard car to be picked up at YVR International Airport on March 3rd at 2 pm until March 4th.,CONFIRM,,
121_00070,USER,Yes. That's correct.,AFFIRM,,
121_00070,SYSTEM,Your reservation was a success.,NOTIFY_SUCCESS,,
121_00070,USER,Can you also book 1 hotel room.,INFORM,INFORM_INTENT,
121_00070,SYSTEM,There are 10 options. Atrium Inn Vancouver has a 3.7 rating.,OFFER,,INFORM_COUNT
121_00070,USER,Is it pet friendly.,REQUEST,,
121_00070,SYSTEM,Yes. It is pet friendly.,INFORM,,
121_00070,USER,What other options do you have?,REQUEST_ALTS,,
121_00070,SYSTEM,The Auberge Vancouver Hotel has a 4.1 rating.,OFFER,,
121_00070,USER,Perfect. That will be all today.,SELECT,GOODBYE,
121_00070,SYSTEM,Okay. Enjoy your day.,GOODBYE,,
121_00071,USER,"Hey, can you find me a standard car to rent?",INFORM,INFORM_INTENT,
121_00071,SYSTEM,"Sure, when and what time do you want it from and when do you want it until?",REQUEST,,
121_00071,USER,"I'd like to pick it up from SFO at morning 11 of Friday next week, I need it until the 10th of March.",INFORM,,
121_00071,SYSTEM,"Okay, I have 6 cars for you. How about an Altima from SFO International Airport. It's a standard car available from March 8th.",OFFER,,
121_00071,USER,"Is there anything else? I'd like it until the 9th of March, actually.",INFORM,REQUEST_ALTS,
121_00071,SYSTEM,"Okay, there are 5 cars available. How about a standard Civic from Salesforce Transit Center on March 8th?",OFFER,,
121_00071,USER,How much will that cost?,REQUEST,,
121_00071,SYSTEM,It'll be $33 total.,INFORM,,
121_00071,USER,"Nice, sounds perfect. Please reserve it.",INFORM_INTENT,SELECT,
121_00071,SYSTEM,"Okay, please confirm that you'd like a standard car from Salesforce Transit Center from 11 am March 8th until March 9th.",CONFIRM,,
121_00071,USER,"Yes, that's perfect.",AFFIRM,,
121_00071,SYSTEM,It has been done.,NOTIFY_SUCCESS,,
121_00071,USER,Thanks so much.,THANK_YOU,,
121_00071,SYSTEM,Is there anything else?,REQ_MORE,,
121_00071,USER,Can you find me a hotel around there? I need a pet-friendly place.,INFORM,INFORM_INTENT,
121_00071,SYSTEM,"Sure, I found 10 hotels. How about the 4.4 rated Argonaut Hotel?",OFFER,,INFORM_COUNT
121_00071,USER,How can I contact them?,REQUEST,,
121_00071,SYSTEM,You can call them on +1 415-563-0800.,INFORM,,
121_00071,USER,"That's fantastic, thanks.",SELECT,,
121_00071,SYSTEM,Should I reserve the hotel for you?,OFFER_INTENT,,
121_00071,USER,"No thanks, I don't need it.",NEGATE_INTENT,,
121_00071,SYSTEM,"Okay, is there anything else?",REQ_MORE,,
121_00071,USER,"No thanks, that's all.",NEGATE,THANK_YOU,
121_00071,SYSTEM,"Okay, see you.",GOODBYE,,
121_00072,USER,I'll need to pick up a rental car soon and I'm looking for options.,INFORM_INTENT,,
121_00072,SYSTEM,When and where do you need it from?,REQUEST,,
121_00072,USER,I'll need to get a car from around this evening 5 until next Wednesday from Sacramento somewhere.,INFORM,,
121_00072,SYSTEM,How long do you need this car?,REQUEST,,
121_00072,USER,I'll need one until March 8th.,INFORM,,
121_00072,SYSTEM,I've found 5 results that may suit your needs. There's a nice one at SMF International Airport available on March 6th. It's a Standard rental of a Honda Accord.,OFFER,,
121_00072,USER,Okay. Do you have anything else like a Compact car that you see available?,INFORM,REQUEST_ALTS,
121_00072,SYSTEM,Sure. I've found 5 others that you may like. The first is another car at SMF International Airport that's available from March 6th. It's a Compact car called a Chevy Bolt.,OFFER,,
121_00072,USER,That's okay. Can you find something else?,REQUEST_ALTS,,
121_00072,SYSTEM,Another great car is available at Sacramento Valley Station on March 6th. It's a Compact car called a Mini Cooper.,OFFER,,
121_00072,USER,"Oh, I like that. Can you book it?",INFORM_INTENT,SELECT,
121_00072,SYSTEM,Sure. Let me confirm. You want a Compact car from Sacramento Valley Station from March 6th at 5 pm to March 8th. Is that correct?,CONFIRM,,
121_00072,USER,Yes. That's perfect. What does it cost?,REQUEST,AFFIRM,
121_00072,SYSTEM,I've reserved the car for you. It only costs $42.,INFORM,NOTIFY_SUCCESS,
121_00072,USER,Thank you for the help. I also need a hotel around there.,THANK_YOU,,
121_00072,SYSTEM,There's 10 results for hotels around there. The first result is Best Western Plus Sutter House and it has a star rating of 4.3.,OFFER,,INFORM_COUNT
121_00072,USER,Where is it located and what is the phone number?,REQUEST,,
121_00072,SYSTEM,The street address is 1100 H Street and the number is +1 916-441-1314.,INFORM,,
121_00072,USER,Is there anything else? I just want to book 1 room.,INFORM,REQUEST_ALTS,
121_00072,SYSTEM,I have 9 results for hotels. I'm seeing the Courtyard By Marriott Sacramento Midtown with a star rating of 4.1. Does that interest you?,OFFER,,INFORM_COUNT
121_00072,USER,"That sounds good, but I'm fine for now. Thanks.",SELECT,GOODBYE,
121_00072,SYSTEM,Okay. Have a great day!,GOODBYE,,
121_00073,USER,I am looking for a large rental car,INFORM,INFORM_INTENT,
121_00073,SYSTEM,Till What day and and what time you need the car?,REQUEST,,
121_00073,USER,I want it till 11th of March and want to pick it around morning 10:30,INFORM,,
121_00073,SYSTEM,When do you need the car and where do you want to pick it from?,REQUEST,,
121_00073,USER,I wanted to pick up the car from Philadelphia on March 1st and need till Saturday this week,INFORM,,
121_00073,SYSTEM,I have selected 4 cars of your liking and one among them is available at Intercity terminal for pickup on March 1st and it is a Full-size Cherokee car,OFFER,,
121_00073,USER,That is okay,SELECT,,
121_00073,SYSTEM,You need to do car booking?,OFFER_INTENT,,
121_00073,USER,"yes, i need to rent a car",AFFIRM_INTENT,,
121_00073,SYSTEM,Please give confirmation details: You are picking it up from Intercity Terminal on March 1st at 10:30 am and drop off date is March 2nd and it's a Full-size car,CONFIRM,,
121_00073,USER,Perfect and how much it costs?,REQUEST,AFFIRM,
121_00073,SYSTEM,Car is booked and it costs total $39,INFORM,NOTIFY_SUCCESS,
121_00073,USER,Thanks and i need to book 1 room in the hotel there,THANK_YOU,,
121_00073,SYSTEM,What is your opinion on Aka University City with rating 4.6?,OFFER,,
121_00073,USER,Can i know their address and do they allow pets?,REQUEST,,
121_00073,SYSTEM,Their address is Cira Centre South 2929 Walnut Street and the don't allow pets,INFORM,,
121_00073,USER,That is fine,SELECT,GOODBYE,
121_00073,SYSTEM,Have a nice day,GOODBYE,,
121_00074,USER,I need some help finding a rental car?,INFORM_INTENT,,
121_00074,SYSTEM,What date would you like to return the car?,REQUEST,,
121_00074,USER,I will need the car until the 11th of this month.,INFORM,,
121_00074,SYSTEM,What location would you like to pick it up from?,REQUEST,,
121_00074,USER,"I want to rent the car in Seattle, WA, and I would like a standard size car.",INFORM,,
121_00074,SYSTEM,What time will you want to pick it up?,REQUEST,,
121_00074,USER,I'd like to pick it up around afternoon 3.,INFORM,,
121_00074,SYSTEM,What date would you like to pick it up?,REQUEST,,
121_00074,USER,I'll need to pick it up on March 7th.,INFORM,,
121_00074,SYSTEM,I found 5 cars you might like. How about a standard size Honda Civic? There is one available at Seattle-Tacoma International Airport on March 7th.,OFFER,,
121_00074,USER,What would the cost for that be?,REQUEST,,
121_00074,SYSTEM,The total cost for that reservation would be $172.,INFORM,,
121_00074,USER,Are there any other cars available?,REQUEST_ALTS,,
121_00074,SYSTEM,"Yes, there is also a standard size Hyundai Elantra available at King Street Station on March 7th.",OFFER,,
121_00074,USER,"Okay, that one sound good to me.",SELECT,,
121_00074,SYSTEM,Would you like to reserve that car now?,OFFER_INTENT,,
121_00074,USER,"Yeah, I'd like to rent that one.",AFFIRM_INTENT,,
121_00074,SYSTEM,"Alright, so you'd like to rent a standard size car from King Street Station, picking it up at 3 pm on March 7th, and returning it on March 11th. Is that correct?",CONFIRM,,
121_00074,USER,Yeah that all sounds good.,AFFIRM,,
121_00074,SYSTEM,Your reservation was successful.,NOTIFY_SUCCESS,,
121_00074,USER,Thanks! I'd also like to search for a hotel in the area.,THANK_YOU,,
121_00074,SYSTEM,I found 10 hotels you might be interested in. How about the Ace Hotel Seattle? It has a 4.5 rating.,OFFER,,INFORM_COUNT
121_00074,USER,What is their phone number? Are pets allowed there?,REQUEST,,
121_00074,SYSTEM,"Their phone number is +1 206-448-4721. Yes, pets are welcome.",INFORM,,
121_00074,USER,Perfect! That's all I needed right now.,SELECT,GOODBYE,
121_00074,SYSTEM,Have a wonderful day!,GOODBYE,,
121_00075,USER,I'd like to book a rental car for collection on the 13th at 6:30 pm.,INFORM,,INFORM_INTENT
121_00075,SYSTEM,Where would you like to collect the car from. How long do you need it for?,REQUEST,,
121_00075,USER,"I'd like to collect it from Long Beach, CA and need it until the 14th of March.",INFORM,,
121_00075,SYSTEM,There are 3 cars available. There is a nice Cruze which is a standard car and is available for collection at Downtown Station on March 13th.,OFFER,,
121_00075,USER,How much will the rental cost?,REQUEST,,
121_00075,SYSTEM,It will cost $34 in total.,INFORM,,
121_00075,USER,"Perfect, many thanks.",SELECT,,
121_00075,SYSTEM,Would you like to reserve this car.,OFFER_INTENT,,
121_00075,USER,Yes please go ahead and make the booking.,AFFIRM_INTENT,,
121_00075,SYSTEM,Okay sure. To confirm: You would like to book a standard car and will collect it from Downtown Station on March 13th at 6:30 pm. You need the car until March 14th.,CONFIRM,,
121_00075,USER,Yes that's correct.,AFFIRM,,
121_00075,SYSTEM,Your car has been booked.,NOTIFY_SUCCESS,,
121_00075,USER,Thanks for your help. I'd like to find a hotel to stay in while I'm there.,THANK_YOU,,
121_00075,SYSTEM,How about the Best Western Of Long Beach. It has a rating of 3.9.,OFFER,,
121_00075,USER,I'd like something else please. I need a pet friendly place with 2 rooms available.,INFORM,,REQUEST_ALTS
121_00075,SYSTEM,There are 2 hotels that meet your criteria. How about the Residence Inn By Marriott Long Beach? It has a rating of 4.3.,OFFER,,INFORM_COUNT
121_00075,USER,"Perfect, thanks for your help.",SELECT,,
121_00075,SYSTEM,Would you like to make a reservation now?,OFFER_INTENT,,
121_00075,USER,Not right now thanks.,NEGATE_INTENT,,
121_00075,SYSTEM,Do you need anything else?,REQ_MORE,,
121_00075,USER,"No, I'm good thanks.",NEGATE,THANK_YOU,
121_00075,SYSTEM,Enjoy your day.,GOODBYE,,
121_00076,USER,Can you help me find a rental car?,INFORM_INTENT,,
121_00076,SYSTEM,"Okay, where will you be picking up the rental car?",REQUEST,,
121_00076,USER,I'll be picking up in Long Beach.,INFORM,,
121_00076,SYSTEM,"Okay, I'll need to know your date of pickup and drop off and your pick up time.",REQUEST,,
121_00076,USER,I'll pick up at 5 pm on the 4th of March and drop off on the 10th.,INFORM,,
121_00076,SYSTEM,I have 5 cars that may work for you. There's a standard Accord available for pickup at LGB Airport on March 4th.,OFFER,,
121_00076,USER,"Cool, how much in total?",REQUEST,,
121_00076,SYSTEM,$204 in total.,INFORM,,
121_00076,USER,Let's reserve this one.,INFORM_INTENT,SELECT,
121_00076,SYSTEM,"Okay, one moment, please confirm first that you'd like to reserve a standard car for pickup at LGB Airport on March 4th at 5 pm with a drop off on March 10th.",CONFIRM,,
121_00076,USER,Yes that works.,AFFIRM,,
121_00076,SYSTEM,I've completed your reservation.,NOTIFY_SUCCESS,,
121_00076,USER,"Thanks, can you also help with finding me a hotel nearby?",THANK_YOU,,
121_00076,SYSTEM,I found 10 that may work. There's Best Western of Long Beach which has a rating of 3.9.,OFFER,,INFORM_COUNT
121_00076,USER,"That's great, thanks.",SELECT,,
121_00076,SYSTEM,Should I book you a room?,OFFER_INTENT,,
121_00076,USER,"No, not yet. I'll keep looking. That's all for now.",NEGATE_INTENT,GOODBYE,
121_00076,SYSTEM,Have a good one.,GOODBYE,,
121_00077,USER,"I need to rent a Full-size car. I want to pick it up at 8 o""clock in the night and will need it until the 8th of March.",INFORM,,
121_00077,SYSTEM,What location do you want to pick it up at?,REQUEST,,
121_00077,USER,I want to pick it up in Washington on next Monday.,INFORM,,
