dialogue_id,speaker,turn,act_1,act_2,act_3
73_00086,USER,I'm looking for something to do in NY.,INFORM,INFORM_INTENT,
73_00086,SYSTEM,What are you interested in.,REQUEST,,
73_00086,USER,I've heard good things about Squeeze.,INFORM,,
73_00086,SYSTEM,Squeeze will be at Pier 17 on March 1st.,OFFER,,
73_00086,USER,Are there other dates?,REQUEST_ALTS,,
73_00086,SYSTEM,Squeeze will also be at Pier 17 on March 2nd.,OFFER,,
73_00086,USER,"What about events in Vancouver, BC. I'd like to see the Whitecaps vs Colorado Rapids.",INFORM,,REQUEST_ALTS
73_00086,SYSTEM,There will be a Whitecaps vs Colorado Rapids on March 4th at BC Place.,OFFER,,
73_00086,USER,That sounds good.,SELECT,,
73_00086,SYSTEM,Would you like to order tickets?,OFFER_INTENT,,
73_00086,USER,Not just yet. Can you find me a bus to get there?,NEGATE_INTENT,,
73_00086,SYSTEM,Did you want to leave on March 4th? Where are you leaving from.,REQUEST,,
73_00086,USER,"I'm leaving from Seattle, WA. March 4th is good.",INFORM,AFFIRM,
73_00086,SYSTEM,I found a bus leaving at 6:40 am with an economy ticket for $26.,OFFER,,
73_00086,USER,What other buses are available. Any kind of tickets are fine. I'll need 4.,INFORM,,REQUEST_ALTS
73_00086,SYSTEM,There's another one leaving at 7:40 am. The economy tickets are $24.,OFFER,,
73_00086,USER,Where does it leave from and where will it arrive?,REQUEST,,
73_00086,SYSTEM,You'll leave from King Street Station and arrive at Pacific Central Station.,INFORM,,
73_00086,USER,"That works. I also need to find a hotel, just one room.",SELECT,,
73_00086,SYSTEM,I found 10 hotels. There's the Atrium Inn Vancouver which is a nice 3 star hotel.,OFFER,,INFORM_COUNT
73_00086,USER,What's the address? Is there wifi there?,REQUEST,,
73_00086,SYSTEM,2889 East Hastings Street. It does not have wifi.,INFORM,,
73_00086,USER,What's another option.,REQUEST_ALTS,,
73_00086,SYSTEM,There's Auberge Vancouver Hotel which is a nice 4 star hotel.,OFFER,,
73_00086,USER,That will work. I'd like to get two tickets to the game.,INFORM,INFORM_INTENT,
73_00086,SYSTEM,You want 2 tickets to the Whitecaps vs Colorado Rapids on March 4th in Vancouver. Is that correct?,CONFIRM,,
73_00086,USER,Yes it is.,AFFIRM,,
73_00086,SYSTEM,Your tickets are confirmed. Enjoy the game!,NOTIFY_SUCCESS,,
73_00086,USER,Thank you so much.,THANK_YOU,,
73_00086,SYSTEM,Is there anything else you need?,REQ_MORE,,
73_00086,USER,No. That's all for now.,NEGATE,THANK_YOU,
73_00086,SYSTEM,Have a wonderful day.,GOODBYE,,
73_00087,USER,I wish to find dates for events.,INFORM_INTENT,,
73_00087,SYSTEM,In which city shall I search in? Which event you are interested in?,REQUEST,,
73_00087,USER,"I know that, Hozier is really nice. I want something in SD.",INFORM,,
73_00087,SYSTEM,I searched and found event on 3 days. The event Hozier at Cal Coast Credit Union Amphitheater will be on March 4th.,OFFER,,
73_00087,USER,What about events on some other dates?,REQUEST_ALTS,,
73_00087,SYSTEM,The event Hozier at Cal Coast Credit Union Amphitheater will be on March 5th.,OFFER,,
73_00087,USER,What about events on some other dates?,REQUEST_ALTS,,
73_00087,SYSTEM,The event Hozier at Cal Coast Credit Union Amphitheater will be on March 12th.,OFFER,,
73_00087,USER,It is good.,SELECT,,
73_00087,SYSTEM,Shall I book tickets for this event?,OFFER_INTENT,,
73_00087,USER,It can be done late.,NEGATE_INTENT,,
73_00087,SYSTEM,Do you need any other help?,REQ_MORE,,
73_00087,USER,What about a bus going there on March 10th?,INFORM,INFORM_INTENT,
73_00087,SYSTEM,From which place will you leave?,REQUEST,,
73_00087,USER,"I am moving from Long Beach, CA.",INFORM,,
73_00087,SYSTEM,What about a Economy ticket bus starting at 7 am? The cost of the ticket is $25.,OFFER,,
73_00087,USER,What is the name of the bus starting station?,REQUEST,,
73_00087,SYSTEM,The starting station is Downtown Station,INFORM,,
73_00087,USER,Is there any other buses available?,REQUEST_ALTS,,
73_00087,SYSTEM,What about a Economy ticket bus starting at 8:40 am? The cost of the ticket is $25.,OFFER,,
73_00087,USER,What is the name of the bus reaching station and starting station?,REQUEST,,
73_00087,SYSTEM,The starting station is Downtown Station and the reaching station is Santa Fe Depot.,INFORM,,
73_00087,USER,Is there any other buses available?,REQUEST_ALTS,,
73_00087,SYSTEM,What about a Economy ticket bus starting at 10:30 am? The cost of the ticket is $24.,OFFER,,
73_00087,USER,It is good. I wish to search a room in a hotel with wifi connection.,SELECT,,
73_00087,SYSTEM,Bahia Resort Hotel is a great hotel with 3 star.,OFFER,,
73_00087,USER,What is the cost per night?,REQUEST,,
73_00087,SYSTEM,The cost of the room is $96 per night.,INFORM,,
73_00087,USER,It is good. I wish to get back to book the tickets for the event. I need 4 tickets.,INFORM,INFORM_INTENT,
73_00087,SYSTEM,"Kindly ensure that, on March 12th, 4 tickets have been booked for the event Hozier at San Diego.",CONFIRM,,
73_00087,USER,It is good for me. What is the starting time of the event and where it is located?,REQUEST,,AFFIRM
73_00087,SYSTEM,Your booking is done. Have a nice time there. The venue start at 6:30 pm and it is located at 5500 Campanile Drive.,INFORM,,NOTIFY_SUCCESS
73_00087,USER,Thank you so much for your help. That is what I want.,THANK_YOU,GOODBYE,
73_00087,SYSTEM,Have a fantastic day.,GOODBYE,,
73_00088,USER,I'd like an event: Mariners Vs Blue Jays,INFORM,INFORM_INTENT,
73_00088,SYSTEM,In which city?,REQUEST,,
73_00088,USER,I'd like to find it in Seattle,INFORM,,
73_00088,SYSTEM,There's the event on 6 days. On March 1st Mariners Vs Blue Jays is at T-Mobile Park,OFFER,,
73_00088,USER,Is there the event on other dates?,REQUEST_ALTS,,
73_00088,SYSTEM,"Yes, there's Mariners Vs Blue Jays on March 2nd at T-Mobile Park",OFFER,,
73_00088,USER,"Yes, this date is good!",SELECT,,
73_00088,SYSTEM,Do you want to book it now?,OFFER_INTENT,,
73_00088,USER,Not now. I need a bus to go there,NEGATE_INTENT,,
73_00088,SYSTEM,Do you want to depart on March 2nd? From which city?,REQUEST,,
73_00088,USER,"No, I leave on later today, from Vancouver",INFORM,,
73_00088,SYSTEM,I found a bus at 6:40 am. The Economy ticket costs $30,OFFER,,
73_00088,USER,Which station does it start from?,REQUEST,,
73_00088,SYSTEM,It starts from Pacific Central Station,INFORM,,
73_00088,USER,What's the station of destination?,REQUEST,,
73_00088,SYSTEM,The bus reaches King Street Station,INFORM,,
73_00088,USER,"Ok, It's good for me!",SELECT,,
73_00088,SYSTEM,Do you want to reserve tickets?,OFFER_INTENT,,
73_00088,USER,"Not now, thanks",NEGATE_INTENT,,
73_00088,SYSTEM,Do you need anything else?,REQ_MORE,,
73_00088,USER,"Yes, please. I need a four star hotel there. I am looking for a hotel with wifi",INFORM,,INFORM_INTENT
73_00088,SYSTEM,There's a 4 star hotel for you: Crowne Plaza Seattle Downtown,OFFER,,
73_00088,USER,"Yes, It's good!",SELECT,,
73_00088,SYSTEM,Do you want to book here?,OFFER_INTENT,,
73_00088,USER,"Maybe later, thanks",NEGATE_INTENT,,
73_00088,SYSTEM,Can I do anything else for you?,REQ_MORE,,
73_00088,USER,"Yes, I want to book tickets for the event",INFORM_INTENT,,
73_00088,SYSTEM,How many tickets do I have to book?,REQUEST,,
73_00088,USER,I need four tickets,INFORM,,
73_00088,SYSTEM,4 tickets for Mariners Vs Blue Jays in Seattle on March 2nd. Is it correct?,CONFIRM,,
73_00088,USER,"Yes, It's correct",AFFIRM,,
73_00088,SYSTEM,Your tickets are booked! Have a good time there!,NOTIFY_SUCCESS,,
73_00088,USER,Thank you so much. That's all for today,THANK_YOU,GOODBYE,
73_00088,SYSTEM,Have a nice day!,GOODBYE,,
73_00089,USER,Help me look for dates for events?,INFORM_INTENT,,
73_00089,SYSTEM,What city is the event in? And do you have an event in mind?,REQUEST,,
73_00089,USER,The city should be Los Angeles. I was thinking of Usc Vs Oregon. Lots of people have been recommending it.,INFORM,,
73_00089,SYSTEM,There's Usc Vs Oregon at LA Memorial Coliseum on March 7th.,OFFER,,
73_00089,USER,What's the address of that?,REQUEST,,
73_00089,SYSTEM,The address is 3911 Figueroa Street.,INFORM,,
73_00089,USER,And what time does it begin.,REQUEST,,
73_00089,SYSTEM,It begins at 6 pm.,INFORM,,
73_00089,USER,"Nice, that works for me.",SELECT,,
73_00089,SYSTEM,Would you like to purchase tickets?,OFFER_INTENT,,
73_00089,USER,I'll do that later.,NEGATE_INTENT,,
73_00089,SYSTEM,What else can I do for you?,REQ_MORE,,
73_00089,USER,Let's look for buses to get there.,INFORM_INTENT,,
73_00089,SYSTEM,When is your departure? Will it be March 7th? And where will you depart from?,REQUEST,,
73_00089,USER,I'm departing from SFO. And I want to depart next Tuesday.,INFORM,,
73_00089,SYSTEM,There's a bus that leaves at 7 am. And Economy ticket is $45.,OFFER,,
73_00089,USER,"Okay, that works. Now let's find a hotel there.",SELECT,,
73_00089,SYSTEM,Ac Hotel By Marriott Beverly Hills is a nice 2 star hotel.,OFFER,,
73_00089,USER,Can you give me their phone number?,REQUEST,,
73_00089,SYSTEM,You can call them at +1 323-852-7000.,INFORM,,
73_00089,USER,"Where's it located specifically, and what's the cost for a night?",REQUEST,,
73_00089,SYSTEM,It's located at 6399 Wilshire Boulevard and the cost for a night is $156.,INFORM,,
73_00089,USER,"Okay, that works. Let's get back to that event, I want to get 3 tickets.",INFORM,INFORM_INTENT,
73_00089,SYSTEM,You want 3 tickets to Usc Vs Oregon in Los Angeles on March 7th. Is that correct?,CONFIRM,,
73_00089,USER,"No, just get 2 tickets.",INFORM,NEGATE,
73_00089,SYSTEM,So 2 tickets for Usc Vs Oregon?,CONFIRM,,
73_00089,USER,"Yeah, that's right.",AFFIRM,,
73_00089,SYSTEM,I've purchased your tickets. Have fun at the game!,NOTIFY_SUCCESS,,
73_00089,USER,Thanks so much. I don't need anything else.,THANK_YOU,GOODBYE,
73_00089,SYSTEM,Have a terrific day.,GOODBYE,,
73_00090,USER,Hello! Nancy here! do you have any upcoming events?,INFORM_INTENT,,
73_00090,SYSTEM,In which city are you looking in?,REQUEST,,
73_00090,USER,Might be something in NY.,INFORM,,
73_00090,SYSTEM,Which event interests you more?,REQUEST,,
73_00090,USER,I think Mets Vs Pirates event is a good one and that's what I heard.,INFORM,,
73_00090,SYSTEM,Okay... lemme check... This event Mets Vs Pirates is happening for 7 days starting from March 5th in Citi Field.,OFFER,,
73_00090,USER,Sounds great to me.,SELECT,,
73_00090,SYSTEM,Do you wish to book tickets for this event?,OFFER_INTENT,,
73_00090,USER,"Not, right now. Do you have any bus transportation to reach there?",NEGATE_INTENT,,
73_00090,SYSTEM,When are you going to depart? Do you have any plan to leave on March 5th?,REQUEST,,
73_00090,USER,I've a plan to leave by 3rd of March.,INFORM,,
73_00090,SYSTEM,From where are you going to start?,REQUEST,,
73_00090,USER,I'll be starting from Philadelphia.,INFORM,,
73_00090,SYSTEM,Okay! there are 8 buses going to Philadelphia and the bust leaving at 8:30 am has an economy ticket and the ticket price will be around $21.,OFFER,,
73_00090,USER,Cool.. do you have tickets for this bus?,SELECT,,
73_00090,SYSTEM,"So, do you wish to book tickets in this bus?",OFFER_INTENT,,
73_00090,USER,"Nope, not right now.",NEGATE_INTENT,,
73_00090,SYSTEM,Do you have anything to be helped on?,REQ_MORE,,
73_00090,USER,"yup, Please can you find a room in a good hotel there?",INFORM_INTENT,,
73_00090,SYSTEM,"Okay! 10 hotels matching your requirement is available. The 4 star hotel, 1 Hotel Brooklyn Bridge has a good rating and do you wish to stay here.",OFFER,,INFORM_COUNT
73_00090,USER,Do they have contact number? Where is it located?,REQUEST,,
73_00090,SYSTEM,"It's located at 60 Furman Street, Brooklyn and they are reachable at +1 833-625-6111.",INFORM,,
73_00090,USER,Do you have any other hotels of my choice?,REQUEST_ALTS,,
73_00090,SYSTEM,"Yup, there is a 5 star hotel with a good rating and it is 1 Hotel Central Park.",OFFER,,
73_00090,USER,"Yup, sounds great to me.",SELECT,,
73_00090,SYSTEM,Do you wish to book a room at this hotel?,OFFER_INTENT,,
73_00090,USER,"Nope, I don't wish to reserve right now.",NEGATE_INTENT,,
73_00090,SYSTEM,Do you need any other help?,REQ_MORE,,
73_00090,USER,Please can you help me to book tickets for the event for i wish to have 1 ticket?,INFORM,INFORM_INTENT,
73_00090,SYSTEM,"Sure. Please can you confirm me that you wish to book 1 ticekt for the event Mets Vs Pirates on March 5th that is going to take place in New York, right?",CONFIRM,,
73_00090,USER,"Nope, I'm looking for three tickets.",INFORM,NEGATE,
73_00090,SYSTEM,"Please can you confirm me that you wish to book 3 tickets for the event that is going to take place on March 5th, right?",CONFIRM,,
73_00090,USER,"Yup, you're correct.",AFFIRM,,
73_00090,SYSTEM,Okay! I've made your reservation. Have a great time there?,NOTIFY_SUCCESS,,
73_00090,USER,Where is the event happening?,REQUEST,,
73_00090,SYSTEM,It's happening at 123-01 Roosevelt Avenue.,INFORM,,
73_00090,USER,Thanks much for your help.,THANK_YOU,,
73_00090,SYSTEM,Do you want me to help you with anything else?,REQ_MORE,,
73_00090,USER,"Nope, thanks much for the help.",NEGATE,THANK_YOU,
73_00090,SYSTEM,Have a wonderful day.,GOODBYE,,
73_00091,USER,"Hi, I'd like to find some event dates.",INFORM_INTENT,,
73_00091,SYSTEM,"Okay, what city do you want to look in, and do you have any particular events in mind already?",REQUEST,,
73_00091,USER,"I need something in LAX, and USC vs Utah is supposed to be good.",INFORM,,
73_00091,SYSTEM,USC vs Utah is taking place on 4 days. One is on March 4th at LA Memorial Coliseum.,OFFER,,
73_00091,USER,That would be so much fun.,SELECT,,
73_00091,SYSTEM,Would you like me to get tickets for you?,OFFER_INTENT,,
73_00091,USER,"Not right now, but I need a bus going there from Fresno, CA.",NEGATE_INTENT,,
73_00091,SYSTEM,"When are you departing, would March 4th work?",REQUEST,,
73_00091,USER,"No, I want to leave on March 3rd.",INFORM,,
73_00091,SYSTEM,"Okay, there's an economy ticket for $33 on a bus leaving at 9 am.",OFFER,,
73_00091,USER,What station does it leave from and what station will it reach?,REQUEST,,
73_00091,SYSTEM,It leaves Fresno Station and arrives at Union Station.,INFORM,,
73_00091,USER,"Hm, are there any other options?",REQUEST_ALTS,,
73_00091,SYSTEM,"Yeah, there's another economy ticket for $45 on a bus that leaves at 9:50 am.",OFFER,,
73_00091,USER,That works for me. I also need to get a hotel room for my trip.,SELECT,,
73_00091,SYSTEM,"Sure, Ac Hotel by Marriott Beverly Hills is nice and has a rating of 2 stars.",OFFER,,
73_00091,USER,"Yeah, that would be good.",SELECT,,
73_00091,SYSTEM,Should I book you a room?,OFFER_INTENT,,
73_00091,USER,"No thanks, I don't need to.",NEGATE_INTENT,,
73_00091,SYSTEM,Any other help you need?,REQ_MORE,,
73_00091,USER,I'd like to book three tickets to the event we talked about.,INFORM,INFORM_INTENT,
73_00091,SYSTEM,"Alright, confirming 3 tickets to USC vs Utah on March 4th in Los Angeles.",CONFIRM,,
73_00091,USER,"Yep, that's exactly right.",AFFIRM,,
73_00091,SYSTEM,"The reservation was successful, hope it's a fun game!",NOTIFY_SUCCESS,,
73_00091,USER,"Thanks, where is the venue and what time does the game start?",REQUEST,,
73_00091,SYSTEM,The venue is at 3911 Figueroa Street and it starts at 7 pm.,INFORM,,
73_00091,USER,"Thanks so much for helping, that's all for now.",THANK_YOU,GOODBYE,
73_00091,SYSTEM,Have a wonderful day.,GOODBYE,,
73_00092,USER,Can you help me finding the dates for events?,INFORM_INTENT,,
73_00092,SYSTEM,What is your preferred event and the city for the event?,REQUEST,,
73_00092,USER,Some of my friend says Girl in Red is very good. And my preferred city is Philadelphia.,INFORM,,
73_00092,SYSTEM,The event Girl in red is taking place on March 1st at The Foundry.,OFFER,,
73_00092,USER,Can you find me the timing and the address of the venue for the event?,REQUEST,,
73_00092,SYSTEM,The address of the venue is 29 East Allen Street 2nd Floor and the event starts at 7:30 pm.,INFORM,,
73_00092,USER,Can you check for the events on another dates?,REQUEST_ALTS,,
73_00092,SYSTEM,The event Girl in red is taking place on March 2nd at The Foundry.,OFFER,,
73_00092,USER,"Okay, That sounds good to me.",SELECT,,
73_00092,SYSTEM,Would you like me to tickets for the event?,OFFER_INTENT,,
73_00092,USER,Maybe some other time.,NEGATE_INTENT,,
73_00092,SYSTEM,Is there anything else I can help you with?,REQ_MORE,,
73_00092,USER,Can you find me a bus going there?,INFORM_INTENT,,
73_00092,SYSTEM,What will be your boarding point?,REQUEST,,
73_00092,USER,I would like to board from New York City.,INFORM,,
73_00092,SYSTEM,Should I put the date of departure as March 2nd?,REQUEST,,
73_00092,USER,"Yes, That sounds good to me.",AFFIRM,,
73_00092,SYSTEM,There are 7 buses that you may want to travel with. What do think of Economy tickets in a bus leaving at 7:40 am with the ticket price of $24.,OFFER,,
73_00092,USER,Find me the name of the boarding point and the destination?,REQUEST,,
73_00092,SYSTEM,The boarding point is Port Authority Station and the destination is Intercity Terminal.,INFORM,,
73_00092,USER,Can you find me Economy extra tickets in any other buses?,INFORM,REQUEST_ALTS,
73_00092,SYSTEM,What do you think of Economy extra tickets in a bus which leaves at 8 am and the ticket costs $34?,OFFER,,
73_00092,USER,"Okay, That sounds good to me.",SELECT,,
73_00092,SYSTEM,Would you like me to buy the tickets for you?,OFFER_INTENT,,
73_00092,USER,"No, Don't buy tickets now. Can you find me a room in a hotel there?",NEGATE_INTENT,,
73_00092,SYSTEM,There are 10 hotels suitable to you. One is a 3 star hotel called Aka University City.,OFFER,,INFORM_COUNT
73_00092,USER,Can you search for any other hotel that might interest me?,REQUEST_ALTS,,
73_00092,SYSTEM,There is a nice 3 star hotel called Aloft Philadelphia Airport.,OFFER,,
73_00092,USER,Can you find me the contact number?,REQUEST,,
73_00092,SYSTEM,The contact number is +1 267-298-1700.,INFORM,,
73_00092,USER,And what is the address of the hotel?,REQUEST,,
73_00092,SYSTEM,The address of the hotel is 4301 Island Avenue.,INFORM,,
73_00092,USER,"Okay, That sounds good to me.",SELECT,,
73_00092,SYSTEM,Do you want me to reserve a room for you?,OFFER_INTENT,,
73_00092,USER,"No, Don't reserve a room now.",NEGATE_INTENT,,
73_00092,SYSTEM,Is there anything else I can help you with?,REQ_MORE,,
73_00092,USER,Can you please get back to booking the tickets for the event?,INFORM_INTENT,,
73_00092,SYSTEM,Can you confirm the number of tickets you want?,REQUEST,,
73_00092,USER,Book one ticket for mr.,INFORM,,
73_00092,SYSTEM,Please confirm: You want me to book 1 ticket for the event Girl in Red taking place on March 2nd at Philadelphia.,CONFIRM,,
73_00092,USER,"Yes, That sounds good to me. Can you find me the address of the venue and the timing for the event?",REQUEST,,AFFIRM
73_00092,SYSTEM,I have successfully made your reservation. The address of the venue is 29 East Allen Street 2nd Floor and it starts at 7 pm.,INFORM,,NOTIFY_SUCCESS
73_00092,USER,Thank you very much!,THANK_YOU,,
73_00092,SYSTEM,Is there anything else I can help you with?,REQ_MORE,,
73_00092,USER,No. That will be all. Thank you!,NEGATE,THANK_YOU,
73_00092,SYSTEM,I ma glad I could help. Have a great day!,GOODBYE,,
73_00093,USER,Will you find events in Los Angeles?,INFORM,INFORM_INTENT,
73_00093,SYSTEM,Any preference?,REQUEST,,
73_00093,USER,Sparks Vs Mystics.,INFORM,,
73_00093,SYSTEM,I found 8. Sparks Vs Mystics is at Staples Center on March 5th.,OFFER,,
73_00093,USER,Anything else? Greta Van Fleet in SD?,INFORM,,REQUEST_ALTS
73_00093,SYSTEM,Greta Van Fleet is at Cal Coast Credit Union Amphitheater on March 4th.,OFFER,,
73_00093,USER,Great. Will you find a bus for two going there?,SELECT,,
73_00093,SYSTEM,Departing March 4th from where?,REQUEST,,
73_00093,USER,"Leave Sacramento, CA this Sunday.",INFORM,,
73_00093,SYSTEM,I found 8. Economy ticket on a bus that departs at 10:20 am costs $77.,OFFER,,
73_00093,USER,Origin and destination stations?,REQUEST,,
73_00093,SYSTEM,Bus leaves Sacramento Valley Station to arrive at Santa Fe Depot.,INFORM,,
73_00093,USER,Fantastic. Will you find one room at a two star hotel with wifi?,SELECT,,
73_00093,SYSTEM,I found 10. Bahia Resort Hotel is a 2 star hotel.,OFFER,,INFORM_COUNT
73_00093,USER,Address?,REQUEST,,
73_00093,SYSTEM,998 West Mission Bay Drive.,INFORM,,
73_00093,USER,Anything else? Will you find three rooms in a one star hotel?,INFORM,,REQUEST_ALTS
73_00093,SYSTEM,I found 9. Best Western Mission Bay is a 1 star hotel.,OFFER,,INFORM_COUNT
73_00093,USER,Anything else?,REQUEST_ALTS,,
73_00093,SYSTEM,Best Western Plus Bayside Inn is a 1 star hotel.,OFFER,,
73_00093,USER,Cost per night? Address?,REQUEST,,
73_00093,SYSTEM,555 West Ash Street for $270 per night.,INFORM,,
73_00093,USER,Perfect.,SELECT,,
73_00093,SYSTEM,Reserve a room?,OFFER_INTENT,,
73_00093,USER,Not now.,NEGATE_INTENT,,
73_00093,SYSTEM,Anything else?,REQ_MORE,,
73_00093,USER,Will you reserve tickets for the event?,INFORM_INTENT,,
73_00093,SYSTEM,How many?,REQUEST,,
73_00093,USER,Three.,INFORM,,
73_00093,SYSTEM,Please confirm 3 tickets for Greta Van Fleet in San Diego on March 4th.,CONFIRM,,
73_00093,USER,Great. Location and start time?,REQUEST,,AFFIRM
73_00093,SYSTEM,5500 Campanile Drive at 7 pm. I've completed your reservation.,INFORM,,NOTIFY_SUCCESS
73_00093,USER,Thanks. That's all.,THANK_YOU,GOODBYE,
73_00093,SYSTEM,Have a wonderful day.,GOODBYE,,
73_00094,USER,"Hello, I am hoping you can help me find out when some events are happening. I am looking for something in Livermore.",INFORM,INFORM_INTENT,
73_00094,SYSTEM,"Hello, yes I can help you with that. What type of events are you interested in?",REQUEST,,
73_00094,USER,I am a fan of baseball and heard the Angels vs White Sox game is coming up. I am hoping to find an event in Anaheim.,INFORM,,
73_00094,SYSTEM,I have found 5 dates related to your search. There is an Angels vs White Sox game at the Angel Stadium of Anaheim on March 1st.,OFFER,,
73_00094,USER,Can you tell me other events? Are there any Angels vs Red Sox games happening soon?,INFORM,REQUEST_ALTS,
73_00094,SYSTEM,I have found 3 dates related to your search. There is an Angels vs Red Sox game on March 4th. It is also at the Angel Stadium of Anaheim.,OFFER,,
73_00094,USER,Are there any related games on other dates?,REQUEST_ALTS,,
73_00094,SYSTEM,There is an Angels vs Red Sox game at the Angel Stadium of Anaheim on March 11th.,OFFER,,
73_00094,USER,That sounds great. Would it be possible for you to help me book tickets for a bus to go there? I will need four economy tickets. I will be leaving from Los Angeles.,SELECT,,
73_00094,SYSTEM,What date are you planning on leaving? March 11th?,REQUEST,,
73_00094,USER,"Actually, I am hoping to leave on the 8th of March.",INFORM,,
73_00094,SYSTEM,I have found 10 buses that match your search. There is a bus leaving at 7 am on March 8th. The economy tickets are $13.,OFFER,,
73_00094,USER,What is the name of the bus station?,REQUEST,,
73_00094,SYSTEM,It will be Union Station.,INFORM,,
73_00094,USER,That sounds good.,SELECT,,
73_00094,SYSTEM,Would you like to buy tickets for this bus?,OFFER_INTENT,,
73_00094,USER,"No, not at this time. I was hoping you could help me find a hotel in that area. I am fine with a two star hotel as long as it has wifi. I will need 3 rooms.",NEGATE_INTENT,,
73_00094,SYSTEM,I have found 10 hotels that match your inquiry. Anaheim Desert Inn and Suites is a 2 star hotel close to the stadium.,OFFER,,INFORM_COUNT
73_00094,USER,"Yes, that works for me.",SELECT,,
73_00094,SYSTEM,Is there anything else I can help you with?,REQ_MORE,,
73_00094,USER,"Yes, I would like to purchase tickets for the game. I will need four tickets.",INFORM,INFORM_INTENT,
73_00094,SYSTEM,Please confirm: You would like 4 tickets for the Angels vs Red Sox game on March 11th taking place in Anaheim.,CONFIRM,,
73_00094,USER,"Actually, I will only need two tickets.",INFORM,NEGATE,
73_00094,SYSTEM,Please confirm changes: You would like 2 tickets for the Angels vs Red Sox game.,CONFIRM,,
73_00094,USER,"Yes, that is correct. What time does the game start?",REQUEST,AFFIRM,
73_00094,SYSTEM,Your tickets have been purchased. The game starts at 7 pm.,INFORM,NOTIFY_SUCCESS,
73_00094,USER,Thank you for your help today.,THANK_YOU,,
73_00094,SYSTEM,Is there anything else I can help you with?,REQ_MORE,,
73_00094,USER,"No, not at this time. Thank you.",NEGATE,THANK_YOU,
73_00094,SYSTEM,Have a great time at the game!,GOODBYE,,
73_00095,USER,i am looking for something to do in sd,INFORM,INFORM_INTENT,
73_00095,SYSTEM,what are you interested in,REQUEST,,
73_00095,USER,I hear that spose in la is pretty good,INFORM,,
73_00095,SYSTEM,i found spose in the next 4 days start on march 4th at 1720(tm),OFFER,,
73_00095,USER,when does it start,REQUEST,,
73_00095,SYSTEM,it start at 7 pm,INFORM,,
73_00095,USER,what is the address,REQUEST,,
73_00095,SYSTEM,their address is 1720 east 16th street,INFORM,,
73_00095,USER,"perfect, do they have bus going there",SELECT,,
73_00095,SYSTEM,where are you traveling from? are you traveling on march 4th,REQUEST,,
73_00095,USER,"I am traveling from fresno, ca on 3rd of march",INFORM,,
73_00095,SYSTEM,i found 9 buses. What about 9 am on an economy for $33,OFFER,,
73_00095,USER,what station will this arrive at,REQUEST,,
73_00095,SYSTEM,you will arrive at union station,INFORM,,
73_00095,USER,what station am i leaving from,REQUEST,,
73_00095,SYSTEM,you will travel from fresno station,INFORM,,
73_00095,USER,perfect. please also find me a 3 star hotel for 1 room,SELECT,,
73_00095,SYSTEM,what about airtel plaza hotel it is a 3 star hotel,OFFER,,
73_00095,USER,what is their address and how much do they cost,REQUEST,,
73_00095,SYSTEM,"they cost $75 a night and their address is 7277 valjean avenue, van nuys, california 91406, united states",INFORM,,
73_00095,USER,ok perfect,SELECT,,
73_00095,SYSTEM,would you like to book a room,OFFER_INTENT,,
73_00095,USER,"no, please go ahead and book 1 event ticket for me",INFORM,INFORM_INTENT,
