dialogue_id,speaker,turn,act_1,act_2,act_3
110_00095,USER,"Nope, thanks again.",NEGATE,THANK_YOU,
110_00095,SYSTEM,"No problem, have a good day.",GOODBYE,,
110_00096,USER,I'd like to make some event ticket reservations.,INFORM_INTENT,,
110_00096,SYSTEM,What sort of event were you interested in? How many tickets do you need?,REQUEST,,
110_00096,USER,I want 1 ticket to Electric Feels.,INFORM,,
110_00096,SYSTEM,What city do you want me to start searching in?,REQUEST,,
110_00096,USER,Find me a showing around San Francisco.,INFORM,,
110_00096,SYSTEM,Any preference on the date?,REQUEST,,
110_00096,USER,Let's shoot for the 14th.,INFORM,,
110_00096,SYSTEM,Okay. First let's go over the details. You want 1 ticket to Electric Feels in San Francisco. The show will be on March 14th.,CONFIRM,,
110_00096,USER,"Yes. That's perfect. What's the name of the venue? Also, when does it start?",REQUEST,,AFFIRM
110_00096,SYSTEM,I've purchased your ticket. Enjoy the show! It should start at 8 pm at August Hall.,INFORM,,NOTIFY_SUCCESS
110_00096,USER,I'd also like to find a restaurant nearby.,INFORM_INTENT,,
110_00096,SYSTEM,Did you have any particular food in mind?,REQUEST,,
110_00096,USER,"Yea, I think European food would be a great choice.",INFORM,,
110_00096,SYSTEM,There's a nice restaurant in San Francisco called Ayola.,OFFER,,
110_00096,USER,Let's keep looking. I want something a little costly that serves alcohol.,INFORM,,REQUEST_ALTS
110_00096,SYSTEM,In San Francisco there's also Bar Tartine.,OFFER,,
110_00096,USER,What else is there? I'm looking for a Light meal of some kind.,INFORM,REQUEST_ALTS,
110_00096,SYSTEM,I've found 5 restaurants in San Francisco which might work for you. How about Absinthe Brasserie & Bar?,OFFER,,INFORM_COUNT
110_00096,USER,Give me the address.,REQUEST,,
110_00096,SYSTEM,They're located at 398 Hayes Street.,INFORM,,
110_00096,USER,"Okay, that'll do.",SELECT,,
110_00096,SYSTEM,Do you want to reserve a table now?,OFFER_INTENT,,
110_00096,USER,"Yea, let's go ahead and do that.",AFFIRM_INTENT,,
110_00096,SYSTEM,When did you want to make the reservation?,REQUEST,,
110_00096,USER,Get a table at a quarter past 12 in the afternoon.,INFORM,,
110_00096,SYSTEM,"To be clear, you want a reservation for 1 at Absinthe Brasserie & Bar in San Francisco? You'll be arriving at 12:15 pm on March 14th.",CONFIRM,,
110_00096,USER,Yes. That's great. Do they have live music?,REQUEST,AFFIRM,
110_00096,SYSTEM,Sadly they do not have live music. I was also unable to make a reservation at that time. Would you like to change it to 12 pm instead? It would still be 1 person on March 14th at Absinthe Brasserie & Bar.,INFORM,OFFER,
110_00096,USER,No thanks.,NEGATE,,
110_00096,SYSTEM,Do you need anything else at the moment?,REQ_MORE,,
110_00096,USER,"No, I'm fine. Thanks.",NEGATE,THANK_YOU,
110_00096,SYSTEM,Enjoy the rest of your day.,GOODBYE,,
110_00097,USER,I want tickets for an event,INFORM_INTENT,,
110_00097,SYSTEM,How many tickets do you need?,REQUEST,,
110_00097,USER,I need three tickets,INFORM,,
110_00097,SYSTEM,For what date and in which city?,REQUEST,,
110_00097,USER,Around San Francisco on the 9th,INFORM,,
110_00097,SYSTEM,Do you already have a particular event in mind?,REQUEST,,
110_00097,USER,"Yes, I'd like Carmina Burana",INFORM,,
110_00097,SYSTEM,3 tickets for Carmina Burana in San Francisco on March 9th. Is it correct?,CONFIRM,,
110_00097,USER,"Yes, it's correct.",AFFIRM,,
110_00097,SYSTEM,I have booked tickets. Have fun!,NOTIFY_SUCCESS,,
110_00097,USER,Thanks a lot. I would like to book a restaurant,INFORM_INTENT,,
110_00097,SYSTEM,"Do you prefer an Indian, Italian or other restaurant?",REQUEST,,
110_00097,USER,"A Greek restaurant, please",INFORM,,
110_00097,SYSTEM,There is Ayola in San Francisco,OFFER,,
110_00097,USER,Do you have any other suggestions?,REQUEST_ALTS,,
110_00097,SYSTEM,Kokkari Estiatorio in San Francisco,OFFER,,
110_00097,USER,"Yes, that's ok for me. I want to make a reservation at 12:30 in the afternoon",INFORM,INFORM_INTENT,SELECT
110_00097,SYSTEM,A table for 3 people at Kokkari Estiatorio in San Francisco on March 9th at 12:30 pm. Do you confirm?,CONFIRM,,
110_00097,USER,"Yes, I confirm! Is it a very expensive restaurant?",REQUEST,AFFIRM,
110_00097,SYSTEM,"Yes, it's a very expensive restaurant. Your table has been booked",INFORM,NOTIFY_SUCCESS,
110_00097,USER,Thank you. It's all I need.,THANK_YOU,GOODBYE,
110_00097,SYSTEM,Have a great day,GOODBYE,,
110_00098,USER,I want to reserve 2 tickets at an event.,INFORM,INFORM_INTENT,
110_00098,SYSTEM,In what city do you prefer the event to be?,REQUEST,,
110_00098,USER,Any event around SF will be good.,INFORM,,
110_00098,SYSTEM,On what date you prefer to be?,REQUEST,,
110_00098,USER,On March 13th will be fine.,INFORM,,
110_00098,SYSTEM,You want any specific event?,REQUEST,,
110_00098,USER,Yes the event is Matt Corby.,INFORM,,
110_00098,SYSTEM,Book 2 tickets on March 13th in San Francisco for event Matt Corby.Is it ok for you?,CONFIRM,,
110_00098,USER,Yes is good but tell me where is taking place the event.,REQUEST,AFFIRM,
110_00098,SYSTEM,The reservation is made.Is taking place at August Hall.Have fun there!,INFORM,NOTIFY_SUCCESS,
110_00098,USER,Thanks.I want you to find me a not very costly priced restaurant.,INFORM,INFORM_INTENT,
110_00098,SYSTEM,What type of food do you prefer?,REQUEST,,
110_00098,USER,Some Sushi I would love.,INFORM,,
110_00098,SYSTEM,10 option I have for you.One is a nice restaurant called Atami Sushi Bar & Grill located in San Francisco.,OFFER,,INFORM_COUNT
110_00098,USER,Other option you have for me? Gastrobar kind of food will be nice.,INFORM,REQUEST_ALTS,
110_00098,SYSTEM,A nice restaurant located in San Francisco is B-side.,OFFER,,
110_00098,USER,Is live music available?,REQUEST,,
110_00098,SYSTEM,Live music is not available.,INFORM,,
110_00098,USER,Can you recommend me another?,REQUEST_ALTS,,
110_00098,SYSTEM,A nice restaurant in San Francisco is Balboa Cafe.,OFFER,,
110_00098,USER,I like it. Make a reservation here.,INFORM_INTENT,SELECT,
110_00098,SYSTEM,At what time you want?,REQUEST,,
110_00098,USER,At 6 in the evening will be fine.,INFORM,,
110_00098,SYSTEM,Book a table for 2 people in March 13th at 6 pm.Restaurant name is Balboa Cafe and is located in San Francisco.Is that correct?,CONFIRM,,
110_00098,USER,Yes is fine for me.,AFFIRM,,
110_00098,SYSTEM,The booking was successful.,NOTIFY_SUCCESS,,
110_00098,USER,Is the liqueur available to there?Tell the address please.,REQUEST,,
110_00098,SYSTEM,"Yes, they serve alcoholic beverages.3199 Fillmore Street is the address.",INFORM,,
110_00098,USER,Thank you for all.,THANK_YOU,,
110_00098,SYSTEM,Can I do anything else?,REQ_MORE,,
110_00098,USER,No.Thanks for your help.,NEGATE,THANK_YOU,
110_00098,SYSTEM,Have a great day!,GOODBYE,,
110_00099,USER,I'd like to find a Chris Webby event near Berkeley.,INFORM,,INFORM_INTENT
110_00099,SYSTEM,When would you like to go and how many tickets do you need?,REQUEST,,
110_00099,USER,I'd like one ticket for the 12th.,INFORM,,
110_00099,SYSTEM,So that's 1 ticket for Chris Webby at Berkeley on March 12th.,CONFIRM,,
110_00099,USER,That's correct. What time does it start and what venue is it on at?,REQUEST,,AFFIRM
110_00099,SYSTEM,Your booking has been confirmed. I hope you enjoy the event! It starts at 8:30 pm at Cornerstone Craft Beer & Live Music.,INFORM,,NOTIFY_SUCCESS
110_00099,USER,I'd also like to find a restaurant while I'm there.,INFORM_INTENT,,
110_00099,SYSTEM,What kind of food would you like?,REQUEST,,
110_00099,USER,I'd like to eat Asian Fusion food.,INFORM,,
110_00099,SYSTEM,I have found a nice restaurant called Da Lian Restaurant in Berkeley.,OFFER,,
110_00099,USER,Do you have any other suggestions?,REQUEST_ALTS,,
110_00099,SYSTEM,There is a nice place called Great China Restaurant in Berkeley.,OFFER,,
110_00099,USER,Do they serve alcohol?,REQUEST,,
110_00099,SYSTEM,No they don't serve alcohol.,INFORM,,
110_00099,USER,What is their phone number?,REQUEST,,
110_00099,SYSTEM,Their number is 510-843-7996.,INFORM,,
110_00099,USER,Can you find any other restaurants?,REQUEST_ALTS,,
110_00099,SYSTEM,There is a nice restaurant called the Himalayan Tandoori And Curry House in Berkeley.,OFFER,,
110_00099,USER,Sounds great.,SELECT,,
110_00099,SYSTEM,Would you like to make a reservation?,OFFER_INTENT,,
110_00099,USER,Can I reserve a table for 13:00 please.,AFFIRM_INTENT,INFORM,
110_00099,SYSTEM,"Sure, so to confirm: You would like to reserve a table for 1 at the Himalayan Tandoori And Curry House in Berkeley on March 12th at 1 pm.",CONFIRM,,
110_00099,USER,That sounds great. Does this place have live music?,REQUEST,AFFIRM,
110_00099,SYSTEM,Your reservation has been made successfully. There is no live music there.,INFORM,NOTIFY_SUCCESS,
110_00099,USER,Thanks for your help. I don't need anything else right now.,THANK_YOU,GOODBYE,
110_00099,SYSTEM,Enjoy your day.,GOODBYE,,
110_00100,USER,I would like to purchase two tickets for an event.,INFORM,INFORM_INTENT,
110_00100,SYSTEM,In which city do you want to search and what event do you have in mind?,REQUEST,,
110_00100,USER,I would like to attend the Giants Vs Cardinals on the 7th of this month in San Francisco.,INFORM,,
110_00100,SYSTEM,You would like 2 tickets for the Giants Vs Cardinals for March 7th in San Francisco?,CONFIRM,,
110_00100,USER,"Yes, I would like to purchase those tickets.",AFFIRM,,
110_00100,SYSTEM,Your tickets have been purchased.,NOTIFY_SUCCESS,,
110_00100,USER,I also would like to find a restaurant.,INFORM_INTENT,,
110_00100,SYSTEM,What type of food are you looking for?,REQUEST,,
110_00100,USER,I would like a Latin American restaurant.,INFORM,,
110_00100,SYSTEM,There are 8 restaurants. What do you think of Alegrias located in San Francisco?,OFFER,,INFORM_COUNT
110_00100,USER,Is there another restaurant? I'm looking for something fancy priced.,INFORM,REQUEST_ALTS,
110_00100,SYSTEM,There are 5 restaurants. There is Barcino which is located in San Francisco.,OFFER,,INFORM_COUNT
110_00100,USER,What is their phone number?,REQUEST,,
110_00100,SYSTEM,Their phone number is 415-430-6590.,INFORM,,
110_00100,USER,Could you suggest another restaurant?,REQUEST_ALTS,,
110_00100,SYSTEM,There is Bellota in San Francisco.,OFFER,,
110_00100,USER,"Yes, reservation for 10:45 please.",INFORM,INFORM_INTENT,SELECT
110_00100,SYSTEM,Table for 2 people at Bellota at 10:45 am on March 7th in San Francisco.,CONFIRM,,
110_00100,USER,Yes that works for me.,AFFIRM,,
110_00100,SYSTEM,Your reservation was made.,NOTIFY_SUCCESS,,
110_00100,USER,What is their phone number and do they serve liquor?,REQUEST,,
110_00100,SYSTEM,They serve alcohol and their number is 415-430-6580.,INFORM,,
110_00100,USER,Thank you for your help.,THANK_YOU,,
110_00100,SYSTEM,Can I help with anything else?,REQ_MORE,,
110_00100,USER,"No, that is all thank you.",NEGATE,THANK_YOU,
110_00100,SYSTEM,Have a good day.,GOODBYE,,
110_00101,USER,I'd like tickets to an event on the 2nd of this month in the Berkeley area.,INFORM,,INFORM_INTENT
110_00101,SYSTEM,Do you have a specific event in mind?,REQUEST,,
110_00101,USER,"Yes, Chris Webby.",INFORM,,
110_00101,SYSTEM,How many tickets do you need?,REQUEST,,
110_00101,USER,"Just one, for me.",INFORM,,
110_00101,SYSTEM,Can you please confirm that you want me to get 1 ticket for you to Chris Webby in Berkeley on March 2nd?,CONFIRM,,
110_00101,USER,"Yes, that's correct.",AFFIRM,,
110_00101,SYSTEM,I've successfully placed your reservation. Enjoy the event!,NOTIFY_SUCCESS,,
110_00101,USER,Can you please tell me the venue as well as the starting time of the event.,REQUEST,,
110_00101,SYSTEM,The event is held at Cornerstone Craft Beer & Live Music and it starts at 6 pm.,INFORM,,
110_00101,USER,Thanks. Can you also find me a restaurant in the area?,INFORM_INTENT,,
110_00101,SYSTEM,Do you have a particular cuisine in mind?,REQUEST,,
110_00101,USER,Mediterranean would be awesome!,INFORM,,
110_00101,SYSTEM,"There are 3 restaurants matching your criteria in Berkeley, out of which I'd recommend Alborz Restaurant.",OFFER,,INFORM_COUNT
110_00101,USER,Perfect. Please place a reservation for me.,INFORM_INTENT,SELECT,
110_00101,SYSTEM,For what time?,REQUEST,,
110_00101,USER,12:15 would be perfect.,INFORM,,
110_00101,SYSTEM,Can you please confirm that you want a table for 1 at Alborz Restaurant in Berkeley at 12:15 pm on March 2nd?,CONFIRM,,
110_00101,USER,"On second thought, better make it 12 pm.",INFORM,NEGATE,
110_00101,SYSTEM,Can you please confirm that you want the table for 12 pm on March 2nd?,CONFIRM,,
110_00101,USER,"Yes, that's correct. Can you please tell me their phone number?",REQUEST,AFFIRM,
110_00101,SYSTEM,I've successfully placed your reservation. You can reach them at 510-848-8877.,INFORM,NOTIFY_SUCCESS,
110_00101,USER,Do you know if they're pricey and if they serve liquor?,REQUEST,,
110_00101,SYSTEM,They do serve liquor and their prices are just moderate.,INFORM,,
110_00101,USER,Thanks. That will be all for now!,THANK_YOU,GOODBYE,
110_00101,SYSTEM,Have a great day!,GOODBYE,,
110_00102,USER,I need tickets to The Drums events. Find me two tickets to the March 7th event.,INFORM,,
110_00102,SYSTEM,Do I need to look in a particular city?,REQUEST,,
110_00102,USER,I want something else around San Fran.,INFORM,,
110_00102,SYSTEM,Could you confirm that I should book tickets for The Drums? You have 2 tickets in your reservation and the event is March 7th. This event will take place in San Francisco.,CONFIRM,,
110_00102,USER,"No, the event is actually Okkervil River.",INFORM,NEGATE,
110_00102,SYSTEM,Could you confirm that you need tickets for Okkervil River in San Francisco?,CONFIRM,,
110_00102,USER,"Yes, that is good. Where is the location?",REQUEST,AFFIRM,
110_00102,SYSTEM,Your reservatoinw as made. The address is 777 Valencia Street. Enjoy!,INFORM,NOTIFY_SUCCESS,
110_00102,USER,I would also like to find a restaurant there. Ramen type of food would be good. I do not care too much about price.,INFORM,,INFORM_INTENT
110_00102,SYSTEM,2g Japanese Brasserie is a good restaurant in San Francisco.,OFFER,,
110_00102,USER,That is fine. I would like to make a restaurant reservation for 10:30.,INFORM,INFORM_INTENT,SELECT
110_00102,SYSTEM,Could you confirm that you want to book a table at 2g Japanese Brasserie in San Francisco? This reservation should be at 10:30 am for 2 people on March 7th.,CONFIRM,,
110_00102,USER,That is good.,AFFIRM,,
110_00102,SYSTEM,"Sorry, but your reservation didn't go through. Would I be able to assist with something else?",NOTIFY_FAILURE,REQ_MORE,
110_00102,USER,Try agan for 12:15 in the afternoon please.,INFORM,INFORM_INTENT,
110_00102,SYSTEM,"Okay, so you want to book at 2g Japanese Brasserie in San Francisco at 12:15 pm for 2 on March 7th?",CONFIRM,,
110_00102,USER,"Yes, that works perfectly.",AFFIRM,,
110_00102,SYSTEM,Your reservation was made.,NOTIFY_SUCCESS,,
110_00102,USER,Is live music available?,REQUEST,,
110_00102,SYSTEM,"No, there is no live music.",INFORM,,
110_00102,USER,What is the contact number and address?,REQUEST,,
110_00102,SYSTEM,The address is 601 Van Ness Avenue and phone number is 415-292-9997.,INFORM,,
110_00102,USER,Thanks so much. That is all I need.,THANK_YOU,GOODBYE,
110_00102,SYSTEM,Have a great day.,GOODBYE,,
110_00103,USER,I want to reserve the event Jon B for 2 people on March 5th,INFORM,,
110_00103,SYSTEM,What's your preferred city?,REQUEST,,
110_00103,USER,Look around Napa,INFORM,,
110_00103,SYSTEM,Please confirm this: Booking tickets for Jon B for 2 tickets on March 5th in Napa,CONFIRM,,
110_00103,USER,Yes perfect. Where's it taking place?,REQUEST,AFFIRM,
110_00103,SYSTEM,Your booking is done. Have a nice time there. The event is at Blue note Napa,INFORM,NOTIFY_SUCCESS,
110_00103,USER,Please find a restaurant nearby it,INFORM_INTENT,,
110_00103,SYSTEM,What's your preferred food?,REQUEST,,
110_00103,USER,I would prefer some Spanish kindo of food,INFORM,,
110_00103,SYSTEM,There is 1 restaurant called La Taberna which is good one in Napa,OFFER,,INFORM_COUNT
110_00103,USER,Yes perfect for me. I wanna make a reservation there,INFORM_INTENT,SELECT,
110_00103,SYSTEM,At what time should I reserve?,REQUEST,,
110_00103,USER,Make it one pm,INFORM,,
110_00103,SYSTEM,Please confirm this: Making a table booking at La Taberna in Napa at 1 pm for 2 people on March 5th,CONFIRM,,
110_00103,USER,No make it 12:45,INFORM,NEGATE,
110_00103,SYSTEM,Please confirm this: The reservation for 2 people at 12:45 pm,CONFIRM,,
110_00103,USER,Yes great,AFFIRM,,
110_00103,SYSTEM,Sorry im unable to make the reservation. La Taberna is a good restaurant shall I try for 2 people on March 5th at 1 pm?,OFFER,,
110_00103,USER,No thanks,NEGATE,,
110_00103,SYSTEM,Can I help you with anything else ?,REQ_MORE,,
110_00103,USER,No thanks a lot for this help,NEGATE,THANK_YOU,
110_00103,SYSTEM,Have a wonderful day ahead,GOODBYE,,
110_00104,USER,I want to find some event tickets to reserve.,INFORM_INTENT,,
110_00104,SYSTEM,Is there a specific date you prefer?,REQUEST,,
110_00104,USER,I would prefer to find something on the 8th.,INFORM,,
110_00104,SYSTEM,Is there a specific city to search? What kind of event and how many tickets do you need?,REQUEST,,
110_00104,USER,I want the event Giants Vs Cardinals and need 4 tickets. I would like it to be near San Fran.,INFORM,,
110_00104,SYSTEM,Please make sure the following details are correct: Reserving 4 tickets for Giants Vs Cardinals in San Francisco on March 8th.,CONFIRM,,
110_00104,USER,"Okay, that sounds good to me. Can you tell me the venue's address and where it's at?",REQUEST,,AFFIRM
110_00104,SYSTEM,I have verified your reservation. The venue is at Oracle Park and located at 24 Willie Mays Plaza. Have a fantastic time when you go!,INFORM,,NOTIFY_SUCCESS
110_00104,USER,Thank you very much for your assistance. I would like to find a restaurant there too.,INFORM_INTENT,,
110_00104,SYSTEM,What are your food interests?,REQUEST,,
110_00104,USER,I think diner food would be delicious.,INFORM,,
110_00104,SYSTEM,I located 10 restaurants. 1760 is a good restaurant and it's in San Francisco.,OFFER,,INFORM_COUNT
110_00104,USER,Do you have some other restaurant options? Indian food sounds ideal.,INFORM,REQUEST_ALTS,
110_00104,SYSTEM,I located 10 restaurants and Amber is located in San Francisco. It's a great one.,OFFER,,INFORM_COUNT
110_00104,USER,"Okay, that sounds like a great plan to me.",SELECT,,
110_00104,SYSTEM,Do you want me to book a table for you there?,OFFER_INTENT,,
110_00104,USER,"Yes, I would like reserve a table for one person.",AFFIRM_INTENT,INFORM,
110_00104,SYSTEM,What time would you like to reserve it?,REQUEST,,
110_00104,USER,The time should be 12:45 in the afternoon.,INFORM,,
110_00104,SYSTEM,Please verify the following is correct: Reserving a table for 1 person at Amber for 12:45 pm on March 8th in San Francisco.,CONFIRM,,
110_00104,USER,"Right, that's it.",AFFIRM,,
110_00104,SYSTEM,I have made a reservation and it was successful.,NOTIFY_SUCCESS,,
110_00104,USER,Can you give me their phone number?,REQUEST,,
110_00104,SYSTEM,Their contact number is 415-777-0500.,INFORM,,
110_00104,USER,I appreciate all of your help. That takes care of it.,THANK_YOU,GOODBYE,
110_00104,SYSTEM,Have a wonderful day.,GOODBYE,,
110_00105,USER,I am looking for 2 event tickets for the Giants Vs Nationals in San Francisco.,INFORM,,
110_00105,SYSTEM,Which date are you interested in?,REQUEST,,
110_00105,USER,On the 9th please.,INFORM,,
110_00105,SYSTEM,To confirm then you want 2 tickets for Giants Vs Nationals on March 9th in San Francisco.,CONFIRM,,
110_00105,USER,Yes that's right. Where is the event and at what time?,REQUEST,,AFFIRM
110_00105,SYSTEM,"Your booking is confirmed, I'm sure you will enjoy. It is located at Oracle Park and starts at 8 pm.",INFORM,,NOTIFY_SUCCESS
110_00105,USER,Cheers for helping. Now I also want a restaurant that serves Pasta kind of food and alcohol.,INFORM,,INFORM_INTENT
110_00105,SYSTEM,There is 54 Mint Ristorante Italiano in San Francisco.,OFFER,,
110_00105,USER,Do they have live music and where are they located?,REQUEST,,
110_00105,SYSTEM,No music i'm afraid. Their address is 16 Mint Plaza.,INFORM,,
110_00105,USER,Yes I am happy with that. Could you reserve a table for me around evening 5:45.,INFORM,INFORM_INTENT,SELECT
110_00105,SYSTEM,To confirm thn you want a table for 2 on March 9th at 5:45 pm in 54 Mint Ristorante Italiano in the city of San Francisco.,CONFIRM,,
110_00105,USER,Sorry change that to 1:30 pm for 4.,INFORM,,NEGATE
110_00105,SYSTEM,To confirm then the table is for 4 at 1:30 pm.,CONFIRM,,
110_00105,USER,Yes that is correct.,AFFIRM,,
110_00105,SYSTEM,Your booking is confirmed.,NOTIFY_SUCCESS,,
110_00105,USER,Are they expensive? Do you have a contact number for them?,REQUEST,,
110_00105,SYSTEM,Pricing appears to be average / moderate and their number is 415-543-5100.,INFORM,,
110_00105,USER,That's all for now thanks.,THANK_YOU,GOODBYE,
110_00105,SYSTEM,Enjoy the rest of your day.,GOODBYE,,
110_00106,USER,I am looking for three tickets for an event near SFO.,INFORM,,INFORM_INTENT
110_00106,SYSTEM,Is the an event or day you have in mind?,REQUEST,,
110_00106,USER,I want to go to the Giants Vs Phillies game on March 5th.,INFORM,,
110_00106,SYSTEM,"Please confirm, 3 tickets for Giants Vs Phillies in San Francisco on March 5th.",CONFIRM,,
110_00106,USER,"Yes, that is perfect. What time does the game begin? What is the address?",REQUEST,,AFFIRM
110_00106,SYSTEM,Your reservation is complete. The game is suppose to begin at 8:30 pm. The address is 24 Willie Mays Plaza.,INFORM,,NOTIFY_SUCCESS
110_00106,USER,I want to find somewhere to eat there too.,INFORM_INTENT,,
110_00106,SYSTEM,What kind of food? Mexican? Chinese?,REQUEST,,
110_00106,USER,We want to go to a Japanese restaurant.,INFORM,,
110_00106,SYSTEM,2g Japanese Brasserie is located in San Francisco.,OFFER,,
110_00106,USER,Do they have alcohol? What is the address?,REQUEST,,
110_00106,SYSTEM,They serve alcohol and the address is 601 Van Ness Avenue.,INFORM,,
110_00106,USER,"Yes, lets make a reservation for evening 6:30.",INFORM,INFORM_INTENT,SELECT
110_00106,SYSTEM,"Please confirm, reservation for 3 people on March 5th at 6:30 pm at 2g Japanese Brasserie in San Francisco.",CONFIRM,,
110_00106,USER,"No, change it to half past 11 in the morning.",INFORM,NEGATE,
110_00106,SYSTEM,"Please confirm, reservation for 11:30 am in San Francisco.",CONFIRM,,
110_00106,USER,"Yes, that is perfect.",AFFIRM,,
110_00106,SYSTEM,Your reservation is complete.,NOTIFY_SUCCESS,,
110_00106,USER,Thank you.,THANK_YOU,,
110_00106,SYSTEM,Anything else?,REQ_MORE,,
110_00106,USER,"No, that is all.",NEGATE,THANK_YOU,
110_00106,SYSTEM,Have a nice day.,GOODBYE,,
110_00107,USER,Can I get some Celine Dion tickets?,INFORM,INFORM_INTENT,
110_00107,SYSTEM,"Sure, how many people? Which city and do you have a date you'd like to go?",REQUEST,,
110_00107,USER,There will be 4 of us. Something near SFO for this Sunday please,INFORM,,
110_00107,SYSTEM,Please confirm: 4 tickets for Celine Dion on March 3rd in San Francisco,CONFIRM,,
110_00107,USER,Yes please book it,AFFIRM,,
110_00107,SYSTEM,I've purchased those tickets. Enjoy the concert,NOTIFY_SUCCESS,,
110_00107,USER,And can I get a restaurant nearby?,INFORM_INTENT,,
110_00107,SYSTEM,Any particular type of food?,REQUEST,,
110_00107,USER,I'm interested in ramen,INFORM,,
110_00107,SYSTEM,2g Japanese Brasserie in San Francisco looks good,OFFER,,
110_00107,USER,"What else do you have? Maybe Italian, a moderate price please",INFORM,,REQUEST_ALTS
110_00107,SYSTEM,I found 10 restaurants for you. 54 Mint Ristorante Italiano looks good in San Francisco,OFFER,,INFORM_COUNT
110_00107,USER,What else? I need it to have a bar,INFORM,REQUEST_ALTS,
110_00107,SYSTEM,"A16 is excellent, they're in San Francisco too",OFFER,,
110_00107,USER,Yes I like that one,SELECT,,
110_00107,SYSTEM,Would you like to book a table?,OFFER_INTENT,,
110_00107,USER,"Yes, a 12:45 in the afternoon reservation please",AFFIRM_INTENT,INFORM,
110_00107,SYSTEM,Please confirm: a table for 4 at A16 in San Francisco at 12:45 pm on March 3rd,CONFIRM,,
110_00107,USER,Yes that's good. Can I get the address and phone number.,REQUEST,,AFFIRM
110_00107,SYSTEM,They're at 2355 Chestnut Street and you can call them at 415-771-2216. But unfortunately I wasn't able to book that reservation. Shall I try 4 people at 1 pm instead? March 3rd at A16,INFORM,,OFFER
110_00107,USER,"Yes, book that",AFFIRM,,
110_00107,SYSTEM,I've confirmed your table,NOTIFY_SUCCESS,,
110_00107,USER,Thanks so much,THANK_YOU,,
110_00107,SYSTEM,Anything else I can do to help?,REQ_MORE,,
110_00107,USER,No thanks,NEGATE,THANK_YOU,
110_00107,SYSTEM,Take care,GOODBYE,,
110_00108,USER,I want to reserve tickets for an event.,INFORM_INTENT,,
110_00108,SYSTEM,Is there a specific date you'd like? How many tickets will you need?,REQUEST,,
110_00108,USER,I would like 1 ticket for something on March 9th.,INFORM,,
110_00108,SYSTEM,What city would you like to search in?,REQUEST,,
110_00108,USER,I want something in the Napa area.,INFORM,,
110_00108,SYSTEM,Do you have a specific event in mind?,REQUEST,,
110_00108,USER,"Yes, please find Jon B.",INFORM,,
110_00108,SYSTEM,Please confirm these details: You're booking 1 ticket for Jon B. on March 9th in Napa.,CONFIRM,,
110_00108,USER,"Yes, that's exactly right.",AFFIRM,,
110_00108,SYSTEM,Your reservation has been confirmed. Have fun!,NOTIFY_SUCCESS,,
110_00108,USER,Thanks. Can you also locate a restaurant nearby? I would like something fancy. Brazilian food is my favorite.,INFORM,,INFORM_INTENT
110_00108,SYSTEM,I have 1 restaurant for you. Galpao Gaucho Brazilian Steakhouse is a great place in Napa.,OFFER,,INFORM_COUNT
110_00108,USER,"Yes, that sounds good. Please make a reservation there at 10:30 in the morning.",INFORM,INFORM_INTENT,SELECT
