dialogue_id,speaker,turn,act_1,act_2,act_3
57_00089,SYSTEM,Where are you going?,REQUEST,,
57_00089,USER,Portland,INFORM,,
57_00089,SYSTEM,There's 1 southwest airlines flight with 1 stop that leaves at 2:35 pm for $202,OFFER,,
57_00089,USER,"Awesome, can you buy an economy one-way flight?",INFORM,INFORM_INTENT,SELECT
57_00089,SYSTEM,Please confirm: 3 economy Southwest Airlines tickets from Las Vegas to Portland leaving march 1st.,CONFIRM,,
57_00089,USER,Perfect.,AFFIRM,,
57_00089,SYSTEM,Ticket is confirmed.,NOTIFY_SUCCESS,,
57_00089,USER,"Can I refund the ticket if need be? Also, when does the flight arrive?",REQUEST,,
57_00089,SYSTEM,"No, the tickets are non refundable and it arrives at 7 pm.",INFORM,,
57_00089,USER,Thanks. I'll need a three star hotel with wifi.,THANK_YOU,,
57_00089,SYSTEM,There's 10 matches. How about a 3 star rated Aloft Portland Airport At Cascade Station.,OFFER,,INFORM_COUNT
57_00089,USER,Where is it located and how much?,REQUEST,,
57_00089,SYSTEM,9920 Northeast Cascades Parkway and $114,INFORM,,
57_00089,USER,"Perfect, thanks so much",SELECT,GOODBYE,
57_00089,SYSTEM,Enjoy and have a wonderful day.,GOODBYE,,
57_00090,USER,I need a United Airlines one way flight for 3.,INFORM,,INFORM_INTENT
57_00090,SYSTEM,When for?,REQUEST,,
57_00090,USER,The 4th of this month.,INFORM,,
57_00090,SYSTEM,What will your starting and ending points be?,REQUEST,,
57_00090,USER,Starting in Atlanta going to London.,INFORM,,
57_00090,SYSTEM,United Airlines has 1 nice flight with 0 stops leaving at 10:30 am for $241.,OFFER,,
57_00090,USER,That's perfect.,SELECT,,
57_00090,SYSTEM,Shall I make a purchase?,OFFER_INTENT,,
57_00090,USER,"Yes, please.",AFFIRM_INTENT,,
57_00090,SYSTEM,Permission needed to purchase 3 Economy tickets from Atlanta to London this March 4th with United Airlines.,CONFIRM,,
57_00090,USER,Make the purchase.,AFFIRM,,
57_00090,SYSTEM,You now own a oneway ticket.,NOTIFY_SUCCESS,,
57_00090,USER,What is the arriving airport called. Can I get my money back?,REQUEST,,
57_00090,SYSTEM,The ticket is non-refundable. The arriving destination is Heathrow International Airport.,INFORM,,
57_00090,USER,Great. I also need a hotel in the area.,THANK_YOU,,
57_00090,SYSTEM,I found a 5 star hotel called 45 Park Lane.,OFFER,,
57_00090,USER,Great. I'll be taking a break now.,SELECT,GOODBYE,
57_00090,SYSTEM,Enjoy.,GOODBYE,,
57_00091,USER,I would like to find a one-way flight.,INFORM_INTENT,,
57_00091,SYSTEM,Where are you traveling and leaving from? When are planning to leave?,REQUEST,,
57_00091,USER,I'm leaving from New York going to Vancouver on Thursday next week.,INFORM,,
57_00091,SYSTEM,There are 4 flights available. There is American Airlines that leaves at 5:25 am and has 1 stop for the cost of $284.,OFFER,,
57_00091,USER,That flight sounds good I would like a one-way ticket.,INFORM_INTENT,SELECT,
57_00091,SYSTEM,Booking 1 economy ticket on American Airlines New York to Vancouver for March 7th.,CONFIRM,,
57_00091,USER,Thank you. When does the onward flight arrive and what is the origin Airport?,REQUEST,,AFFIRM
57_00091,SYSTEM,Your ticket has been purchased. The flight departs from JFK International Airport and the onward flight arrives at 1:41 pm.,INFORM,,NOTIFY_SUCCESS
57_00091,USER,I would like to find an hotel room.,INFORM_INTENT,,
57_00091,SYSTEM,There are 10 hotels. There is Atrium Inn Vancouver that is a 3 star hotel.,OFFER,,INFORM_COUNT
57_00091,USER,"Thank you, I just needed the information for now.",SELECT,GOODBYE,
57_00091,SYSTEM,Have a good day.,GOODBYE,,
57_00092,USER,"Hi, are there any one-way flights on United Airlines which I can travel with?",INFORM,INFORM_INTENT,
57_00092,SYSTEM,Where do you plan to depart from?,REQUEST,,
57_00092,USER,"I plan to depart from Las Vegas, please.",INFORM,,
57_00092,SYSTEM,And when do you plan to depart?,REQUEST,,
57_00092,USER,I will be departing on March 9th.,INFORM,,
57_00092,SYSTEM,Where will you be travelling to?,REQUEST,,
57_00092,USER,I intend to travel to SF!,INFORM,,
57_00092,SYSTEM,"Sure, there are 1 suitable United Airlines flight with 0 layovers which departs and 3:05 pm and will cost you $114.",OFFER,,
57_00092,USER,May I know which airport does this flight depart from?,REQUEST,,
57_00092,SYSTEM,You will be departing from McCarran International Airport.,INFORM,,
57_00092,USER,This sounds great to me!,SELECT,,
57_00092,SYSTEM,Would you like me to make a ticket reservation for you?,OFFER_INTENT,,
57_00092,USER,"Sure, please do so, thanks!",AFFIRM_INTENT,,
57_00092,SYSTEM,Please confirm your reservation for 1 Economy ticket on the United Airlines flight from Las Vegas to San Francisco on March 9th.,CONFIRM,,
57_00092,USER,"Sure, that sounds good! May I know which airport will I arrive at and is the ticket refundable?",REQUEST,,AFFIRM
57_00092,SYSTEM,"Your one-way ticket has been purchased. You will be travelling to SFO International Airport and unfortunately, the ticket is not refundable.",INFORM,,NOTIFY_SUCCESS
57_00092,USER,"I see, could you also help me search for a hotel room there?",INFORM_INTENT,,
57_00092,SYSTEM,"There are 10 hotels which might suit your requirements, how about a 1 star hotel called Amsterdam Hostel San Francisco?",OFFER,,INFORM_COUNT
57_00092,USER,"Sure, this sounds great!",SELECT,,
57_00092,SYSTEM,Would you like me to make a reservation at the hotel?,OFFER_INTENT,,
57_00092,USER,"No, that is not necessary. That is all I need for now, thanks!",NEGATE_INTENT,GOODBYE,
57_00092,SYSTEM,"Sure, have a safe flight!",GOODBYE,,
57_00093,USER,I would like to find a one-way flight.,INFORM_INTENT,,
57_00093,SYSTEM,When are you leaving and where are you traveling?,REQUEST,,
57_00093,USER,"I'm leaving on the 14th of March and going to Seattle, Wa.",INFORM,,
57_00093,SYSTEM,Where are you leaving from?,REQUEST,,
57_00093,USER,I will be leaving from LA.,INFORM,,
57_00093,SYSTEM,There are 5 options. There is Alaska Airlines that leaves at 7:10 pm and has 0 stops for the cost of $134.,OFFER,,
57_00093,USER,What are the other flights available?,REQUEST_ALTS,,
57_00093,SYSTEM,There is American Airlines that leaves at 11:45 pm and has 0 stop for the cost of $116.,OFFER,,
57_00093,USER,When does the onward flight arrive and depart from?,REQUEST,,
57_00093,SYSTEM,It departs from LAX International Airport and the onward flight is at 2:32 am.,INFORM,,
57_00093,USER,Are they other flights available?,REQUEST_ALTS,,
57_00093,SYSTEM,There is Delta Airlines that leaves at 6:50 am and it has 0 stop for the price of $119.,OFFER,,
57_00093,USER,That is a good flight. Can I purchase an economy ticket?,INFORM,INFORM_INTENT,SELECT
57_00093,SYSTEM,Booking 1 economy ticket with Delta Airlines for Los Angeles to Seattle on March 14th.,CONFIRM,,
57_00093,USER,Yes that sounds good.,AFFIRM,,
57_00093,SYSTEM,Your one-way ticket has been purchased.,NOTIFY_SUCCESS,,
57_00093,USER,Which airport does the flight arrive at and is the ticket refundable?,REQUEST,,
57_00093,SYSTEM,The ticket is not refundable. The destination is Seattle-Tacoma International Airport.,INFORM,,
57_00093,USER,Thank you. Can I find a hotel room.,THANK_YOU,,
57_00093,SYSTEM,There are 10 hotels. There is Ace Hotel Seattle that is a 2 star hotel?,OFFER,,INFORM_COUNT
57_00093,USER,"Yes, that sounds good.",SELECT,,
57_00093,SYSTEM,Would you like to book a room?,OFFER_INTENT,,
57_00093,USER,"No, I just wanted the information.",NEGATE_INTENT,GOODBYE,
57_00093,SYSTEM,Have a good day.,GOODBYE,,
57_00094,USER,I'm looking for one way flights leaving on the 11th.,INFORM,INFORM_INTENT,
57_00094,SYSTEM,Where would you like to fly from and what is your destination.,REQUEST,,
57_00094,USER,"I'd like to travel from Philadelphia to London, England.",INFORM,,
57_00094,SYSTEM,I have found an American Airlines flight leaving at 10:10 am. It has 1 stop and a ticket costs $359.,OFFER,,
57_00094,USER,I like the sound of this flight.,SELECT,,
57_00094,SYSTEM,Would you like help with anything else?,REQ_MORE,,
57_00094,USER,Yes I'd like to go ahead and book the ticket please.,INFORM_INTENT,,
57_00094,SYSTEM,Okay so you'd like to book 1 economy ticket on an American Airlines flight from Philadelphia to London on March 11th.,CONFIRM,,
57_00094,USER,Yes that's correct. When does the outbound flight arrive.,REQUEST,AFFIRM,
57_00094,SYSTEM,Your ticket has been confirmed. Your flight arrives at the destination at 3:14 am.,INFORM,NOTIFY_SUCCESS,
57_00094,USER,I'd also like to find a hotel room while I'm there.,INFORM_INTENT,,
57_00094,SYSTEM,There are 10 hotels that meet your criteria. How about 45 Park Lane. It has a 5 star rating.,OFFER,,INFORM_COUNT
57_00094,USER,Are there any other hotels available?,REQUEST_ALTS,,
57_00094,SYSTEM,How about the ABC Hyde Park Hotel? It has a 3 star rating.,OFFER,,
57_00094,USER,How much does it cost per night?,REQUEST,,
57_00094,SYSTEM,It is $186 per night.,INFORM,,
57_00094,USER,Yes that's fine by me thanks. That is everything for now.,SELECT,GOODBYE,
57_00094,SYSTEM,Enjoy your day.,GOODBYE,,
57_00095,USER,Can you find me a one way flight to SFO.,INFORM,INFORM_INTENT,
57_00095,SYSTEM,Where will you be leaving from?,REQUEST,,
57_00095,USER,From LA. I'd like to fly American Airlines.,INFORM,,
57_00095,SYSTEM,When did you want to leave?,REQUEST,,
57_00095,USER,"The 3rd of March. On second thought, check Delta Airlines.",INFORM,,
57_00095,SYSTEM,I found 1 flight on Delta Airlines. It leaves at 9:15 am with 0 stops for $113.,OFFER,,
57_00095,USER,Which airport will it arrive at?,REQUEST,,
57_00095,SYSTEM,SFO International Airport.,INFORM,,
57_00095,USER,Which airport does it leave from? Is the ticket refundable?,REQUEST,,
57_00095,SYSTEM,"It leaves from LAX International Airport. Sorry, it is not refundable.",INFORM,,
57_00095,USER,"Okay, that flight works. Can you help me get an economy ticket?",INFORM,INFORM_INTENT,SELECT
57_00095,SYSTEM,To verify: You want 1 economy ticket for the Delta Airlines flight from Los Angeles to San Francisco on March 3rd.,CONFIRM,,
57_00095,USER,Yes that's right.,AFFIRM,,
57_00095,SYSTEM,Your ticket is confirmed.,NOTIFY_SUCCESS,,
57_00095,USER,Thank you. I also need to find a hotel there.,THANK_YOU,,
57_00095,SYSTEM,"There's the Amsterdam Hostel San Francisco that's nice, it's a 1 star hotel.",OFFER,,
57_00095,USER,Are there others? I'd like to get 2 rooms.,INFORM,REQUEST_ALTS,
57_00095,SYSTEM,There's Argonaut Hotel which has 4 stars.,OFFER,,
57_00095,USER,That will work.,SELECT,,
57_00095,SYSTEM,Would you like to reserve the rooms now?,OFFER_INTENT,,
57_00095,USER,"Not just yet, thanks. That's all I need for now.",NEGATE_INTENT,GOODBYE,
57_00095,SYSTEM,Have a great day!,GOODBYE,,
57_00096,USER,I'd like to find a one-way Economy flight.,INFORM,INFORM_INTENT,
57_00096,SYSTEM,Where do you plan on going?,REQUEST,,
57_00096,USER,"I'm planning a trip to New York City, any airline will do.",INFORM,,
57_00096,SYSTEM,"What date do you plan on leaving, and where will you be leaving from.",REQUEST,,
57_00096,USER,"I'd like to leave Sunday this week, I may need to change that though so I'd like the ticket to be refundable. I plan on leaving from Nairobi, Kenya.",INFORM,,
57_00096,SYSTEM,"There is 1 flight matching your needs. Its a Delta Airlines flight leaving at 5 pm with 0 stops, the ticket price is $280.",OFFER,,
57_00096,USER,"That sounds great to me, can you help me buy the one-way ticket.",INFORM_INTENT,SELECT,
57_00096,SYSTEM,"Okay, so you are purchasing a one-way economy ticket for 1 passenger from Nairobi to New York via Delta Airlines. The departure date is march 3rd.",CONFIRM,,
57_00096,USER,Yes that is correct.,AFFIRM,,
57_00096,SYSTEM,Your one-way ticket has been confirmed.,NOTIFY_SUCCESS,,
57_00096,USER,I'd also like to find a hotel room there.,INFORM_INTENT,,
57_00096,SYSTEM,There are 10 matching hotels. How about 1 Hotel Brooklyn Bridge its a 4 star hotel.,OFFER,,INFORM_COUNT
57_00096,USER,Can you tell me about any other hotels I might like?,REQUEST_ALTS,,
57_00096,SYSTEM,There is also 1 Hotel Central Park which is a 5 star hotel.,OFFER,,
57_00096,USER,Yeah that sounds like it will work for me.,SELECT,,
57_00096,SYSTEM,Would you like to reserve a room there?,OFFER_INTENT,,
57_00096,USER,"No, not at the moment.Thats all I need thank you though.",NEGATE_INTENT,GOODBYE,
57_00096,SYSTEM,You're welcome have a nice day.,GOODBYE,,
57_00097,USER,Will you find me one-way flights?,INFORM_INTENT,,
57_00097,SYSTEM,What city are you leaving from and planning to visit?,REQUEST,,
57_00097,USER,I would like to go to Vancouver from Las Vegas.,INFORM,,
57_00097,SYSTEM,When are you leaving?,REQUEST,,
57_00097,USER,I am going on the 7th of this month.,INFORM,,
57_00097,SYSTEM,I have 4 flights suitable for you including an American Airlines flight at 9:30 am 1 stop for $220.,OFFER,,
57_00097,USER,Would there be any other flights premium economy for four people.,INFORM,,REQUEST_ALTS
57_00097,SYSTEM,Delta Airlines leaves outbound at 12:20 pm with 1 stop for $360.,OFFER,,
57_00097,USER,Will there be any available flights leaving on March 10th.,INFORM,REQUEST_ALTS,
57_00097,SYSTEM,I found 1 flight from United Airlines leaving 8:15 am with 1 stop for $332.,OFFER,,
57_00097,USER,The flight sounds great to me.,SELECT,,
57_00097,SYSTEM,Would you like to buy tickets for it?,OFFER_INTENT,,
57_00097,USER,"Yes, I'd like to book the ticket.",AFFIRM_INTENT,,
57_00097,SYSTEM,Please confirm the details for the flight from Las Vegas to Vancouver via United Airlines leaving March 10th Premium Economy for 4.,CONFIRM,,
57_00097,USER,"Yes, that is great. When is the onward flight arriving?",REQUEST,AFFIRM,
57_00097,SYSTEM,The oneway ticket is confirmed arriving 1:59 pm.,INFORM,NOTIFY_SUCCESS,
57_00097,USER,Thanks for the help. I'd like a room in a hotel there.,THANK_YOU,,
57_00097,SYSTEM,The Atrium Inn Vancouver is a nice hotel that is 3 stars.,OFFER,,
57_00097,USER,Would there be any other hotels I like.,REQUEST_ALTS,,
57_00097,SYSTEM,It is a 4 star hotel called Auberge Vancouver Hotel.,OFFER,,
57_00097,USER,Tell me the address and phone number.,REQUEST,,
57_00097,SYSTEM,The phone is +1 604-678-8899 and is located at 837 West Hastings Street.,INFORM,,
57_00097,USER,"Yes, that will be great. That is all I need.",SELECT,GOODBYE,
57_00097,SYSTEM,Have a great day.,GOODBYE,,
57_00098,USER,"I'd like a one way flight on the 4th of this month to Portland, OR. I need a premium economy ticket.",INFORM,,
57_00098,SYSTEM,Departing from where?,REQUEST,,
57_00098,USER,From Vegas please.,INFORM,,
57_00098,SYSTEM,I have 4 possibilities for you. American Airlines has a 7:15 pm flight with a 1 stop for $331.,OFFER,,
57_00098,USER,Where does that take off from?,REQUEST,,
57_00098,SYSTEM,It leaves from McCarran International Airport.,INFORM,,
57_00098,USER,Is there something else?,REQUEST_ALTS,,
57_00098,SYSTEM,There's a Delta Airlines flight with a 4:45 PM departure and 1 stop for $339.,OFFER,,
57_00098,USER,I like that one.,SELECT,,
57_00098,SYSTEM,Would you like to purchase tickets?,OFFER_INTENT,,
57_00098,USER,"Yes, I need four tickets please.",AFFIRM_INTENT,INFORM,
57_00098,SYSTEM,"Confirming a flight on Delta Airlines from Las Vegas to Portland on March 4th, for 4 premium economy tickets.",CONFIRM,,
57_00098,USER,Perfect. What's the arrival time of the onward flight?,REQUEST,AFFIRM,
57_00098,SYSTEM,That arrives at 9:05 PM. Your tickets have been booked.,INFORM,NOTIFY_SUCCESS,
57_00098,USER,Where does it leave from and is the ticket a refundable one?,REQUEST,,
57_00098,SYSTEM,The flight takes off from McCarran International Airport but it is not a refundable ticket.,INFORM,,
57_00098,USER,Thank you. I also need to find 1 hotel room there.,THANK_YOU,,
57_00098,SYSTEM,"I have 10 possible hotels for you. How about Aloft Portland Airport at Cascade Station hotel, which has 3 stars.",OFFER,,INFORM_COUNT
57_00098,USER,How much does that cost and do they have Wi-Fi?,REQUEST,,
57_00098,SYSTEM,"Yes, they do have Wi-Fi and the hotel is $114 nightly.",INFORM,,
57_00098,USER,I think that will work.,SELECT,,
57_00098,SYSTEM,Shall I book a room for you?,OFFER_INTENT,,
57_00098,USER,"No thank you, I'm all set.",NEGATE_INTENT,GOODBYE,
57_00098,SYSTEM,Thank you very much.,GOODBYE,,
57_00099,USER,"I am in need of finding a one-way flight, and I want the ticket for the flight to be an Economy one. I will be flying off from London.",INFORM,,INFORM_INTENT
57_00099,SYSTEM,Can you tell me your destination? When are you going to leave with the flight?,REQUEST,,
57_00099,USER,I am planning on leaving on Friday next week. I want to arrive in Chicago.,INFORM,,
57_00099,SYSTEM,There are 4 flights which match what you want. How would you like flying with the American Airlines flight which has 0 stops and leaves at 2:05 pm? The ticket for this flight costs $245.,OFFER,,
57_00099,USER,This flight seems good for me.,SELECT,,
57_00099,SYSTEM,Would you like to have tickets bought for this flight?,OFFER_INTENT,,
57_00099,USER,"Yes I want to buy tickets for this flight, and I need tickets for three people.",AFFIRM_INTENT,INFORM,
57_00099,SYSTEM,Can you please confirm that you want to buy Economy class tickets for 3 people for the flight of American Airlines which leaves from London and arrives in Chicago on March 8th?,CONFIRM,,
57_00099,USER,That would suit me well.,AFFIRM,,
57_00099,SYSTEM,Your requested one way ticket has been booked.,NOTIFY_SUCCESS,,
57_00099,USER,"I also need a place to stay there, so find me a room in a hotel. More specifically I am looking for three rooms.",INFORM,INFORM_INTENT,
57_00099,SYSTEM,"A nice hotel which I can suggest and has 3 stars, is called Ac Hotel By Marriott Chicago Downtown.",OFFER,,
57_00099,USER,"That seems nice to me. I appreciate it, that would be all.",SELECT,GOODBYE,
57_00099,SYSTEM,Have a wonderful time!,GOODBYE,,
57_00100,USER,Look up one way flights.,INFORM_INTENT,,
57_00100,SYSTEM,Departing from?,REQUEST,,
57_00100,USER,CDMX.,INFORM,,
57_00100,SYSTEM,Departure date? Destination?,REQUEST,,
57_00100,USER,Going to LA on the 14th of this month.,INFORM,,
57_00100,SYSTEM,I found 3 flights. There's an American Airlines one with 0 stops leaving 8:05 am for $160.,OFFER,,
57_00100,USER,"Good, get a ticket.",INFORM_INTENT,SELECT,
57_00100,SYSTEM,Please confirm: 1 economy ticket on American Airlines from Mexico City to Los Angeles on March 14th.,CONFIRM,,
57_00100,USER,Yep.,AFFIRM,,
57_00100,SYSTEM,Your seat is reserved.,NOTIFY_SUCCESS,,
57_00100,USER,What's the departing airport?,REQUEST,,
57_00100,SYSTEM,Benito Juarez International Airport.,INFORM,,
57_00100,USER,Where does it get in?,REQUEST,,
57_00100,SYSTEM,LAX International Airport.,INFORM,,
57_00100,USER,"Thanks, find a hotel too.",THANK_YOU,,
57_00100,SYSTEM,I found 10 places. Ac Hotel by Marriott Beverly Hills is 2 stars.,OFFER,,INFORM_COUNT
57_00100,USER,Do they have wifi? Where are they?,REQUEST,,
57_00100,SYSTEM,They have wifi and are at 6399 Wilshire Boulevard.,INFORM,,
57_00100,USER,"Thanks, that's all for now.",SELECT,GOODBYE,
57_00100,SYSTEM,Have a nice day.,GOODBYE,,
57_00101,USER,"I am flying with some friends on a trip, please find a one way flight from no particular airline for 3 people.",INFORM,,INFORM_INTENT
57_00101,SYSTEM,Where do you want to go?,REQUEST,,
57_00101,USER,We are going to Washington.,INFORM,,
57_00101,SYSTEM,When do you want to leave from and when do you want to leave?,REQUEST,,
57_00101,USER,"Search for flights on San Fran and change the destination to LAX. I want it for the 4th of March and look for refundable tickets, our plans might change.",INFORM,,
57_00101,SYSTEM,There is a Southwest Airlines flight that takes off at 5:10 pm and has 1 stop. It has a price of $179.,OFFER,,
57_00101,USER,From which airport does it depart?,REQUEST,,
57_00101,SYSTEM,It departs from SFO International Airport.,INFORM,,
57_00101,USER,"Are there other available flights? I will be in ATL, search for the flights leaving from there. I do not care about the ticket class.",INFORM,,REQUEST_ALTS
57_00101,SYSTEM,There is an American Airlines flight that takes off at 9:35 am and has 0 stops. It has a price of $184.,OFFER,,
57_00101,USER,Is there any flight from Delta Airlines?,INFORM,REQUEST_ALTS,
57_00101,SYSTEM,There is 1 flight you might like. Delta Airlines has a flight that takes off at 10:20 pm and has 0 stops. It has a price of $150.,OFFER,,
57_00101,USER,From which airport does it leave? And to which one it arrives?,REQUEST,,
57_00101,SYSTEM,It departs from Hartsfield-Jackson International Airport and arrives to LAX International Airport.,INFORM,,
57_00101,USER,It sounds great. Get me some tickets please.,INFORM_INTENT,SELECT,
57_00101,SYSTEM,Please confirm: Booking 3 economy class tickets for a Delta Airlines flight. Departing from Atlanta with destination to Los Angeles on March 4th.,CONFIRM,,
57_00101,USER,That is correct.,AFFIRM,,
57_00101,SYSTEM,The tickets have been booked.,NOTIFY_SUCCESS,,
57_00101,USER,I think I will also need a hotel room in there.,INFORM_INTENT,,
57_00101,SYSTEM,"There is the Ac Hotel By Marriott Beverly Hills, it has a 2 star rating.",OFFER,,
57_00101,USER,That sounds good.,SELECT,,
57_00101,SYSTEM,Do you want to book a room?,OFFER_INTENT,,
57_00101,USER,"Not right now, that would be all for now.",NEGATE_INTENT,GOODBYE,
57_00101,SYSTEM,Have a great day.,GOODBYE,,
57_00102,USER,Are you able to find me a one-way flight?,INFORM_INTENT,,
57_00102,SYSTEM,"Can you tell me when will you leave, and from where will you leave from? Can you also please tell me where you want to go?",REQUEST,,
57_00102,USER,"I will be leaving on 4th of March to go to Las Vegas, and I will depart from Paris, France.",INFORM,,
57_00102,SYSTEM,There is an Air France flight with 1 stop which leaves at 1:25 pm. The ticket for this flight will cost you $369.,OFFER,,
57_00102,USER,Can you check if the ticket is refundable? Which is the airport where the flight will arrive at?,REQUEST,,
57_00102,SYSTEM,"I regret to say, but the ticket for this flight can not be refunded. The arrival destination of your flight is McCarran International Airport.",INFORM,,
57_00102,USER,"Are there other flight which you can suggest, that leave on the 13th?",INFORM,REQUEST_ALTS,
57_00102,SYSTEM,"There are 2 flight which match what you asked for. One of the flights is with American Airlines, which has 1 stop and leaves at 4:05 am. The ticket for this flight will cost you $363.",OFFER,,
57_00102,USER,This flight would suit me well. Can you help me buy the tickets for this one-way flight?,INFORM_INTENT,SELECT,
57_00102,SYSTEM,Can you please confirm that you want to buy Economy class ticket for 1 person for the flight of American Airlines which leaves from Paris on March 13th and arrives in Las Vegas?,CONFIRM,,
57_00102,USER,"That is correct. Can you tell me from which airport my flight leaves, and when is it expected to arrive at the destination?",REQUEST,,AFFIRM
57_00102,SYSTEM,"Your request for a one way flight ticket has been made. Your flight will be leaving from Charles de Gaulle International Airport, and is expected to arrive at the destination at 12:25 pm.",INFORM,,NOTIFY_SUCCESS
57_00102,USER,I appreciate your help.,THANK_YOU,,
57_00102,SYSTEM,Is there something else I can help you with?,REQ_MORE,,
57_00102,USER,"I would like to find two rooms in a hotel, so I have a place to stay there. I want the hotel to provide wifi.",INFORM,,INFORM_INTENT
57_00102,SYSTEM,There are 6 hotels which match what you requested. A good 3 star hotel is the Best Western Plus Las Vegas West.,OFFER,,INFORM_COUNT
57_00102,USER,Can you give me their phone number?,REQUEST,,
57_00102,SYSTEM,If you want to call them you can at +1 702-256-3766.,INFORM,,
57_00102,USER,"That is good. I appreciate it, that would be all.",SELECT,GOODBYE,
57_00102,SYSTEM,Have a good time!,GOODBYE,,
57_00103,USER,I need a one way economy flight with American Airlines.,INFORM,,INFORM_INTENT
57_00103,SYSTEM,When is departure and where?,REQUEST,,
57_00103,USER,I leave on the 13th of this month to New York.,INFORM,,
57_00103,SYSTEM,Where do you depart?,REQUEST,,
57_00103,USER,"I leave from Delhi, India.",INFORM,,
57_00103,SYSTEM,I have an American Airlines leaving at 7 pm with 1 stop for $472.,OFFER,,
57_00103,USER,This is good for me.,SELECT,,
57_00103,SYSTEM,Do you want tickets?,OFFER_INTENT,,
57_00103,USER,"Yes, buy the tickets.",AFFIRM_INTENT,,
57_00103,SYSTEM,Confirm American Airlines economy from Delhi to New York for 1 on March 13th.,CONFIRM,,
57_00103,USER,"Yes, that is fine and is it refundable?",REQUEST,,AFFIRM
57_00103,SYSTEM,You are confirmed to depart from Indira Gandhi International Airport and it is not refundable.,INFORM,,NOTIFY_SUCCESS
57_00103,USER,I need a hotel room too.,INFORM,INFORM_INTENT,
57_00103,SYSTEM,I found 10. I have a 4 star at 1 Hotel Brooklyn Bridge.,OFFER,,INFORM_COUNT
57_00103,USER,That is all I need.,SELECT,GOODBYE,
57_00103,SYSTEM,Have a great day.,GOODBYE,,
57_00104,USER,"I need three tickets on a flight to Seattle, WA.",INFORM,,INFORM_INTENT
57_00104,SYSTEM,When are you leaving? Where are you leaving from?,REQUEST,,
57_00104,USER,"I am leaving from Phoenix, AZ on the 9th of this month.",INFORM,,
57_00104,SYSTEM,I found 4 options including an American Airlines flight leaving at 8:40 am with 1 stop. The ticket price is $226.,OFFER,,
57_00104,USER,What airports does the flight arrive and depart from?,REQUEST,,
57_00104,SYSTEM,I flight leaves from Sky Harbor International Airport and the destination is Seattle-Tacoma International Airport.,INFORM,,
57_00104,USER,Any flight? I am leaving on the 10th of March for Paris.,INFORM,,REQUEST_ALTS
57_00104,SYSTEM,I found 2 options including a Southwest Airlines flight that leaves at 7:05 am and has 1 stop. The ticket cost is $359.,OFFER,,
57_00104,USER,That is perfect. I need a one-way ticket in economy.,INFORM,INFORM_INTENT,SELECT
57_00104,SYSTEM,"Please confirm, leaving Phoenix on March 10th on Southwest Airlines for Paris. You have reserved 3 tickets in economy.",CONFIRM,,
57_00104,USER,"Yes, that is perfect.",AFFIRM,,
