dialogue_id,speaker,turn,act_1,act_2,act_3
39_00000,USER,I wanna check my calendar for events.,INFORM_INTENT,,
39_00000,SYSTEM,Which date should I look at?,REQUEST,,
39_00000,USER,Look at the 6th.,INFORM,,
39_00000,SYSTEM,There are 3 events scheduled on this date. You have an Appointment at World Cuts at 3 pm.,OFFER,,INFORM_COUNT
39_00000,USER,What about any other events scheduled for this Sunday?,INFORM,REQUEST_ALTS,
39_00000,SYSTEM,You have a Dentist appointment at 1 pm.,OFFER,,
39_00000,USER,"Okay, sounds great. When am I available?",INFORM_INTENT,SELECT,
39_00000,SYSTEM,You have an open time from 8 am to 1 pm.,OFFER,,
39_00000,USER,Any other available time?,REQUEST_ALTS,,
39_00000,SYSTEM,You're available from 2 pm to 7:30 pm.,OFFER,,
39_00000,USER,"Okay, great. Thanks, that's all I needed.",SELECT,GOODBYE,
39_00000,SYSTEM,Have a nice day!,GOODBYE,,
39_00001,USER,Is there anything scheduled on my calendar for March 13th?,INFORM,INFORM_INTENT,
39_00001,SYSTEM,You have a stylist appointment at Supercuts for 12 pm.,OFFER,,
39_00001,USER,Do I have anything scheduled for the 1st of this month?,INFORM,REQUEST_ALTS,
39_00001,SYSTEM,You have a soccer game: sounders vs timbers at 6:30 pm,OFFER,,
39_00001,USER,That's awesome. When is my schedule clear?,INFORM_INTENT,SELECT,
39_00001,SYSTEM,You have 1 space available today from 5 pm - 8 am.,OFFER,,
39_00001,USER,That would be fine. I do not need anymore assistance.,SELECT,GOODBYE,
39_00001,SYSTEM,Enjoy the rest of your day.,GOODBYE,,
39_00002,USER,"Hello, I want to check the upcoming events on my calendar.",INFORM_INTENT,,
39_00002,SYSTEM,Which dates are you looking for specifically?,REQUEST,,
39_00002,USER,Please check for later today.,INFORM,,
39_00002,SYSTEM,"You have 3 events scheduled. You have a Dentist appointment with Kini Ramanand , Kini Lata starting at 1 pm.",OFFER,,INFORM_COUNT
39_00002,USER,What other events do I have today?,REQUEST_ALTS,,
39_00002,SYSTEM,You also have a General Practitioner appointment that begins at 3 pm.,OFFER,,
39_00002,USER,Do I have other events scheduled today?,REQUEST_ALTS,,
39_00002,SYSTEM,You have a Stylist appointment at Redline Barbers. The appointment is set for 6:30 pm.,OFFER,,
39_00002,USER,Sounds good. Can you please show me when I am available?,INFORM_INTENT,SELECT,
39_00002,SYSTEM,You have an empty slot from 8 am to 1 pm.,OFFER,,
39_00002,USER,"Sounds great, thank you. That is all I need.",SELECT,GOODBYE,
39_00002,SYSTEM,Have a good day.,GOODBYE,,
39_00003,USER,I need to check my calendar.,INFORM_INTENT,,
39_00003,SYSTEM,What date do you want to check?,REQUEST,,
39_00003,USER,I need the 9th of March.,INFORM,,
39_00003,SYSTEM,On March 9th you have 3 scheduled events. The first is Apartment Viewing at 10 am.,OFFER,,INFORM_COUNT
39_00003,USER,Give me my calendar for the 13th.,INFORM,REQUEST_ALTS,
39_00003,SYSTEM,On March 13th you have 1 event. The event id Apartment viewing at Reed Square at 2 pm.,OFFER,,
39_00003,USER,Ok. That sounds good.,SELECT,,
39_00003,SYSTEM,Do you need anything else?,REQ_MORE,,
39_00003,USER,Show me when I an available.,INFORM_INTENT,,
39_00003,SYSTEM,You are free between 8 am and 11:30 am.,OFFER,,
39_00003,USER,Do I have any other openings?,REQUEST_ALTS,,
39_00003,SYSTEM,You are free fom 12:30 pm to 2 pm.,OFFER,,
39_00003,USER,Do I have any other openings?,REQUEST_ALTS,,
39_00003,SYSTEM,You are free from 2:30 pm to 5 pm.,OFFER,,
39_00003,USER,"Ok, Good. Thanks.",SELECT,,
39_00003,SYSTEM,Do you need anything else.,REQ_MORE,,
39_00003,USER,"Not for now, thanks?",NEGATE,THANK_YOU,
39_00003,SYSTEM,Let me know if you need anything else.,GOODBYE,,
39_00004,USER,I want to check events on my calendar for Thursday next week.,INFORM,INFORM_INTENT,
39_00004,SYSTEM,You have a Movie booking for Breakthrough starting at 10:30 pm.,OFFER,,
39_00004,USER,Do I have any other events scheduled?,REQUEST_ALTS,,
39_00004,SYSTEM,You have a Reservation for 2 people at Mandalay Restaurant starting at 1 pm.,OFFER,,
39_00004,USER,Do I have other events scheduled?,REQUEST_ALTS,,
39_00004,SYSTEM,You have a Viewing at Park Branham Apartments starting at 11:30 am.,OFFER,,
39_00004,USER,"Sounds good, when am I available?",INFORM_INTENT,SELECT,
39_00004,SYSTEM,You have an opening from 8 am to 11:30 am.,OFFER,,
39_00004,USER,Sounds good. That's all I need.,SELECT,GOODBYE,
39_00004,SYSTEM,Have a good day.,GOODBYE,,
39_00005,USER,What is happening March 9th on my calendar?,INFORM,INFORM_INTENT,
39_00005,SYSTEM,You have an Apartment viewing at 11 am.,OFFER,,
39_00005,USER,Is anything else scheduled?,REQUEST_ALTS,,
39_00005,SYSTEM,You also have a Dentist appointment at 12:30 pm.,OFFER,,
39_00005,USER,Okay. When should I be available?,INFORM_INTENT,SELECT,
39_00005,SYSTEM,There are 4 empty slots on your calendar from 8 am through 11 am.,OFFER,,INFORM_COUNT
39_00005,USER,Okay. That is all.,SELECT,GOODBYE,
39_00005,SYSTEM,Have a nice day.,GOODBYE,,
39_00006,USER,Can you help me check my calendar for events?,INFORM_INTENT,,
39_00006,SYSTEM,What date should be checked?,REQUEST,,
39_00006,USER,Please check 10th of March.,INFORM,,
39_00006,SYSTEM,There is a 2 pm Appointment at Glam-Up.,OFFER,,
39_00006,USER,Do I have any events scheduled on March 9th?,INFORM,REQUEST_ALTS,
39_00006,SYSTEM,You have 2 events including a 3 pm Appointment at Sport Clips Haircuts Of Brentwood.,OFFER,,INFORM_COUNT
39_00006,USER,Is there anything else on the schedule?,REQUEST_ALTS,,
39_00006,SYSTEM,At 9:30 pm you have a Movie show.,OFFER,,
39_00006,USER,"Great, can you show me my availability now?",INFORM_INTENT,SELECT,
39_00006,SYSTEM,You have availability from 8 am to 3 pm.,OFFER,,
39_00006,USER,Great!,SELECT,,
39_00006,SYSTEM,Is there anything else I can do for you?,REQ_MORE,,
39_00006,USER,"Not now, thanks for checking for me.",NEGATE,THANK_YOU,
39_00006,SYSTEM,Enjoy your day!,GOODBYE,,
39_00007,USER,Can you check my events calendar for the 3rd of this month?,INFORM,INFORM_INTENT,
39_00007,SYSTEM,"You have a General Practitioner appointment with Kelly A. Welsh, M.D. at 12:30 pm.",OFFER,,
39_00007,USER,Anything else?,REQUEST_ALTS,,
39_00007,SYSTEM,You also have a Geto Boys concert scheduled for 7 pm.,OFFER,,
39_00007,USER,Okay. When am I available?,INFORM_INTENT,SELECT,
39_00007,SYSTEM,You are available from 8 am to 12:30 pm.,OFFER,,
39_00007,USER,That sounds good.,SELECT,,
39_00007,SYSTEM,Do you need anything else?,REQ_MORE,,
39_00007,USER,No. Thank you.,NEGATE,THANK_YOU,
39_00007,SYSTEM,Your welcome. Have a nice day.,GOODBYE,,
39_00008,USER,I want do double check my events for next Thursday.,INFORM,INFORM_INTENT,
39_00008,SYSTEM,"You have 2 events scheduled that day, one of them is a Dentist appointment with Dr. Susana M. Chou, starting at 10 am.",OFFER,,INFORM_COUNT
39_00008,USER,Any other events?,REQUEST_ALTS,,
39_00008,SYSTEM,You also have a Restaurant reservation at Begoni Bistro at 1 pm.,OFFER,,
39_00008,USER,"Thanks, show me when I have free time.",INFORM_INTENT,SELECT,
39_00008,SYSTEM,You have 3 empty slots in your calender from 8 am to 10 am.,OFFER,,INFORM_COUNT
39_00008,USER,Great thanks!,SELECT,,
39_00008,SYSTEM,Anything else you need?,REQ_MORE,,
39_00008,USER,"Nope, thank you so much!",NEGATE,THANK_YOU,
39_00008,SYSTEM,Have a great day!,GOODBYE,,
39_00009,USER,"I'm trying to schedule an appointment, can you check the events on my calendar?",INFORM_INTENT,,
39_00009,SYSTEM,Which dates would you like me to check?,REQUEST,,
39_00009,USER,Check on the 6th of March.,INFORM,,
39_00009,SYSTEM,You have 2 events scheduled. You have an Apartment viewing at 11 am.,OFFER,,INFORM_COUNT
39_00009,USER,How about the 9th of this month?,INFORM,REQUEST_ALTS,
39_00009,SYSTEM,You have an Apartment viewing at Mission Pointe By Windsor at 12 pm.,OFFER,,
39_00009,USER,Is that the only event scheduled?,REQUEST_ALTS,,
39_00009,SYSTEM,You also have a Dentist appointment at 2 pm.,OFFER,,
39_00009,USER,"Okay, when am I available to schedule an appointment?",INFORM_INTENT,SELECT,
39_00009,SYSTEM,You are free from 8 am to 12 pm.,OFFER,,
39_00009,USER,Am I free any other time?,REQUEST_ALTS,,
39_00009,SYSTEM,You're also free from 12:30 pm to 2 pm.,OFFER,,
39_00009,USER,"Alright that works, thanks for your help.",SELECT,GOODBYE,
39_00009,SYSTEM,"No problem, have a good day.",GOODBYE,,
39_00010,USER,Do I have anything in my calendar for March 12th?,INFORM,INFORM_INTENT,
39_00010,SYSTEM,You have 2 events scheduled on that day. One of them is an Apartment viewing at 5:30 pm.,OFFER,,INFORM_COUNT
39_00010,USER,Sounds good. What times am I available on that day?,INFORM_INTENT,SELECT,
39_00010,SYSTEM,You have 3 empty slots on your calendar. One of them is from 8 am to 4 pm.,OFFER,,INFORM_COUNT
39_00010,USER,Sounds good.,SELECT,,
39_00010,SYSTEM,Do you need anything else?,REQ_MORE,,
39_00010,USER,"No, that's all.",NEGATE,THANK_YOU,
39_00010,SYSTEM,Have a good day.,GOODBYE,,
39_00011,USER,Can you please check my calendar events for March 7th?,INFORM,INFORM_INTENT,
39_00011,SYSTEM,Sure. You have an Apartment viewing at 12:30 pm.,OFFER,,
39_00011,USER,Anything else scheduled for Wednesday next week?,INFORM,REQUEST_ALTS,
39_00011,SYSTEM,"At 2:30 pm you have your General Practitioner appointment with Dr. Leland M. Luna, MD.",OFFER,,
39_00011,USER,"OK, got it. Please tell me when I'm available.",INFORM_INTENT,SELECT,
39_00011,SYSTEM,"At the moment you have 3 empty slots in you calendar, one starting from 8 am to 2:30 pm.",OFFER,,INFORM_COUNT
39_00011,USER,Any other available time?,REQUEST_ALTS,,
39_00011,SYSTEM,"Yes, another empty slot from 3:30 pm to 5 pm.",OFFER,,
39_00011,USER,"OK, got it.",SELECT,,
39_00011,SYSTEM,Is there anything else I can help you with?,REQ_MORE,,
39_00011,USER,"No, that will be all.",NEGATE,THANK_YOU,
39_00011,SYSTEM,Have a good one!,GOODBYE,,
39_00012,USER,Please tell me about the events on my calendar.,INFORM_INTENT,,
39_00012,SYSTEM,For which dates would you like the events?,REQUEST,,
39_00012,USER,Please tell me what events are on next Wednesday.,INFORM,,
39_00012,SYSTEM,"There are a total of 2 events. At 5:30 pm, there is a General Practitioner appointment.",OFFER,,INFORM_COUNT
39_00012,USER,Please tell me what events are scheduled for March 9th.,INFORM,REQUEST_ALTS,
39_00012,SYSTEM,"There are a total of 3 events. At 6 pm, there is an Apartment viewing at Siena Pointe Apartments.",OFFER,,INFORM_COUNT
39_00012,USER,Thank you. Please tell me when I am free.,INFORM_INTENT,SELECT,
39_00012,SYSTEM,You have free time between 8 am and 10:30 am.,OFFER,,
39_00012,USER,"Thank you, that's all.",SELECT,GOODBYE,
39_00012,SYSTEM,Enjoy the rest of your day.,GOODBYE,,
39_00013,USER,"Hello, I want to check the events occurring on the date of the 11th of March on my calendar.",INFORM,INFORM_INTENT,
39_00013,SYSTEM,You have an Appointment at Stem Salon and it starts at 3 pm.,OFFER,,
39_00013,USER,Do I have any other events scheduled that day?,REQUEST_ALTS,,
39_00013,SYSTEM,You also have a Dentist appointment with Dr. Minh B. Nguyen that starts at 4:30 pm.,OFFER,,
39_00013,USER,Do I have any other items scheduled on the 1st of March?,INFORM,REQUEST_ALTS,
39_00013,SYSTEM,You have 3 events on your calendar for that day. You have an Apartment viewing that starts at 12 pm.,OFFER,,INFORM_COUNT
39_00013,USER,Sounds good. Please let me know when I am available.,INFORM_INTENT,SELECT,
39_00013,SYSTEM,You have an empty time slot from 8 am to 10 am.,OFFER,,
39_00013,USER,"Sounds good, thank you. That is all I need.",SELECT,GOODBYE,
39_00013,SYSTEM,"Thank you, have a good day.",GOODBYE,,
39_00014,USER,Can you check my calendar for events?,INFORM_INTENT,,
39_00014,SYSTEM,"Sure, what date?",REQUEST,,
39_00014,USER,I am checking for the 7th,INFORM,,
39_00014,SYSTEM,There is an Apartment viewing at Crestview Apartments at 1 pm,OFFER,,
39_00014,USER,Do I have any other events this Sunday?,INFORM,REQUEST_ALTS,
39_00014,SYSTEM,There is a baseball game at 6 pm,OFFER,,
39_00014,USER,"Sounds good, when am I available?",INFORM_INTENT,SELECT,
39_00014,SYSTEM,You have 3 open slots. One is from 8 am to 2:30 pm,OFFER,,INFORM_COUNT
39_00014,USER,Any other times I'm available?,REQUEST_ALTS,,
39_00014,SYSTEM,"Yes, from 3:30 pm to 6 pm",OFFER,,
39_00014,USER,"Great, that's all, thanks",SELECT,GOODBYE,
39_00014,SYSTEM,Have an awesome day,GOODBYE,,
39_00015,USER,I would like to see the events on my calendar and more specifically for the 8th of this month.,INFORM,INFORM_INTENT,
39_00015,SYSTEM,There are 3 events which I see to have been scheduled on the calendar. You have arranged an Appointment with Renew Dental Implant Specialists and the appointment is going to start at 4 pm.,OFFER,,INFORM_COUNT
39_00015,USER,Are there other events which I have scheduled for the 1st of this month?,INFORM,REQUEST_ALTS,
39_00015,SYSTEM,There are 2 other events scheduled on the calendar. You have arranged the Apartment viewing at Lakeshore Apartments which will start at 12 pm.,OFFER,,INFORM_COUNT
39_00015,USER,Seems great. Tell me when I will be available.,INFORM_INTENT,SELECT,
39_00015,SYSTEM,I can see that 3 slots are empty on your calendar. One of the slots is from 8 am to 12 pm.,OFFER,,INFORM_COUNT
39_00015,USER,Seems great.,SELECT,,
39_00015,SYSTEM,What else can I help you with?,REQ_MORE,,
39_00015,USER,Nothing. I appreciate your help.,NEGATE,THANK_YOU,
39_00015,SYSTEM,Have a good time.,GOODBYE,,
39_00016,USER,"Shelly, check upcoming events on my calendar.",INFORM_INTENT,,
39_00016,SYSTEM,"For what dates, please?",REQUEST,,
39_00016,USER,Check events for next Wednesday.,INFORM,,
39_00016,SYSTEM,You have an appointment with Wafelbakker Anderson Orthodontics at 1:30 pm.,OFFER,,
39_00016,USER,"Shelly, are any other events scheduled for that day?",REQUEST_ALTS,,
39_00016,SYSTEM,"Yes, lunch at Marketbar at 5 pm.",OFFER,,
39_00016,USER,What events are scheduled for the 12th of March.,INFORM,REQUEST_ALTS,
39_00016,SYSTEM,You have a dentist appointment at 4:30 pm.,OFFER,,
39_00016,USER,"Shelly, show me times I'm available that day.",INFORM_INTENT,SELECT,
39_00016,SYSTEM,"You have 3 empty time slots, from 8 am to 12:30 pm that day.",OFFER,,INFORM_COUNT
39_00016,USER,What are my available afternoon slots?,REQUEST_ALTS,,
39_00016,SYSTEM,From 2 pm to 4:30 pm.,OFFER,,
39_00016,USER,"Thanks, Shelly.",SELECT,,
39_00016,SYSTEM,May I help you with anything else?,REQ_MORE,,
39_00016,USER,"No, that's all I needed to know.",NEGATE,THANK_YOU,
39_00016,SYSTEM,Have a great day.,GOODBYE,,
39_00017,USER,Which events are on my calendar Monday next week?,INFORM,INFORM_INTENT,
39_00017,SYSTEM,There are 3 events one of which is a Dermatologist appointment at 12 pm.,OFFER,,INFORM_COUNT
39_00017,USER,What else is on my schedule the 3rd?,INFORM,REQUEST_ALTS,
39_00017,SYSTEM,There are 2 events. You have an Apartment viewing at 10 am.,OFFER,,INFORM_COUNT
39_00017,USER,"When am I available, please.",INFORM_INTENT,SELECT,
39_00017,SYSTEM,From 8 am to 10 am there are 2 empty slots.,OFFER,,INFORM_COUNT
39_00017,USER,Is there any other free time?,REQUEST_ALTS,,
39_00017,SYSTEM,11:30 am to 12 pm is also free.,OFFER,,
39_00017,USER,Thanks.,SELECT,,
39_00017,SYSTEM,Do you need anything else?,REQ_MORE,,
39_00017,USER,No.,NEGATE,THANK_YOU,
39_00017,SYSTEM,Have a great day.,GOODBYE,,
39_00018,USER,"Hey, I'd like to see what I'm doing on March 5th. Can you check my calendar?",INFORM,INFORM_INTENT,
39_00018,SYSTEM,Sure. On March 5th you're going to the Girl In Red concert at 5 pm.,OFFER,,
39_00018,USER,"Oh great, thanks. When am I available that day?",INFORM_INTENT,SELECT,
39_00018,SYSTEM,You're available from 8 am to 11 am.,OFFER,,
39_00018,USER,Fantastic. That's all.,SELECT,GOODBYE,
39_00018,SYSTEM,"Okay, see you.",GOODBYE,,
39_00019,USER,I'd like to check on some events in my calendar.,INFORM_INTENT,,
39_00019,SYSTEM,Do you have a specific date in mind?,REQUEST,,
39_00019,USER,It is the 8th of March.,INFORM,,
39_00019,SYSTEM,"You currently have 3 scheduled events, one of them is Apartment viewing, starting at 5 pm.",OFFER,,INFORM_COUNT
39_00019,USER,Thanks! I'd like to see when I have time available.,INFORM_INTENT,SELECT,
39_00019,SYSTEM,You're free from 8 am to 4 pm.,OFFER,,
39_00019,USER,That sounds great!,SELECT,,
39_00019,SYSTEM,Is there something else I can help you with?,REQ_MORE,,
39_00019,USER,"Nope, thanks for your help!",NEGATE,THANK_YOU,
39_00019,SYSTEM,Have a great day!,GOODBYE,,
39_00020,USER,I need to know the events on my calendar.,INFORM_INTENT,,
39_00020,SYSTEM,Which days events would you like to know?,REQUEST,,
39_00020,USER,I need to know the events on the 1st of March.,INFORM,,
39_00020,SYSTEM,At 2:30 pm you have a General Practitioner appointment.,OFFER,,
39_00020,USER,"Great, when am I free?",INFORM_INTENT,SELECT,
39_00020,SYSTEM,You are free from 8 am to 2:30 pm.,OFFER,,
39_00020,USER,"Perfect, thank you.",SELECT,,
39_00020,SYSTEM,Is there anything else I can help you with.,REQ_MORE,,
39_00020,USER,"That is all I need, thank you.",NEGATE,THANK_YOU,
39_00020,SYSTEM,Enjoy your day.,GOODBYE,,
39_00021,USER,I want to check what events are coming up on my calendar.,INFORM_INTENT,,
39_00021,SYSTEM,Which date on your calendar are looking to check?,REQUEST,,
39_00021,USER,Next Wednesday.,INFORM,,
39_00021,SYSTEM,There are 3 events scheduled on your calendar. You also have a Movie booking for Pet Sematary that is going to begin at 9:30 pm.,OFFER,,INFORM_COUNT
39_00021,USER,Great. Tell me when I am available.,INFORM_INTENT,SELECT,
39_00021,SYSTEM,You have 4 empty slots in your calendar from 8 am to 10:30 am.,OFFER,,INFORM_COUNT
39_00021,USER,Are there any other available times?,REQUEST_ALTS,,
39_00021,SYSTEM,There is also an empty slot from 11 am to 5 pm.,OFFER,,
39_00021,USER,Are there any other available times?,REQUEST_ALTS,,
39_00021,SYSTEM,There is also an empty slot from 7 pm to 9:30 pm.,OFFER,,
39_00021,USER,Great. That is all I needed to know.,SELECT,GOODBYE,
39_00021,SYSTEM,Have a great rest of your day!,GOODBYE,,
39_00022,USER,What do I have for events on my calendar for the 7th of March?,INFORM,INFORM_INTENT,
39_00022,SYSTEM,There is 2 events scheduled. A Baseball game that starts at 7:30 pm.,OFFER,,INFORM_COUNT
39_00022,USER,Do I have any other events scheduled on March 10th?,INFORM,REQUEST_ALTS,
39_00022,SYSTEM,Yes you have a 10 am Dentist appointment.,OFFER,,
39_00022,USER,Any other events Scheduled?,REQUEST_ALTS,,
39_00022,SYSTEM,A General Practitioner Appointment at 5 pm.,OFFER,,
39_00022,USER,Thanks. Tell me when I am available.,INFORM_INTENT,SELECT,
39_00022,SYSTEM,You have a total of 4 empty slots. One being from 8 am to 10 am.,OFFER,,INFORM_COUNT
39_00022,USER,Any other times?,REQUEST_ALTS,,
39_00022,SYSTEM,Yes from 11 am to 11:30 am.,OFFER,,
39_00022,USER,Thanks. I am all set.,SELECT,GOODBYE,
39_00022,SYSTEM,Have a nice day.,GOODBYE,,
39_00023,USER,I want to see events on my calendar later today.,INFORM,INFORM_INTENT,
39_00023,SYSTEM,There is a Dentist appointment with Park Victoria Dental at 10 am.,OFFER,,
39_00023,USER,Perfect. Let me know when I'm available.,INFORM_INTENT,SELECT,
39_00023,SYSTEM,You have 3 empty slots from 8 am to 10 am.,OFFER,,INFORM_COUNT
39_00023,USER,Is there any other available time.,REQUEST_ALTS,,
39_00023,SYSTEM,There are empty slots from 11 am to 6 pm.,OFFER,,
39_00023,USER,Perfect.,SELECT,,
39_00023,SYSTEM,Is there anything else you need?,REQ_MORE,,
39_00023,USER,No. Thanks.,NEGATE,THANK_YOU,
39_00023,SYSTEM,Have a good one!,GOODBYE,,
39_00024,USER,"I would like to check any events on my calendar, please.",INFORM_INTENT,,
39_00024,SYSTEM,No problem. Which date would you like to know about?,REQUEST,,
39_00024,USER,"I'd like to know what is on the 6th of this month, please.",INFORM,,
39_00024,SYSTEM,Sure. You have a dentist appointment that is scheduled for 3:30 pm.,OFFER,,
39_00024,USER,"Ok, great. Can you tell me when I'm available?",INFORM_INTENT,SELECT,
39_00024,SYSTEM,You currently have 3 open spots on your calendar. One slot is available from 8 am to 2 pm.,OFFER,,INFORM_COUNT
39_00024,USER,"Thank you, that sounds great. That is all I need to know.",SELECT,GOODBYE,
39_00024,SYSTEM,You are welcome. Have a great day!,GOODBYE,,
39_00025,USER,I'd like to check my calendar.,INFORM_INTENT,,
39_00025,SYSTEM,"Okay, what day?",REQUEST,,
39_00025,USER,Do I have anything on the 5th?,INFORM,,
39_00025,SYSTEM,You have a Dentist appointment at 10:30 am on the 5th.,OFFER,,
39_00025,USER,Got it. Do I have anything on the 14th of this month?,INFORM,REQUEST_ALTS,
39_00025,SYSTEM,"Yes, you have 2 events on the 14th. The first is an Appointment with Dr. Julie M. Savant at 5 pm.",OFFER,,INFORM_COUNT
39_00025,USER,"Okay, what else do I have?",REQUEST_ALTS,,
39_00025,SYSTEM,You also have a Hairdresser appointment at 11 am.,OFFER,,
39_00025,USER,That sounds good.,SELECT,,
39_00025,SYSTEM,Is there something else I can help you with?,REQ_MORE,,
39_00025,USER,When am I available on that day?,INFORM_INTENT,,
39_00025,SYSTEM,I found 3 empty slots on your calendar for the 14th. You don't have anything between 8 am and 11 am.,OFFER,,INFORM_COUNT
39_00025,USER,"That works, thank you. I don't need anything else.",SELECT,GOODBYE,
39_00025,SYSTEM,"Sure thing, have a nice day!",GOODBYE,,
39_00026,USER,I would like to check if I have any events on my calendar next Monday.,INFORM,INFORM_INTENT,
39_00026,SYSTEM,I was able to pull up 2 events you have going on. One of those events is an Apartment viewing at 3 pm.,OFFER,,INFORM_COUNT
39_00026,USER,Alright. Is there anything I have going on next Tuesday?,INFORM,REQUEST_ALTS,
39_00026,SYSTEM,Looks like you have 3 events going on that day. One of which is an Appointment at Fremont Barber Shop at 6:30 pm.,OFFER,,INFORM_COUNT
39_00026,USER,Anything else going on?,REQUEST_ALTS,,
39_00026,SYSTEM,"Yes, there as an Appointment with Arts Of Dentistry at 1:30 pm.",OFFER,,
39_00026,USER,"Okay, sounds like a plan. What time blocks do I have nothing going on?",INFORM_INTENT,SELECT,
39_00026,SYSTEM,Looks like you've got 3 time slots open on the calendar. One of which is from 8 am to 1:30 pm.,OFFER,,INFORM_COUNT
39_00026,USER,"Great, thank you. That should do it for now.",SELECT,GOODBYE,
39_00026,SYSTEM,Perfect. Take care.,GOODBYE,,
39_00027,USER,I want to see what events are on my calendar.,INFORM_INTENT,,
39_00027,SYSTEM,For which date?,REQUEST,,
39_00027,USER,I want to see March 11th.,INFORM,,
39_00027,SYSTEM,There are 3 events on that date. You have an Appointment with Marenda Ronald E at 11 am.,OFFER,,INFORM_COUNT
39_00027,USER,Are there other events?,REQUEST_ALTS,,
39_00027,SYSTEM,There is also a Movie show at 10 pm.,OFFER,,
39_00027,USER,What are the other events for the 12th of March.,INFORM,REQUEST_ALTS,
39_00027,SYSTEM,There is a Reservation at McDonald's at 11:30 am.,OFFER,,
39_00027,USER,Perfect. Tell me when I'm available.,INFORM_INTENT,SELECT,
39_00027,SYSTEM,You have 3 empty slots on your calendar from 8 am to 10 am.,OFFER,,INFORM_COUNT
39_00027,USER,Thanks. That's all.,SELECT,GOODBYE,
39_00027,SYSTEM,Have a good one!,GOODBYE,,
39_00028,USER,"Hey, I'd like you to check my calendar. What am I doing on the 11th?",INFORM,INFORM_INTENT,
39_00028,SYSTEM,You're going to the Lyfe Jennings concert at 7 pm on the 11th.,OFFER,,
39_00028,USER,Thanks. Am I doing anything on March 4th?,INFORM,REQUEST_ALTS,
39_00028,SYSTEM,You're going to an apartment viewing at Hopper Lane Apartments at 10 am.,OFFER,,
39_00028,USER,Okay thanks. When am I available on the 4th?,INFORM_INTENT,SELECT,
39_00028,SYSTEM,You'll be free from 8 am to 10 am.,OFFER,,
39_00028,USER,Any other available times?,REQUEST_ALTS,,
39_00028,SYSTEM,You're also available from 10:30 am to 5 pm.,OFFER,,
39_00028,USER,Is there anything else?,REQUEST_ALTS,,
39_00028,SYSTEM,"Yes, you're free from 7 pm to 9:30 pm.",OFFER,,
39_00028,USER,Sounds great.,SELECT,,
39_00028,SYSTEM,Is there anything else?,REQ_MORE,,
39_00028,USER,No thanks. That's all.,NEGATE,THANK_YOU,
39_00028,SYSTEM,"Okay, see you.",GOODBYE,,
39_00029,USER,I am very busy in my day-to-day work. Will you please check whether any events on my calendar?,INFORM_INTENT,,
39_00029,SYSTEM,In which date i need to check for the events in your calendar?,REQUEST,,
39_00029,USER,I prefer 6th of this month.,INFORM,,
39_00029,SYSTEM,There are 2 events scheduled on that date . One is Dentist appointment which is going to start at 5 pm.,OFFER,,INFORM_COUNT
39_00029,USER,whether any other events scheduled in any other date i meant 8th of March?,INFORM,REQUEST_ALTS,
39_00029,SYSTEM,Yes you have 2 events scheduled on the calendar. The event is going to start at 2:30 pm and the appointment with Donna M Cotner.,OFFER,,INFORM_COUNT
39_00029,USER,well that's great to hear from you. Please find any empty slots available this month.,INFORM_INTENT,SELECT,
39_00029,SYSTEM,"well, there are 3 empty slots on your calendar and time of empty slots from 8 am to 12 pm.",OFFER,,INFORM_COUNT
39_00029,USER,whether i have any other available time other than 8 am to 12 pm?,REQUEST_ALTS,,
39_00029,SYSTEM,Yes you have an empty slot from 1 pm to 2:30 pm.,OFFER,,
39_00029,USER,That's great and now i am aware of all my events and my available time. Thanks.,SELECT,GOODBYE,
39_00029,SYSTEM,Take care and have a good day.,GOODBYE,,
39_00030,USER,I want to check the events on my calendar for the 2nd.,INFORM,INFORM_INTENT,
39_00030,SYSTEM,You have a Celine Dion concert starting at 7 pm.,OFFER,,
39_00030,USER,Do I have any other events scheduled on the day after tomorrow?,INFORM,REQUEST_ALTS,
39_00030,SYSTEM,You have Apartment viewing scheduled at 12 pm.,OFFER,,
39_00030,USER,Do I have other events scheduled?,REQUEST_ALTS,,
39_00030,SYSTEM,You have a Dentist appointment with Dr. Sethi And Dr. Virdi at 10 am.,OFFER,,
39_00030,USER,Sounds good. Please show me when I am available.,INFORM_INTENT,SELECT,
39_00030,SYSTEM,You have an empty slot from 8 am to 10 am.,OFFER,,
39_00030,USER,Do I have any other available time?,REQUEST_ALTS,,
39_00030,SYSTEM,You have an empty slot from 11 am to 12 pm.,OFFER,,
39_00030,USER,Sounds good.,SELECT,,
