dialogue_id,speaker,turn,act_1,act_2,act_3
38_00072,USER,We are going to go to Chi-town.,INFORM,,
38_00072,SYSTEM,American Airlines is offering a flight for $315 per ticket that will take off at 2:35 am with a return flight scheduled for 12:30 pm.,OFFER,,
38_00072,USER,What airport will I leave from?,REQUEST,,
38_00072,SYSTEM,You would board your plane at the Benito Juarez International Airport.,INFORM,,
38_00072,USER,I want to take that flight.,SELECT,,
38_00072,SYSTEM,Would you like to make your ticket purchase made now?,OFFER_INTENT,,
38_00072,USER,"No, it can wait. What I rally need is a one way flight for my impending vacation.",INFORM_INTENT,NEGATE_INTENT,
38_00072,SYSTEM,I found 1 American Airlines flight that meets your specifications. The plane will take off at 2:35 am and makes 1 stop. Seats can be purchased for $296.,OFFER,,
38_00072,USER,What time does it touch down and what airport wilI be at?,REQUEST,,
38_00072,SYSTEM,The plane is slotted for arrival at 1:52 pm. You will be flying into O'Hare International Airport.,INFORM,,
38_00072,USER,I thank that flight is a good fir. I want it.,SELECT,,
38_00072,SYSTEM,Do you want some more help?,REQ_MORE,,
38_00072,USER,No you've done more than enough thank you.,NEGATE,THANK_YOU,
38_00072,SYSTEM,Have a fantastic day.,GOODBYE,,
38_00073,USER,"Can you search flights, preferably American Airlines?",INFORM,INFORM_INTENT,
38_00073,SYSTEM,Where are you leaving from and going to? When do you want to visit?,REQUEST,,
38_00073,USER,I want to go to San Francisco to New York on Monday next week. I need tickets for two people.,INFORM,,
38_00073,SYSTEM,When are you returning?,REQUEST,,
38_00073,USER,I want to come back next Wednesday.,INFORM,,
38_00073,SYSTEM,I found 1 American Airlines flight that leaves at 4:45 pm and returns at 8:30 pm. Each ticket is $195.,OFFER,,
38_00073,USER,What airports do the flights leave from and arrive at?,REQUEST,,
38_00073,SYSTEM,The return flight arrives at the SFO International Airport at 5:56 am.,INFORM,,
38_00073,USER,That sounds good.,SELECT,,
38_00073,SYSTEM,Would you like to purchase those tickets?,OFFER_INTENT,,
38_00073,USER,"No thank you. Can you find a oneway flight, preferable Economy?",INFORM,INFORM_INTENT,NEGATE_INTENT
38_00073,SYSTEM,There is a flight leaving 4:45 pm on American Airlines with 0 stops. The ticket fare is $171.,OFFER,,
38_00073,USER,"Yes, that is fine.",SELECT,,
38_00073,SYSTEM,What else can I help you with?,REQ_MORE,,
38_00073,USER,"Nothing, thanks.",NEGATE,THANK_YOU,
38_00073,SYSTEM,Enjoy the rest of your day.,GOODBYE,,
38_00074,USER,I need a flight.,INFORM_INTENT,,
38_00074,SYSTEM,Where are you going and leaving?,REQUEST,,
38_00074,USER,I wan to travel in Economy from LA to London.,INFORM,,
38_00074,SYSTEM,When are you returning?,REQUEST,,
38_00074,USER,I am going to Chi-town and return on the 8th of this month.,INFORM,,
38_00074,SYSTEM,What day are you leaving?,REQUEST,,
38_00074,USER,I am departing on March 2nd.,INFORM,,
38_00074,SYSTEM,Search revealed 3 flights. I found an American Airlines flight that leaves at 8:30 am and the returning flight departs at 4:30 am. It costs $180.,OFFER,,
38_00074,USER,That works for me.,SELECT,,
38_00074,SYSTEM,Do you want to buy tickets?,OFFER_INTENT,,
38_00074,USER,"No, not right now. Can you find oneway flights for an upcoming trip?",INFORM_INTENT,NEGATE_INTENT,
38_00074,SYSTEM,Search revealed 1 flight for you. It is an American Airlines flight with 0 stops and leaves at 8:30 am. It costs $163.,OFFER,,
38_00074,USER,What airport does it fly out of and when does the flight arrive?,REQUEST,,
38_00074,SYSTEM,It flies out of LAX International Airport and arrives at 3:02 pm.,INFORM,,
38_00074,USER,That works for me.,SELECT,,
38_00074,SYSTEM,Do you need anything else?,REQ_MORE,,
38_00074,USER,"No, that is all. Thanks.",NEGATE,THANK_YOU,
38_00074,SYSTEM,Have a great day.,GOODBYE,,
38_00075,USER,I need help with flights.,INFORM_INTENT,,
38_00075,SYSTEM,Where will you go and where will you depart from?,REQUEST,,
38_00075,USER,Leaving ATL and going to Paris.,INFORM,,
38_00075,SYSTEM,When will your departure time/date be?,REQUEST,,
38_00075,USER,Friday Next week.,INFORM,,
38_00075,SYSTEM,When will you return?,REQUEST,,
38_00075,USER,12th of March. I really must have Delta Airlines.,INFORM,,
38_00075,SYSTEM,There is only 1 option. Delta Airlines has a flight that leaves at 3:40 pm. The return leaves at 5:35 pm. The price on that is $360.,OFFER,,
38_00075,USER,"That seems exactly right, I want that.",SELECT,,
38_00075,SYSTEM,Should I get tickets for you?,OFFER_INTENT,,
38_00075,USER,"No, I'm looking for a one way trip.",INFORM_INTENT,NEGATE_INTENT,
38_00075,SYSTEM,"I have 1 flight you'll like. Delta Airlines, leaving 3:40 pm. with 1 stop. Your cost will be $320.",OFFER,,
38_00075,USER,What airport will I arrive at?,REQUEST,,
38_00075,SYSTEM,Charles de Gaulle International Airport.,INFORM,,
38_00075,USER,Perfect.,SELECT,,
38_00075,SYSTEM,what else can I help with today?,REQ_MORE,,
38_00075,USER,"Nothing much, I'm good.",NEGATE,THANK_YOU,
38_00075,SYSTEM,Have a good flight.,GOODBYE,,
38_00076,USER,Could you search flights to Chicago for me?,INFORM,INFORM_INTENT,
38_00076,SYSTEM,What is your departure city?,REQUEST,,
38_00076,USER,I will be leaving from Vancouver. I prefer Delta Airlines and Economy class works just fine.,INFORM,,
38_00076,SYSTEM,What will be your date of departure?,REQUEST,,
38_00076,USER,I'd like to leave on March 2nd and return on the 9th of March.,INFORM,,
38_00076,SYSTEM,I found 1 flight for your trip. It is a Delta Airlines flight. It leaves at 2:50 am and returns at 8:30 am. The cost of the ticket is $249.,OFFER,,
38_00076,USER,That flight sounds great to me.,SELECT,,
38_00076,SYSTEM,Should I purchase the ticket?,OFFER_INTENT,,
38_00076,USER,"No, I am good for now.",NEGATE_INTENT,,
38_00076,SYSTEM,Can I help you with anything else?,REQ_MORE,,
38_00076,USER,I have another trip coming up. Can you find me a oneway flight?,INFORM_INTENT,,
38_00076,SYSTEM,I found 1 flight for you. It is a Delta Airlines flight. It leaves at 2:50 am and has 0 stops. The cost is $166.,OFFER,,
38_00076,USER,That flight sounds good to me.,SELECT,,
38_00076,SYSTEM,May I help you with anything else at this time?,REQ_MORE,,
38_00076,USER,No. Thanks for the help.,NEGATE,THANK_YOU,
38_00076,SYSTEM,Have a wonderful day.,GOODBYE,,
38_00077,USER,Can you find me flights leaving from CDMX?,INFORM,INFORM_INTENT,
38_00077,SYSTEM,Where will you visit and when will you come back?,REQUEST,,
38_00077,USER,I am going to Vegas and will come back on the 4th of this month.,INFORM,,
38_00077,SYSTEM,When will you leave?,REQUEST,,
38_00077,USER,I will leave later today.,INFORM,,
38_00077,SYSTEM,I have 1 good flight. It is an American Airlines flight leaving at 8:05 am and returning at 9:30 am. It costs $220.,OFFER,,
38_00077,USER,When will my return flight arrive?,REQUEST,,
38_00077,SYSTEM,The return flight arrives at 8:05 pm,INFORM,,
38_00077,USER,That flight sounds good.,SELECT,,
38_00077,SYSTEM,Should I purchase the tickets?,OFFER_INTENT,,
38_00077,USER,Not at the moment. I have a trip coming up soon. Can you find me one way flights?,INFORM_INTENT,NEGATE_INTENT,
38_00077,SYSTEM,I have 1 flight that you should like. It's an American Airlines flight leaving at 8:05 am with 1 stop. It costs $204.,OFFER,,
38_00077,USER,That flight sounds perfect.,SELECT,,
38_00077,SYSTEM,Would I be able to help you with anything else?,REQ_MORE,,
38_00077,USER,"No, that's it.",NEGATE,THANK_YOU,
38_00077,SYSTEM,Have a great day.,GOODBYE,,
38_00078,USER,Can you find me a flight to Mexico City?,INFORM,INFORM_INTENT,
38_00078,SYSTEM,When are you leaving? Where would you like to leave from? And when will you be back?,REQUEST,,
38_00078,USER,I'm leaving on the 8th from Los Angeles and I would like to get back on the 14th of March.,INFORM,,
38_00078,SYSTEM,There's an American Airlines flight that leaves LA at 2:45 pm and returns to LA at 8:05 am. The price is $163.,OFFER,,
38_00078,USER,Are there any other flights? I like to travel in Economy.,INFORM,REQUEST_ALTS,
38_00078,SYSTEM,There's a Delta Airlines flight that leaves LA at 9:15 am and returns to LA at 1:45 pm. The ticket costs $253.,OFFER,,
38_00078,USER,That sounds great.,SELECT,,
38_00078,SYSTEM,Should I buy the tickets?,OFFER_INTENT,,
38_00078,USER,"Nope, I'm good for now.",NEGATE_INTENT,,
38_00078,SYSTEM,Do you need help with anything else?,REQ_MORE,,
38_00078,USER,Could you find me oneway flights for my upcoming trip?,INFORM_INTENT,,
38_00078,SYSTEM,I've found 1 flight for you. There's a Delta Airlines flight that leaves at 9:15 am and has 1 stop. It costs $241.,OFFER,,
38_00078,USER,What airport does the flight go to?,REQUEST,,
38_00078,SYSTEM,Benito Juarez International Airport.,INFORM,,
38_00078,USER,That sounds great.,SELECT,,
38_00078,SYSTEM,Do you need any more help?,REQ_MORE,,
38_00078,USER,"No, that will be all. Thanks!",NEGATE,THANK_YOU,
38_00078,SYSTEM,Have a great day!,GOODBYE,,
38_00079,USER,Can you serach some flights for me? I want to be back on the 12th of March.,INFORM,INFORM_INTENT,
38_00079,SYSTEM,Where will you be leaving from? Where are you planning to visit and when do you plan to leave.,REQUEST,,
38_00079,USER,"I'm leaving on the 1st of March and am traveling to SFO. I 'm leaving from Phoenix, AZ",INFORM,,
38_00079,SYSTEM,I found 3 flight for your trip. Thereis an American Airlines flight. The outbound flight leaves at 7:35 am. The return fligh tleaves at 8:10 am. The price of the tickets is $200.,OFFER,,
38_00079,USER,Are there any other availble flights? I prefer UNited Airlines. I like traveling Economy.,INFORM,,REQUEST_ALTS
38_00079,SYSTEM,Found 1 flight for the trip. There is an United Airlines flight. The outbound flight leaves at 11:50 pm. The return flight leaves at 2:15 pm. The price is $140.,OFFER,,
38_00079,USER,When does the flight return?,REQUEST,,
38_00079,SYSTEM,The return flight arrives at 4:22 pm.,INFORM,,
38_00079,USER,That flight sound good.,SELECT,,
38_00079,SYSTEM,Should I buy the tickets for it?,OFFER_INTENT,,
38_00079,USER,"No, actuatlly could you find me a different flight? A oneway flight?",INFORM_INTENT,NEGATE_INTENT,
38_00079,SYSTEM,There is a United Airlines flight. The outbound flight leaves at 11:50 pm and it has 0 stops. The prices of the ticket is $128.,OFFER,,
38_00079,USER,Is the ticket refundable?,REQUEST,,
38_00079,SYSTEM,"No, the ticket is not refundable.",INFORM,,
38_00079,USER,Any other flights available?,REQUEST_ALTS,,
38_00079,SYSTEM,"Sorry, I wasn't able to find any other flight. Do you need help with anything else?",NOTIFY_FAILURE,REQ_MORE,
38_00079,USER,"No, thank you.",NEGATE,THANK_YOU,
38_00079,SYSTEM,Have a wonderful day.,GOODBYE,,
38_00080,USER,Can you please search for flights on the 2nd of this month.,INFORM,INFORM_INTENT,
38_00080,SYSTEM,Where will you be leaving from?,REQUEST,,
38_00080,USER,I am leaving from NY.,INFORM,,
38_00080,SYSTEM,Where are you planning to visit? When are you returning?,REQUEST,,
38_00080,USER,I am traveling to SF and I'll return next Thursday.,INFORM,,
38_00080,SYSTEM,There is an outbound American Airlines flight at 4:45 pm. The return flight leaves at 8:30 pm. The price is $213.,OFFER,,
38_00080,USER,Does it have zero stops? Which airport does the plane leave from?,REQUEST,,
38_00080,SYSTEM,0 stops on this flight. Leaves from JFK International Airport.,INFORM,,
38_00080,USER,That sounds good.,SELECT,,
38_00080,SYSTEM,Should I buy the tickets?,OFFER_INTENT,,
38_00080,USER,"No, not now.",NEGATE_INTENT,,
38_00080,SYSTEM,Is there anything else I can help you with?,REQ_MORE,,
38_00080,USER,"I have a trip coming up, can you find me a oneway flight?",INFORM_INTENT,,
38_00080,SYSTEM,"American Airlines with 0 stops, leaves at 4:45 pm and the price of the ticket is $198.",OFFER,,
38_00080,USER,That sounds great.,SELECT,,
38_00080,SYSTEM,Is there anything else?,REQ_MORE,,
38_00080,USER,"No, thank you.",NEGATE,THANK_YOU,
38_00080,SYSTEM,Have a great day.,GOODBYE,,
38_00081,USER,Can you search for some flights for me? I am taking a trip soon.,INFORM_INTENT,,
38_00081,SYSTEM,Where are you visiting and when do you plan on leaving?,REQUEST,,
38_00081,USER,"I am leaving on March 2nd traveling to Toronto, Canada from ATL.",INFORM,,
38_00081,SYSTEM,When will you be returning?,REQUEST,,
38_00081,USER,I am returning on the 14th of this month. I prefer United Airlines.,INFORM,,
38_00081,SYSTEM,I found 1 flight that matches the criteria. There is a United Airlines flight departing at 12:50 pm and retuning at 5:35 pm for $240.,OFFER,,
38_00081,USER,How many stops does the flight have? Which airport does the flight depart from?,REQUEST,,
38_00081,SYSTEM,There is 1 stop on the flight. It is departing from Hartsfield-Jackson International Airport.,INFORM,,
38_00081,USER,That flight looks good to me.,SELECT,,
38_00081,SYSTEM,Do you want me to book the flight?,OFFER_INTENT,,
38_00081,USER,"No, thank you. I have another trip coming up, can you find me oneway flights?",INFORM_INTENT,NEGATE_INTENT,
38_00081,SYSTEM,There is a United Airlines flight departing at 12:50 pm with 1 stop for $222.,OFFER,,
38_00081,USER,That flight works for me.,SELECT,,
38_00081,SYSTEM,Is there anything else I can help you with?,REQ_MORE,,
38_00081,USER,"No, thank you!",NEGATE,THANK_YOU,
38_00081,SYSTEM,Have a great day.,GOODBYE,,
38_00082,USER,I totally forgot my schedule and appointments of my calendar. Will you find events on my calendar?,INFORM_INTENT,,
38_00082,SYSTEM,"It is a pleasure for me, Which date i need to check?",REQUEST,,
38_00082,USER,Actually it is on March 5th.,INFORM,,
38_00082,SYSTEM,The event will start at 10 am and the event is Dentist appointment.,OFFER,,
38_00082,USER,Ok Fine.It is a very useful information. Do i have any other events scheduled? Will you find on March 13th?,INFORM,REQUEST_ALTS,
38_00082,SYSTEM,The event will start at 10:30 pm and you need to go for a Movie show.,OFFER,,
38_00082,USER,Ok that's great and i need to know whether i am available on that day. Please find also that?,INFORM_INTENT,SELECT,
38_00082,SYSTEM,"On March 13th, you have an emply slot starting at 8 pm and slot ends at 10:30 pm",OFFER,,
38_00082,USER,Ok that's great and i need to thank you for your wonderful work.,SELECT,GOODBYE,
38_00082,SYSTEM,Take care Have a great day,GOODBYE,,
38_00083,USER,What is my calendar like for Monday next week.,INFORM,INFORM_INTENT,
38_00083,SYSTEM,You have a stylist appointment at Philgood Cuts at 3:30 pm.,OFFER,,
38_00083,USER,Do I have anything scheduled for Wednesday next week.,INFORM,REQUEST_ALTS,
38_00083,SYSTEM,You have a Westside Gunn concert for 7:30 pm.,OFFER,,
38_00083,USER,That would be fine.,SELECT,,
38_00083,SYSTEM,Is there anything else I can assist you with?,REQ_MORE,,
38_00083,USER,When do I have some free time.,INFORM_INTENT,,
38_00083,SYSTEM,You have time available next Wednesday between 9:30 pm and midnight.,OFFER,,
38_00083,USER,That would be ok. That would be all.,SELECT,GOODBYE,
38_00083,SYSTEM,Enjoy your day.,GOODBYE,,
38_00084,USER,I am not sure when is my friend's birthday so I am going to check the calendar.,INFORM_INTENT,,
38_00084,SYSTEM,Please tell me which date you want to know.,REQUEST,,
38_00084,USER,My friend's birthday is on the 9th.,INFORM,,
38_00084,SYSTEM,There are 3 events scheduled for you. The first one is Doctor appointment at 11 am.,OFFER,,INFORM_COUNT
38_00084,USER,Let me look on March 14th to see if I have any other events scheduled.,INFORM,REQUEST_ALTS,
38_00084,SYSTEM,You have a Baseball game at 5 pm.,OFFER,,
38_00084,USER,Great. When is my free time then?,INFORM_INTENT,SELECT,
38_00084,SYSTEM,You are free from 8 am to 4 pm.,OFFER,,
38_00084,USER,Great. Thanks so much.,SELECT,GOODBYE,
38_00084,SYSTEM,Thanks for being patient and please have a wonderful day.,GOODBYE,,
38_00085,USER,I want to check my calendar on the 10th of March.,INFORM,INFORM_INTENT,
38_00085,SYSTEM,"On that day, you will be watching a 10:30 pm showing of a movie at The New Parkway Theater.",OFFER,,
38_00085,USER,Great! I'm looking forward to that movie. What spare time do I have that day?,INFORM_INTENT,SELECT,
38_00085,SYSTEM,"On March 10th, you have free time spanning from 8 am to 1:30 pm.",OFFER,,
38_00085,USER,That's good to know.,SELECT,,
38_00085,SYSTEM,Do I need to help you any further?,REQ_MORE,,
38_00085,USER,You do not need to help me further. Thanks for reminding me of what I'm doing that day.,NEGATE,THANK_YOU,
38_00085,SYSTEM,Enjoy your day.,GOODBYE,,
38_00086,USER,I want to see the events on my calendar.,INFORM_INTENT,,
38_00086,SYSTEM,What date were you inquiring about?,REQUEST,,
38_00086,USER,I want to know about the 4th of this month.,INFORM,,
38_00086,SYSTEM,You have a Dentist appointment with Bautista Maximilian at 4 pm.,OFFER,,
38_00086,USER,Thank you. When am I available?,INFORM_INTENT,SELECT,
38_00086,SYSTEM,Next Monday there is an empty slot from 8 am to 2:30 pm.,OFFER,,
38_00086,USER,That sounds great.,SELECT,,
38_00086,SYSTEM,Anything else I can do for you?,REQ_MORE,,
38_00086,USER,"No, that's it. Thanks.",NEGATE,THANK_YOU,
38_00086,SYSTEM,Have a great day.,GOODBYE,,
38_00087,USER,Can you check events on my calendar?,INFORM_INTENT,,
38_00087,SYSTEM,What date I should look for?,REQUEST,,
38_00087,USER,Look for the 9th of this month.,INFORM,,
38_00087,SYSTEM,There is a Soccer game event at 5 pm.,OFFER,,
38_00087,USER,"Okay, That sounds perfect. Find me when I am available.",INFORM_INTENT,SELECT,
38_00087,SYSTEM,You are available at 2:30 pm till 5 pm on March 9th.,OFFER,,
38_00087,USER,"Okay, That sounds great. That will be all.",SELECT,GOODBYE,
38_00087,SYSTEM,I am glad I could help. Have a nice day.,GOODBYE,,
38_00088,USER,I'd like to check the events I have scheduled on next Wednesday.,INFORM,INFORM_INTENT,
38_00088,SYSTEM,"Okay, you have an event at 7 pm, it's a movie show.",OFFER,,
38_00088,USER,"Great, are there any other events scheduled?",REQUEST_ALTS,,
38_00088,SYSTEM,"Yes, you have a reservation for 6 people at Rocker Oysterfeller's for 11:30 am.",OFFER,,
38_00088,USER,Is there anything else scheduled for the 9th of this month?,INFORM,REQUEST_ALTS,
38_00088,SYSTEM,"Yes, there are 2 scheduled events. There is a Joe Hisaishi concert that starts at 7:30 pm.",OFFER,,INFORM_COUNT
38_00088,USER,"That's good, when am I available?",INFORM_INTENT,SELECT,
38_00088,SYSTEM,There is an empty slot from 8 am to 7:30 pm.,OFFER,,
38_00088,USER,Okay great.,SELECT,,
38_00088,SYSTEM,Is there anything else I can help you with?,REQ_MORE,,
38_00088,USER,"No, thank you.",NEGATE,THANK_YOU,
38_00088,SYSTEM,"Okay, have a nice day.",GOODBYE,,
38_00089,USER,What events do I have in my calendar?,INFORM_INTENT,,
38_00089,SYSTEM,What date are you curious about?,REQUEST,,
38_00089,USER,I want to know about the 6th.,INFORM,,
38_00089,SYSTEM,You have an event baseball game: Diamondbacks Vs Rockies at 7:30 pm.,OFFER,,
38_00089,USER,Do I have anything scheduled on the 14th of March?,INFORM,REQUEST_ALTS,
38_00089,SYSTEM,You have a movie at AMC Mercado 20 at 10:30 pm.,OFFER,,
38_00089,USER,"Okay, thanks. When am I available?",INFORM_INTENT,SELECT,
38_00089,SYSTEM,You are free on March 14th from 8 am to 11 am.,OFFER,,
38_00089,USER,"Thanks, that's all.",SELECT,GOODBYE,
38_00089,SYSTEM,Have a great day.,GOODBYE,,
38_00090,USER,I'd like to check events on my calendar.,INFORM_INTENT,,
38_00090,SYSTEM,What day do you wish to know?,REQUEST,,
38_00090,USER,The day is Wednesday next week.,INFORM,,
38_00090,SYSTEM,You have an event starting at 4:30 pm about a movie booking for Dumbo.,OFFER,,
38_00090,USER,Do I have anything else planned on the 13th of March?,INFORM,REQUEST_ALTS,
38_00090,SYSTEM,You have an event beginning at 10:30 am about viewing at ridgeview terrace Townhouses.,OFFER,,
38_00090,USER,That sounds great. Tell me when I am available.,INFORM_INTENT,SELECT,
38_00090,SYSTEM,"The event starts on March 13th, and you have an empty slot that begins at 11 am and ends at 1:30 pm.",OFFER,,
38_00090,USER,That sounds wonderful.,SELECT,,
38_00090,SYSTEM,Could I assist you with anything else?,REQ_MORE,,
38_00090,USER,Nah. Thanks for your assistance.,NEGATE,THANK_YOU,
38_00090,SYSTEM,Have a pleasant afternoon.,GOODBYE,,
38_00091,USER,I want to see whats on my calendar,INFORM_INTENT,,
38_00091,SYSTEM,Which date are you looking at?,REQUEST,,
38_00091,USER,I am looking for Friday next week,INFORM,,
38_00091,SYSTEM,You have a Restaurant reservation at Mcdonald's at 6 pm,OFFER,,
38_00091,USER,"That's good, when am I free?",INFORM_INTENT,SELECT,
38_00091,SYSTEM,You're available next Friday between 1 pm and 6 pm,OFFER,,
38_00091,USER,That's good thank you,SELECT,GOODBYE,
38_00091,SYSTEM,Have a nice day!,GOODBYE,,
38_00092,USER,Can you show me the events on my calendar? I need a verification.,INFORM_INTENT,,
38_00092,SYSTEM,Which date are you looking for?,REQUEST,,
38_00092,USER,I want to get details on 1st of March.,INFORM,,
38_00092,SYSTEM,You have got event at 1 pm on that day at Restaurant reservation at Pasta Moon.,OFFER,,
38_00092,USER,Please check 9th of this month is vacant.,INFORM,REQUEST_ALTS,
38_00092,SYSTEM,"No sir, you have fixed that day to enjoy Psychedelic Furs concert at 6 pm",OFFER,,
38_00092,USER,"Ok, Then which day I will be available?",INFORM_INTENT,SELECT,
38_00092,SYSTEM,You are free from 8 pm to midnight on March 9th.,OFFER,,
38_00092,USER,"Fine, thank you.",SELECT,,
38_00092,SYSTEM,Do you need any other service?,REQ_MORE,,
38_00092,USER,"No, that's all. Thank you.",NEGATE,THANK_YOU,
38_00092,SYSTEM,Have a great day sir.,GOODBYE,,
38_00093,USER,"I'd like to verify activities on my calendar, specifically on the 3rd of March.",INFORM,INFORM_INTENT,
38_00093,SYSTEM,You have a Dentist appointment with C-Dental X-Ray that begins at 1 pm.,OFFER,,
38_00093,USER,Is there any other activity planned for me on the 4th of March?,INFORM,REQUEST_ALTS,
38_00093,SYSTEM,You have a Property viewing activity that begins at 4:30 pm.,OFFER,,
38_00093,USER,That's great. Tell me what time I am available.,INFORM_INTENT,SELECT,
38_00093,SYSTEM,"The day for the activity is next Monday, and you have an empty slot that begins at 8 am and finishes at 10:30 am.",OFFER,,
38_00093,USER,That's perfect; that's all.,SELECT,GOODBYE,
38_00093,SYSTEM,Have a pleasant afternoon.,GOODBYE,,
38_00094,USER,I want to check the events on my calendar.,INFORM_INTENT,,
38_00094,SYSTEM,Which day would you like to search?,REQUEST,,
38_00094,USER,I would like to know the 14th.,INFORM,,
38_00094,SYSTEM,You have a Dermatologist appointment with Karls Michael S. at 10 am.,OFFER,,
38_00094,USER,Do I have other events scheduled for the 12th of this month?,INFORM,REQUEST_ALTS,
38_00094,SYSTEM,You have a restaurant reservation for 4 at Betty Spaghetti starting at 11:30 am.,OFFER,,
38_00094,USER,"Sounds good, when am I available?",INFORM_INTENT,SELECT,
38_00094,SYSTEM,There is 1 empty slot in your calendar for March 12th from 1 pm to 10:30 pm.,OFFER,,
38_00094,USER,That is good information.,SELECT,,
38_00094,SYSTEM,Can I help you with anything else?,REQ_MORE,,
38_00094,USER,"No, that is all thank you.",NEGATE,THANK_YOU,
38_00094,SYSTEM,have a good day.,GOODBYE,,
38_00095,USER,Please check Saturday this week on my calendar.,INFORM,INFORM_INTENT,
38_00095,SYSTEM,This Saturday Table for 2 at Caputo is scheduled at 7 pm,OFFER,,
38_00095,USER,Is there anything else on the calendar March 12th?,INFORM,REQUEST_ALTS,
38_00095,SYSTEM,At 6 pm there is a Baseball game scheduled.,OFFER,,
38_00095,USER,Great.,SELECT,,
38_00095,SYSTEM,Is there anything else you need?,REQ_MORE,,
38_00095,USER,When do I have free time?,INFORM_INTENT,,
38_00095,SYSTEM,March 12th there is 1 space from 8 am to 12 pm.,OFFER,,
38_00095,USER,Great.,SELECT,,
38_00095,SYSTEM,What else do you need?,REQ_MORE,,
38_00095,USER,"That's all, thank you.",NEGATE,THANK_YOU,
38_00095,SYSTEM,Enjoy the rest of your day.,GOODBYE,,
38_00096,USER,I want to take my girlfriend on a proper date soon but I don't know what I have on my schedule already. Can you check upcoming events on my calendar?,INFORM_INTENT,,
38_00096,SYSTEM,Is there a particular date you would like me to look at for you?,REQUEST,,
38_00096,USER,"Yes, I was thinking the 5th of March.",INFORM,,
38_00096,SYSTEM,You have a movie show beginning at 11 pm on that day.,OFFER,,
38_00096,USER,"Okay, what do I have scheduled for the 2nd of this month?",INFORM,REQUEST_ALTS,
38_00096,SYSTEM,You have a Stylist appointment at Lotte Beauty Salon at 5 pm on that day.,OFFER,,
38_00096,USER,So far that sounds good.,SELECT,,
38_00096,SYSTEM,Is there anything else I can help you with?,REQ_MORE,,
38_00096,USER,"Yes, rather than telling me my scheduled events can you tell me when I am available?",INFORM_INTENT,,
38_00096,SYSTEM,It looks like tomorrow you are free from 8 am until 5 pm.,OFFER,,
38_00096,USER,"Great, everything sounds good.",SELECT,,
38_00096,SYSTEM,Is there anything else I can help you with?,REQ_MORE,,
38_00096,USER,"No, that was all I needed at the moment. Thank you.",NEGATE,THANK_YOU,
38_00096,SYSTEM,"It was my pleasure, enjoy the rest of your day.",GOODBYE,,
38_00097,USER,I need the details of my calendar. Look for Friday next week,INFORM,INFORM_INTENT,
38_00097,SYSTEM,"You have an Dermatologist appointment with Greenbrae Dermatology, cheryl Tanasovich, M.D., Benjamin Nichols, M.D., John Maddox, M.D. at 2 pm",OFFER,,
38_00097,USER,"Fine, now check the 6th.",INFORM,REQUEST_ALTS,
38_00097,SYSTEM,Yes there is one at 5 pm at Juliana Hatfield concert,OFFER,,
38_00097,USER,Ok. Let me see when I am available.,INFORM_INTENT,SELECT,
38_00097,SYSTEM,"You are available on 3 slots, one from 8 am to 11:30 am",OFFER,,INFORM_COUNT
38_00097,USER,Fine.Thank you.,SELECT,,
38_00097,SYSTEM,Any more help?,REQ_MORE,,
38_00097,USER,No Thank you.,NEGATE,THANK_YOU,
38_00097,SYSTEM,Have a good day,GOODBYE,,
38_00098,USER,I'm kind of curious about what's on my calendar for next Thursday.,INFORM,INFORM_INTENT,
