dialogue_id,speaker,turn,act_1,act_2,act_3
60_00021,USER,I need it on 11th of March at around 2:45 in the afternoon until 12th of March.,INFORM,,
60_00021,SYSTEM,"Okay, you want a Standard car and you will pick it up from Seattle-Tacoma International Airport on March 11th at 2:45 pm until March 12th. Please confirm.",CONFIRM,,
60_00021,USER,"Yes, correct. May I know the name of the car and the total cost?",REQUEST,,AFFIRM
60_00021,SYSTEM,The car cost $30 and it's a Civic. Your car has been reserved!,INFORM,,NOTIFY_SUCCESS
60_00021,USER,Thank you.,THANK_YOU,,
60_00021,SYSTEM,Anything else I can help you with?,REQ_MORE,,
60_00021,USER,"No, thanks",NEGATE,THANK_YOU,
60_00021,SYSTEM,You are welcome.,GOODBYE,,
60_00022,USER,I need some round tickets departing NYC and returning next Thursday on Delta Airlines.,INFORM,,
60_00022,SYSTEM,Do you have a plan on time to leave? Where will you go?,REQUEST,,
60_00022,USER,"Well, there are two of us. We're leaving March 2nd and going to London.",INFORM,,
60_00022,SYSTEM,"well, there's a Delta Airlines flight. It takes off at 6:20 pm. The return on that is 3:35 pm You total is $248 American.",OFFER,,
60_00022,USER,"Fine do that, I need to make sure the tickets are economy, cheapest possible.",INFORM,INFORM_INTENT,SELECT
60_00022,SYSTEM,Here's what I have: 2 departing New York March 2nd at 6:20 pm via Delta Airlines headed to London on Economy. You'll return on March 7th taking off at 3:35 pm.,CONFIRM,,
60_00022,USER,"That's a mouthful, but correct.",AFFIRM,,
60_00022,SYSTEM,"Fine, I have your ticket.",NOTIFY_SUCCESS,,
60_00022,USER,How many stops are there? When will my flight arrive back home?,REQUEST,,
60_00022,SYSTEM,0 stops and you're back about 7:57 pm.,INFORM,,
60_00022,USER,"Cool, thanks. Get me a car for when I'm there.",INFORM_INTENT,,
60_00022,SYSTEM,Do you want Full-size or standard? You'll need the car until March 7th right? How about picking up at Heathrow international Airport?,REQUEST,,
60_00022,USER,"Yes, I'll need it until next Wednesday. I need medium-sized car",INFORM,,AFFIRM
60_00022,SYSTEM,What time will you want to pick it up?,REQUEST,,
60_00022,USER,I can pick it up around two pm.,INFORM,,
60_00022,SYSTEM,You'll need it from March 2nd right?,REQUEST,,
60_00022,USER,How about getting me a small car? I need it from day after tomorrow.,INFORM,,
60_00022,SYSTEM,"Ok, to be clear: You will pick up a compact car on March 3rd at 2 pm. from Heathrow international Airport and you'll turn it back in on March 6th?",CONFIRM,,
60_00022,USER,"Fine, what car model?",REQUEST,AFFIRM,
60_00022,SYSTEM,"You're getting a Forte, it's been reserved.",INFORM,NOTIFY_SUCCESS,
60_00022,USER,perfect Right o.,THANK_YOU,GOODBYE,
60_00022,SYSTEM,"Cheerio, have a good time pip pip.",GOODBYE,,
60_00023,USER,can you look for some round trip flights for me?,INFORM_INTENT,,
60_00023,SYSTEM,where are you departing from?,REQUEST,,
60_00023,USER,i'm leaving from san fran.,INFORM,,
60_00023,SYSTEM,when are you leaving?,REQUEST,,
60_00023,USER,i leave on march 9th.,INFORM,,
60_00023,SYSTEM,what's the destination and the return date?,REQUEST,,
60_00023,USER,i'm going to london and i'll be back on the 14th of this month.,INFORM,,
60_00023,SYSTEM,i found 3 flights that could work for you. there's an american airlines flight that leaves at 7:05 am and returns at 3:05 pm for $377.,OFFER,,
60_00023,USER,"that works for me, can you book them?",INFORM_INTENT,SELECT,
60_00023,SYSTEM,you want me to book 1 american airlines flight from san francisco to london on march 9th and march 14th that leaves at 7:05 am and returns at 3:05 pm in economy?,CONFIRM,,
60_00023,USER,"yes, that's perfect.",AFFIRM,,
60_00023,SYSTEM,it's been reserved.,NOTIFY_SUCCESS,,
60_00023,USER,"thanks, can you get me a standard rental car for the 10th of this month too?",INFORM,,INFORM_INTENT
60_00023,SYSTEM,when will you need it?,REQUEST,,
60_00023,USER,i wanna pick it up at 4:45 pm.,INFORM,,
60_00023,SYSTEM,will you be going to heathrow international airport?,REQUEST,,
60_00023,USER,yes,AFFIRM,,
60_00023,SYSTEM,do you want to return it on march 14th?,REQUEST,,
60_00023,USER,"no, i'll need it until the 12th of march.",INFORM,,
60_00023,SYSTEM,"okay, so you want a standard car from heathrow international airport from march 10th at 4:45 pm until march 12th?",CONFIRM,,
60_00023,USER,yes. what's my total gonna be? and what kind of car is it?,REQUEST,,AFFIRM
60_00023,SYSTEM,it'll cost $64 total and you'll be driving a chevrolet cruze.,INFORM,,NOTIFY_SUCCESS
60_00023,USER,thanks,THANK_YOU,,
60_00023,SYSTEM,is there anything else?,REQ_MORE,,
60_00023,USER,"no, that's it.",NEGATE,THANK_YOU,
60_00023,SYSTEM,have a good day.,GOODBYE,,
60_00024,USER,Find me some round trip flights.,INFORM_INTENT,,
60_00024,SYSTEM,What will be the place and date of departure?,REQUEST,,
60_00024,USER,I will be leaving from LA on Saturday this week.,INFORM,,
60_00024,SYSTEM,What will be the the destination and the date of return?,REQUEST,,
60_00024,USER,My destination is Paris and I will be returning on 10th of this month.,INFORM,,
60_00024,SYSTEM,I found an American Airlines flight which takes off at 9:40 am and the return flight takes off at 4:05 am. The ticket costs $343.,OFFER,,
60_00024,USER,Can you search for any other flights?,REQUEST_ALTS,,
60_00024,SYSTEM,I found a Delta Airlines flight which takes off at 8:25 am and the return flight takes off at 5:35 pm. The ticket costs $341.,OFFER,,
60_00024,USER,What is the destination of the flight?,REQUEST,,
60_00024,SYSTEM,The flight goes to Charles de Gaulle International Airport.,INFORM,,
60_00024,USER,Can you search for any other flights?,REQUEST_ALTS,,
60_00024,SYSTEM,Unfortunately I could not find any flight of your requirements. Is there anything else I can help you with?,NOTIFY_FAILURE,REQ_MORE,
60_00024,USER,can you search again for 4 refundable flight tickets to Chicago?,INFORM,,
60_00024,SYSTEM,I found a Southwest Airlines flight which takes off at 6:45 pm and the return flight takes off at 2:50 pm. The ticket costs $247.,OFFER,,
60_00024,USER,What is the arrival time for my return and onward flight?,REQUEST,,
60_00024,SYSTEM,The arrival time for onward flight is 4:07 am and for return flight is 5:22 pm.,INFORM,,
60_00024,USER,Okay. That sounds good to me. Can you buy Economy tickets for the flight?,INFORM,INFORM_INTENT,SELECT
60_00024,SYSTEM,Please confirm: You want me to buy 4 Economy class tickets in the Southwest Airlines which travels from Los Angeles at 6:45 pm on March 2nd to Chicago and the return flight leaves at 2:50 pm on March 10th.,CONFIRM,,
60_00024,USER,"Yes, That is correct. Can you find the airport the flight departs from and the number of stops?",REQUEST,,AFFIRM
60_00024,SYSTEM,I have successfully booked your tickets. The flight takes off from LAX International Airport with 1 stop.,INFORM,,NOTIFY_SUCCESS
60_00024,USER,Thank you so much for the help.,THANK_YOU,,
60_00024,SYSTEM,Is there anything else I can help you with?,REQ_MORE,,
60_00024,USER,Can you reserve a rental car for me?,INFORM_INTENT,,
60_00024,SYSTEM,"Is the destination O'Hare International Airport?What is your preferred pick up time and the type of car like Full-size, Standard or something else?",REQUEST,,
60_00024,USER,"Okay, That sounds good to me. I need a compact car for pick up at 6:15 pm.",INFORM,,AFFIRM
60_00024,SYSTEM,Is your pick up date March 2nd and drop off date is March 10th?,REQUEST,,
60_00024,USER,My pick up date is 7th of March and drop off date is 8th of March.,INFORM,,
60_00024,SYSTEM,Please confirm: You want me to book a compact car for pick up at 6:15 pm on March 7th from O'Hare International Airport. And the date of drop off is March 8th?,CONFIRM,,
60_00024,USER,"yes, That is correct. Can you find me the name of the car?",REQUEST,AFFIRM,
60_00024,SYSTEM,I have successfully reserved your car and the name of the car is Mini Cooper.,INFORM,NOTIFY_SUCCESS,
60_00024,USER,That will be all. Thank you!,THANK_YOU,GOODBYE,
60_00024,SYSTEM,I am glad I could help. have a great day.,GOODBYE,,
60_00025,USER,Help me look for round trip flights by American Airlines.,INFORM,INFORM_INTENT,
60_00025,SYSTEM,Where will you be leaving from and on what date?,REQUEST,,
60_00025,USER,"I'm going to leave from Phoenix, AZ on the 9th of March.",INFORM,,
60_00025,SYSTEM,And when will you return?,REQUEST,,
60_00025,USER,I'll be back on March 13th. I want to get an Economy ticket.,INFORM,,
60_00025,SYSTEM,Where will you be traveling to?,REQUEST,,
60_00025,USER,I'm going to LA.,INFORM,,
60_00025,SYSTEM,I found 1 flight that will fit. It's American Airlines and the outbound flight is at 7:35 am. The return flight is at 7:50 am. A ticket is $95.,OFFER,,
60_00025,USER,Is it a 1 stop flight? And what's the arrival airport?,REQUEST,,
60_00025,SYSTEM,It has 0 stops. The arrival airport is LAX International Airport.,INFORM,,
60_00025,USER,"Okay, that will work.",SELECT,,
60_00025,SYSTEM,Would you like to purchases tickets?,OFFER_INTENT,,
60_00025,USER,"Yeah, I'd like a ticket.",AFFIRM_INTENT,,
60_00025,SYSTEM,You will purchase 1 Economy ticket on American Airlines. It is a Phoenix departure on March 9th at 7:35 am to Los Angeles. The return is on March 13th at 7:50 am. Is that what you want?,CONFIRM,,
60_00025,USER,"No, I actually need four tickets, there are 4 people going.",INFORM,NEGATE,
60_00025,SYSTEM,"So for American Airlines you want 4 tickets, is that correct?",CONFIRM,,
60_00025,USER,"Yeah, that's it.",AFFIRM,,
60_00025,SYSTEM,The tickets have been purchased.,NOTIFY_SUCCESS,,
60_00025,USER,I also want to book a rental car while I'm there.,INFORM_INTENT,,
60_00025,SYSTEM,"Would you like a Compact, Full-size, or another sized care? And will the rental be until March 13th?",REQUEST,,
60_00025,USER,I'd like a Standard car. It should be from the 10th of this month to the 12th of this month.,INFORM,,
60_00025,SYSTEM,And what time would you like to pick it up?,REQUEST,,
60_00025,USER,I want to get it at half past 5 in the evening.,INFORM,,
60_00025,SYSTEM,You want to book a Standard car from LAX International Airport to be picked up on March 10th at 5:30 pm and dropped off at March 12th. Shall I book this?,CONFIRM,,
60_00025,USER,"Yes, please book it.",AFFIRM,,
60_00025,SYSTEM,I've booked the car.,NOTIFY_SUCCESS,,
60_00025,USER,Thanks so much. I don't need anything else.,THANK_YOU,GOODBYE,
60_00025,SYSTEM,Have a terrific day!,GOODBYE,,
60_00026,USER,Will you find round trip flights?,INFORM_INTENT,,
60_00026,SYSTEM,When and where?,REQUEST,,
60_00026,USER,NYC. Return on 10th of March.,INFORM,,
60_00026,SYSTEM,Leaving from?,REQUEST,,
60_00026,USER,ATL,INFORM,,
60_00026,SYSTEM,When are you leaving?,REQUEST,,
60_00026,USER,March 6th in Economy.,INFORM,,
60_00026,SYSTEM,American Airlines offers outbound flight that leaves at 6:25 am with return flight at 11:20 am for $121.,OFFER,,
60_00026,USER,Cool. Will you buy nonrefundable tickets for 2?,INFORM,,INFORM_INTENT
60_00026,SYSTEM,Please confirm 2 Economy tickets on American Airlines from Atlanta to New York on March 6th at 6:25 am and return on March 10th at 11:20 am.,CONFIRM,,
60_00026,USER,Great. Origin and destination airports?,REQUEST,,AFFIRM
60_00026,SYSTEM,Flight leaves from Hartsfield-Jackson International Airport and arrives at JFK International Airport. Ticket is reserved.,INFORM,,NOTIFY_SUCCESS
60_00026,USER,Will you reserve a car there?,INFORM_INTENT,,
60_00026,SYSTEM,Pick up on March 6th? Drop off on March 10th at what time?,REQUEST,,
60_00026,USER,Pick up at quarter to 6 in the evening on Thursday next week. Keep it till 9th of this month.,INFORM,,
60_00026,SYSTEM,"Standard, Compact or other?",REQUEST,,
60_00026,USER,Something small.,INFORM,,
60_00026,SYSTEM,Please confirm a Compact car from JFK International Airport on March 7th at 5:45 pm to be dropped off on March 9th.,CONFIRM,,
60_00026,USER,Make that a medium-sized car.,INFORM,NEGATE,
60_00026,SYSTEM,Please confirm a Standard car from JFK International Airport.,CONFIRM,,
60_00026,USER,Nice.,AFFIRM,,
60_00026,SYSTEM,I was unable to reserve the car. Anything else?,NOTIFY_FAILURE,REQ_MORE,
60_00026,USER,"No, thanks.",NEGATE,THANK_YOU,
60_00026,SYSTEM,Have a nice day.,GOODBYE,,
60_00027,USER,I would like an economy ticket on a round trip flight.,INFORM,INFORM_INTENT,
60_00027,SYSTEM,When would you like to return?,REQUEST,,
60_00027,USER,I want to return on March 12th and I want to travel on southwest airlines.,INFORM,,
60_00027,SYSTEM,When would you be leaving and from which city?,REQUEST,,
60_00027,USER,"I will be leaving Atlanta, GA on March 4th.",INFORM,,
60_00027,SYSTEM,Where are you heading to?,REQUEST,,
60_00027,USER,I am heading to SF.,INFORM,,
60_00027,SYSTEM,There is 1 suitable flight. There is a flight on southwest airlines that leaves at 6:30 am. It would be returning at 7:10 am and costs $243,OFFER,,
60_00027,USER,Which airport would it be leaving from and does it have 1 stop?,REQUEST,,
60_00027,SYSTEM,It leaves hartsfield-jackson international airport and has 1 stop.,INFORM,,
60_00027,USER,That would be great.,SELECT,,
60_00027,SYSTEM,Would you like tickets?,OFFER_INTENT,,
60_00027,USER,Go ahead and book the ticket for 1.,AFFIRM_INTENT,INFORM,
60_00027,SYSTEM,You would like an economy ticket for 1 on a southwest airlines flight from atlanta to san francisco that leaves on march 4th at 6:30 am and returns on March 12th at 7:10 am?,CONFIRM,,
60_00027,USER,That would work. Is the ticket refundable? When would the return flight land?,REQUEST,,AFFIRM
60_00027,SYSTEM,I have reserved your tickets. The flight lands at 5:04 pm. I am sorry but the ticket is non-refundable.,INFORM,,NOTIFY_SUCCESS
60_00027,USER,Thanks a lot.,THANK_YOU,,
60_00027,SYSTEM,Is there anything else?,REQ_MORE,,
60_00027,USER,I would need a rental car.,INFORM_INTENT,,
60_00027,SYSTEM,You would like to pick it up on March 4th at SFO international airport? What time would be convenient for you?,REQUEST,,
60_00027,USER,I would need it next Thursday at afternoon 1:45.,INFORM,,AFFIRM
60_00027,SYSTEM,What kind of car?,REQUEST,,
60_00027,USER,I would need a large one.,INFORM,,
60_00027,SYSTEM,You would be dropping it off on March 12th?,REQUEST,,
60_00027,USER,I want to keep it till the 8th of March.,INFORM,,
60_00027,SYSTEM,You would like to pick up a full-size car at SFO international airport on March 7th at 1:45 pm till March 8th?,CONFIRM,,
60_00027,USER,That would be great. What type of car is it?,REQUEST,AFFIRM,
60_00027,SYSTEM,I was not able to reserve the car. Is there anything else you would like?,NOTIFY_FAILURE,REQ_MORE,
60_00027,USER,I really need a car. A compact car would work.,INFORM,INFORM_INTENT,
60_00027,SYSTEM,You would like to pick up a compact car at SFO international airport on March 7th at 1:45 pm till March 8th?,CONFIRM,,
60_00027,USER,"Yes, that would be fine.",AFFIRM,,
60_00027,SYSTEM,I was not able to get the car. There is a lovely car available at SFO international airport on March 7th. It is a mini cooper and it would cost $25 in all.,OFFER,,
60_00027,USER,That would be fine.,AFFIRM,,
60_00027,SYSTEM,I have reserved the car.,NOTIFY_SUCCESS,,
60_00027,USER,Thanks a lot.,THANK_YOU,,
60_00027,SYSTEM,Is there anything else?,REQ_MORE,,
60_00027,USER,No. Thanks for your assistance.,NEGATE,THANK_YOU,
60_00027,SYSTEM,Enjoy your day.,GOODBYE,,
60_00028,USER,Can you find some Alaska Airlines round trip flights departing from San Fran.,INFORM,,INFORM_INTENT
60_00028,SYSTEM,When do you want to leave?,REQUEST,,
60_00028,USER,Next Friday.,INFORM,,
60_00028,SYSTEM,Where are you going and when are you coming back?,REQUEST,,
60_00028,USER,"San Diego, I want to be back on the 14th.",INFORM,,
60_00028,SYSTEM,I found 1 Alaska Airlines flight that leaves at 6:10 am. The return flight leaves at 11:10 am and the cost is $103.,OFFER,,
60_00028,USER,That sounds great.,SELECT,,
60_00028,SYSTEM,Do you want to buy the tickets?,OFFER_INTENT,,
60_00028,USER,Yes please.,AFFIRM_INTENT,,
60_00028,SYSTEM,Please confirm the following details: 1 Economy ticket on Alaska Airlines form San Francisco to San Diego. The departure date is March 8th at 6:10 am and the return flight departs on March 14th at 11:10 am.,CONFIRM,,
60_00028,USER,"Yes, what airport does the flight leave from? Is this ticket refundable?",REQUEST,,AFFIRM
60_00028,SYSTEM,Your ticket is confirmed. The flight leaves from SFO International Airport. The ticket unfortunately is not refundable.,INFORM,,NOTIFY_SUCCESS
60_00028,USER,I want to reserve a rental car on the 12th.,INFORM,INFORM_INTENT,
60_00028,SYSTEM,Will you drop it off on March 14th?,REQUEST,,
60_00028,USER,"No, I need it until the 13th.",INFORM,,
60_00028,SYSTEM,What kind of car do you prefer? What time will you need it?,REQUEST,,
60_00028,USER,I want a small car and I want to pick it up at quarter to 6 in the evening.,INFORM,,
60_00028,SYSTEM,Do you want to pick it up at SAN International Airport?,REQUEST,,
60_00028,USER,"Yes, that will work.",AFFIRM,,
60_00028,SYSTEM,Please confirm the following: You are renting a compact car and will pick it up from SAN International Airport on March 12th at 5:45 pm and will drop it off on March 13th.,CONFIRM,,
60_00028,USER,Yes that works.,AFFIRM,,
60_00028,SYSTEM,Sorry I wasn't able to make the reservation. There is a Kia Forte for $29 available at SAN International Airport on March 12th.,OFFER,,
60_00028,USER,No,NEGATE,,
60_00028,SYSTEM,Is there anything else I can help you with?,REQ_MORE,,
60_00028,USER,No that is all.,NEGATE,THANK_YOU,
60_00028,SYSTEM,Have a good day!,GOODBYE,,
60_00029,USER,I am interested in finding a round trip flight.,INFORM_INTENT,,
60_00029,SYSTEM,"Can you tell me where you want to go, and when you plan to return?",REQUEST,,
60_00029,USER,"I want to arrive in Vancouver, BC, and I will return from my trip on March 14th.",INFORM,,
60_00029,SYSTEM,Can you tell me the date when you want to depart?,REQUEST,,
60_00029,USER,I want to depart for my trip on March 7th.,INFORM,,
60_00029,SYSTEM,Which is the location from where you will depart?,REQUEST,,
60_00029,USER,"I will begin my trip from Atlanta, GA.",INFORM,,
60_00029,SYSTEM,"There are 2 flights which match what you need. One of the flights is with Delta Airlines, and it leaves at 3:20 pm, as for the returning flight, it leaves at 2:50 am. The ticket for this flight will cost you $242.",OFFER,,
60_00029,USER,Is there some other flight? I do not care very much about the airline.,INFORM,REQUEST_ALTS,
60_00029,SYSTEM,"There is also an United Airlines flight, which leaves at 6:15 am, and when it returns it takes off at 3:15 am. The ticket for this flight costs $253.",OFFER,,
60_00029,USER,This flight seems as what I want. Can you buy me the tickets for this flight?,INFORM_INTENT,SELECT,
60_00029,SYSTEM,"Can you please confirm that you want to buy Economy class flight ticket for 1 person for the flight of United Airlines which leaves from Atlanta on March 7th at 6:15 am to go to Vancouver, and it returns on March 14th at 3:15 am.",CONFIRM,,
60_00029,USER,This suits me well.,AFFIRM,,
60_00029,SYSTEM,Your requested ticket has been booked.,NOTIFY_SUCCESS,,
60_00029,USER,I appreciate your help. I am also in need of booking a rental car there.,INFORM_INTENT,,
60_00029,SYSTEM,"Will you be picking the car up on March 7th, and will need it till March 14th? Can you tell me the time when you need to have the car?",REQUEST,,
60_00029,USER,"I will be needing the rental car till March 10th, and I will have to take the car on 9th of this month. The time when I will pick up the car is 4:45 pm.",INFORM,,
60_00029,SYSTEM,Is there some specific kind of car you want to have?,REQUEST,,
60_00029,USER,"I want to rent a Compact car, which I can pick up at Vancouver Airport.",INFORM,,
60_00029,SYSTEM,"Can you please confirm that you want to rent a Compact car, which you will pick up at YVR International Airport on March 9th at 4:45 pm, and you will need the car till March 10th?",CONFIRM,,
60_00029,USER,That is what I want.,AFFIRM,,
60_00029,SYSTEM,Your requested car has been booked.,NOTIFY_SUCCESS,,
60_00029,USER,Can you tell me the name of the car?,REQUEST,,
60_00029,SYSTEM,The car you requested is called Chevrolet Bolt.,INFORM,,
60_00029,USER,I appreciate your help very much. That would be all.,THANK_YOU,GOODBYE,
60_00029,SYSTEM,Have a wonderful time!,GOODBYE,,
60_00030,USER,I would like to find a flight.,INFORM_INTENT,,
60_00030,SYSTEM,Where are you leaving from and when are you returning?,REQUEST,,
60_00030,USER,I will be leaving from SF and returning on next Wednesday.,INFORM,,
60_00030,SYSTEM,Where are you traveling and when are you leaving?,REQUEST,,
60_00030,USER,I'm traveling to NYC and leaving on March 3rd.,INFORM,,
60_00030,SYSTEM,There is a flight with American Airlines that leaves at 8:30 pm and returns at 4:45 pm for $235.,OFFER,,
60_00030,USER,That flight sounds good.,SELECT,,
60_00030,SYSTEM,Would you like to purchase tickets?,OFFER_INTENT,,
60_00030,USER,"Yes, I would like to book a ticket.",AFFIRM_INTENT,,
60_00030,SYSTEM,"1 economy ticket from San Francisco to New York with American Airlines from March 3rd to March 6th, leaving at 8:30 pm and returning on 4:45 pm.",CONFIRM,,
60_00030,USER,"Yes, that is perfect.",AFFIRM,,
60_00030,SYSTEM,Your ticket has been purchased.,NOTIFY_SUCCESS,,
60_00030,USER,At what time does the onward flight arrive? Is the flight ticket refundable?,REQUEST,,
60_00030,SYSTEM,The flight ticket is no refundable. The onward flight arrives at 5:56 am.,INFORM,,
60_00030,USER,I would like to rent a car to get there.,INFORM_INTENT,,
60_00030,SYSTEM,What type of car would you like?,REQUEST,,
60_00030,USER,I would like a full-size car.,INFORM,,
60_00030,SYSTEM,At what time would you like the car on March 3rd?,REQUEST,,
60_00030,USER,I will need the car on next Monday at 10:45 till the 5th of March.,INFORM,,
60_00030,SYSTEM,Are you going to pick up the car at JFK International Airport?,REQUEST,,
60_00030,USER,"Yes, that works for me.",AFFIRM,,
60_00030,SYSTEM,Booking a full-size car from JFK International Airport at 10:45 am on March 4th till March 5th.,CONFIRM,,
60_00030,USER,"Yes, that is perfect. What type of car is it and what is the cost?",REQUEST,,AFFIRM
60_00030,SYSTEM,I was unable to rent that car can I help with something else?,NOTIFY_FAILURE,REQ_MORE,
60_00030,USER,"No, that is all for now.",NEGATE,THANK_YOU,
60_00030,SYSTEM,Have a good day.,GOODBYE,,
60_00031,USER,Find me round trip flights from LA on march 3rd?,INFORM,,INFORM_INTENT
60_00031,SYSTEM,What will be your destination?,REQUEST,,
60_00031,USER,My destination is SFO.,INFORM,,
60_00031,SYSTEM,What will be the date of return?,REQUEST,,
60_00031,USER,I will be returning on 9th of March.,INFORM,,
60_00031,SYSTEM,There are 3 flights you might like. One is in Alaska Airlines which departs at 5:50 pm and the return flight departs at 7:10 pm. The price of ticket is $102.,OFFER,,
60_00031,USER,can you search for American Airlines flights on 5th of this month?,INFORM,,REQUEST_ALTS
60_00031,SYSTEM,There is 1 American Airlines flight which departs at 6:30 am and the return flight departs at 4:25 pm. The ticket costs $96.,OFFER,,
60_00031,USER,Can you check whether the ticket is refundable and what is the place of departure?,REQUEST,,
60_00031,SYSTEM,The flight takes off from LAX International Airport and the ticket is non-refundable.,INFORM,,
60_00031,USER,"Okay, That sounds good to me. Can you buy me Economy tickets for the flight?",INFORM,INFORM_INTENT,SELECT
60_00031,SYSTEM,Please confirm: You want me to buy 1 economy ticket in American Airlines traveling from Los Angeles at 6:30 am on march 5th to San Francisco. The return flight takes off at 4:25 pm on March 9th.,CONFIRM,,
60_00031,USER,"No, There is one people in my group.",INFORM,NEGATE,
60_00031,SYSTEM,Please confirm: You want me to buy 1 economy ticket in American Airlines.,CONFIRM,,
60_00031,USER,"Yes, That is correct. can you check how many stops the flight has?",REQUEST,AFFIRM,
60_00031,SYSTEM,I have successfully booked the ticket and the number of stops is 0.,INFORM,NOTIFY_SUCCESS,
60_00031,USER,can you reserve this car for me?,INFORM_INTENT,,
60_00031,SYSTEM,Is the date of pick up March 5th and the place of pick up SFO International Airport?,REQUEST,,
60_00031,USER,Yes. That is correct. I will pick up the car on the 6th.,INFORM,AFFIRM,
60_00031,SYSTEM,What is your preferred time and type for the car?,REQUEST,,
60_00031,USER,I will pick up a medium-sized car at 7:15 pm.,INFORM,,
60_00031,SYSTEM,Will you be needing it till March 9th?,REQUEST,,
60_00031,USER,"The time for pick up will be 12 o""clock in the afternoon on March 7th. The drop of date is the 8th.",INFORM,,
60_00031,SYSTEM,Please confirm: You want me to reserve a standard car for pick up at 12 pm on March 7th from SFO International Airport. The date of drop off is March 8th.,CONFIRM,,
60_00031,USER,No. Find me a small car.,INFORM,NEGATE,
60_00031,SYSTEM,Please confirm again: You want me a compact car for pick up at 12 pm.,CONFIRM,,
60_00031,USER,"Yes, That is correct.",AFFIRM,,
60_00031,SYSTEM,I have successfully booked the car.,NOTIFY_SUCCESS,,
60_00031,USER,Can you tell me the total cost?,REQUEST,,
60_00031,SYSTEM,The total cost for the car is $25.,INFORM,,
60_00031,USER,Thank you for the help!,THANK_YOU,,
60_00031,SYSTEM,Is there anything else I can help you with?,REQ_MORE,,
60_00031,USER,No. That will be all. Thank you!,NEGATE,THANK_YOU,
60_00031,SYSTEM,I am glad I could help. Have a nice day!,GOODBYE,,
60_00032,USER,Look up round trip economy tickets for 3 on United Airlines.,INFORM,,
60_00032,SYSTEM,Departure city? Destination? Return date?,REQUEST,,
60_00032,USER,From Vegas to SF and returning March 12th.,INFORM,,
60_00032,SYSTEM,Departure date?,REQUEST,,
60_00032,USER,The 9th of this month.,INFORM,,
60_00032,SYSTEM,There's a United Airlines flight leaving 3:05 pm and returning 11:55 am for $158.,OFFER,,
60_00032,USER,"Sounds good, book it.",INFORM_INTENT,SELECT,
