dialogue_id,speaker,turn,act_1,act_2,act_3
117_00098,USER,"Yes, that sounds good. I would like to start traveling this Sunday.",INFORM,AFFIRM,
117_00098,SYSTEM,Would you like to fly with Alaska Airlines? The flight will leave at 7:10 pm and the returning flight will leave at 5:50 pm. This ticket will cost $108.,OFFER,,
117_00098,USER,Anything else available?,REQUEST_ALTS,,
117_00098,SYSTEM,How about flying with American Airlines? The flight will leave at 3:50 pm and the returning flight will leave at 6:30 am. This ticket will cost $98.,OFFER,,
117_00098,USER,"When will the returning flight arrive? Also, is it a redeye flight?",REQUEST,,
117_00098,SYSTEM,The returning flight will arrive at 7:55 am. It is not an overnight flight.,INFORM,,
117_00098,USER,"Ok. Thank you, that is all.",SELECT,GOODBYE,
117_00098,SYSTEM,Have a great day.,GOODBYE,,
117_00099,USER,Find for me a rental car please.,INFORM_INTENT,,
117_00099,SYSTEM,By what date do you want it to be?,REQUEST,,
117_00099,USER,Till March 9th will be okay.,INFORM,,
117_00099,SYSTEM,The pick up will be from where?,REQUEST,,
117_00099,USER,I would like to pick it up from Long Beach.,INFORM,,
117_00099,SYSTEM,In what date do you want?,REQUEST,,
117_00099,USER,"The pick up will be from Washington around 11 o""clock in the morning.I will need it from 8th of this month.",INFORM,,
117_00099,SYSTEM,A nice Standard Accord is available on March 8th at Union Station.,OFFER,,
117_00099,USER,Tell me please the total cost.,REQUEST,,
117_00099,SYSTEM,Reservation will cost $28 in total.,INFORM,,
117_00099,USER,Great.I will need a bus that goes there.We are four people.,SELECT,,
117_00099,SYSTEM,Are you leaving in March 8th?,REQUEST,,
117_00099,USER,No.I will leave on the 1st.,INFORM,,
117_00099,SYSTEM,Tell me from where are you leaving.,REQUEST,,
117_00099,USER,From Philadelphia I want to leave.,INFORM,,
117_00099,SYSTEM,I have for you 8 options.One that departs at 7:30 am with 0 transfers and cost $27.,OFFER,,
117_00099,USER,Tell me at which bus station I will reach and what is the bus station from where I will leave.,REQUEST,,
117_00099,SYSTEM,Intercity Terminal is the origin station and the destination is Union Station.,INFORM,,
117_00099,USER,Other variants?I want to be for one person.,INFORM,REQUEST_ALTS,
117_00099,SYSTEM,7 buses I found.With 0 transfer and cost $27 is a bus that departs at 7:50 am.,OFFER,,
117_00099,USER,Great.Find me a round trip flight to get there at Economy class.,INFORM,INFORM_INTENT,
117_00099,SYSTEM,You want to leave on March 8th or March 1st or what date?The return will be on March 9th?,REQUEST,,
117_00099,USER,I would like to start my travel on 5th of this month and return on 10th of March.I prefer a Premium Economy tickets.,INFORM,,
117_00099,SYSTEM,1 option I have for you.What do you think about American Airlines?At cost $214 is a flight that takes off at 9:45 am and return at 5:10 pm.,OFFER,,
117_00099,USER,Tell me from where do the flight land and if is a redeye flight.,REQUEST,,
117_00099,SYSTEM,Flight is for Dulles International Airport and is not an overnight flight.,INFORM,,
117_00099,USER,I understand.Thanks.,SELECT,,
117_00099,SYSTEM,With something else I can help you?,REQ_MORE,,
117_00099,USER,No.Thank you very much.,NEGATE,THANK_YOU,
117_00099,SYSTEM,Have a great day!,GOODBYE,,
117_00100,USER,I'd like to find a full-size rental car.,INFORM,INFORM_INTENT,
117_00100,SYSTEM,What time do you need it and till what date?,REQUEST,,
117_00100,USER,I will need it till the 8th of this month and will pick it up around afternoon 12:30.,INFORM,,
117_00100,SYSTEM,Where will you like to pick it up from?,REQUEST,,
117_00100,USER,I would like from Washington.,INFORM,,
117_00100,SYSTEM,When do you wish to have it from?,REQUEST,,
117_00100,USER,I need the vehicle next Tuesday.,INFORM,,
117_00100,SYSTEM,There's a good Full-size Forester car from Dulles International Airport March 5th.,OFFER,,
117_00100,USER,That sounds great.,SELECT,,
117_00100,SYSTEM,Would you like to reserve the car?,OFFER_INTENT,,
117_00100,USER,"No, I don't but can you help me find a bus going from NYC to there leaving on March 4th?",NEGATE_INTENT,,
117_00100,SYSTEM,The bus will leave at 6 am and cost $39 with 0 transfers.,OFFER,,
117_00100,USER,That sounds nice and I'd like a round trip there.,INFORM_INTENT,,
117_00100,SYSTEM,Will you be leaving March 4th?,REQUEST,,
117_00100,USER,I would like to start travels on March 2nd.,INFORM,,
117_00100,SYSTEM,Will you be returning on March 8th?,REQUEST,,
117_00100,USER,I'll be returning on the 10th of this month.,INFORM,,
117_00100,SYSTEM,I have 2 flights including American Airlines taking off at 10:55 am and with a return flight leaving at 6:05 am for $90.,OFFER,,
117_00100,USER,That will work.,SELECT,,
117_00100,SYSTEM,Could I assist you with anything else?,REQ_MORE,,
117_00100,USER,No thanks so much.,NEGATE,THANK_YOU,
117_00100,SYSTEM,Have a great day.,GOODBYE,,
117_00101,USER,"I'll need to rent a car when I arrive in San Fran so we can visit all the places on our list. Would you help me set up a Standard rental, please?",INFORM,,INFORM_INTENT
117_00101,SYSTEM,When do you want to pick up the car?,REQUEST,,
117_00101,USER,"We'll be arriving about 10:30 am so if I could pick up the rental car in the morning 11 am, that would be great.",INFORM,,
117_00101,SYSTEM,"And, when do you want to return the car?",REQUEST,,
117_00101,USER,Let's make that next Thursday.,INFORM,,
117_00101,SYSTEM,What date do you want your rental to start?,REQUEST,,
117_00101,USER,"Set that up for the 6th of this month, please.",INFORM,,
117_00101,SYSTEM,Current information shows the Standard rental of an Altima that'll be available at SFO International Airport on March 6th.,OFFER,,
117_00101,USER,"Wonderful. Now, what about me taking a bus on the 1st of March to get there?",SELECT,,
117_00101,SYSTEM,What bus station do want for that?,REQUEST,,
117_00101,USER,I'd like a bus out of San Diego.,INFORM,,
117_00101,SYSTEM,"We show 6 buses, leaving at 7:40 am with 0 transfers for $54.",OFFER,,
117_00101,USER,"Okay, so what's the name of that bus station and what station will I arrive at?",REQUEST,,
117_00101,SYSTEM,You would leave out of Santa Fe Depot and arrive at Salesforce Transit Center.,INFORM,,
117_00101,USER,"Very nice, but I'm thinking now that maybe I can catch a round-trip flight that returns on the 12th of this month and save the bus hassle.",INFORM,INFORM_INTENT,
117_00101,SYSTEM,Do you want to leave on March 6th?,REQUEST,,
117_00101,USER,"I could head out earlier, on the 4th.",INFORM,,
117_00101,SYSTEM,"Alaska Airlines has a round-trip flight available, taking off at 11:10 am and returning at 6:10 am for $113.",OFFER,,
117_00101,USER,All right. I'll give it all some more thought. That's it for now. Thanks a lot.,SELECT,GOODBYE,
117_00101,SYSTEM,Definitely. Enjoy your day.,GOODBYE,,
117_00102,USER,"Find me a rental car from Paris, France",INFORM,INFORM_INTENT,
117_00102,SYSTEM,What time do you want the car?,REQUEST,,
117_00102,USER,look for a intermediate car from 10th of March around five pm,INFORM,,
117_00102,SYSTEM,When is the drop off?,REQUEST,,
117_00102,USER,I want it till 11th of this month,INFORM,,
117_00102,SYSTEM,I found 4 cars. How about a Standard and a Accord car at Charles de Gaulle International Airport on March 10th,OFFER,,
117_00102,USER,Do you have any other car?,REQUEST_ALTS,,
117_00102,SYSTEM,How about Standard and a cruze car at Charles de Gaulle International Airport on March 10th,OFFER,,
117_00102,USER,Do you have any other car? Get me a small car from Philly,INFORM,,REQUEST_ALTS
117_00102,SYSTEM,There are 6 cars. How about A cooper and a compact car at Intercity terminal on March 10th,OFFER,,
117_00102,USER,That's good one,SELECT,,
117_00102,SYSTEM,Can I reserve the car,OFFER_INTENT,,
117_00102,USER,No Not now. Find me a bus there,NEGATE_INTENT,,
117_00102,SYSTEM,From where you want?,REQUEST,,
117_00102,USER,I want from Washington,INFORM,,
117_00102,SYSTEM,Do you want to look on March 10th,REQUEST,,
117_00102,USER,No look for the buses on March 2nd,INFORM,,
117_00102,SYSTEM,There are 8 buses. How about the one which departs at 7:10 am and has 0 transfers. The cost is $30,OFFER,,
117_00102,USER,Do you have any other cars? Find the car for four people,INFORM,REQUEST_ALTS,
117_00102,SYSTEM,How about the one which departs from 7:50 am and has 0 transfers. The cost is $25,OFFER,,
117_00102,USER,That's good one. Now look for a round trip flight to there,INFORM_INTENT,,
117_00102,SYSTEM,Are you planning to leave on March 2nd or March 10th?,REQUEST,,
117_00102,USER,I am leaving on next Wednesday,INFORM,,
117_00102,SYSTEM,Do you plan to return on March 11th,REQUEST,,
117_00102,USER,Look for Economy class. I am returning on 13th of this month,INFORM,,
117_00102,SYSTEM,There are 2 flights. How about American Airlines which takes off at 5:10 pm and returning takes off at 9:45 am. The cost is $150,OFFER,,
117_00102,USER,Ok. Thank you for your help,SELECT,GOODBYE,
117_00102,SYSTEM,Have a nice day,GOODBYE,,
117_00103,USER,I'd like to find a rental car for pickup in Washington.,INFORM,INFORM_INTENT,
117_00103,SYSTEM,"When would you like the car, for how long, and what time will you be picking it up?",REQUEST,,
117_00103,USER,I would like the car from the 5th of this month until March 6th. And I should be able to pickup the car near 3:30 in the afternoon.,INFORM,,
117_00103,SYSTEM,There is a Standard Accord available from the Union Station on March 5th.,OFFER,,
117_00103,USER,Awesome.,SELECT,,
117_00103,SYSTEM,I there anything else you'd like me to help you with?,REQ_MORE,,
117_00103,USER,Can you find a bus headed in that direction? I'd only need a seat for one person.,INFORM,INFORM_INTENT,
117_00103,SYSTEM,Where are you departing from? And are you leaving on March 5th?,REQUEST,,
117_00103,USER,I'll be leave Philly on Sunday this week.,INFORM,,
117_00103,SYSTEM,There is a bus with 0 transfers that departs at 7:30 am and the tickets cost $26.,OFFER,,
117_00103,USER,Do you see any other buses available?,REQUEST_ALTS,,
117_00103,SYSTEM,"There is a bus departing at 7:50 am with 0 transfer, and tickets start at $30.",OFFER,,
117_00103,USER,Do you see any buses that are available?,REQUEST_ALTS,,
117_00103,SYSTEM,There is a bus with 0 transfers that is departing at 8:20 am. Tickets start at $33.,OFFER,,
117_00103,USER,Which bus station will I be departing from?,REQUEST,,
117_00103,SYSTEM,The bus leaves from the Intercity Terminal.,INFORM,,
117_00103,USER,"Excellent. I'd like Economy class round-trip tickets, please.",INFORM,INFORM_INTENT,
117_00103,SYSTEM,Are you leaving on March 3rd and returning March 6th?,REQUEST,,
117_00103,USER,I'd like to depart on the 4th of this month and return on the 10th.,INFORM,,
117_00103,SYSTEM,I was able to locate 2 flights for you. There is a flight with American Airlines that departs at 9:45 am and returns at 5:10 pm. Tickets start at $149.,OFFER,,
117_00103,USER,Any other flight regardless of ticket class?,INFORM,REQUEST_ALTS,
117_00103,SYSTEM,"There is a flight with United Airlines that departs at 4:45 am, and has a returning flight at 8:40 pm. Tickets start at $215.",OFFER,,
117_00103,USER,"Okay. That'll be all, thank you.",SELECT,GOODBYE,
117_00103,SYSTEM,Enjoy your day.,GOODBYE,,
117_00104,USER,I'm looking for a car to rent.,INFORM_INTENT,,
117_00104,SYSTEM,From when until when? And what time would you like to pick it up?,REQUEST,,
117_00104,USER,I'll need it from the 11th until the 14th of this month and I want to do a pick up around one in the afternoon.,INFORM,,
117_00104,SYSTEM,From where please?,REQUEST,,
117_00104,USER,In Vegas please.,INFORM,,
117_00104,SYSTEM,"I have 4 possible cars for you. How about a standard Civic, which can be picked up March 11th from McCarran International Airport?",OFFER,,
117_00104,USER,For how much?,REQUEST,,
117_00104,SYSTEM,For $93 total.,INFORM,,
117_00104,USER,What else is available?,REQUEST_ALTS,,
117_00104,SYSTEM,"I also have a standard Elantra available on March 11th, also at McCarran International Airport.",OFFER,,
117_00104,USER,I'd like an intermediate car if possible and could I pick it up around 3:30 pm?,INFORM,,REQUEST_ALTS
117_00104,SYSTEM,There are 2 cars I can recommend. I have a standard Prius for pick up from McCarran International Airport available on March 11th.,OFFER,,
117_00104,USER,How much is that one?,REQUEST,,
117_00104,SYSTEM,That one is $108 total.,INFORM,,
117_00104,USER,"Okay, that's good.",SELECT,,
117_00104,SYSTEM,Should I reserve that for you?,OFFER_INTENT,,
117_00104,USER,"No, not right now. I need a bus please for 1 person on the 5th.",NEGATE_INTENT,,
117_00104,SYSTEM,Leaving from where?,REQUEST,,
117_00104,USER,From SF please.,INFORM,,
117_00104,SYSTEM,"I have a bus leaving at 7:20 am, 0 transfers, for $49.",OFFER,,
117_00104,USER,"Okay. And I need a round trip flight, too.",INFORM_INTENT,,
117_00104,SYSTEM,Is that for a departure on March 11th or March 5th? And will you return on March 14th?,REQUEST,,
117_00104,USER,I'd like to leave Sunday this week.,INFORM,AFFIRM,
117_00104,SYSTEM,There are 3 flight which might work. American Airlines has a flight departing at 12:15 pm and coming back at 5:30 am and the ticket price is $139.,OFFER,,
117_00104,USER,Is it a redeye? And does it have stops?,REQUEST,,
117_00104,SYSTEM,It's not a redeye and it does have 1 stop.,INFORM,,
117_00104,USER,"Okay, I'm good for now.",SELECT,GOODBYE,
117_00104,SYSTEM,Thank you very much.,GOODBYE,,
117_00105,USER,I need a rental reservation. Pull up options please.,INFORM_INTENT,,
117_00105,SYSTEM,"Sure, first please tell me, When are you planning to leave, and do you know from where you would like to pick up this rental?",REQUEST,,
117_00105,USER,Picking up in Philly on the 10th would be the best date. I will need the rental from next Thursday and let's see if i can pick up around 3:30 pm.,INFORM,,
117_00105,SYSTEM,"Ok, at 30th Street Station, there is a Standard Altima availabel for pickup on March 7th.",OFFER,,
117_00105,USER,More options please.,REQUEST_ALTS,,
117_00105,SYSTEM,PHL International Airport has a Standard Civic available for pick up on March 7th.,OFFER,,
117_00105,USER,"No, more options please.",REQUEST_ALTS,,
117_00105,SYSTEM,Intercity Terminal has a Standard Corolla available for pick up on March 7th.,OFFER,,
117_00105,USER,"Maybe, find the total cost of the rental.",REQUEST,,
117_00105,SYSTEM,This reservation would be $84.,INFORM,,
117_00105,USER,"Alright, that will do.",SELECT,,
117_00105,SYSTEM,"Great, should I reserve it now?",OFFER_INTENT,,
117_00105,USER,Not yet. I would like to check buses first. See whats available on the 6th of this month for 1 person.,NEGATE_INTENT,,
117_00105,SYSTEM,Where would you like to depart from?,REQUEST,,
117_00105,USER,Washington would be best.,INFORM,,
117_00105,SYSTEM,I show a bus departing at 7:10 am and will 0 transfers. This ticket would be $23.,OFFER,,
117_00105,USER,Any other options?,REQUEST_ALTS,,
117_00105,SYSTEM,There is another bus departing at 7:50 am and has 0 transfers. This ticket is $27.,OFFER,,
117_00105,USER,More options please.,REQUEST_ALTS,,
117_00105,SYSTEM,I found another bus departing at 8:40 am and has 0 transfers. This ticket would be $29.,OFFER,,
117_00105,USER,"Alright, that will do. Let's go back and check round trip flight there please.",INFORM_INTENT,,
117_00105,SYSTEM,Will you be leaving on March 6th and returning on March 10th?,REQUEST,,
117_00105,USER,I would like to leave on the 1st and return on the 12th of March.,INFORM,,
117_00105,SYSTEM,I found a United Airlines flight departing at 8:40 pm and returning at 4:45 am. This ticket costs $195.,OFFER,,
117_00105,USER,"Alright, sounds good.",SELECT,,
117_00105,SYSTEM,Can I reserve this ticket for you?,REQ_MORE,,
117_00105,USER,"No, just looking for information.",NEGATE,THANK_YOU,
117_00105,SYSTEM,"Alright, Enjoy your day.",GOODBYE,,
117_00106,USER,I like to search a intermediate car for rental. i need the car from the 8th till 13th of this month.,INFORM,,
117_00106,SYSTEM,From where you want to pick it up and at what time you need the car?,REQUEST,,
117_00106,USER,I like to pick it up from NYC around afternoon 1:15,INFORM,,
117_00106,SYSTEM,I have short listed 5 cars of your liking. One of them is available at Grand Central Station for pick up on march 8th. This is a nice Accord car and it is a standard car.,OFFER,,
117_00106,USER,What about the total price?,REQUEST,,
117_00106,SYSTEM,$180 is the total reservation cost.,INFORM,,
117_00106,USER,Can you find anything else for me? I want the car till the 12th around 6:30 in the evening.,INFORM,,REQUEST_ALTS
117_00106,SYSTEM,There is one beautiful Camry car available at JFK International Airport for pick up on march 8th and it is a standard car.,OFFER,,
117_00106,USER,This is cool.,SELECT,,
117_00106,SYSTEM,Are you like to book this car?,OFFER_INTENT,,
117_00106,USER,"No, i don't want to book it now. Could you help me to search for a bus going there?",NEGATE_INTENT,,
117_00106,SYSTEM,Are you interested to leave on march 8th?,REQUEST,,
117_00106,USER,I like to leave on the 7th from Philly.,INFORM,,
117_00106,SYSTEM,I searched 8 buses of your choice. One of them is depart at 8:30 am and has 0 transfers. The cost is $24.,OFFER,,
117_00106,USER,Can you tell me the origin and destination station?,REQUEST,,
117_00106,SYSTEM,Intercity Terminal is the origin station and port Authority Station is the destination station.,INFORM,,
117_00106,USER,Can i get any other buses?,REQUEST_ALTS,,
117_00106,SYSTEM,The bus starts at 9:50 am and has 0 transfers with ticket cost $22.,OFFER,,
117_00106,USER,This is cool.,SELECT,,
117_00106,SYSTEM,Are you like to book tickets on this bus?,OFFER_INTENT,,
117_00106,USER,"No, i am not interested to buy tickets now",NEGATE_INTENT,,
117_00106,SYSTEM,Any more help i can do for you?,REQ_MORE,,
117_00106,USER,I want to search a round trip flight to get there. I want Premium Economy class tickets with United Airlines and my travel date is on the 1st.,INFORM,,
117_00106,SYSTEM,Are you plan to return on march 12th?,REQUEST,,
117_00106,USER,Coming back on 13th of this month.,INFORM,,
117_00106,SYSTEM,Are you plan to fly with United Airlines? The flight takes off at 12:55 pm and returning flight takes off at 10:05 am. The ticket cost is $111.,OFFER,,
117_00106,USER,This is fine.,SELECT,,
117_00106,SYSTEM,You need any other help?,REQ_MORE,,
117_00106,USER,"No, thank you for the help.",NEGATE,THANK_YOU,
117_00106,SYSTEM,Have a great day.,GOODBYE,,
117_00107,USER,Can you help me find a rental car?,INFORM_INTENT,,
117_00107,SYSTEM,"What date do you want to pick it up, and at what time?",REQUEST,,
117_00107,USER,I want to pick i tup on the 5th of March at eleven in the morning.,INFORM,,
117_00107,SYSTEM,Where do you want to pick it up from and how long will you need it?,REQUEST,,
117_00107,USER,I want to pick it up in Philadelphia and will need it until the 9th of March.,INFORM,,
117_00107,SYSTEM,I found a standard size Nissan Altima available for pickup at 30th Street Station on March 5th.,OFFER,,
117_00107,USER,"Okay, that will work for me.",SELECT,,
117_00107,SYSTEM,Should I reserve the car for you?,OFFER_INTENT,,
117_00107,USER,"No, not right now. Can you look for a bus ticket for 1 person going there on the 2nd of March?",NEGATE_INTENT,,
117_00107,SYSTEM,Where will you be leaving from?,REQUEST,,
117_00107,USER,I'm coming from New York.,INFORM,,
117_00107,SYSTEM,I found 7 options for you. There is a bus ticket for $24 that leaves at 7:40 am and has 0 transfers.,OFFER,,
117_00107,USER,"Okay, that sounds good.",SELECT,,
117_00107,SYSTEM,Would you like to buy a ticket for the bus?,OFFER_INTENT,,
117_00107,USER,"No, thanks. Can you look for round trip flights there that return on the 9th of March?",INFORM,INFORM_INTENT,
117_00107,SYSTEM,Will you be leaving March 2nd?,REQUEST,,
117_00107,USER,"No, I don't want to leave until March 3rd.",INFORM,,
117_00107,SYSTEM,"I found an American Airlines flight for $67 that departs at 7:55 am, with a return flight that leaves at 5:35 pm.",OFFER,,
117_00107,USER,"Okay, that's fine.",SELECT,,
117_00107,SYSTEM,Is there anything else I can help you with?,REQ_MORE,,
117_00107,USER,"No, thank you.",NEGATE,THANK_YOU,
117_00107,SYSTEM,Have a wonderful day!,GOODBYE,,
117_00108,USER,Can you help me rent a car? I need one until March 14th?,INFORM,INFORM_INTENT,
117_00108,SYSTEM,Where do you want to pick it up from? What time and date will you pick it up?,REQUEST,,
117_00108,USER,"I want to pick it up in Portland, OR. I would like to pick it up on the 10th of this month at 16:30.",INFORM,,
117_00108,SYSTEM,I found a standard size Honda Accord available for pickup at PDX International Airport on March 10th.,OFFER,,
117_00108,USER,"Okay, that works.",SELECT,,
117_00108,SYSTEM,Should I reserve the car for you?,OFFER_INTENT,,
117_00108,USER,"No, not right now.",NEGATE_INTENT,,
117_00108,SYSTEM,Is there anything else I can help you with?,REQ_MORE,,
117_00108,USER,"Yeah, can you look for a bus to get there? It would be for four people.",INFORM,INFORM_INTENT,
117_00108,SYSTEM,Will you be leaving March 10th?,REQUEST,,
117_00108,USER,"No, I'd like to leave March 1st.",INFORM,,
117_00108,SYSTEM,Where will you be coming from?,REQUEST,,
117_00108,USER,"I will be coming from Seattle, WA.",INFORM,,
117_00108,SYSTEM,I found 10 buses that fit your request. There is one that leaves at 6:10 am and has 0 transfers. The cost is $30.,OFFER,,
117_00108,USER,"Okay, thanks. Can you also look for a round trip flight to get there?",INFORM_INTENT,,
117_00108,SYSTEM,"Will you be leaving March 1st, March 10th, or some other day? And will you return March 14th?",REQUEST,,
117_00108,USER,I want to leave next Monday. The return date looks good.,INFORM,AFFIRM,
117_00108,SYSTEM,"I found 3 flights that match. How about an American Airlines flight that costs $78 and departs at 8:05 am, with a return flight departing at 6 am?",OFFER,,
117_00108,USER,"Ok, thank you.",SELECT,,
117_00108,SYSTEM,Is there anything else you need?,REQ_MORE,,
117_00108,USER,"No, that's all for now, thank you.",NEGATE,THANK_YOU,
117_00108,SYSTEM,"Alright, enjoy your day!",GOODBYE,,
117_00109,USER,I want to rent a large car with pickup point as Las Vegas on 5th of March.,INFORM,,
117_00109,SYSTEM,Till which date do you want the car?,REQUEST,,
117_00109,USER,I need the car till next wednesday.,INFORM,,
117_00109,SYSTEM,At which time do you need the car?,REQUEST,,
117_00109,USER,I want the car to pick me up at morning 10.,INFORM,,
117_00109,SYSTEM,There is 1 car that you may like. It is available at McCarran International Airport on March 5th. It is a full-size escape.,OFFER,,
117_00109,USER,That sounds good. Can you help me in finding a bus from LA for the 1st?,SELECT,,
117_00109,SYSTEM,The bus will depart at 7:40 am and it will cost you $40 and it has 0 transfers.,OFFER,,
117_00109,USER,Are there other buses available for 1 people? I am looking to leave on 2nd of March.,INFORM,,REQUEST_ALTS
117_00109,SYSTEM,The bus will departs at 12:30 pm and it will cost you $37. It has 0 transfers.,OFFER,,
117_00109,USER,Which bus station would I be reaching?,REQUEST,,
117_00109,SYSTEM,The destination will be Union Plaza.,INFORM,,
117_00109,USER,Are there other options available?,REQUEST_ALTS,,
117_00109,SYSTEM,The bus will depart at 1:40 pm and it will cost you $38. It has 0 transfers.,OFFER,,
117_00109,USER,That sounds good to me. I would liek to book a round trip flight there. Please help me find a premium economy ticket on Delta Airlines with return date as 11th of March.,INFORM,,
117_00109,SYSTEM,Are you planning to leave on March 2nd?,REQUEST,,
117_00109,USER,I am travelling on day after tomorrow.,INFORM,,
117_00109,SYSTEM,There is 1 flight available. It is Delta Airlines which takes off at 10:15 pm and return flight takes off at 9:40 pm. The ticket will cost you $146.,OFFER,,
117_00109,USER,ok.,SELECT,,
117_00109,SYSTEM,Is there anything else I can help you with?,REQ_MORE,,
117_00109,USER,No. That's all I needed fro now.,NEGATE,THANK_YOU,
117_00109,SYSTEM,Have a nice day.,GOODBYE,,
117_00110,USER,I need to find a rental car.,INFORM_INTENT,,
117_00110,SYSTEM,What is your pick up location?,REQUEST,,
117_00110,USER,Las Vegas.,INFORM,,
117_00110,SYSTEM,Can you give me your rental time and dates?,REQUEST,,
117_00110,USER,March 5th through the 7th. I will pick up at 3 in the afternoon.,INFORM,,
117_00110,SYSTEM,I found you a Standard Civic at McCarran International Airport. You can pick it up on March 5th.,OFFER,,
117_00110,USER,Is anything else available?,REQUEST_ALTS,,
117_00110,SYSTEM,I found a Standard Elantra at McCarran International Airport. It is available for pickup on March 5th.,OFFER,,
117_00110,USER,Anything else?,REQUEST_ALTS,,
117_00110,SYSTEM,How about a Standard Prius? It is available for pickup at McCarran International Airport on March 5th.,OFFER,,
117_00110,USER,Sounds good. Can you try to find me a bus?,SELECT,,
117_00110,SYSTEM,Are you still leaving on March 5th?,REQUEST,,
117_00110,USER,"No, the 4th of this month.",INFORM,,
117_00110,SYSTEM,What is your departure city?,REQUEST,,
117_00110,USER,I'm looking to leave from Sacramento.,INFORM,,
117_00110,SYSTEM,There is a bus that departs at 7:30 am. It has 1 transfer and costs $73.,OFFER,,
117_00110,USER,Any other buses? I need 3 tickets for March 3rd.,INFORM,,REQUEST_ALTS
117_00110,SYSTEM,I found 9 buses. How about a 10:20 am departure? There is 1 transfers and it costs $65.,OFFER,,
117_00110,USER,Any buses from San Francisco?,INFORM,REQUEST_ALTS,
117_00110,SYSTEM,There are 7 buses available. One departs at 7:20 am and has 0 transfers. It costs $46.,OFFER,,
117_00110,USER,What is my arrival station?,REQUEST,,
117_00110,SYSTEM,The arrival station is Union Plaza.,INFORM,,
117_00110,USER,What is the departure station?,REQUEST,,
117_00110,SYSTEM,Salesforce Transit Center.,INFORM,,
117_00110,USER,Sounds good. Help me find a flight.,INFORM_INTENT,,
