dialogue_id,speaker,turn,act_1,act_2,act_3
60_00085,SYSTEM,The vehicle is a Toyota Prius and the cost of the rental will be $234.,INFORM,,
60_00085,USER,Thank you so much.,THANK_YOU,,
60_00085,SYSTEM,Is there anything else today?,REQ_MORE,,
60_00085,USER,"No, I'm all set.",NEGATE,THANK_YOU,
60_00085,SYSTEM,Thank you very much.,GOODBYE,,
60_00086,USER,"Can you get 2 round trip tickets to Atlanta, GA with a return date of March 14th?",INFORM,,
60_00086,SYSTEM,"Sure, where are you leaving from and when?",REQUEST,,
60_00086,USER,On March 1st from Seattle.,INFORM,,
60_00086,SYSTEM,"Great, I found an American Airlines flight departing at 9:45 pm and returning at 11:40 am. The price is $257.",OFFER,,
60_00086,USER,"That sounds good, can you get the tickets?",INFORM_INTENT,SELECT,
60_00086,SYSTEM,"Just to confirm, you'd like 2 economy seats on the American Airlines flight from Seattle to Atlanta departing March 1st at 9:45 pm and returning on march 14th at 11:40 am?",CONFIRM,,
60_00086,USER,"Yes, which airports am I departing from and arriving to?",REQUEST,,AFFIRM
60_00086,SYSTEM,I've confirmed your reservation for the flight. You're leaving from Seattle-Tacoma International Airport and arriving at Hartsfield-Jackson International Airport.,INFORM,,NOTIFY_SUCCESS
60_00086,USER,"Great, I'll also need a car there.",INFORM_INTENT,,
60_00086,SYSTEM,Is your pick up date on March 1st?,REQUEST,,
60_00086,USER,"No, the 7th at two pm.",INFORM,,
60_00086,SYSTEM,Is your drop off date March 14th and do you have a preference in vehicle?,REQUEST,,
60_00086,USER,I want a compact car until the 12th.,INFORM,,
60_00086,SYSTEM,"Just to confirm, you want a compact car for pickup March 7th at 2 pm from Hartsfield-Jackson International Airport with a return date of March 12th?",CONFIRM,,
60_00086,USER,"Yup, that's correct.",AFFIRM,,
60_00086,SYSTEM,I've reserved your vehicle.,NOTIFY_SUCCESS,,
60_00086,USER,What car did I get?,REQUEST,,
60_00086,SYSTEM,You're renting a Volkswagen GTI.,INFORM,,
60_00086,USER,How much is it?,REQUEST,,
60_00086,SYSTEM,The total reservation is $150.,INFORM,,
60_00086,USER,"Thanks, that's all for now.",THANK_YOU,GOODBYE,
60_00086,SYSTEM,"My pleasure, enjoy your day.",GOODBYE,,
60_00087,USER,Find me round trip flights?,INFORM_INTENT,,
60_00087,SYSTEM,What will be the date of departure and the date of return?,REQUEST,,
60_00087,USER,Date of departure is March 2nd and the date of return is March 14th.,INFORM,,
60_00087,SYSTEM,What will be the place of departure?,REQUEST,,
60_00087,USER,Find me Delta Airlines flights from Paris.,INFORM,,
60_00087,SYSTEM,What is your destination?,REQUEST,,
60_00087,USER,My destination is Chi-town.,INFORM,,
60_00087,SYSTEM,I found a Delta Airlines flight which takes off at 11:20 pm and the return flight takes off at 6:40 pm. The ticket costs $272,OFFER,,
60_00087,USER,What is the destination of the flight?,REQUEST,,
60_00087,SYSTEM,The flight lands in O'hare International Airport.,INFORM,,
60_00087,USER,Okay. That sounds good to me. can you by me Economy tickets for the flight?,INFORM,INFORM_INTENT,SELECT
60_00087,SYSTEM,Please confirm: You want me to buy 1 Economy class ticket for Delta Airlines traveling from Paris at 11:20 pm on March 2nd to Chicago.And the return flight takes off at 6:40 pm on March 14th.,CONFIRM,,
60_00087,USER,"Yes, That is correct.",AFFIRM,,
60_00087,SYSTEM,I have successfully booked the tickets.,NOTIFY_SUCCESS,,
60_00087,USER,Can you find whether the ticket is refundable and the number of stops?,REQUEST,,
60_00087,SYSTEM,"Sorry, It is non-refundable ticket and the flight has 0 stop.",INFORM,,
60_00087,USER,Thank you for the help! Can you reserve a rental car for me?,INFORM_INTENT,,
60_00087,SYSTEM,Is your drop off date March 14th and the pick up date March 2nd? What type of car do you want?,REQUEST,,
60_00087,USER,I want a spacious car for pick up on 4th of March and will drop it off on the 8th.,INFORM,,
60_00087,SYSTEM,What is the pick up time?,REQUEST,,
60_00087,USER,The time for the pick up is quarter to 1 in the afternoon.,INFORM,,
60_00087,SYSTEM,Please confirm: You want me to reserve a Full-size car for pick up at 12:45 pm on March 4th from O'Hare International Airport. And the drop off date is March 8th.,CONFIRM,,
60_00087,USER,"Yes, That is correct. can you find me the total cost and the name of the car?",REQUEST,,AFFIRM
60_00087,SYSTEM,I have successfully reserved the car for you. The name of the car is Honda CR-V and the price is $176.,INFORM,,NOTIFY_SUCCESS
60_00087,USER,Thank you so much!,THANK_YOU,,
60_00087,SYSTEM,Is there anything else I can help you with,REQ_MORE,,
60_00087,USER,That will be all. Thank you!,NEGATE,THANK_YOU,
60_00087,SYSTEM,I am glad I could help. Have a nice day.,GOODBYE,,
60_00088,USER,Hello! Could you help me search for round trip flights returning on the March 12th for 3 passengers?,INFORM,,INFORM_INTENT
60_00088,SYSTEM,"Sure! Where do you plan to depart and travel to, and when do you plan to leave?",REQUEST,,
60_00088,USER,"I will be departing from Seattle on the 1st of this month to Vancouver, BC.",INFORM,,
60_00088,SYSTEM,"Sure, there are 2 available flights, one of which is a Delta Airlines flight which departs at 3:20 am and returns at 7:40 am, and this will cost you $288.",OFFER,,
60_00088,USER,"Sure, could you help me purchase economy class tickets for the flight please?",INFORM,INFORM_INTENT,SELECT
60_00088,SYSTEM,"Sure, please confirm your purchase for 3 economy class tickets for the Delta Airlines flight from Vancouver to Seattle from March 1st at 3:20 am to March 12th at 7:40 am.",CONFIRM,,
60_00088,USER,That sounds great!,AFFIRM,,
60_00088,SYSTEM,Your reservation has been made.,NOTIFY_SUCCESS,,
60_00088,USER,Could you also help me reserve a car there too?,INFORM_INTENT,,
60_00088,SYSTEM,"Sure, what time will you be needing the car?",REQUEST,,
60_00088,USER,I would likely pick up the car at 4 in the evening.,INFORM,,
60_00088,SYSTEM,"Will you be picking up the car at Seattle-Tacoma International Airport, and would you like a Standard, Full-size or some other type of car?",REQUEST,,
60_00088,USER,That sounds great! I would prefer to travel in a compact car please.,INFORM,AFFIRM,
60_00088,SYSTEM,"Sure, will you be using the car till the March 12th?",REQUEST,,
60_00088,USER,"Sorry, could I pick up the car at Roissy Airport instead? I will only need the car till March 3rd.",INFORM,,
60_00088,SYSTEM,"Sure, will you be picking the car up on March 1st?",REQUEST,,
60_00088,USER,"I will need the car tomorrow instead, thanks!",INFORM,,
60_00088,SYSTEM,Please confirm your reservation for a compact car for pickup at Charles de Gaulle International Airport from March 2nd at 4 pm to March 3rd.,CONFIRM,,
60_00088,USER,That sounds great with me.,AFFIRM,,
60_00088,SYSTEM,Your reservation has been made!,NOTIFY_SUCCESS,,
60_00088,USER,Do you know how much will the rental cost me?,REQUEST,,
60_00088,SYSTEM,Your rental will cost you $29 in total.,INFORM,,
60_00088,USER,"Sure, thank you for your help!",THANK_YOU,,
60_00088,SYSTEM,"Sure, do you require any further assistance?",REQ_MORE,,
60_00088,USER,"No, that is all I need, thank you!",NEGATE,THANK_YOU,
60_00088,SYSTEM,"Sure, have a great day ahead!",GOODBYE,,
60_00089,USER,Let's search for a round trip flight please.,INFORM_INTENT,,
60_00089,SYSTEM,"Sure, I would love to help you. First, please tell me, Where do you want to fly to? and what date are you thinking of flying?",REQUEST,,
60_00089,USER,"Let's try to get to Phoenix leaving from Vancouver, BC.",INFORM,,
60_00089,SYSTEM,What are your travel to and fro dates please?,REQUEST,,
60_00089,USER,"Sure, leaving out on March 2nd and returning on March 9th.",INFORM,,
60_00089,SYSTEM,"Ok, I can work with this. I discovered 2 flights for your consideration. Up first, Delta Airlines departing at 3:20 am and returning flight departing at 11:55 am. This ticket is $244.",OFFER,,
60_00089,USER,This will work.,SELECT,,
60_00089,SYSTEM,Shall we proceed and purchase your ticket now?,OFFER_INTENT,,
60_00089,USER,"Yeah, go ahead and book now.",AFFIRM_INTENT,,
60_00089,SYSTEM,"Alright, but first please confirm your details please. 1 Economy ticket on Delta Airlines. Flight will leave out of Vancouver and arrive to Phoenix. Your departure date will be on March 2nd at 3:20 am and return on March 9th, departing at 11:55 am. Do I have this correct?",CONFIRM,,
60_00089,USER,"Yes, please book now.",AFFIRM,,
60_00089,SYSTEM,"Great news, I was able to confirm your ticket.",NOTIFY_SUCCESS,,
60_00089,USER,"Thanks, while we are searching I will need to reserve a car as well.",INFORM_INTENT,,
60_00089,SYSTEM,"Sure, Will this pick up for a rental also be on March 2nd? Would you like a compact or Standard vehicle?",REQUEST,,
60_00089,USER,I need the car for next Tuesday and let's find an intermediate size car please.,INFORM,,
60_00089,SYSTEM,"Sure thing, Will you be returning your rental on March 9th? Will you be able to pick up the rental from Sky Harbor International Airport? I will also need to know your pick up time please.",REQUEST,,
60_00089,USER,"I will need the car until the 8th of this month, I will pick up at 10:45 am and yes I can pick up there.",INFORM,,AFFIRM
60_00089,SYSTEM,"Alright, one moment. Please confirm we will be picking up a standard rental at Sky Harbor International Airport on March 5th at 10:45 am, I have a return date for March 8th. Is this correct.",CONFIRM,,
60_00089,USER,"Alright, that is correct. Find the cost and the type of car please.",REQUEST,,AFFIRM
60_00089,SYSTEM,"Great news, I was able to confirm your rental for a Toyota Prius, total cost will be $96.",INFORM,,NOTIFY_SUCCESS
60_00089,USER,"Great, thank you.",THANK_YOU,,
60_00089,SYSTEM,"your welcome, Can I assist you with anything else?",REQ_MORE,,
60_00089,USER,"Nope, that's it. Good bye.",NEGATE,THANK_YOU,
60_00089,SYSTEM,"Alright, have a wonderful day.",GOODBYE,,
60_00090,USER,I need a roundtrip flight departing from LAX please on any airline.,INFORM,,INFORM_INTENT
60_00090,SYSTEM,What is your destination?,REQUEST,,
60_00090,USER,"That's Paris, France.",INFORM,,
60_00090,SYSTEM,When would you like to leave?,REQUEST,,
60_00090,USER,The 6th please.,INFORM,,
60_00090,SYSTEM,And how about your return?,REQUEST,,
60_00090,USER,On the 9th.,INFORM,,
60_00090,SYSTEM,American Airlines has a 9:40 AM flight with a 4:05 AM return and a ticket price of $377.,OFFER,,
60_00090,USER,That should work.,SELECT,,
60_00090,SYSTEM,Do you want to make reservations?,OFFER_INTENT,,
60_00090,USER,Yes I do.,AFFIRM_INTENT,,
60_00090,SYSTEM,Confirming a March 6th American Airlines flight departing at 9:40 AM from Los Angeles and returning from Paris March 9th at 4:05 AM for 1 economy ticket.,CONFIRM,,
60_00090,USER,"Perfect, thank you.",AFFIRM,,
60_00090,SYSTEM,The reservation was successful.,NOTIFY_SUCCESS,,
60_00090,USER,Are there any stops on that flight?,REQUEST,,
60_00090,SYSTEM,"Yes, there's 1 stop.",INFORM,,
60_00090,USER,Where do I fly out of and what time do I get back?,REQUEST,,
60_00090,SYSTEM,The flight leaves from LAX International Airport and the return time is 10:40 AM.,INFORM,,
60_00090,USER,Great. Would you mind helping me with a rental car as well? I need something I can pick up from Charles De Gaulle International Airport.,INFORM,INFORM_INTENT,
60_00090,SYSTEM,Are you planning on returning it on March 9th?,REQUEST,,
60_00090,USER,"No, I'll just need it until the 8th.",INFORM,,
60_00090,SYSTEM,"What kind of car would you like, compact, full-size, or something different?",REQUEST,,
60_00090,USER,Something spacious please.,INFORM,,
60_00090,SYSTEM,And your pickup time?,REQUEST,,
60_00090,USER,I'd like to pick it up at 14:15.,INFORM,,
60_00090,SYSTEM,Is that on March 6th?,REQUEST,,
60_00090,USER,"No, the 7th of this month.",INFORM,,
60_00090,SYSTEM,Confirming pick up of a full-size rental car from Charles De Gaulle International Airport on March 7th at 2:15 PM and returning on March 8th.,CONFIRM,,
60_00090,USER,Great. What kind of car is it and how much?,REQUEST,,AFFIRM
60_00090,SYSTEM,The vehicle is a Toyota Highlander and the charge will be $48 total. The reservation is complete.,INFORM,,NOTIFY_SUCCESS
60_00090,USER,Thanks for everything.,THANK_YOU,GOODBYE,
60_00090,SYSTEM,It's my pleasure.,GOODBYE,,
60_00091,USER,I want to go for a short trip and for which I need to search for round trip flights. Can you search for the one which is suitable to me?,INFORM_INTENT,,
60_00091,SYSTEM,To which place you are planning to visit?,REQUEST,,
60_00091,USER,I have planned to visit Chi-town and I will return on March 9th.,INFORM,,
60_00091,SYSTEM,"Let me know about the starting date of your travel plan, so that I can search accordingly.",REQUEST,,
60_00091,USER,Search for the flights from today. Anything else you want to search?,INFORM,,
60_00091,SYSTEM,"Yes, what is your present location to search for the flight?",REQUEST,,
60_00091,USER,I want to search the flight from Portland from where am planning to leave.,INFORM,,
60_00091,SYSTEM,Found 2 results. Hope the outbound flight with Southwest Airlines which leaves at 3:15 pm and the return flight leaves at 4:35 am under ticket price $293 is okay to you. How about your opinion?,OFFER,,
60_00091,USER,Any other available flights that you have in your search list?,REQUEST_ALTS,,
60_00091,SYSTEM,What about a flight with United Airlines which is an outbound flight leaves at 10:45 pm and the leaving time of return flight is 4 am for which the price of the ticket is $277? Is that okay to you?,OFFER,,
60_00091,USER,I want to know the arrival time of my return flight for my reference. Can you get me the same?,REQUEST,,
60_00091,SYSTEM,"Yes, it will arrive at 9:58 am. Hope it is okay to you.",INFORM,,
60_00091,USER,Also I need to check whether the ticket is refundable or not? Because there will be a chance of cancelling my trip.,REQUEST,,
60_00091,SYSTEM,"Sorry, the tickets are not refundable.",INFORM,,
60_00091,USER,"That is okay, I can manage and this flight is Okay for me.",SELECT,,
60_00091,SYSTEM,Shall I book the tickets to this flight?,OFFER_INTENT,,
60_00091,USER,"Yes, do it for me.",AFFIRM_INTENT,,
60_00091,SYSTEM,Please confirm to book 1 Economy class ticket in a Flight with United Airlines from Portland on March 1st at 10:45 pm to Chicago and the return flight leaves at 4 am on March 9th.,CONFIRM,,
60_00091,USER,That is confirmed to proceed further.,AFFIRM,,
60_00091,SYSTEM,I have successfully booked the tickets to that flight.,NOTIFY_SUCCESS,,
60_00091,USER,I want to search for a Car for rent to go there and I need your help to find the suitable one.,INFORM_INTENT,,
60_00091,SYSTEM,Let me know whether you want to pick up the car at O'Hare International Airport on March 1st? and at what time your want the Car for pickup?,REQUEST,,
60_00091,USER,Your mentioned place is Okay but change the date to Saturday this week at evening 6:30.,INFORM,,AFFIRM
60_00091,SYSTEM,What type of car you want to book whether it is a Compact one or Full-size or something else?,REQUEST,,
60_00091,USER,I need a large size car for my ride.,INFORM,,
60_00091,SYSTEM,Shall I proceed with the booking for drop-off date on March 9th.,REQUEST,,
60_00091,USER,"No, I need to book it till March 5th. Make it as per my requirement.",INFORM,,
60_00091,SYSTEM,Please confirm to book a Full-size Car for pickup at O'Hare International Airport from March 2nd at 6:30 pm to March 5th.,CONFIRM,,
60_00091,USER,"Yes, that is confirmed to proceed and also get me the details about total cost for that ride.",REQUEST,AFFIRM,
60_00091,SYSTEM,Total cost for that reservation will be $150 and I have booked the Car successfully.,INFORM,NOTIFY_SUCCESS,
60_00091,USER,Let me know the name of the Car so that I can identify it easily.,REQUEST,,
60_00091,SYSTEM,It is a Honda CR-V model Car.,INFORM,,
60_00091,USER,Thank you for your all help and that's all for now.,THANK_YOU,GOODBYE,
60_00091,SYSTEM,Have a good day.,GOODBYE,,
60_00092,USER,Will you fine Economy round trip flights for two?,INFORM,,INFORM_INTENT
60_00092,SYSTEM,Departure and return dates? Where are you leaving from ?,REQUEST,,
60_00092,USER,I'm departing from Vegas Wednesday next week and return on the 9th.,INFORM,,
60_00092,SYSTEM,What's your destination?,REQUEST,,
60_00092,USER,SF.,INFORM,,
60_00092,SYSTEM,American Airlines offers outbound flight that leaves at 5:30 am with return flight at 5:30 pm for $119.,OFFER,,
60_00092,USER,Origin and destination airports?,REQUEST,,
60_00092,SYSTEM,Departs from McCarran International Airport and arrives at SFO International Airport.,INFORM,,
60_00092,USER,Cool.,SELECT,,
60_00092,SYSTEM,Buy tickets?,OFFER_INTENT,,
60_00092,USER,Yes.,AFFIRM_INTENT,,
60_00092,SYSTEM,Please confirm 2 Economy tickets for American Airlines from Las Vegas to San Francisco on March 6th at 5:30 am with return date of March 9th at 5:30 pm.,CONFIRM,,
60_00092,USER,Fine. Does it have 1 stop? Refundable ticket?,REQUEST,,AFFIRM
60_00092,SYSTEM,I've completed your reservation. Nonrefundable ticket with 0 stops.,INFORM,,NOTIFY_SUCCESS
60_00092,USER,Will you reserve a car there?,INFORM_INTENT,,
60_00092,SYSTEM,Pick up March 6th at what time? Drop off on March 9th?,REQUEST,,
60_00092,USER,I want the car from next Thursday at 4 pm till the 8th.,INFORM,,
60_00092,SYSTEM,"Standard, Compact or other?",REQUEST,,
60_00092,USER,Something large.,INFORM,,
60_00092,SYSTEM,Please confirm a Full-size car from SFO International Airport on March 7th at 4 pm with drop off on March 8th.,CONFIRM,,
60_00092,USER,Cool. Name of the car?,REQUEST,AFFIRM,
60_00092,SYSTEM,Ford Escape. I've made your reservation.,INFORM,NOTIFY_SUCCESS,
60_00092,USER,Thanks. That's all.,THANK_YOU,GOODBYE,
60_00092,SYSTEM,Have a nice day.,GOODBYE,,
60_00093,USER,I want you to find me a round trip flight. I will be departing from Seattle.,INFORM,INFORM_INTENT,
60_00093,SYSTEM,"Can you tell me when you will be leaving, and when will you be returning? What is your arrival destination?",REQUEST,,
60_00093,USER,"I need tickets for two people. I will be departing this Saturday, and I want to arrive in San Fran. My returning date is 6th of March.",INFORM,,
60_00093,SYSTEM,"I have found an Alaska Airlines flight which leaves at 12 pm, and when it returns it flies at 2:55 pm. The ticket for this flight costs $131.",OFFER,,
60_00093,USER,"This flight seems nice to me. Please buy the tickets for this flight, and I want the tickets to be Economy ones.",INFORM,INFORM_INTENT,SELECT
60_00093,SYSTEM,"Can you please confirm that you want to buy Economy class flight tickets for 2 people for the flight of Alaska Airlines which departs from Seattle on March 2nd at 12 pm to arrive in San Francisco, and it returns on March 6th at 2:55 pm.",CONFIRM,,
60_00093,USER,That suits me well. Can you tell me from which airport leaves the flight?,REQUEST,AFFIRM,
60_00093,SYSTEM,Your requested ticket has been booked. The flight you want leaves from Seattle-Tacoma International Airport.,INFORM,NOTIFY_SUCCESS,
60_00093,USER,"Can you tell me the time when the return flight is expected to arrive, and if the ticket of the flight is refundable?",REQUEST,,
60_00093,SYSTEM,Your return flight should arrive at 5:06 pm. I regret to say but the flight ticket you want is not refundable.,INFORM,,
60_00093,USER,"I appreciate your help. I want to have a rental car booked there, which I will pick up at 5 pm.",INFORM,INFORM_INTENT,
60_00093,SYSTEM,"Are you willing to pick the car up on March 2nd? Which kind of car you want to rent Standard, Compact or something else? Can you pick the car up at SFO International Airport?",REQUEST,,
60_00093,USER,"That suits me well. I want to have a Compact car, which I will pick up on 4th of March.",INFORM,,AFFIRM
60_00093,SYSTEM,Will you need the rented car till March 6th?,REQUEST,,
60_00093,USER,I will be pick up the rented car at Roissy Airport. I want to have the car on day after tomorrow. I will need to have the car rented till 4th of March.,INFORM,,
60_00093,SYSTEM,"Can you please confirm that you want to rent a Compact car which you will pick up from Charles de Gaulle International Airport on March 3rd at 5 pm, and you will need it till March 4th.",CONFIRM,,
60_00093,USER,Alright that seems nice.,AFFIRM,,
60_00093,SYSTEM,Your requested rental car has been booked.,NOTIFY_SUCCESS,,
60_00093,USER,Can you tell me the name of the rented car?,REQUEST,,
60_00093,SYSTEM,The name of the rented car is Nissan Leaf.,INFORM,,
60_00093,USER,Can you tell me how much renting this car will cost me?,REQUEST,,
60_00093,SYSTEM,Renting this car would cost you $29 in total.,INFORM,,
60_00093,USER,I appreciate your help very much. That would be all.,THANK_YOU,GOODBYE,
60_00093,SYSTEM,Have a good time!,GOODBYE,,
60_00094,USER,Hello! Please can you find me a flight with round trip?,INFORM_INTENT,,
60_00094,SYSTEM,Sure! When is your return? From where will you be starting your journey?,REQUEST,,
60_00094,USER,I'll be returning on 11th of March and will be leaving from LAX.,INFORM,,
60_00094,SYSTEM,Okay! Where are you flying? When are you planning to leave?,REQUEST,,
60_00094,USER,"I'll be travelling to Atlanta, GA by next Tuesday.",INFORM,,
60_00094,SYSTEM,Okay! The American Airlines outbound flight will leave at 5:25 pm and the return flight will leave at 2:30 pm. The cost of the ticket will be $179.,OFFER,,
60_00094,USER,Sounds good to me.,SELECT,,
60_00094,SYSTEM,Please can I help you to buy tickets for this flight?,OFFER_INTENT,,
60_00094,USER,Yup! Please reserve tickets in Economy class.,AFFIRM_INTENT,INFORM,
60_00094,SYSTEM,Please can you confirm me that you wish to reserve 1 Economy ticket in American Airlines that is flying from Los Angeles to Atlanta on March 5th at 5:25 pm and the return flight will be on March 11th at 2:30 pm. Is that right?,CONFIRM,,
60_00094,USER,"Nope, Please book the ticket in Premium Economy.",INFORM,NEGATE,
60_00094,SYSTEM,"Okay! Please confirm that you wish to book the ticket in Premium Economy and the return flight will leave at 2:30 pm, right?",CONFIRM,,
60_00094,USER,"Yup, sounds good to me.",AFFIRM,,
60_00094,SYSTEM,Okay! I've confirmed the ticket for you.,NOTIFY_SUCCESS,,
60_00094,USER,I'm looking for some rental car there. I can pick it up at Hartsfield-Jackson Airport. Please can you find me one?,INFORM,INFORM_INTENT,
60_00094,SYSTEM,"Can you pick it up on March 5th? What is the preferred time? What type of the car like small, compact, medium etc are you looking to rent?",REQUEST,,
60_00094,USER,I'm looking for a small car to rent from next Thursday and I can pick it up at 2:45 pm.,INFORM,,
60_00094,SYSTEM,Can you drop off on March 11th?,REQUEST,,
60_00094,USER,"Nope, I can drop before that on 8th of March itself.",INFORM,,
60_00094,SYSTEM,"Please can you confirm me that you wish to rent a Compact car from March 7th till March 8th and you will pick up the car at Hartsfield-Jackson International Airport at 2:45 pm, right?",CONFIRM,,
60_00094,USER,"Nope, I might need the car till the 9th.",INFORM,NEGATE,
60_00094,SYSTEM,"please confirm me that you will pick up the car on March 7th and drop it on March 9th, right?",CONFIRM,,
60_00094,USER,Yup. What's the name of the car and how much its cost totally?,REQUEST,,AFFIRM
60_00094,SYSTEM,It's Volkswagen GTI and it will cost $52 in total.,INFORM,,NOTIFY_SUCCESS
60_00094,USER,Thanks much for the help,THANK_YOU,,
60_00094,SYSTEM,Do you need any other help?,REQ_MORE,,
60_00094,USER,Nope thanks much,NEGATE,THANK_YOU,
60_00094,SYSTEM,Have a wonderful day.,GOODBYE,,
60_00095,USER,search round trips for me,INFORM_INTENT,,
60_00095,SYSTEM,when will you leave?,REQUEST,,
60_00095,USER,on the 4th,INFORM,,
60_00095,SYSTEM,where are you going from?,REQUEST,,
60_00095,USER,I am going from lax,INFORM,,
60_00095,SYSTEM,when will you be back?,REQUEST,,
60_00095,USER,I will be back on the 11th,INFORM,,
60_00095,SYSTEM,where are you heading?,REQUEST,,
60_00095,USER,I am going to seattle,INFORM,,
60_00095,SYSTEM,alaska airlines leaves 7:10 pm and returns 3:45 pm and is $162,OFFER,,
60_00095,USER,any other flights?,REQUEST_ALTS,,
60_00095,SYSTEM,american airlines at 11:45 pm and leaves at 8:15 am and is $128,OFFER,,
60_00095,USER,is it a refundable one?,REQUEST,,
60_00095,SYSTEM,No and the flight leaves lax international airport,INFORM,,
60_00095,USER,that sounds good. help me buy flight tickets cause I like travelling in economy and there is one person with me,INFORM,,INFORM_INTENT
60_00095,SYSTEM,confirm los angeles to seattle from american airlines leaving march 4th and coming back march 11th and it leaves at 11:45 pm and returns 8:15 am and is seating class economy and 1 person,CONFIRM,,
60_00095,USER,yes that works,AFFIRM,,
60_00095,SYSTEM,it has been confirmed,NOTIFY_SUCCESS,,
60_00095,USER,when does the return flight arrive and what airport?,REQUEST,,
60_00095,SYSTEM,arrives 11:02 am and destination seattle-tacoma international airport,INFORM,,
60_00095,USER,I want the car on the 6th of this month and a spacious one,INFORM,,INFORM_INTENT
60_00095,SYSTEM,drop it off march 11th,REQUEST,,
60_00095,USER,I want till 9th of march,INFORM,,
60_00095,SYSTEM,what time is that?,REQUEST,,
60_00095,USER,quarter to 3 in the afternoon,INFORM,,
60_00095,SYSTEM,pick up car from seattle-tacoma international airport on march 6th at 2:45 pm and drop off is march 9th and it is a full-size car,CONFIRM,,
60_00095,USER,"yes, and what is the cost?",REQUEST,,AFFIRM
60_00095,SYSTEM,subaru forester is $120,INFORM,,NOTIFY_SUCCESS
60_00095,USER,thank you very much,THANK_YOU,,
60_00095,SYSTEM,anything else for you?,REQ_MORE,,
60_00095,USER,no thank you,NEGATE,THANK_YOU,
60_00095,SYSTEM,have a good one,GOODBYE,,
60_00096,USER,Could you look up round trip flights for my sake? I have one person in my cohort.,INFORM,INFORM_INTENT,
60_00096,SYSTEM,"What location will you depart from, and what date do you intend to return? What time do you intend to depart?",REQUEST,,
60_00096,USER,"I am departing on 5th of March from LAX, and I'd like to return on 14th of March.",INFORM,,
