dialogue_id,speaker,turn,act_1,act_2,act_3
32_00039,USER,Great. Whats my balance now?,INFORM_INTENT,THANK_YOU,
32_00039,SYSTEM,"There is $19,435.16 in your savings.",OFFER,,
32_00039,USER,Great. I got to run now.,SELECT,GOODBYE,
32_00039,SYSTEM,No problem. Good bye.,GOODBYE,,
32_00040,USER,Can you help me to check the balance in my savings account?,INFORM,INFORM_INTENT,
32_00040,SYSTEM,"Its done and the balance in your savings account is $4,002.90",OFFER,,
32_00040,USER,Also please check balance with my checking account.,INFORM,REQUEST_ALTS,
32_00040,SYSTEM,"balance of you checking account is $12,509.36",OFFER,,
32_00040,USER,that is okay.,SELECT,,
32_00040,SYSTEM,Do you like to transfer any amount?,OFFER_INTENT,,
32_00040,USER,"Yes, I need to transfer some money.",AFFIRM_INTENT,,
32_00040,SYSTEM,To whom do you want to send the money?,REQUEST,,
32_00040,USER,I need to transfer it to Abhinav from my savings account.,INFORM,,
32_00040,SYSTEM,How much money do you like to transfer?,REQUEST,,
32_00040,USER,Please transfer one thousand seven hundred and twenty dollars from my savings account.,INFORM,,
32_00040,SYSTEM,"Please confirm to transfer $1,720 from your checking account to savings account of Abhinav.",CONFIRM,,
32_00040,USER,"Yes, that is correct. go ahead.",AFFIRM,,
32_00040,SYSTEM,I have successfully transferred the amount.,NOTIFY_SUCCESS,,
32_00040,USER,Please also check the balance.,INFORM_INTENT,,
32_00040,SYSTEM,"The balance of your checking account is $10,789.36",OFFER,,
32_00040,USER,"Thanks, that's all.",SELECT,GOODBYE,
32_00040,SYSTEM,Have a good day.,GOODBYE,,
32_00041,USER,I want to make sure I have plenty of money to spare. I'd like to see how much I have in my savings account.,INFORM,INFORM_INTENT,
32_00041,SYSTEM,"Your savings account has $17,982.31 at the moment.",OFFER,,
32_00041,USER,That's good to know. Now can I find out how much is in my checking account?,INFORM,REQUEST_ALTS,
32_00041,SYSTEM,"Your checking account currently has $3,948.16.",OFFER,,
32_00041,USER,Ok. I want to send some money to a friend. You can send the money to any functional account.,INFORM,INFORM_INTENT,SELECT
32_00041,SYSTEM,How much would you like to send to your friend? What is the name of your friend?,REQUEST,,
32_00041,USER,"My friend is Pranav, who I wish to transfer $1,500 to.",INFORM,,
32_00041,SYSTEM,"Okay then. You want to transfer $1,500 from your checking account to the checking account of Pranav?",CONFIRM,,
32_00041,USER,That is correct.,AFFIRM,,
32_00041,SYSTEM,You have successfully transferred the money.,NOTIFY_SUCCESS,,
32_00041,USER,I'd like to see how much my checking account has after the transfer.,INFORM_INTENT,,
32_00041,SYSTEM,"Your checking account now has $2,448.16.",OFFER,,
32_00041,USER,Got it. See you later!,SELECT,GOODBYE,
32_00041,SYSTEM,Enjoy the rest of your day.,GOODBYE,,
32_00042,USER,I'd like to check the balance in my account.,INFORM_INTENT,,
32_00042,SYSTEM,Which account would you like to check?,REQUEST,,
32_00042,USER,Can you tell me the balance in my checking account?,INFORM,,
32_00042,SYSTEM,"You have a checking account balance of $13,703.79.",OFFER,,
32_00042,USER,I'd also like to know the balance in my savings account.,INFORM,REQUEST_ALTS,
32_00042,SYSTEM,"You have a savings account balance of $18,195.79.",OFFER,,
32_00042,USER,Thank you for the information.,SELECT,,
32_00042,SYSTEM,Can I assist you with a transfer or another banking transaction?,OFFER_INTENT,,
32_00042,USER,"Yes, I would like to send money to Raghav.",AFFIRM_INTENT,INFORM,
32_00042,SYSTEM,How much money would you like to send?,REQUEST,,
32_00042,USER,Please send $1520.,INFORM,,
32_00042,SYSTEM,"Please confirm that you would like to transfer $1,520 from your savings account to the checking account of Raghav.",CONFIRM,,
32_00042,USER,"Yes, that is correct.",AFFIRM,,
32_00042,SYSTEM,The transfer has been successfully completed.,NOTIFY_SUCCESS,,
32_00042,USER,"Can you tell me my current balance, please?",INFORM_INTENT,,
32_00042,SYSTEM,"You have a current balance of $16,675.79 in your savings account.",OFFER,,
32_00042,USER,Thank you for helping.,SELECT,GOODBYE,
32_00042,SYSTEM,Enjoy your day.,GOODBYE,,
32_00043,USER,I want to know my balance,INFORM_INTENT,,
32_00043,SYSTEM,Should I check on savings or checking account?,REQUEST,,
32_00043,USER,Go with the savings account,INFORM,,
32_00043,SYSTEM,"The balance is $2,837.26 in your savings account.",OFFER,,
32_00043,USER,Cool. I want to initiate a fund transfer. Send it to their checking account. Send it to Amir,INFORM,,INFORM_INTENT
32_00043,SYSTEM,How much amount would you like to transfer?,REQUEST,,
32_00043,USER,Make a transfer of six hundred and sixty dollars.,INFORM,,
32_00043,SYSTEM,"Please confirm this : From my savings account, transfer to Amir to their checking account for $660",CONFIRM,,
32_00043,USER,"No make it to Raghav for 1,740 dollars",INFORM,,NEGATE
32_00043,SYSTEM,"Please confirm this : Making a transfer to Raghav for an amount of $1,740",CONFIRM,,
32_00043,USER,Yes thats correct,AFFIRM,,
32_00043,SYSTEM,Your transfer has been made.,NOTIFY_SUCCESS,,
32_00043,USER,I want to know my balance,INFORM_INTENT,,
32_00043,SYSTEM,"The balance is $1,097.26 in your savings account",OFFER,,
32_00043,USER,Okay cool Bye now,SELECT,GOODBYE,
32_00043,SYSTEM,Have a good day,GOODBYE,,
32_00044,USER,I'd like to verify my balance.,INFORM_INTENT,,
32_00044,SYSTEM,What account do you want me to utilize?,REQUEST,,
32_00044,USER,Use my checking account.,INFORM,,
32_00044,SYSTEM,"The checking account has $22,494.33 for the balance.",OFFER,,
32_00044,USER,Inform me of the balance of my savings account.,INFORM,REQUEST_ALTS,
32_00044,SYSTEM,"Your savings account has a balance of $1,230.19.",OFFER,,
32_00044,USER,Alright.,SELECT,,
32_00044,SYSTEM,Do you want to make a transfer?,OFFER_INTENT,,
32_00044,USER,"Yup, I'd like to make a transfer of 600 bucks.",AFFIRM_INTENT,INFORM,
32_00044,SYSTEM,To whom do you want to send the money to?,REQUEST,,
32_00044,USER,Send the money to Xiaoxue.,INFORM,,
32_00044,SYSTEM,Please verify the following information: transfer $600 from my savings account to Xiaoxue's checking account.,CONFIRM,,
32_00044,USER,Exactly.,AFFIRM,,
32_00044,SYSTEM,Your transfer was made.,NOTIFY_SUCCESS,,
32_00044,USER,I'd like to verify my balance.,INFORM_INTENT,,
32_00044,SYSTEM,Your savings account balance is $630.19.,OFFER,,
32_00044,USER,Alright. See ya!,SELECT,GOODBYE,
32_00044,SYSTEM,Have a pleasant afternoon.,GOODBYE,,
32_00045,USER,I want to check the balance of my checking account,INFORM,INFORM_INTENT,
32_00045,SYSTEM,"You have $21,219.36 in your checking account",OFFER,,
32_00045,USER,What is the balance of my savings,INFORM,REQUEST_ALTS,
32_00045,SYSTEM,"You have $24,384.31 in your savings",OFFER,,
32_00045,USER,Ok that's good,SELECT,,
32_00045,SYSTEM,Do you need to make a transfer?,OFFER_INTENT,,
32_00045,USER,I want to transfer $830,AFFIRM_INTENT,INFORM,
32_00045,SYSTEM,Where do you want to transfer to?,REQUEST,,
32_00045,USER,Send it to the checking account of Amir,INFORM,,
32_00045,SYSTEM,Please confirm: Transfer $830 from my savings to the checking account of Amir,CONFIRM,,
32_00045,USER,"Yes, do this, please",AFFIRM,,
32_00045,SYSTEM,I have made the transfer,NOTIFY_SUCCESS,,
32_00045,USER,Please check my balance,INFORM_INTENT,,
32_00045,SYSTEM,"You have $23,554.31 in your savings",OFFER,,
32_00045,USER,"Ok, thanks, bye",SELECT,GOODBYE,
32_00045,SYSTEM,I hope you have a nice day,GOODBYE,,
32_00046,USER,I want to check my balance.,INFORM_INTENT,,
32_00046,SYSTEM,For checking or savings?,REQUEST,,
32_00046,USER,For checking.,INFORM,,
32_00046,SYSTEM,"You have $8,316.79 in your checking.",OFFER,,
32_00046,USER,And the balance in my savings account?,INFORM,REQUEST_ALTS,
32_00046,SYSTEM,"You have $20,335.27 in savings.",OFFER,,
32_00046,USER,"Ok, I want to make a transfer.",INFORM_INTENT,SELECT,
32_00046,SYSTEM,Transfer money to whom and in what amount?,REQUEST,,
32_00046,USER,Transfer $1200 to Raghav.,INFORM,,
32_00046,SYSTEM,"Please confirm: transfer $1,200 from savings to Raghav in their checking.",CONFIRM,,
32_00046,USER,Yes.,AFFIRM,,
32_00046,SYSTEM,Transfer is successful.,NOTIFY_SUCCESS,,
32_00046,USER,"Thanks, I want to check my balance.",INFORM_INTENT,THANK_YOU,
32_00046,SYSTEM,"You have $19,135.27 in savings.",OFFER,,
32_00046,USER,Ok.,SELECT,,
32_00046,SYSTEM,Anything else I can do?,REQ_MORE,,
32_00046,USER,"No, thanks for the help.",NEGATE,THANK_YOU,
32_00046,SYSTEM,Have a great day.,GOODBYE,,
32_00047,USER,Check the balance of my savings account please.,INFORM,INFORM_INTENT,
32_00047,SYSTEM,"Sure, Your current savings account balance is $16,494.74",OFFER,,
32_00047,USER,great.,SELECT,,
32_00047,SYSTEM,Would you like to make a transfer?,OFFER_INTENT,,
32_00047,USER,Yes actually I would. send a transfer to raghav.,AFFIRM_INTENT,INFORM,
32_00047,SYSTEM,"Ok, what amount would you like to transfer?",REQUEST,,
32_00047,USER,Please transfer $260.,INFORM,,
32_00047,SYSTEM,"OK, just to confirm: You want to transfer $260 from your savings to Raghav checking. Does this sound correct?",CONFIRM,,
32_00047,USER,Yes.,AFFIRM,,
32_00047,SYSTEM,Great. Your transfer is complete.,NOTIFY_SUCCESS,,
32_00047,USER,Please check my balance again.,INFORM_INTENT,,
32_00047,SYSTEM,"OK, Your current savings account balance is $16,234.74.",OFFER,,
32_00047,USER,great. thankyou.,SELECT,,
32_00047,SYSTEM,your welcome. Is there anything else I can assist with?,REQ_MORE,,
32_00047,USER,"Nope, that will be all.",NEGATE,THANK_YOU,
32_00047,SYSTEM,"Ok, Have a wonderful day.",GOODBYE,,
32_00048,USER,I wonder what my balance is?,INFORM_INTENT,,
32_00048,SYSTEM,For your checking or savings?,REQUEST,,
32_00048,USER,Try my savings.,INFORM,,
32_00048,SYSTEM,"Savings is $7,883.47.",OFFER,,
32_00048,USER,Alright.,SELECT,,
32_00048,SYSTEM,You want me to do a transfer or something?,OFFER_INTENT,,
32_00048,USER,Yeah. A transfer.,AFFIRM_INTENT,,
32_00048,SYSTEM,Transfer money to who?,REQUEST,,
32_00048,USER,Raghav. Shoot him some bucks.,INFORM,,
32_00048,SYSTEM,How many bucks you want sent his way?,REQUEST,,
32_00048,USER,"$1,330. But make it Pranav.",INFORM,,
32_00048,SYSTEM,"OK. $1,330 from your savings account to Pranav checking account. Please confirm.",CONFIRM,,
32_00048,USER,Confirmed.,AFFIRM,,
32_00048,SYSTEM,Done. Transfer has been made.,NOTIFY_SUCCESS,,
32_00048,USER,So what's my balance now?,INFORM_INTENT,,
32_00048,SYSTEM,"Savings balance is $6,553.47.",OFFER,,
32_00048,USER,Fine.,SELECT,,
32_00048,SYSTEM,You need anything else?,REQ_MORE,,
32_00048,USER,"No, thanks a lot Man.",NEGATE,THANK_YOU,
32_00048,SYSTEM,You're welcome. Take care.,GOODBYE,,
32_00049,USER,Can you check my bank account balance please?,INFORM_INTENT,,
32_00049,SYSTEM,"Which account shall I check for you, savings or checking?",REQUEST,,
32_00049,USER,"My checking account please, I need the balance.",INFORM,,
32_00049,SYSTEM,"Your checking account balance is $1,597.61.",OFFER,,
32_00049,USER,Would you also check my savings balance?,INFORM,REQUEST_ALTS,
32_00049,SYSTEM,"Savings account balance is $22,559.34.",OFFER,,
32_00049,USER,Thank You,SELECT,,
32_00049,SYSTEM,Do you wish to make a transfer of funds?,OFFER_INTENT,,
32_00049,USER,Yes. I need to transfer 730 dollars to a different savings account.,AFFIRM_INTENT,INFORM,
32_00049,SYSTEM,Whose account shall I send the funds to?,REQUEST,,
32_00049,USER,Please remit funds to Amir.,INFORM,,
32_00049,SYSTEM,To confirm: You wish to transfer $730 from your savings count to savings account owned by Amir?,CONFIRM,,
32_00049,USER,That is correct,AFFIRM,,
32_00049,SYSTEM,The transfer is complete. Is there anything else I can do?,NOTIFY_SUCCESS,,
32_00049,USER,I would like to know my updated balance.,INFORM_INTENT,THANK_YOU,
32_00049,SYSTEM,"Current savings balance is $21,829.34.",OFFER,,
32_00049,USER,Thank you for checking.,SELECT,,
32_00049,SYSTEM,Will there be anything else?,REQ_MORE,,
32_00049,USER,That will be all thank you.,NEGATE,THANK_YOU,
32_00049,SYSTEM,Have a lovely day.,GOODBYE,,
32_00050,USER,"Hey, can I check my bank balance?",INFORM_INTENT,,
32_00050,SYSTEM,Which account would you like to check?,REQUEST,,
32_00050,USER,"I think my savings account, please.",INFORM,,
32_00050,SYSTEM,"The current balance in your savings account is $3,857.79.",OFFER,,
32_00050,USER,"Ok, and while you're at it, what's the balance in my checking account?",INFORM,REQUEST_ALTS,
32_00050,SYSTEM,"Your checking account balance is at $13,174.25.",OFFER,,
32_00050,USER,That sounds right.,SELECT,,
32_00050,SYSTEM,Do you need to take any action with your accounts today?,OFFER_INTENT,,
32_00050,USER,"Yeah, I need to make a transfer.",AFFIRM_INTENT,,
32_00050,SYSTEM,How much would you like to transfer today?,REQUEST,,
32_00050,USER,I need to transfer eight hundred dollars.,INFORM,,
32_00050,SYSTEM,Where is the money being sent?,REQUEST,,
32_00050,USER,Please send it to Srinivas.,INFORM,,
32_00050,SYSTEM,To review: You'd like to transfer $800 from your checking account to the checking account belonging to Srinivas.,CONFIRM,,
32_00050,USER,"Yeah, that's right.",AFFIRM,,
32_00050,SYSTEM,Your transfer has been completed.,NOTIFY_SUCCESS,,
32_00050,USER,Can I check my balance again?,INFORM_INTENT,,
32_00050,SYSTEM,"Your checking account balance is now at $12,374.25",OFFER,,
32_00050,USER,Alright.,SELECT,,
32_00050,SYSTEM,Is there anything else I can help you with today?,REQ_MORE,,
32_00050,USER,"No, that's everything, thanks.",NEGATE,THANK_YOU,
32_00050,SYSTEM,Have a good day.,GOODBYE,,
32_00051,USER,I need to pay some bills. What is my bank balance.,INFORM_INTENT,,
32_00051,SYSTEM,WOuld you like the checking or savings balance.,REQUEST,,
32_00051,USER,"Checking, please. I'm hoping I don't have to tap my savings.",INFORM,,
32_00051,SYSTEM,"The current balance in your checking account is $1,274.55.",OFFER,,
32_00051,USER,"Ok, that's good.",SELECT,,
32_00051,SYSTEM,WOuld you like to transfer funds or pay bills online?,OFFER_INTENT,,
32_00051,USER,Let's transfer funds.,AFFIRM_INTENT,,
32_00051,SYSTEM,How much would you liek to transfer?,REQUEST,,
32_00051,USER,I need to transfer 400 bucks.,INFORM,,
32_00051,SYSTEM,Who is the recipient of the transfer.,REQUEST,,
32_00051,USER,The transfer is to Sanuj,INFORM,,
32_00051,SYSTEM,Ok. You wish to transfer $400 from your checking account to Sanuj checking account. Is this correct?,CONFIRM,,
32_00051,USER,Yes. That is correct.,AFFIRM,,
32_00051,SYSTEM,The transfer is complete.,NOTIFY_SUCCESS,,
32_00051,USER,Thanks. What was my balance again?,INFORM_INTENT,THANK_YOU,
32_00051,SYSTEM,The current balance in your checking account is $874.55.,OFFER,,
32_00051,USER,Cool.,SELECT,,
32_00051,SYSTEM,Do you require anything else?,REQ_MORE,,
32_00051,USER,"Not just now, thanks.",NEGATE,THANK_YOU,
32_00051,SYSTEM,Let me know if I can be of any further assistance.,GOODBYE,,
32_00052,USER,I would like to check my balance.,INFORM_INTENT,,
32_00052,SYSTEM,Do you want me to check the checking or savings account?,REQUEST,,
32_00052,USER,Go with the savings account.,INFORM,,
32_00052,SYSTEM,"The savings account balance is $24,991.25.",OFFER,,
32_00052,USER,"Okay, how about my checking account?",INFORM,REQUEST_ALTS,
32_00052,SYSTEM,"Your checking account balance is $22,020.31.",OFFER,,
32_00052,USER,Okay.,SELECT,,
32_00052,SYSTEM,Do you want to start a transfer?,OFFER_INTENT,,
32_00052,USER,"Yes, I want to make a transfer.",AFFIRM_INTENT,,
32_00052,SYSTEM,Who will you send money to?,REQUEST,,
32_00052,USER,Send it to Srinivas.,INFORM,,
32_00052,SYSTEM,How much do you want to transfer?,REQUEST,,
32_00052,USER,Send 650 bucks.,INFORM,,
32_00052,SYSTEM,Please confirm that you are transferring $650 to Srinivas checking account fom your checking account.,CONFIRM,,
32_00052,USER,"Yep, that is right.",AFFIRM,,
32_00052,SYSTEM,You have made the transfer.,NOTIFY_SUCCESS,,
32_00052,USER,I would like to check my balance.,INFORM_INTENT,,
32_00052,SYSTEM,"You have $21,370.31 in your checking.",OFFER,,
32_00052,USER,All right.,SELECT,,
32_00052,SYSTEM,Could I help with something else?,REQ_MORE,,
32_00052,USER,"No, that is it but thank you.",NEGATE,THANK_YOU,
32_00052,SYSTEM,Have a good one.,GOODBYE,,
32_00053,USER,"I would like to check the balance on my account, please.",INFORM_INTENT,,
32_00053,SYSTEM,Would you like me to use your checking or savings account?,REQUEST,,
32_00053,USER,"I would like the balance from my checking account, please.",INFORM,,
32_00053,SYSTEM,"The current balance of your checking account is $22,326.22.",OFFER,,
32_00053,USER,Could I get the balance to my savings account as well?,INFORM,REQUEST_ALTS,
32_00053,SYSTEM,"The current balance of your savings account is $20,186.84.",OFFER,,
32_00053,USER,Thank You.,SELECT,,
32_00053,SYSTEM,What amount do you need to transfer?,OFFER_INTENT,,
32_00053,USER,"Yes, I would like to transfer 720 bucks to Maria.",AFFIRM_INTENT,INFORM,
32_00053,SYSTEM,Please confirm that you would like to transfer $720 from your savings account to Maria's checking account.,CONFIRM,,
32_00053,USER,That is correct.,AFFIRM,,
32_00053,SYSTEM,Your transfer is complete.,NOTIFY_SUCCESS,,
32_00053,USER,Thank You. What is the current balance of my savings account?,INFORM_INTENT,THANK_YOU,
32_00053,SYSTEM,"Your current balance of your savings account is $19,466.84",OFFER,,
32_00053,USER,"OK, Thank you.",SELECT,GOODBYE,
32_00053,SYSTEM,"Your welcome, have a great day!",GOODBYE,,
32_00054,USER,I need to check my balance.,INFORM_INTENT,,
32_00054,SYSTEM,Which account i need to use?,REQUEST,,
32_00054,USER,move with my checking account.,INFORM,,
32_00054,SYSTEM,"Your balance is $13,507.61 from your checking account.",OFFER,,
32_00054,USER,Looking into my savings account can you tell me the balance of another account,INFORM,REQUEST_ALTS,
32_00054,SYSTEM,"Your balance is $12,087.67 from your savings account.",OFFER,,
32_00054,USER,I will be interested in making the transfer and send it to their savings account.,INFORM,INFORM_INTENT,SELECT
32_00054,SYSTEM,How much money you want to transfer and to whom?,REQUEST,,
32_00054,USER,I need you to transfer one thousand seven hundred and thirty bucks to Amir.,INFORM,,
32_00054,SYSTEM,"please give confirmation details: Transfer $1,730 from my savings account to Amir",CONFIRM,,
32_00054,USER,ok,AFFIRM,,
32_00054,SYSTEM,Your transfer has been done,NOTIFY_SUCCESS,,
32_00054,USER,Thank you very much for your help. I will check the balance.,INFORM_INTENT,THANK_YOU,
32_00054,SYSTEM,"The total amount is $10,357.67 and this is from your savings account.",OFFER,,
32_00054,USER,ok then Good.Bye.,SELECT,GOODBYE,
32_00054,SYSTEM,Have a good day.,GOODBYE,,
32_00055,USER,What's my balance?,INFORM_INTENT,,
32_00055,SYSTEM,What balance are you checking?,REQUEST,,
32_00055,USER,I need the balance for my checking account.,INFORM,,
32_00055,SYSTEM,Your checking account balance $960.16.,OFFER,,
32_00055,USER,Great!,SELECT,,
32_00055,SYSTEM,Would you like to transfer funds?,OFFER_INTENT,,
32_00055,USER,Yes I do.,AFFIRM_INTENT,,
32_00055,SYSTEM,How much do you want to transfer?,REQUEST,,
32_00055,USER,Send Srinivas 50 bucks.,INFORM,,
32_00055,SYSTEM,Please confirm that you are sending $50 to the Srinivas checking account from your checking account.,CONFIRM,,
32_00055,USER,That's correct.,AFFIRM,,
32_00055,SYSTEM,The transfer has been completed.,NOTIFY_SUCCESS,,
32_00055,USER,What's my balance now?,INFORM_INTENT,,
32_00055,SYSTEM,You have $910.16 available in your checking account.,OFFER,,
32_00055,USER,"Great, thank you.",SELECT,GOODBYE,
32_00055,SYSTEM,Have a good day!,GOODBYE,,
32_00056,USER,What's my balance?,INFORM_INTENT,,
32_00056,SYSTEM,Would you like to know the balance on your checking or your savings account?,REQUEST,,
32_00056,USER,My checking account.,INFORM,,
32_00056,SYSTEM,"There is $17,402.20 in your checking account.",OFFER,,
32_00056,USER,"Please transfer $1,770 from that account to Pranav.",INFORM,,INFORM_INTENT
32_00056,SYSTEM,"Okay, the transfer will be a total of $1,770 from your checking account to the checking account for Pranav. Is this correct?",CONFIRM,,
32_00056,USER,Yes.,AFFIRM,,
32_00056,SYSTEM,Your transfer is complete.,NOTIFY_SUCCESS,,
32_00056,USER,What's my balance now?,INFORM_INTENT,,
32_00056,SYSTEM,"There is $15,632.20 in your checking account.",OFFER,,
32_00056,USER,Okay.,SELECT,,
32_00056,SYSTEM,Is there anything else I can assist you with?,REQ_MORE,,
32_00056,USER,"No, thank you.",NEGATE,THANK_YOU,
32_00056,SYSTEM,Have a great day.,GOODBYE,,
32_00057,USER,i want to check my balance about my checking account.,INFORM,INFORM_INTENT,
32_00057,SYSTEM,"the blance is $4,482.60 in your checking",OFFER,,
32_00057,USER,i want to know about my savings,INFORM,REQUEST_ALTS,
32_00057,SYSTEM,"the balance is $9,032.11 savings account",OFFER,,
32_00057,USER,ok i would like to make a transfer,INFORM_INTENT,SELECT,
32_00057,SYSTEM,what amount would you like to transfer?,REQUEST,,
32_00057,USER,"transfer 1,630 bucks",INFORM,,
32_00057,SYSTEM,who would you like to send money to?,REQUEST,,
32_00057,USER,sent it to xiaoxue,INFORM,,
32_00057,SYSTEM,"from my savings $1,630 to xiaoxue their checking",CONFIRM,,
32_00057,USER,yes,AFFIRM,,
32_00057,SYSTEM,your transfer is successful,NOTIFY_SUCCESS,,
32_00057,USER,thanks for your help.,INFORM_INTENT,THANK_YOU,
32_00057,SYSTEM,"the balance is $7,402.11 in your savings",OFFER,,
32_00057,USER,ok thanks for you help,SELECT,GOODBYE,
32_00057,SYSTEM,have a nice day,GOODBYE,,
32_00058,USER,I need to what my balance in my savings account is.,INFORM,INFORM_INTENT,
32_00058,SYSTEM,"Your savings account balance is $20,611.26.",OFFER,,
32_00058,USER,OK,SELECT,,
32_00058,SYSTEM,Did you want to make a transfer?,OFFER_INTENT,,
32_00058,USER,"Please, I need to make a transfer to their savings account.",AFFIRM_INTENT,INFORM,
32_00058,SYSTEM,To whom do you want to send money. How much do you want to transfer.,REQUEST,,
32_00058,USER,"Please send $1,780 to Amir.",INFORM,,
32_00058,SYSTEM,"Details to confirm: Transfer $1,780 to Amir's savings account from my savings account.",CONFIRM,,
32_00058,USER,"Yes, that is correct,",AFFIRM,,
32_00058,SYSTEM,Your funds have been successfully transferred.,NOTIFY_SUCCESS,,
32_00058,USER,Thanks for your assistance.,THANK_YOU,,
32_00058,SYSTEM,May I help you with anything else.,REQ_MORE,,
32_00058,USER,Please check my balance.,INFORM_INTENT,,
32_00058,SYSTEM,"Your savings account has a balance of $18,831.26.",OFFER,,
32_00058,USER,Great. Thank you for helping me.,SELECT,GOODBYE,
32_00058,SYSTEM,Have a wonderful day.,GOODBYE,,
32_00059,USER,I want to check my balance of my checking account.,INFORM,INFORM_INTENT,
32_00059,SYSTEM,"The balance of your checking account is $13,053.62.",OFFER,,
32_00059,USER,Tell me about my savings account.,INFORM,REQUEST_ALTS,
32_00059,SYSTEM,"The balance is $14,153.36 in your savings account.",OFFER,,
32_00059,USER,Ok.,SELECT,,
32_00059,SYSTEM,Is there anything else I can help you with?,REQ_MORE,,
32_00059,USER,I want to make a transfer.,INFORM_INTENT,,
32_00059,SYSTEM,Where would you like to send it? How much?,REQUEST,,
32_00059,USER,Transfer $580 to Raghav. Send it to any account that works.,INFORM,,
32_00059,SYSTEM,Please confirm these details: Transfer $580 from savings to Raghav in their checking account.,CONFIRM,,
32_00059,USER,Yes.,AFFIRM,,
32_00059,SYSTEM,It was successful.,NOTIFY_SUCCESS,,
32_00059,USER,"Thanks, can I check my balance?",INFORM_INTENT,THANK_YOU,
32_00059,SYSTEM,"The balance is $13,573.36 in your savings account.",OFFER,,
32_00059,USER,"Ok, thanks for the help.",SELECT,GOODBYE,
32_00059,SYSTEM,Have a great day.,GOODBYE,,
32_00060,USER,Could you find out my balance please.,INFORM_INTENT,,
32_00060,SYSTEM,Which account do you want the information for?,REQUEST,,
32_00060,USER,I need my checking account balance.,INFORM,,
32_00060,SYSTEM,"There is $14,478.13 in your checking account.",OFFER,,
32_00060,USER,I need to transfer some money.,INFORM_INTENT,SELECT,
32_00060,SYSTEM,Who will be receiving the transfer?,REQUEST,,
32_00060,USER,"I need to send money to Maria, use any account that will allow that.",INFORM,,
32_00060,SYSTEM,How much do you want to send to Maria?,REQUEST,,
32_00060,USER,"I told her I would send 1,010 dollars so send that please.",INFORM,,
32_00060,SYSTEM,"You want to send Maria $1,010 from your checking account to her checking account. Is that correct?",CONFIRM,,
32_00060,USER,That is correct.,AFFIRM,,
32_00060,SYSTEM,The transfer went through.,NOTIFY_SUCCESS,,
32_00060,USER,I would like to check my balance again please.,INFORM_INTENT,,
32_00060,SYSTEM,"The amount in your checking account is now $13,468.13.",OFFER,,
32_00060,USER,Alright thank you.,SELECT,,
32_00060,SYSTEM,What else can I help you with?,REQ_MORE,,
32_00060,USER,Nothing at the moment. Thank you for your assistance.,NEGATE,THANK_YOU,
32_00060,SYSTEM,I wish you a wonderful day.,GOODBYE,,
32_00061,USER,I want to check my balance.,INFORM_INTENT,,
32_00061,SYSTEM,Which account should I check?,REQUEST,,
32_00061,USER,I want to know my checking account balance.,INFORM,,
32_00061,SYSTEM,"The balance is $24,432.56 in your checking account.",OFFER,,
32_00061,USER,Ok.,SELECT,,
32_00061,SYSTEM,Would you like to transfer any money?,OFFER_INTENT,,
32_00061,USER,"Yes, I would like to transfer $1550 to their checking account.",AFFIRM_INTENT,INFORM,
32_00061,SYSTEM,Who would you like to send money to?,REQUEST,,
32_00061,USER,Send it to Maria for her savings account.,INFORM,,
32_00061,SYSTEM,"Please confirm the following: transfer $1,550 from my checking account to Maria for her savings account.",CONFIRM,,
32_00061,USER,Yes.,AFFIRM,,
32_00061,SYSTEM,Your transfer has been successful.,NOTIFY_SUCCESS,,
32_00061,USER,Thank you for your help. I would like to check my balance.,INFORM_INTENT,THANK_YOU,
32_00061,SYSTEM,"The balance is $22,882.56 in your checking account.",OFFER,,
32_00061,USER,Ok.,SELECT,,
