dialogue_id,speaker,turn,act_1,act_2,act_3
29_00059,SYSTEM,In which city should I search?,REQUEST,,
29_00059,USER,I want you to find a salon in SF,INFORM,,
29_00059,SYSTEM,"Okay, I have found 10 salons for you. 1512 Barber shop seems to be a nice salon in San Francisco",OFFER,,INFORM_COUNT
29_00059,USER,what's its address? is it unisex?,REQUEST,,
29_00059,SYSTEM,"Yes, it is unisex. It's address is 1532 20th street.",INFORM,,
29_00059,USER,"Cool, book me an appointment on the 7th at 15:00.",INFORM,,INFORM_INTENT
29_00059,SYSTEM,"Please confirm. Appointment at 1512 Barber shop, next thursday at 3 pm.",CONFIRM,,
29_00059,USER,No change that to 14th of this month at afternoon 3:15,INFORM,,NEGATE
29_00059,SYSTEM,Okay. Please confirm. Appointment on March 14th at 3:15 pm.,CONFIRM,,
29_00059,USER,"Okay, that's right",AFFIRM,,
29_00059,SYSTEM,I couldn't make that. I have booked appointment at 1512 Barber shop on March 14th at 3 pm.,OFFER,,
29_00059,USER,"Yes, that is correct",AFFIRM,,
29_00059,SYSTEM,Your appointment is booked.,NOTIFY_SUCCESS,,
29_00059,USER,Thanks a ton,THANK_YOU,,
29_00059,SYSTEM,Do you need something else,REQ_MORE,,
29_00059,USER,"No, this would be all.",NEGATE,THANK_YOU,
29_00059,SYSTEM,Have a great day.,GOODBYE,,
29_00060,USER,I am looking for a salon in Redwood City.,INFORM,INFORM_INTENT,
29_00060,SYSTEM,There is a nice one in Redwood City called August Barbershop.,OFFER,,
29_00060,USER,Is the salon unisex?,REQUEST,,
29_00060,SYSTEM,"Yes, it is unisex.",INFORM,,
29_00060,USER,Is there another salon you can find?,REQUEST_ALTS,,
29_00060,SYSTEM,Another nice one in Redwood City is Natalie's Salon.,OFFER,,
29_00060,USER,What is the address and phone number?,REQUEST,,
29_00060,SYSTEM,The address of the salon is 2606 Broadway and their phone number is 650-298-8586.,INFORM,,
29_00060,USER,"Yes, that sounds fine, book me an appointment there.",INFORM_INTENT,SELECT,
29_00060,SYSTEM,What is the day you wish to have the appointment?,REQUEST,,
29_00060,USER,I would like to go on March 3rd.,INFORM,,
29_00060,SYSTEM,What time do you want to schedule the appointment for?,REQUEST,,
29_00060,USER,I would like to have the appointment at five pm.,INFORM,,
29_00060,SYSTEM,"Confirm these details for me please. The hairstylist will be Natalie's Salon, your appointment is at 5 pm and the appointment will be for the day after tomorrow.",CONFIRM,,
29_00060,USER,"No, I would like to have the appointment at 4:45 pm instead.",INFORM,NEGATE,
29_00060,SYSTEM,"Okay, please tell me if these details are right: the hair stylist will be Natalie's Salon and you will be scheduled at 4:45 pm.",CONFIRM,,
29_00060,USER,"No, I wish to go on the 14th of this month instead.",INFORM,NEGATE,
29_00060,SYSTEM,Confirm these details for me: the appointment will be at 4:45 pm on March 14th.,CONFIRM,,
29_00060,USER,"Yes, that is fine. Is the salon unisex?",REQUEST,AFFIRM,
29_00060,SYSTEM,The appointment is set and confirmed. The salon is unisex.,INFORM,NOTIFY_SUCCESS,
29_00060,USER,Thanks a lot.,THANK_YOU,,
29_00060,SYSTEM,Is there anything else you need help with?,REQ_MORE,,
29_00060,USER,"No, that's all. I appreciate the help.",NEGATE,THANK_YOU,
29_00060,SYSTEM,Have a great day.,GOODBYE,,
29_00061,USER,I need a salon.,INFORM_INTENT,,
29_00061,SYSTEM,Any particular city?,REQUEST,,
29_00061,USER,"Yeah, a salon in Pleasanton would be good.",INFORM,,
29_00061,SYSTEM,There're 9 salons you might be interested in. How does Cosmo'S Barber Shop in Pleasanton sound?,OFFER,,INFORM_COUNT
29_00061,USER,What's their number?,REQUEST,,
29_00061,SYSTEM,You can reach them at 925-462-2695.,INFORM,,
29_00061,USER,Where are they?,REQUEST,,
29_00061,SYSTEM,They're located at 4275 First Street.,INFORM,,
29_00061,USER,Any other salons?,REQUEST_ALTS,,
29_00061,SYSTEM,There's a salon in Pleasanton called Fusion 3 Salon Pleasanton.,OFFER,,
29_00061,USER,How about a different salon in Redwood City?,INFORM,REQUEST_ALTS,
29_00061,SYSTEM,How does August Barbershop in Redwood City sound?,OFFER,,
29_00061,USER,That sounds awesome.,SELECT,,
29_00061,SYSTEM,Want to book the appointment?,OFFER_INTENT,,
29_00061,USER,"Yeah, book it.",AFFIRM_INTENT,,
29_00061,SYSTEM,What day and time would you like to go there?,REQUEST,,
29_00061,USER,Set it up for the 5th at quarter to 5 in the evening.,INFORM,,
29_00061,SYSTEM,"Just to make sure, you want a hair stylist appointment at August Barbershop for next Tuesday at 4:45 pm.",CONFIRM,,
29_00061,USER,Make that at evening 6.,INFORM,NEGATE,
29_00061,SYSTEM,"Just to make sure, you want to book a 6 pm hair stylist appointment with August Barbershop.",CONFIRM,,
29_00061,USER,"Sounds perfect, thanks.",AFFIRM,,
29_00061,SYSTEM,You're all set.,NOTIFY_SUCCESS,,
29_00061,USER,"Thanks a bunch, that'll do it!",THANK_YOU,GOODBYE,
29_00061,SYSTEM,Enjoy your day!,GOODBYE,,
29_00062,USER,I'm looking for a unisex salon in Foster City.,INFORM,,INFORM_INTENT
29_00062,SYSTEM,I have found Great Clips which is a unisex salon in Foster City.,OFFER,,
29_00062,USER,I would like to make an appointment at Great Clips on the 4th then.,INFORM,INFORM_INTENT,SELECT
29_00062,SYSTEM,What time were you thinking for your appointment?,REQUEST,,
29_00062,USER,I was thinking 11 in the morning.,INFORM,,
29_00062,SYSTEM,"I need your confirmation for the following: The name of the hair salon is Great Clips, the appointment is at 11 am and the appointment is on next Monday.",CONFIRM,,
29_00062,USER,That's wrong I want the appointment at one pm.,INFORM,NEGATE,
29_00062,SYSTEM,"I need your confirmation for the following: the name of the hair salon is Great Clips, and your appointment is at 1 pm.",CONFIRM,,
29_00062,USER,That works for me. What is the average rating at Great Clips?,REQUEST,AFFIRM,
29_00062,SYSTEM,"Sorry, I was unable to make an appointment at Great Clips. Did you want to try another salon?",NOTIFY_FAILURE,REQ_MORE,
29_00062,USER,"Yes, I need an appointment at a salon for the 10th.",INFORM,INFORM_INTENT,
29_00062,SYSTEM,"I need your confirmation for the following: the name of the hair salon is Great Clips, with an appointment on March 10th at 1 pm.",CONFIRM,,
29_00062,USER,"Yes, that is correct.",AFFIRM,,
29_00062,SYSTEM,I was able to book this appointment for you.,NOTIFY_SUCCESS,,
29_00062,USER,What is the contact number and address of this Great Clips.,REQUEST,,
29_00062,SYSTEM,The address for Great Clips is 929 East Hillsdale Boulevard. The phone number is 650-522-8433.,INFORM,,
29_00062,USER,"Thanks, that's all I needed.",THANK_YOU,GOODBYE,
29_00062,SYSTEM,Have a good day.,GOODBYE,,
29_00063,USER,Can you please help me find a nearby salon?,INFORM_INTENT,,
29_00063,SYSTEM,What city do you recommend I search?,REQUEST,,
29_00063,USER,Can you recommend a salon in San Fran?,INFORM,,
29_00063,SYSTEM,I recommend the salon at 1512 Barber Shop in San Francisco.,OFFER,,
29_00063,USER,Can you please recommend a different salon?,REQUEST_ALTS,,
29_00063,SYSTEM,I heard that their is a nice salon at 20Th Salon And Barber in San Francisco.,OFFER,,
29_00063,USER,Can you please tell me what is the average rating of the salon?,REQUEST,,
29_00063,SYSTEM,The average rating of the salon is 4.5.,INFORM,,
29_00063,USER,"Thank you, that sounds good.",SELECT,,
29_00063,SYSTEM,Would you like me to book an appointment at this salon?,OFFER_INTENT,,
29_00063,USER,I would like to visit the salon on March 5th so please book an appointment.,AFFIRM_INTENT,INFORM,
29_00063,SYSTEM,What time would you like your appointment for the salon?,REQUEST,,
29_00063,USER,I request an appointment on the 13th at four in the evening.,INFORM,,
29_00063,SYSTEM,"Please confirm the following details: Your appointment is at March 13th at 4 pm, and the name of the hair stylist is 20Th Salon And Barber.",CONFIRM,,
29_00063,USER,May I please have appointment at 11:30 in the morning instead?,INFORM,NEGATE,
29_00063,SYSTEM,Please confirm the following details: Your appointment is scheduled for March 13th at 11:30 am.,CONFIRM,,
29_00063,USER,What is the contact number of the hair stylist? Is the hair stylist unisex in that they work with both men and women?,REQUEST,,AFFIRM
29_00063,SYSTEM,Your appointment is confirmed. The phone number of the salon is 415-824-1335 and they're a unisex salon that works with both men and women.,INFORM,,NOTIFY_SUCCESS
29_00063,USER,"Thank you very much, I have all the information I need.",THANK_YOU,GOODBYE,
29_00063,SYSTEM,"Have a pleasant day, it was great assisting you.",GOODBYE,,
29_00064,USER,I want to find a unisex salon in Walnut Creek.,INFORM,,INFORM_INTENT
29_00064,SYSTEM,One of the nicest salons in Walnut Creek is the Blow Dry Bar.,OFFER,,
29_00064,USER,Can you find me a different salon?,REQUEST_ALTS,,
29_00064,SYSTEM,Another one in Walnut Creek is the Dipietro Todd Salon.,OFFER,,
29_00064,USER,Anything else?,REQUEST_ALTS,,
29_00064,SYSTEM,Another one in Walnut Creek is Drybar Walnut Creek.,OFFER,,
29_00064,USER,Yes that sounds good. I want an appointment at that salon.,INFORM_INTENT,SELECT,
29_00064,SYSTEM,When do you want your appointment?,REQUEST,,
29_00064,USER,I want to visit Friday next week.,INFORM,,
29_00064,SYSTEM,What time would you want your appointment?,REQUEST,,
29_00064,USER,"At 3 o""clock in the afternoon.",INFORM,,
29_00064,SYSTEM,Here are the details: The name of the hair stylist is Drybar Walnut Creek. Your appointment is at 3 pm next Friday.,CONFIRM,,
29_00064,USER,That sounds good. What is the address?,REQUEST,AFFIRM,
29_00064,SYSTEM,"The address is at 1634 Bonanza Street, and your appointment is confirmed.",INFORM,NOTIFY_SUCCESS,
29_00064,USER,Thank you very much. That is all.,THANK_YOU,GOODBYE,
29_00064,SYSTEM,Have a pleasant day.,GOODBYE,,
29_00065,USER,Can you find me a salon in Fremont?,INFORM,INFORM_INTENT,
29_00065,SYSTEM,I've found a nice salon called 3Sixty Salon and Boutique in Fremont.,OFFER,,
29_00065,USER,Can you find me another salon? I would like a unisex salon.,INFORM,REQUEST_ALTS,
29_00065,SYSTEM,"Alex'S Classic Barber Shop in Fremont is among the 8 salons I found, that you may like.",OFFER,,INFORM_COUNT
29_00065,USER,On what street is it located?,REQUEST,,
29_00065,SYSTEM,"It's located at 4175, 42151 Blacow Road.",INFORM,,
29_00065,USER,"Yes, I like the sound of that. Please book me an appointment at a salon.",INFORM_INTENT,SELECT,
29_00065,SYSTEM,What date and time would you like me to book the appointment for?,REQUEST,,
29_00065,USER,I would like an appointment for next Wednesday afternoon 2:15.,INFORM,,
29_00065,SYSTEM,"Please confirm that I got everything correctly: An appointment for 2:15 next Wednesday, 2:15 pm at Alex'S Classic Barber Shop.",CONFIRM,,
29_00065,USER,"Sorry, I've changed my mind. I'd like the appointment to be for 3:30 in the afternoon, on the 4th of March.",INFORM,,NEGATE
29_00065,SYSTEM,"Please confirm that I got everything correctly: An appointment for 3:30 pm in the afternoon, next Monday.",CONFIRM,,
29_00065,USER,"Yes, that sounds perfect.",AFFIRM,,
29_00065,SYSTEM,"Unfortunately, I was unable to book the appointment. Alex'S Classic Barber Shop, a nice salon, has an opening for next Monday at 4 pm.",OFFER,,
29_00065,USER,No thanks. That will be all.,NEGATE,GOODBYE,
29_00065,SYSTEM,Have a wonderful day.,GOODBYE,,
29_00066,USER,"Hi, I am from SF, I want find a Good Salon.",INFORM,INFORM_INTENT,
29_00066,SYSTEM,"Yeah, I have found 10 salons that you may like, and I can suggest the best salon in San Francisco is 1512 Barber Shop.",OFFER,,INFORM_COUNT
29_00066,USER,"Well, that sounds great.",SELECT,,
29_00066,SYSTEM,shall I book an appointment for the salon?,OFFER_INTENT,,
29_00066,USER,"Yes, I would like to have an appointment at afternoon 3 pm.",AFFIRM_INTENT,INFORM,
29_00066,SYSTEM,Which date do you want to book your appointment?,REQUEST,,
29_00066,USER,I wish to visit the salon on Thursday Next week.,INFORM,,
29_00066,SYSTEM,"Please confirm the details for the reservation: The name of the Hair stylist is 1512 Barber shop, your appointment is on Next Thursday, 3 pm.",CONFIRM,,
29_00066,USER,"Sorry, please change the appointment, I would like have a appointment on the 14th, by evening 6",INFORM,,NEGATE
29_00066,SYSTEM,"Please confirm the details for the reservation: Your appointment is scheduled on the March 14th, by evening 6 pm.",CONFIRM,,
29_00066,USER,"Yeah, that sounds great, Is it unisex salon?",REQUEST,AFFIRM,
29_00066,SYSTEM,"Your appointment is confirmed with the salon. Yes, it is unisex salon.",INFORM,NOTIFY_SUCCESS,
29_00066,USER,What is the Address and Contact Number of the salon?,REQUEST,,
29_00066,SYSTEM,"The address of the salon is 1532 20th street, and the contact number is 415-286-4371.",INFORM,,
29_00066,USER,"Thanks, for your help and that's all I needed.",THANK_YOU,GOODBYE,
29_00066,SYSTEM,"Thank you, have a pleasant day.",GOODBYE,,
29_00067,USER,I am looking for a unisex salon in Concord.,INFORM,,INFORM_INTENT
29_00067,SYSTEM,Breds Barbershop is a salon located in Concord.,OFFER,,
29_00067,USER,Are there any other salons?,REQUEST_ALTS,,
29_00067,SYSTEM,Empire Barbershop is a great salon in Concord.,OFFER,,
29_00067,USER,What is the phone number and address?,REQUEST,,
29_00067,SYSTEM,The phone number is 925-798-3000. The address is 114 Sun Valley Mall.,INFORM,,
29_00067,USER,Are there any other salons?,REQUEST_ALTS,,
29_00067,SYSTEM,There is First Class Barber Shop in Concord.,OFFER,,
29_00067,USER,That sounds great. Book an appointment.,INFORM_INTENT,SELECT,
29_00067,SYSTEM,What time would you like your appointment for?,REQUEST,,
29_00067,USER,I'd like the appointment at half past 6 in the evening.,INFORM,,
29_00067,SYSTEM,What date would you like the appointment?,REQUEST,,
29_00067,USER,I'd like to go to the salon Wednesday next week at two in the afternoon.,INFORM,,
29_00067,SYSTEM,Please confirm: An appointment at First Class Barber Shop at 2 pm next Wednesday.,CONFIRM,,
29_00067,USER,Sounds great. What is their rating?,REQUEST,AFFIRM,
29_00067,SYSTEM,Your appointment has been made. The rating is 4.5.,INFORM,NOTIFY_SUCCESS,
29_00067,USER,"That's all, thank you.",THANK_YOU,GOODBYE,
29_00067,SYSTEM,Have a great day.,GOODBYE,,
29_00068,USER,I need to you to locate a salon for me.,INFORM_INTENT,,
29_00068,SYSTEM,Where are you wanting to find one?,REQUEST,,
29_00068,USER,I need to find a salon in San Francisco.,INFORM,,
29_00068,SYSTEM,"I found 10. One of the salons is 1512 Barber Shop, it is in San Francisco.",OFFER,,INFORM_COUNT
29_00068,USER,"What is the contact number, if any and is it a unisex salon?",REQUEST,,
29_00068,SYSTEM,It is a unisex salon and here is the number 415-286-4371.,INFORM,,
29_00068,USER,That one sounds like a good one.,SELECT,,
29_00068,SYSTEM,Would you like me to make you an appointment with that salon?,OFFER_INTENT,,
29_00068,USER,"Yes, I want an appointment for three pm there.",AFFIRM_INTENT,INFORM,
29_00068,SYSTEM,And what day would you like the appointment to be on?,REQUEST,,
29_00068,USER,I want to make the appointment for the 7th of March.,INFORM,,
29_00068,SYSTEM,"Okay I have make an appointment for 3 pm on next Thursday with 1512 Barber Shop, is that right?",CONFIRM,,
29_00068,USER,Yes it is. What address is given for them?,REQUEST,AFFIRM,
29_00068,SYSTEM,The appointment has been made and the address is 1532 20th Street.,INFORM,NOTIFY_SUCCESS,
29_00068,USER,Is there an average rating? If so what is it.,REQUEST,,
29_00068,SYSTEM,Their average rating is a 4.8.,INFORM,,
29_00068,USER,Thank you so much for your help.,THANK_YOU,,
29_00068,SYSTEM,Is there anything else I can do for you?,REQ_MORE,,
29_00068,USER,No and thank you that's all for right now.,NEGATE,THANK_YOU,
29_00068,SYSTEM,Have a wonderful day.,GOODBYE,,
29_00069,USER,Can you help me find a salon?,INFORM_INTENT,,
29_00069,SYSTEM,Is there a certain city I should search for?,REQUEST,,
29_00069,USER,My preference would be a salon in San Jose.,INFORM,,
29_00069,SYSTEM,"Here, I have found 10 salons you might like in San Jose, Atelier Salon Willow Glen. It is a very nice salon.",OFFER,,INFORM_COUNT
29_00069,USER,Can you search for another salon?,REQUEST_ALTS,,
29_00069,SYSTEM,Here I have another Salon in San Jose called Barba & Co. San Jose.,OFFER,,
29_00069,USER,I would like a unisex salon. Can you help me find one? Can you search in Los Gatos?,INFORM,,REQUEST_ALTS
29_00069,SYSTEM,In Los Gatos I have found a 6 Salons including a Great Clips.,OFFER,,INFORM_COUNT
29_00069,USER,"Wow, that sounds great. Can you book it for the 10th of this month?",INFORM,INFORM_INTENT,SELECT
29_00069,SYSTEM,What time would you like your appointment at?,REQUEST,,
29_00069,USER,I would like it at 4 in the evening.,INFORM,,
29_00069,SYSTEM,If you could please confirm the reservation I have. The name of the salon is Great Clips at is at 4 pm. on March 10th.,CONFIRM,,
29_00069,USER,Everything is correct. What is the rating of the salon?,REQUEST,AFFIRM,
29_00069,SYSTEM,The rating is a 3.8 at Great Clips. The time was not available I have made it for March 10th at 3:30 PM.,INFORM,OFFER,
29_00069,USER,No that won't work. Thank for your help,NEGATE,GOODBYE,
29_00069,SYSTEM,Have an amazing day.,GOODBYE,,
29_00070,USER,I would like to find a salon.,INFORM_INTENT,,
29_00070,SYSTEM,Which city are you looking in?,REQUEST,,
29_00070,USER,I am looking in Santa Clara.,INFORM,,
29_00070,SYSTEM,About Time Barber Shop is a nice salon in Santa Clara.,OFFER,,
29_00070,USER,What is their contact number?,REQUEST,,
29_00070,SYSTEM,The phone number is 408-727-2200.,INFORM,,
29_00070,USER,And what is the address?,REQUEST,,
29_00070,SYSTEM,The address is 2485 De La Cruz Boulevard.,INFORM,,
29_00070,USER,"Can you find a different salon, one in San Mateo?",INFORM,REQUEST_ALTS,
29_00070,SYSTEM,I found 10 salons you may like in San Mateo. Elite Hair Design is a nice salon.,OFFER,,INFORM_COUNT
29_00070,USER,Can you find me a unisex salon?,INFORM,REQUEST_ALTS,
29_00070,SYSTEM,I found 9 salons you may like. Great Clips is a nice salon in San Mateo.,OFFER,,INFORM_COUNT
29_00070,USER,"Yes, that sounds good.",SELECT,,
29_00070,SYSTEM,Would you like to book an appointment there?,OFFER_INTENT,,
29_00070,USER,"Yes, I'd like to book an appointment at 1 pm.",AFFIRM_INTENT,INFORM,
29_00070,SYSTEM,What date do you want your appointment on?,REQUEST,,
29_00070,USER,The 6th of March at 16:30.,INFORM,,
29_00070,SYSTEM,Please confirm the following details: You have an appointment at Great Clips next Wednesday at 4:30 pm.,CONFIRM,,
29_00070,USER,"Yes, that sounds good. What is the average rating of the salon? What's the address?",REQUEST,,AFFIRM
29_00070,SYSTEM,Your appointment is confirmed. The average rating is 3.4 and the address is 207 East 4th Avenue.,INFORM,,NOTIFY_SUCCESS
29_00070,USER,Thank you very much. That's all I need.,THANK_YOU,GOODBYE,
29_00070,SYSTEM,Have a pleasant day.,GOODBYE,,
29_00071,USER,I'm looking for a salon.,INFORM_INTENT,,
29_00071,SYSTEM,"Okay, in what city?",REQUEST,,
29_00071,USER,I'm in San Fran.,INFORM,,
29_00071,SYSTEM,I've found 10 salons in San Francisco that you might like. How about 1512 Barber Shop?,OFFER,,INFORM_COUNT
29_00071,USER,What is their address?,REQUEST,,
29_00071,SYSTEM,They are located at 1532 20th Street.,INFORM,,
29_00071,USER,What's their phone number and rating?,REQUEST,,
29_00071,SYSTEM,"Their average rating is 4.8, and their phone number is 415-286-4371.",INFORM,,
29_00071,USER,"That sounds good, I'd like to book an appointment.",INFORM_INTENT,SELECT,
29_00071,SYSTEM,"Sure thing, did you have a date and time in mind?",REQUEST,,
29_00071,USER,Thursday next week at 3:30 pm.,INFORM,,
29_00071,SYSTEM,"So you would like to book an appointment at 1512 Barber Shop at 3:30 pm next Thursday, is that right?",CONFIRM,,
29_00071,USER,"Actually, I want an appointment on the 14th at 3 o""clock in the afternoon.",INFORM,,NEGATE
29_00071,SYSTEM,"So you'd like an appointment at 3 pm on March 14th instead, correct?",CONFIRM,,
29_00071,USER,"Yep, that works for me. Is the salon unisex?",REQUEST,AFFIRM,
29_00071,SYSTEM,"Your appointment has been confirmed! And yes, it is a unisex salon.",INFORM,NOTIFY_SUCCESS,
29_00071,USER,"Great, thanks! That's all.",THANK_YOU,GOODBYE,
29_00071,SYSTEM,"Have a nice day, and enjoy your visit!",GOODBYE,,
29_00072,USER,I would like you to find me a salon please.,INFORM_INTENT,,
29_00072,SYSTEM,Which city should I look in?,REQUEST,,
29_00072,USER,I would like one in SF.,INFORM,,
29_00072,SYSTEM,I found 10 salons in that area you may like.1512 Barber Shop is a very nice salon in San Francisco.,OFFER,,INFORM_COUNT
29_00072,USER,Can you find a different salon please.,REQUEST_ALTS,,
29_00072,SYSTEM,20Th Salon And Barber is a very nice salon in San Francisco.,OFFER,,
29_00072,USER,Yes that is perfect.,SELECT,,
29_00072,SYSTEM,Shall I book the appointment?,OFFER_INTENT,,
29_00072,USER,"Yes,please book the appointment for Tuesday next week.",AFFIRM_INTENT,INFORM,
29_00072,SYSTEM,What time would you like your appointment?,REQUEST,,
29_00072,USER,I would like it to be at 12 pm.,INFORM,,
29_00072,SYSTEM,"Please confirm,The name of the hair stylist is 20th Salon And Barber the appointment is to be at 12 pm next Tuesday?",CONFIRM,,
29_00072,USER,"Yes that is perfect,What is the address and the average rating please?",REQUEST,,AFFIRM
29_00072,SYSTEM,"Your appointment is confirmed The address is 2737 20th Street,The average rating is 4.5",INFORM,,NOTIFY_SUCCESS
29_00072,USER,Thank you very much.,THANK_YOU,,
29_00072,SYSTEM,Is there anything else?,REQ_MORE,,
29_00072,USER,"thank you for asking,there is nothing else.",NEGATE,THANK_YOU,
29_00072,SYSTEM,Have a very nice day.,GOODBYE,,
29_00073,USER,"I am on a vacation trip here , I want to find a salon and I want a salon in Walnut Creek.",INFORM,INFORM_INTENT,
29_00073,SYSTEM,give a minute I'll check the nearby salon. Blow Dry Bar is a nice salon in Walnut Creek.,OFFER,,
29_00073,USER,"fine, Is it unisex?",REQUEST,,
29_00073,SYSTEM,"yes sir, Is is a unisex salon.",INFORM,,
29_00073,USER,"oh I have my wife with me, can you find me a different salon?",REQUEST_ALTS,,
29_00073,SYSTEM,"sure sir, Dipietro Todd Salon is a nice salon in Walnut Creek.",OFFER,,
29_00073,USER,"Its nearby to me, yes that sounds good. I want a book an appointment at a salon, hope you can do it for me. I want to visit the salon on 2nd of March.",INFORM,INFORM_INTENT,SELECT
29_00073,SYSTEM,"Yes I can book it for you, At what time would you like your appointment?",REQUEST,,
29_00073,USER,"Thank you, I want the appointment at evening 5:30.",INFORM,,
29_00073,SYSTEM,"give a minute I'll check with them and let you know. Please confirm the following details. The name of the hair stylist is Dipietro Todd Salon, the appointment is at 5:30 pm and the appointment is on tomorrow.",CONFIRM,,
29_00073,USER,"fine thank you, that sounds good.",AFFIRM,,
29_00073,SYSTEM,"welcome sir, now your appointment is confirmed.",NOTIFY_SUCCESS,,
29_00073,USER,"great, Thank you very much.",THANK_YOU,,
29_00073,SYSTEM,"Happy to assist you, Can I help you with anything else?",REQ_MORE,,
29_00073,USER,No. Thank you very much for the assistance.,NEGATE,THANK_YOU,
29_00073,SYSTEM,"welcome, Have a pleasant day.",GOODBYE,,
29_00074,USER,I'd like to find a salon.,INFORM_INTENT,,
29_00074,SYSTEM,where should i search?,REQUEST,,
29_00074,USER,I'd like one in Redwood City.,INFORM,,
29_00074,SYSTEM,"August Barbershop is found in Redwood City, would you like them?",OFFER,,
29_00074,USER,Could you find me a different salon?,REQUEST_ALTS,,
29_00074,SYSTEM,Natalie's salon is also found in Redwood City.,OFFER,,
29_00074,USER,What is its average rating?,REQUEST,,
29_00074,SYSTEM,The average rating is 4.3.,INFORM,,
29_00074,USER,That sounds good to me.,SELECT,,
29_00074,SYSTEM,Would you like me to book an appointment?,OFFER_INTENT,,
29_00074,USER,Yes I would like to book an appointment.,AFFIRM_INTENT,,
29_00074,SYSTEM,What date and time would you like for your appointment?,REQUEST,,
29_00074,USER,I'd like to schedule for March 3rd at evening 4:30.,INFORM,,
29_00074,SYSTEM,"Please confirm the following details: Natalie's salon, booked at 4:30 pm for the day after tomorrow.",CONFIRM,,
29_00074,USER,Sounds good to me.,AFFIRM,,
29_00074,SYSTEM,The appointment is confirmed.,NOTIFY_SUCCESS,,
29_00074,USER,What is the address?,REQUEST,,
29_00074,SYSTEM,Its address is 2606 broadway.,INFORM,,
29_00074,USER,What's their number?,REQUEST,,
29_00074,SYSTEM,The phone number is 650-298-8586,INFORM,,
29_00074,USER,Thank you very much.,THANK_YOU,,
29_00074,SYSTEM,Would you like anything else?,REQ_MORE,,
29_00074,USER,No thank you.,NEGATE,THANK_YOU,
29_00074,SYSTEM,Have a nice day.,GOODBYE,,
29_00075,USER,"Hello, I am looking for somewhere to get my haircut. Is there a salon nearby?",INFORM_INTENT,,
29_00075,SYSTEM,I see a number of cities nearby. Is there a city in particular that you would like to find the salon?,REQUEST,,
29_00075,USER,I would really like to find one in Sunnyvale.,INFORM,,
29_00075,SYSTEM,"OK, great! I see that there are 10 salons in Sunnyvale! A+ Haircuts for Men is a nice salon.",OFFER,,INFORM_COUNT
29_00075,USER,"OK, that sounds good. Do you have their number and address?",REQUEST,,
29_00075,SYSTEM,"Yes, the address is 450 East El Camino Real and the phone number is 408-743-5780.",INFORM,,
29_00075,USER,"Actually, can you find a different salon? I am not sure that location will be good for me.",REQUEST_ALTS,,
29_00075,SYSTEM,"Sure, if you would still like to find on in Sunnyvale, Alpha Barbershop is also a very nice salon.",OFFER,,
29_00075,USER,"I'm sorry, I am being a bit indecisive. Can you actually find a salon in Millbrae. I think that will work out better.",INFORM,REQUEST_ALTS,
29_00075,SYSTEM,"Yes, no problem at all. There are 2 salons in Millbrae. There is a Great Clips! Will that work out for you.",OFFER,,INFORM_COUNT
29_00075,USER,"Yes, that sounds perfect!",SELECT,,
29_00075,SYSTEM,Would you like me to make the appointment for you?,OFFER_INTENT,,
