dialogue_id,speaker,turn,act_1,act_2,act_3
57_00058,SYSTEM,LAX International Airport.,INFORM,,
57_00058,USER,"Sounds good, that's what I need.",SELECT,,
57_00058,SYSTEM,Should I get you tickets?,OFFER_INTENT,,
57_00058,USER,"Yes, please get the ticket.",AFFIRM_INTENT,,
57_00058,SYSTEM,Please confirm you'd like 1 ticket on the American Airlines economy flight from New York to Los Angeles on March 13th.,CONFIRM,,
57_00058,USER,"Yes, that's right.",AFFIRM,,
57_00058,SYSTEM,I've booked your flight.,NOTIFY_SUCCESS,,
57_00058,USER,"Great, thank you.",THANK_YOU,,
57_00058,SYSTEM,Anything else I can do for you?,REQ_MORE,,
57_00058,USER,"Yeah, find me a 1 star hotel there.",INFORM,INFORM_INTENT,
57_00058,SYSTEM,"Sure, I found 10 that may work. There's a 1 star hotel called Ac Hotel by Marriott Beverly Hills.",OFFER,,INFORM_COUNT
57_00058,USER,"Great, that's perfect.",SELECT,,
57_00058,SYSTEM,Shall I get you a room?,OFFER_INTENT,,
57_00058,USER,"Not yet, that's all I need.",NEGATE_INTENT,GOODBYE,
57_00058,SYSTEM,Have a great rest of your day.,GOODBYE,,
57_00059,USER,"Could you find me a one-way flight leaving London, England?",INFORM,INFORM_INTENT,
57_00059,SYSTEM,Sure! Where would you like to fly to? When would you like the tickets?,REQUEST,,
57_00059,USER,"I'd be leaving Thursday next week, traveling to Atlanta, GA.",INFORM,,
57_00059,SYSTEM,"Okay, I found an American Airlines flight that leaves at 8:35 pm with 0 stops. It'll cost $228.",OFFER,,
57_00059,USER,"Okay, any other flights?",REQUEST_ALTS,,
57_00059,SYSTEM,There's a British Airways flight that leaves at 8 am with 0 stops. It costs $260.,OFFER,,
57_00059,USER,Any other flights?,REQUEST_ALTS,,
57_00059,SYSTEM,I found a Delta airlines flight that leaves at 3:35 pm with 1 stop. It costs $351.,OFFER,,
57_00059,USER,"Okay, yeah, that flight sounds good.",SELECT,,
57_00059,SYSTEM,Would you like me to purchase the tickets for you?,OFFER_INTENT,,
57_00059,USER,"Yes, please. I'd like to reserve the tickets for 4 people in Economy.",AFFIRM_INTENT,INFORM,
57_00059,SYSTEM,"Okay, you would like 4 tickets for a flight from London to Atlanta with Delta airlines. You will depart March 7th with Economy seating. Is this correct?",CONFIRM,,
57_00059,USER,Yes.,AFFIRM,,
57_00059,SYSTEM,"Okay, your tickets have been reserved.",NOTIFY_SUCCESS,,
57_00059,USER,"Thanks so much for your help. I'd like to find a hotel with wifi, a one star hotel is fine.",THANK_YOU,,
57_00059,SYSTEM,"I found a 1 star hotel, Ac Hotel by Marriott Atlanta Buckhead At Phipps Plaza.",OFFER,,
57_00059,USER,What's their contact number? How much would it cost each day?,REQUEST,,
57_00059,SYSTEM,Their phone number is +1 470-231-3030 and it costs $108 per night.,INFORM,,
57_00059,USER,Are there any other hotels I'd like around?,REQUEST_ALTS,,
57_00059,SYSTEM,Ac Hotel By Marriott Atlanta Downtown is a 1 star hotel.,OFFER,,
57_00059,USER,"Okay, thanks for your help. That's all for now.",SELECT,GOODBYE,
57_00059,SYSTEM,"You're welcome, have a lovely day!",GOODBYE,,
57_00060,USER,Please help me find one-way flights.,INFORM_INTENT,,
57_00060,SYSTEM,Where are you leaving from?,REQUEST,,
57_00060,USER,"I'm in Toronto, Ontario.",INFORM,,
57_00060,SYSTEM,When will you leave? What's the destination?,REQUEST,,
57_00060,USER,I want to leave next Friday and fly to San Fran. I prefer economy.,INFORM,,
57_00060,SYSTEM,I have 4 possible flights for you. How about an Air Canada flight? It leaves at 1:25 pm and has 1 stop. The cost is $305.,OFFER,,
57_00060,USER,Sounds good.,SELECT,,
57_00060,SYSTEM,Do you want to buy tickets now?,OFFER_INTENT,,
57_00060,USER,"Yes, please get me a ticket.",AFFIRM_INTENT,,
57_00060,SYSTEM,Please confirm your purchase: You are reserving 1 seat on an Air Canada flight from Toronto to San Francisco. The flight leaves March 8th. The ticket is in economy class.,CONFIRM,,
57_00060,USER,"Yes, that's correct. What airport do I arrive at?",REQUEST,AFFIRM,
57_00060,SYSTEM,Your one-way ticket has been confirmed. The destination for that flight is SFO International Airport.,INFORM,NOTIFY_SUCCESS,
57_00060,USER,What airport does it leave from? What time does the flight arrive?,REQUEST,,
57_00060,SYSTEM,The flight leaves from Toronto Pearson International Airport. It arrives at 8:11 pm.,INFORM,,
57_00060,USER,Thanks. I also need a hotel room there.,THANK_YOU,,
57_00060,SYSTEM,I have 10 hotels you may like. First is the Amsterdam Hostel San Francisco. That's a 1 star hotel.,OFFER,,INFORM_COUNT
57_00060,USER,What else might I like?,REQUEST_ALTS,,
57_00060,SYSTEM,The Argonaut Hotel is a 4 star hotel.,OFFER,,
57_00060,USER,What else do you have? I want a 1 star hotel.,INFORM,REQUEST_ALTS,
57_00060,SYSTEM,Beck's Motor Lodge is a nice 1 star hotel.,OFFER,,
57_00060,USER,That one is good.,SELECT,,
57_00060,SYSTEM,Do you want to reserve a room now?,OFFER_INTENT,,
57_00060,USER,"No, not right now.",NEGATE_INTENT,,
57_00060,SYSTEM,Is there anything else I can do for you?,REQ_MORE,,
57_00060,USER,"No, that's all. Thanks.",NEGATE,THANK_YOU,
57_00060,SYSTEM,Have a good day.,GOODBYE,,
57_00061,USER,I need help finding 3 tickets for a one-way flight to New York.,INFORM,,INFORM_INTENT
57_00061,SYSTEM,I'd be happy to help. Where are you leaving from and on what date?,REQUEST,,
57_00061,USER,We will be flying from Portland on March 10th.,INFORM,,
57_00061,SYSTEM,Alaska Airlines has a flight for $320 that leaves at 10:10 am and has 1 stop.,OFFER,,
57_00061,USER,That works. I want to buy economy tickets for that flight.,INFORM,INFORM_INTENT,SELECT
57_00061,SYSTEM,Please confirm you would like to purchase 3 economy tickets for the Alaska Airlines flight from Portland to New York on March 10th.,CONFIRM,,
57_00061,USER,"Yes, please book it. Also, what time will we reach our destination?",REQUEST,AFFIRM,
57_00061,SYSTEM,Your one-way tickets have been confirmed. The onward flight will land at 11:20 pm.,INFORM,NOTIFY_SUCCESS,
57_00061,USER,Thanks! I also want to reserve a 4 star hotel for my trip.,THANK_YOU,,
57_00061,SYSTEM,There are 10 hotels you may like. 1 Hotel Brooklyn Bridge is a nice 4 star hotel.,OFFER,,INFORM_COUNT
57_00061,USER,Great. That's all the info I needed.,SELECT,GOODBYE,
57_00061,SYSTEM,Have a wonderful day.,GOODBYE,,
57_00062,USER,I need one-way flights.,INFORM_INTENT,,
57_00062,SYSTEM,Where and when are you leaving from?,REQUEST,,
57_00062,USER,I plan to leave March 13th from Toronto.,INFORM,,
57_00062,SYSTEM,Where are you visiting?,REQUEST,,
57_00062,USER,I prefer to use Delta Airlines traveling to Phoenix.,INFORM,,
57_00062,SYSTEM,I have 1 flight from Delta Airlines leaving 2:10 am with 1 stop at the cost of $292.,OFFER,,
57_00062,USER,Will the ticket be refundable?,REQUEST,,
57_00062,SYSTEM,"No, the ticket isn't refundable.",INFORM,,
57_00062,USER,The flight sounds nice to me.,SELECT,,
57_00062,SYSTEM,Would you like to buy tickets for it?,OFFER_INTENT,,
57_00062,USER,"Yes, I'd like to book a ticket.",AFFIRM_INTENT,,
57_00062,SYSTEM,Please confirm a flight from Toronto to Phoenix with Delta Airlines leaving March 13th Economy class 1 passenger.,CONFIRM,,
57_00062,USER,"Yes, that will be good.",AFFIRM,,
57_00062,SYSTEM,I have a oneway ticket confirmed.,NOTIFY_SUCCESS,,
57_00062,USER,Thanks for the help. I'd like to find a hotel room there.,THANK_YOU,,
57_00062,SYSTEM,I have 10 hotels including Aloft Phoenix-Airport which is 3 stars.,OFFER,,INFORM_COUNT
57_00062,USER,Would there be any other hotels with one room?,INFORM,REQUEST_ALTS,
57_00062,SYSTEM,The Arizona Grand Resort & Spa is a nice 4 star hotel.,OFFER,,
57_00062,USER,What is the address and cost per night?,REQUEST,,
57_00062,SYSTEM,The address is 8000 Arizona Grand Parkway for $264 a night.,INFORM,,
57_00062,USER,Are there any other one star hotels with wifi?,INFORM,,REQUEST_ALTS
57_00062,SYSTEM,I have 8 hotels including Cambria Hotel North Scottsdale Desert Ridge which is 1 star.,OFFER,,INFORM_COUNT
57_00062,USER,That sounds good.,SELECT,,
57_00062,SYSTEM,Do you wish to reserve a room?,OFFER_INTENT,,
57_00062,USER,No thanks no room.,NEGATE_INTENT,,
57_00062,SYSTEM,Can I assist you with anything else?,REQ_MORE,,
57_00062,USER,No thanks so much.,NEGATE,THANK_YOU,
57_00062,SYSTEM,Have a great day.,GOODBYE,,
57_00063,USER,find one way flights,INFORM_INTENT,,
57_00063,SYSTEM,where and when will you leave?,REQUEST,,
57_00063,USER,"the 6th from seattle, wa leaving ny",INFORM,,
57_00063,SYSTEM,american airlines leaves 4:05 am and has 1 stop for $328,OFFER,,
57_00063,USER,is it refundable?,REQUEST,,
57_00063,SYSTEM,it leaves 11:42 am,INFORM,,
57_00063,USER,any other flights?,REQUEST_ALTS,,
57_00063,SYSTEM,delta airlines flight leaves 2 pm and 1 stop and price is $274,OFFER,,
57_00063,USER,that is good,SELECT,,
57_00063,SYSTEM,wanna get tickets?,OFFER_INTENT,,
57_00063,USER,yes I do,AFFIRM_INTENT,,
57_00063,SYSTEM,flight new york to seattle delta airlines march 6th economy 1 person,CONFIRM,,
57_00063,USER,yes that works,AFFIRM,,
57_00063,SYSTEM,it is confirmed,NOTIFY_SUCCESS,,
57_00063,USER,is it refundable?,REQUEST,,
57_00063,SYSTEM,the ticket is,INFORM,,
57_00063,USER,which airport then?,REQUEST,,
57_00063,SYSTEM,jfk international airport to seattle-tacoma international airport,INFORM,,
57_00063,USER,one room 3 star hotel,THANK_YOU,,
57_00063,SYSTEM,best western plus pioneer square hotel downtown is a 3 star one,OFFER,,
57_00063,USER,yes that works,SELECT,,
57_00063,SYSTEM,wanna get a room?,OFFER_INTENT,,
57_00063,USER,no I do not,NEGATE_INTENT,,
57_00063,SYSTEM,anything else then?,REQ_MORE,,
57_00063,USER,no that is all,NEGATE,THANK_YOU,
57_00063,SYSTEM,have a good one,GOODBYE,,
57_00064,USER,Find for me a one-way flight for a group of three people.,INFORM,INFORM_INTENT,
57_00064,SYSTEM,Tell me where you want to go and from where are you leaving from?In what date you will leave?,REQUEST,,
57_00064,USER,"I am leaving from London, England to LAX on later today.",INFORM,,
57_00064,SYSTEM,I found one with American Airlines.Outbound flight leaves at 3:05 pm and have 0 stops.Ticket cost $229.,OFFER,,
57_00064,USER,Other options you have?,REQUEST_ALTS,,
57_00064,SYSTEM,With Delta Airlines at 8 am.Have 1 stops and cost $393.,OFFER,,
57_00064,USER,Sounds very good.,SELECT,,
57_00064,SYSTEM,You want to take thickets?,OFFER_INTENT,,
57_00064,USER,Yes will be perfect at Economy class.,AFFIRM_INTENT,INFORM,
57_00064,SYSTEM,You want to book 3 tickets at Economy with Delta Airlines from London to Los Angeles.Departure date is March 1st.Is that correct?,CONFIRM,,
57_00064,USER,Yes is very good.,AFFIRM,,
57_00064,SYSTEM,Book was made for you.,NOTIFY_SUCCESS,,
57_00064,USER,I also want to find a hotel there.,INFORM_INTENT,,
57_00064,SYSTEM,A nice 2 star hotel is Ac Hotel By Marriott Beverly Hills.,OFFER,,
57_00064,USER,Tell me the cost per night.,REQUEST,,
57_00064,SYSTEM,$156 is the cost.,INFORM,,
57_00064,USER,Tell me the address.,REQUEST,,
57_00064,SYSTEM,6399 Wilshire Boulevard is the address.,INFORM,,
57_00064,USER,Other recommendations you have?I want 1 room at a 4 star hotel.,INFORM,,REQUEST_ALTS
57_00064,SYSTEM,I have 10 options that you may like.A nice hotel with 4 star is Beverly Hills Marriott.,OFFER,,INFORM_COUNT
57_00064,USER,Sounds very good.,SELECT,,
57_00064,SYSTEM,You want to make a reservation here?,OFFER_INTENT,,
57_00064,USER,No.Now I don't want.Thank you.That's all.,NEGATE_INTENT,GOODBYE,
57_00064,SYSTEM,Have a great day!,GOODBYE,,
57_00065,USER,Can you please help me in finding one way flights?,INFORM_INTENT,,
57_00065,SYSTEM,Which place are you planning to visit? Also from where do you leave and which day ?,REQUEST,,
57_00065,USER,"I am leaving on March 13th from Portland, OR to Atlanta, GA.",INFORM,,
57_00065,SYSTEM,There is a flight named as Alaska Airlines which leaves at 7:55 am and has 1 stop. It will cost you $280.,OFFER,,
57_00065,USER,From which airport does the flight departs and also is the ticket refundable?,REQUEST,,
57_00065,SYSTEM,"The flight is scheduled to depart from PDX International Airport and unfortunately, the ticket is non refundable.",INFORM,,
57_00065,USER,Are there other options available?,REQUEST_ALTS,,
57_00065,SYSTEM,There is American Airlines which leaves at 7:20 am and has 1 stop. It will cost you $296.,OFFER,,
57_00065,USER,That sounds good to me.,SELECT,,
57_00065,SYSTEM,Would you like to buy the tickets for the same?,OFFER_INTENT,,
57_00065,USER,Yes please book tickets for three people. Any class would be fine.,AFFIRM_INTENT,INFORM,
57_00065,SYSTEM,Please confirm the details: American Airlines from Portland to Atlanta with departure date as March 13th for 3 passengers. The seating class is economy.,CONFIRM,,
57_00065,USER,That's perfect. At which airport does the flight arrive and from where does it departs?,REQUEST,,AFFIRM
57_00065,SYSTEM,The ticket has now been confirmed. The flight will depart from PDX International Airport and will arrive at Hartsfield-Jackson International Airport.,INFORM,,NOTIFY_SUCCESS
57_00065,USER,Thanks for the help. Also can you find a hotel there?,THANK_YOU,,
57_00065,SYSTEM,Ac Hotel By Marriott Atlanta Buckhead At Phipps Plaza is a nice hotel with 4 star.,OFFER,,
57_00065,USER,Yes. That sounds good to me. I am good for now.,SELECT,GOODBYE,
57_00065,SYSTEM,Have a nice day.,GOODBYE,,
57_00066,USER,I would like to find some one-way flights and I prefer traveling in Economy.,INFORM,INFORM_INTENT,
57_00066,SYSTEM,Where would you like to go and when?,REQUEST,,
57_00066,USER,I would like to travel to Chicago on March 14th.,INFORM,,
57_00066,SYSTEM,Where will you be traveling from?,REQUEST,,
57_00066,USER,I will be traveling from CDMX.,INFORM,,
57_00066,SYSTEM,I have an American Airlines flight with 1 stop that leaves at 8:05 am. The ticket price is $305.,OFFER,,
57_00066,USER,That sounds like a good flight. Can you buy me a one-way ticket for 1 person.,INFORM,INFORM_INTENT,SELECT
57_00066,SYSTEM,Can you confirm the following travel arrangements. 1 Economy class seat for an American Airlines flight from Mexico City to Chicago on March 14th.,CONFIRM,,
57_00066,USER,That is correct. When does the flight arrive?,REQUEST,AFFIRM,
57_00066,SYSTEM,Your ticket has been confirmed. The flight arrives at 8:12 pm.,INFORM,NOTIFY_SUCCESS,
57_00066,USER,I need to find a hotel room with wifi.,INFORM,INFORM_INTENT,
57_00066,SYSTEM,I found 10 hotels matching your request. AC Hotel By Marriott Chicago Downtown is a good 3 star hotel.,OFFER,,INFORM_COUNT
57_00066,USER,What is the address and phone number?,REQUEST,,
57_00066,SYSTEM,The address is 630 North Rush Street and the phone number is +1 312-981-6600.,INFORM,,
57_00066,USER,Thanks that sounds good. That is all I needed.,SELECT,GOODBYE,
57_00066,SYSTEM,Enjoy your day.,GOODBYE,,
57_00067,USER,Could you find me a one way flight leaving from Vancouver? I need four Economy tickets.,INFORM,,
57_00067,SYSTEM,When are you wanting to leave?,REQUEST,,
57_00067,USER,I'd like to leave on the 9th.,INFORM,,
57_00067,SYSTEM,Where are you leaving from?,REQUEST,,
57_00067,USER,I'd like to leave from Seattle.,INFORM,,
57_00067,SYSTEM,There's an Alaska Airlines flight that leaves at 12 pm and has 1 stop. It costs $222.,OFFER,,
57_00067,USER,When will the onward flight be arriving? Where is it leaving from?,REQUEST,,
57_00067,SYSTEM,The flight will be leaving from Seattle-Tacoma International Airport. The onward flight will arrive at 8:12 pm.,INFORM,,
57_00067,USER,Are there any other options? I prefer Southwest Airlines.,INFORM,REQUEST_ALTS,
57_00067,SYSTEM,I have found 1 flight that might work. There's a Southwest Airlines flight that leaves at 5:25 am and has 1 stop. It costs $260.,OFFER,,
57_00067,USER,That will work for me. Could you help me buy a one-way flight ticket?,INFORM_INTENT,SELECT,
57_00067,SYSTEM,Please confirm the following: You want to buy 4 Economy tickets for a Southwest Airlines flight that is leaving from Seattle for Vancouver on March 9th.,CONFIRM,,
57_00067,USER,"Yes, that will work. Is it refundable.",REQUEST,AFFIRM,
57_00067,SYSTEM,"The ticket has been bought. However, it's not refundable.",INFORM,NOTIFY_SUCCESS,
57_00067,USER,Where is it leaving from? And where will it be arriving?,REQUEST,,
57_00067,SYSTEM,It's leaving from Seattle-Tacoma International Airport and will be arriving at YVR International Airport.,INFORM,,
57_00067,USER,Thanks so much for everything! I'd like to book a hotel room at a two star hotel.,THANK_YOU,,
57_00067,SYSTEM,Atrium Inn Vancouver is a nice 2 star hotel.,OFFER,,
57_00067,USER,Are there other options? I need 1 room.,INFORM,REQUEST_ALTS,
57_00067,SYSTEM,Auberge Vancouver Hotel is a nice 2 star hotel.,OFFER,,
57_00067,USER,Does it have wifi?,REQUEST,,
57_00067,SYSTEM,The hotel unfortunately does not have wifi.,INFORM,,
57_00067,USER,What's their phone number and address?,REQUEST,,
57_00067,SYSTEM,Their number is +1 604-678-8899 and they are located at 837 West Hastings Street.,INFORM,,
57_00067,USER,Are there any other options?,REQUEST_ALTS,,
57_00067,SYSTEM,Best Western Plus Chateau Granville Hotel & Suites & Conference Ctr. is a nice 2 star hotel.,OFFER,,
57_00067,USER,"Yes, that'll work.",SELECT,,
57_00067,SYSTEM,Would you like to book a room?,OFFER_INTENT,,
57_00067,USER,"No, I don't want a room. That's all for now.",NEGATE_INTENT,GOODBYE,
57_00067,SYSTEM,Have a great day!,GOODBYE,,
57_00068,USER,I would like economy flights for 9th of this month.,INFORM,,INFORM_INTENT
57_00068,SYSTEM,Where are you going and where are you leaving from?,REQUEST,,
57_00068,USER,"I am going from Washington to Toronto, Ontario.",INFORM,,
57_00068,SYSTEM,There are 2 possible flights. There is an American Airlines flighs leaving at 5:40 pm with 0 stops. the ticket costs $107.,OFFER,,
57_00068,USER,Which airport will the flight arrive at?,REQUEST,,
57_00068,SYSTEM,The flight arrives at Toronto Pearson International Airport.,INFORM,,
57_00068,USER,Can I refund the flight if need be and which airport does the flight leave from?,REQUEST,,
57_00068,SYSTEM,Sorry but the ticket is non refundable and the departure airport is Dulles International Airport.,INFORM,,
57_00068,USER,That suits me well. Can you help me to buy flights for four people?,INFORM,INFORM_INTENT,SELECT
57_00068,SYSTEM,To confirm then you need 4 Economy tickets on March 9th from Washington to Toronto with American Airlines.,CONFIRM,,
57_00068,USER,Yes that is perfect At what time will the flight arrive?,REQUEST,AFFIRM,
57_00068,SYSTEM,You ticket is now booked and your flight will arrive at 7:05 pm.,INFORM,NOTIFY_SUCCESS,
57_00068,USER,Thank you for that now can you assist me in finding a hotel.,THANK_YOU,,
57_00068,SYSTEM,There is a 3 star hotel called Best Western Plus Toronto North York Hotel & Suites.,OFFER,,
57_00068,USER,Yes that would work for me. That is all I want for now thank you.,SELECT,GOODBYE,
57_00068,SYSTEM,Have a great day.,GOODBYE,,
57_00069,USER,Can you help me find a one way flight?,INFORM_INTENT,,
57_00069,SYSTEM,"Sure, where do you want to visit, and where are you leaving from? What date would you like to leave?",REQUEST,,
57_00069,USER,"I'm traveling from SFO to Portland, OR. I want to leave today.",INFORM,,
57_00069,SYSTEM,I found an Alaska Airlines flight for $108 that leaves at 12:20 pm. It has 0 stops.,OFFER,,
57_00069,USER,Is that a refundable ticket? Where is it departing from?,REQUEST,,
57_00069,SYSTEM,It is not refundable. The flight departs from SFO International Airport.,INFORM,,
57_00069,USER,"Okay, that's fine. Can you help me purchase the ticket?",INFORM_INTENT,SELECT,
57_00069,SYSTEM,"Sure. Just to confirm, you want to purchase 1 economy ticket on the Alaska Airlines flight from San Francisco to Portland departing March 1st. Is that right?",CONFIRM,,
57_00069,USER,Yeah that's perfect.,AFFIRM,,
57_00069,SYSTEM,Your ticket is confirmed.,NOTIFY_SUCCESS,,
57_00069,USER,Can you also find me a hotel with wifi there? I want 1 room at a 1 star hotel.,INFORM,,
57_00069,SYSTEM,I found 10 hotels you might like. How about Aloft Portland Airport At Cascade Station? It is a 1 star hotel.,OFFER,,INFORM_COUNT
57_00069,USER,That's fine with me.,SELECT,,
57_00069,SYSTEM,Would you like to book a room there?,OFFER_INTENT,,
57_00069,USER,"No, not right now.",NEGATE_INTENT,,
57_00069,SYSTEM,Is there anything else you need?,REQ_MORE,,
57_00069,USER,"No, that's all for now, thanks.",NEGATE,THANK_YOU,
57_00069,SYSTEM,"Alright, have a great day.",GOODBYE,,
57_00070,USER,Can you look for one-way flights for me?,INFORM_INTENT,,
57_00070,SYSTEM,When you are starting and where are you moving to? which is the place of your departure?,REQUEST,,
57_00070,USER,I am leaving from New York City on the 2nd from Chi-town,INFORM,,
57_00070,SYSTEM,There is an American Airlines which leaves at 5:25 am with 0 stops and the ticket cost is $128,OFFER,,
57_00070,USER,Which is the airport flight starting from?,REQUEST,,
57_00070,SYSTEM,The flight leaving from JFK International Airport,INFORM,,
57_00070,USER,Is there a ticket refund?,REQUEST,,
57_00070,SYSTEM,"No, sorry there is no ticket refund",INFORM,,
57_00070,USER,Are there any other flights available for me?,REQUEST_ALTS,,
57_00070,SYSTEM,There is an Delta Airlines which leaves at 6 am am with 0 stops and the ticket cost is $129,OFFER,,
57_00070,USER,That is perfect,SELECT,,
57_00070,SYSTEM,You need to buy tickets?,OFFER_INTENT,,
57_00070,USER,"yes, i require to book a ticket",AFFIRM_INTENT,,
57_00070,SYSTEM,Please give confirmation details: The flight is Delta Airlines departing on March 2nd from New York to Chicago and tickets is 1 Economy ticket,CONFIRM,,
57_00070,USER,"No, i need Premium Economy",INFORM,NEGATE,
57_00070,SYSTEM,Please give confirmation details: The flight will be from New York with Premium Economy class ticket,CONFIRM,,
57_00070,USER,That is okay,AFFIRM,,
57_00070,SYSTEM,Your oneway ticket is booked,NOTIFY_SUCCESS,,
57_00070,USER,thanks.I need to search for a hotel room with wifi,THANK_YOU,,
57_00070,SYSTEM,There is a nice 3 star hotel called Ac Hotel By Marriott Chicago Downtown,OFFER,,
57_00070,USER,Can i know their address and what is the cost per night there?,REQUEST,,
57_00070,SYSTEM,Their location is 630 North Rush Street with room cost at $192 per night,INFORM,,
57_00070,USER,That is fine,SELECT,,
57_00070,SYSTEM,Do you need to book a hotel room?,OFFER_INTENT,,
57_00070,USER,No i do not want now,NEGATE_INTENT,,
57_00070,SYSTEM,Is there any other help?,REQ_MORE,,
57_00070,USER,"No, thank you",NEGATE,THANK_YOU,
57_00070,SYSTEM,Have a pleasant day,GOODBYE,,
57_00071,USER,It's likely I'll be going on a trip soon. Can you get a one-way flight for me?,INFORM_INTENT,,
57_00071,SYSTEM,Where are you going to depart from?,REQUEST,,
57_00071,USER,"From Portland, OR. I'd like to have a refundable economy ticket, as the current plans might fall through.",INFORM,,
57_00071,SYSTEM,On what day will you leave?,REQUEST,,
57_00071,USER,"My group of one heads to Vancouver, BC on the 2nd.",INFORM,,
57_00071,SYSTEM,Okay. This $209 American Airlines flight leaves at 10:45 am and has 1 stop. How's that sound?,OFFER,,
57_00071,USER,Sounds good. Can you get the ticket for me?,INFORM_INTENT,SELECT,
57_00071,SYSTEM,Sure. 1 economy American Airlines ticket from Portland to Vancouver on March 2nd?,CONFIRM,,
57_00071,USER,"Yes, that's right.",AFFIRM,,
57_00071,SYSTEM,I confirmed your ticket.,NOTIFY_SUCCESS,,
57_00071,USER,"I'll probably be there for a few days, so can you also book a hotel room for me?",INFORM_INTENT,,
57_00071,SYSTEM,Want to book Atrium Inn Vancouver? It's a 3 star hotel.,OFFER,,
57_00071,USER,"Depends. Is there Wi-Fi there? Also, what's the address?",REQUEST,,
57_00071,SYSTEM,"This hotel, which can be found at 2889 East Hastings Street, does not have Wi-Fi, unfortunately.",INFORM,,
57_00071,USER,I see. What other hotels might be a good fit?,REQUEST_ALTS,,
57_00071,SYSTEM,There's the 4 star hotel Auberge Vancouver Hotel.,OFFER,,
57_00071,USER,"Oh, that sounds good.",SELECT,,
57_00071,SYSTEM,Want to book a room there?,OFFER_INTENT,,
57_00071,USER,"Not now. Thanks, I need nothing further for now.",NEGATE_INTENT,GOODBYE,
57_00071,SYSTEM,Have a nice day.,GOODBYE,,
57_00072,USER,I'm looking for a one way flight from Los Angeles to Vancouver on the 10th of March.,INFORM,,
57_00072,SYSTEM,There are 4 flights that match. There's Air Canada that leaves at 4:45 pm with 0 stops and costs $156 per ticket.,OFFER,,
57_00072,USER,What else is there?,REQUEST_ALTS,,
57_00072,SYSTEM,There's American Airlines that leaves at 11 pm with 0 stops and costs $159.,OFFER,,
57_00072,USER,"Okay, I like that. Can you buy me a 1 ticket?",INFORM,INFORM_INTENT,SELECT
57_00072,SYSTEM,"I'll buy you 1 Economy ticket for the American Airlines flight from Vancouver to Los Angeles on March 10th, is that right?",CONFIRM,,
57_00072,USER,"Yes, that is right.",AFFIRM,,
57_00072,SYSTEM,I've purchased the ticket for you.,NOTIFY_SUCCESS,,
57_00072,USER,"I also need to book a hotel, specifically three rooms. I want it to be 1 star. It has to have wifi.",INFORM,,
57_00072,SYSTEM,There are 10 matches. Ac Hotel By Marriott Beverly Hills is a nice 1 star hotel.,OFFER,,INFORM_COUNT
57_00072,USER,How much is it per night and where is it located?,REQUEST,,
57_00072,SYSTEM,It is $234 for a room per night. It's located at 6399 Wilshire Boulevard.,INFORM,,
57_00072,USER,"Okay, I can do that.",SELECT,,
57_00072,SYSTEM,Do you want me to book you rooms?,OFFER_INTENT,,
57_00072,USER,"No, don't reserve any rooms.",NEGATE_INTENT,,
57_00072,SYSTEM,Do you need any further assistance?,REQ_MORE,,
57_00072,USER,"No, thanks a lot.",NEGATE,THANK_YOU,
57_00072,SYSTEM,Have a fine day.,GOODBYE,,
57_00073,USER,I'm looking for a one-way flight.,INFORM_INTENT,,
57_00073,SYSTEM,"Okay, what city are you departing from and traveling to and what date are you departing?",REQUEST,,
57_00073,USER,I'm traveling from Vancouver to New York on the 4th of March. I prefer traveling in economy.,INFORM,,
