dialogue_id,speaker,turn,act_1,act_2,act_3
55_00058,USER,"No, thanks, it's all!",NEGATE,THANK_YOU,
55_00058,SYSTEM,Have a good day!,GOODBYE,,
55_00059,USER,Can you find me a one way flight please?,INFORM_INTENT,,
55_00059,SYSTEM,Where are you leaving from? And when?,REQUEST,,
55_00059,USER,I am leaving on the 10th of this month from Philly,INFORM,,
55_00059,SYSTEM,Where are you planning to visit?,REQUEST,,
55_00059,USER,I'm traveling to NYC,INFORM,,
55_00059,SYSTEM,There's an American Airlines flight with 0 stops that leaves at 4:45 pm at $63,OFFER,,
55_00059,USER,Are there other flights available,REQUEST_ALTS,,
55_00059,SYSTEM,Then how bout this Delta Airlines flight that leaves at 4:40 pm and has 0 stops and will cost you $62,OFFER,,
55_00059,USER,What other flights are possible?,REQUEST_ALTS,,
55_00059,SYSTEM,There's a Southwest Airlines flight that leaves at 7:45 am and has 0 stops and has a $58 price,OFFER,,
55_00059,USER,Is that refundable?,REQUEST,,
55_00059,SYSTEM,"No it's not, sorry about that",INFORM,,
55_00059,USER,"It's ok, that flight still sounds good",SELECT,,
55_00059,SYSTEM,Can I help with something else?,REQ_MORE,,
55_00059,USER,Can you help me buy a one way ticket,INFORM_INTENT,,
55_00059,SYSTEM,"Sure, so you want 1 one way economy ticket from Philadelphia to New York via Southwest Airlines on March 10th?",CONFIRM,,
55_00059,USER,Yes that's right,AFFIRM,,
55_00059,SYSTEM,"OK, your ticket is confirmed",NOTIFY_SUCCESS,,
55_00059,USER,"Thanks, not can you help me find a bus headed there too?",THANK_YOU,,
55_00059,SYSTEM,"Sure, do you also plan to leave on March 10th.",REQUEST,,
55_00059,USER,"No, I'm leaving Thursday next week",INFORM,,
55_00059,SYSTEM,There's a 8:30 am 0 transfer bus for $24,OFFER,,
55_00059,USER,That sounds great,SELECT,,
55_00059,SYSTEM,"OK, shall I get you seats?",OFFER_INTENT,,
55_00059,USER,"No, not at the moment",NEGATE_INTENT,,
55_00059,SYSTEM,"OK, can I assist with something else?",REQ_MORE,,
55_00059,USER,"No, for now that's all. I appreciate it.",NEGATE,THANK_YOU,
55_00059,SYSTEM,"You're welcome, have a good day",GOODBYE,,
55_00060,USER,Find me one way flights departing on the 14th of March.,INFORM,INFORM_INTENT,
55_00060,SYSTEM,Where are you going and where are you departing?,REQUEST,,
55_00060,USER,"I am departing out of Vancouver, BC and going to Seattle.",INFORM,,
55_00060,SYSTEM,"Air Canada has 1 transfer, departs at 4:45 pm and costs $256.",OFFER,,
55_00060,USER,What else do you have?,REQUEST_ALTS,,
55_00060,SYSTEM,"Delta Airlines has 1 transfer, departs at 3:20 am and costs $284.",OFFER,,
55_00060,USER,What else can you find?,REQUEST_ALTS,,
55_00060,SYSTEM,"United Airlines has 1 transfer, departs at 6:05 pm and costs $260.",OFFER,,
55_00060,USER,What is the departing airport?,REQUEST,,
55_00060,SYSTEM,It flies out of YVR International Airport.,INFORM,,
55_00060,USER,What is the arrival airport?,REQUEST,,
55_00060,SYSTEM,It arrives at Seattle-Tacoma International Airport.,INFORM,,
55_00060,USER,That works for me.,SELECT,,
55_00060,SYSTEM,Shall I get you tickets now?,OFFER_INTENT,,
55_00060,USER,"Yes, get me plane tickets.",AFFIRM_INTENT,,
55_00060,SYSTEM,You want 1 Economy seat from Vancouver to Seattle on United Airlines that departs March 14th. Is that right?,CONFIRM,,
55_00060,USER,That is right. What time does the flight land?,REQUEST,AFFIRM,
55_00060,SYSTEM,Your booking is complete and you will land at 10:56 pm.,INFORM,NOTIFY_SUCCESS,
55_00060,USER,I need a bus for two people that leaves on the 13th.,INFORM,,INFORM_INTENT
55_00060,SYSTEM,"Search revealed 10 results. A bus has 0 stops, departs at 6:40 am and costs $31.",OFFER,,
55_00060,USER,What else do you have?,REQUEST_ALTS,,
55_00060,SYSTEM,"Another bus has 0 stops, departs at 8:10 am and costs $29.",OFFER,,
55_00060,USER,That works for me.,SELECT,,
55_00060,SYSTEM,Shall I get you tickets?,OFFER_INTENT,,
55_00060,USER,"No, not right now.",NEGATE_INTENT,,
55_00060,SYSTEM,Do you need something more?,REQ_MORE,,
55_00060,USER,"No, thanks a bunch.",NEGATE,THANK_YOU,
55_00060,SYSTEM,Have a good day.,GOODBYE,,
55_00061,USER,I need a flight one-way.,INFORM_INTENT,,
55_00061,SYSTEM,Where are your starting and ending points and when?,REQUEST,,
55_00061,USER,I'm traveling from LAX to San Francisco the 9th.,INFORM,,
55_00061,SYSTEM,Alaska Airlines has a flight with 0 stops leaving at 5:50 pm for $97.,OFFER,,
55_00061,USER,That's perfect Is it possible for you to purchase 2 one-way tickets Economy class?,INFORM,,INFORM_INTENT
55_00061,SYSTEM,A flight on Alaska Airlines from Los Angeles to San Francisco March 9th for 2 Economy travelers will be purchased with your permission.,CONFIRM,,
55_00061,USER,Permission granted. What is the departing airport called. When will the onward flight land?,REQUEST,,AFFIRM
55_00061,SYSTEM,The ticket purchase is complete from LAX International Airport with the onward flight arriving at 7:15 pm.,INFORM,,NOTIFY_SUCCESS
55_00061,USER,You're awesome. I need a bus there also.,THANK_YOU,,
55_00061,SYSTEM,Are you going March 9th?,REQUEST,,
55_00061,USER,The 2 of us are leaving the 6th of March.,INFORM,,
55_00061,SYSTEM,One of 10 found with 0 stops leaves at 6:20 am for $53.,OFFER,,
55_00061,USER,Great. I'm going to take a rest.,SELECT,GOODBYE,
55_00061,SYSTEM,See you later.,GOODBYE,,
55_00062,USER,Do you mind helping me find a one-way flight?,INFORM_INTENT,,
55_00062,SYSTEM,"When will you be leaving, and where are you departing from?",REQUEST,,
55_00062,USER,I'll be leaving on March 9th from Seattle.,INFORM,,
55_00062,SYSTEM,And where would you like to visit?,REQUEST,,
55_00062,USER,I'm hoping to visit Vancouver.,INFORM,,
55_00062,SYSTEM,I was able to find 5 flight for you. There is a flight with Alaska Airlines that has 1 stop and departs at 12 pm. Tickets start at $222.,OFFER,,
55_00062,USER,Am I able to refund the ticket if I have any problems?,REQUEST,,
55_00062,SYSTEM,"I'm sorry, but the ticket is not refundable.",INFORM,,
55_00062,USER,Do you see any other flights that are available?,REQUEST_ALTS,,
55_00062,SYSTEM,There is a flight with American Airlines that has 1 stop and departs at 8:15 am. Tickets start at $267.,OFFER,,
55_00062,USER,Which airport will I be leaving from and when does the flight arrive?,REQUEST,,
55_00062,SYSTEM,"The flight leaves from Seattle-Tacoma International Airport, and it arrives at 7:49 pm.",INFORM,,
55_00062,USER,That sounds great.,SELECT,,
55_00062,SYSTEM,Would you like me to buy tickets for this flight?,OFFER_INTENT,,
55_00062,USER,"Yes. I'd like a ticket, please.",AFFIRM_INTENT,,
55_00062,SYSTEM,"To confirm: You'd like 1 Economy ticket with American Airlines for the flight from Seattle to Vancouver on March 9th, correct?",CONFIRM,,
55_00062,USER,"Yes, that's correct.",AFFIRM,,
55_00062,SYSTEM,Your ticket has been reserved.,NOTIFY_SUCCESS,,
55_00062,USER,Can you also help me find a bus going to Vancouver.,INFORM_INTENT,,
55_00062,SYSTEM,Will you be departing on March 9th?,REQUEST,,
55_00062,USER,"I'd like to leave on the 14th, please.",INFORM,,
55_00062,SYSTEM,There is a bus with 0 transfers that departs at 6:40 am. Tickets start at $28.,OFFER,,
55_00062,USER,Excellent.,SELECT,,
55_00062,SYSTEM,Would you like me to buy bus tickets for you?,OFFER_INTENT,,
55_00062,USER,"No, maybe later. That'll be all for now.",NEGATE_INTENT,GOODBYE,
55_00062,SYSTEM,Enjoy your day.,GOODBYE,,
55_00063,USER,Hello! Can you help me find a one-way American Airlines flight?,INFORM,INFORM_INTENT,
55_00063,SYSTEM,I'd be happy to. Where are you departing from?,REQUEST,,
55_00063,USER,I will be traveling from Washington to Philly.,INFORM,,
55_00063,SYSTEM,What is your expected travel date?,REQUEST,,
55_00063,USER,I will be departing on the 12th.,INFORM,,
55_00063,SYSTEM,There is 1 American Airlines flight available for $131. It has 1 stop and departs at 8 am. Will that work with your schedule?,OFFER,,
55_00063,USER,I'm not sure. Where does it land and what time does it get there?,REQUEST,,
55_00063,SYSTEM,It is scheduled to land at PHL International Airport at 11:36 am.,INFORM,,
55_00063,USER,"Ok, that works.",SELECT,,
55_00063,SYSTEM,Can I help you with anything else today?,REQ_MORE,,
55_00063,USER,"Yes, I'd like to purchase my ticket now.",INFORM_INTENT,,
55_00063,SYSTEM,You'd like 1 Economy ticket on the American Airlines flight leaving Washington bound for Philadelphia on March 12th. Is this correct?,CONFIRM,,
55_00063,USER,"Yes, that is correct.",AFFIRM,,
55_00063,SYSTEM,Congratulations. Your ticket has been successfully purchased.,NOTIFY_SUCCESS,,
55_00063,USER,"Next, can you help me find a bus there on the 4th of this month?",THANK_YOU,,
55_00063,SYSTEM,The bus leaves at 7:10 am and has 0 transfers. Tickets are $28.,OFFER,,
55_00063,USER,Are there any other options available?,REQUEST_ALTS,,
55_00063,SYSTEM,The next bus also has 0 transfers. It leaves at 7:50 am and tickets cost $32.,OFFER,,
55_00063,USER,Is there anything else for the 14th of this month?,INFORM,REQUEST_ALTS,
55_00063,SYSTEM,There are 6 other options. The 8:40 am bus has 0 transfers and the ticket price is $31.,OFFER,,
55_00063,USER,"That one is better. Thanks, that will be all.",SELECT,GOODBYE,
55_00063,SYSTEM,You are very welcome. Have a wonderful day.,GOODBYE,,
55_00064,USER,I need to find a oneway flight from Vegas to San Diego and I'd like something on American Airlines please.,INFORM,,
55_00064,SYSTEM,Departing when please?,REQUEST,,
55_00064,USER,On the 11th of this month.,INFORM,,
55_00064,SYSTEM,I have 1 flight on American Airlines with 0 stops which departs at 8:20 am and it's a $98 ticket.,OFFER,,
55_00064,USER,Can the ticket be refunded if need be?,REQUEST,,
55_00064,SYSTEM,"No, the ticket is non-refundable.",INFORM,,
55_00064,USER,"Okay, no problem.",SELECT,,
55_00064,SYSTEM,Do you want to make a reservation?,OFFER_INTENT,,
55_00064,USER,"Yes, I would.",AFFIRM_INTENT,,
55_00064,SYSTEM,Confirming a flight from Las Vegas to San Diego on March 11th for 1 economy seat on American Airlines.,CONFIRM,,
55_00064,USER,"That's great, thank you.",AFFIRM,,
55_00064,SYSTEM,The ticket has been booked.,NOTIFY_SUCCESS,,
55_00064,USER,What's the arrival time of the onward flight?,REQUEST,,
55_00064,SYSTEM,It's a 9:34 am arrival.,INFORM,,
55_00064,USER,What airport does it fly into?,REQUEST,,
55_00064,SYSTEM,SAN International Airport.,INFORM,,
55_00064,USER,"Okay, thank you.",THANK_YOU,,
55_00064,SYSTEM,What else may I do for you?,REQ_MORE,,
55_00064,USER,I'd like to find a bus please.,INFORM_INTENT,,
55_00064,SYSTEM,For a March 11th departure?,REQUEST,,
55_00064,USER,"No, on the 9th of this month.",INFORM,,
55_00064,SYSTEM,There is a bus leaving at 3:50 pm with 0 transfers and the ticket price is $42.,OFFER,,
55_00064,USER,What are the bus stations?,REQUEST,,
55_00064,SYSTEM,It leaves from Union Plaza and the destination is Santa Fe Depot.,INFORM,,
55_00064,USER,"Great, thanks for that.",SELECT,GOODBYE,
55_00064,SYSTEM,You're very welcome.,GOODBYE,,
55_00065,USER,I need a one-way flight.,INFORM_INTENT,,
55_00065,SYSTEM,Where would you like to go. Where would you be leaving from and when would you like to go?,REQUEST,,
55_00065,USER,I would be leaving SD from San Francisco for Thursday next week.,INFORM,,
55_00065,SYSTEM,I have found 4 suitable options. There is an alaska airlines flights that would be leaving at 11:10 am. There are 0 stops and it costs $107,OFFER,,
55_00065,USER,That would be great. I want to get a ticket.,INFORM_INTENT,SELECT,
55_00065,SYSTEM,Youw ant 1 economy ticket on an alaska airlines flight from san diego to san francisco for March 7th?,CONFIRM,,
55_00065,USER,"Yes, that's what I want. Is the ticket refundable?",REQUEST,AFFIRM,
55_00065,SYSTEM,I have bought the oneway ticket. It is non-refundable.,INFORM,NOTIFY_SUCCESS,
55_00065,USER,Ok. I would need a bus to get there.,THANK_YOU,,
55_00065,SYSTEM,You would like to leave on March 7th?,REQUEST,,
55_00065,USER,I want to leave on the 1st of March.,INFORM,,
55_00065,SYSTEM,There are 6 buses available. One leaves at 7:40 am with 0 transfers and costs $54.,OFFER,,
55_00065,USER,From which station would it be leaving and which one would it be heading to?,REQUEST,,
55_00065,SYSTEM,It leaves from Santa Fe Depot and would be heading to salesforce transit center.,INFORM,,
55_00065,USER,Is there anything else for this sunday?,INFORM,REQUEST_ALTS,
55_00065,SYSTEM,There is a bus leaving at 10 am. It has 0 transfers and the price is $45.,OFFER,,
55_00065,USER,Is there anything else?,REQUEST_ALTS,,
55_00065,SYSTEM,There is a bus leaving at 11:40 am. It has 0 transfers and the price is $49.,OFFER,,
55_00065,USER,"Ok, cool. I need nothing else.",SELECT,GOODBYE,
55_00065,SYSTEM,Enjoy your day.,GOODBYE,,
55_00066,USER,I need a one way flight that departs on the 7th of this month.,INFORM,INFORM_INTENT,
55_00066,SYSTEM,What city are you departing and where are you going?,REQUEST,,
55_00066,USER,I am departing San Fran and headed to Las Vegas.,INFORM,,
55_00066,SYSTEM,"Search revealed 4 results. Alaska Airlines has a flight with 0 stops, a departure time of 8:15 pm and a cost of $106.",OFFER,,
55_00066,USER,What airport am I departing out of and what time does the flight land?,REQUEST,,
55_00066,SYSTEM,SFO International Airport is the original airport and the flight will land at 9:50 pm.,INFORM,,
55_00066,USER,What else do you have?,REQUEST_ALTS,,
55_00066,SYSTEM,"American Airlines has a flight with 0 stops, a departure time of 5:30 pm and a ticket price of $112.",OFFER,,
55_00066,USER,Can you find flights for three Economy class tickets?,INFORM,,REQUEST_ALTS
55_00066,SYSTEM,"Delta Airlines has a flight that departs at 10:50 am, 0 stops, and a ticket price of $114.",OFFER,,
55_00066,USER,That works for me.,SELECT,,
55_00066,SYSTEM,Shall I get you tickets now?,OFFER_INTENT,,
55_00066,USER,"Yes, get me tickets.",AFFIRM_INTENT,,
55_00066,SYSTEM,You want 3 Economy seats on a Delta Airlines flight from San Francisco to Las Vegas on March 7th. Is that right?,CONFIRM,,
55_00066,USER,That is right.,AFFIRM,,
55_00066,SYSTEM,Your flight is booked.,NOTIFY_SUCCESS,,
55_00066,USER,I you to find me a bus.,INFORM_INTENT,,
55_00066,SYSTEM,Are you departing on March 7th.,REQUEST,,
55_00066,USER,"No, I wan to depart on the 13th.",INFORM,,
55_00066,SYSTEM,"There is a bus that leaves at 7:20 am, has 0 transfers and costs $54.",OFFER,,
55_00066,USER,That works for me. That is everything.,SELECT,GOODBYE,
55_00066,SYSTEM,Have a good day.,GOODBYE,,
55_00067,USER,I'm looking for one-way flights.,INFORM_INTENT,,
55_00067,SYSTEM,"Alright, I just need some information. Where are you going to and from, and when you would like to leave?",REQUEST,,
55_00067,USER,I want to leave on the 13th from SD to Vegas.,INFORM,,
55_00067,SYSTEM,I found 3 possible flights. One options is a $96 Alaska Airlines flight leaving at 6:30 am with 0 stops. Would that work?,OFFER,,
55_00067,USER,What else is there?,REQUEST_ALTS,,
55_00067,SYSTEM,There is a $91 American Airlines flight leaving at 4:40 pm that also has 0 stops. What about that one?,OFFER,,
55_00067,USER,That one sounds good. Go ahead and book a one-way ticket.,INFORM_INTENT,SELECT,
55_00067,SYSTEM,"Alright, please confirm the following: You want the 1 ticket for the American Airlines Economy flight leaving San Diego on March 13th, going to Las Vegas.",CONFIRM,,
55_00067,USER,Yup that is perfect.,AFFIRM,,
55_00067,SYSTEM,Your ticket has been confirmed.,NOTIFY_SUCCESS,,
55_00067,USER,"Which airport is it leaving from? Also, is this refundable?",REQUEST,,
55_00067,SYSTEM,Your flight leaves from SAN International Airport and it is refundable.,INFORM,,
55_00067,USER,"Cool. I also need a bus, planning on leaving the 14th of March.",THANK_YOU,,
55_00067,SYSTEM,"Alright, there is a bus leaving at 6:50 pm with 0 transfers for $43.",OFFER,,
55_00067,USER,"Ok perfect, thanks.",SELECT,,
55_00067,SYSTEM,Would you like me to purchase bus tickets for you?,OFFER_INTENT,,
55_00067,USER,"No, not now. I'm good, thanks.",NEGATE_INTENT,GOODBYE,
55_00067,SYSTEM,Have a great trip.,GOODBYE,,
55_00068,USER,Could you find me a one-way flight?,INFORM_INTENT,,
55_00068,SYSTEM,"Where are you wanting to go, and when do you want to leave?",REQUEST,,
55_00068,USER,I'd like to leave for Vegas on the 11th of this month.,INFORM,,
55_00068,SYSTEM,Where are you wanting to leave from?,REQUEST,,
55_00068,USER,I'd like to leave from LAX.,INFORM,,
55_00068,SYSTEM,I have found 4 flights that could work. There's an American Airlines flight that leaves at 8:25 pm and has 0 stops. It costs $81.,OFFER,,
55_00068,USER,What time does the onward flight arrive? And where is it arriving at?,REQUEST,,
55_00068,SYSTEM,The onward flight will arrive at 9:35 pm at McCarran International Airport.,INFORM,,
55_00068,USER,Are there any other options? I like to travel in Premium Economy.,INFORM,REQUEST_ALTS,
55_00068,SYSTEM,There's an Alaska Airlines flight that leaves at 8:20 pm and has 0 stops. It costs $133.,OFFER,,
55_00068,USER,That would work for me. Could you help me buy a one way flight ticket? There are 3 people coming with me.,INFORM,INFORM_INTENT,SELECT
55_00068,SYSTEM,Please confirm the following: You want to buy 3 tickets in Premium Economy on an Alaska Airlines flight that is leaving Los Angeles on March 11th for Las Vegas?,CONFIRM,,
55_00068,USER,"Yes, that would work.",AFFIRM,,
55_00068,SYSTEM,Your ticket has been bought.,NOTIFY_SUCCESS,,
55_00068,USER,Thanks so much. Could you help me find a bus going there? I'd like to leave on March 5th.,THANK_YOU,,
55_00068,SYSTEM,The bus leaves at 7:40 am and costs $40. It has 0 transfers.,OFFER,,
55_00068,USER,Are there other options available? I'd like to leave on the 8th of March.,INFORM,REQUEST_ALTS,
55_00068,SYSTEM,I have found 3 buses that would work. It leaves at 12:30 pm and costs $39. It has 0 transfers.,OFFER,,
55_00068,USER,What station is it going to? And what station is it leaving from?,REQUEST,,
55_00068,SYSTEM,The bus is going to Union Plaza and leaving from Union Station.,INFORM,,
55_00068,USER,Are there other options?,REQUEST_ALTS,,
55_00068,SYSTEM,There's a bus leaving at 1:40 pm that has 0 transfers and costs $35.,OFFER,,
55_00068,USER,That's good. That's all for now.,SELECT,GOODBYE,
55_00068,SYSTEM,Have a wonderful day.,GOODBYE,,
55_00069,USER,I need to find a one-way flight.,INFORM_INTENT,,
55_00069,SYSTEM,What is your departure date and city and what is your destination?,REQUEST,,
55_00069,USER,"Leaving today from Portland and heading to Seattle, WA.",INFORM,,
55_00069,SYSTEM,There are 4 options. One is on American Airlines departing at 9:15 pm with 0 stops for $64 per seat.,OFFER,,
55_00069,USER,Is it refundable and what is the airport it departs from?,REQUEST,,
55_00069,SYSTEM,The departing airport is PDX International Airport. The flight is in fact refundable.,INFORM,,
55_00069,USER,Do you have any options on a different airline?,INFORM,REQUEST_ALTS,
55_00069,SYSTEM,There are 3 options. There is a Delta Airlines flight departing at 9:35 am with 0 stops for $62 per seat.,OFFER,,
55_00069,USER,Can you book a one-way ticket on that one please?,INFORM_INTENT,SELECT,
55_00069,SYSTEM,Please confirm you want me to book 1 economy seat on Delta Airlines flight departing from Portland and arriving at Seattle on March 1st.,CONFIRM,,
55_00069,USER,Yes. From which airport will I depart?,REQUEST,AFFIRM,
55_00069,SYSTEM,The flight departs from PDX International Airport. Your flight has been confirmed.,INFORM,NOTIFY_SUCCESS,
55_00069,USER,At what time does the return flight arrive and is it a refundable ticket?,REQUEST,,
55_00069,SYSTEM,The ticket is non refundable and the return flight arrives at 10:33 am.,INFORM,,
55_00069,USER,Help me find a bus headed there please.,THANK_YOU,,
55_00069,SYSTEM,Are you leaving on March 1st?,REQUEST,,
55_00069,USER,Leaving on the 8th of this month.,INFORM,,
55_00069,SYSTEM,There are 8 options. There is a bus departing at 8:40 am with 0 stops for $30 per seat.,OFFER,,
55_00069,USER,Sounds good. That's it.,SELECT,GOODBYE,
55_00069,SYSTEM,Please enjoy your day.,GOODBYE,,
55_00070,USER,Is it possible for you to find me a one-way flight? I want to fly off from SD.,INFORM,INFORM_INTENT,
55_00070,SYSTEM,Can you tell me where you want to arrive? When do you want to fly?,REQUEST,,
55_00070,USER,"I want to fly Sunday this week, and I want to go to Vegas.",INFORM,,
55_00070,SYSTEM,There is a flight with Alaska Airlines which has 0 stops and leaves at 6:30 am. The ticket for this flight will cost you $86.,OFFER,,
55_00070,USER,This flight seems nice to me. Can you help me buy a one-way flight ticket?,INFORM_INTENT,SELECT,
55_00070,SYSTEM,"Can you please confirm that you want to buy an Economy class flight ticket for 1 person for the flight of Alaska Airlines which departs from San Diego on March 3rd, and arrives to Las Vegas?",CONFIRM,,
55_00070,USER,That suits me well.,AFFIRM,,
55_00070,SYSTEM,Your requested oneway flight ticket has been booked.,NOTIFY_SUCCESS,,
55_00070,USER,I appreciate your help. I am in need of finding a bus to go there for 1 person. I want to begin my trip on Sunday this week.,THANK_YOU,,
55_00070,SYSTEM,"There is 1 bus which matches what you want. The bus has 0 stops, and leaves at 6:50 pm. The ticket for this bus will cost you $41.",OFFER,,
55_00070,USER,That seems nice to me.,SELECT,,
55_00070,SYSTEM,Are you willing to have tickets bought for this bus?,OFFER_INTENT,,
55_00070,USER,"No, I do not want to have tickets bought for this bus trip now.",NEGATE_INTENT,,
55_00070,SYSTEM,Is there something else I can help you with?,REQ_MORE,,
55_00070,USER,Nothing. I appreciate your help very much.,NEGATE,THANK_YOU,
55_00070,SYSTEM,Have a wonderful time.,GOODBYE,,
55_00071,USER,Would you find me one way flights?,INFORM_INTENT,,
55_00071,SYSTEM,Where do you want to leave from and where will you go? When will you leave?,REQUEST,,
55_00071,USER,I want to leave on March 11th from LA to SD.,INFORM,,
55_00071,SYSTEM,I have 4 flights that are good. How about this Alaska Airlines flight that leaves at 7:30 am and has 0 stops? This costs $71.,OFFER,,
55_00071,USER,What airport does the flight leave from and which airport does it arrive at?,REQUEST,,
55_00071,SYSTEM,The flight leaves from LAX International Airport and goes to SAN International Airport.,INFORM,,
55_00071,USER,That flight sounds good.,SELECT,,
55_00071,SYSTEM,Would you like to buy tickets?,OFFER_INTENT,,
55_00071,USER,"Yes, I want to buy tickets.",AFFIRM_INTENT,,
55_00071,SYSTEM,Could you confirm that you will leave from Los Angeles to San Diego on Alaska Airlines on March 11th? You need 1 ticket in economy.,CONFIRM,,
55_00071,USER,Sounds good to me. Could I get a refund?,REQUEST,AFFIRM,
55_00071,SYSTEM,Your oneway ticket has been confirmed. This ticket is refundable.,INFORM,NOTIFY_SUCCESS,
55_00071,USER,Could you help me look for a bus going there?,INFORM_INTENT,,
55_00071,SYSTEM,Would you like to leave on March 11th?,REQUEST,,
55_00071,USER,I want to leave later today.,INFORM,,
55_00071,SYSTEM,The buss leaves at 7:40 am and it costs $27. It has 0 transfers.,OFFER,,
55_00071,USER,Are there other buses available?,REQUEST_ALTS,,
55_00071,SYSTEM,The bus leaves at 7:50 am and it is $26. It has 0 transfers.,OFFER,,
55_00071,USER,What bus station will I reach and what bus station am I leaving from?,REQUEST,,
55_00071,SYSTEM,You will leave from Union Station and arrive at Santa Fe Depot.,INFORM,,
55_00071,USER,Do they have any other buses available? I will leave on the 8th.,INFORM,REQUEST_ALTS,
55_00071,SYSTEM,I have 8 buses for you. The bus leaves at 9:20 am and it is $28. There are 0 transfers.,OFFER,,
55_00071,USER,Sounds good to me. I don't need anything else.,SELECT,GOODBYE,
55_00071,SYSTEM,Have a good day.,GOODBYE,,
55_00072,USER,Can you help me book a one way flight?,INFORM_INTENT,,
55_00072,SYSTEM,"Sure, I'll need more information. Where are you leaving from and going to and when are you leaving?",REQUEST,,
55_00072,USER,I'm going from Philadelphia to Washington on March 13th.,INFORM,,
55_00072,SYSTEM,I found 3 flights that may work. How about an American Airlines flight with 1 stop for $136 that departs at 9:45 am?,OFFER,,
55_00072,USER,What else did you find?,REQUEST_ALTS,,
55_00072,SYSTEM,I found a $244 Delta Airlines flight with 1 stop that departs at 12:20 pm.,OFFER,,
55_00072,USER,"No, what else is there? I'd like a United Airlines flight for one.",INFORM,,REQUEST_ALTS
55_00072,SYSTEM,I found a $141 United Airlines flight with 1 stop that departs at 4:45 am.,OFFER,,
55_00072,USER,That one sounds like it'll work.,SELECT,,
55_00072,SYSTEM,Should I buy you tickets?,OFFER_INTENT,,
55_00072,USER,"Yes, get economy.",AFFIRM_INTENT,INFORM,
55_00072,SYSTEM,"Just to confirm, you'd like 1 economy ticket on the United Airlines flight from Philadelphia to Washington that departs on March 13th.",CONFIRM,,
55_00072,USER,Sounds good. When does the first flight arrive and in which airport?,REQUEST,,AFFIRM
55_00072,SYSTEM,I've booked your flight. You'll arrive at Dulles International Airport at 7:15 am.,INFORM,,NOTIFY_SUCCESS
55_00072,USER,"Great, I want to check out buses too.",THANK_YOU,,
55_00072,SYSTEM,For March 13th?,REQUEST,,
55_00072,USER,"No, for the 7th.",INFORM,,
55_00072,SYSTEM,I found a bus with 0 transfers that costs $30 and departs at 7:30 am.,OFFER,,
55_00072,USER,"Great, sounds good.",SELECT,,
55_00072,SYSTEM,Should I get tickets for you?,OFFER_INTENT,,
55_00072,USER,"No, not yet.",NEGATE_INTENT,,
55_00072,SYSTEM,"Okay, anything else you need?",REQ_MORE,,
55_00072,USER,"No, that's all for now,",NEGATE,THANK_YOU,
55_00072,SYSTEM,Have a great rest of your day.,GOODBYE,,
55_00073,USER,Search one-way flights please.,INFORM_INTENT,,
55_00073,SYSTEM,I would need more information first. Where are you going and when would you like to leave? Where would you like to depart from?,REQUEST,,
55_00073,USER,let's go to LA from San Fran on the 4th of March please.,INFORM,,
