dialogue_id,speaker,turn,act_1,act_2,act_3
39_00096,SYSTEM,What should I call the event?,REQUEST,,
39_00096,USER,Put Bedtime as the event title.,INFORM,,
39_00096,SYSTEM,What time would you like that?,REQUEST,,
39_00096,USER,At 9:30 in the night.,INFORM,,
39_00096,SYSTEM,"Let's confirm the following. On March 13th, your bedtime at Home is scheduled for 9:30 pm.",CONFIRM,,
39_00096,USER,"Yeah, that sounds perfect.",AFFIRM,,
39_00096,SYSTEM,I have successfully added that to your calender.,NOTIFY_SUCCESS,,
39_00096,USER,Thanks for your help.,THANK_YOU,,
39_00096,SYSTEM,Can I help with something else?,REQ_MORE,,
39_00096,USER,"No, that's everything.",NEGATE,THANK_YOU,
39_00096,SYSTEM,Have a nice day.,GOODBYE,,
39_00097,USER,When am I available?,INFORM_INTENT,,
39_00097,SYSTEM,For which day?,REQUEST,,
39_00097,USER,The 10th please,INFORM,,
39_00097,SYSTEM,"On March 10th, you are free from 7 pm until 10:30 pm.",OFFER,,
39_00097,USER,How about next Monday?,INFORM,REQUEST_ALTS,
39_00097,SYSTEM,"Next Monday, you are free from 11 am until 6:30 pm.",OFFER,,
39_00097,USER,Perfect. Thank you.,SELECT,,
39_00097,SYSTEM,Would you like to add an event?,OFFER_INTENT,,
39_00097,USER,"Yes, I would like to add an event.",AFFIRM_INTENT,,
39_00097,SYSTEM,When and where is the event?,REQUEST,,
39_00097,USER,It will be a Dentist appointment at 128 El Cerrito Plz. Time: morning 11:15.,INFORM,,
39_00097,SYSTEM,Please confirm: Dentist appointment next Monday at 128 El Cerrito Plz for 11:15 am,CONFIRM,,
39_00097,USER,Yes thank you,AFFIRM,,
39_00097,SYSTEM,Your event has been added,NOTIFY_SUCCESS,,
39_00097,USER,Thank you for your assistance.,THANK_YOU,,
39_00097,SYSTEM,Can I help with anything else?,REQ_MORE,,
39_00097,USER,Nope. Thank you so much.,NEGATE,THANK_YOU,
39_00097,SYSTEM,Have a good day.,GOODBYE,,
39_00098,USER,"Hey, show me my schedule.",INFORM_INTENT,,
39_00098,SYSTEM,What date are you interested in?,REQUEST,,
39_00098,USER,Please check march 13th.,INFORM,,
39_00098,SYSTEM,"Ok, on March 13th you have a slot from 8 am to 1 pm that is empty.",OFFER,,
39_00098,USER,What about March 3rd? Do I have any time then?,INFORM,REQUEST_ALTS,
39_00098,SYSTEM,day after tomorrow you have a slot all the way from 8 am until 11:30 am.,OFFER,,
39_00098,USER,"Great, add something will you?",INFORM_INTENT,SELECT,
39_00098,SYSTEM,What name should the event be given?,REQUEST,,
39_00098,USER,Appointment at the Dreadlocks Salon please.,INFORM,,
39_00098,SYSTEM,What's the time and event activity location?,REQUEST,,
39_00098,USER,341 7th Street at 08:45,INFORM,,
39_00098,SYSTEM,OK confirm please: Appointment at the dreadlocks salon day after tomorrow at 341 7th street at 8:45 am.,CONFIRM,,
39_00098,USER,You have nailed it again.,AFFIRM,,
39_00098,SYSTEM,"Great, it's added.",NOTIFY_SUCCESS,,
39_00098,USER,I thank you for your help.,THANK_YOU,,
39_00098,SYSTEM,What else can I help with?,REQ_MORE,,
39_00098,USER,"Nothing now, thanks.",NEGATE,THANK_YOU,
39_00098,SYSTEM,Have a good appointment.,GOODBYE,,
39_00099,USER,Could you please show me when Im available.,INFORM_INTENT,,
39_00099,SYSTEM,Which date should I search for?,REQUEST,,
39_00099,USER,Check for the date 10th of March,INFORM,,
39_00099,SYSTEM,You have free from 8 am to 1 pm,OFFER,,
39_00099,USER,Is there any other available time?,REQUEST_ALTS,,
39_00099,SYSTEM,You have another free slot from 2:30 pm to 12 pm,OFFER,,
39_00099,USER,Do I have any other available time for next Monday,INFORM,REQUEST_ALTS,
39_00099,SYSTEM,Yes you are free from 4 pm to 12 pm,OFFER,,
39_00099,USER,Its great please add an event on my calender,INFORM_INTENT,SELECT,
39_00099,SYSTEM,What is the name of the event and where is the it happening?,REQUEST,,
39_00099,USER,The location is 2227 Piedmont Avenue mark as Football Game: Golden Bears Vs Trojans as event title.,INFORM,,
39_00099,SYSTEM,Whats the time for the event?,REQUEST,,
39_00099,USER,Its 5:30 in the evening.,INFORM,,
39_00099,SYSTEM,Please confirm this : The event name is Football Game: Golden Bears Vs Trojans on next Monday by 5:30 pm at 2227 Piedmont Avenue,CONFIRM,,
39_00099,USER,Yes thats perfect,AFFIRM,,
39_00099,SYSTEM,The event is successfully added to your calendar,NOTIFY_SUCCESS,,
39_00099,USER,Thanks a lot for the help.Thats all for now.,THANK_YOU,GOODBYE,
39_00099,SYSTEM,Have a great day ahead.,GOODBYE,,
39_00100,USER,I need to know when my schedule is clear.,INFORM_INTENT,,
39_00100,SYSTEM,For which date?,REQUEST,,
39_00100,USER,For this Sunday.,INFORM,,
39_00100,SYSTEM,You have free time the day after tomorrow from 3:30 pm to 7 pm.,OFFER,,
39_00100,USER,Do I have any spare time Monday next week?,INFORM,REQUEST_ALTS,
39_00100,SYSTEM,There is time available next Monday from 8:30 pm to midnight.,OFFER,,
39_00100,USER,Fine. I would be going out somewhere at night 9:45,INFORM,INFORM_INTENT,SELECT
39_00100,SYSTEM,What is the name of the event and where is it taking place?,REQUEST,,
39_00100,USER,The title would be Laundry and it would be taking place at the Laundry room.,INFORM,,
39_00100,SYSTEM,I would like to confirm the following information: laundry at the Laundry room for next Monday at 9:45 pm,CONFIRM,,
39_00100,USER,That would be fine.,AFFIRM,,
39_00100,SYSTEM,I have added it to your calendar.,NOTIFY_SUCCESS,,
39_00100,USER,I appreciate your assistance.,THANK_YOU,,
39_00100,SYSTEM,Is there anything else I can assist you with?,REQ_MORE,,
39_00100,USER,No. You have been very helpful.,NEGATE,THANK_YOU,
39_00100,SYSTEM,Enjoy your day.,GOODBYE,,
39_00101,USER,Show me my open calendar on 5th of this month.,INFORM,INFORM_INTENT,
39_00101,SYSTEM,You have 4 empty slots between 8 am to 12 pm on your calendar.,OFFER,,INFORM_COUNT
39_00101,USER,Any other available time on the 14th?,INFORM,REQUEST_ALTS,
39_00101,SYSTEM,There are 3 empty slots between 2 pm to 2:30 pm,OFFER,,INFORM_COUNT
39_00101,USER,Any other empty slots?,REQUEST_ALTS,,
39_00101,SYSTEM,You have empty slot from 3:30 pm to 5 pm on your calendar,OFFER,,
39_00101,USER,ok great.,SELECT,,
39_00101,SYSTEM,Do you want me to add an event to your calendar?,OFFER_INTENT,,
39_00101,USER,Yes please,AFFIRM_INTENT,,
39_00101,SYSTEM,What is the event and where is the event at what time?,REQUEST,,
39_00101,USER,Please put Property viewing from half past 11 in the morning at 49 Gold Mine Drive,INFORM,,
39_00101,SYSTEM,Please confirm your calendar for Property viewing on March 14th 11:30 am at 49 Gold Mine Drive,CONFIRM,,
39_00101,USER,Yes thats correct,AFFIRM,,
39_00101,SYSTEM,Event has been added to your calendar,NOTIFY_SUCCESS,,
39_00101,USER,Thank you,THANK_YOU,,
39_00101,SYSTEM,Anything else ?,REQ_MORE,,
39_00101,USER,No thats it,NEGATE,THANK_YOU,
39_00101,SYSTEM,Have a nice day,GOODBYE,,
39_00102,USER,Show me my availability for the 12th of this month please.,INFORM,INFORM_INTENT,
39_00102,SYSTEM,"OK, I show that you have availability at 8 am until 2:30 pm on March 12th.",OFFER,,
39_00102,USER,"Ok, that's great.",SELECT,,
39_00102,SYSTEM,Did you want to add an event to this calendar?,OFFER_INTENT,,
39_00102,USER,"Yes actually, Please add event title as General Practitioner appointment.",AFFIRM_INTENT,INFORM,
39_00102,SYSTEM,"Sure, for what time ?",REQUEST,,
39_00102,USER,This is event is morning 9:30.,INFORM,,
39_00102,SYSTEM,"Ok, Where is this event happening?",REQUEST,,
39_00102,USER,Event location is 31 Panoramic Way #201.,INFORM,,
39_00102,SYSTEM,"One moment, Please confirm details: Add calendar event General Practitioner appointment on March 12th at 9:30 am. This event is located at 31 Panoramic Way #201. Is this correct?",CONFIRM,,
39_00102,USER,"Yes, sounds perfect.",AFFIRM,,
39_00102,SYSTEM,Great. event has successfully been added.,NOTIFY_SUCCESS,,
39_00102,USER,Thanks. That will be all for now.,THANK_YOU,GOODBYE,
39_00102,SYSTEM,Your welcome. Have a wonderful day.,GOODBYE,,
39_00103,USER,Can you please let me know my availability.,INFORM_INTENT,,
39_00103,SYSTEM,"Sure, which date would you like to check?",REQUEST,,
39_00103,USER,The 9th.,INFORM,,
39_00103,SYSTEM,There is availability from 8 am to 12 pm.,OFFER,,
39_00103,USER,What else is available?,REQUEST_ALTS,,
39_00103,SYSTEM,There's also an empty slot at 1:30 pm to 4 pm.,OFFER,,
39_00103,USER,"Hmmm, what else is open on the 7th?",INFORM,REQUEST_ALTS,
39_00103,SYSTEM,There's open space at 1 pm to 3 pm.,OFFER,,
39_00103,USER,"Perfect, please title it, Reservation for 3 people at Mexico Lindo.",INFORM,INFORM_INTENT,SELECT
39_00103,SYSTEM,Can you please provide the location of this event?,REQUEST,,
39_00103,USER,"Yes, 1 o""clock in the afternoon at 33306 Alvarado-Niles Road.",INFORM,,
39_00103,SYSTEM,"Great, please confirm your reservation details: Reservation for 3 people at Mexico Lindo next Thursday at 33306 Alvarado-Niles Road for 1 pm.",CONFIRM,,
39_00103,USER,Correct.,AFFIRM,,
39_00103,SYSTEM,This event is successfully on your calendar.,NOTIFY_SUCCESS,,
39_00103,USER,"Awesome, thanks.",THANK_YOU,,
39_00103,SYSTEM,Is there anything else you would like?,REQ_MORE,,
39_00103,USER,"Nope, thanks.",NEGATE,THANK_YOU,
39_00103,SYSTEM,Have a wonderful day.,GOODBYE,,
39_00104,USER,I need to schedule an appointment. Can you check what's available on my calendar?,INFORM_INTENT,,
39_00104,SYSTEM,"Sure, what day?",REQUEST,,
39_00104,USER,What does the 13th look like right now?,INFORM,,
39_00104,SYSTEM,You have 3 empty slots that day. It looks like 8 am to 2:30 pm is open.,OFFER,,INFORM_COUNT
39_00104,USER,What else is available?,REQUEST_ALTS,,
39_00104,SYSTEM,Looks like 3 pm to 7 pm is also open.,OFFER,,
39_00104,USER,Do I have available times on the 14th of March?,INFORM,REQUEST_ALTS,
39_00104,SYSTEM,There are 2 empty slots that day. Looks like 1 pm to 1:30 pm is open.,OFFER,,INFORM_COUNT
39_00104,USER,"Ok, that sounds fine.",SELECT,,
39_00104,SYSTEM,Should I add an event to your calendar?,OFFER_INTENT,,
39_00104,USER,"Yes, go ahead.",AFFIRM_INTENT,,
39_00104,SYSTEM,"Ok, what's the location, time, and name of the event?",REQUEST,,
39_00104,USER,You can just put Hairdresser appointment and make it for 6:30 in the evening at 1374 9th Avenue.,INFORM,,
39_00104,SYSTEM,"Ok, just to confirm, I'm adding a Hairdresser appointment on March 14th for 6:30 pm at 1374 9th Avenue. Is that right?",CONFIRM,,
39_00104,USER,"Yep, sounds good.",AFFIRM,,
39_00104,SYSTEM,"Ok, the event has been added.",NOTIFY_SUCCESS,,
39_00104,USER,Thanks. That's all.,THANK_YOU,GOODBYE,
39_00104,SYSTEM,Have a good day.,GOODBYE,,
39_00105,USER,Show me when I am available on the 2nd of this month.,INFORM,INFORM_INTENT,
39_00105,SYSTEM,You have an empty slot from 8 am to 5:30 pm.,OFFER,,
39_00105,USER,Do I have any other free time?,REQUEST_ALTS,,
39_00105,SYSTEM,You have an empty slot from 7 pm to 7:30 pm.,OFFER,,
39_00105,USER,Do I have any other available time on the 14th of this month?,INFORM,REQUEST_ALTS,
39_00105,SYSTEM,You have an empty slot from 4:30 pm to 5 pm.,OFFER,,
39_00105,USER,Sounds good.,SELECT,,
39_00105,SYSTEM,Would you like to add an event to your calendar.,OFFER_INTENT,,
39_00105,USER,"Yes,I would like to add an event to my calendar.",AFFIRM_INTENT,,
39_00105,SYSTEM,What should I call the event? What time is it occurring and where is the event happening?,REQUEST,,
39_00105,USER,The event is located at 5500 Campanile Drive at 6:30 in the evening. Name the event Alejandro Sanz concert.,INFORM,,
39_00105,SYSTEM,Please confirm the following: The event name is Alejandro Sanz concert and it is scheduled for March 14th at 6:30 pm. It is located at 5500 Campanile Drive.,CONFIRM,,
39_00105,USER,"Yes, that is correct.",AFFIRM,,
39_00105,SYSTEM,The event has been successfully added to your calendar.,NOTIFY_SUCCESS,,
39_00105,USER,Thank you for your help.,THANK_YOU,,
39_00105,SYSTEM,Can I be of further help?,REQ_MORE,,
39_00105,USER,"No,thank you for your help.",NEGATE,THANK_YOU,
39_00105,SYSTEM,Have a nice day.,GOODBYE,,
39_00106,USER,"Can you show me when I'm available on the 13th of this month, please?",INFORM,INFORM_INTENT,
39_00106,SYSTEM,Sure! There are 2 empty slots on your calendar. You're available at 8 am and at 5 pm.,OFFER,,INFORM_COUNT
39_00106,USER,Do I have any available times next Monday?,INFORM,REQUEST_ALTS,
39_00106,SYSTEM,You have empty slots at 1:30 pm and at 8 pm.,OFFER,,
39_00106,USER,Are those my only empty slots?,REQUEST_ALTS,,
39_00106,SYSTEM,No. You also have available time at 10 pm and at 12 pm.,OFFER,,
39_00106,USER,"Okay, great!",SELECT,,
39_00106,SYSTEM,Would you like me to add an event to your calendar?,OFFER_INTENT,,
39_00106,USER,"Yes, please! The event is located at 801 Welch Road.",AFFIRM_INTENT,INFORM,
39_00106,SYSTEM,What time is the event? What name should I use to categorize the event?,REQUEST,,
39_00106,USER,The event is called the ENT Specialist appointment at 14:30.,INFORM,,
39_00106,SYSTEM,"Okay, perfect! Can you confirm the following details, please? The event name is ENT Specialist appointment. It's scheduled for next Monday at 2:30 pm. It's located at 801 Welch Road.",CONFIRM,,
39_00106,USER,"Yes, indeed.",AFFIRM,,
39_00106,SYSTEM,You're successfully booked for your appointment.,NOTIFY_SUCCESS,,
39_00106,USER,Thank you so much!,THANK_YOU,,
39_00106,SYSTEM,You're welcome! Can I help you with anything else?,REQ_MORE,,
39_00106,USER,"No, that will be all.",NEGATE,THANK_YOU,
39_00106,SYSTEM,All right. I hope you have a good day!,GOODBYE,,
39_00107,USER,Show me the times I am available on March 14th.,INFORM,INFORM_INTENT,
39_00107,SYSTEM,You're free from 8 am to 7:30 pm.,OFFER,,
39_00107,USER,Sounds good. Make an appointment on my calendar for 15:30.,INFORM,INFORM_INTENT,SELECT
39_00107,SYSTEM,Where are you going for this appointment?,REQUEST,,
39_00107,USER,I'm going to a Property viewing at 100 Summerfield Drive.,INFORM,,
39_00107,SYSTEM,So do I have this right? You have a Property viewing at 100 Summerfield Drive on March 14th at 3:30 pm?,CONFIRM,,
39_00107,USER,"Yes, that's correct.",AFFIRM,,
39_00107,SYSTEM,I've marked the appointment in your calendar.,NOTIFY_SUCCESS,,
39_00107,USER,Thanks. That's all I need right now.,THANK_YOU,GOODBYE,
39_00107,SYSTEM,Have a good day. Bye.,GOODBYE,,
39_00108,USER,What times am I available next Wednesday?,INFORM,INFORM_INTENT,
39_00108,SYSTEM,You have 3 times of availability from 8 am to 1:30 pm.,OFFER,,INFORM_COUNT
39_00108,USER,Do I have any other times available on March 7th?,INFORM,REQUEST_ALTS,
39_00108,SYSTEM,Your calendar shows 2 open times from 1 pm to 5 pm.,OFFER,,INFORM_COUNT
39_00108,USER,"Okay, sounds great.",SELECT,,
39_00108,SYSTEM,How else can I assist you today?,REQ_MORE,,
39_00108,USER,I'd like to add an event to my calendar.,INFORM_INTENT,,
39_00108,SYSTEM,What is the time and location of this event?,REQUEST,,
39_00108,USER,The event location is 6000 Bollinger Canyon Road Suite 2300 and the time will be at seven pm.,INFORM,,
39_00108,SYSTEM,What name would you like me to use for this event?,REQUEST,,
39_00108,USER,I'd like the event to be called Movie at THE LOT City Center.,INFORM,,
39_00108,SYSTEM,Please confirm that you would like me to add an event named Movie at THE LOT City Center to your calendar schedule for next Thursday at 7 pm. The event will be located at 6000 Bollinger Canyon Road Suite 2300.,CONFIRM,,
39_00108,USER,Thank you. That sounds great.,AFFIRM,,
39_00108,SYSTEM,The event has been successfully added to your calendar.,NOTIFY_SUCCESS,,
39_00108,USER,Thanks for helping.,THANK_YOU,,
39_00108,SYSTEM,Is there anything else I can assist you with?,REQ_MORE,,
39_00108,USER,"No, but thank you for helping.",NEGATE,THANK_YOU,
39_00108,SYSTEM,Enjoy your day.,GOODBYE,,
39_00109,USER,When am I available on the 4th?,INFORM,INFORM_INTENT,
39_00109,SYSTEM,You are free from 8 am to 4:30 pm.,OFFER,,
39_00109,USER,"OK, put Appointment at Great Clips in my calendar, for half past 6 in the evening.",INFORM,,INFORM_INTENT
39_00109,SYSTEM,Where is it happening?,REQUEST,,
39_00109,USER,It will be at 4045 East Castro Valley Boulevard.,INFORM,,
39_00109,SYSTEM,Please confirm this: The event is Appointment at Great Clips. It will be next Monday at 6:30 pm and it is happening at 4045 East Castro Valley Boulevard.,CONFIRM,,
39_00109,USER,"Yes, that's good.",AFFIRM,,
39_00109,SYSTEM,I have added this to your calendar.,NOTIFY_SUCCESS,,
39_00109,USER,"Thanks, for the help.",THANK_YOU,,
39_00109,SYSTEM,Do you need anything else?,REQ_MORE,,
39_00109,USER,"No, that's it thanks.",NEGATE,THANK_YOU,
39_00109,SYSTEM,"OK, enjoy your day!",GOODBYE,,
39_00110,USER,Do you know when I am available?,INFORM_INTENT,,
39_00110,SYSTEM,Which do were you curious about?,REQUEST,,
39_00110,USER,The 9th please.,INFORM,,
39_00110,SYSTEM,There are 3 spots open that day. One empty spot is 8 am to 1 pm.,OFFER,,INFORM_COUNT
39_00110,USER,Do I have any other time?,REQUEST_ALTS,,
39_00110,SYSTEM,You have a time available from 1:30 pm to 7 pm.,OFFER,,
39_00110,USER,Okay add an event during that time.,INFORM_INTENT,SELECT,
39_00110,SYSTEM,Alright what are the details of the event?,REQUEST,,
39_00110,USER,The title is The Struts concert and it is at 5 in the evening. The location is 89 South Street.,INFORM,,
39_00110,SYSTEM,The Struts concert for 5 pm in the evening of March 9th and the location is 89 South Street. Is this all correct?,CONFIRM,,
39_00110,USER,That is perfect.,AFFIRM,,
39_00110,SYSTEM,Okay the date has been added.,NOTIFY_SUCCESS,,
39_00110,USER,Thank you that will be all.,THANK_YOU,GOODBYE,
39_00110,SYSTEM,Have a great day.,GOODBYE,,
39_00111,USER,Can you tell me if I am available for next Friday?,INFORM,INFORM_INTENT,
39_00111,SYSTEM,"You have 3 empty slots for next Friday, you are available from 8 am to 11:30 am.",OFFER,,INFORM_COUNT
39_00111,USER,Is there any other time that I am available?,REQUEST_ALTS,,
39_00111,SYSTEM,You are also available from 12 pm to 5 pm.,OFFER,,
39_00111,USER,"Is that all, is there any empty slots on the 3rd?",INFORM,REQUEST_ALTS,
39_00111,SYSTEM,"On the 3rd you have 1 empty slot, from 8:30 pm to 12 pm.",OFFER,,INFORM_COUNT
39_00111,USER,"Sounds perfect, add an event to that date at 15:30?",INFORM,INFORM_INTENT,SELECT
39_00111,SYSTEM,How should I name this event?,REQUEST,,
39_00111,USER,"Call the event Viewing at Apricot Pit Apartments, and give it the location 400 East Remington Drive.",INFORM,,
39_00111,SYSTEM,"You wish to set an event titled Viewing at Apricot Pit Apartments at 400 East Remington Drive, for the day after tomorrow at 3:30 pm?",CONFIRM,,
39_00111,USER,"That all sounds good, yes.",AFFIRM,,
39_00111,SYSTEM,Your event was successfully added to your calendar.,NOTIFY_SUCCESS,,
39_00111,USER,Thanks for all your help.,THANK_YOU,,
39_00111,SYSTEM,Is there anything else you need me to help you with?,REQ_MORE,,
39_00111,USER,"No, that is all thank you.",NEGATE,THANK_YOU,
39_00111,SYSTEM,"Your welcome, have a good day.",GOODBYE,,
39_00112,USER,Hey. When am I free?,INFORM_INTENT,,
39_00112,SYSTEM,For what date would you like to know?,REQUEST,,
39_00112,USER,The 1st of March.,INFORM,,
39_00112,SYSTEM,You have 3 empty slots on that day. There is one between 8 am and 1:30 pm.,OFFER,,INFORM_COUNT
39_00112,USER,"Yes, sounds good,",SELECT,,
39_00112,SYSTEM,Would you like to set an event for that tune?,OFFER_INTENT,,
39_00112,USER,"Yes, I would.",AFFIRM_INTENT,,
39_00112,SYSTEM,What should I name it?,REQUEST,,
39_00112,USER,Put Restaurant reservation for 3 at Perch + Plow as the title.,INFORM,,
39_00112,SYSTEM,What time will it be?,REQUEST,,
39_00112,USER,At evening 6.,INFORM,,
39_00112,SYSTEM,Where will the event be?,REQUEST,,
39_00112,USER,On 90 Old Courthouse Square.,INFORM,,
39_00112,SYSTEM,Please confirm: You want to schedule an event called Restaurant reservation for 3 at Perch + Plow for today. It's located on 90 Old Courthouse Square at 6 pm.,CONFIRM,,
39_00112,USER,"Yes, that's it.",AFFIRM,,
39_00112,SYSTEM,Successfully added it to your calendar.,NOTIFY_SUCCESS,,
39_00112,USER,Thanks a lot. That's all I need.,THANK_YOU,GOODBYE,
39_00112,SYSTEM,Have a great day.,GOODBYE,,
39_00113,USER,Do I have something scheduled for March 12th?,INFORM,INFORM_INTENT,
39_00113,SYSTEM,Your calendar has 3 empty slots: from 8 am to 11 am.,OFFER,,INFORM_COUNT
39_00113,USER,Any other slot?,REQUEST_ALTS,,
39_00113,SYSTEM,There's one from 11:30 am to 5 pm.,OFFER,,
39_00113,USER,Anything else for the 14th?,INFORM,REQUEST_ALTS,
39_00113,SYSTEM,There's an available time from 4 pm to 10:30 pm.,OFFER,,
39_00113,USER,That will do it. I want a reservation for 5 people at Mayflower Seafood Restaurant for the main title. Add it to my calendar too.,INFORM,INFORM_INTENT,SELECT
39_00113,SYSTEM,Where is the event at?,REQUEST,,
39_00113,USER,34348 Alvarado-Niles Road at eleven am.,INFORM,,
39_00113,SYSTEM,Let's confirm the following: Reservation for 5 people at Mayflower Seafood Restaurant. It's scheduled for March 14th. It's taking place at 34348 Alvarado-Niles Road. Scheduled for 11 am.,CONFIRM,,
39_00113,USER,Thank you.,AFFIRM,,
39_00113,SYSTEM,The event's been added to your calendar.,NOTIFY_SUCCESS,,
39_00113,USER,Thank you.,THANK_YOU,GOODBYE,
39_00113,SYSTEM,We wish you the best.,GOODBYE,,
39_00114,USER,Am I available Saturday this week?,INFORM,INFORM_INTENT,
39_00114,SYSTEM,There are 3 empty slots on your calendar. From 8 am to 12:30 pm you have time,OFFER,,INFORM_COUNT
39_00114,USER,"Sounds good, add an event to my calendar",INFORM_INTENT,SELECT,
39_00114,SYSTEM,"What event is it, and when and where?",REQUEST,,
39_00114,USER,It's a hairdresser appointment at 5 in the evening at 994 The Alameda,INFORM,,
39_00114,SYSTEM,Confirming your 5 pm Hairdresser appointment tomorrow at 994 The Alameda,CONFIRM,,
39_00114,USER,Yes thats right,AFFIRM,,
39_00114,SYSTEM,I've added it to your calendar,NOTIFY_SUCCESS,,
39_00114,USER,Thanks for your help,THANK_YOU,,
39_00114,SYSTEM,Anything else you need?,REQ_MORE,,
39_00114,USER,No that's all for now,NEGATE,THANK_YOU,
39_00114,SYSTEM,Have a good day,GOODBYE,,
39_00115,USER,Do I have any free time on 14th of this month?,INFORM,INFORM_INTENT,
39_00115,SYSTEM,"Yes, you have 2 empty slots from 8 am to 7:30 pm.",OFFER,,INFORM_COUNT
39_00115,USER,Do I have any free time on the 9th?,INFORM,REQUEST_ALTS,
39_00115,SYSTEM,"There are 2 empty slots on 9th, from 3:30 pm to 9 pm.",OFFER,,INFORM_COUNT
39_00115,USER,That sounds great.,SELECT,,
39_00115,SYSTEM,Is there anything you would like me to do?,REQ_MORE,,
39_00115,USER,Add a new event with location 344 East Hamilton Avenue to my calendar.,INFORM,INFORM_INTENT,
39_00115,SYSTEM,What name and time should I use for the event?,REQUEST,,
39_00115,USER,Use Ophthalmologist appointment with Dr. Edward J. Saub as the title and save the event time as 11:00.,INFORM,,
39_00115,SYSTEM,Please confirm that the event name is Ophthalmologist appointment with Dr. Edward J. Saub and date and time of the event are March 9th and 11 am and event location is 344 East Hamilton Avenue.,CONFIRM,,
39_00115,USER,Yes.,AFFIRM,,
39_00115,SYSTEM,I have successfully added the event to your calendar.,NOTIFY_SUCCESS,,
39_00115,USER,Thank you. That's all for now.,THANK_YOU,GOODBYE,
39_00115,SYSTEM,Have a great day.,GOODBYE,,
39_00116,USER,I need to know when I am available on March 12th.,INFORM,INFORM_INTENT,
39_00116,SYSTEM,You are available during the hours of 8 am to 12 pm.,OFFER,,
39_00116,USER,That is fine.,SELECT,,
39_00116,SYSTEM,Do you wish to schedule this event in your calendar?,OFFER_INTENT,,
39_00116,USER,"Yes, I would like to schedule the event in my caldendar.",AFFIRM_INTENT,,
39_00116,SYSTEM,What is the location of the event?,REQUEST,,
39_00116,USER,The event is happening at 200 South 3rd Street.,INFORM,,
39_00116,SYSTEM,What time will the event occur?,REQUEST,,
39_00116,USER,"The event is occurring at 7 o""clock in the evening.",INFORM,,
39_00116,SYSTEM,What should I use as the event title?,REQUEST,,
39_00116,USER,The name to use for the event title is Young The Giant concert.,INFORM,,
39_00116,SYSTEM,"Please verify the following information: The name of the event is Young The Giant concert. The date the event takes place is March 12th. The concert will be located at 200 South 3rd Street, at 7 pm.",CONFIRM,,
39_00116,USER,"Yes, that is correct.",AFFIRM,,
39_00116,SYSTEM,The concert is scheduled in your calendar.,NOTIFY_SUCCESS,,
39_00116,USER,I appreciate your help. That will be all.,THANK_YOU,GOODBYE,
39_00116,SYSTEM,Have a nice day.,GOODBYE,,
39_00117,USER,Am I available on the 2nd of this month?,INFORM,INFORM_INTENT,
39_00117,SYSTEM,"Yes, you are available from 8 am to 5 pm.",OFFER,,
39_00117,USER,"Perfect, thank you.",SELECT,,
39_00117,SYSTEM,Can I add this event to your calendar?,OFFER_INTENT,,
39_00117,USER,"Yes, please add the event and label it Apartment viewing at The Enclave.",AFFIRM_INTENT,INFORM,
39_00117,SYSTEM,Where is The Enclave located?,REQUEST,,
39_00117,USER,It's located at 4343 Renaissance Drive.,INFORM,,
39_00117,SYSTEM,What time are you planning to go?,REQUEST,,
39_00117,USER,I plan to attend in the afternoon 3.,INFORM,,
39_00117,SYSTEM,"To confirm, I am planning an Apartment viewing at The Enclave at 4343 Renaissance Drive tomorrow at 3 pm.",CONFIRM,,
39_00117,USER,Sounds good to me!,AFFIRM,,
39_00117,SYSTEM,It's been added to your calendar.,NOTIFY_SUCCESS,,
39_00117,USER,"You've been very helpful, thank you.",THANK_YOU,GOODBYE,
39_00117,SYSTEM,You have a good day as well.,GOODBYE,,
39_00118,USER,Show me when I am available on March 14th.,INFORM,INFORM_INTENT,
39_00118,SYSTEM,"There are 3 empty slots on your calendar,starting from 8 am to 11:30 am",OFFER,,INFORM_COUNT
39_00118,USER,Please check any available time on 1st of March.,INFORM,REQUEST_ALTS,
39_00118,SYSTEM,Yes slots from 6:30 pm to 10:30 pm,OFFER,,
39_00118,USER,alright,SELECT,,
39_00118,SYSTEM,Would you like to add an event to your calandar?,OFFER_INTENT,,
39_00118,USER,"Yes, I want to add an event to my calendar.",AFFIRM_INTENT,,
39_00118,SYSTEM,What time is the event?,REQUEST,,
39_00118,USER,The event time is half past 1 in the afternoon.,INFORM,,
