dialogue_id,speaker,turn,act_1,act_2,act_3
51_00103,USER,Yes. I want it on Tuesday next week.,AFFIRM_INTENT,INFORM,
51_00103,SYSTEM,Are you checking in on March 3rd?,REQUEST,,
51_00103,USER,I want to check in on the 1st of March.,INFORM,,
51_00103,SYSTEM,You want 1 room at Aka University City in Philadelphia. You're checking in on March 1st until March 5th. Is this right?,CONFIRM,,
51_00103,USER,"Yes, that's it.",AFFIRM,,
51_00103,SYSTEM,Your reservation has been made.,NOTIFY_SUCCESS,,
51_00103,USER,Thanks. That's all.,THANK_YOU,GOODBYE,
51_00103,SYSTEM,Have a nice day.,GOODBYE,,
51_00104,USER,I would like to book this car.,INFORM_INTENT,,
51_00104,SYSTEM,When do you need the car to?,REQUEST,,
51_00104,USER,Until the 11th.,INFORM,,
51_00104,SYSTEM,What time do you need to take it at?,REQUEST,,
51_00104,USER,At 2 in the afternoon.,INFORM,,
51_00104,SYSTEM,At what location will you be collecting the car?,REQUEST,,
51_00104,USER,In King Street Station.,INFORM,,
51_00104,SYSTEM,What type of car for example a full-size or standard or something else and on what date do you need it?,REQUEST,,
51_00104,USER,An intermediate car please from March 9th.,INFORM,,
51_00104,SYSTEM,To confirm you want a standard car from March 9th at 2 pm until March 11th and you will collect the car from King Street Station.,CONFIRM,,
51_00104,USER,Yes that is all correct.,AFFIRM,,
51_00104,SYSTEM,You booking is confirmed.,NOTIFY_SUCCESS,,
51_00104,USER,What brand of car is it?,REQUEST,,
51_00104,SYSTEM,It is a Fusion.,INFORM,,
51_00104,USER,"Thank you for your assistance. Could you also help me book 1 room in a hotel in Seattle, WA.",THANK_YOU,,
51_00104,SYSTEM,"There are 10 available options for you, there is Ace hotel Seattle which has a 4.5 rating.",OFFER,,INFORM_COUNT
51_00104,USER,Where is that hotel?,REQUEST,,
51_00104,SYSTEM,It is aat 2423 1st Avenue.,INFORM,,
51_00104,USER,Are pets permitted?,REQUEST,,
51_00104,SYSTEM,Yes it allows pets.,INFORM,,
51_00104,USER,That is exactly what I want.,SELECT,,
51_00104,SYSTEM,Will I book the hotel for you?,OFFER_INTENT,,
51_00104,USER,Please make a reservation.,AFFIRM_INTENT,,
51_00104,SYSTEM,Will you be checking out on March 11th?,REQUEST,,
51_00104,USER,It will March 14th.,INFORM,,
51_00104,SYSTEM,Is your check in date March 9th?,REQUEST,,
51_00104,USER,no it is the 7th.,INFORM,,
51_00104,SYSTEM,To confirm then you want 1 room at Ace Hotel Seattle in Seattle from March 7th until March 14th.,CONFIRM,,
51_00104,USER,Yes that is fine by me. Could you give me their contact details?,REQUEST,AFFIRM,
51_00104,SYSTEM,Your booking is confirmed and their contact number is +1 206-448-4721.,INFORM,NOTIFY_SUCCESS,
51_00104,USER,Thank you that is all for now.,THANK_YOU,GOODBYE,
51_00104,SYSTEM,Have a lovely afternoon.,GOODBYE,,
51_00105,USER,Will you reserve a car?,INFORM_INTENT,,
51_00105,SYSTEM,Till when? When and where do you want to pick up?,REQUEST,,
51_00105,USER,Pick up in Vancouver Airport around seven in the evening. Keep it till the 7th.,INFORM,,
51_00105,SYSTEM,Prefer a Full-size or Standard? When do you need it?,REQUEST,,
51_00105,USER,Prefer a Standard from the 5th.,INFORM,,
51_00105,SYSTEM,Please confirm s Standard car from YVR International Airport with pick up on March 5th at 7 pm and drop off on March 7th.,CONFIRM,,
51_00105,USER,Great.,AFFIRM,,
51_00105,SYSTEM,I've reserved your car.,NOTIFY_SUCCESS,,
51_00105,USER,Thanks. Will you find one hotel room around Vancouver?,THANK_YOU,,
51_00105,SYSTEM,Atrium Inn Vancouver is a 3.7 star hotel.,OFFER,,
51_00105,USER,Anything else?,REQUEST_ALTS,,
51_00105,SYSTEM,Best Western Plus Chateau Granville Hotel & Suites & Conference Ctr. has a 4.1 rating.,OFFER,,
51_00105,USER,What's their number and address?,REQUEST,,
51_00105,SYSTEM,1100 Granville Street. Reach them at +1 604-669-7070.,INFORM,,
51_00105,USER,Great. Will you make a reservation?,INFORM_INTENT,SELECT,
51_00105,SYSTEM,Check in on March 5th?,REQUEST,,
51_00105,USER,Yes.,AFFIRM,,
51_00105,SYSTEM,Check out on March 7th?,REQUEST,,
51_00105,USER,12th of this month.,INFORM,,
51_00105,SYSTEM,Please confirm 1 room at Best Western Plus Chateau Granville Hotel & Suites & Conference Ctr. in Vancouver with check in on March 5th and check out on March 12th.,CONFIRM,,
51_00105,USER,Yes. Price?,REQUEST,AFFIRM,
51_00105,SYSTEM,I've made your reservation for $924.,INFORM,NOTIFY_SUCCESS,
51_00105,USER,Thanks. That's all.,THANK_YOU,GOODBYE,
51_00105,SYSTEM,Have a great day.,GOODBYE,,
51_00106,USER,"I'm taking a trip, i'll need a rental car reservation from the 3rd of March until March 5th.",INFORM,,INFORM_INTENT
51_00106,SYSTEM,I can help you with this. What time would be best to pick up the rental?,REQUEST,,
51_00106,USER,Half past 1 in the afternoon works best.,INFORM,,
51_00106,SYSTEM,"Ok, would you like a compact or standard?",REQUEST,,
51_00106,USER,I need a Compact if possible.,INFORM,,
51_00106,SYSTEM,"Alright, any particular place you would like to pick up the rental from?",REQUEST,,
51_00106,USER,JFK Airport is the closest to me.,INFORM,,
51_00106,SYSTEM,"Alright, one moment. Please confirm we are creating a rental car reservation for a Compact vehicle at JFK International Airport. Pick up on March 3rd at 1:30 pm and return on March 5th. Is this correct?",CONFIRM,,
51_00106,USER,"Yeah, that is right.",AFFIRM,,
51_00106,SYSTEM,"Alright, I was able to successfully reserve your rental.",NOTIFY_SUCCESS,,
51_00106,USER,What's the total and what type of car is it?,REQUEST,,
51_00106,SYSTEM,This is a Leaf and will cost $58.,INFORM,,
51_00106,USER,"Awesome, I also need a hotel search.",THANK_YOU,,
51_00106,SYSTEM,"Sure, I can help with that. Will this be in New York?",REQUEST,,
51_00106,USER,"Yeah, I will only need one room please.",INFORM,AFFIRM,
51_00106,SYSTEM,"Ok, How about 1 Hotel Brooklyn Bridge with a 4.5 star rating",OFFER,,
51_00106,USER,"Maybe, what is the address and find out if I can bring my pet.",REQUEST,,
51_00106,SYSTEM,"Great news, they accept pets and are located at 60 Furman Street, Brooklyn.",INFORM,,
51_00106,USER,That will do.,SELECT,,
51_00106,SYSTEM,"Great, can I help you reserve this room?",REQ_MORE,,
51_00106,USER,Yes make the reservation please.,INFORM_INTENT,,
51_00106,SYSTEM,"Ok, do you want to check in on March 3rd and check out on March 5th?",REQUEST,,
51_00106,USER,Let's check in later today and check out for the 6th of March.,INFORM,,
51_00106,SYSTEM,"Alright, please confirm 1 room at 1 Hotel Brooklyn Bridge, located in New York. Check in is today March 1st and check out is March 6th. Is this correct?",CONFIRM,,
51_00106,USER,"yeah, you got. Find the phone number to the hotel please.",REQUEST,AFFIRM,
51_00106,SYSTEM,"Great, reservation was completed successfully. The phone number you requested is +1 833-625-6111.",INFORM,NOTIFY_SUCCESS,
51_00106,USER,"Thank you, that will be all.",THANK_YOU,GOODBYE,
51_00106,SYSTEM,"Ok, your welcome. Have a great day.",GOODBYE,,
51_00107,USER,"On March 5th, I need a Compact car around 14:00.",INFORM,,
51_00107,SYSTEM,Up to which date do you need the car? From which place do you want to get pick up?,REQUEST,,
51_00107,USER,I wish to pick up the car in Pacific Central Station and I want to have it up to 9th of March.,INFORM,,
51_00107,SYSTEM,"Kindly ensure that, on March 5th, a Compact car will pick up you from Pacific Central Station and pick up you at 2 pm. The drop off date is March 9th.",CONFIRM,,
51_00107,USER,Yes. It is good. What is the total price? What is the car name?,REQUEST,,AFFIRM
51_00107,SYSTEM,Forte car has been booked and the cost is $96.,INFORM,,NOTIFY_SUCCESS
51_00107,USER,"Thank you so much and I wish to find a hotel there. I wish to reserve 1 room around Vancouver, BC.",THANK_YOU,,
51_00107,SYSTEM,I searched and found 10 hotels. What is your opinion about Atrium Inn Vancouver with the rating 3.7.,OFFER,,INFORM_COUNT
51_00107,USER,Do you need any other else?,REQUEST_ALTS,,
51_00107,SYSTEM,What is your opinion about Auberge Vancouver Hotel with the rating 4.1.,OFFER,,
51_00107,USER,Whether they permit pets?,REQUEST,,
51_00107,SYSTEM,Sorry the pets are not allowed.,INFORM,,
51_00107,USER,What is their contact number and contact address?,REQUEST,,
51_00107,SYSTEM,Contact address is 837 West Hastings Street and their number is +1 604-678-8899,INFORM,,
51_00107,USER,Do you have any other thing?,REQUEST_ALTS,,
51_00107,SYSTEM,What is your opinion about Best Western Plus Chateau Granville Hotel & Suites & conference Ctr. with the rating 4.1.,OFFER,,
51_00107,USER,It is nice. I wish to book the hotel.,INFORM_INTENT,SELECT,
51_00107,SYSTEM,Do you wish to check out on March 9th?,REQUEST,,
51_00107,USER,I want to check out on 10th of March.,INFORM,,
51_00107,SYSTEM,Do you wish to check in on March 5th?,REQUEST,,
51_00107,USER,I want to check in on March 3rd.,INFORM,,
51_00107,SYSTEM,"Kindly ensure that, on March 3rd, 1 room has been booked at Best Western Plus Chateau Granville Hotel & Suites & conference Ctr. in Vancouver. The check out date is March 10th.",CONFIRM,,
51_00107,USER,No. I want to check in on March 5th and check out on March 12th.,INFORM,,NEGATE
51_00107,SYSTEM,"Kindly ensure that, check in on March 5th and check out on March 12th",CONFIRM,,
51_00107,USER,Yes. It is good for me.,AFFIRM,,
51_00107,SYSTEM,Your booking is done.,NOTIFY_SUCCESS,,
51_00107,USER,What is their contact number?,REQUEST,,
51_00107,SYSTEM,Their contact number is +1 604-669-7070,INFORM,,
51_00107,USER,Whether the pets are allowed?,REQUEST,,
51_00107,SYSTEM,Yes. Pets are allowed.,INFORM,,
51_00107,USER,Thank you so much. That is what I want.,THANK_YOU,GOODBYE,
51_00107,SYSTEM,Have a fantastic day.,GOODBYE,,
51_00108,USER,I wish to book this car. I wish to pick up the car in Portland Bus Station. It has t pick up me around half past 12 in the afternoon.,INFORM,,INFORM_INTENT
51_00108,SYSTEM,Up to which date do you need a car? Which is your preferred type of car? What is about Standard or Full-size?,REQUEST,,
51_00108,USER,"On March 7th, I need a small car.",INFORM,,
51_00108,SYSTEM,From which place do you need it?,REQUEST,,
51_00108,USER,I wish to pick up the car around 7:30 in the evening. I need it from later today.,INFORM,,
51_00108,SYSTEM,"Kindly ensure that, on March 1st, a compact car will pick up you from Portland Bus Station at 7:30 pm. The drop off date is March 7th.",CONFIRM,,
51_00108,USER,Yes. It is good.,AFFIRM,,
51_00108,SYSTEM,Your car has been booked.,NOTIFY_SUCCESS,,
51_00108,USER,Thank you so much for your help. I wish to find a hotel there.,THANK_YOU,,
51_00108,SYSTEM,Do you need a hotel is Portland?,REQUEST,,
51_00108,USER,Yes. It is good for me.,AFFIRM,,
51_00108,SYSTEM,I searched and found 10 hotels. What is your opinion about Aloft Portland Airport At Cascade Station with the rating 4.3.,OFFER,,INFORM_COUNT
51_00108,USER,What is the contact address?,REQUEST,,
51_00108,SYSTEM,The contact address is 9920 Northeast Cascades Parkway.,INFORM,,
51_00108,USER,Do you have any other option?,REQUEST_ALTS,,
51_00108,SYSTEM,What is your opinion about Best Western Plus Portland Airport Hotel & Suites At Cascade Station with the rating 4.4.,OFFER,,
51_00108,USER,What is the contact address?,REQUEST,,
51_00108,SYSTEM,The contact address is 11938 Northeast Airport Way.,INFORM,,
51_00108,USER,It is nice.,SELECT,,
51_00108,SYSTEM,Shall I reserve the hotel?,OFFER_INTENT,,
51_00108,USER,I wish to confirm the reservation.,AFFIRM_INTENT,,
51_00108,SYSTEM,Are you check in on March 1st and check out on March 7th?,REQUEST,,
51_00108,USER,Yes. It is good for me. I want to check out on next Friday.,INFORM,AFFIRM,
51_00108,SYSTEM,"Kindly ensure that,on March 1st, 1 room has been booked at Best Western Plus Portland Airport Hotel & Suites at Portland. The check out date is March 8th.",CONFIRM,,
51_00108,USER,Yes. It is good for me.,AFFIRM,,
51_00108,SYSTEM,Your reservation is done.,NOTIFY_SUCCESS,,
51_00108,USER,Thank you so much.,THANK_YOU,,
51_00108,SYSTEM,Do you need any other help?,REQ_MORE,,
51_00108,USER,Nope. Thank you so much.,NEGATE,THANK_YOU,
51_00108,SYSTEM,Have a wonderful day.,GOODBYE,,
51_00109,USER,"I want to book a rental car, which I want to pick up from Fresno Yosemite International Airport.",INFORM,INFORM_INTENT,
51_00109,SYSTEM,Can you tell me the kind of car you would like to rent?,REQUEST,,
51_00109,USER,I am interested in renting a small car.,INFORM,,
51_00109,SYSTEM,"From when will you need to rent the car, and at what time do you want to have it?",REQUEST,,
51_00109,USER,"I am available to pick the car up around two pm, and I will need it from next Thursday.",INFORM,,
51_00109,SYSTEM,Can you tell me till what date you will need to rent this car?,REQUEST,,
51_00109,USER,I need to have the car rented till March 8th.,INFORM,,
51_00109,SYSTEM,"Can you please confirm that you want to rent a Compact car which you will pick up from Fresno Yosemite International Airport on March 7th at 2 pm, and will need to rent the car till March 8th?",CONFIRM,,
51_00109,USER,"That's not right, because the car I am looking for is a Standard one.",INFORM,NEGATE,
51_00109,SYSTEM,Can you please confirm that you want to rent a Standard car which you will pick up from Fresno Yosemite International Airport?,CONFIRM,,
51_00109,USER,That is what I want.,AFFIRM,,
51_00109,SYSTEM,Your requested car has been booked.,NOTIFY_SUCCESS,,
51_00109,USER,"I appreciate you help very much! Now I need to find a hotel, so I have a place to sleep there.",THANK_YOU,,
51_00109,SYSTEM,Would you like for the hotel to be in Fresno?,REQUEST,,
51_00109,USER,That would suit me well. Though I need for the hotel to welcome pets.,INFORM,AFFIRM,
51_00109,SYSTEM,"There is 1 hotel which matches your requirements. How would you like staying at the La Quinta Inn By Wyndham Fresno Yosemite hotel, which has a rating of 3.7?",OFFER,,INFORM_COUNT
51_00109,USER,Can you give me their phone number? Also please tell me their street address.,REQUEST,,
51_00109,SYSTEM,"The address of the hotel is 2926 Tulare Street, and if you want to call them you can at +1 559-442-1110.",INFORM,,
51_00109,USER,"Alright, that is great.",SELECT,,
51_00109,SYSTEM,Do you want to book a room at this hotel?,OFFER_INTENT,,
51_00109,USER,"Yes I want to have a room booked at this hotel, and I will need to have it till 13th of March.",AFFIRM_INTENT,INFORM,
51_00109,SYSTEM,Will you be going at the hotel on March 7th?,REQUEST,,
51_00109,USER,"Yes, that would work well for me.",AFFIRM,,
51_00109,SYSTEM,"Can you please confirm that you want to book 1 room at the La Quinta Inn By Wyndham Fresno Yosemite hotel in Fresno, and you will go there on March 7th, and will need the room till March 13th?",CONFIRM,,
51_00109,USER,"That's not right, because I will need the room from 6th of this month, and I want to have two rooms.",INFORM,,NEGATE
51_00109,SYSTEM,Can you please confirm that you will need to have 2 rooms booked for you from March 6th?,CONFIRM,,
51_00109,USER,"That's correct, that's what I want.",AFFIRM,,
51_00109,SYSTEM,Your requested rooms have been booked.,NOTIFY_SUCCESS,,
51_00109,USER,Can you tell me how much will it cost me?,REQUEST,,
51_00109,SYSTEM,"The total cost of your booking is $1,050 in total.",INFORM,,
51_00109,USER,I appreciate it. That would be all.,THANK_YOU,GOODBYE,
51_00109,SYSTEM,Have a wonderful time!,GOODBYE,,
51_00110,USER,"Hi there, could you help me make a car reservation at Phoenix Union Station on the March 9th?",INFORM,,INFORM_INTENT
51_00110,SYSTEM,Any preference on the pickup date and the type of car?,REQUEST,,
51_00110,USER,I prefer a small car available for pick up Monday next week.,INFORM,,
51_00110,SYSTEM,"Sure, and what time do you need the car?",REQUEST,,
51_00110,USER,I will need it around 4 in the evening please.,INFORM,,
51_00110,SYSTEM,"Sure, please confirm your reservation for a Compact Car from Phoenix Union Station from March 4th 4 pm to March 9th.",CONFIRM,,
51_00110,USER,"Sure, may I know what is the car model and how much will this cost me?",REQUEST,,AFFIRM
51_00110,SYSTEM,This is a bolt which will cost you $135 in total. Your reservation has been made!,INFORM,,NOTIFY_SUCCESS
51_00110,USER,"Thank you! Could you also help me search for three hotel rooms, preferably one which allows pets?",THANK_YOU,,
51_00110,SYSTEM,"Sure, would you be looking in the Phoenix area?",REQUEST,,
51_00110,USER,"Yes, this is fine.",AFFIRM,,
51_00110,SYSTEM,"There are 10 hotels, and one of them is Aloft Phoenix-Airport with a 4.2 rating.",OFFER,,INFORM_COUNT
51_00110,USER,That is great! Could you help me make a reservation please?,INFORM_INTENT,SELECT,
51_00110,SYSTEM,Will you be staying from March 4th to March 9th?,REQUEST,,
51_00110,USER,"Yes, but could you check me in on the 3rd of March instead?",INFORM,AFFIRM,
51_00110,SYSTEM,"Sure, please confirm your reservation for 3 rooms at Aloft Phoenix-Airport in Phoenix from March 3rd to March 9th.",CONFIRM,,
51_00110,USER,"Sure, this is fine with me.",AFFIRM,,
51_00110,SYSTEM,"Your reservation has been made, enjoy your trip!",NOTIFY_SUCCESS,,
51_00110,USER,Thank you so much!,THANK_YOU,,
51_00110,SYSTEM,Do you require further assistance?,REQ_MORE,,
51_00110,USER,"No, that is all I need.",NEGATE,THANK_YOU,
51_00110,SYSTEM,"Great, have a safe trip!",GOODBYE,,
51_00111,USER,I would like to reserve this car. I want to pick up the car at 30th Street Station around 12:30 in the afternoon on March 4th.,INFORM,,
51_00111,SYSTEM,"Till what date will you want the car? What kind of car would you like, Full-size or Standard?",REQUEST,,
51_00111,USER,I would like a Standard car and I'll need it until the 8th.,INFORM,,
51_00111,SYSTEM,Please confirm these details:You will be picking up a Standard car from 30th Street Station on March 4th at 12:30 pm. The drop-off date will be March 8th.,CONFIRM,,
51_00111,USER,"Yes, that's fine. What is the name of the car and its total cost to reserve?",REQUEST,,AFFIRM
51_00111,SYSTEM,Your car has been reserved. The car is a Sentra and the reservation cost is $136 in total.,INFORM,,NOTIFY_SUCCESS
51_00111,USER,Thank you very much for the help. I would also like to find a hotel there.,THANK_YOU,,
51_00111,SYSTEM,Would you like a hotel in Philadelphia?,REQUEST,,
51_00111,USER,"Yes, that works.",AFFIRM,,
51_00111,SYSTEM,There are 10 hotels available. How about Aka University City? It has a rating of 4.6.,OFFER,,INFORM_COUNT
51_00111,USER,Anything else available?,REQUEST_ALTS,,
51_00111,SYSTEM,How about Aloft Philadelphia Airport which has a rating of 4.0.,OFFER,,
51_00111,USER,Does it allow pets? What is the street address?,REQUEST,,
51_00111,SYSTEM,It allows pets. The address is 4301 Island Avenue.,INFORM,,
51_00111,USER,Is there anything else available? I would like to book 1 room.,INFORM,REQUEST_ALTS,
51_00111,SYSTEM,I found 8 hotels. How about Aloft Philadelphia Downtown? it is rated 4.4.,OFFER,,INFORM_COUNT
51_00111,USER,That is perfect. I would like to make a reservation at that hotel. I want to check-in on March 4th and check-out on the 10th.,INFORM,,INFORM_INTENT
51_00111,SYSTEM,Please confirm these details: You want to book 1 room at Aloft Philadelphia Downtown located in Philadelphia. The check-in date is March 4th and check-out date is March 10th.,CONFIRM,,
51_00111,USER,"No, I would like to check in on the 3rd.",INFORM,NEGATE,
51_00111,SYSTEM,Please confirm these details: You want to book 1 room and check in on March 3rd.,CONFIRM,,
51_00111,USER,"Yes, that works.",AFFIRM,,
51_00111,SYSTEM,Your reservation is set.,NOTIFY_SUCCESS,,
51_00111,USER,Thank you. That is all.,THANK_YOU,GOODBYE,
51_00111,SYSTEM,Have a great day.,GOODBYE,,
51_00112,USER,I want to book a car from Delhi airport,INFORM,INFORM_INTENT,
51_00112,SYSTEM,What time will you need it?,REQUEST,,
51_00112,USER,I will pick it up at evening 5:30,INFORM,,
51_00112,SYSTEM,Any car specification? what time do you want it?,REQUEST,,
51_00112,USER,I want a small car from 9th of this month till 14th of this month,INFORM,,
51_00112,SYSTEM,Booking a compact car from indira gandhi international airport on march 9th 5:30 pm till march 14th,CONFIRM,,
51_00112,USER,"No, change that to a standard car to be picked up around 15:00",INFORM,,NEGATE
51_00112,SYSTEM,Booking a standard car at 3 pm,CONFIRM,,
51_00112,USER,Book it from 8th of this month,INFORM,NEGATE,
51_00112,SYSTEM,Booking a standard car from march 8th,CONFIRM,,
51_00112,USER,"okay, what will the cost be",REQUEST,AFFIRM,
51_00112,SYSTEM,Booking successful. it will cost $198,INFORM,NOTIFY_SUCCESS,
51_00112,USER,"I also need to book 1 room around Delhi, India",THANK_YOU,,
51_00112,SYSTEM,How about 4.4 rated aloft new delhi aerocity?,OFFER,,
51_00112,USER,Is it pet friendly? what is the address?,REQUEST,,
51_00112,SYSTEM,"No, pets aren't allowed. The address it 5B IGI T3 road, delhi - ajmer expressway, aerocity, new delhi",INFORM,,
51_00112,USER,Is anything else available?,REQUEST_ALTS,,
51_00112,SYSTEM,How about 4.6 rated andaz delhi - a concept by hyatt?,OFFER,,
51_00112,USER,"Perfect, book it from 8th of this month till 14th of this month",INFORM,,INFORM_INTENT
51_00112,SYSTEM,Booking 1 room at andaz delhi - a concept by hyatt in Delhi from march 8th to march 14th,CONFIRM,,
51_00112,USER,"Cool, let me know the address and the price",REQUEST,,AFFIRM
51_00112,SYSTEM,"Booking confirmed. The address is asset, street number 1, new delhi and costs $1632",INFORM,,NOTIFY_SUCCESS
51_00112,USER,Thanks a lot,THANK_YOU,,
51_00112,SYSTEM,anything else I can help with?,REQ_MORE,,
51_00112,USER,"No, that will be all",NEGATE,THANK_YOU,
51_00112,SYSTEM,Have a great trip,GOODBYE,,
51_00113,USER,I need a car,INFORM_INTENT,,
51_00113,SYSTEM,When do you need it?,REQUEST,,
51_00113,USER,I need the car from 9th of this month around 16:15,INFORM,,
51_00113,SYSTEM,How long do you need it? Where do you want to rent it from? Do you prefer a Full-size or a Standard?,REQUEST,,
51_00113,USER,I want to pick up a Compact car in LAX Airport and I need it until the 10th,INFORM,,
51_00113,SYSTEM,A Compact car from LAX International Airport from March 9th at 4:15 pm to March 10th. Do you confirm?,CONFIRM,,
51_00113,USER,"Yes, I confirm",AFFIRM,,
51_00113,SYSTEM,Unfortunately it is not possible to reserve a car. Can I do anything else for you?,NOTIFY_FAILURE,REQ_MORE,
51_00113,USER,"Please try to book a Full-size car, around 5:30 in the evening",INFORM,,INFORM_INTENT
51_00113,SYSTEM,A Full-size car from LAX International Airport from March 9th at 5:30 pm to March 10th. Is it correct?,CONFIRM,,
51_00113,USER,"Yes, it is. What is the car model?",REQUEST,AFFIRM,
51_00113,SYSTEM,The car is an Equinox. Your reservation is confirmed!,INFORM,NOTIFY_SUCCESS,
51_00113,USER,Perfect! Now I need a hotel around LAX,INFORM,INFORM_INTENT,
51_00113,SYSTEM,There's Ac Hotel By Marriott Beverly Hills with rating 4.4,OFFER,,
51_00113,USER,Are there other hotels in the area?,REQUEST_ALTS,,
51_00113,SYSTEM,There's a 3.9 rating hotel: Airtel Plaza Hotel,OFFER,,
51_00113,USER,"Yes, that's good! I want to book there",INFORM_INTENT,SELECT,
51_00113,SYSTEM,Is the arrival date March 9th? Until March 10th?,REQUEST,,
51_00113,USER,"No, the arrival date is the 7th, until 11th of this month",INFORM,,
51_00113,SYSTEM,"1 rooms at Airtel Plaza Hotel in Los Angeles, from March 7th to March 11th. Is it correct?",CONFIRM,,
51_00113,USER,"Yes, perfect. Do you give me the hotel phone number? Can pets enter?",REQUEST,,AFFIRM
51_00113,SYSTEM,Phone number is +1 800-224-7835. Pets can enter. Your reservation is confirmed!,INFORM,,NOTIFY_SUCCESS
51_00113,USER,Thanks for helping!,THANK_YOU,,
51_00113,SYSTEM,Do you need anything else?,REQ_MORE,,
51_00113,USER,"No, Thank you!",NEGATE,THANK_YOU,
51_00113,SYSTEM,Have a nice day,GOODBYE,,
51_00114,USER,I need to reserve a car from March 10th till the 13th of this month.,INFORM,,INFORM_INTENT
51_00114,SYSTEM,What kind of car?,REQUEST,,
51_00114,USER,A full-size car.,INFORM,,
51_00114,SYSTEM,Where would you like to pick it up and for what time?,REQUEST,,
51_00114,USER,I would need a medium-sized car for eight pm at SMF international airport.,INFORM,,
51_00114,SYSTEM,You would like to pick up a standard car at SMF international airport on march 10th at 8 pm and would be returning it on March 13th?,CONFIRM,,
51_00114,USER,"Yes, that's right. How much would that be?",REQUEST,AFFIRM,
51_00114,SYSTEM,I have reserved the car. It would be $93 in all.,INFORM,NOTIFY_SUCCESS,
51_00114,USER,I would need a hotel when I get there.,INFORM_INTENT,,
51_00114,SYSTEM,How about Sacramento?,REQUEST,,
51_00114,USER,Go ahead and book 3 rooms for me.,INFORM,AFFIRM,
51_00114,SYSTEM,There are 10 suitable hotels. Would you like to stay at best western plus sutter house? It has a 4.3 rating.,OFFER,,INFORM_COUNT
51_00114,USER,What is the address? Can I bring a pet?,REQUEST,,
51_00114,SYSTEM,Pets are not allowed. It is located on 1100 H street.,INFORM,,
51_00114,USER,That is excellent.,SELECT,,
51_00114,SYSTEM,Would you like to reserve the hotel?,OFFER_INTENT,,
51_00114,USER,Yes. I would be there from March 8th to March 14th.,AFFIRM_INTENT,INFORM,
51_00114,SYSTEM,You would like to book 3 rooms at best western plus sutter house in Sacramento from March 8th to March 14th?,CONFIRM,,
51_00114,USER,"Yes, that would be fine.",AFFIRM,,
51_00114,SYSTEM,I have made the reservation.,NOTIFY_SUCCESS,,
51_00114,USER,How much would it cost?,REQUEST,,
51_00114,SYSTEM,"That would be $2,160 in all.",INFORM,,
51_00114,USER,Thanks. That would be all.,THANK_YOU,GOODBYE,
51_00114,SYSTEM,Enjoy your day.,GOODBYE,,
51_00115,USER,I need to have a car rented.,INFORM_INTENT,,
51_00115,SYSTEM,Can you tell me from where will you pick the car up?,REQUEST,,
51_00115,USER,I want to pick up the rented car in Pacific Central Station.,INFORM,,
51_00115,SYSTEM,"Till when will you need the car, and what type of car would you like to rent? Would you like to rent a Compact car or a Full-size one?",REQUEST,,
51_00115,USER,"I am interested in having a medium-sized car, and I will need to have till 14th of March.",INFORM,,
