dialogue_id,speaker,turn,act_1,act_2,act_3
39_00053,USER,Good job. I'm chill for now.,THANK_YOU,GOODBYE,
39_00053,SYSTEM,Enjoy yourself then.,GOODBYE,,
39_00054,USER,Can you check out my calendar and find me a time when I am available?,INFORM_INTENT,,
39_00054,SYSTEM,On which date would you like to find an availability?,REQUEST,,
39_00054,USER,On the 4th of March please.,INFORM,,
39_00054,SYSTEM,The 4th of March is next Monday. On this date you have a free time period from 8 am to 5 pm.,OFFER,,
39_00054,USER,"Okay great, that's what I thought. Add an event to my calendar for that day.",INFORM_INTENT,SELECT,
39_00054,SYSTEM,"What time is the event, and where will it be happening?",REQUEST,,
39_00054,USER,The event will take place at 2891 University Avenue in the morning 8:15.,INFORM,,
39_00054,SYSTEM,What should I title the event as?,REQUEST,,
39_00054,USER,Title it as The Hives Concert.,INFORM,,
39_00054,SYSTEM,Please confirm the following: The Hives Concert at 2891 University Avenue on next Monday starting at 8:15 am.,CONFIRM,,
39_00054,USER,Confirm that.,AFFIRM,,
39_00054,SYSTEM,The event has successfully been added to your calendar.,NOTIFY_SUCCESS,,
39_00054,USER,"Great, thanks for your help bud.",THANK_YOU,GOODBYE,
39_00054,SYSTEM,You're most welcome.,GOODBYE,,
39_00055,USER,I would like to know when I am available next Wednesday,INFORM,INFORM_INTENT,
39_00055,SYSTEM,Next Wednesday you have an empty slot from 1 pm until 2 pm,OFFER,,
39_00055,USER,"Ok, then add an event",INFORM_INTENT,SELECT,
39_00055,SYSTEM,"What is the name of the event, and what time is it?",REQUEST,,
39_00055,USER,Hairdresser appointment at half past 1 in the afternoon,INFORM,,
39_00055,SYSTEM,What is the address of the event?,REQUEST,,
39_00055,USER,1053 Cochrane Road Suite 140,INFORM,,
39_00055,SYSTEM,"Hairdresser appointment next Wednesday at 1:30 pm, in 1053 Cochrane Road Suite 140: do you confirm?",CONFIRM,,
39_00055,USER,"Yes I confirm, perfect!",AFFIRM,,
39_00055,SYSTEM,The event has been created in your calendar,NOTIFY_SUCCESS,,
39_00055,USER,Thank you so much!,THANK_YOU,,
39_00055,SYSTEM,Need more help?,REQ_MORE,,
39_00055,USER,"No, thanks, it's all",NEGATE,THANK_YOU,
39_00055,SYSTEM,Have a nice day,GOODBYE,,
39_00056,USER,"Hello, could you show me what time am I available on the 6th of March?",INFORM,INFORM_INTENT,
39_00056,SYSTEM,"You are available next Wednesday from 12:30 pm, all the way through midnight.",OFFER,,
39_00056,USER,"I see, how about my available timing this Saturday?",INFORM,REQUEST_ALTS,
39_00056,SYSTEM,You are free tomorrow from 4:30 pm to 5 pm.,OFFER,,
39_00056,USER,That sounds great.,SELECT,,
39_00056,SYSTEM,Would you like me to add an event to your calendar?,OFFER_INTENT,,
39_00056,USER,Sure! Please add an event titled Restaurant reservation for 4 at Ristorante Fratello which is located at 1712 Meridian Avenue.,AFFIRM_INTENT,INFORM,
39_00056,SYSTEM,May I know what time would the event commence?,REQUEST,,
39_00056,USER,"Yes, it will start at quarter to 5 in the evening.",INFORM,,
39_00056,SYSTEM,"Please confirm the event scheduled tomorrow at 4:45 pm titled Restaurant reservation for 4 at Ristorante Fratello, which will be held at 1712 Meridian Avenue.",CONFIRM,,
39_00056,USER,That's perfect.,AFFIRM,,
39_00056,SYSTEM,I have added thee event to your calendar.,NOTIFY_SUCCESS,,
39_00056,USER,Thank you for your kind assistance.,THANK_YOU,,
39_00056,SYSTEM,Do you require any further help?,REQ_MORE,,
39_00056,USER,"No, that's all I need. Thank you!",NEGATE,THANK_YOU,
39_00056,SYSTEM,"Sure, have a great day ahead.",GOODBYE,,
39_00057,USER,I am hoping to go view an apartment on the 11th of March. Do I have any available times that day?,INFORM,INFORM_INTENT,
39_00057,SYSTEM,"Yes, on March 11th you are free from 8 am until 6 pm.",OFFER,,
39_00057,USER,"Ok, that sounds great!",SELECT,,
39_00057,SYSTEM,I can add the event to your calendar if you would like.,OFFER_INTENT,,
39_00057,USER,"Sure, could you please add it for 9:30 am?",AFFIRM_INTENT,INFORM,
39_00057,SYSTEM,"Yes, what would you like to use for the title of the event and do you have a location you would like me to add?",REQUEST,,
39_00057,USER,"Oh, sorry, please title it Apartment viewing and the location is 4875 Clayton Road.",INFORM,,
39_00057,SYSTEM,"Alright, I will add the event Apartment viewing at 9:30 am on March 11th at 4875 Clayton Road. Is that correct?",CONFIRM,,
39_00057,USER,"Yes, that is correct.",AFFIRM,,
39_00057,SYSTEM,"Alright, the event has been added to your calendar. Is there anything else I can help you with?",NOTIFY_SUCCESS,,
39_00057,USER,"No, that is all I need right now. Thanks so much for all of your help.",THANK_YOU,GOODBYE,
39_00057,SYSTEM,"It was my pleasure, enjoy the rest of the day.",GOODBYE,,
39_00058,USER,On March 9th show me please when I will be available.,INFORM,INFORM_INTENT,
39_00058,SYSTEM,You have on March 9th an empty slot that start at 8 am and ends at 6 pm.,OFFER,,
39_00058,USER,In the 6th I have any other available time?,INFORM,REQUEST_ALTS,
39_00058,SYSTEM,You have next Wednesday an empty slot that start at 2 pm and ends at 10:30 pm.,OFFER,,
39_00058,USER,Please add an event on my calendar with tile Appointment with Dr. Azadeh Jafarnia at 2:30 in the afternoon.,INFORM,,INFORM_INTENT
39_00058,SYSTEM,The event where is happening?,REQUEST,,
39_00058,USER,At location 301 Sycamore Valley Road.,INFORM,,
39_00058,SYSTEM,Event name is Appointment with Dr. Azadeh Jafarnia and sheduled date in on next Wednesday at location 301 Sycamore Valley Road.The scheduled will be at 2:30 pm,CONFIRM,,
39_00058,USER,Sounds pefect for me.,AFFIRM,,
39_00058,SYSTEM,Event was successfully added.,NOTIFY_SUCCESS,,
39_00058,USER,Thanks for your help.,THANK_YOU,,
39_00058,SYSTEM,Can I still help you now?,REQ_MORE,,
39_00058,USER,No.Thank you very much.,NEGATE,THANK_YOU,
39_00058,SYSTEM,Have a great day!,GOODBYE,,
39_00059,USER,I want to know what time I have available.,INFORM_INTENT,,
39_00059,SYSTEM,Which day do you want to look at?,REQUEST,,
39_00059,USER,The 9th of this month is what I'm curious about.,INFORM,,
39_00059,SYSTEM,"For March 9th, you have empty slots starting from 11 pm to midnight.",OFFER,,
39_00059,USER,"Do I have any other open slots, particularly for Saturday this week?",INFORM,REQUEST_ALTS,
39_00059,SYSTEM,"For tomorrow, you have empty slots from 8 am to 4 pm.",OFFER,,
39_00059,USER,Alright. That sounds great.,SELECT,,
39_00059,SYSTEM,Is there anything else you need?,REQ_MORE,,
39_00059,USER,Sure. Please add an event to my calendar.,INFORM_INTENT,,
39_00059,SYSTEM,Okay. When is the event and what should I name it?,REQUEST,,
39_00059,USER,Please put a Property viewing in the morning 8:30.,INFORM,,
39_00059,SYSTEM,Where does this event happen?,REQUEST,,
39_00059,USER,It's located at 1375 Montecito Avenue.,INFORM,,
39_00059,SYSTEM,Let me make sure. You want to add a Property viewing event for tomorrow at 8:30 am that takes place at 1375 Montecito Avenue.,CONFIRM,,
39_00059,USER,Yeah. That is correct.,AFFIRM,,
39_00059,SYSTEM,"Okay, I've added it to your calendar.",NOTIFY_SUCCESS,,
39_00059,USER,Thanks for the help!,THANK_YOU,,
39_00059,SYSTEM,Is there anything else I can assist you with?,REQ_MORE,,
39_00059,USER,Nope. That's it. Thank you.,NEGATE,THANK_YOU,
39_00059,SYSTEM,Have a great day.,GOODBYE,,
39_00060,USER,Can you search for my available timing?,INFORM_INTENT,,
39_00060,SYSTEM,When do you want me to search in?,REQUEST,,
39_00060,USER,Show me my free timings on March 10th.,INFORM,,
39_00060,SYSTEM,You have an empty slot from 8 am to 5 pm on March 10th.,OFFER,,
39_00060,USER,Can you look for any other empty slot on 9th of March?,INFORM,REQUEST_ALTS,
39_00060,SYSTEM,You have an empty slot from 11:30 am to 1 pm on March 9th.,OFFER,,
39_00060,USER,That sounds good to me. Add one event to my calendar.,INFORM_INTENT,SELECT,
39_00060,SYSTEM,"Can you give me the details of the event like name, timing and place?",REQUEST,,
39_00060,USER,The name of the event is Buddy Guy concert which will be occur at 235 West 46th Street at 12 in the afternoon.,INFORM,,
39_00060,SYSTEM,Please confirm the details: You want me to add an event with name as Buddy Guy concert happening on March 9th at 235 West 46th Street at 12 pm to your calendar.,CONFIRM,,
39_00060,USER,"Yes, That is correct.",AFFIRM,,
39_00060,SYSTEM,Your event is successfully added to your calendar.,NOTIFY_SUCCESS,,
39_00060,USER,Okay. Thank you very much.,THANK_YOU,,
39_00060,SYSTEM,Do you need my help with anything else?,REQ_MORE,,
39_00060,USER,No. That will be all. Thank you.,NEGATE,THANK_YOU,
39_00060,SYSTEM,I am glad I could help. Have a great day.,GOODBYE,,
39_00061,USER,When am I free on March 5th?,INFORM,INFORM_INTENT,
39_00061,SYSTEM,"Next Tuesday, you're free from 2:30 pm to midnight.",OFFER,,
39_00061,USER,Ok. When am I free on the 8th?,INFORM,REQUEST_ALTS,
39_00061,SYSTEM,"Next Friday, you have an empty slot from 6:30 pm to midnight.",OFFER,,
39_00061,USER,Ok good.,SELECT,,
39_00061,SYSTEM,Would you like to book something?,OFFER_INTENT,,
39_00061,USER,"Yes. Add to my calendar an event at 261 Driggs Avenue, Brooklyn.",AFFIRM_INTENT,INFORM,
39_00061,SYSTEM,All right. What name should I use? What time?,REQUEST,,
39_00061,USER,It's Amber Run Brooklyn concert at 19:00.,INFORM,,
39_00061,SYSTEM,"Please confirm: adding Amber Run Brooklyn concert for next Friday at 7 pm. The address is 261 Driggs Avenue, Brooklyn",CONFIRM,,
39_00061,USER,Yes that's right,AFFIRM,,
39_00061,SYSTEM,I've added that to your calendar,NOTIFY_SUCCESS,,
39_00061,USER,Thanks so much.,THANK_YOU,,
39_00061,SYSTEM,Anything else you need?,REQ_MORE,,
39_00061,USER,Nah. Thanks.,NEGATE,THANK_YOU,
39_00061,SYSTEM,Always here for you.,GOODBYE,,
39_00062,USER,Please show me when I have available time slots.,INFORM_INTENT,,
39_00062,SYSTEM,Which date would you like me to search through?,REQUEST,,
39_00062,USER,The 4th of this month is the date I want you to check.,INFORM,,
39_00062,SYSTEM,There is an event next Monday that you have planned. You have an empty time slot that goes from 7:30 pm to midnight.,OFFER,,
39_00062,USER,What about March 2nd? Do I have any available time then?,INFORM,REQUEST_ALTS,
39_00062,SYSTEM,There is an event scheduled for tomorrow. You have space of free time that ranges from 8 am to 1:30 pm.,OFFER,,
39_00062,USER,"Okay that sounds fine. Now, can you please add an event to my calendar?",INFORM_INTENT,SELECT,
39_00062,SYSTEM,Where is the event taking place and at what time?,REQUEST,,
39_00062,USER,The event will take place at 600 Wilbur Avenue at nine am.,INFORM,,
39_00062,SYSTEM,What would you like to name this event?,REQUEST,,
39_00062,USER,List this event under the title Property viewing please.,INFORM,,
39_00062,SYSTEM,"The event, Property viewing, is scheduled for tomorrow at 600 Wilbur Avenue at 9 am.",CONFIRM,,
39_00062,USER,Yes. that sounds correct.,AFFIRM,,
39_00062,SYSTEM,I have successfully added the event to your calendar.,NOTIFY_SUCCESS,,
39_00062,USER,I appreciate the help. That's all I need for right now.,THANK_YOU,GOODBYE,
39_00062,SYSTEM,Thank you. Have a wonderful day.,GOODBYE,,
39_00063,USER,When do I have open availability?,INFORM_INTENT,,
39_00063,SYSTEM,Which day shall I look at?,REQUEST,,
39_00063,USER,"5th of March, please",INFORM,,
39_00063,SYSTEM,Next tuesday there's room at 9 pm until 9:30 pm,OFFER,,
39_00063,USER,"Hmmm, what about the 13th?",INFORM,REQUEST_ALTS,
39_00063,SYSTEM,On March 13th you have 8 am to 6:30 pm open.,OFFER,,
39_00063,USER,"Ok, can you please book a dentist appointment.",INFORM,INFORM_INTENT,SELECT
39_00063,SYSTEM,"Sure, where's this event and what time?",REQUEST,,
39_00063,USER,24307 Southland Drive and it's at 8:30 am,INFORM,,
39_00063,SYSTEM,Please confirm the following event: An 8:30 am dentist appointment on March 13th located at 24307 Southland Drive,CONFIRM,,
39_00063,USER,"Yes, perfect",AFFIRM,,
39_00063,SYSTEM,This event is confirmed in your calendar,NOTIFY_SUCCESS,,
39_00063,USER,"Great, thanks.",THANK_YOU,,
39_00063,SYSTEM,Will that be all?,REQ_MORE,,
39_00063,USER,"Nope, thanks.",NEGATE,THANK_YOU,
39_00063,SYSTEM,Have a wonderful day,GOODBYE,,
39_00064,USER,Can you tell me when I am going to be available?,INFORM_INTENT,,
39_00064,SYSTEM,Do you have a particular date in mind?,REQUEST,,
39_00064,USER,Show me if I am available on Thursday next week.,INFORM,,
39_00064,SYSTEM,"For next Thursday, you have empty slot that starts at 12:30 pm and ends at 6:30 pm.",OFFER,,
39_00064,USER,"Sounds good, thank you.",SELECT,,
39_00064,SYSTEM,Do you want to add an event for next Thursday to your calendar?,OFFER_INTENT,,
39_00064,USER,"Yes, please add an event to my calendar at quarter past 1 in the afternoon.",AFFIRM_INTENT,INFORM,
39_00064,SYSTEM,How should I name the event?,REQUEST,,
39_00064,USER,"Name the event Movie at Contra Costa Stadium Cinemas, located at 555 Center Avenue.",INFORM,,
39_00064,SYSTEM,"The event is Movie at Contra Costa Stadium Cinemas at 555 Center Avenue, which is scheduled for next Thursday at 1:15 pm correct?",CONFIRM,,
39_00064,USER,That all sounds correct.,AFFIRM,,
39_00064,SYSTEM,Your event was successfully added to your calendar.,NOTIFY_SUCCESS,,
39_00064,USER,"That will be all, thanks for your help.",THANK_YOU,GOODBYE,
39_00064,SYSTEM,"Your welcome, have a good day.",GOODBYE,,
39_00065,USER,"Hey, can you show me when I'm free?",INFORM_INTENT,,
39_00065,SYSTEM,In what date?,REQUEST,,
39_00065,USER,The 12th of March.,INFORM,,
39_00065,SYSTEM,You're free from 8 am to 4 pm.,OFFER,,
39_00065,USER,Good to know.,SELECT,,
39_00065,SYSTEM,Would you like to add an event on your calendar on that time?,OFFER_INTENT,,
39_00065,USER,"Yes, I would.",AFFIRM_INTENT,,
39_00065,SYSTEM,What is the event? Where will it be?,REQUEST,,
39_00065,USER,"It's a General Practitioner appointment with John Toth, D.O. at 401 Gregory Ln # 248.",INFORM,,
39_00065,SYSTEM,What time will it be?,REQUEST,,
39_00065,USER,At 2:30 in the afternoon.,INFORM,,
39_00065,SYSTEM,"Can you confirm the details? You have a General Practitioner appointment with John Toth, D.O. at 401 Gregory Ln # 248. The date is March 12th and the time is 2:30 pm.",CONFIRM,,
39_00065,USER,"Yes, this is it.",AFFIRM,,
39_00065,SYSTEM,I successfully added it to your calendar.,NOTIFY_SUCCESS,,
39_00065,USER,Thanks for the help.,THANK_YOU,,
39_00065,SYSTEM,Can I assist you in anything else?,REQ_MORE,,
39_00065,USER,"No, that's all.",NEGATE,THANK_YOU,
39_00065,SYSTEM,Have a great day.,GOODBYE,,
39_00066,USER,"Hey, when am I available?",INFORM_INTENT,,
39_00066,SYSTEM,For which date would you like to know?,REQUEST,,
39_00066,USER,March 11th.,INFORM,,
39_00066,SYSTEM,You have an empty slot from 8:30 pm to 10:30 pm on March 11th.,OFFER,,
39_00066,USER,Great. Add a new event to my calendar.,INFORM_INTENT,SELECT,
39_00066,SYSTEM,For what time? What is the event and what should I name it?,REQUEST,,
39_00066,USER,Gym. It's at night 9:30 in the Community Gym.,INFORM,,
39_00066,SYSTEM,Please confirm: you want to schedule Gym for March 11th at 9:30 pm in the Community Gym. Is that correct?,CONFIRM,,
39_00066,USER,"Yes, that's it.",AFFIRM,,
39_00066,SYSTEM,Successfully added it to your calendar.,NOTIFY_SUCCESS,,
39_00066,USER,Thanks for the help.,THANK_YOU,,
39_00066,SYSTEM,Can I assist you in anything else?,REQ_MORE,,
39_00066,USER,"No, that's all.",NEGATE,THANK_YOU,
39_00066,SYSTEM,Have a great day.,GOODBYE,,
39_00067,USER,When am i free?,INFORM_INTENT,,
39_00067,SYSTEM,Please specify the date?,REQUEST,,
39_00067,USER,12th of March,INFORM,,
39_00067,SYSTEM,"ok, for March 12th you are free at 7:30 pm to midnight.",OFFER,,
39_00067,USER,That is good,SELECT,,
39_00067,SYSTEM,Do you want me to add any event to your calendar?,OFFER_INTENT,,
39_00067,USER,"Yes, please.",AFFIRM_INTENT,,
39_00067,SYSTEM,"Please provide the details: time, location and the name for the event.",REQUEST,,
39_00067,USER,"Sure, the event starts at eight in the night and is located at 1500 South capitol street southeast. put it by the name Baseball game: Nationals Vs Reds.",INFORM,,
39_00067,SYSTEM,"Sure, please confirm: Event named Baseball game: Nationals Vs Reds for March 12th located at 1500 South capitol street southeast starting at 8 pm",CONFIRM,,
39_00067,USER,yes that right,AFFIRM,,
39_00067,SYSTEM,"ok, added to your calendar",NOTIFY_SUCCESS,,
39_00067,USER,Thanks for the help,THANK_YOU,,
39_00067,SYSTEM,Any thing else?,REQ_MORE,,
39_00067,USER,"No, thats it",NEGATE,THANK_YOU,
39_00067,SYSTEM,Have a great day!,GOODBYE,,
39_00068,USER,Can you tell me when I am available?,INFORM_INTENT,,
39_00068,SYSTEM,What date are you wanting to know about?,REQUEST,,
39_00068,USER,The 9th of March.,INFORM,,
39_00068,SYSTEM,On the event date of March 9th you have an empty slot starting at 9:30 pm and ending at midnight.,OFFER,,
39_00068,USER,Do I have another available time on the 10th of March?,INFORM,REQUEST_ALTS,
39_00068,SYSTEM,On March 10th you have an empty slot starting at 12:30 pm and ending at 7:30 pm.,OFFER,,
39_00068,USER,That sounds good.,SELECT,,
39_00068,SYSTEM,Is there anything else I can help you with?,REQ_MORE,,
39_00068,USER,Add an event to my calendar.,INFORM_INTENT,,
39_00068,SYSTEM,What type of event and what is the event name?,REQUEST,,
39_00068,USER,The event name is Toto concert and it is at 858 North Broad Street.,INFORM,,
39_00068,SYSTEM,What is the time of event?,REQUEST,,
39_00068,USER,The time is afternoon 12:45.,INFORM,,
39_00068,SYSTEM,The event name is Toto concert scheduled for March 10th at 12:45 pm and the location is 858 North Broad Street.. Is that correct?,CONFIRM,,
39_00068,USER,"Yes, that is correct.",AFFIRM,,
39_00068,SYSTEM,The event was successfully added.,NOTIFY_SUCCESS,,
39_00068,USER,Thank you very much.,THANK_YOU,,
39_00068,SYSTEM,Is there anything else I can help you with?,REQ_MORE,,
39_00068,USER,"No, that is all. Thank you.",NEGATE,THANK_YOU,
39_00068,SYSTEM,My pleasure. Have a great day.,GOODBYE,,
39_00069,USER,When am I available on next Wednesday?,INFORM,INFORM_INTENT,
39_00069,SYSTEM,You are available from 4:30 pm to midnight on next Wednesday.,OFFER,,
39_00069,USER,Can you look for any empty slot on 9th of March?,INFORM,REQUEST_ALTS,
39_00069,SYSTEM,You are available from 8 am to 1 pm on March 9th.,OFFER,,
39_00069,USER,"Okay, That sounds great to me.",SELECT,,
39_00069,SYSTEM,Is there anything else I can help you with?,REQ_MORE,,
39_00069,USER,"Yes, Can you add an event to my calendar?",INFORM_INTENT,,
39_00069,SYSTEM,"What should I put as the name, address and time for the event?",REQUEST,,
39_00069,USER,Put the name as Movie booking for long shot which will be at quarter to 10 in the morning at 2508.,INFORM,,
39_00069,SYSTEM,Please confirm the details: You want to add an event with the name as Movie booking for long shot and the schedule timing as 9:45 am on March 9th and address as 2508.,CONFIRM,,
39_00069,USER,"Yeah, That sounds great to me.",AFFIRM,,
39_00069,SYSTEM,Your event has been successfully added to your calendar.,NOTIFY_SUCCESS,,
39_00069,USER,Okay. Thank you very much.,THANK_YOU,,
39_00069,SYSTEM,Is there anything else I can help you with?,REQ_MORE,,
39_00069,USER,No. That will be all. Thank you.,NEGATE,THANK_YOU,
39_00069,SYSTEM,I am glad I could help. Have a nice day.,GOODBYE,,
39_00070,USER,"Can you help with my schedule, openness?",INFORM_INTENT,,
39_00070,SYSTEM,What date should I check?,REQUEST,,
39_00070,USER,Look on the 12th.,INFORM,,
39_00070,SYSTEM,You have an open slot at 8 pm on March 12th. That time of openness ends at 10:30 pm.,OFFER,,
39_00070,USER,Are there any other available times on the 2nd of March?,INFORM,REQUEST_ALTS,
39_00070,SYSTEM,Tomorrow you have an opening at 3 pm. lasting until 4 pm.,OFFER,,
39_00070,USER,Great. Add something for me will you?,INFORM_INTENT,SELECT,
39_00070,SYSTEM,What time and where will it be?,REQUEST,,
39_00070,USER,3:15 in the afternoon at 5 Bon Air Rd # 114,INFORM,,
39_00070,SYSTEM,Which name do you want listed for this?,REQUEST,,
39_00070,USER,Place Appointment with Koppe Michael J.,INFORM,,
39_00070,SYSTEM,"Ok, this is what I have for you: Appointment with Koppe Michael J. at 3:15 pm @ 5 Bon Air Rd # 114 tomorrow.",CONFIRM,,
39_00070,USER,That's great thank you.,AFFIRM,,
39_00070,SYSTEM,"Ok, it's on the books.",NOTIFY_SUCCESS,,
39_00070,USER,great thanks.,THANK_YOU,,
39_00070,SYSTEM,Can I help with any other activity scheduling?,REQ_MORE,,
39_00070,USER,"No, I'm good thanks.",NEGATE,THANK_YOU,
39_00070,SYSTEM,Thanks a lot.,GOODBYE,,
39_00071,USER,Can I see when I'm available on the 10th of March?,INFORM,INFORM_INTENT,
39_00071,SYSTEM,You have empty slots starting from 8 am to 5 pm on March 10th.,OFFER,,
39_00071,USER,Is there any other time available? What about March 7th?,INFORM,REQUEST_ALTS,
39_00071,SYSTEM,"Next Thursday, you have an empty slot starting at 1 pm and ending 9:30 pm.",OFFER,,
39_00071,USER,Okay. Can you add an event on my calendar?,INFORM_INTENT,SELECT,
39_00071,SYSTEM,What is the event and when and where is it happening?,REQUEST,,
39_00071,USER,It's happening at 2901 East Hastings Street at 2:15 pm.,INFORM,,
39_00071,SYSTEM,What should I call it?,REQUEST,,
39_00071,USER,Please name it as Billy Idol concert on my calendar.,INFORM,,
39_00071,SYSTEM,Just to confirm; you want to add the Billy Idol concert next Thursday at 2901 East Hastings Street at 2:15 pm to your calendar?,CONFIRM,,
39_00071,USER,"Yes, that sounds perfect.",AFFIRM,,
39_00071,SYSTEM,"Okay, I've added it to your calendar.",NOTIFY_SUCCESS,,
39_00071,USER,Thanks for all the help.,THANK_YOU,,
39_00071,SYSTEM,Is there anything else I can assist you with?,REQ_MORE,,
39_00071,USER,"Nope, that's it. Thanks.",NEGATE,THANK_YOU,
39_00071,SYSTEM,Okay. Bye! Have a great day.,GOODBYE,,
39_00072,USER,When am I available on March 5th.,INFORM,INFORM_INTENT,
39_00072,SYSTEM,The date is next Tuesday. You are free between 8 am and 3:30 pm.,OFFER,,
39_00072,USER,What other free time do I have on the 8th of this month?,INFORM,REQUEST_ALTS,
39_00072,SYSTEM,You are available next Friday between 2:30 pm and 5 pm.,OFFER,,
39_00072,USER,Great.,SELECT,,
39_00072,SYSTEM,Do you want to add a calendar event?,OFFER_INTENT,,
39_00072,USER,Yes I'd like to add an event to my calendar.,AFFIRM_INTENT,,
39_00072,SYSTEM,What would you like to call this event? What is the time and location?,REQUEST,,
39_00072,USER,The event address is 50 South San Mateo Drive and the time is afternoon 3. The title is General Practitioner appointment.,INFORM,,
39_00072,SYSTEM,Ok so just to check this is correct: You would like to create an event called General Practitioner Appointment next Friday at 3 pm. The address is 50 South San Mateo Drive.,CONFIRM,,
39_00072,USER,That's correct.,AFFIRM,,
39_00072,SYSTEM,The event has been successfully created in your calendar.,NOTIFY_SUCCESS,,
39_00072,USER,Thanks.,THANK_YOU,,
39_00072,SYSTEM,Would you like help with anything else?,REQ_MORE,,
39_00072,USER,No that's all for now thanks.,NEGATE,THANK_YOU,
39_00072,SYSTEM,Enjoy your day.,GOODBYE,,
39_00073,USER,Hey. Can you show me when I am available?,INFORM_INTENT,,
39_00073,SYSTEM,In which date?,REQUEST,,
39_00073,USER,"March 8th, please.",INFORM,,
39_00073,SYSTEM,There are 4 empty slots for that day. One of them is between 8 am and 10 am.,OFFER,,INFORM_COUNT
39_00073,USER,Do I have any free time on March 11th?,INFORM,REQUEST_ALTS,
39_00073,SYSTEM,You have 2 empty slots on March 11th. One of them is between 4:30 pm to 5:30 pm.,OFFER,,INFORM_COUNT
39_00073,USER,Any other time available?,REQUEST_ALTS,,
39_00073,SYSTEM,There is another between 8:30 pm and 10 pm.,OFFER,,
39_00073,USER,Sounds good. Create a new event on my calendar.,INFORM_INTENT,SELECT,
39_00073,SYSTEM,Great. What's the event?,REQUEST,,
39_00073,USER,"The location is 4175, 42151 Blacow Road.",INFORM,,
39_00073,SYSTEM,In what time? What should I name the event?,REQUEST,,
39_00073,USER,"At afternoon 3, please. It's a Hairdresser appointment.",INFORM,,
39_00073,SYSTEM,"Can you confirm the details? You want to set a Hairdresser appointment on March 11th. The location is 4175, 42151 Blacow Road. It is scheduled to begin at 3 pm.",CONFIRM,,
39_00073,USER,"Yes, that's it.",AFFIRM,,
39_00073,SYSTEM,I successfully added it to your calendar.,NOTIFY_SUCCESS,,
39_00073,USER,That's all. Thanks for the help.,THANK_YOU,GOODBYE,
39_00073,SYSTEM,Have a great day.,GOODBYE,,
39_00074,USER,Show me my availability,INFORM_INTENT,,
39_00074,SYSTEM,What date are you talking about?,REQUEST,,
39_00074,USER,For the 5th,INFORM,,
39_00074,SYSTEM,You have 3 empty slots. You have an empty slot from 8 am to 10 am,OFFER,,INFORM_COUNT
39_00074,USER,Is there any other time available? Maybe on the 3rd of this month,INFORM,REQUEST_ALTS,
39_00074,SYSTEM,"There are 2 empty slots on that date, you have one from 2 pm to 6 pm",OFFER,,INFORM_COUNT
39_00074,USER,Anything else available?,REQUEST_ALTS,,
39_00074,SYSTEM,Another slot from 9 pm to 12 pm,OFFER,,
39_00074,USER,That sounds good,SELECT,,
39_00074,SYSTEM,Do you want me to add something there?,OFFER_INTENT,,
39_00074,USER,"Yes, add an event",AFFIRM_INTENT,,
39_00074,SYSTEM,What time? and where is it happening?,REQUEST,,
39_00074,USER,It's at 2 pm. A hairdresser appointment at 1880 Solano Avenue,INFORM,,
39_00074,SYSTEM,Confirming you have a 2 pm hairdresser appointment at 1880 Solano Avenue the day after tomorrow,CONFIRM,,
39_00074,USER,Yes that's correct,AFFIRM,,
39_00074,SYSTEM,I've added it,NOTIFY_SUCCESS,,
39_00074,USER,"That's all for now, thanks",THANK_YOU,GOODBYE,
39_00074,SYSTEM,You're welcome. Bye,GOODBYE,,
39_00075,USER,What is my availability on the 14th.,INFORM,INFORM_INTENT,
39_00075,SYSTEM,"On March 14th, you are available from 11 am until 5 pm.",OFFER,,
39_00075,USER,"Ok, thanks a lot.",SELECT,,
39_00075,SYSTEM,Would you like me to add an event to your calendar?,OFFER_INTENT,,
39_00075,USER,"Yes, I guess I should. Could you just add Apartment viewing.",AFFIRM_INTENT,INFORM,
