dialogue_id,speaker,turn,act_1,act_2,act_3
13_00099,SYSTEM,"Dumbo, Hellboy, or Missing Link?",OFFER,,
13_00099,USER,"No, something else, in 3D, please.",INFORM,REQUEST_ALTS,
13_00099,SYSTEM,"Okay, how about Breakthrough, How to Train Your Dragon: The Hidden World, or Little?",OFFER,,
13_00099,USER,Breakthrough sounds good. What are the show times?,INFORM_INTENT,SELECT,
13_00099,SYSTEM,What day do you want to watch it?,REQUEST,,
13_00099,USER,On the 3rd.,INFORM,,
13_00099,SYSTEM,There's a 9:30 pm show at CineLux Almaden Cinema.,OFFER,,
13_00099,USER,Thanks. That's all I need.,SELECT,GOODBYE,
13_00099,SYSTEM,Have a good day.,GOODBYE,,
13_00100,USER,I like Life history movies and want to find a movie to watch. I would like to watch Century at Hayward.,INFORM,,INFORM_INTENT
13_00100,SYSTEM,Where are you located?,REQUEST,,
13_00100,USER,Please find movies in Hayward.,INFORM,,
13_00100,SYSTEM,I was able to find 1 movie. What do you think about Breakthrough?,OFFER,INFORM_COUNT,
13_00100,USER,Breakthrough sounds great. What time is it available to watch? I am interested in a regular show.,INFORM,INFORM_INTENT,SELECT
13_00100,SYSTEM,What is your preferred date to watch it?,REQUEST,,
13_00100,USER,I want to see it on the 7th.,INFORM,,
13_00100,SYSTEM,There is one show availabe at 10:30 pm in Century at Hayward.,OFFER,,
13_00100,USER,How much does the ticket cost?,REQUEST,,
13_00100,SYSTEM,The cost is 19 dollars each person.,INFORM,,
13_00100,USER,That sounds fine. That does it for me.,SELECT,GOODBYE,
13_00100,SYSTEM,Enjoy your day.,GOODBYE,,
13_00101,USER,I would like to watch a 3d movie.,INFORM,INFORM_INTENT,
13_00101,SYSTEM,where abouts are you?,REQUEST,,
13_00101,USER,I would like movies in Petaluma.,INFORM,,
13_00101,SYSTEM,"There are 3 available - Missing Link, Shazam! or The Curse of La Llorona.",OFFER,INFORM_COUNT,
13_00101,USER,Shazam is perfect.,SELECT,,
13_00101,SYSTEM,Would you like me to purchase tickets?,OFFER_INTENT,,
13_00101,USER,No not at present. What time is it on? I am interested in showing on the 4th at Boulevard Cinema.,INFORM,,INFORM_INTENT
13_00101,SYSTEM,There is 1 showing on that day at 8:30 pm in Boulevard 14 Cinema.,OFFER,,INFORM_COUNT
13_00101,USER,Do you know the address of the theater?,REQUEST,,
13_00101,SYSTEM,Yes it is 200 C Street.,INFORM,,
13_00101,USER,How much do tickets cost?,REQUEST,,
13_00101,SYSTEM,$25 per person.,INFORM,,
13_00101,USER,That all sounds good.,SELECT,,
13_00101,SYSTEM,Can I assist you with anything else?,REQ_MORE,,
13_00101,USER,No that is everything thanks.,NEGATE,THANK_YOU,
13_00101,SYSTEM,Have a great day.,GOODBYE,,
13_00102,USER,Can you help me find a good movie please?,INFORM_INTENT,,
13_00102,SYSTEM,"Sure, where are you located?",REQUEST,,
13_00102,USER,I would like hear about movies being played in Brentwood.,INFORM,,
13_00102,SYSTEM,"Would you be interested in seeing Breakthrough, Captain Marvel or Dumbo?",OFFER,,
13_00102,USER,I would like to see Dumbo!,SELECT,,
13_00102,SYSTEM,Would like to reserve the tickets?,OFFER_INTENT,,
13_00102,USER,"No not right now, can I have the show times and can you look for the movie in 3d?",INFORM,INFORM_INTENT,NEGATE_INTENT
13_00102,SYSTEM,What is the day you are interested in going to see the movie?,REQUEST,,
13_00102,USER,I would like to watch a imax show on the 2nd of this month.,INFORM,,
13_00102,SYSTEM,I have located 1 showtime for AMC Brentwood 14 at 5 pm.,OFFER,,INFORM_COUNT
13_00102,USER,Can I have the price of the ticket and the address to the theater?,REQUEST,,
13_00102,SYSTEM,The ticket price is $8 per person and the address to the theatre is 2525 Sand Creek Road.,INFORM,,
13_00102,USER,Thank you that will be all.,SELECT,GOODBYE,
13_00102,SYSTEM,No problem enjoy the rest of your day.,GOODBYE,,
13_00103,USER,I feel like being spooked out. Can you help me find some scary movies?,INFORM,INFORM_INTENT,
13_00103,SYSTEM,Where are you located?,REQUEST,,
13_00103,USER,Please look for movies showing in Campbell.,INFORM,,
13_00103,SYSTEM,I found 1 movie I think you would like. How does The Curse of La Llorona sound?,OFFER,INFORM_COUNT,
13_00103,USER,The Curse of La Llorona works good for me. What time is it showing? I'd like to go on the 9th.,INFORM,INFORM_INTENT,SELECT
13_00103,SYSTEM,I managed to find 1 showtime. It starts at 9:30 pm in Pruneyard Dine-In Cinemas.,OFFER,,INFORM_COUNT
13_00103,USER,"That's perfect, that's all I needed.",SELECT,GOODBYE,
13_00103,SYSTEM,Enjoy the movie!,GOODBYE,,
13_00104,USER,I want to find a comedy movie. Search for movies now showing in Oakland.,INFORM,,INFORM_INTENT
13_00104,SYSTEM,"Dr. Strangelove, Gloria Bell, and Little are playing. Do any of these interest you?",OFFER,,
13_00104,USER,Let's try something else. I want a regular show. Something like a Biographical movie.,INFORM,,REQUEST_ALTS
13_00104,SYSTEM,Here's 1. It is called Breakthrough.,OFFER,INFORM_COUNT,
13_00104,USER,Breakthrough is great.,SELECT,,
13_00104,SYSTEM,Do you want to purchase tickets now?,OFFER_INTENT,,
13_00104,USER,"No, not right now. What time does it play? I also want to watch Regal Jack London next Friday.",INFORM,,INFORM_INTENT
13_00104,SYSTEM,"I have found 1 showtime. It is at 9:30 pm, playing at Regal Cinemas Jack London 9.",OFFER,,INFORM_COUNT
13_00104,USER,What is the theater address?,REQUEST,,
13_00104,SYSTEM,The address is 100 Washington Street.,INFORM,,
13_00104,USER,"Great, that's all I need.",SELECT,GOODBYE,
13_00104,SYSTEM,Have a great day,GOODBYE,,
13_00105,USER,"I want to watch a movie, can you search for movies shown in San Jose.",INFORM,INFORM_INTENT,
13_00105,SYSTEM,"How about A Madea Family Funeral, After or Breakthrough?",OFFER,,
13_00105,USER,"No thanks, can you find some others.",REQUEST_ALTS,,
13_00105,SYSTEM,"How about Captain Marvel, Dogman, or Dumbo?",OFFER,,
13_00105,USER,Dogman is great thanks.,SELECT,,
13_00105,SYSTEM,Would you like to buy tickets?,OFFER_INTENT,,
13_00105,USER,"No, not at the moment. What time is it on?",INFORM_INTENT,NEGATE_INTENT,
13_00105,SYSTEM,What date would you you like to watch it?,REQUEST,,
13_00105,USER,"I want to go on the 11th, at 3 Below Theaters And Lounge.",INFORM,,
13_00105,SYSTEM,Theres a show on at 7 pm in 3 Below Theaters And Lounge.,OFFER,,
13_00105,USER,Sounds great thanks.,SELECT,,
13_00105,SYSTEM,Can I help you with anything else?,REQ_MORE,,
13_00105,USER,No thanks.,NEGATE,THANK_YOU,
13_00105,SYSTEM,"Have a good day,",GOODBYE,,
13_00106,USER,I need to find a movie to watch.,INFORM_INTENT,,
13_00106,SYSTEM,Where is your location?,REQUEST,,
13_00106,USER,Can you find for movies shown in Santa Clara.,INFORM,,
13_00106,SYSTEM,"What about Dumbo, Hellboy or Hotel Mumbai?",OFFER,,
13_00106,USER,The movie Hotel Mumbai is good.,SELECT,,
13_00106,SYSTEM,Do you want to buy tickets?,OFFER_INTENT,,
13_00106,USER,"No, i don't want to buy now and what time can i see it?",INFORM_INTENT,NEGATE_INTENT,
13_00106,SYSTEM,On which date you want to watch it?,REQUEST,,
13_00106,USER,I like to watch imax show on 1st of March.,INFORM,,
13_00106,SYSTEM,I have looked at 1 show time for the movie at the 9 pm in AMC Mercado 20.,OFFER,,INFORM_COUNT
13_00106,USER,What is the theater location?,REQUEST,,
13_00106,SYSTEM,The location is 3111 Mission College Boulevard.,INFORM,,
13_00106,USER,What type of the movie and what is the ticket cost?,REQUEST,,
13_00106,SYSTEM,The cost is $10 for that thriller movie.,INFORM,,
13_00106,USER,It's cool. That is all i want.,SELECT,GOODBYE,
13_00106,SYSTEM,Have a great day.,GOODBYE,,
13_00107,USER,I wanna go to the cinema. I don't mind the theatre.,INFORM,INFORM_INTENT,
13_00107,SYSTEM,What is your location?,REQUEST,,
13_00107,USER,Can you search movies in San Francisco?,INFORM,,
13_00107,SYSTEM,"I found 10 movies. How about Ash Is Purest White, Body Double or Captain Marvel?",OFFER,INFORM_COUNT,
13_00107,USER,"Could you find some other movies, please?",REQUEST_ALTS,,
13_00107,SYSTEM,"How about Citizen Kane, Dogman or Dumbo?",OFFER,,
13_00107,USER,Dumbo is perfect. What time can I watch it? I'd like to watch it on March 3rd.,INFORM,INFORM_INTENT,SELECT
13_00107,SYSTEM,There's one show at 10 am in AMC Metreon 16.,OFFER,,
13_00107,USER,Sounds great.,SELECT,,
13_00107,SYSTEM,Would you like to buy tickets?,OFFER_INTENT,,
13_00107,USER,"Nope, I don't wanna purchase now.",NEGATE_INTENT,,
13_00107,SYSTEM,Can I help you with anything else?,REQ_MORE,,
13_00107,USER,"Nope, thanks a lot!",NEGATE,THANK_YOU,
13_00107,SYSTEM,Have a good one,GOODBYE,,
13_00108,USER,I would like to find a movie to watch.,INFORM_INTENT,,
13_00108,SYSTEM,Where are you located?,REQUEST,,
13_00108,USER,Can you search for movies showing in Pleasant Hill?,INFORM,,
13_00108,SYSTEM,"I found 5 movies. How about After, Hotel Mumbai or Little?",OFFER,INFORM_COUNT,
13_00108,USER,I would like to see After. Any type of show is fine. What times is it showing?,INFORM,INFORM_INTENT,SELECT
13_00108,SYSTEM,What date would you like to see After?,REQUEST,,
13_00108,USER,I'd like to see it on the 1st of this month.,INFORM,,
13_00108,SYSTEM,There is one show at 10 pm in Century 16 Downtown.,OFFER,,
13_00108,USER,Great!,SELECT,,
13_00108,SYSTEM,Would you like to purchase tickets?,OFFER_INTENT,,
13_00108,USER,"No, I don't want to purchase them now.",NEGATE_INTENT,,
13_00108,SYSTEM,Can I help you with anything else?,REQ_MORE,,
13_00108,USER,No. Thanks for your help today.,NEGATE,THANK_YOU,
13_00108,SYSTEM,Have a good day.,GOODBYE,,
13_00109,USER,Find me some good movies to watch.,INFORM_INTENT,,
13_00109,SYSTEM,What location do you want me to search in?,REQUEST,,
13_00109,USER,Search for Fantasy movies in San Jose.,INFORM,,
13_00109,SYSTEM,There are 2 movies. What do think of Dumbo or Hellboy?,OFFER,INFORM_COUNT,
13_00109,USER,"Okay, Dumbo sounds great.",SELECT,,
13_00109,SYSTEM,Would you like me to buy tickets for you?,OFFER_INTENT,,
13_00109,USER,"No, I don't want to buy the ticket right now. Can you find me the timing of the movie on March 1st at Cinemark?",INFORM,,INFORM_INTENT
13_00109,SYSTEM,"There is 1 showtime, which is at 9:30 pm in Cinemark USA.",OFFER,,INFORM_COUNT
13_00109,USER,"Okay, That sounds great.",SELECT,,
13_00109,SYSTEM,Do you need my help with anything else?,REQ_MORE,,
13_00109,USER,No. That will be all. Thank you.,NEGATE,THANK_YOU,
13_00109,SYSTEM,I am glad I could help. Thank you.,GOODBYE,,
13_00110,USER,What are some movies playing in Emeryville right now?,INFORM,INFORM_INTENT,
13_00110,SYSTEM,"I found 7 of them. There's Dumbo, Family, and Little.",OFFER,INFORM_COUNT,
13_00110,USER,"Family sounds good, what are the times?",INFORM_INTENT,SELECT,
13_00110,SYSTEM,When did you want to watch it?,REQUEST,,
13_00110,USER,On the 4th of this month.,INFORM,,
13_00110,SYSTEM,There's a showing at 10 pm at AMC Bay Street 16.,OFFER,,
13_00110,USER,How much per ticket?,REQUEST,,
13_00110,SYSTEM,It's $21 a person.,INFORM,,
13_00110,USER,What type of movie is it?,REQUEST,,
13_00110,SYSTEM,It's a comedy film.,INFORM,,
13_00110,USER,"Okay, that works.",SELECT,,
13_00110,SYSTEM,Do you want to buy the tickets?,OFFER_INTENT,,
13_00110,USER,"No, not now. That's it.",NEGATE_INTENT,GOODBYE,
13_00110,SYSTEM,Have a good day.,GOODBYE,,
13_00111,USER,Give me a 3d show.,INFORM,INFORM_INTENT,
13_00111,SYSTEM,Where are you?,REQUEST,,
13_00111,USER,I am in Petaluma.,INFORM,,
13_00111,SYSTEM,"I found 3 movies: Missing Link, Shazam! and The Curse of La Llorona.",OFFER,INFORM_COUNT,
13_00111,USER,Give me The Curse of La Llorona please.,SELECT,,
13_00111,SYSTEM,Do you want tickets?,OFFER_INTENT,,
13_00111,USER,"Um, not now.",NEGATE_INTENT,,
13_00111,SYSTEM,Is there anything else?,REQ_MORE,,
13_00111,USER,What times are available on the 2nd of this month at Boulevard Cinema.,INFORM,,INFORM_INTENT
13_00111,SYSTEM,There is one at 4:30 pm in Boulevard 14 Cinema.,OFFER,,
13_00111,USER,"Sound good, thanks.",SELECT,GOODBYE,
13_00111,SYSTEM,Have a good day.,GOODBYE,,
13_00112,USER,"Hey, can you help me find a movie to watch?",INFORM_INTENT,,
13_00112,SYSTEM,Where do you live?,REQUEST,,
13_00112,USER,I'm in San Francisco. Try searching for movies shown there.,INFORM,,
13_00112,SYSTEM,"I've found 10 good ones! I recommend Ash Is Purest White, Body Double or Captain Marvel.",OFFER,INFORM_COUNT,
13_00112,USER,Can you find some other movies? I want to watch one at an imax show in the AMC Metreon nearby.,INFORM,,REQUEST_ALTS
13_00112,SYSTEM,Then Dumbo and Missing Link are 2 movies that you might want to check out.,OFFER,INFORM_COUNT,
13_00112,USER,I would love to see Missing Link!,SELECT,,
13_00112,SYSTEM,Can I help you purchase some tickets?,OFFER_INTENT,,
13_00112,USER,"No, I don't want to right now.",NEGATE_INTENT,,
13_00112,SYSTEM,Alright. Can I help you with anything else?,REQ_MORE,,
13_00112,USER,Yes. What are the available times for the movie?,INFORM_INTENT,,
13_00112,SYSTEM,What date would you like to see the movie?,REQUEST,,
13_00112,USER,March 2nd would be nice.,INFORM,,
13_00112,SYSTEM,There is 1 available showtime at 3:30 pm in AMC Metreon 16.,OFFER,,INFORM_COUNT
13_00112,USER,Great!,SELECT,,
13_00112,SYSTEM,Anything else you need?,REQ_MORE,,
13_00112,USER,No. Thanks for your help!,NEGATE,THANK_YOU,
13_00112,SYSTEM,No problem. I hope you have a great day!,GOODBYE,,
13_00113,USER,I want a recommendation on a movie to watch.,INFORM_INTENT,,
13_00113,SYSTEM,Where are you interested in seeing a movie?,REQUEST,,
13_00113,USER,"I am in San Francisco, can you search for movies in this city?",INFORM,,
13_00113,SYSTEM,"I can recommend Captain Marvel, Body Double, and Ash is Purest White.",OFFER,,
13_00113,USER,"Can you give me more movie recommendations, I want to see an IMAX show and I do like seeing comic movies.",INFORM,,REQUEST_ALTS
13_00113,SYSTEM,"Would you be interested in Gloria Bell, Josie and the Pussycats, or Missing Link?",OFFER,,
13_00113,USER,Missing Link sounds perfect.,SELECT,,
13_00113,SYSTEM,Is there anything else I can help you with?,REQ_MORE,,
13_00113,USER,"At what time can I watch the movie, if I plan on seeing it on the 1st of this month?",INFORM,INFORM_INTENT,
13_00113,SYSTEM,"The Century San Francisco Centre 9 & XD has a showing at 11 pm, would that be acceptable?",OFFER,,
13_00113,USER,That sounds good.,SELECT,,
13_00113,SYSTEM,Do you want to purchase tickets now?,OFFER_INTENT,,
13_00113,USER,"I think I am not ready to purchase tickets, so no.",NEGATE_INTENT,,
13_00113,SYSTEM,Is there anything else I can help you with?,REQ_MORE,,
13_00113,USER,"No, that will be all, thank you for your help.",NEGATE,THANK_YOU,
13_00113,SYSTEM,"No problem, have a good day.",GOODBYE,,
13_00114,USER,I am looking for something to do tonight and would like to find a movie that I can watch.,INFORM_INTENT,,
13_00114,SYSTEM,Where are you right now?,REQUEST,,
13_00114,USER,I would like to find movies shown in Moraga tonight.,INFORM,,
13_00114,SYSTEM,Hotel Mumbai and Missing Link are the 2 movies I found first.,OFFER,INFORM_COUNT,
13_00114,USER,What time is Hotel Mumbai being shown?,INFORM_INTENT,SELECT,
13_00114,SYSTEM,When would you like to schedule your movie?,REQUEST,,
13_00114,USER,Lets watch it on the 2nd of this month and right now I will watch a regular T.V. show.,INFORM,,
13_00114,SYSTEM,There is only 1 show at the Rheem Theatre at 4 pm that day.,OFFER,,INFORM_COUNT
13_00114,USER,That is good! Thank you.,SELECT,GOODBYE,
13_00114,SYSTEM,You're welcome!,GOODBYE,,
13_00115,USER,What movies are being shown in Healdsburg?,INFORM,INFORM_INTENT,
13_00115,SYSTEM,"Does Dumbo, Hotel Mumbai, or Shazam! sound good?",OFFER,,
13_00115,USER,I love Dumbo.,SELECT,,
13_00115,SYSTEM,Do you want to buy tickets?,OFFER_INTENT,,
13_00115,USER,I don't want to buy them now.,NEGATE_INTENT,,
13_00115,SYSTEM,Do you need anything else?,REQ_MORE,,
13_00115,USER,What times are available?,INFORM_INTENT,,
13_00115,SYSTEM,What days can I watch it on?,REQUEST,,
13_00115,USER,"I want to see it 1st of March, in imax, at Raven Film center.",INFORM,,
13_00115,SYSTEM,1 showtime at 8:30 pm in Raven Film center.,OFFER,,INFORM_COUNT
13_00115,USER,Okay.,SELECT,,
13_00115,SYSTEM,Anything else?,REQ_MORE,,
13_00115,USER,No. Thanks for your help.,NEGATE,THANK_YOU,
13_00115,SYSTEM,Have a Good day.,GOODBYE,,
13_00116,USER,I wish to search for a movie at Tiburon Playhouse.,INFORM,INFORM_INTENT,
13_00116,SYSTEM,Where are you living?,REQUEST,,
13_00116,USER,Could you please find the movie in Tiburon?,INFORM,,
13_00116,SYSTEM,"I searched and found 3 movies. What do you think about Dumbo, Long Shot or Missing Link?",OFFER,INFORM_COUNT,
13_00116,USER,I prefer Long Shot.,SELECT,,
13_00116,SYSTEM,Shall I book tickets?,OFFER_INTENT,,
13_00116,USER,Nope. This time I not interested in booking now. Which time shall I see it?,INFORM_INTENT,NEGATE_INTENT,
13_00116,SYSTEM,When will you want to see it on?,REQUEST,,
13_00116,USER,I wish to see it on the 9th.,INFORM,,
13_00116,SYSTEM,I searched and found 1 showtime in Tiburon Playhouse at 7 pm.,OFFER,,INFORM_COUNT
13_00116,USER,It is great. That is what I want.,SELECT,GOODBYE,
13_00116,SYSTEM,Have a wonderful day.,GOODBYE,,
13_00117,USER,Can you find me a movie shown in Vallejo,INFORM,INFORM_INTENT,
13_00117,SYSTEM,"What do you think about After, Breakthrough or Captain Marvel",OFFER,,
13_00117,USER,Can you search regular show movies shown in Santa Clara,INFORM,,REQUEST_ALTS
13_00117,SYSTEM,"I found you 2 movies, what about Dumbo, How to Train Your Dragon: The hidden World or Little",OFFER,,
13_00117,USER,Any other movies available?,INFORM,REQUEST_ALTS,
13_00117,SYSTEM,"What about Hellboy, Hotel Mumbai or Long shot",OFFER,,
13_00117,USER,Long shot sounds great. I want to watch on the 11th at AMC Mercado,INFORM,,INFORM_INTENT
13_00117,SYSTEM,I located 1 showtime at 10:30 pm in AMC Mercado 20,OFFER,,INFORM_COUNT
13_00117,USER,What is the cost of the ticket?,REQUEST,,
13_00117,SYSTEM,Ticket is $7 per person,INFORM,,
13_00117,USER,ok perfect,SELECT,,
13_00117,SYSTEM,Would you like to purchase a ticket,OFFER_INTENT,,
13_00117,USER,No not now,NEGATE_INTENT,,
13_00117,SYSTEM,Anything else i can help you with,REQ_MORE,,
13_00117,USER,No thats it,NEGATE,THANK_YOU,
13_00117,SYSTEM,Have a nice day,GOODBYE,,
13_00118,USER,I want to watch a movie.,INFORM_INTENT,,
13_00118,SYSTEM,Where are you located?,REQUEST,,
13_00118,USER,I want to watch a movie in Larkspur. I want to watch some Horror movies.,INFORM,,
13_00118,SYSTEM,"OK, I found 1 movie. Do you want to watch The Curse of La Llorona?",OFFER,INFORM_COUNT,
13_00118,USER,"Yes, I want to watch The Curse of La Llorona.",SELECT,,
13_00118,SYSTEM,Do you need help with anything else?,REQ_MORE,,
13_00118,USER,What are the showtimes for the 1st of March?,INFORM,INFORM_INTENT,
13_00118,SYSTEM,One showing is available at 10 pm at Century Larkspur.,OFFER,,
13_00118,USER,Where is the theater located?,REQUEST,,
13_00118,SYSTEM,The theater is at 500 Larkspur Landing Circle.,INFORM,,
13_00118,USER,Great! That's all I need.,SELECT,GOODBYE,
13_00118,SYSTEM,Have a great day!,GOODBYE,,
13_00119,USER,I need help finding a movie to watch.,INFORM_INTENT,,
13_00119,SYSTEM,Sure thing. Where are you located?,REQUEST,,
13_00119,USER,I'm in Redwood City. Are there any Adventure movies playing at Century Redwood City?,INFORM,,
13_00119,SYSTEM,Would you like Shazam! ?,OFFER,,
13_00119,USER,Shazam! sounds good. What times are available?,INFORM_INTENT,SELECT,
13_00119,SYSTEM,"On what date, please?",REQUEST,,
13_00119,USER,On March 4th.,INFORM,,
13_00119,SYSTEM,"OK, I have 1 showtime available at Century Redwood City Downtown 20 & XD, for Shazam!, at 11 pm.",OFFER,,INFORM_COUNT
13_00119,USER,How much is a ticket?,REQUEST,,
13_00119,SYSTEM,Tickets are 10 dollars per person.,INFORM,,
13_00119,USER,What is the address?,REQUEST,,
13_00119,SYSTEM,The theatre address is 825 Middlefield Road.,INFORM,,
13_00119,USER,Sounds good. That's what I needed.,SELECT,GOODBYE,
13_00119,SYSTEM,Have a great day!,GOODBYE,,
13_00120,USER,I'm looking for a movie at CineLux Tennant Station.,INFORM,INFORM_INTENT,
13_00120,SYSTEM,Which location?,REQUEST,,
13_00120,USER,"Something in Adventure at Morgan Hill, a regular show.",INFORM,,
13_00120,SYSTEM,There's Captain Marvel and Shazam!.,OFFER,,
13_00120,USER,"Shazam sounds good, what times are there for Monday next week?",INFORM,INFORM_INTENT,SELECT
13_00120,SYSTEM,I found 1 showtime at 10 pm in CineLux Tennant Station Stadium 11.,OFFER,,INFORM_COUNT
13_00120,USER,Sounds good.,SELECT,,
13_00120,SYSTEM,Anything else I can find for you?,REQ_MORE,,
13_00120,USER,"No, that's all.",NEGATE,THANK_YOU,
13_00120,SYSTEM,Have a nice day.,GOODBYE,,
13_00121,USER,I'm looking for a movie.,INFORM_INTENT,,
13_00121,SYSTEM,Where you?,REQUEST,,
13_00121,USER,Look in Santa Rosa.,INFORM,,
13_00121,SYSTEM,"I found Hellboy, Dumbo and After.",OFFER,,
13_00121,USER,What time is After playing later today?,INFORM,INFORM_INTENT,SELECT
13_00121,SYSTEM,At 10 pm there is 1 showtime at the Roxy Stadium 14.,OFFER,,INFORM_COUNT
13_00121,USER,I need an address.,REQUEST,,
13_00121,SYSTEM,It's at 85 Santa Rosa Avenue.,INFORM,,
13_00121,USER,Awesome. I don't need anything else.,SELECT,GOODBYE,
13_00121,SYSTEM,You have a great day.,GOODBYE,,
13_00122,USER,I'm looking for a movie to see preferably in Livermore.,INFORM,INFORM_INTENT,
13_00122,SYSTEM,"I have 7 possibilities. How about Breakthrough, After, or Captain Marvel?",OFFER,INFORM_COUNT,
13_00122,USER,What else do you have?,REQUEST_ALTS,,
13_00122,SYSTEM,"Some other possibilities are High Life, Missing Link, or Shazam!?",OFFER,,
13_00122,USER,I'd like to see High Life. I'd like to see a 3d show. What time could I see it?,INFORM,INFORM_INTENT,SELECT
13_00122,SYSTEM,What date are you interested in?,REQUEST,,
13_00122,USER,The day after tomorrow.,INFORM,,
13_00122,SYSTEM,I have a 6:30 PM show at Vine Cinema & Alehouse.,OFFER,,
13_00122,USER,What is the genre?,REQUEST,,
13_00122,SYSTEM,It is a drama.,INFORM,,
13_00122,USER,"That's perfect, I'm all set.",SELECT,GOODBYE,
13_00122,SYSTEM,Enjoy your movie.,GOODBYE,,
13_00123,USER,I would love to watch a movie right now. What's playing right now?,INFORM_INTENT,,
13_00123,SYSTEM,"If you give me your location, I can find movies closest to you.",REQUEST,,
13_00123,USER,Find movies in the Santa Rosa area please.,INFORM,,
13_00123,SYSTEM,"How about any of the following movies: After, Dumbo, or Hellboy?",OFFER,,
13_00123,USER,"Eh, I kind of want to watching something a little more regular. Can you find what is playing at the Airport Stadium Cinemas?",INFORM,,REQUEST_ALTS
13_00123,SYSTEM,I've found 1 movie playing there that matches your criteria. How about The Curse of La Llorona?,OFFER,INFORM_COUNT,
13_00123,USER,Curse of La Llorona sounds great. What time is it playing?,INFORM_INTENT,SELECT,
13_00123,SYSTEM,I will need a date to help determine showtimes.,REQUEST,,
13_00123,USER,I plan on going to the theater Friday next week.,INFORM,,
13_00123,SYSTEM,Okay. I've found 1 showtime for Friday next week at the Airport Stadium 12. The show is at 9:30 pm.,OFFER,,INFORM_COUNT
13_00123,USER,"Gosh, that's kind of late. How much is a ticket?",REQUEST,,
13_00123,SYSTEM,The price per ticket is $9.,INFORM,,
13_00123,USER,That's not too bad.,SELECT,,
13_00123,SYSTEM,Would you like to purchase tickets now?,OFFER_INTENT,,
13_00123,USER,"No, not right now, but thank you.",NEGATE_INTENT,GOODBYE,
13_00123,SYSTEM,Okay. You're most welcome.,GOODBYE,,
13_00124,USER,Find me please a movie to watch at Airport Stadium Cinemas,INFORM,INFORM_INTENT,
13_00124,SYSTEM,Please tell me your exact location,REQUEST,,
13_00124,USER,In Santa Rosa search me please.,INFORM,,
13_00124,SYSTEM,"I have for you 4 movies.What do you think about Dumbo, Little or Pet Sematary?",OFFER,INFORM_COUNT,
13_00124,USER,Find me something else please.,REQUEST_ALTS,,
13_00124,SYSTEM,The Curse of La Llorona you like?,OFFER,,
13_00124,USER,Is perfect The Curse of La Llorona.At what time can I watch?,INFORM_INTENT,SELECT,
13_00124,SYSTEM,You want to watch it on in witch date?,REQUEST,,
13_00124,USER,It will be perfect for me to watch on next Friday.,INFORM,,
13_00124,SYSTEM,I found one show that starts at 9:30 pm in Airport Stadium 12,OFFER,,
13_00124,USER,Sounds perfect.,SELECT,,
13_00124,SYSTEM,You want to buy tickets?,OFFER_INTENT,,
13_00124,USER,"No,I dont want now.That is all I need now",NEGATE_INTENT,GOODBYE,
13_00124,SYSTEM,Have a great day!,GOODBYE,,
13_00125,USER,"Hey, I want a movie. Find me one in San Ramon, please. A good one this time!",INFORM,INFORM_INTENT,
13_00125,SYSTEM,"I have found three movie options which match what you are looking for. Would you like to see any of the following: Breakthrough, Captain Marvel or Dumbo?",OFFER,,
13_00125,USER,"Cool, but find some other ones too please. I love Adventure movies.",INFORM,REQUEST_ALTS,
13_00125,SYSTEM,I have found 1 movie which matches your request. Would you like to see Shazam!?,OFFER,INFORM_COUNT,
13_00125,USER,"Yeah, I heard of that one! I want to see Shazam then. What showtimes are there today? Actually I'm free on the 2nd.",INFORM,INFORM_INTENT,SELECT
13_00125,SYSTEM,There are 2 showtimes for that movie on that day. There is one show at 3 PM in THE LOT City Center.,OFFER,,INFORM_COUNT
13_00125,USER,Yeah! That works.,SELECT,,
13_00125,SYSTEM,Would you like to purchase these tickets?,OFFER_INTENT,,
13_00125,USER,"No, I don't want to purchase them ahead of time. I don't need to. But thank you!",NEGATE_INTENT,GOODBYE,
13_00125,SYSTEM,Of course. Have a wonderful day.,GOODBYE,,
13_00126,USER,Can you help me find a movie to watch?,INFORM_INTENT,,
13_00126,SYSTEM,Yes of course. In what location please?,REQUEST,,
13_00126,USER,I prefer Union City.,INFORM,,
13_00126,SYSTEM,"There are three choices: After, Breakthrough or Captain Marvel.",OFFER,,
13_00126,USER,Can you find some other choices? I prefer an adventure movie at Century Union Landing.,INFORM,,REQUEST_ALTS
13_00126,SYSTEM,Only 1 movie is available at Century Union Landing: Shazam!.,OFFER,INFORM_COUNT,
13_00126,USER,Shazam! sounds good.,SELECT,,
