dialogue_id,speaker,turn,act_1,act_2,act_3
51_00070,USER,"Actually, find a compact car for pickup around 13:30 at 30th Street Station.",INFORM,,
51_00070,SYSTEM,"Okay, just to confirm you'd like to reserve a compact car for pickup at 1:30 pm on March 6th at 30th Street Station with a drop off date of March 8th?",CONFIRM,,
51_00070,USER,"Yes, that's correct.",AFFIRM,,
51_00070,SYSTEM,I've reserved your car.,NOTIFY_SUCCESS,,
51_00070,USER,How much in total?,REQUEST,,
51_00070,SYSTEM,It's $54 total.,INFORM,,
51_00070,USER,What kind of car?,REQUEST,,
51_00070,SYSTEM,You're getting a Leaf.,INFORM,,
51_00070,USER,"Thanks, can you help me find a hotel room in Philly, too?",THANK_YOU,,
51_00070,SYSTEM,"Sure, I found 10 that suit your needs. How about Aka University City with a rating of 4.6?",OFFER,,INFORM_COUNT
51_00070,USER,What else is there? Find something with 2 rooms available.,INFORM,REQUEST_ALTS,
51_00070,SYSTEM,"Okay, I found 9 you may like. How about Aloft Philadelphia Airport with a rating of 4.0?",OFFER,,INFORM_COUNT
51_00070,USER,"Sure, make me a reservation for the 6th of this month.",INFORM,INFORM_INTENT,SELECT
51_00070,SYSTEM,Is your check out on March 8th?,REQUEST,,
51_00070,USER,"No, on the 11th of March.",INFORM,,
51_00070,SYSTEM,Please confirm you'd like 2 rooms at Aloft Philadelphia Airport in Philadelphia for March 6th until March 11th.,CONFIRM,,
51_00070,USER,"Yes, what's their number and do they allow pets?",REQUEST,,AFFIRM
51_00070,SYSTEM,I've made your reservation. It is pet friendly and they can be reached at +1 267-298-1700.,INFORM,,NOTIFY_SUCCESS
51_00070,USER,Thanks so much.,THANK_YOU,,
51_00070,SYSTEM,My pleasure. Can I do anything else?,REQ_MORE,,
51_00070,USER,"Nope, thanks again.",NEGATE,THANK_YOU,
51_00070,SYSTEM,Have a good rest of your day.,GOODBYE,,
51_00071,USER,I need to reserve this car on the 6th.,INFORM,INFORM_INTENT,
51_00071,SYSTEM,What date will you be returning it? What kind of car do you want?,REQUEST,,
51_00071,USER,I'd like a standard car until the 11th of this month.,INFORM,,
51_00071,SYSTEM,Where will you be picking up? At what time?,REQUEST,,
51_00071,USER,I'd like to pick it up around 4:30 pm at Peachtree station.,INFORM,,
51_00071,SYSTEM,"Please confirm: you'll pick up a Standard car at 4:30 pm on March 6th at Peachtree station, and return it on March 11th.",CONFIRM,,
51_00071,USER,"Actually, I want a compact car and only until the 7th.",INFORM,,NEGATE
51_00071,SYSTEM,Please confirm the new details: change the drop off date to March 7th and change style to compact.,CONFIRM,,
51_00071,USER,"Yes, that's correct.",AFFIRM,,
51_00071,SYSTEM,I've reserved the car.,NOTIFY_SUCCESS,,
51_00071,USER,How much will it be?,REQUEST,,
51_00071,SYSTEM,It'll be $25 in total.,INFORM,,
51_00071,USER,What model car is it?,REQUEST,,
51_00071,SYSTEM,It's a Forte.,INFORM,,
51_00071,USER,Thanks for your help! Can you find me a hotel near there?,THANK_YOU,,
51_00071,SYSTEM,Do you want me to find you a hotel in Atlanta?,REQUEST,,
51_00071,USER,"Yes, that sounds good.",AFFIRM,,
51_00071,SYSTEM,How about Ac Hotel By Marriott Atlanta Buckhead at Phipps Plaza? It's rated at 4.5.,OFFER,,
51_00071,USER,Do they allow pets?,REQUEST,,
51_00071,SYSTEM,"Unfortunately, they do not.",INFORM,,
51_00071,USER,"Can you find me something else, maybe around LAX?",INFORM,REQUEST_ALTS,
51_00071,SYSTEM,How about the Ac Hotel By Marriott Beverly Hills? It's rated at 4.4.,OFFER,,
51_00071,USER,Can you tell me their phone number and street address?,REQUEST,,
51_00071,SYSTEM,"Sure, they're located at 6399 Wilshire Boulevard and can be reached at +1 323-852-7000.",INFORM,,
51_00071,USER,Is there anything else? I need a pet friendly place with 2 available rooms.,INFORM,,REQUEST_ALTS
51_00071,SYSTEM,I found 10 options. How about the 3.9 rated Airtel Plaza Hotel?,OFFER,,INFORM_COUNT
51_00071,USER,That one sounds perfect.,SELECT,,
51_00071,SYSTEM,Do you want me to reserve it for you?,OFFER_INTENT,,
51_00071,USER,"Yes please, from the 4th until March 9th.",AFFIRM_INTENT,INFORM,
51_00071,SYSTEM,Please confirm: book 2 rooms for the Airtel Plaza Hotel in Los Angeles from March 4th through March 9th.,CONFIRM,,
51_00071,USER,"No, I'll be staying from the 5th of March until the 7th.",INFORM,,NEGATE
51_00071,SYSTEM,Please confirm: the stay is from March 5th until March 7th.,CONFIRM,,
51_00071,USER,"Yes, that's wonderful. What's the address and price?",REQUEST,,AFFIRM
51_00071,SYSTEM,"The reservation is successful. It's located at 7277 Valjean Avenue, Van Nuys, California 91406, United States and it will cost $504 total.",INFORM,,NOTIFY_SUCCESS
51_00071,USER,"Thanks, that'll be all!",THANK_YOU,GOODBYE,
51_00071,SYSTEM,Have a great evening!,GOODBYE,,
51_00072,USER,I would like to book this car.,INFORM_INTENT,,
51_00072,SYSTEM,What date do you want it from and to?,REQUEST,,
51_00072,USER,I need it from the 3rd of this month until the 4th.,INFORM,,
51_00072,SYSTEM,Which kind of car do you want for example Compact or Full-size or something else? Also where will you be collecting the car from?,REQUEST,,
51_00072,USER,I want a small car and will be collecting it from Union Plaza.,INFORM,,
51_00072,SYSTEM,What time will you be collecting it?,REQUEST,,
51_00072,USER,At evening 4:30,INFORM,,
51_00072,SYSTEM,To confirm then you want a Compact car form March 3rd at 4:30 pm to March 4th and you will collect it from Union Plaza.,CONFIRM,,
51_00072,USER,Yes that information is correct.,AFFIRM,,
51_00072,SYSTEM,You booking is confirmed.,NOTIFY_SUCCESS,,
51_00072,USER,What is the car brand?,REQUEST,,
51_00072,SYSTEM,It is a GTI.,INFORM,,
51_00072,USER,Thanks for you help now can you help me book 1 hotel room there?,THANK_YOU,,
51_00072,SYSTEM,In Las Vegas?,REQUEST,,
51_00072,USER,Yes that suits me.,AFFIRM,,
51_00072,SYSTEM,There is a 4.3 rating hotel called Best Western Plus Las Vegas West,OFFER,,
51_00072,USER,Is there anything else?,REQUEST_ALTS,,
51_00072,SYSTEM,There is a 3.4 rating hotl called Budget Suites of America.,OFFER,,
51_00072,USER,Where is that located?,REQUEST,,
51_00072,SYSTEM,at 2219 North Rancho Drive.,INFORM,,
51_00072,USER,That is exactly what I want.,SELECT,,
51_00072,SYSTEM,Will I book this hotel?,OFFER_INTENT,,
51_00072,USER,Yes book this for me.,AFFIRM_INTENT,,
51_00072,SYSTEM,Will you check in on March 3rd?,REQUEST,,
51_00072,USER,Yes that suits me.,AFFIRM,,
51_00072,SYSTEM,Will you check out on March 4th?,REQUEST,,
51_00072,USER,I want to check out on the 6th.,INFORM,,
51_00072,SYSTEM,To confirm then that is 1 room from March 3rd until March 6th at Budget Suites of America in Las Vegas.,CONFIRM,,
51_00072,USER,Yes that suits me.,AFFIRM,,
51_00072,SYSTEM,Your booking is now confirmed.,NOTIFY_SUCCESS,,
51_00072,USER,thank you so much.,THANK_YOU,,
51_00072,SYSTEM,What else can I do for you?,REQ_MORE,,
51_00072,USER,no nothing thank you.,NEGATE,THANK_YOU,
51_00072,SYSTEM,have a lovely day.,GOODBYE,,
51_00073,USER,I'd like to reserve a car until the 10th.,INFORM,INFORM_INTENT,
51_00073,SYSTEM,Where would you like to get it from? And what kind of car do you want?,REQUEST,,
51_00073,USER,I'd like to pick it up at the Gatwick International Airport. I'd like a medium-sized car.,INFORM,,
51_00073,SYSTEM,When do you need it?,REQUEST,,
51_00073,USER,I'd like to pick it up around 12:00.,INFORM,,
51_00073,SYSTEM,When would you like to pick it up?,REQUEST,,
51_00073,USER,I'd like to get the car on the 7th of this month.,INFORM,,
51_00073,SYSTEM,Please confirm the following: You want to pickup a Standard car on March 7th at 12 PM from Gatwick International Airport and keep it until March 10th.,CONFIRM,,
51_00073,USER,"Yes, that would work.",AFFIRM,,
51_00073,SYSTEM,The car has been reserved.,NOTIFY_SUCCESS,,
51_00073,USER,Thanks so much for your help. I'd like to find a hotel there.,THANK_YOU,,
51_00073,SYSTEM,Are you wanting a hotel in London?,REQUEST,,
51_00073,USER,"Yes, that would work.",AFFIRM,,
51_00073,SYSTEM,"I have found 10 hotels that would work. How does 45 Park Lane, which has a 4.7 rating, sound to you?",OFFER,,INFORM_COUNT
51_00073,USER,Does it allow pets? And what's the phone number?,REQUEST,,
51_00073,SYSTEM,"It does allow pets, and their number is +44 20 7493 4545.",INFORM,,
51_00073,USER,That would work. I'd like to make a reservation for one room and would like to check out on the 11th.,INFORM,,INFORM_INTENT
51_00073,SYSTEM,Would you like to check in on March 7th?,REQUEST,,
51_00073,USER,I'd like to check in on March 4th.,INFORM,,
51_00073,SYSTEM,Please confirm the following: You want a reservation for 1 room starting on March 4th and ending on March 11th at 45 Park Lane in London.,CONFIRM,,
51_00073,USER,"Yes, that would work. How much is it?",REQUEST,AFFIRM,
51_00073,SYSTEM,"The reservation has been made. It costs $3,276.",INFORM,NOTIFY_SUCCESS,
51_00073,USER,Thank you so much. That's all for now.,THANK_YOU,GOODBYE,
51_00073,SYSTEM,Have a great day!,GOODBYE,,
51_00074,USER,Reserve a car please.,INFORM_INTENT,,
51_00074,SYSTEM,"Sure, I need to know what date would you like to pick up the rental and which type of car do you require?",REQUEST,,
51_00074,USER,Pick up on Wednesday next week and keep until the 10th of this month. I would need a medium-sized vehicle.,INFORM,,
51_00074,SYSTEM,what time will you be picking up the rental and where would be the best place for you to pick it up?,REQUEST,,
51_00074,USER,let's shoot for 12:30 at McCarran International Airport.,INFORM,,
51_00074,SYSTEM,"Alright, Pick up at McCarran International Airport on March 6th. Pick up time will be 12:30 pm and drop off on March 10th. This reservation is for a Standard car.",CONFIRM,,
51_00074,USER,Find the total and which type of vehicle please. Go ahead and book.,REQUEST,,AFFIRM
51_00074,SYSTEM,"Great, reservation is complete. The car is a Prius and a total due of $128.",INFORM,,NOTIFY_SUCCESS
51_00074,USER,"Thank you, let's also search for a hotel there. I will need 1 room in Las Vegas.",THANK_YOU,,
51_00074,SYSTEM,"Sure, how about Best Western Plus Las Vegas West with a 4.3 star rating.",OFFER,,
51_00074,USER,Any other options?,REQUEST_ALTS,,
51_00074,SYSTEM,Found Budget Suites Of America with a 3.4 star rating.,OFFER,,
51_00074,USER,That is great.,SELECT,,
51_00074,SYSTEM,Should I reserve this?,OFFER_INTENT,,
51_00074,USER,yes please. make sure dates are for Wednesday next week until the 13th of March.,AFFIRM_INTENT,INFORM,
51_00074,SYSTEM,"Ok, please confirm: Budget Suites Of America in Las Vegas. Check in on March 6th until March 13th for 1 room. Is this correct.",CONFIRM,,
51_00074,USER,Yes go ahead and book.,AFFIRM,,
51_00074,SYSTEM,"Great, reservation is complete.",NOTIFY_SUCCESS,,
51_00074,USER,Thank you.,THANK_YOU,,
51_00074,SYSTEM,Will there be anything else?,REQ_MORE,,
51_00074,USER,"Nope, that was all.",NEGATE,THANK_YOU,
51_00074,SYSTEM,"Alright, Enjoy your trip. Good bye.",GOODBYE,,
51_00075,USER,There's a car I want to reserve.,INFORM_INTENT,,
51_00075,SYSTEM,Where would you like to pick it up from?,REQUEST,,
51_00075,USER,I'd prefer to pick it up from John Wayne Airport.,INFORM,,
51_00075,SYSTEM,What time will you pick it up?,REQUEST,,
51_00075,USER,I can go get it in the evening 5.,INFORM,,
51_00075,SYSTEM,"And what's your pick up date? Also, is there a specific type of car you want, like Full-size or Compact?",REQUEST,,
51_00075,USER,I want to pick it up on the 9th. And I need an intermediate car.,INFORM,,
51_00075,SYSTEM,And until when will you need the car.,REQUEST,,
51_00075,USER,I plan to use the car until the 10th of this month.,INFORM,,
51_00075,SYSTEM,"You want a Standard car from John Wayne Airport with a pick up date on March 9th at 5 pm and drop off date on March 10th, do you want me to book this?",CONFIRM,,
51_00075,USER,"Yes, that's what I want. What's the car's name and the cost of everything?",REQUEST,,AFFIRM
51_00075,SYSTEM,I've booked the car. It's an Accord and the cost total is $31.,INFORM,,NOTIFY_SUCCESS
51_00075,USER,Thanks so much. Now I want to find a hotel there.,THANK_YOU,,
51_00075,SYSTEM,You'd like to look for a hotel in Anaheim?,REQUEST,,
51_00075,USER,"Yes, in Anaheim.",AFFIRM,,
51_00075,SYSTEM,There are 10 matches. There's the Anaheim Desert Inn and Suites with a 4.1 rating.,OFFER,,INFORM_COUNT
51_00075,USER,That sounds great. Please book me a room.,INFORM_INTENT,SELECT,
51_00075,SYSTEM,Would you like to check in on March 9th and check out on March 10th?,REQUEST,,
51_00075,USER,"Yeah, that can work. Actually, let me check in on the 5th of this month.",INFORM,AFFIRM,
51_00075,SYSTEM,You want 1 room at Anaheim Desert Inn and Suites in Anaheim with a check in on March 5th and a check out on March 10th. Do you want me to book this?,CONFIRM,,
51_00075,USER,"Yes, please book it.",AFFIRM,,
51_00075,SYSTEM,I've booked you the room.,NOTIFY_SUCCESS,,
51_00075,USER,Thanks for booking it.,THANK_YOU,,
51_00075,SYSTEM,Do you need me to do anything else?,REQ_MORE,,
51_00075,USER,"No, thanks again.",NEGATE,THANK_YOU,
51_00075,SYSTEM,Have a pleasant day.,GOODBYE,,
51_00076,USER,I want to book a rental car.,INFORM_INTENT,,
51_00076,SYSTEM,"Can you tell me when will you pick up the car, and at what time do you want to have the car? Is there a specific type of car you want to have?",REQUEST,,
51_00076,USER,"I would like to have a car which is spacious, and I want to pick it up in Phoenix Union Station. I would like to pick the car up around 2:15 in the afternoon, and I will need it till the 12th.",INFORM,,
51_00076,SYSTEM,Can you tell me the time from when you need the car?,REQUEST,,
51_00076,USER,"I will need to rent the car from Wednesday next week till next Thursday, and I will be picking it up around evening 4.",INFORM,,
51_00076,SYSTEM,"Can you please confirm that you want to rent a Full-size car which you will pick up from Phoenix Union Station on March 6th at 4 pm, and will need the car till March 7th?",CONFIRM,,
51_00076,USER,That seems nice. Can you tell me how much it will cost me?,REQUEST,AFFIRM,
51_00076,SYSTEM,"Your requested car has been booked, and it will cost you $40.",INFORM,NOTIFY_SUCCESS,
51_00076,USER,"I also need to find a place to sleep there, so find me one room in a hotel. I want the hotel to welcome pets, and for the hotel to be around Phoenix.",INFORM,,
51_00076,SYSTEM,"There are 10 hotels which match what you want. One of the hotels is Aloft Phoenix-Airport, which has a rating of 4.2.",OFFER,,INFORM_COUNT
51_00076,USER,"Is there some other hotel you can suggest? Now that I think about it, I need to have 2 rooms.",INFORM,REQUEST_ALTS,
51_00076,SYSTEM,"There are 9 hotels which you might like. One of the hotels is the Comfort Suites Phoenix North, that has a rating of 3.8.",OFFER,,INFORM_COUNT
51_00076,USER,Can you tell me their phone number?,REQUEST,,
51_00076,SYSTEM,If you want to call them you can at +1 602-861-3900.,INFORM,,
51_00076,USER,Can you give me their street address?,REQUEST,,
51_00076,SYSTEM,The address of the hotel is 10210 North 26th Drive.,INFORM,,
51_00076,USER,Is there some other hotel you can recommend?,REQUEST_ALTS,,
51_00076,SYSTEM,Another hotel I can recommend which has a rating of 4.1 is the Crowne Plaza Phoenix Airport.,OFFER,,
51_00076,USER,That's what I need.,SELECT,,
51_00076,SYSTEM,Would you like to have a room booked at this hotel?,OFFER_INTENT,,
51_00076,USER,"Yes, I want to book a room at this hotel, and I will need it till next Thursday.",AFFIRM_INTENT,INFORM,
51_00076,SYSTEM,Will you be going there on March 6th?,REQUEST,,
51_00076,USER,I actually want to go there on March 2nd.,INFORM,,
51_00076,SYSTEM,"Can you please confirm that you want to book 2 rooms at the Crowne Plaza Phoenix Airport in Phoenix, and that you will go there on March 2nd, and will need the room till March 7th?",CONFIRM,,
51_00076,USER,That suits me well. Can you give me their phone number? Could you also please tell me how much it will cost me?,REQUEST,,AFFIRM
51_00076,SYSTEM,"Your room has been booked. If you want to call them, you can at +1 602-273-7778. Your booking will cost you $1,520 in total.",INFORM,,NOTIFY_SUCCESS
51_00076,USER,I appreciate it. That would be all.,THANK_YOU,GOODBYE,
51_00076,SYSTEM,Have a wonderful time!,GOODBYE,,
51_00077,USER,I'm trying to rent a car from the 6th of this month until the 12th of this month.,INFORM,,INFORM_INTENT
51_00077,SYSTEM,Would you like a full-size or standard vehicle?,REQUEST,,
51_00077,USER,I'd like something intermediate size.,INFORM,,
51_00077,SYSTEM,Where would you like to pick up the car and what time?,REQUEST,,
51_00077,USER,I'm hoping to pick it up at LAX International Airport at half past 5 in the evening.,INFORM,,
51_00077,SYSTEM,Confirming pick up of a standard vehicle from LAX International Airport on March 6th at 5:30 PM and returning on March 12th.,CONFIRM,,
51_00077,USER,"Okay, great. What kind of car is it?",REQUEST,AFFIRM,
51_00077,SYSTEM,It's a Camry and the reservation is complete.,INFORM,NOTIFY_SUCCESS,
51_00077,USER,Thank you. I also need a hotel please.,THANK_YOU,,
51_00077,SYSTEM,Is that in Los Angeles?,REQUEST,,
51_00077,USER,Yes it is.,AFFIRM,,
51_00077,SYSTEM,"I have 10 options for you. Would you like Ac Hotel By Marriott Beverly Hills, which is rated 4.4?",OFFER,,INFORM_COUNT
51_00077,USER,Could you give me something else?,REQUEST_ALTS,,
51_00077,SYSTEM,"I also have Airtel Plaza Hotel, which has a 3.9 rating.",OFFER,,
51_00077,USER,I like that one. I'd like to reserve 1 room.,INFORM,INFORM_INTENT,SELECT
51_00077,SYSTEM,Are you planning to check in March 6th and check out March 12th?,REQUEST,,
51_00077,USER,The checkout will be on the 13th of this month.,INFORM,AFFIRM,
51_00077,SYSTEM,Confirming a reservation for 1 at the Airtel Plaza Hotel in Los Angeles on March 6th and checking out March 13th.,CONFIRM,,
51_00077,USER,"Great, thank you.",AFFIRM,,
51_00077,SYSTEM,The room has been booked.,NOTIFY_SUCCESS,,
51_00077,USER,Do they take pets there?,REQUEST,,
51_00077,SYSTEM,"Yes, they do.",INFORM,,
51_00077,USER,Thank you for your help.,THANK_YOU,GOODBYE,
51_00077,SYSTEM,It's my pleasure.,GOODBYE,,
51_00078,USER,can you reserve this car for pick up at half past 2 in the afternoon on 12th of March for me?,INFORM,,INFORM_INTENT
51_00078,SYSTEM,What is the date of drop off and the type of car like Standard or compact?,REQUEST,,
51_00078,USER,Find me a small car with the drop off date as March 13th.,INFORM,,
51_00078,SYSTEM,What is the place of pick up?,REQUEST,,
51_00078,USER,The place of pick up is Santa Fe Depot.,INFORM,,
51_00078,SYSTEM,Please confirm: You want me to reserve a compact car for pick up at 2:30 pm on March 12th from Santa Fe Depot. And the drop off date is March 13th.,CONFIRM,,
51_00078,USER,"No, Find me car for pick up in Charles de Gaulle International Airport with drop off date as March 14th.",INFORM,,NEGATE
51_00078,SYSTEM,Please confirm: You want me to reserve a compact car for pick up from Charles de Gaulle International Airport with the drop off date as March 14th.,CONFIRM,,
51_00078,USER,"Yes, That is correct.",AFFIRM,,
51_00078,SYSTEM,I have successfully reserved your car.,NOTIFY_SUCCESS,,
51_00078,USER,can you find me a hotel where pets are allowed?,INFORM,INFORM_INTENT,
51_00078,SYSTEM,Should this hotel be in Paris?,REQUEST,,
51_00078,USER,"Yes, That is correct.",AFFIRM,,
51_00078,SYSTEM,What do think of Ac Hotel By Marriott Paris Porte Maillot with 4.3 ratings?,OFFER,,
51_00078,USER,Can you find me some other hotel?,REQUEST_ALTS,,
51_00078,SYSTEM,What do think of Aparthotel Adagio Access Paris La Villette with 3.4 ratings?,OFFER,,
51_00078,USER,Can you find me some other hotel?,REQUEST_ALTS,,
51_00078,SYSTEM,What do think of Aparthotel Adagio Paris Montmartre with 4.1 ratings?,OFFER,,
51_00078,USER,can you find me the street address and the contact number of the hotel?,REQUEST,,
51_00078,SYSTEM,"The street address is 10 Place Charles Dullin, 75018 and the contact number is +33 1 42 57 14 55.",INFORM,,
51_00078,USER,That sounds perfect to me.,SELECT,,
51_00078,SYSTEM,Would you like me to continue to reserve the hotel?,OFFER_INTENT,,
51_00078,USER,"Yes, Please make the reservation for me.",AFFIRM_INTENT,,
51_00078,SYSTEM,Is your check out date March 14th?,REQUEST,,
51_00078,USER,"Yes, That is correct",AFFIRM,,
51_00078,SYSTEM,Is your check in date March 12th?,REQUEST,,
51_00078,USER,"Yes, that is correct. Please book 2 rooms for me.",INFORM,AFFIRM,
51_00078,SYSTEM,Please confirm: You want me to book 2 room at Aparthotel Adagio Paris montmartre located in Paris and the check-in date is March 12th and the check out date is March 14th.,CONFIRM,,
51_00078,USER,"Yes, That is correct.",AFFIRM,,
51_00078,SYSTEM,I have successfully made your reservation.,NOTIFY_SUCCESS,,
51_00078,USER,That will be all. thank you!,THANK_YOU,GOODBYE,
51_00078,SYSTEM,I am glad I could help. have a nice day!,GOODBYE,,
51_00079,USER,"I'm looking to make reservations for a car I can drive. Ideally, it'd be something i can pick up in Hartsfield. Is there anything available that I could keep from next Tuesday through the 9th of March?",INFORM,,
51_00079,SYSTEM,I will look into it. Any specific type of car you want?,REQUEST,,
51_00079,USER,Just an intermediate car should suit my needs.,INFORM,,
51_00079,SYSTEM,Alright. What time would you like to pick it up?,REQUEST,,
51_00079,USER,Sometime around evening 5 would be good.,INFORM,,
51_00079,SYSTEM,"Okay. Just to make sure I have everything right, You want to pick up a standard vehicle from Hartsfield-Jackson International Airport at 5 pm on March 5th. You will be returning the vehicle on March 9th. Does this sound correct?",CONFIRM,,
51_00079,USER,"Yeah that sounds fine with me. What kind of car is it exactly? Also, how much is it going to run me?",REQUEST,,AFFIRM
51_00079,SYSTEM,It is a Cruze brand. The cost comes out to a total of $136. I was able to reserve it for you successfully.,INFORM,,NOTIFY_SUCCESS
51_00079,USER,"Great, thanks for your assistance. I'm also looking for a hotel in that area. Specifically something around ATL. I would like to book two rooms all together.",THANK_YOU,,
51_00079,SYSTEM,I was able to pull up 10 hotels. One of which is the Ac Hotel by Marriott Atlanta Buckhead at Phipps plaza. It has a solid rating of 4.5.,OFFER,,INFORM_COUNT
51_00079,USER,Do they allow pets at this location?,REQUEST,,
51_00079,SYSTEM,It appears that they have a no pet policy.,INFORM,,
51_00079,USER,Even better. I'll go ahead and make the reservation now please.,INFORM_INTENT,SELECT,
51_00079,SYSTEM,Is March 5th your desired check in date?,REQUEST,,
51_00079,USER,I was actually hoping to check in on March 3rd if possible.,INFORM,,
51_00079,SYSTEM,Okay. Were you looking to check out on March 9th?,REQUEST,,
51_00079,USER,"Actually, I was going for the 10th of this month to check out.",INFORM,,
51_00079,SYSTEM,"Alright, just to make sure everything is correct, I will be booking you 2 rooms at the Ac Hotel by Marriott Atlanta Buckhead at Phipps Plaza. You wish to check in on March 3rd and Check out on March 10th. The hotel is in Atlanta. Does this all sound right?",CONFIRM,,
51_00079,USER,"Yeah, that sounds perfect.",AFFIRM,,
51_00079,SYSTEM,"Okay, great. I was able to book the room for you.",NOTIFY_SUCCESS,,
51_00079,USER,"Great, thanks a lot! That should be everything for now.",THANK_YOU,GOODBYE,
51_00079,SYSTEM,Enjoy your day!,GOODBYE,,
51_00080,USER,I need a rental car.,INFORM_INTENT,,
51_00080,SYSTEM,"What type of car would you like? A Standard or a Compact? Also, where will you pick up?",REQUEST,,
51_00080,USER,I want an intermediate car until the 13th of March. I will be picking it up from Chicago Union Station.,INFORM,,
51_00080,SYSTEM,What date and time will you be picking the rental up?,REQUEST,,
51_00080,USER,March 11th at half past 3 in the afternoon.,INFORM,,
51_00080,SYSTEM,Please confirm the following: You will be picking up a Standard car on March 11th at 3:30 pm at Chicago Union Station. You will drop of on March 13th. Is this information correct?,CONFIRM,,
51_00080,USER,"Yes, sounds good.",AFFIRM,,
51_00080,SYSTEM,I have reserved your car.,NOTIFY_SUCCESS,,
51_00080,USER,What type of car is it? And the price?,REQUEST,,
51_00080,SYSTEM,You will be renting a Fusion for $62 total.,INFORM,,
51_00080,USER,Thanks a lot. Can you help me search for a hotel nearby?,THANK_YOU,,
51_00080,SYSTEM,You mean in Chicago.,REQUEST,,
51_00080,USER,"Yes, that's right.",AFFIRM,,
51_00080,SYSTEM,I found you 10 hotels. How about Ac Hotel By Marriott Chicago Downtown? It has a rating of 4.3.,OFFER,,INFORM_COUNT
51_00080,USER,That would be perfect. Make a reservation.,INFORM_INTENT,SELECT,
51_00080,SYSTEM,Will you be checking out on March 13th?,REQUEST,,
51_00080,USER,"Yes, that works.",AFFIRM,,
51_00080,SYSTEM,Do you want to check in on March 11th?,REQUEST,,
51_00080,USER,I want to check in next Wednesday.,INFORM,,
51_00080,SYSTEM,Please confirm: You want a reservation for 1 room at the Ac Hotel By Marriott Chicago Downtown in Chicago. You will be checking in on March 6th and checking out on March 13th. Is this correct?,CONFIRM,,
51_00080,USER,"Yes, that's right. How much will it cost? Can you give me the phone number?",REQUEST,,AFFIRM
51_00080,SYSTEM,"The hotel will cost $3,108 total. The phone number is +1 312-981-6600.",INFORM,,NOTIFY_SUCCESS
51_00080,USER,Thank you.,THANK_YOU,,
51_00080,SYSTEM,What else can I help you with today?,REQ_MORE,,
51_00080,USER,"Nothing, thank you very much.",NEGATE,THANK_YOU,
51_00080,SYSTEM,You are welcome. Have a good day.,GOODBYE,,
51_00081,USER,I want to reserve a car.,INFORM_INTENT,,
51_00081,SYSTEM,Where will you pick it up?,REQUEST,,
51_00081,USER,At Pacific Central Station.,INFORM,,
51_00081,SYSTEM,How long will you need the car?,REQUEST,,
51_00081,USER,I want to have the spacious car from afternoon 1:15 on Wednesday next week until the 10th of March.,INFORM,,
51_00081,SYSTEM,You want to pick up a full-size car from Pacific Central Station at 1:15 pm on March 6th and use it until March 10th?,CONFIRM,,
