dialogue_id,speaker,turn,act_1,act_2,act_3
51_00047,SYSTEM,"What is the pickup time, drop date and pickup location",REQUEST,,
51_00047,USER,"I will pick it up from Toronto Pearson Airport at 12 o""clock in the afternoon and drop off on 11th of this month",INFORM,,
51_00047,SYSTEM,"what type or you need, Full-size or compact?",REQUEST,,
51_00047,USER,a compact car please,INFORM,,
51_00047,SYSTEM,Please confirm: Booking a compact rental to be picked up from Toronto pearson international Airport on march 5th at 12 pm and drop off on March 11th,CONFIRM,,
51_00047,USER,yes thats good. what the cost and the name of the car,REQUEST,,AFFIRM
51_00047,SYSTEM,"Its booked, its a cooper and costs $180",INFORM,,NOTIFY_SUCCESS
51_00047,USER,"Please find me a hotel there, where pets are allowed",INFORM,INFORM_INTENT,
51_00047,SYSTEM,want in Toronto?,REQUEST,,
51_00047,USER,"yes, thats right",AFFIRM,,
51_00047,SYSTEM,How about Best Western Premier Toronto airport carlingview hotel rated 4.0,OFFER,,
51_00047,USER,what the address and phone number?,REQUEST,,
51_00047,SYSTEM,"The address is 135 Carlingview drive, etobicoke, ontario M9W 5e7, canada. The nunber is +1 416-637-7000",INFORM,,
51_00047,USER,Thats good. make the reservation for 4th of this month,INFORM,INFORM_INTENT,SELECT
51_00047,SYSTEM,and the check out on March 11th?,REQUEST,,
51_00047,USER,ye thats right,AFFIRM,,
51_00047,SYSTEM,"Please confirm: Making a reservation for 1 room at the Best Western Premier Toronto airport carlingview hotel at Toronto, on march 4th and checkout march 11th",CONFIRM,,
51_00047,USER,"yes, whats the price?",REQUEST,AFFIRM,
51_00047,SYSTEM,its done. the total is $2100,INFORM,NOTIFY_SUCCESS,
51_00047,USER,thanks a lot,THANK_YOU,,
51_00047,SYSTEM,any thing else?,REQ_MORE,,
51_00047,USER,"No, thats it",NEGATE,THANK_YOU,
51_00047,SYSTEM,have a good day!,GOODBYE,,
51_00048,USER,"Hi there, could you help me make a car reservation please?",INFORM_INTENT,,
51_00048,SYSTEM,Where and what time will you be picking up the car from?,REQUEST,,
51_00048,USER,I will pick up the car at LAX International Airport at around afternoon 3.,INFORM,,
51_00048,SYSTEM,"Any preference on the type of car you would like, such as a Standard or Compact car?",REQUEST,,
51_00048,USER,"Sure, a compact car is perfect for me!",INFORM,,
51_00048,SYSTEM,When will you be picking up the car?,REQUEST,,
51_00048,USER,I will be using the car from March 10th!,INFORM,,
51_00048,SYSTEM,And till when will you be needing the car?,REQUEST,,
51_00048,USER,Most likely till the 12th of this month.,INFORM,,
51_00048,SYSTEM,"Sure, please confirm your reservation for a Compact Car for pickup from LAX International Airport from March 10th at 3 pm to March 12th.",CONFIRM,,
51_00048,USER,This sounds great to me!,AFFIRM,,
51_00048,SYSTEM,Your reservation has been made.,NOTIFY_SUCCESS,,
51_00048,USER,"Thank you, could you help me search for a hotel there too?",THANK_YOU,,
51_00048,SYSTEM,Would you like a hotel in the Los Angeles area?,REQUEST,,
51_00048,USER,"Yes, this is fine with me.",AFFIRM,,
51_00048,SYSTEM,Would you like Ac Hotel by Marriott Beverly Hills with a 4.4 rating?,OFFER,,
51_00048,USER,Are there any alternatives?,REQUEST_ALTS,,
51_00048,SYSTEM,How about Airtel Plaza Hotel with a 3.9 rating?,OFFER,,
51_00048,USER,"Not really, could you search for something else?",REQUEST_ALTS,,
51_00048,SYSTEM,Would you like Banana Bungalow - Hollywood hostel wit ha 4.1 rating?,OFFER,,
51_00048,USER,"This sounds interesting, may I have their contact number please?",REQUEST,,
51_00048,SYSTEM,"Sure, you can call them up at +1 323-469-2500.",INFORM,,
51_00048,USER,Do you know their street address and whether they allow pets on their premises?,REQUEST,,
51_00048,SYSTEM,"Unfortunately, they do not allow pets, but you can visit them at 5920 Hollywood Boulevard, Hollywood, CA 90028, USA.",INFORM,,
51_00048,USER,"I see, could you make a reservation for 1 rooms please?",INFORM,INFORM_INTENT,SELECT
51_00048,SYSTEM,Will you be staying from March 10th till March 12th?,REQUEST,,
51_00048,USER,"No, could you check me in on 5th of March instead?",INFORM,AFFIRM,
51_00048,SYSTEM,"Sure, please confirm your reservation for 1 room at Banana Bungalow - Hollywood Hostel in Los Angeles from March 5th to March 12th.",CONFIRM,,
51_00048,USER,This sounds perfect! Do you know how much will this cost me?,REQUEST,AFFIRM,
51_00048,SYSTEM,"Your reservation has been made, and this will cost you a total of $952.",INFORM,NOTIFY_SUCCESS,
51_00048,USER,"I see, thank you very much!",THANK_YOU,,
51_00048,SYSTEM,"No worries, do you need further assistance?",REQ_MORE,,
51_00048,USER,"Not really, thanks thought!",NEGATE,THANK_YOU,
51_00048,SYSTEM,"Sure, have an enjoyable trip!",GOODBYE,,
51_00049,USER,yvr airport on march 5th and I need till march 9th,INFORM,,
51_00049,SYSTEM,at what time?,REQUEST,,
51_00049,USER,four in the evening,INFORM,,
51_00049,SYSTEM,full-size or standard?,REQUEST,,
51_00049,USER,compact car please,INFORM,,
51_00049,SYSTEM,confirm yvr international airport on march 5th at 4 pm and march 9th drop off compact,CONFIRM,,
51_00049,USER,yes that works,AFFIRM,,
51_00049,SYSTEM,it has been reserved,NOTIFY_SUCCESS,,
51_00049,USER,what is the total?,REQUEST,,
51_00049,SYSTEM,$112 total,INFORM,,
51_00049,USER,what is the name?,REQUEST,,
51_00049,SYSTEM,Bolt is the name,INFORM,,
51_00049,USER,thanks a lot,THANK_YOU,,
51_00049,SYSTEM,Vancouver hotel now,REQUEST,,
51_00049,USER,yes that is fine,AFFIRM,,
51_00049,SYSTEM,10 hotels at atrium inn vancouver with 3.7 rating,OFFER,,INFORM_COUNT
51_00049,USER,address and pets,REQUEST,,
51_00049,SYSTEM,yes to pets and 2889 east hastings street,INFORM,,
51_00049,USER,anything else now?,REQUEST_ALTS,,
51_00049,SYSTEM,auberge vancouver hotel with 4.1 rate,OFFER,,
51_00049,USER,anything else now?,REQUEST_ALTS,,
51_00049,SYSTEM,best western plus chateau granville hotel & suites & conference ctr. with 4.1 rating,OFFER,,
51_00049,USER,that is good,SELECT,,
51_00049,SYSTEM,wanna reserve the hotel?,OFFER_INTENT,,
51_00049,USER,yes two rooms,AFFIRM_INTENT,INFORM,
51_00049,SYSTEM,check in march 5th,REQUEST,,
51_00049,USER,yes that is fine,AFFIRM,,
51_00049,SYSTEM,march 9th please,REQUEST,,
51_00049,USER,check out the 12th,INFORM,,
51_00049,SYSTEM,best western plus chateau granville hotel & suites & conference ctr. in vancouver check in march 5th and check out march 12th for 2 rooms,CONFIRM,,
51_00049,USER,yes that works,AFFIRM,,
51_00049,SYSTEM,you have made it,NOTIFY_SUCCESS,,
51_00049,USER,tell me address,REQUEST,,
51_00049,SYSTEM,"it is 1100 granville street and is $2,016",INFORM,,
51_00049,USER,thanks a lot,THANK_YOU,GOODBYE,
51_00049,SYSTEM,have a good one,GOODBYE,,
51_00050,USER,I want to reserve a Compact car next Friday at 1:30 pm.,INFORM,,
51_00050,SYSTEM,Where do you want to get your car and how long do you need it for?,REQUEST,,
51_00050,USER,I will get the car at Fresno Yosemite International Airport and I will return it on the 12th of this month.,INFORM,,
51_00050,SYSTEM,You want a Compact car for pickup at Fresno Yosemite International Airport for pickup on March 8th at 1:30 pm and will return it March 12th. Is that correct?,CONFIRM,,
51_00050,USER,That is correct.,AFFIRM,,
51_00050,SYSTEM,Your booking is complete.,NOTIFY_SUCCESS,,
51_00050,USER,Now I need to find a hotel near there.,INFORM_INTENT,,
51_00050,SYSTEM,Do you want to stay in Fresno?,REQUEST,,
51_00050,USER,"Yes, I want a hotel in Fresno.",AFFIRM,,
51_00050,SYSTEM,Doubletree By Hilton Hotel Fresno Convention Center is rated 4.3.,OFFER,,
51_00050,USER,Can you find something else?,REQUEST_ALTS,,
51_00050,SYSTEM,La Quinta Inn By Wyndham Fresno Yosemite is rated 3.7.,OFFER,,
51_00050,USER,What is their location?,REQUEST,,
51_00050,SYSTEM,They are located at 2926 Tulare Street.,INFORM,,
51_00050,USER,What is their contact number?,REQUEST,,
51_00050,SYSTEM,You can contact them at +1 559-442-1110.,INFORM,,
51_00050,USER,That is great. Book me a room there.,INFORM_INTENT,SELECT,
51_00050,SYSTEM,Are you arriving March 8th and leaving March 12th?,REQUEST,,
51_00050,USER,I will arrive next Thursday and depart on the 14th of March.,INFORM,,
51_00050,SYSTEM,You want 1 room at the La Quinta Inn By Wyndham Fresno Yosemite hotel in Fresno from March 7th to March 14th. Is that right?,CONFIRM,,
51_00050,USER,"No, I will arrive on March 6th and depart on March 13th.",INFORM,,NEGATE
51_00050,SYSTEM,You wan to arrive on March 6th and depart on March 13th. Is that right?,CONFIRM,,
51_00050,USER,That is right. Can you tell me the total bill?,REQUEST,AFFIRM,
51_00050,SYSTEM,"Your booking is complete and the total price is $1,050.",INFORM,NOTIFY_SUCCESS,
51_00050,USER,Are pets allowed?,REQUEST,,
51_00050,SYSTEM,Pets are allowed.,INFORM,,
51_00050,USER,Thanks a bunch. That is everything for now.,THANK_YOU,GOODBYE,
51_00050,SYSTEM,Have a great day.,GOODBYE,,
51_00051,USER,I'd like to book a small car to be picked up from Chicago Union Station. I plan to keep it until Monday next week.,INFORM,,
51_00051,SYSTEM,At what time do you need the car?,REQUEST,,
51_00051,USER,I'll be picking the car up around evening 4:30.,INFORM,,
51_00051,SYSTEM,When do you plan on picking it up?,REQUEST,,
51_00051,USER,I will pick it up tomorrow.,INFORM,,
51_00051,SYSTEM,Can you please confirm that you want to pick up the Compact car from Chicago Union Station on March 2nd. The car is supposed to be dropped of on March 4th at 4:30 pm.,CONFIRM,,
51_00051,USER,"Yes, that's correct. What car model is it?",REQUEST,AFFIRM,
51_00051,SYSTEM,I've successfully booked your car. The car is a Forte.,INFORM,NOTIFY_SUCCESS,
51_00051,USER,Can you please tell me the total rental cost.,REQUEST,,
51_00051,SYSTEM,Your rental will cost $52.,INFORM,,
51_00051,USER,Thanks. Let's now search for one pet friendly hotel room in the Chicago area.,THANK_YOU,,
51_00051,SYSTEM,How about the nice Ac Hotel By Marriott Chicago Downtown which is rated at 4.3.,OFFER,,
51_00051,USER,Is there anything else? I'd like to reserve 2 rooms.,INFORM,REQUEST_ALTS,
51_00051,SYSTEM,There are 9 hotels meeting your criteria. How about Ace Hotel Chicago rated at 4.6?,OFFER,,INFORM_COUNT
51_00051,USER,Is there anything else?,REQUEST_ALTS,,
51_00051,SYSTEM,There's also Aloft Chicago Downtown River North rated at 4.5,OFFER,,
51_00051,USER,Can you please tell me its address?,REQUEST,,
51_00051,SYSTEM,"Sure, it's 515 North Clark Street.",INFORM,,
51_00051,USER,Perfect. Lets book the rooms.,INFORM_INTENT,SELECT,
51_00051,SYSTEM,Are you checking in on March 2nd?,REQUEST,,
51_00051,USER,"No, on March 1st.",INFORM,,
51_00051,SYSTEM,Will you be checking out on March 4th?,REQUEST,,
51_00051,USER,I will check in tomorrow and I plan to check out on the 7th.,INFORM,,
51_00051,SYSTEM,"Can you please confirm that you want me to book 2 rooms for you at Aloft Chicago Downtown River North in Chicago, checking in on March 2nd and checking out on March 7th.",CONFIRM,,
51_00051,USER,"Yes, that's correct.",AFFIRM,,
51_00051,SYSTEM,I've successfully booked your room.,NOTIFY_SUCCESS,,
51_00051,USER,Thanks so much!,THANK_YOU,,
51_00051,SYSTEM,Is there anything else I can do for you?,REQ_MORE,,
51_00051,USER,"No, not at the moment. Thanks again.",NEGATE,THANK_YOU,
51_00051,SYSTEM,Have a nice day!,GOODBYE,,
51_00052,USER,I would like to book a car please.,INFORM_INTENT,,
51_00052,SYSTEM,What type for example a standard or compact or something else?,REQUEST,,
51_00052,USER,A medium-sized car.,INFORM,,
51_00052,SYSTEM,What date will you need the car to? Also what date and from where will you be collecting the car?,REQUEST,,
51_00052,USER,I will collect the car at 11:00 at YVR International Airport and will keep it until 12th of March.,INFORM,,
51_00052,SYSTEM,What date will you collect it.,REQUEST,,
51_00052,USER,On the 8th.,INFORM,,
51_00052,SYSTEM,To confirm then you want at standard car from March 8th at 11 am until March 12th collecting form YVR International Airport.,CONFIRM,,
51_00052,USER,"No things have changed, I need a small car from 6th of this month.",INFORM,,NEGATE
51_00052,SYSTEM,To confirm then that is a compact car from March 6th.,CONFIRM,,
51_00052,USER,Yes that is it.,AFFIRM,,
51_00052,SYSTEM,Your booking is confirmed.,NOTIFY_SUCCESS,,
51_00052,USER,what type of car is it?,REQUEST,,
51_00052,SYSTEM,it is a bolt.,INFORM,,
51_00052,USER,What does it cost?,REQUEST,,
51_00052,SYSTEM,It costs $162.,INFORM,,
51_00052,USER,Thanks for your assistance.,THANK_YOU,,
51_00052,SYSTEM,What else can I do for you?,REQ_MORE,,
51_00052,USER,I need a hotel too.,INFORM_INTENT,,
51_00052,SYSTEM,a hotel in Vancouver.,REQUEST,,
51_00052,USER,Yes that is correct.,AFFIRM,,
51_00052,SYSTEM,"There are 10 available, one has 3.7 rating and is called Atrium Inn Vancouver.",OFFER,,INFORM_COUNT
51_00052,USER,That is great. Can I reseve 2 rooms from 6th of this month until the 12th of March.,INFORM,,
51_00052,SYSTEM,To confirm then that is 2 rooms from March 6th to March 12th in Vancouver at the hotel Atrium Inn Vancouver.,CONFIRM,,
51_00052,USER,Yes that suits. Where is the hotel?,REQUEST,AFFIRM,
51_00052,SYSTEM,it is at 2889 East Hastings Street.,INFORM,NOTIFY_SUCCESS,
51_00052,USER,Thank you so much.,THANK_YOU,,
51_00052,SYSTEM,Can I help with anything else?,REQ_MORE,,
51_00052,USER,No thank you.,NEGATE,THANK_YOU,
51_00052,SYSTEM,have a lovely day.,GOODBYE,,
51_00053,USER,I need a rental car.,INFORM_INTENT,,
51_00053,SYSTEM,Where would you be picking it up?,REQUEST,,
51_00053,USER,At 30th Street station.,INFORM,,
51_00053,SYSTEM,From when would you like it?,REQUEST,,
51_00053,USER,From the 9th of this month.,INFORM,,
51_00053,SYSTEM,Till which date? Would you like a full-size car or a compact one?,REQUEST,,
51_00053,USER,An intermediate one would work. I need it till the 14th of this month.,INFORM,,
51_00053,SYSTEM,At what time?,REQUEST,,
51_00053,USER,At around 11:30,INFORM,,
51_00053,SYSTEM,You would like to pick up a standard car at 30th street station on March 9th at 11:30 am till March 14th?,CONFIRM,,
51_00053,USER,"Yes, that would be fine.",AFFIRM,,
51_00053,SYSTEM,I have reserved the car.,NOTIFY_SUCCESS,,
51_00053,USER,I would also need to find a hotel room for one in Philadelphia.,INFORM,,INFORM_INTENT
51_00053,SYSTEM,There is the aka university city that has a rating of 4.6.,OFFER,,
51_00053,USER,What is the address?,REQUEST,,
51_00053,SYSTEM,"It is located at cira centre south, 2929 walnut street.",INFORM,,
51_00053,USER,That would be ideal.,SELECT,,
51_00053,SYSTEM,Would you like to reserve the room?,OFFER_INTENT,,
51_00053,USER,Yes. Go ahead and make the reservation for me.,AFFIRM_INTENT,,
51_00053,SYSTEM,You would like to check out on March 14th?,REQUEST,,
51_00053,USER,"Yes, that could work.",AFFIRM,,
51_00053,SYSTEM,And check in on March 9th?,REQUEST,,
51_00053,USER,I want to check in on the 7th of this month.,INFORM,,
51_00053,SYSTEM,You would like to book 1 room at aka university city in philadelphia from march 7th to March 14th?,CONFIRM,,
51_00053,USER,"Yes, that's good. Can I take a pet with me?",REQUEST,AFFIRM,
51_00053,SYSTEM,I have made the reservations. Pets are not allowed.,INFORM,NOTIFY_SUCCESS,
51_00053,USER,Thanks a lot.,THANK_YOU,,
51_00053,SYSTEM,Is there anything.,REQ_MORE,,
51_00053,USER,No. Thanks a lot.,NEGATE,THANK_YOU,
51_00053,SYSTEM,Enjoy your day.,GOODBYE,,
51_00054,USER,can you reserve this car for me?,INFORM_INTENT,,
51_00054,SYSTEM,What is the date of drop off and the time of pick up?,REQUEST,,
51_00054,USER,I want to pick up the car at 5:30 pm and will return the car on March 9th.,INFORM,,
51_00054,SYSTEM,What is your pick up date and what type of car do you prefer?,REQUEST,,
51_00054,USER,I want to pick up a standard car on Monday next week.,INFORM,,
51_00054,SYSTEM,What is the place of pick up?,REQUEST,,
51_00054,USER,I will be picking up the car in Gatwick International Airport.,INFORM,,
51_00054,SYSTEM,Please confirm: You want me to reserve a standard car for pick up at 5:30 pm on March 4th from Gatwick International Airport. And the date of return is March 9th.,CONFIRM,,
51_00054,USER,"Yes, That is correct.",AFFIRM,,
51_00054,SYSTEM,I have successfully reserved your car.,NOTIFY_SUCCESS,,
51_00054,USER,"Thank you for the help. Can you book me 1 room in a hotel located around London, England?",THANK_YOU,,
51_00054,SYSTEM,What do you think of 45 Park lane with 4.7 ratings?,OFFER,,
51_00054,USER,Can you find me the Contact number of the hotel?,REQUEST,,
51_00054,SYSTEM,The contact number is +44 20 7493 4545.,INFORM,,
51_00054,USER,Can you find me the address of the hotel?,REQUEST,,
51_00054,SYSTEM,The address of the hotel is 45 Park Lane.,INFORM,,
51_00054,USER,That sounds perfect to me.,SELECT,,
51_00054,SYSTEM,Would you like me to continue booking the room in the hotel?,OFFER_INTENT,,
51_00054,USER,"Yes, I would like to Book a room in the hotel.",AFFIRM_INTENT,,
51_00054,SYSTEM,Is your date of check in March 4th?,REQUEST,,
51_00054,USER,My date of check in is Saturday this week.,INFORM,,
51_00054,SYSTEM,Is your date of check out March 9th?,REQUEST,,
51_00054,USER,"Yes, put that date for check out.",AFFIRM,,
51_00054,SYSTEM,Please confirm: You want me to book 1 room at 45 Park Lane located in London and the check-in date is March 2nd and the check out date is March 9th.,CONFIRM,,
51_00054,USER,"Yes, That is correct.",AFFIRM,,
51_00054,SYSTEM,I have successfully booked the room.,NOTIFY_SUCCESS,,
51_00054,USER,Can you find the total price and whether the hotel allows pets?,REQUEST,,
51_00054,SYSTEM,"Yes, They allow pets and the total cost is $1,064.",INFORM,,
51_00054,USER,That will be all. Thank you!,THANK_YOU,GOODBYE,
51_00054,SYSTEM,I am glad I could help. Have a nice day!,GOODBYE,,
51_00055,USER,I need a rental car until the 9th of March.,INFORM,INFORM_INTENT,
51_00055,SYSTEM,What location would you like to pick up the rental car from? Please provide the time you will pick the vehicle up as well.,REQUEST,,
51_00055,USER,I think I'll pick up around the evening 7 from SFO International Airport.,INFORM,,
51_00055,SYSTEM,Okay. Please provide the date for the beginning of the rental.,REQUEST,,
51_00055,USER,I'll be needing it starting the 7th of this month please.,INFORM,,
51_00055,SYSTEM,"Would you prefer a Compact or Full-size? If you do not want either of these, please state the type of car you wish to rent.",REQUEST,,
51_00055,USER,I'll be requiring a medium-sized car for the rental.,INFORM,,
51_00055,SYSTEM,I can process this order but please confirm the details first. On March 7th at 7 pm you want to rent a Standard car from SFO International Airport until March 9th. Is this correct?,CONFIRM,,
51_00055,USER,Yep. That's what I need. Please go ahead and confirm the rental.,AFFIRM,,
51_00055,SYSTEM,I have reserved the rental car for you from March 7th until March 9th.,NOTIFY_SUCCESS,,
51_00055,USER,"What's the model of the car? Also, how much will it cost to rent it?",REQUEST,,
51_00055,SYSTEM,It is an Altima. The total cost of the rental will be $62.,INFORM,,
51_00055,USER,"Thank you! Now that the transportation is set, I'll be needing a place to stay. Please find a hotel for me.",THANK_YOU,,
51_00055,SYSTEM,I'd be glad to. Do you wish to have a hotel in San Francisco?,REQUEST,,
51_00055,USER,That's correct. Find a hotel for me in San Francisco.,AFFIRM,,
51_00055,SYSTEM,I have found 10 hotels. There is a hotel with a rating of 3.5 called the Amsterdam Hostel San Francisco. Is this acceptable?,OFFER,,INFORM_COUNT
51_00055,USER,No thank you. Can you find me something with a better rating?,REQUEST_ALTS,,
51_00055,SYSTEM,The Argonaut hotel has a rating of 4.4 and is a reputable establishment.,OFFER,,
51_00055,USER,I do not want to stay there either. Please provide me with another option.,REQUEST_ALTS,,
51_00055,SYSTEM,Certainly. There is a hotel called Beck'S Motor Lodge with a rating of 4.4.,OFFER,,
51_00055,USER,Are pets allowed at this establishment?,REQUEST,,
51_00055,SYSTEM,It does not allow visitors to have pets. I apologize for the trouble.,INFORM,,
51_00055,USER,What's the street address for that hotel?,REQUEST,,
51_00055,SYSTEM,The address for the hotel is 2222 Market Street.,INFORM,,
51_00055,USER,That will do just fine. Thanks!,SELECT,,
51_00055,SYSTEM,"If you wish, I can make those reservations now.",OFFER_INTENT,,
51_00055,USER,Yeah this hotel will work just fine. I want to book 2 rooms from the 7th until the 9th of March.,AFFIRM_INTENT,INFORM,
51_00055,SYSTEM,Confirm the booking details: 2 rooms for Beck'S Motor Lodge in San Francisco from March 7th until March 9th. Do you wish for me to proceed with this transaction?,CONFIRM,,
51_00055,USER,Please go ahead and make the reservation. Provide me with the hotel's phone number as well.,REQUEST,AFFIRM,
51_00055,SYSTEM,The reservation has been made from March 7th to March 9th at Beck'S Motor Lodge. The phone number for this establishment is +1 415-621-8212.,INFORM,NOTIFY_SUCCESS,
51_00055,USER,We had to go through a few options but we got it done. Thank you for your help. That's all I need for now.,THANK_YOU,GOODBYE,
51_00055,SYSTEM,Anytime. Have a great day!,GOODBYE,,
51_00056,USER,I want to reserve a spacious can from March 2nd.,INFORM,,INFORM_INTENT
51_00056,SYSTEM,What time and day will you need to car until?,REQUEST,,
51_00056,USER,"I would like to pick up around 1 in the afternoon, and I will need it until the 7th of this month.",INFORM,,
51_00056,SYSTEM,Where would you like to pickup?,REQUEST,,
51_00056,USER,I would like a compact car to be picked up in Roissy Airport.,INFORM,,
51_00056,SYSTEM,"Alright, So you are picking up a compact car at 1 pm on march 2nd from Charles de gaulle international airport and you will be dropping off the car on march 7th, does that sound right?",CONFIRM,,
51_00056,USER,"Actually, I'll need it until the 3rd of this month.",INFORM,NEGATE,
51_00056,SYSTEM,"Alright, can you confirm you will be picking up the car at 1 pm and dropping off on march 3rd?",CONFIRM,,
51_00056,USER,"Yep, sounds good.",AFFIRM,,
51_00056,SYSTEM,"Alright, I got that reserved for you.",NOTIFY_SUCCESS,,
51_00056,USER,"I would like to search for pet-friendly hotels in paris, france please.",INFORM,,INFORM_INTENT
51_00056,SYSTEM,This one is rated 4.3 and is call Ac Hotel by Marriott paris porte maillot.,OFFER,,
51_00056,USER,Do you have contact information for them?,REQUEST,,
51_00056,SYSTEM,Their number is +33 1 84 82 49 09.,INFORM,,
51_00056,USER,Perfect. I would like to book one room for check-in on March 2nd and then checkout for the 8th of this month.,INFORM,,
51_00056,SYSTEM,"Alright, You are booking 1 room at Ac hotel by marriott paris porte maillot in paris and you will be checking in on March 2nd and checking out on march 8th.",CONFIRM,,
51_00056,USER,"Yep, that works!",AFFIRM,,
51_00056,SYSTEM,I got that booked for you.,NOTIFY_SUCCESS,,
51_00056,USER,Do you have their street address.,REQUEST,,
51_00056,SYSTEM,"Their address in 6 Rue Gustave Charpentier, 75017.",INFORM,,
51_00056,USER,Thanks!,THANK_YOU,,
51_00056,SYSTEM,Anything else I can help you with right now?,REQ_MORE,,
51_00056,USER,"Nope, thanks!",NEGATE,THANK_YOU,
51_00056,SYSTEM,Have a good one.,GOODBYE,,
51_00057,USER,I need to book a rental car for 3rd of March.,INFORM,INFORM_INTENT,
51_00057,SYSTEM,Which type of car and where will you be collecting it?,REQUEST,,
51_00057,USER,A small car please and I will collect it from Santa Fe Depot.,INFORM,,
51_00057,SYSTEM,What time will you require it?,REQUEST,,
51_00057,USER,Around 17:30 and I will return it on 5th of March.,INFORM,,
51_00057,SYSTEM,To confirm then you want a compact car from 5:30 pm on March 3rd until March 5th and you will be collecting it from Santa Fe Depot.,CONFIRM,,
51_00057,USER,Yes that information is correct. What type of car is it?,REQUEST,AFFIRM,
51_00057,SYSTEM,It is a bolt and I am pleased to inform you your booking is confirmed.,INFORM,NOTIFY_SUCCESS,
51_00057,USER,Can you assist me to search for hotels in San Diego?,INFORM,INFORM_INTENT,
51_00057,SYSTEM,"There are 10 available for you, one is Bahia Resort Hotel which has a 4.3 rating.",OFFER,,INFORM_COUNT
51_00057,USER,What are the other options? I actually need one in London that will allow me to bring my pet along.,INFORM,,REQUEST_ALTS
51_00057,SYSTEM,There is a 4.7 rating hotel called 45 Park Lane.,OFFER,,
51_00057,USER,Any other options?,REQUEST_ALTS,,
51_00057,SYSTEM,Ace Hotel London with a 4.3 rating.,OFFER,,
51_00057,USER,Where is it located?,REQUEST,,
51_00057,SYSTEM,100 Shoreditch High Street.,INFORM,,
51_00057,USER,That is exactly what I require. Can you book it for me for 2 rooms on the 2nd.,INFORM,,INFORM_INTENT
51_00057,SYSTEM,Will you be checking out on March 5th?,REQUEST,,
51_00057,USER,Yes that is correct.,AFFIRM,,
51_00057,SYSTEM,To confirm then you require 2 rooms from March 2nd to March 5th in London at Ace Hotel London.,CONFIRM,,
51_00057,USER,Yes that is the right information.,AFFIRM,,
51_00057,SYSTEM,Your booking has been successful.,NOTIFY_SUCCESS,,
51_00057,USER,Thank you so much.,THANK_YOU,,
51_00057,SYSTEM,Do you need any more assistance?,REQ_MORE,,
51_00057,USER,No thank you.,NEGATE,THANK_YOU,
51_00057,SYSTEM,Have a lovely day.,GOODBYE,,
51_00058,USER,I'd like to reserve this car to pick up at SAN International Airport next Monday.,INFORM,,INFORM_INTENT
51_00058,SYSTEM,Until which date do you want the car?,REQUEST,,
51_00058,USER,I need the car until March 10th.,INFORM,,
51_00058,SYSTEM,"Which type of car are you interested in, compact or full-size. What time do you need it?",REQUEST,,
51_00058,USER,I would like a large car to pick up 12 in the afternoon.,INFORM,,
51_00058,SYSTEM,Please confirm for pick up at SAN International Airport March 4th at 12 pm with a drop-off date of March 10th for a Full-size car.,CONFIRM,,
51_00058,USER,"No, I wish to pick up the vehicle at Charles de Gaulle Airport.",INFORM,NEGATE,
