dialogue_id,speaker,turn,act_1,act_2,act_3
11_00033,SYSTEM,Have a great day!,GOODBYE,,
11_00034,USER,I want to look for events.,INFORM_INTENT,,
11_00034,SYSTEM,"What are you interested in, and what city should I search?",REQUEST,,
11_00034,USER,"I'm looking for Games in Toronto, Ontario.",INFORM,,
11_00034,SYSTEM,"Okay, I've found 10 events. One is Blue Jays Vs Astros at the Rogers Centre.",OFFER,,INFORM_COUNT
11_00034,USER,That sounds good. What are the dates?,INFORM_INTENT,SELECT,
11_00034,SYSTEM,"There is a game next Monday, Blue Jays Vs Astros at the Rogers Centre.",OFFER,,
11_00034,USER,What time does it start?,REQUEST,,
11_00034,SYSTEM,It starts at 7:30 pm.,INFORM,,
11_00034,USER,"Perfect, I'd like to buy tickets.",INFORM_INTENT,SELECT,
11_00034,SYSTEM,How many tickets would you like?,REQUEST,,
11_00034,USER,Just 1 please.,INFORM,,
11_00034,SYSTEM,Please verify that you want 1 ticket for the Blue Jays Vs Astros next Monday in Toronto.,CONFIRM,,
11_00034,USER,Perfect. Where is that venue?,REQUEST,AFFIRM,
11_00034,SYSTEM,I've made the reservation. The address is 1 Blue Jays Way.,INFORM,NOTIFY_SUCCESS,
11_00034,USER,Thanks so much.,THANK_YOU,,
11_00034,SYSTEM,Is there anything else I can do for you today?,REQ_MORE,,
11_00034,USER,"No, thanks for you help.",NEGATE,THANK_YOU,
11_00034,SYSTEM,Have a wonderful day.,GOODBYE,,
11_00035,USER,I am looking for sports events in Oakland.,INFORM,,INFORM_INTENT
11_00035,SYSTEM,There is an event at Oakland-Alameda County Coliseum. The even is the Raiders Vs Bengals.,OFFER,,
11_00035,USER,Can you find some football events?,INFORM,REQUEST_ALTS,
11_00035,SYSTEM,There is an event at Oakland-Alameda County Coliseum. It is the Raiders Vs Chiefs.,OFFER,,
11_00035,USER,When does it start and where is the venue located?,REQUEST,,
11_00035,SYSTEM,It starts at 6 pm and the venue is located at 7000 Coliseum Way.,INFORM,,
11_00035,USER,Sounds great to me.,SELECT,,
11_00035,SYSTEM,Would you like to buy tickets for the event?,OFFER_INTENT,,
11_00035,USER,Not now. I am interested in finding other events.,INFORM_INTENT,NEGATE_INTENT,
11_00035,SYSTEM,There is an event tomorrow. It is the Raiders Vs Chiefs at Oakland-Alameda County Coliseum.,OFFER,,
11_00035,USER,"Yes, that sounds great.",SELECT,,
11_00035,SYSTEM,Anything else I can help you with?,REQ_MORE,,
11_00035,USER,I want to buy 2 tickets for an event.,INFORM,INFORM_INTENT,
11_00035,SYSTEM,Please confirm: 2 tickets to the Raiders Vs Chiefs tomorrow in Oakland.,CONFIRM,,
11_00035,USER,"No, I would like three tickets.",INFORM,NEGATE,
11_00035,SYSTEM,Please confirm: 3 tickets for the event in Oakland.,CONFIRM,,
11_00035,USER,"Yes, that sounds good.",AFFIRM,,
11_00035,SYSTEM,Your reservation was successfully made.,NOTIFY_SUCCESS,,
11_00035,USER,"Thank you, that is all.",THANK_YOU,GOODBYE,
11_00035,SYSTEM,Have a good day.,GOODBYE,,
11_00036,USER,I want to search for events in Philadelphia. I'd like to go to a concert.,INFORM,,INFORM_INTENT
11_00036,SYSTEM,I found 10 events that I think you'd like. One is Blueface and it's at The Fillmore Philadelphia.,OFFER,,INFORM_COUNT
11_00036,USER,That sounds fun. What are the date for the event?,INFORM_INTENT,SELECT,
11_00036,SYSTEM,"I found that event on 7 days. Blueface is on today, at The Fillmore Philadelphia.",OFFER,,
11_00036,USER,What time does it start and where is that located?,REQUEST,,
11_00036,SYSTEM,It starts at 5 pm. The venue is at 29 East Allen Street.,INFORM,,
11_00036,USER,That sounds great.,SELECT,,
11_00036,SYSTEM,Should I get you tickets for the event?,OFFER_INTENT,,
11_00036,USER,"Yes, I would like to go.",AFFIRM_INTENT,,
11_00036,SYSTEM,How many tickets would you like?,REQUEST,,
11_00036,USER,Just one ticket.,INFORM,,
11_00036,SYSTEM,"Please confirm that you want 1 ticket for Blueface today, in Philadelphia.",CONFIRM,,
11_00036,USER,"Yes, that's perfect.",AFFIRM,,
11_00036,SYSTEM,Your reservation is complete.,NOTIFY_SUCCESS,,
11_00036,USER,Thank you for finding something!,THANK_YOU,,
11_00036,SYSTEM,Is there anything else I can help with?,REQ_MORE,,
11_00036,USER,No thank you.,NEGATE,THANK_YOU,
11_00036,SYSTEM,Have a good day.,GOODBYE,,
11_00037,USER,I need to look for events.,INFORM_INTENT,,
11_00037,SYSTEM,What type of events would you like to search for? These can be sports or music or more. Please list the cities.,REQUEST,,
11_00037,USER,"I am looking for sports events in Phoenix, AZ.",INFORM,,
11_00037,SYSTEM,There are 10 sports events. This event is Arizona Vs LA Dodgers at Chase Field.,OFFER,,INFORM_COUNT
11_00037,USER,I would like to look for baseball events.,INFORM,REQUEST_ALTS,
11_00037,SYSTEM,How about Arizona vs Milwaukee at Chase Field?,OFFER,,
11_00037,USER,Perfect,SELECT,,
11_00037,SYSTEM,Would you like to buy tickets?,OFFER_INTENT,,
11_00037,USER,No thank you.,NEGATE_INTENT,,
11_00037,SYSTEM,Is there anything else I can help you with?,REQ_MORE,,
11_00037,USER,I need more event dates.,INFORM_INTENT,,
11_00037,SYSTEM,Arizona vs Milwaukee at Chase Field is next Monday.,OFFER,,
11_00037,USER,What about on other days?,REQUEST_ALTS,,
11_00037,SYSTEM,I couldn't find anymore dates. Is there anything else I can help you with?,NOTIFY_FAILURE,REQ_MORE,
11_00037,USER,"No, thank you so much.",NEGATE,THANK_YOU,
11_00037,SYSTEM,Have a wonderful day.,GOODBYE,,
11_00038,USER,Going to be in Los Angeles for vacation. I'm looking for something to do while I'm there.,INFORM,INFORM_INTENT,
11_00038,SYSTEM,What are you looking to do?,REQUEST,,
11_00038,USER,A Match of some sort would be good.,INFORM,,
11_00038,SYSTEM,How about Dodgers Vs Cubs at Dodger Stadium?,OFFER,,
11_00038,USER,Sounds great! I need dates so I can plan my trip.,INFORM_INTENT,SELECT,
11_00038,SYSTEM,Dodgers Vs Cubs is at Dodger Stadium today. You're in luck!,OFFER,,
11_00038,USER,Darn it...what about another event on a different day?,REQUEST_ALTS,,
11_00038,SYSTEM,We also have Dodgers Vs Cubs at Dodger Stadium on March 9th.,OFFER,,
11_00038,USER,Great! I need tickets!,INFORM_INTENT,SELECT,
11_00038,SYSTEM,How many tickets are you interested in?,REQUEST,,
11_00038,USER,Four tickets should do it.,INFORM,,
11_00038,SYSTEM,Please confirm: 4 tickets for Dodgers Vs Cubs on March 9th in Los Angeles.,CONFIRM,,
11_00038,USER,No. Only want 1 ticket instead.,INFORM,NEGATE,
11_00038,SYSTEM,Please confirm: 1 ticket for Los Angeles event.,CONFIRM,,
11_00038,USER,"Yes, that will work.",AFFIRM,,
11_00038,SYSTEM,Your reservation is complete.,NOTIFY_SUCCESS,,
11_00038,USER,Thank you so much!,THANK_YOU,,
11_00038,SYSTEM,Is there anything else I can help you with?,REQ_MORE,,
11_00038,USER,No thank you. I appreciate your help.,NEGATE,THANK_YOU,
11_00038,SYSTEM,You are welcome. Have a great day!,GOODBYE,,
11_00039,USER,I would like to search for events.,INFORM_INTENT,,
11_00039,SYSTEM,Which city do you prefer and what type of event?,REQUEST,,
11_00039,USER,I would like a concert in Portland.,INFORM,,
11_00039,SYSTEM,There is a Bryan Adams concert at the Theater of the Clouds.,OFFER,,
11_00039,USER,Is there anything on the 4th of this month in LA?,INFORM,,REQUEST_ALTS
11_00039,SYSTEM,There are 5 events. There is Gloryhammer at 1720(tm).,OFFER,,INFORM_COUNT
11_00039,USER,When does it start and what is the category?,REQUEST,,
11_00039,SYSTEM,The event starts at 7:30 pm and it is a rock event.,INFORM,,
11_00039,USER,That sounds great.,SELECT,,
11_00039,SYSTEM,Would you like me to buy tickets?,OFFER_INTENT,,
11_00039,USER,"No, not yet. Are there other dates?",INFORM_INTENT,NEGATE_INTENT,
11_00039,SYSTEM,The is an event on 1 other day next Monday at 1720(tm) for Gloryhammer.,OFFER,,
11_00039,USER,"Good, I want to buy three tickets.",INFORM,INFORM_INTENT,SELECT
11_00039,SYSTEM,Confirming 3 tickets to see Gloryhammer next Monday in Los Angeles.,CONFIRM,,
11_00039,USER,"Good, where is the venue?",REQUEST,AFFIRM,
11_00039,SYSTEM,The reservation is completed. The event is located at 1720 East 16th Street.,INFORM,NOTIFY_SUCCESS,
11_00039,USER,Thanks you for your help.,THANK_YOU,,
11_00039,SYSTEM,Is there anything else I can do for you?,REQ_MORE,,
11_00039,USER,"No, thank you.",NEGATE,THANK_YOU,
11_00039,SYSTEM,Have a nice day.,GOODBYE,,
11_00040,USER,I'm looking for Music events.,INFORM,INFORM_INTENT,
11_00040,SYSTEM,In which city?,REQUEST,,
11_00040,USER,Blues events in Portland.,INFORM,,
11_00040,SYSTEM,I found 2 events. One is Damien Jurado at The Old Church Concert Hall.,OFFER,,INFORM_COUNT
11_00040,USER,Where's the venue and what's the time?,REQUEST,,
11_00040,SYSTEM,It's 1422 Southwest 11th Avenue at 5 pm.,INFORM,,
11_00040,USER,Any other events?,REQUEST_ALTS,,
11_00040,SYSTEM,There's Hozier at Theater Of The Clouds.,OFFER,,
11_00040,USER,"Sounds good, I'm looking at dates for events.",INFORM_INTENT,SELECT,
11_00040,SYSTEM,The event is next Monday for Hozier at Theater Of The Clouds.,OFFER,,
11_00040,USER,When does it start?,REQUEST,,
11_00040,SYSTEM,At 5 pm.,INFORM,,
11_00040,USER,Sounds good.,SELECT,,
11_00040,SYSTEM,Do you want to buy tickets?,OFFER_INTENT,,
11_00040,USER,"Yes, 1 ticket.",AFFIRM_INTENT,INFORM,
11_00040,SYSTEM,Please confirm: 1 ticket to Hozier next Monday in Portland.,CONFIRM,,
11_00040,USER,"Yes, that's great.",AFFIRM,,
11_00040,SYSTEM,Your ticket is reserved.,NOTIFY_SUCCESS,,
11_00040,USER,"Thanks, that's all.",THANK_YOU,GOODBYE,
11_00040,SYSTEM,Have a great day.,GOODBYE,,
11_00041,USER,I want to search for some events in SD. I am interested in Music.,INFORM,,INFORM_INTENT
11_00041,SYSTEM,There is an event in Alejandro Sanz and it's location is Cal Coast Credit Union Amphitheater.,OFFER,,
11_00041,USER,Sounds good. I would like to know the dates for events.,INFORM_INTENT,SELECT,
11_00041,SYSTEM,The event Alejandro Sanz is on next Monday. It's at Cal Coast Credit Union Amphitheater.,OFFER,,
11_00041,USER,Can you give me some events on more dates?,REQUEST_ALTS,,
11_00041,SYSTEM,The event Alejandro Sanz is next Friday. It is located at Cal Coast Credit Union Amphitheater.,OFFER,,
11_00041,USER,Where is the venue and when does the event begin?,REQUEST,,
11_00041,SYSTEM,The venue is at the location of 5500 Campanile Drive and begins at 5 pm.,INFORM,,
11_00041,USER,Sounds great to me.,SELECT,,
11_00041,SYSTEM,Would you like to purchase tickets to this event?,OFFER_INTENT,,
11_00041,USER,"Yes, I would like to purchase 4 event tickets.",AFFIRM_INTENT,INFORM,
11_00041,SYSTEM,Please verify the following information: The event Alejandro Sanz is in San Diego next Friday and with 4 tickets.,CONFIRM,,
11_00041,USER,"No, that's not right. I only want 1 ticket.",INFORM,NEGATE,
11_00041,SYSTEM,Please confirm: The event is in San Diego with 1 ticket.,CONFIRM,,
11_00041,USER,"Yep, that's what I need. When does the event begin? Where is the location of the venue?",REQUEST,,AFFIRM
11_00041,SYSTEM,The venue location is 5500 Campanile Drive and begins at 5 pm. Your reservation has been booked.,INFORM,,NOTIFY_SUCCESS
11_00041,USER,Thank you so much for your help.,THANK_YOU,,
11_00041,SYSTEM,Can I be of service to you for anything else?,REQ_MORE,,
11_00041,USER,"Naw, and thanks for helping.",NEGATE,THANK_YOU,
11_00041,SYSTEM,Have a wonderful day.,GOODBYE,,
11_00042,USER,I want to search for events happening in NYC.,INFORM,INFORM_INTENT,
11_00042,SYSTEM,"Do have have any preference on types of events, such as music or sports?",REQUEST,,
11_00042,USER,I would like to look for music events.,INFORM,,
11_00042,SYSTEM,I found an event at Warsaw. The event is Amber Run Brooklyn.,OFFER,,
11_00042,USER,That sounds great!,SELECT,,
11_00042,SYSTEM,Is there anything else you need help with?,REQ_MORE,,
11_00042,USER,I would like to look for dates for events.,INFORM_INTENT,,
11_00042,SYSTEM,The Amber Run Brooklyn event is taking place tomorrow at Warsaw.,OFFER,,
11_00042,USER,This sounds good to me.,SELECT,,
11_00042,SYSTEM,Would you like to purchase tickets for this event?,OFFER_INTENT,,
11_00042,USER,"Yes, I would like to purchase two tickets.",AFFIRM_INTENT,INFORM,
11_00042,SYSTEM,Please confirm the following: 2 tickets for Amber Run Brooklyn event taking place tomorrow in New York.,CONFIRM,,
11_00042,USER,"Actually, I want 3 tickets.",INFORM,NEGATE,
11_00042,SYSTEM,Please confirm the following: 3 tickets for the event taking place tomorrow in New York.,CONFIRM,,
11_00042,USER,"Yes, this works. Can you tell me where the venue is located?",REQUEST,AFFIRM,
11_00042,SYSTEM,"Your reservation has been made. The venue is located at 261 Driggs Avenue, Brooklyn.",INFORM,NOTIFY_SUCCESS,
11_00042,USER,Thank you very much for your help.,THANK_YOU,,
11_00042,SYSTEM,Is there anything else you need help with?,REQ_MORE,,
11_00042,USER,"No, thanks though.",NEGATE,THANK_YOU,
11_00042,SYSTEM,Have a great day.,GOODBYE,,
11_00043,USER,Is there an event on the 12th?,INFORM,INFORM_INTENT,
11_00043,SYSTEM,"Any preference on city or type of event, such as a music or sports event?",REQUEST,,
11_00043,USER,I'm looking for a music event in Philadelphia,INFORM,,
11_00043,SYSTEM,There is Blueface at The Fillmore Philadelphia,OFFER,,
11_00043,USER,That sounds interesting. What are the dates?,INFORM_INTENT,SELECT,
11_00043,SYSTEM,Blueface is on March 12th at The Fillmore Philadelphia,OFFER,,
11_00043,USER,When does it start?,REQUEST,,
11_00043,SYSTEM,It starts at 6 pm,INFORM,,
11_00043,USER,That works,SELECT,,
11_00043,SYSTEM,Do you want me to buy tickets for this?,OFFER_INTENT,,
11_00043,USER,"Sure, I want two tickets",AFFIRM_INTENT,INFORM,
11_00043,SYSTEM,I'll book 2 tickets for Blueface on March 12th in Philadelphia. Is this correct?,CONFIRM,,
11_00043,USER,"No, I just want one ticket",INFORM,NEGATE,
11_00043,SYSTEM,"Ok, so 1 ticket for the event in Philadelphia",CONFIRM,,
11_00043,USER,Yup,AFFIRM,,
11_00043,SYSTEM,Your reservations has been made,NOTIFY_SUCCESS,,
11_00043,USER,"Thanks, that's all",THANK_YOU,GOODBYE,
11_00043,SYSTEM,Have a good one!,GOODBYE,,
11_00044,USER,"Hello, I have some friends visiting and am wondering if there are any interesting events to take them to.",INFORM_INTENT,,
11_00044,SYSTEM,"Alright, which city are you in. And is there any certain type of event that you are interested in?",REQUEST,,
11_00044,USER,"Oh yes, I am looking for events in San Francisco. A concert would probably be good, but I'm not set on that for sure.",INFORM,,
11_00044,SYSTEM,Allan Rayman will be playing at August Hall on March 9th at 6 pm.,OFFER,,
11_00044,USER,"Ok, that sounds like it will work. That's all I need right now.",SELECT,GOODBYE,
11_00044,SYSTEM,It has been a pleasure helping you. Please have a great day.,GOODBYE,,
11_00045,USER,Can you help me look for events to go to?,INFORM_INTENT,,
11_00045,SYSTEM,"Alright, is there any specific type of event like Music or Sports? Is there a location you are wanting?",REQUEST,,
11_00045,USER,"Okay, How about a Games event, like American Football near Oakland.",INFORM,,
11_00045,SYSTEM,I found 5 events like that. One is the Raiders Vs Bengals at the Oakland-Alameda County Coliseum. This event is next Thursday at 8 pm.,OFFER,,
11_00045,USER,"That sounds interesting, what's the address?",REQUEST,,
11_00045,SYSTEM,The address of the venue is 7000 Coliseum Way.,INFORM,,
11_00045,USER,Sounds perfect.,SELECT,,
11_00045,SYSTEM,Do you want me to go ahead and purchase tickets for this event?,OFFER_INTENT,,
11_00045,USER,"No, I'm good thank you.",NEGATE_INTENT,GOODBYE,
11_00045,SYSTEM,Have a great day!,GOODBYE,,
11_00046,USER,Could you assist me in searching for interesting activities?,INFORM_INTENT,,
11_00046,SYSTEM,Is there a type of activity you prefer? Is there any specific metropolis I ought to look in?,REQUEST,,
11_00046,USER,I'm searching for activities near Oakland. I enjoy Games activities.,INFORM,,
11_00046,SYSTEM,"I discovered 5 activities you may enjoy. The activity is Raiders Vs Bengals, which starts at 8 pm next Thursday at Oakland-Alameda County Coliseum.",OFFER,,
11_00046,USER,That's perfect for me.,SELECT,,
11_00046,SYSTEM,Would you like to purchase tickets for the event?,OFFER_INTENT,,
11_00046,USER,"No, maybe later. That's all.",NEGATE_INTENT,GOODBYE,
11_00046,SYSTEM,Have a pleasant afternoon.,GOODBYE,,
11_00047,USER,Could you find me some cool events?,INFORM_INTENT,,
11_00047,SYSTEM,What city would you like for me to look in?,REQUEST,,
11_00047,USER,NY.,INFORM,,
11_00047,SYSTEM,"What category of event should I look for? For example, Music or Sports.",REQUEST,,
11_00047,USER,I like Concert events.,INFORM,,
11_00047,SYSTEM,I found 10 events. The Amber Run Brooklyn in Warsaw is taking place on March 14th at 6 pm.,OFFER,,
11_00047,USER,What's the address of the event.,REQUEST,,
11_00047,SYSTEM,"261 Driggs Avenue, Brooklyn.",INFORM,,
11_00047,USER,I'd like to know more about the event.,REQUEST,,
11_00047,SYSTEM,It's called a Pop event.,INFORM,,
11_00047,USER,That sounds cool. Thanks for this.,SELECT,GOODBYE,
11_00047,SYSTEM,Have a nice day.,GOODBYE,,
11_00048,USER,"Hello, can you help me find some interesting events?",INFORM_INTENT,,
11_00048,SYSTEM,Hello! Is there any city in which you are particularly interested?,REQUEST,,
11_00048,USER,"Yes, I would like to know if there are events around Berkeley, I am particularly interested in Concert events. Thank you.",INFORM,,
11_00048,SYSTEM,"There is the Berkeley World Music Festival on March 11th, starting at 6:30 pm. The adress is 2500 Durant Ave.",OFFER,,
11_00048,USER,"Excuse me, what is the address of the event?",REQUEST,,
11_00048,SYSTEM,The address is 2500 Durant Avenue.,INFORM,,
11_00048,USER,Thank you very much. Can you give me more details about this event?,REQUEST,,
11_00048,SYSTEM,"Of course. The Berkeley World Music Festival is an International event, with artist from all around the world.",INFORM,,
11_00048,USER,"Wow, that's great!",SELECT,,
11_00048,SYSTEM,Are you interested in purchasing tickets for this event?,OFFER_INTENT,,
11_00048,USER,"No, not at the moment.",NEGATE_INTENT,,
11_00048,SYSTEM,Do you need any more help today?,REQ_MORE,,
11_00048,USER,"No. Thank you, you were very helpful.",NEGATE,THANK_YOU,
11_00048,SYSTEM,Have a good day.,GOODBYE,,
11_00049,USER,I am looking for some events to go to on Wednesday next week. I want to have fun!,INFORM,INFORM_INTENT,
11_00049,SYSTEM,Where do you want to have fun?,REQUEST,,
11_00049,USER,Somewhere in the Napa area.,INFORM,,
11_00049,SYSTEM,What kind of event? Maybe music or sports?,REQUEST,,
11_00049,USER,I think a concert would be cool.,INFORM,,
11_00049,SYSTEM,I found 1 event next Wednesday at 8:30 pm with Mandy Harvey at Blue Note Napa.,OFFER,,
11_00049,USER,That sounds awesome,SELECT,,
11_00049,SYSTEM,Do you want me to get you tickets then?,OFFER_INTENT,,
11_00049,USER,"No not now, that's all I needed at the moment.",NEGATE_INTENT,GOODBYE,
11_00049,SYSTEM,"OK, just let me know, have a good day",GOODBYE,,
11_00050,USER,I would like enjoy some games.Are there any such event?,INFORM,INFORM_INTENT,
11_00050,SYSTEM,Do you prefer any city?,REQUEST,,
11_00050,USER,"Yes, I prefer one in Seattle.",INFORM,,
11_00050,SYSTEM,"There are 10 of such events. One at Husky Stadium, Huskies vs Cougars, at 8 pm on next Tuesday.",OFFER,,
11_00050,USER,Shall I get details?,REQUEST,,
11_00050,SYSTEM,"Yes, it is a basketball game.",INFORM,,
11_00050,USER,Let me know about the venue.,REQUEST,,
11_00050,SYSTEM,It is taking place at 3800 Montlake Boulevard Northeast.,INFORM,,
11_00050,USER,"Good, I think that will do.",SELECT,,
11_00050,SYSTEM,Shall i get tickets for you?,OFFER_INTENT,,
11_00050,USER,"No. Not needed, thank you.",NEGATE_INTENT,GOODBYE,
11_00050,SYSTEM,have a great day.Thank you.,GOODBYE,,
11_00051,USER,Can you help me find interesting events on the 13th of this month?,INFORM,INFORM_INTENT,
11_00051,SYSTEM,Any specific city?,REQUEST,,
11_00051,USER,"Anaheim, CA.",INFORM,,
11_00051,SYSTEM,Do you have preference for the type of event?,REQUEST,,
11_00051,USER,I like Match events?,INFORM,,
11_00051,SYSTEM,The event is Angels Vs Red Sox. It's at Angel Stadium of Anaheim on March 13th at 8 pm.,OFFER,,
11_00051,USER,"What's the venue address, and can you tell me more about this event?",REQUEST,,
11_00051,SYSTEM,It's a baseball event at 2000 East Gene Autry Way.,INFORM,,
11_00051,USER,"That sounds good, and that's all I need.",SELECT,GOODBYE,
11_00051,SYSTEM,Have a good day.,GOODBYE,,
11_00052,USER,I want to find some cool events.,INFORM_INTENT,,
11_00052,SYSTEM,What city would you like to find events in?,REQUEST,,
11_00052,USER,I want to find events in Livermore.,INFORM,,
11_00052,SYSTEM,Do you want to find music or sports events?,REQUEST,,
11_00052,USER,I want to find a concert.,INFORM,,
11_00052,SYSTEM,What about Josh Groban at Concerts at Wente Vineyards tomorrow at 7 pm?,OFFER,,
11_00052,USER,"Yes, that's great.",SELECT,,
11_00052,SYSTEM,Do you want to purchase tickets?,OFFER_INTENT,,
11_00052,USER,"No, now right now.",NEGATE_INTENT,GOODBYE,
11_00052,SYSTEM,Have a good day.,GOODBYE,,
11_00053,USER,I'm looking to go to a football match,INFORM,,INFORM_INTENT
11_00053,SYSTEM,Ok. What city?,REQUEST,,
11_00053,USER,"Look in Seattle, WA",INFORM,,
11_00053,SYSTEM,How about Sounders Vs Red Bulls tomorrow at 6 pm at CenturyLink Field?,OFFER,,
11_00053,USER,That sounds really fun,SELECT,,
11_00053,SYSTEM,Great. Would you like to reserve seats?,OFFER_INTENT,,
11_00053,USER,No not now. Thanks for finding that.,NEGATE_INTENT,GOODBYE,
11_00053,SYSTEM,Have a wonderful day,GOODBYE,,
11_00054,USER,Can you help me find an event?,INFORM_INTENT,,
11_00054,SYSTEM,"Which city would you like to search in, and what kind of event?",REQUEST,,
11_00054,USER,"I'd like a games related event around Phoenix, please.",INFORM,,
11_00054,SYSTEM,"I have 10 events for you. One is Arizona Vs La Dodgers, which is taking place today at 6 pm at Chase Field.",OFFER,,
11_00054,USER,"What's the address, and what kind of event is it?",REQUEST,,
11_00054,SYSTEM,"The address is 401 East Jefferson Street, and it is a baseball game.",INFORM,,
11_00054,USER,Sounds good.,SELECT,,
11_00054,SYSTEM,Would you like to reserve some tickets?,OFFER_INTENT,,
11_00054,USER,Not at the moment.,NEGATE_INTENT,,
11_00054,SYSTEM,Is there anything else I can help you with?,REQ_MORE,,
11_00054,USER,"No, thank you.",NEGATE,THANK_YOU,
11_00054,SYSTEM,Have a nice day.,GOODBYE,,
11_00055,USER,I want to find interesting events around New York City.,INFORM,INFORM_INTENT,
11_00055,SYSTEM,"Do you want events in any specific category like music, sports, or something else?",REQUEST,,
11_00055,USER,I like concert events.,INFORM,,
11_00055,SYSTEM,I found 10 events. One event is called Amber Run Brooklyn at Warsaw on March 14th at 6 pm.,OFFER,,
11_00055,USER,"Those sound good, but I want something on the 6th of march, and I also like match events.",INFORM,,REQUEST_ALTS
11_00055,SYSTEM,I found 8 events. One event is Mets Vs Padres at Citi Field next Wednesday at 6 pm.,OFFER,,
11_00055,USER,That sounds good.,SELECT,,
11_00055,SYSTEM,Do you want tickets for this event?,OFFER_INTENT,,
11_00055,USER,"Nope, that's all I need.",NEGATE_INTENT,GOODBYE,
11_00055,SYSTEM,Have a good day.,GOODBYE,,
11_00056,USER,I would like to find some interesting music events. I really like hip hop. Can you help me?,INFORM,,INFORM_INTENT
11_00056,SYSTEM,What location would you prefer?,REQUEST,,
11_00056,USER,I'd like to find something around SD.,INFORM,,
11_00056,SYSTEM,There are 2 events you may like. It is on March 14th at 7:30 pm at the Cal Coast Credit Union Amphitheater. The event taking place is Jon Bellion.,OFFER,,
11_00056,USER,That sounds amazing.,SELECT,,
11_00056,SYSTEM,Is there anything else I can help you with?,REQ_MORE,,
11_00056,USER,"No, thank you for your help.",NEGATE,THANK_YOU,
11_00056,SYSTEM,Have a wonderful day!,GOODBYE,,
11_00057,USER,"Find interesting events happening around Seattle, WA please.",INFORM,INFORM_INTENT,
11_00057,SYSTEM,"Sure, Any preference on what type of events?",REQUEST,,
11_00057,USER,Find sports events please.,INFORM,,
11_00057,SYSTEM,"OK, I've found 10 events which you may be interested in. May I suggest the Huskies Vs Cougars next Tuesday night at 8 pm, at Husky Stadium.",OFFER,,
11_00057,USER,That sounds really good.,SELECT,,
11_00057,SYSTEM,"Great, glad I could help. Should I purchase tickets now?",OFFER_INTENT,,
11_00057,USER,"No, not right now.",NEGATE_INTENT,,
11_00057,SYSTEM,"Oh, Ok. Well is there anything else I could help with?",REQ_MORE,,
11_00057,USER,Nope. That's it.,NEGATE,THANK_YOU,
11_00057,SYSTEM,"Alright, Have a wonderful day.",GOODBYE,,
11_00058,USER,I am looking for some interesting events?,INFORM_INTENT,,
11_00058,SYSTEM,What is your preferred category like Music or sports or anything else?,REQUEST,,
11_00058,USER,Search for some Music events.,INFORM,,
11_00058,SYSTEM,Which city you want me to search in?,REQUEST,,
11_00058,USER,Search the event around Portland.,INFORM,,
11_00058,SYSTEM,There is an event named as Bryan Adams at Theater Of The Clouds tomorrow at 8:30 pm.,OFFER,,
11_00058,USER,Find me some more information about the event?,REQUEST,,
11_00058,SYSTEM,The event is a Pop event.,INFORM,,
11_00058,USER,Okay. That sounds good to me. That will be all.,SELECT,GOODBYE,
11_00058,SYSTEM,I am glad I could help. Have nice day.,GOODBYE,,
11_00059,USER,I'm looking for some events to go to.,INFORM_INTENT,,
11_00059,SYSTEM,In which city? Do you prefer an event category?,REQUEST,,
11_00059,USER,"I like music, something around Philly.",INFORM,,
11_00059,SYSTEM,There's Blueface at The Fillmore Philadelphia on March 13th at 6 pm.,OFFER,,
11_00059,USER,"They're good, but I like hip hop. Anything on the 2nd?",INFORM,,REQUEST_ALTS
11_00059,SYSTEM,I found 1 event. There's Nav with Killy at The Fillmore Philadelphia tomorrow at 6 pm.,OFFER,,
11_00059,USER,"Great, that's all for now.",SELECT,GOODBYE,
11_00059,SYSTEM,Have a nice day.,GOODBYE,,
11_00060,USER,"Hi i need a help, i am Interested in events, Could you find some events for me?",INFORM_INTENT,,
