dialogue_id,speaker,turn,act_1,act_2,act_3
29_00040,USER,No thank you.,NEGATE,THANK_YOU,
29_00040,SYSTEM,"Ok, have a nice day. Thanks.",GOODBYE,,
29_00041,USER,Could you find me a local dentistry nearby?,INFORM_INTENT,,
29_00041,SYSTEM,What city would you like me to search for one in?,REQUEST,,
29_00041,USER,I am looking for one in Fairfield.,INFORM,,
29_00041,SYSTEM,Would Dr. Pascuala Geraldine T. Ocampo located in Fairfield be okay?,OFFER,,
29_00041,USER,What is their address?,REQUEST,,
29_00041,SYSTEM,Their location is 2401 Waterman Boulevard.,INFORM,,
29_00041,USER,Does the dentist do any cosmetic procedures? Can I have their contact number?,REQUEST,,
29_00041,SYSTEM,"It appears as though they do not offer cosmetic services. However, their phone number is 209-834-7300.",INFORM,,
29_00041,USER,"Thank you for your help, I will choose this dentist.",SELECT,,
29_00041,SYSTEM,Would you like me to book your appointment?,OFFER_INTENT,,
29_00041,USER,"Yes, that would be nice.",AFFIRM_INTENT,,
29_00041,SYSTEM,What time and date would you like me to book the appointment for?,REQUEST,,
29_00041,USER,Please book it on the 4th of March at six in the evening.,INFORM,,
29_00041,SYSTEM,Please confirm that you would like an appointment with Dr. Pascuala Geraldine T. Ocampo scheduled for 6 pm next Monday.,CONFIRM,,
29_00041,USER,"Actually, could you book it on the 2nd?",INFORM,NEGATE,
29_00041,SYSTEM,You would like your appointment with Dr. Pascuala Geraldine T. Ocampo to be scheduled for tomorrow?,CONFIRM,,
29_00041,USER,"Yes, that sounds good.",AFFIRM,,
29_00041,SYSTEM,I apologize for the inconvenience but the appointment that you requested is currently unavailable. Is there anything else I could do for you?,NOTIFY_FAILURE,REQ_MORE,
29_00041,USER,"Is the dentist available at 5 o""clock in the evening?",INFORM,INFORM_INTENT,
29_00041,SYSTEM,Would you like me to book an appointment with Dr. Pascuala Geraldine T. Ocampo scheduled for tomorrow at 5 pm?,CONFIRM,,
29_00041,USER,"Yes, that would be good.",AFFIRM,,
29_00041,SYSTEM,"I apologize, but I cannot book the appointment that you requested. Is there anything else I could do for you today?",NOTIFY_FAILURE,REQ_MORE,
29_00041,USER,"No, that will be all. Thank you for your help.",NEGATE,THANK_YOU,
29_00041,SYSTEM,No problem! Have a good day.,GOODBYE,,
29_00042,USER,Can you help me find a dentist?,INFORM_INTENT,,
29_00042,SYSTEM,In which city?,REQUEST,,
29_00042,USER,can be in Sunnyvale?,INFORM,,
29_00042,SYSTEM,Is this Amazing Smile Dental in Sunnyvale?,OFFER,,
29_00042,USER,Where they are?,REQUEST,,
29_00042,SYSTEM,In 689 East Remington Drive Ste A.,INFORM,,
29_00042,USER,Yes i can go.,SELECT,,
29_00042,SYSTEM,can you like to book this way?,OFFER_INTENT,,
29_00042,USER,"Yes, on March 10th at afternoon 12:30?",AFFIRM_INTENT,INFORM,
29_00042,SYSTEM,Confirm details whit Amazing Smile Dental appointment 12:30 pm on March 10th.,CONFIRM,,
29_00042,USER,"No, at 16:00 available.",INFORM,NEGATE,
29_00042,SYSTEM,Please confirme details at 4 pm on March 10th.,CONFIRM,,
29_00042,USER,"Yes, can they services, give me number phone?",REQUEST,,AFFIRM
29_00042,SYSTEM,No exist.,NOTIFY_FAILURE,REQ_MORE,
29_00042,USER,I can on 14th of March.,INFORM,INFORM_INTENT,
29_00042,SYSTEM,"Please tell me details about this. Amazing Smile Dental at 4 pm, on March 14th.",CONFIRM,,
29_00042,USER,"Yes, i do.",AFFIRM,,
29_00042,SYSTEM,Sorry is not available.,NOTIFY_FAILURE,REQ_MORE,
29_00042,USER,Thanks very much.,NEGATE,THANK_YOU,
29_00042,SYSTEM,Nice day.,GOODBYE,,
29_00043,USER,I am looking for a dentist,INFORM_INTENT,,
29_00043,SYSTEM,Which city should I search?,REQUEST,,
29_00043,USER,I will look in Milpitas,INFORM,,
29_00043,SYSTEM,I found 6 dentists in Milpitas. Chen Jiangkai is one of them.,OFFER,,INFORM_COUNT
29_00043,USER,"Yes, I will go to him.",SELECT,,
29_00043,SYSTEM,Would you like to make an appointment?,OFFER_INTENT,,
29_00043,USER,Yes please book me.,AFFIRM_INTENT,,
29_00043,SYSTEM,What time would you like to go?,REQUEST,,
29_00043,USER,"At 1 o""clock in the afternoon on March 7th.",INFORM,,
29_00043,SYSTEM,"To confirm your booking, appointment with Chen Jiangkai is at 1 pm next Thursday.",CONFIRM,,
29_00043,USER,Do they offer cosmetic services?,REQUEST,AFFIRM,
29_00043,SYSTEM,"Your dentist appointment is confirmed, but they don't offer cosmetic services.",INFORM,NOTIFY_SUCCESS,
29_00043,USER,Thank you for helping.,THANK_YOU,GOODBYE,
29_00043,SYSTEM,Thank you and have a good day.,GOODBYE,,
29_00044,USER,Please find me a dentist,INFORM_INTENT,,
29_00044,SYSTEM,Okay. In which City?,REQUEST,,
29_00044,USER,Find me one in Danville.,INFORM,,
29_00044,SYSTEM,I found you 5 dentists. How about Dr. Azadeh Jafarnia in Danville?,OFFER,,INFORM_COUNT
29_00044,USER,Please find me someone else. How about in San Jose?,INFORM,REQUEST_ALTS,
29_00044,SYSTEM,In San Jose I found A J Dental Lab,OFFER,,
29_00044,USER,Okay I would like to try that one,SELECT,,
29_00044,SYSTEM,Would you like me to help you booking an appointment?,OFFER_INTENT,,
29_00044,USER,Sure. Please go ahead.,AFFIRM_INTENT,,
29_00044,SYSTEM,What time would you like the appointment to be?,REQUEST,,
29_00044,USER,Is 2:45 PM open?,INFORM,,
29_00044,SYSTEM,What date do you prefer?,REQUEST,,
29_00044,USER,This Saturday would be perfect,INFORM,,
29_00044,SYSTEM,"Okay. So to confirm, You want an appointment with A J Dental Lab, at 2:45 pm tomorrow?",CONFIRM,,
29_00044,USER,No. Next Friday would be better. Anything available afternoon 12?,INFORM,,NEGATE
29_00044,SYSTEM,Okay. So to confirm you want the appointment to be at 12 pm next Friday?,CONFIRM,,
29_00044,USER,Yes that's correct,AFFIRM,,
29_00044,SYSTEM,Great. Your appointment is successfully booked.,NOTIFY_SUCCESS,,
29_00044,USER,Thank you so much,THANK_YOU,,
29_00044,SYSTEM,Anything else I can help you with?,REQ_MORE,,
29_00044,USER,No. That was it for today.,NEGATE,THANK_YOU,
29_00044,SYSTEM,Okay. Have a great day. Thank you,GOODBYE,,
29_00045,USER,What dentists are there in Mountain View? I need to have my teeth looked at.,INFORM,INFORM_INTENT,
29_00045,SYSTEM,There are 10 offices in Mountain View. Would you like to try Apple Dental Practice?,OFFER,,INFORM_COUNT
29_00045,USER,"No, what other options are there?",REQUEST_ALTS,,
29_00045,SYSTEM,Bares William R is another dentist in Mountain View.,OFFER,,
29_00045,USER,Do they do cosmetic work? Like whitening or straightening? WHere are they?,REQUEST,,
29_00045,SYSTEM,They sadly don't offer cosmetic work. The office is at 2500 Hospital Dr # 5D,INFORM,,
29_00045,USER,How about in Dublin?,INFORM,REQUEST_ALTS,
29_00045,SYSTEM,There are 4 offices. Delta Dental of Dublin could be a good option.,OFFER,,INFORM_COUNT
29_00045,USER,Yeah let's try that one.,INFORM_INTENT,SELECT,
29_00045,SYSTEM,And what day would you liked to go in?,REQUEST,,
29_00045,USER,`Can you do the 7th?,INFORM,,
29_00045,SYSTEM,"Maybe, what time?",REQUEST,,
29_00045,USER,Let's go with the 5th instead. Do you have an opening for 16:30?,INFORM,,
29_00045,SYSTEM,Sure do. So we have you booked for a 4:30 pm appointment next Tuesday at Delta Dental. Is that right?,CONFIRM,,
29_00045,USER,"Yeah, oh, and does Delta Dental provide cosmetic work? Can you give me a number to call?",REQUEST,,AFFIRM
29_00045,SYSTEM,No cosmetic work is done at this office either. The main line is 925-230-2183.,INFORM,,NOTIFY_SUCCESS
29_00045,USER,Thank you for the help.,THANK_YOU,,
29_00045,SYSTEM,"No problem, anything else I can do?",REQ_MORE,,
29_00045,USER,No thanks again.,NEGATE,THANK_YOU,
29_00045,SYSTEM,Thank you for using our services. Have a good day.,GOODBYE,,
29_00046,USER,Kindly find me a dentist.,INFORM_INTENT,,
29_00046,SYSTEM,Which city would you like?,REQUEST,,
29_00046,USER,Find something in Fairfield.I am looking for ones that offer cosmetic services.,INFORM,,
29_00046,SYSTEM,What of Marc Bowen in Fairfield?,OFFER,,
29_00046,USER,What is their contact number?,REQUEST,,
29_00046,SYSTEM,The phone number is 707-429-0451.,INFORM,,
29_00046,USER,I would love to go with this one.I must visit a dentist.,INFORM_INTENT,SELECT,
29_00046,SYSTEM,What date would you like us to book on?,REQUEST,,
29_00046,USER,Make it on the 12th.,INFORM,,
29_00046,SYSTEM,What is the best time for you?,REQUEST,,
29_00046,USER,Make the booking on 4th of this month.Anything available at 11 in the morning?,INFORM,,
29_00046,SYSTEM,Please confirm if this is okay:Appointment on next Monday at 11 am with Marc Bowen.,CONFIRM,,
29_00046,USER,That's fine.What is their location?,REQUEST,AFFIRM,
29_00046,SYSTEM,"They are located at 2801 Waterman Boulevard.Congratulations,your appointment is successfully booked.",INFORM,NOTIFY_SUCCESS,
29_00046,USER,Thank you for the help.,THANK_YOU,,
29_00046,SYSTEM,Anything else i can do for you?,REQ_MORE,,
29_00046,USER,At the moment none.Thank you for your help.,NEGATE,THANK_YOU,
29_00046,SYSTEM,Have a good day.Thank you.,GOODBYE,,
29_00047,USER,I have a dental problem and I need to find a dentist.,INFORM_INTENT,,
29_00047,SYSTEM,Do you have a city in mind where to look for one?,REQUEST,,
29_00047,USER,I want it to be in San Jose.,INFORM,,
29_00047,SYSTEM,What do you think about A J Dental Lab situated in San Jose?,OFFER,,
29_00047,USER,Don't want that one. Please look for one in Vallejo.,INFORM,REQUEST_ALTS,
29_00047,SYSTEM,How would you consider the Dr Pucan Dental office which is in Vallejo?,OFFER,,
29_00047,USER,Do they have a phone number?,REQUEST,,
29_00047,SYSTEM,If you want to contact them by phone you can at 707-552-3952.,INFORM,,
29_00047,USER,Is it true that they offer also cosmetic services? Which is the place where they are situated?,REQUEST,,
29_00047,SYSTEM,As far as I can see they do not do cosmetic services. Their location is 2143 Springs Road # 51.,INFORM,,
29_00047,USER,I would prefer to look into someone else.,REQUEST_ALTS,,
29_00047,SYSTEM,What do you think about Dr. Eugene H. Burton Iii which is situated in Vallejo?,OFFER,,
29_00047,USER,That's seems okay for me. I will go to the dentist. I want the appointment to be for 6th of March.,INFORM,INFORM_INTENT,SELECT
29_00047,SYSTEM,Is there any specific time you prefer?,REQUEST,,
29_00047,USER,I will be free from my work on March 12th. Is there an open space at five pm?,INFORM,,
29_00047,SYSTEM,Please review and confirm back to me if the details about the appointment are correct such as that the appointment is with Dr. Eugene H. Burton Iii at 5 pm on March 12th.,CONFIRM,,
29_00047,USER,Negative. Is there any possibility for afternoon 2?,INFORM,NEGATE,
29_00047,SYSTEM,Check the details and see if you can confirm back to me for the appointment being at 2 pm and on March 12th.,CONFIRM,,
29_00047,USER,Seems great but do they do cosmetic services? Do they have a contact number?,REQUEST,,AFFIRM
29_00047,SYSTEM,I apologize but it has been impossible to make the requested appointment reservation. What else can I do to help you with?,NOTIFY_FAILURE,REQ_MORE,
29_00047,USER,Nothing more. I appreciate your help.,NEGATE,THANK_YOU,
29_00047,SYSTEM,Have a good time! Thanks!,GOODBYE,,
29_00048,USER,Please find me a dentist.,INFORM_INTENT,,
29_00048,SYSTEM,In what city would you like me to search for a dentist?,REQUEST,,
29_00048,USER,Please find one in Fremont.,INFORM,,
29_00048,SYSTEM,Would you like to visit Centerville Dental Care located in Fremont?,OFFER,,
29_00048,USER,Where is that office located?,REQUEST,,
29_00048,SYSTEM,You can find them at 37149 Fremont Boulevard.,INFORM,,
29_00048,USER,Please find me another office.,REQUEST_ALTS,,
29_00048,SYSTEM,I've also found Dr. John Y. Park in Fremont.,OFFER,,
29_00048,USER,Where in Fremont are they? And can they do cosmetic services?,REQUEST,,
29_00048,SYSTEM,"No, they don't do cosmetic services. They can be found at 3200 Mowry Avenue # G.",INFORM,,
29_00048,USER,Could you find me another office?,REQUEST_ALTS,,
29_00048,SYSTEM,I've found Dr. Kwang H. Kim in Fremont for you.,OFFER,,
29_00048,USER,That would be perfect. I want to see a dentist. Please book an appointment on March 2nd. Try to find a time at 12 in the afternoon.,INFORM,,INFORM_INTENT
29_00048,SYSTEM,"To confirm, you want an appointment with Dr. Kwang H. Kim at 12 pm tomorrow?",CONFIRM,,
29_00048,USER,"Never mind, please book it on March 11th. Can you see if there's an appointment at 4:30 pm?",INFORM,,NEGATE
29_00048,SYSTEM,Please confirm for me the following: you want an appointment at 4:30 pm on March 11th?,CONFIRM,,
29_00048,USER,"Yes, that's right.",AFFIRM,,
29_00048,SYSTEM,I have successfully booked your appointment.,NOTIFY_SUCCESS,,
29_00048,USER,Thank you so much for your assistance.,THANK_YOU,,
29_00048,SYSTEM,Anything else today?,REQ_MORE,,
29_00048,USER,"Nope, that'll be all. Thanks again!",NEGATE,THANK_YOU,
29_00048,SYSTEM,Have a great day. Thanks!,GOODBYE,,
29_00049,USER,Can you get a dentist for me.,INFORM_INTENT,,
29_00049,SYSTEM,What metropolis should I look in?,REQUEST,,
29_00049,USER,Search something in Hayward.,INFORM,,
29_00049,SYSTEM,I discovered 2 dentists. What about Gateway Plaza Dental Clinic in Hayward?,OFFER,,INFORM_COUNT
29_00049,USER,Get me someone else.,REQUEST_ALTS,,
29_00049,SYSTEM,"What about the Premier Family Dental: Dr. Peter Han, situated in Hayward?",OFFER,,
29_00049,USER,What is their location? Do they offer cosmetic services?,REQUEST,,
29_00049,SYSTEM,"They are situated in 24307 Southland Drive. Sadly, they don't do cosmetic services.",INFORM,,
29_00049,USER,"Yeah, I'll choose this one.",SELECT,,
29_00049,SYSTEM,Do you also want to reserve an appointment?,OFFER_INTENT,,
29_00049,USER,"Definitely, please make the reservation. Reserve it on this Saturday.",AFFIRM_INTENT,INFORM,
29_00049,SYSTEM,When would the best time be for you?,REQUEST,,
29_00049,USER,Do you have one for two pm?,INFORM,,
29_00049,SYSTEM,Please verify the appointment: Reserve an appointment with Premier Family Dental: Dr. Peter Han at 2 pm tomorrow.,CONFIRM,,
29_00049,USER,Yeah. What's their phone number?,REQUEST,AFFIRM,
29_00049,SYSTEM,"Salutations, your dentist appointment was made successfully. The phone number is 510-785-3900",INFORM,NOTIFY_SUCCESS,
29_00049,USER,Thanks for the assistance. That's all.,THANK_YOU,GOODBYE,
29_00049,SYSTEM,Have a pleasant afternoon. Thank you.,GOODBYE,,
29_00050,USER,I'm looking for a dentist in San Jose.,INFORM,INFORM_INTENT,
29_00050,SYSTEM,I found 10 options. How about A J Dental lab. It's in San Jose.,OFFER,,INFORM_COUNT
29_00050,USER,Where is it? Do they have cosmetic services.,REQUEST,,
29_00050,SYSTEM,"Their address is 2664 Berryessa Road # 206, but they don't have cosmetic services.",INFORM,,
29_00050,USER,I'd like to go there.,SELECT,,
29_00050,SYSTEM,Would you like to book an appointment as well?,OFFER_INTENT,,
29_00050,USER,Sure. Anything available at afternoon 2:15 tomorrow?,AFFIRM_INTENT,INFORM,
29_00050,SYSTEM,Please confirm that you would like to book an appointment with A J Dental Lab for 2:15 pm tomorrow.,CONFIRM,,
29_00050,USER,No. Is there anything available at quarter past 11 in the morning?,INFORM,NEGATE,
29_00050,SYSTEM,You would like to book an appointment for 11:15 am tomorrow?,CONFIRM,,
29_00050,USER,Yes. What is their contact number.,REQUEST,AFFIRM,
29_00050,SYSTEM,"Sorry, I couldn't book that appointment. Do you need help with anything else?",NOTIFY_FAILURE,REQ_MORE,
29_00050,USER,"Yes, I want to make a reservation for March 5th.",INFORM,INFORM_INTENT,
29_00050,SYSTEM,Please confirm that you would like to book an appointment with A J Dental Lab at 11:15 am next Tuesday.,CONFIRM,,
29_00050,USER,Yes,AFFIRM,,
29_00050,SYSTEM,"Sorry, I couldn't book that appointment. Do you need help with anything else?",NOTIFY_FAILURE,REQ_MORE,
29_00050,USER,No.Thanks for the help.,NEGATE,THANK_YOU,
29_00050,SYSTEM,Have a good day.,GOODBYE,,
29_00051,USER,"Hey, could you find me a dentist?",INFORM_INTENT,,
29_00051,SYSTEM,In which city would you like the dentist to be in?,REQUEST,,
29_00051,USER,Sunnyvale will be cool.,INFORM,,
29_00051,SYSTEM,How about the Amazing Smile Dental in Sunnyvale?,OFFER,,
29_00051,USER,"Sure, I can go with that one.",SELECT,,
29_00051,SYSTEM,Do you want to schedule an appointment?,OFFER_INTENT,,
29_00051,USER,"That would be great, anything available around 12 pm?",AFFIRM_INTENT,INFORM,
29_00051,SYSTEM,On what date?,REQUEST,,
29_00051,USER,The 10th of March?,INFORM,,
29_00051,SYSTEM,Can you confirm? You would like me to book an appointment at the Amazing Smile Dental office on March 10th at 12 pm?,CONFIRM,,
29_00051,USER,"Yes, that's correct. Can you give me their number?",REQUEST,AFFIRM,
29_00051,SYSTEM,"Ok great. Your appointment has been booked. By the way, their number is 408-739-6520",INFORM,NOTIFY_SUCCESS,
29_00051,USER,Thanks! That will be all for now!,THANK_YOU,GOODBYE,
29_00051,SYSTEM,"No problem, have a good day.",GOODBYE,,
29_00052,USER,Can you locate a dentist for me?,INFORM_INTENT,,
29_00052,SYSTEM,Which city would you like me to search?,REQUEST,,
29_00052,USER,Find me a dentist in Santa Clara.,INFORM,,
29_00052,SYSTEM,I have located 6 dentists. Located in Ahmed Sameena and in Santa Clara.,OFFER,,INFORM_COUNT
29_00052,USER,Which cities are they located? Can they perform cosmetic work?,REQUEST,,
29_00052,SYSTEM,The address is located at 1150 Scott Boulevard # A2. They do not offer cosmetic work.,INFORM,,
29_00052,USER,Please locate someone else.,REQUEST_ALTS,,
29_00052,SYSTEM,I have also found Cathrine Steinborn in Santa Clara,OFFER,,
29_00052,USER,I will select that one. I would like to visit the dentist. Does the dentist have an available appointment at 12:30 pm? Please make the appointment for next Wednesday.,INFORM,,INFORM_INTENT
29_00052,SYSTEM,Please acknowledge the following details: I will book the appointment with Cathrine Steinborn for the time 12:30 pm for next Wednesday.,CONFIRM,,
29_00052,USER,I've changed my mind. Does the dentist have anything avaiable at four pm? Please make the appointment for the 2nd.,INFORM,,NEGATE
29_00052,SYSTEM,Please acknowledge the following details: Your appointment is for 4 pm tomorrow.,CONFIRM,,
29_00052,USER,Yes. What is the dentists phone number? What is the address?,REQUEST,,AFFIRM
29_00052,SYSTEM,"Sorry, the appointment requested was not available. Can I help with anything else?",NOTIFY_FAILURE,REQ_MORE,
29_00052,USER,No. Thanks for the help.,NEGATE,THANK_YOU,
29_00052,SYSTEM,Have a nice day. Thank you.,GOODBYE,,
29_00053,USER,I want to find a salon that is unisex.,INFORM,INFORM_INTENT,
29_00053,SYSTEM,What city should I go to look for it?,REQUEST,,
29_00053,USER,A salon in Concord sounds like a good idea.,INFORM,,
29_00053,SYSTEM,There are 6 salons in Concord. Breds Barbershop looks to be the best option so far.,OFFER,,INFORM_COUNT
29_00053,USER,What is the store's average rating?,REQUEST,,
29_00053,SYSTEM,Their rating is 3.7.,INFORM,,
29_00053,USER,What is their contact number and address?,REQUEST,,
29_00053,SYSTEM,Their number is 925-446-4144 and their address is 4330 Clayton Road suite j.,INFORM,,
29_00053,USER,Could you find me a different one?,REQUEST_ALTS,,
29_00053,SYSTEM,There is another in Concord called Empire Barbershop.,OFFER,,
29_00053,USER,Another one please.,REQUEST_ALTS,,
29_00053,SYSTEM,First Class Barber Shop is another nice salon. It it also located in Concord.,OFFER,,
29_00053,USER,That place sounds good. I'll make an appointment for that place at 18:30.,INFORM,INFORM_INTENT,SELECT
29_00053,SYSTEM,What date will your appointment be?,REQUEST,,
29_00053,USER,I will visit the place on March 13th.,INFORM,,
29_00053,SYSTEM,"Please confirm that the name of the place is First Class Barber Shop, the appointment is at 6:30 pm, and the appointment will take place on March 13th.",CONFIRM,,
29_00053,USER,I confirm.,AFFIRM,,
29_00053,SYSTEM,Your appointment is confirmed and ready.,NOTIFY_SUCCESS,,
29_00053,USER,Thank you very much. That is all I need for today.,THANK_YOU,GOODBYE,
29_00053,SYSTEM,Have a good day!,GOODBYE,,
29_00054,USER,"I'm looking for a hair salon, can you help me with that?",INFORM_INTENT,,
29_00054,SYSTEM,What city would you like the salon to be in?,REQUEST,,
29_00054,USER,I'd like a place in San Francisco.,INFORM,,
29_00054,SYSTEM,I've found 10 possible options for you: 1512 Barber Shop on 1532 20th St in San Francisco might be suitable.,OFFER,,INFORM_COUNT
29_00054,USER,"What are the reviews - how is it rated, is it unisex?",REQUEST,,
29_00054,SYSTEM,1512 Barber Shop is a unisex salon with a 4.8 rating.,INFORM,,
29_00054,USER,"That sounds good, yeah.",SELECT,,
29_00054,SYSTEM,Would you like to book an appointment?,OFFER_INTENT,,
29_00054,USER,"Yes, please.",AFFIRM_INTENT,,
29_00054,SYSTEM,What are the details for you appointment? What time and date would you like to book it for?,REQUEST,,
29_00054,USER,I think I'd like an appointment at 3:30 in the afternoon on the 7th of this month.,INFORM,,
29_00054,SYSTEM,"To review: You'd like to book an appointment at 3:30 pm, next Thursday, at 1512 Barber Shop.",CONFIRM,,
29_00054,USER,"Actually, can you change the appointment to 3 pm instead? I'm going out that night and I'd like a little more time to get home and change.",INFORM,NEGATE,
29_00054,SYSTEM,"To review: You'd like to book an appointment at 3 pm, next Thursday, at 1512 Barber Shop - does that sound right?",CONFIRM,,
29_00054,USER,"You know what, actually let's change the date too - I'm looking at my calendar and I don't think next Thursday will work. Change it to the 14th of this month, please.",INFORM,NEGATE,
29_00054,SYSTEM,"To review: You'd like to book an appointment at 3:30 pm, at 1512 Barber shop, on March 14th.",CONFIRM,,
29_00054,USER,"That sounds good, yeah.",AFFIRM,,
29_00054,SYSTEM,Your appointment has been booked.,NOTIFY_SUCCESS,,
29_00054,USER,"That'll be all I need today, thank you.",THANK_YOU,GOODBYE,
29_00054,SYSTEM,Have a great day.,GOODBYE,,
29_00055,USER,Can you find me a unisex salon in Vacaville,INFORM,,INFORM_INTENT
29_00055,SYSTEM,The best salon in vacaville is primo's Barbershop.,OFFER,,
29_00055,USER,good.Please book an appointment at a salon.,INFORM_INTENT,SELECT,
29_00055,SYSTEM,Please let me know the date and time on which the appointment to be made?,REQUEST,,
29_00055,USER,Please book on 3rd of march at 12:00,INFORM,,
29_00055,SYSTEM,"Please check and confirm the details. salon name is Primo's barbershop, time of appointment is 12 pm and day after tomorrow is appointment date.",CONFIRM,,
29_00055,USER,yes correct. what is the rating and contact number of salon?,REQUEST,,AFFIRM
29_00055,SYSTEM,Appointment on the date is confirmed. the phone number of salon is 707-689-5136 and its rating is 4.5.,INFORM,,NOTIFY_SUCCESS
29_00055,USER,Thanks for your help.,THANK_YOU,GOODBYE,
29_00055,SYSTEM,great day,GOODBYE,,
29_00056,USER,"I wanna change my hair style, help me find a salon",INFORM_INTENT,,
29_00056,SYSTEM,Where are you trying to get your hair done?,REQUEST,,
29_00056,USER,Let's find a place in Oakland,INFORM,,
29_00056,SYSTEM,"How about 17 Jewels Salon in Oakland, I hear it's nice",OFFER,,
29_00056,USER,"Umm...Doesn't sound like something I'd like, find me something else",REQUEST_ALTS,,
29_00056,SYSTEM,What about this other Oakland salon called Benny Adem Grooming Parlor,OFFER,,
29_00056,USER,What's their contact info and address?,REQUEST,,
29_00056,SYSTEM,You can reach them at 510-227-4268 and they're at 408 14th Street,INFORM,,
29_00056,USER,Actually find me something else,REQUEST_ALTS,,
29_00056,SYSTEM,Bibo Salon in Oakland has great reviews,OFFER,,
29_00056,USER,Yes that' perfect,SELECT,,
29_00056,SYSTEM,Shall I book an appointment for you then?,OFFER_INTENT,,
29_00056,USER,"Yeah I want it done ASAP, maybe later today if possible?",AFFIRM_INTENT,INFORM,
29_00056,SYSTEM,What time then?,REQUEST,,
29_00056,USER,afternoon 12:30 would be great,INFORM,,
29_00056,SYSTEM,Confirming your 12:30 pm Bibo Salon appointment today,CONFIRM,,
29_00056,USER,Yes that's correct,AFFIRM,,
29_00056,SYSTEM,Ok glad I was able to book it,NOTIFY_SUCCESS,,
29_00056,USER,Thanks that's it for now,THANK_YOU,GOODBYE,
29_00056,SYSTEM,Can't wait to see your new hair!,GOODBYE,,
29_00057,USER,I want to find a salon.,INFORM_INTENT,,
29_00057,SYSTEM,In what city?,REQUEST,,
29_00057,USER,I want one in Fremont.,INFORM,,
29_00057,SYSTEM,3Sixty Salon And Boutique is a salon in Fremont.,OFFER,,
29_00057,USER,I actually want a unisex salon in Corte Madera.,INFORM,,REQUEST_ALTS
29_00057,SYSTEM,Colour Bar is a salon in Corte Madera.,OFFER,,
29_00057,USER,Yeah that's good. I want an appointment at this salon.,INFORM_INTENT,SELECT,
29_00057,SYSTEM,What time and date do you want the appointment to be?,REQUEST,,
29_00057,USER,I want the appointment to be at five pm on March 11th.,INFORM,,
29_00057,SYSTEM,"Confirm the following details please: The appointment is on March 11th at 5 pm, and the stylist's name is Colour Bar.",CONFIRM,,
29_00057,USER,That works.,AFFIRM,,
29_00057,SYSTEM,Your appointment is confirmed.,NOTIFY_SUCCESS,,
29_00057,USER,"Thanks, that's all I need.",THANK_YOU,GOODBYE,
29_00057,SYSTEM,Have a good day.,GOODBYE,,
29_00058,USER,Help me find a salon in San Francisco,INFORM,INFORM_INTENT,
29_00058,SYSTEM,There are 10 there in San Francisco. How about 1512 Barber Shop,OFFER,,INFORM_COUNT
29_00058,USER,Find me something else,REQUEST_ALTS,,
29_00058,SYSTEM,In San Francisco there's 20Th Salon And Barber,OFFER,,
29_00058,USER,What's their rating and location?,REQUEST,,
29_00058,SYSTEM,They are rated 4.5 and are at 2737 20th Street,INFORM,,
29_00058,USER,OK book an appointment there,INFORM_INTENT,SELECT,
29_00058,SYSTEM,What date and time?,REQUEST,,
29_00058,USER,Tuesday next week at 12:00,INFORM,,
29_00058,SYSTEM,Ok so a 12 pm appointment at 20Th Salon and Barber next Tuesday yes?,CONFIRM,,
29_00058,USER,Yes that's right,AFFIRM,,
29_00058,SYSTEM,Confirming your appointment,NOTIFY_SUCCESS,,
29_00058,USER,That's all thanks,THANK_YOU,GOODBYE,
29_00058,SYSTEM,Have a good day,GOODBYE,,
29_00059,USER,I need to find a salon.,INFORM_INTENT,,
